date,star,text,compound,neutral,positive,negative,subjectivity
2015-06-07,2.0,"I ordered the grass fed hamburger that came with cheese, grilled onions and lettuce, i think it was $14.  I asked for no cheese (allergic), no grilled onions.  Asked if it could be just lettuce and tomato.  Waiter said they don't serve tomatoes on the hamburger.  Hmmm, really?  So what's  left?   Told him, next time I will bring my own sliced tomato.    Lettuce only.   So I added avocado for $2 more.  It came with oily, soggy, limp, flavorless, disappointing fries.  Really?     Didn't  anyone go to culinary french fry school in this place?  fries were a D-, not an F because they showed up and were served!  Disappointing fries!   Can't say it is a place I would go back anytime soon, Tragic!",-0.9396,0.873,0.0,0.127,0.39642857142857146
2015-06-04,5.0,"Coincidently walked in at the same time as the owners were treating his parents. Down to earth and very humble people. Service was prompt and friendly. Kitchen smells made us even more hungry. Waiter explained the menu in complete detail and gave us plenty of time to decide. Delicous food, great atmosphere, and glad we came by.",0.8834,0.84,0.16,0.0,0.5104861111111112
2015-06-03,5.0,"Best meat in Chicago! Bold statement I know but this place is a true hidden gem! The staff are very friendly, not too overbearing. They have amazing cocktail selections and a great ambiance. It's a pretty chill place but the food will blow your mind! I have ordered the pork chops with a side of mushrooms twice now and am still dreaming about how delicious it was. The pork chops were done to perfection, flavorful and great presentation to boot. Check out the owners story on the back of their menu; pretty cool personal touch to what the restaurant is about....grilling meat.",0.9953,0.618,0.382,0.0,0.6392857142857143
2015-06-01,1.0,"How does this place get '$$'? They have three steaks, one for $26, but the other two for $39. The steak had no flavor what so ever. Might as well go to one of the more popular places and pay a little more for a much better tasting steak. It cost me $150 for a dinner for two. Biggest waste of money ever.",0.604,0.738,0.151,0.111,0.46785714285714286
2015-05-30,4.0,"I walked in from the rain today and immediately felt warm and cozy.  I love the colors; moody soft grays, dark blues, wood tones, and pops of orange, all lit by soft overhead lighting.  So inviting.  I sat on the soft banquet by the window and watched my fellow humans dodge raindrops.  I came here as part of Yelp's Burger Week.  Unite was the only featured restaurant that offered a veggie burger.  As a veggie burger aficionado I have to say this one was tops!  It truly is a veggie burger and not a grain or soy burger like so many others.  There were bits of mushrooms, corn and carrots along with black beans.  The burger was thick and hearty with good texture, and was served on a perfectly toasted brioche.  A spicy aioli was served on the side.  There was also a simple side salad of arugula and cherry tomatoes dressed with a light vinaigrette.  My amazing server also let me know that mimosas were half price.  The delicious mimosa had a nice kick to it and included house-made orange bitters.  The service was excellent, the food was delicious, and the surroundings were inviting.  I'm looking forward to returning and trying other menu items.",0.9913,0.781,0.201,0.017,0.6321428571428571
2015-05-20,2.0,"The food here is edible and the service is average. two stars for the Chicago Style Rib.  The meat is very tough. I originally wanted to order the FOTB rib (fall off the bone)but they didn't have it so the server suggested that I order the Chicago style rib instead but he did not tell me how tough the meat would be comparing to the fotb ribs.  I had to eat with my hand because it was impossible to eat with knife and folk.  Luckily I am not on a first date, because if I was on the first date I probably had to take it home. (can't be making a mess on the first date, right?)  If the waiter had told me that the Chicago style rib is tough I would have ordered something else. I also ordered the lamb meat ball which taste ok. desert menu didn't have anything that makes me want to order. so I skipped the desert.",0.8977,0.87,0.095,0.035,0.5856150793650793
2015-05-18,5.0,"My friend and I shared the hanger steak and lobster mac & cheese. Both were great but the attentive service at the bar was even better. Our bartender, Carlos, really knew his drinks and had great recommendations. My friend asked if a signature drink could be made with vodka and he said 'no' since it would really change the flavor profile. We appreciated his honesty and ability to confidently share his suggestions. The steak was perfectly cooked and the lobster mac & cheese was decadent. We left with a handful of suggestions for local bars and they also lived up to his recommendations. Great place!",0.9947,0.633,0.367,0.0,0.4986111111111111
2015-05-13,3.0,"I wasn't super hungry when I came here so I think I should give it another try. I ordered the rose noir wine special - the first glass was a short pour, but they made up for it on the second. As a table, we shared the lobster mac and cheese which I thought was awesome. I would order it all for myself next time! For my main, I actually just had another snack, the steak tartare. Again, since I wasn't too hungry, I didn't care for anything heavy like a steak or a burger. It was fine, but I wasn't wow'd.",0.8963,0.783,0.162,0.055,0.48113553113553115
2015-05-12,5.0,"We aren't mothers but we still want good food on Sunday.  And so we ever for a stroll down Chicago to see what we could find.  Brunch is always a good time, so we stopped into Unite Urban an",0.7493,0.735,0.204,0.062,0.3722222222222223
2015-05-09,4.0,The decor and vibe is great. Menu has something for everyone. The chicken was perfectly cooked. The ramp side dish was perfect. The fingerling potatoes so-so and came after rest of the meal. The service was spot on- the dish I ordered had goat cheese even though it didn't say so on the menu and the server did not think twice before replacing it with something else. Thumbs up to that kind of service. I'll go back for sure.,0.936,0.838,0.162,0.0,0.7841269841269841
2015-05-09,5.0,"I couldn't of had a better experience than the one I had last night. The food was great, the service was great and we will be going back again. Be sure to try the lobster mac n cheese. Save room for dessert!",0.9116,0.668,0.283,0.049,0.4925925925925925
2015-05-06,5.0,I loved everything our table ordered. The food was excellent and the drink I had was strong. The service was superb as well. I cannot wait to return.,0.9524,0.539,0.461,0.0,0.8833333333333333
2015-05-04,5.0,"Went with a group of fellas fir a bachelor's last night out. The service staff was very friendly and hospitable. Aiight had gotten there early, before anybody else, and was felt welcomed while I waited at the bar. Every subsequent guest, wether they were with my group or not was greeted warmly. I liked that level of consistency.  The food was delicious! portions were hearty and by no means skimpy. I went with the lamb meatballs as an appetizer.  Others in my group git the fries. One other got the lobster mac and cheese.  Everybody shared because the food tasted great. The main course was also wonderful. The porkchops, I must say, were the best!!!! Tender, juicy and seasoned perfectly. They give you two pieces, as well, so in case you can't finish, you can take some home.",0.9771,0.768,0.192,0.04,0.5288461538461539
2015-04-22,5.0,"I came in last weekend for a reunion with some college friends. What a cute neighborhood spot!  The night started out right with a warm welcome and a hand crafted cocktail by bartender Carlos- a unique creation with gin and Campari.  For dinner, we started with the lamb meatballs and glazed chicken wings- both recommendations by our server- delicious!  The sauce was tangy on the wings and they had the perfect amount of spice. For dinner I ordered the hanger steak- medium rare and marinated and prepared to perfection. My friends ordered the whitefish and Amish chicken, also a hit.  The beer and spirits list was vast and our server was able to guide us on good pairings.  And wow the sides- the baked cauliflower standing out as the best. We didn't have room for dessert but ordered the peanut butter mousse cake out of curiosity- it was eating for taste alone at this point... And wow! So glad we did! If you haven't checked out this neighborhood gem, make it your next night out.  I will definitely be back!",0.9877,0.771,0.217,0.013,0.7213690476190477
2015-04-20,3.0,"Second time there once for dinner and once for brunch. I want to like this place more than I do.  Service at dinner was great...our brunch experience was not good service was really subpar. Food is decent, but I think I am done with this place, I hope they get better cuz its a nice local spot.",0.9117,0.738,0.234,0.028,0.43333333333333335
2015-04-18,5.0,"Since dining at Unite Urban Grill my first time, it has immediately become one of my favorite restaurants in the city. My first experience there we did not make reservations, so we ate and drank cocktails at the bar. Since then I make sure to have reservations, because they can get busy.  My absolute favorites are the Hanger Steak and the Bone-In Berkshire Pork Chops! I've tried all three steaks they have and the hanger steak is the clear winner. The pork chops are some of the best I have ever had. Most places including myself cannot cook pork chops well. Most of the time they are overcooked or dry. The pork chops at Unite are spot on, full of flavor, and delicious.  My favorite side is the Baked Cauliflower. AH-Mazing! I also enjoy the roasted fingerling potatoes and hand cut fries.  So far, the only app I have tried is the lamb meatballs and they are great.  Each time I visit Unite, the staff is very welcoming and attentive. Every time I visit Unite the manager comes by to make sure my meal and experience is to my satisfaction. Even the valet guy is super sweet. The best thing about Unite is the price you pay for the quality of food you get. It can't be beat.",0.995,0.757,0.229,0.014,0.6217777777777779
2015-04-13,3.0,"I was so looking forward to going here but I ended up pretty underwhelmed.  We had a group of five that was seated at two tables combined. After we were seated, a larger group came in and our waiter asked if we could move tables to a smaller table so they could have the bigger table. This is 100% not an issue we obliged. He offered us free cinnamon rolls for moving which was very nice of him. The cinnamon rolls were meh though. Kind of bland.  But they were free. I just wouldn't ever pay for them. The restaurant is set up nicely and I really loved that they took reservations for brunch because it seems like whenever I want to go to brunch in this city, I'm quoted an hour wait.  Things I liked: my boyfriend's fried french toast. He loved it too. I got the quiche of the day which was delicious. My friend's lobster benedict was amazing but not $20 amazing. I guess that's just what happens when you order lobster anything.  I also liked the arugula salad that came with my quiche. it was all thinly coated in a super delicious vinaigrette. Things I didn't like: the thick cut bacon is nowhere near thick cut. Maybe I expected too much. Au Cheval's bacon is easily a centimeter thick. The thick cut bacon at Unite Urban Grill was just ..thicker bacon. Like I could buy it from the grocery store and there's a decent chance a few slices of bacon are about as thick as what they served us. So then it was just overpriced bacon.  In general, I thought most of the meal was a bit over priced. The mimosas were $9. They were really strong which is nice but they weren't bottomless so at that point $9 is kind of steep for one small mimosa. The bloody mary's with their never ending garnishes were approximately the same price so they seemed like more bang for your buck. I realize bottomless mimosas would  never be as cheap as $9 but one should also not be $9.  The food also took a bit longer than expected but our server and a manager were apologetic and they was indeed a rush about when we came in.  It was a tasty meal but I probably wouldn't come back.",0.9982,0.753,0.218,0.03,0.621376811594203
2015-04-09,4.0,The owner was very quick to respond to my previous review which I appreciate. Everyone is entitled to a bad day. It is nice to see an owner who cares about his customers and the experience they have and who understands that reviews are an opportunity for improvement....I will definitely give this place another chance.,0.9118,0.676,0.272,0.053,0.5966666666666667
2015-04-05,5.0,Solid brunch. They opened the front windows and it changed the whole dynamic.  We were a group of 10 so I got to try a lot if food. The Ruben was my favorite. Don't miss it.,0.768,0.77,0.23,0.0,0.41666666666666663
2015-04-01,2.0,The ribeye steak meat quality was below average. I had it cooked medium and despite it being cooked fine Ithaca chewy parts and did not taste like good quality. The Brussels sprouts with pesto had no salt. This place has some good dishes but is lacking the finishing touch.  The wings were quite good but it's definitely not in Chicago's top steakhouses like it claims. Spent over 100 for two of us with mediocre meat.,-0.7409,0.772,0.059,0.169,0.5333333333333334
2015-03-14,4.0,"Came here to celebrate myself getting a new job with my boyfriend. We had talked about coming in the past because its right down the street from me. The service was great.  We went on a Friday evening, though I think we got lucky because we didn't have to wait for a table. The steaks were really good. They aren't the best I've ever had but for the price they were great. Like a typical steak house you need to order your side dishes separate. They fries and the other potatoes with the caramelized onions and bacon were really good too.",0.9633,0.784,0.197,0.019,0.5197901635401636
2015-03-08,5.0,"This is a great steakhouse in a non-traditional way.  The atmosphere is super modern, warm and inviting.  The service was perfect.  The ownership makes time for every guest at every table and was engaging and informational.  The lamb meatballs are a must eat.  All of the sides were really well done and yummy.  The steaks, both the NY Strip and the Ribeye were as good as predicted.",0.9776,0.671,0.329,0.0,0.6020833333333333
2015-03-06,5.0,"Unite, you won a little piece of my heart. My partner and I can never agree on food, only one of us is ever actually satisfied after a meal - until tonight. Dinner started on a good note, I ordered a glass of the Garnacha. After hearing what I was in the mood for, our server steered me towards a French blend instead and it was fantastic, at that point he had my trust. We both had the hanger steak and it was a perfect medium rare, the flavors were wonderful but not overwhelming.The cauliflower was delicious and we both fought for the last bites. The potatoes were under seasoned and I didn't want to waste precious space in my stomach on them - I think the chef was too busy making everything else perfectly. Beyond full, I just had to see if the dessert was a magical as the rest of our dinner.Our server, a bearded food fairy suggested we just go for it! The apple hand pie was divine and i ate the last bites despite being stuffed. Excellent service, EXCELLENT. Complemented by phenomenal food and management that is present.",0.9918,0.724,0.23,0.045,0.636231884057971
2015-02-28,4.0,"Great food and  great service. We came in for a 6 o'clock reservation on a Friday night.  It must have been the end of family dinner because our table was flanked by toddlers. We ordered the cheese plate, hangar steak, pork chops, brussel sprouts, and farro salad. All were excellent, with the sprouts the weakest of the bunch. Our server, Danny, was wonderful, attentive and  knowledgeable. Will definitely be back.",0.9432,0.738,0.222,0.04,0.7333333333333334
2015-02-25,4.0,Came for a family dinner/ birthday celebration. Loved the decor. The Service was great and the food was good. The drinks were clever with fun names and good. A bit pricey but fun for a celebration. I would go again.,0.9382,0.624,0.376,0.0,0.5690476190476191
2015-02-22,3.0,"Well..went here for brunch for my birthday on a Sunday morning. We had a reservation at 1, and bunch ends at 2, which I think is a fair time to show up to a brunch in the city. We came here at 1, and had to wait about fifteen minutes, which, fine, whatever. So we get our table, and start ordering...only to find out that they are out of the french toast and Madame croquet..okay...so we order pancakes instead. Five minutes later we find out that they are out of pancakes too. How a functioning restaurant is out of something that consists of flour, eggs, water, and sugar is beyond me? So we are annoyed and frustrated but we have already ordered drinks so we are staying. Our food comes 35 minutes later...but with french fries instead of breakfast potatoes. No one told us they were out of breakfast potatoes..we should have just assumed, I guess.  Anyways, the food was average. I ordered the omelet and it was soggy and gross. I sent it back. They fixed it. Meh. The manager was super apologetic and professional and comped everything and gave us free dessert, which was awesome...but yea. I think we're going to Hollywood Grill next time. They'll have pancakes.",0.5451,0.888,0.06,0.053,0.30444444444444446
2015-02-21,4.0,Pretty healthy and quality food. Great options for the vegetarians in my group. And the service was especially friendly and caring.,0.9513,0.485,0.515,0.0,0.8125
2015-02-17,4.0,"My wife and I and a few friends decided to check this place out for Valentines Day and I must say no one in our party was disappointed. We had a 7:30 reservation and we were seated within 5 minutes of arriving. The decor is hip and chic. All though the seating is pretty close, it wasn't elbow to elbow. I had the lobster special which cost only $40. It wasn't a very huge lobster but for the price and taste it was well worth the money. After tasting my wife's ribeye steak, I wanted to order one as well. The quality and taste of their steak rivals any of those overpriced steakhouses downtown. We had the lamb meatballs and flatbread for an appetizer which were both very good. The only reason that I didn't give this restaurant 5 stars is because the side dishes that we had weren't that great. I almost forgot, you must try a beer called mummy dust that they serve on tap.",0.8205,0.826,0.118,0.056,0.7051428571428572
2015-02-15,4.0,"Went here for someone's birthday .. Can't remember who... my mom maybe? Unite had it all down pat.  Atmosphere, food, service, drinks (wow).  I had this spicy jalapeno drink that blew my mind. I don't recall what I ordered... but I remember liking it a lot.  This place has a lot going for it, but competition is fierce... I think a little more creativity on the menu could be a good thing - not with every dish, mind you - but maybe throw some herbs or more goofy sauces in here and there.",0.8962,0.88,0.12,0.0,0.6269841269841271
2015-02-02,5.0,"First time there, not my last!  Fantastic service, food, & decor.  It's a treasure a short walk from my place, but I've missed it for five years!  I'll be going back as a regular.  Prices reasonable, varied menu should make everyone happy.",0.538,0.739,0.157,0.104,0.4096153846153846
2015-01-31,4.0,"This is a really cool spot with an interesting vibe. There are lounge-ish areas with tables so you can eat, typical tables, as well as a pub style high top section.  My food was delicious -- I had the burger as well as the brussel sprouts and cauliflower. Our waiter was incredibly helpful and because our food took a little while to come out, he proactively told us we would get dessert on the house.  This was really phenomenal service, great ambience, as well as really good food.",0.977,0.727,0.273,0.0,0.6309090909090909
2015-01-28,5.0,"This place is absolutely amazing. I've lived in the neighborhood for years but never came here because the name led me to believe that it was a burger joint/sports bar type thing. How wrong I was. The ambience of the place is elegant, modern and relaxed. The service has always been friendly, unpretentious and wonderful. I'm a vegetarian and have ordered multiple sides as my meal consistently. Tonight I split the farro, cauliflower and brussels sprouts side with my friend and we were completely full. The cauliflower is like mac n cheese done cauliflower style and- somehow- it works. The brussels sprouts have a pistachio pesto- delicious. And the farro-- well, I'd never had farro before, but this was jaw droppingly fresh and delicious. Come here soon!",0.9916,0.694,0.279,0.026,0.6583333333333333
2015-01-27,4.0,"I ended up coming here again after Joe, the owner, offered a second meal on them since I had such a terrible experience the first time around. I opted to come for dinner this time with my other sister. This is what we ordered: -Lamb Meatballs: This was pretty good. The sauce that it came in was very flavorful. I did find the meatballs a bit tough but overall it was pretty good! -Bolognese: This one definitely could have used a bit more salt... -Rib Eye: This was really really good! I loved it. It was cooked perfectly! -Spaghetti Squash: Meh, but I think I'm just not a fan of spaghetti squash to be honest so this was not their fault! My sister also ordered a sour beer originally but the server offered to let her try a sample since it was a love or hate beer. I thought that was incredibly generous of him and it was fantastic service. She ended up hating it so that worked out well! Overall, I really enjoyed my second experience here. I thought that the service was phenomenal, some of the best service that i have received in the city. The server was incredibly attentive and nice but definitely not overbearing at all!",0.9966,0.646,0.29,0.064,0.5903645833333333
2015-01-24,5.0,Hanger steak was incredible. Great taste and cooked perfectly.  Baked cauliflower was my favorite thing we had. Life changing and would go back just for that. The service was awesome and the owner Joe kept coming back to check in with us. He was so friendly and attentive. He even said if we didn't like our food just let him know and no charge he would change to whatever else we wanted. There was no need for that. Great night out with friends. We will be back for sure.,0.9764,0.687,0.256,0.057,0.6407407407407408
2015-01-23,5.0,"I was really blown away when I visited this spot about a couple months ago. I went in with a friend, she had a GC and we ordered the Lamb Meatballs to start as a suggestion from the waiter, SO glad we did...they were fantastic! I ordered the Shrimp Linguine and I cannot even begin to tell you how fantastic it was. What topped the evening off is the adorable owners walk around and greet almost all guests and I had the pleasure to meet Joe who slipped me a few ingredients that are in the linguine so that I could attempt (poorly) to recreate it in the off season.  The vibe of this place is just what can be expected in West Town, and so worth it. The owner's story is great and it shows through the amazing food.",0.9875,0.775,0.225,0.0,0.6227272727272727
2015-01-17,4.0,"We really enjoyed this place both times we went.  It is great for both vegetarian and meat eaters.  Their sides are very tasty and we enjoy the many healthy options.  The atmosphere is great and have always had wonderful service.  Living in the neighborhood, I hope this place stays!",0.9766,0.625,0.375,0.0,0.625
2015-01-08,5.0,"Unite is a fantastic addition to the Noble Square / West Town neighborhood.  I've been here three times, and each has been a fine dining experience at affordable prices.  Everything I've tried has been extremely delicious -- I particularly recommend the hangar steak, salmon, watermelon salad (when in season), crunch salad, Brussels sprouts, and cauliflower.  The drink menu is quite diverse and includes tasty local beers and unique 'neighborhood' cocktails.  Joe is an extremely gracious host, and the staff/atmosphere is very inviting.  I look forward to returning again soon and trying more of the menu!",0.9681,0.791,0.209,0.0,0.6433333333333333
