date,star,text,compound,neutral,positive,negative,subjectivity
2016-04-24,2.0,"I felt the prices were extremely high for the value. Ok portions, food was ALRIGHT- but I was put off by the prices for what was received. Interior atmosphere was great, staff was friendly, but I cannot justify the just ok-ness of the overall.",0.9339,0.704,0.296,0.0,0.458
2016-03-26,3.0,"I guess this is a null review as Unite has closed but I myself will not miss it. The food was okay. My one experience there had a steak that was ordered medium-rare and brought in almost bloody rare. They took it back to ""cook"" some more, and pretty much returned the same steak. Meh.",0.5958,0.772,0.147,0.082,0.4694444444444444
2016-03-13,3.0,"I live right in the neighborhood so I was fairly excited to try Unite. This rating is based on my brunch experience. This particular Saturday they seemed to be severely understaffed. Our waitress would visit our table every 20 minutes. After being seated, it took 20 minutes to receive our drinks. It then took an additional 20 minutes to come back after dropping off drinks to have her take our order. After taking our order, it took well over 45 minutes to receive a very simple dish (The Classic). I understand restaurants get busy, but rather than communicate with us and acknowledge that there was a severe delay due to lack of staff, she clearly avoided our table. The food was fine. It was very basic and portion size was very small. I wouldn't personally come here again after this experience.",-0.7406,0.843,0.061,0.096,0.3779166666666666
2016-03-05,2.0,"Okay so we normally would never give a restaurant bad-ish review like this. We know that it is a hard business and people try their best for the most part.  But, it was very slow to get our food. Owner was responsive right when I reviewed this, the food was decent, so I'll give them that they tried and was maybe just a bad night.",0.7351,0.775,0.156,0.069,0.5423015873015873
2016-03-04,5.0,"Love the place, the food and the people. Need I say more?  OK, I will, Joe, the owner is a wonderful host.",0.9027,0.59,0.41,0.0,0.65
2016-03-02,5.0,What a great experience! This was my first time trying the dinner here and it was fantastic. Reservations were seamless and the staff was super friendly. All of the food tasted so flavorful and was unique! Calamari and a flatbread for appetizers was perfect for 6 people. My husband got the burger and was very impressed. The lobster mac n cheese was another must try! The cocktail list was impressive and it was just an overfull fun setting! Will definitely be back to try the brunch soon!,0.9865,0.696,0.304,0.0,0.6208333333333333
2016-02-29,5.0,"I don't regularly give out 5 stars, but this place earned it. The food was great, I am still thinking about the Hangar Steak I ate on Friday & the wings were incredible. Great atmosphere & staff. Definitely will go back.",0.9505,0.683,0.317,0.0,0.49615384615384617
2016-02-21,5.0,"Came in for dinner this past Saturday evening and our expectations were not only met- but pleasantly exceeded. The steak was beyond memorable, I'm talking melt in your mouth, makes you crave it for days after good. Drinks were also on point, and consistent- nothing compliments an amazing steak like a top notch Martini. Combine that with a cozy and inviting interior- romantic if you will. It made me and the boo feel like we weren't just watching Mad Men on Netflix, but instead doing it up ourselves- Don Draper style. Alas I can't afford to dine like this every night- but the entire experience, drinks and all was still affordable enough that it makes for the perfect weekend retreat. My only fear now is that this place will blow up and it'll be impossible to get a table in 6 months. I'll definitely be back. Cheers.",0.9847,0.68,0.244,0.076,0.7134259259259259
2016-02-21,2.0,"My experience was pretty mixed, but the restaurant followed up with me right away after this review which I truly appreciated, and I definitely plan to give it another try.  Turns out it was all around a bad night and my visit may have just been a fluke during a series of unfortunate events. So here it is:  The drinks and sides were good, but the entrees and service were spotty. I made a reservation for my boyfriend's birthday and ordered birthday dessert in advance when I confirmed my reservation. After receiving a phone call, and text, and email to confirm my reservation, I felt like this was going to be an amazing  experience. When we arrived, we were happy  with the ambiance; however, it wasn't crowded yet at all and we definitely could have skipped the reservation with all the follow up messages.  I ordered the Amish chicken, and my boyfriend ordered the ribs. My chicken was pretty dry, even the dark meat. The ribs were fine but the sauce wasn't great. The fries and sweet potatoes that we ordered were everything, as were the drinks. The hot toddy was served in a proper tea cup on a saucer.  The service was not amazing. Once we were seated we waited about 5 minutes for water and about 10 before our server greeted us. She did check on us during the meal, which was nice. When we were done with done with our meal, the waitress offered us dessert menus, after mentioning that they were out of ice cream, so clearly no one told her that it was my boyfriend's birthday. They only had 4 dessert options 2 of which  kinda required ice cream and  it was only 8:00.... At that point, My only option was to ruin the surprise for my boyfriend with wack dessert options , and we just decided to get dessert elsewhere. I wonder why they tried to confirm our reservation so many times if the details didn't really matter to them... The prices weren't bad if the food had been good. I spent $100 before tip for two entrees, two sides, and a drink for each of us.  If you're looking for great ambiance and a nice cocktail, this is the place to be.",0.9902,0.763,0.163,0.074,0.6829251700680272
2016-02-14,5.0,"Solid eats with friendly staff. How can you go wrong with bottomless mimosas for $14? You can't. Even if the food isn't gourmet, the value outweighs the ingredients (which aren't too shabby)! The friend French toast is moist, steak and eggs fantastic, omelette is a solid choice if you'd like something lighter. Also, get a side order cinnamon roll, om nom.",0.8707,0.707,0.222,0.071,0.4166666666666667
2016-02-11,4.0,"Recently visited this establishment for dinner in my old neighborhood. Heard great things about it so we had to give it a try. Made reservations online with no problem. It was a Friday night, so the parking around there was limited but not bad. We were seated as soon as we confirmed our reservation. FYI.... if you want a more intimate setting for 2-4 people, ask for the high tables towards the back, or the booths in the front. They seemed more far apart than the seating across from the bar. The place itself is very modern, yet intimate. Love the décor lighting.  To start off, we ordered an appetizer, I believe we ordered calamari. Very good! Their selection of craft beers was very good. Our server knew her beers, and suggested the right one just by telling her what I was in the mood for. My wife had her dirty martini. She said it was right on point. For our main entrees, she ordered the skirt steak and I went with the Hanger steak. For sides we went with the lobster mac & cheese and the glazed sweet potatoes. I have to say, both our steaks were cooked to perfection, the way we ordered them. If you're a steak lover, this one is a must have! The sides were delicious as well. We went light on dessert and had a rare cognac! All in all, we will definitely go back and try different things on the menu. Curious to try other entrees on their menu!",0.9936,0.79,0.179,0.03,0.576871921182266
2016-02-08,4.0,"Went there for the first time during restaurant week.  Loved the way it's decorated - gives it a very chill vibe.   My sister & I both had the steak tartare to start.   It had a nice zip of black pepper but we weren't a fan of the egg on top.  We scraped that sucker off to the side.  For the second course, we both ordered the calamari.  It wasn't heavily breaded which I liked but I thought it could have used a touch more spice.  For the third course, I had the salmon which was cooked to perfection.  My sister had the steak which she enjoyed as well.   Thought it was a little odd that a veggie or something didn't come on the side with either dish.  We ordered both of the desserts and split them.   The cookie was served nice & warm.  The sticky toffee pudding was really, really good.   Our waitress was very friendly and gave us a good feedback on our food choices.   Overall thought the service was very good.  Would definitely go back to try their regular menu.",0.9917,0.716,0.239,0.045,0.48848290598290595
2016-02-05,5.0,"Our group of friends met up before the holiday season and for my birthday to grab dinner here. I can honestly say this was a great dining experience. We all enjoyed our food, several bottles of wine (well I'm carrying a little one but they did), and dessert. Our server was knowledgable and friendly. Not to mention we had a late reservation and we saw they were closing. They were very accommodating and never rushed us. The manager also came to the table and greeted us and gave me a card to return for a free app. All in all I would definitely return and plan to do so in the future. One small compliant that was rectified immediately was  the french fries with our steaks were well done. Fresh batches were sent to table immediately.",0.982,0.791,0.209,0.0,0.46964285714285714
2016-02-03,5.0,The food here is amazing. I could eat ten of the short rib appetizer. The lamb app and the root veggie side were fantastic. The owners and staff are so welcoming and wonderful. I cannot wait to go back.,0.9442,0.686,0.314,0.0,0.5166666666666667
2016-02-03,3.0,"Not sure what all the hype is about this place, but it was just alright. We were expecting to be blown away, but we went this past Sunday and ordered off their regular menu and restaurant week menu and both were just okay. The infamous hanger steak, nothing special. My brother and I both ordered our steaks medium well. He was given a medium steak. I received a well-done steak. The lobster mac and cheese, we found maybe 3 pieces of lobster. The salmon was good, but nothing spectacular. The only dish we all enjoyed was the mushroom risotto. I will also note that we waited an hour and a half for our entrees to arrive. Pretty disappointing, probably won't return.",0.9269,0.784,0.162,0.054,0.6426082464544003
2016-02-03,5.0,I went here for Restaurant Week.  Awesome food and service!!!  Will return soon.,0.7163,0.689,0.311,0.0,1.0
2016-02-01,5.0,"What started as a search for a reasonably priced steakhouse turned into an incredible meal exceeding my expectations.  My partner and I arrived for on Saturday a little before our reservation time and were seated promptly. Since it was restaurant week, they were offering a fixed menu which we were both very excited to try. The starter was a grass-fed steak tartare with garlic toast. The bread and beef had great flavor and was just the right size. For the first course, you had the choice between an orange and fennel salad, or fried calamari. We both got the fried calamari which had a spicy orange chili glaze, accompanied by red peppers and green onions. IT WAS INCREDIBLE. Just the right amount of spice made this a delectable dish. For the second or main course, we both enjoyed an 8 oz steak Bavette which we decided to pair with sweet potatoes. The steak was cooked and seasoned perfectly, while the potatoes were sweet and spicy with just enough firmness.  For dessert we each had the toffee pudding. Though it was just the right size to end the meal, neither of us could finish because we were so full.  I should also mention that he had a wine pairing with each course, while I had the penicillin..amazing. I would love to go back and try pretty much everything, since this experience was so great. Loved the atmosphere, friendly staff, and delicious food. I will hopefully be back in the near future!",0.9944,0.815,0.185,0.0,0.5173881673881674
2016-01-31,4.0,"Came here for restaurant week and had a good dinner. Service was a bit slow at first but once we got our orders in we were all good. Not a huge fan of raw meat so I can't give an honest opinion of the steak tartare. Can with a runny egg on top and although I couldn't eat it, husband said it was good. The fennel & orange salad was pretty boring- not much to it besides the greens and some orange slices. Salmon was great. Very simple, raw on the inside so if you don't like your salmon like hat make sure you tell them! Husband had the Bavette steak which was outstanding. Tastes like they marinated that thing for days in a Worcestershire sauce. Def recommend that, as well as the sticky toffee pudding for dessert!",0.9836,0.664,0.251,0.085,0.643210874093227
2016-01-29,4.0,"Dined at Unite for this first time the other day. A friend and I decided split most of the Restaurant Week menu and we really enjoyed it.  Individual steak tartare--didn't love the yolk to meat ratio but overall good. Nice portion of crusty bread. And love the bonus course for $33 Fried calamari with orange chili glaze--realllllly good! loved the spice and the fact that it wasn't overly fried or greasy. Would definitely order as an appetizer again.  Fennel and orange salad--my friend really liked the light flavor.  Bavette steak--no sides, just the meat, but a very decent portion. Not blow-your-mind in terms of flavor, but a great deal with the RW menu.  Veggie burger--a random choice as neither of us is veg, but it was VERY good. the patty was great and not boring like most veg burgers tend to be, the aioli was fantastic (and actually made the steak more interesting too....) Sticky toffee pudding--so moist and delicious. I'm not even a big desserts person but this was a good one. For those who might not be familiar...this is not an actual pudding, it's a piece of sponge cake. This is a British dessert, where they refer to all dessert as ""pudding."" (I only say all of this because I saw another reviewer mention the lack of actually pudding.) Chocolate chip cookie-big cookie, nice and soft, even spread of chocolate. Still warm! Owner came by to chat with us; that was a nice touch. It was half price bottle of wine night, which was a great deal, BUT my friend arrived early and they did not inform her of this so she ordered a glass of wine while waiting for me. Kind of a bummer that we had to do bottle + glass. ALSO they have a takeaway license (which I didn't even realize was a thing) so if you don't finish your bottle, they put it in a sealed bag and you can take it home. Unfortunately, my bag was not sealed completely and some of the wine spilled out in my purse. Luckily, most of the contents survived, but the lining of my purse was soaked :( Just a heads up to be more careful than I was, I guess, just in case your bag ends up not sealed all the way either.  The restaurant itself is nicely decorated. Loved the general atmosphere. Great spot for a date, girls night, dinner with your parents, etc. Can't wait to come back!",0.9987,0.714,0.241,0.046,0.5975320512820514
2016-01-27,5.0,"delicious! grass fed beef, their wings are fabulous, nice simple wine list!",0.8881,0.462,0.538,0.0,0.8392857142857143
2016-01-24,4.0,"Glad this place opened nearby. The marinade they use is excellent. Now its not a Mastro's tier steak, but the food is very very good. Hope they are here to stay",0.929,0.655,0.345,0.0,0.9266666666666667
2016-01-24,5.0,"Girlfriend thought they had a solid restaurant week deal, and thought the wine pairing was good. My NY strip came out too rare, but it was quickly taken care of and ended up being very good. Waiter basically refilled wine for free after that so can't complain. Would recommend the place.",0.9457,0.666,0.293,0.041,0.6133333333333334
2016-01-21,4.0,We came on a Wednesday evening at opening. We were there until 7 and it was dead! The food was good. We both got the veggie burger and fries. The flavor was god. The bun is toasted and it comes with an aioli sauce that has a kick. Recommend this place but not sure if they will last!,-0.3457,0.821,0.096,0.084,0.4888888888888889
2016-01-15,5.0,"THE BEST HANGER STEAK I HAVE EVER HAD. I went here for my birthday with my friends and the evening could not have gone better. It started off with the bar, and Matt creating the most delicious cocktails. After a few the rest of my friends showed up and we made our way to the table. We ordered the calamari (tangy with spice- perfect for five to split with other appetizers), artichoke hearts (the paste left the perfect subtle zest in your mouth- again split between five), and steak tartar (with the egg on top and salt to sprinkle- IT WAS AMAZING.) Again, let me reiterate, all did not disappoint! I am telling you, my friend's are the biggest foodies and couldn't have raved about the appetizers more. We split a few bottles of wine and all ordered the hanger steak medium rare/some did rare. First and foremost this steak was beautifully crafted. The chef cooked exactly to each request. (Finally a place that isn't afraid to cook rare because of the quality of the beef) We also ordered the potatoes for our side, and shared a bowl of the mushroom risotto- FANTASTIC! Highly recommend to add this order to split six ways as an additive. I cannot rave about the steak more- no one even talked during dinner because of the savory flavors. At the end we topped it off with a walnut cake- again the caramel sauce was divine. We stayed and drank for ours after, and there was never a rush from the staff to leave- in fact we stayed from open-close. The staff was nice and extremely helpful. This is absolutely at the top of my forever list and cannot wait to try the rest of the menu-inclusive of their bottomless mimosas for brunch! Restaurants such as this make me love and appreciate my neighborhood more, and make me so happy to live in a foodie city. Again best steak dinner I have had thus far in life- cheers!",0.9968,0.788,0.195,0.016,0.6370952380952382
2016-01-12,5.0,I went there with two different friend groups. A couple were vegetarian. Both groups were thoroughly pleased. The calamari app had a fresh flavor to it that made it stand out above normal calamari. The artichoke had an excellent lentil sauce that it came with. The Amish chicken was moist and delicious while I couldn't get enough of the Brussels Sprouts. The staff was very accommodating and clearly new the menu very well. It was a great first experience there and I look foreword to bringing a date next time.,0.9765,0.746,0.254,0.0,0.5625252525252525
2016-01-03,5.0,"Great food, reasonable prices and terrific service. Recommendations - steak tartar, artichokes, lobster mac and cheese, hanger steak, New York strip and sticky toffee pudding.",0.802,0.753,0.247,0.0,0.7011363636363637
2016-01-03,2.0,Honestly I've expected better. My hanging tender was cold and the dude serving us was rudely ignoring me while only talking with my company. Pretty unprofessional for all the hype and the $$,-0.0258,0.596,0.201,0.203,0.75
2015-12-31,5.0,"This is a great spot!  1.) great customer service 2.) great food ! We ordered a skirt steak , glazed chicken wings and a kale salad. 3.) Great atmosphere, clean bathrooms and finally very attentive staff!  A must try !",0.9693,0.58,0.42,0.0,0.8071428571428572
2015-12-18,3.0,"So I'm torn between a 3.5 & 4 stars. The food was good, but not mind blowing. The ribs weren't falling of the bone, a little tough if I might say so. The sides were okay, and my partner's burger was decent. Beautiful on the inside, the staff was attentive, but not in a hurry to return.",0.8543,0.759,0.191,0.05,0.7142857142857143
2015-12-07,5.0,"Some of the best food i've ever had AND they take reservations!!!! This was the perfect restaurant. Ambiance has a Chicago neighborhood feel but is not crowded, has neat lighting and is not too loud. Our server was fantastic, wish we could remember his name. He made great recommendations for drinks, meals, sides, dessert and was very descriptive so we knew exactly what we were ordering. He even made recommendations of other places in the area to go if we wanted to come back to Noble Square to try something new.  Food: I'll keep it short, because EVERYTHING was good, but the hanger steak was my entree and was cooked perfectly and my favorite! The table consisted of hanger steak, burger, porkchop, mac and cheese, brussel sprouts, and two desserts. ALL amazing but wouldn't get the mac and cheese as an entree.  Price: Very affordable for the quality.  Drinks: Solid list of cocktails, wine, and beer.  The owner even came by to ensure the steaks were cooked correctly and everything was up to our expectations. I will definitely be back next time I want a steak and to try some of their appetizers.",0.9941,0.76,0.226,0.014,0.5114772727272727
2015-12-05,4.0,"My wife and i came her to celebrate my birthday. The food was great -- my favorites were the hanger steak w/ fingerling potatoes and lamb meatballs. The service and cocktails were also exceptional. Seating is one area in need of improvement. The restaurant is set up with bench style seats and individual tables. In most cases this setup would be fine but we were sandwiched between two obnoxious, overly loud tables.",0.4939,0.821,0.129,0.051,0.6583333333333333
2015-11-22,5.0,"When I found out that Unite is now offering unlimited mimosas for weekend brunch, I immediately made a reservation.  I have always enjoyed their brunch, especially the steak and eggs, and now this seals the deal for me as one of my favorite brunch spots in the city.  The unlimited mimosa deal for $14 is a great deal and they put a lot of effort into their mimosas. They use fresh orange juice and are definitely an upgrade from your typical mimosa. Check it out.",0.9371,0.828,0.172,0.0,0.7071428571428572
2015-11-19,5.0,"Love this place! We came here twice on a visit to Chicago and both the cocktails and the food were outstanding. The Sazerac put a smile on my face so beguiling that other patrons started ordering Sazeracs too. The New York Steak was cooked to perfection, the fried calamari was delicious. I wish this was my neighborhood bar and grill, I would blow all my money here.",0.9686,0.73,0.27,0.0,0.5674242424242425
2015-11-18,5.0,Wow this place is great.  You can't go wrong with anything on the menu.  Even their veggie burger is phenomenal.  I definitely recommend this place.,0.9398,0.548,0.452,0.0,0.73
2015-11-15,5.0,"Wow. If I could give this place 10 stars I would. Found it via Yelp while looking for someplace to spend our anniversary. It did not disappoint. Staff was courteous and friendly. Their recommendations were spot on! We tried various cocktails, calamari app, and each had a steak. Best steak I have EVER ate in my life. Buttery tender delicious magical. I wish we had this place in Indy. We can't wait to come back next time we are in town.    Already craving it again!!",0.9751,0.752,0.248,0.0,0.5888888888888889
2015-11-14,5.0,"My wife and I recently went on a trip to Chicago. We are from the SF bay area.  We looked up restaurants on yelp and found Unite Urban Grill, the pictures and menu looked great,  and plenty of positive reviews so we decided to see for ourselves.   Im so glad we did! The restaurant is very cozy,  perfect for a social dinner with friends,  or a quiet evening for two.  The decor is very modern and hip. The food was AMAZING...my wife and I started with the flash fried Calamari..it was so tender and had red peppers, green onions, and chili glaze that was perfectly balanced. We then had the crunch salad which was spring greens,  apples, carrots,  currants, and seeds with honey tahini. And a fennel and orange salad, with toasted pistachio, pomegranate, romano, with red wine vinnagrette  Our main course,  my wife ordered the poached Maine Lobster mac and cheese with gruyere and aged cheddar.  I had the ribeye steak with fingerling potatos Everything was on point!  My steak was perfectly cooked The Waite staff was friendly,  attentive, and you could tell they believed in their Chef. Next time I visit Chicago, this place is on my list of places to go!",0.9863,0.858,0.142,0.0,0.487189393939394
2015-11-09,5.0,"My husband and I ate here for our anniversary dinner.  We are here visiting Chicago and after checking out pics on yelp this is the place we decided to try.  Omg!  So glad we did!   The service was impeccable, the food was delectable!   Started with the flash fried calamari - soft, tender, light spicy Asian sauce on them. ... I'm still drooling.   We then moved on to salads.  The Crunch and the Fennel; both were excellent.  For dinner we shared the Lobster Mac and the ribeye. The mac didn't skimp on the Lobster and the steak was perfectly done.   Best steak I've had in a long long time.   When next I'm in Chicago; I will be back!",0.9746,0.824,0.176,0.0,0.4916666666666667
2015-11-08,5.0,"Husband and i just went back to Unite, again, the staff was so friendly,the owner was running around making sure everything was perfect!!! the veggies were delicious! hubby had hanger steak because of the photo posted,  it was the best steak ever! i wish i lived closer to unite, i could have healthy delicious veggies more often! the food is the best in town, Chicgos best really needs to feature this place!  Here a vegetarian could fall off the wagon!!!!",0.9868,0.67,0.33,0.0,0.5444444444444444
