date,star,text,compound,neutral,positive,negative,subjectivity
2015-01-03,5.0,"Simply amazing!! My husband and I made reservations for New Years Eve, just wanting a comfortable atmosphere and that's exactly what we got. Although the restaurant was packed when we got there, we didn't feel overwhelming and the ambience was amazing; it felt like we were at a friend's house.  Our intentions for the night were to try a little bit of everything and that's exactly what we did. We decided to try the lamb meatballs and that was an excellent choice. The meatballs were so moist, juicy and packed with favor, the sprinkled feta and the tomato sauce were the perfect pairing for this appetizer.  We decided to order a couple of drinks as well. I ordered the Noble Square, which had a great refreshing fruitiness to it and my husband ordered the Bucktown, which had a nice hint of citrus and the smokiness of bourbon without the harsh burn.  Next we ordered dinner, which consisted of a whole lobster, Prime rib, Ribeye, Cauliflower and Mushrooms. The lobster and the prime rib were specials for NYE and were done to perfection.  The lobster was grilled, brushed with a lemon and herbs and just the right texture and the butter was out of this world!! The 16oz Prime Rib was extremely tender and flavorful, the au jus was best I ever had. Usually au jus is extremely salty, but this au jus was incredible. Now, where else can you go in the city and get a 14oz Ribeye for 30 bucks, that's of great quality? I have tried Ribeyes at every steakhouse in the city and I can say, hands down this absolutely was the best steak I have ever tasted!! To add to the deliciousness of the night, we paired our steaks and lobster with mushrooms and baked cauliflower. The mushrooms had so many flavorful notes and were sautéed to perfection and the baked cauliflower paired with cheddar and Parmesan cheese was melt in your mouth good. To top off the wonderful evening we tried the Apple pie, which was to die for!! I can't wait to go back, I keep talking about all of the amazing food we tasted. This is now my favorite restaurant in the city, hands down!!",0.9962,0.811,0.175,0.013,0.6366121532788199
2015-01-02,4.0,"We got carry out from here and I really enjoyed the veggie burger, was pretty damn good!  However, my husband thought the wings were mediocre and didn't finish them, hence the 4 stars.  The carry out time was accurate.We would go back because it's so close to where we live and I would like to eat the burger again.",0.8685,0.771,0.189,0.041,0.6333333333333333
2014-12-29,5.0,"Love this place. A wonderful story, delicious food and a really chill and intimate atmosphere. I decided to return here to celebrate my birthday with some girlfriends and so glad I did. We are also meat lovers and all enjoyed a great cut of meat with a few vege sides so we didn't feel too guilty. The brussel sprouts were my personal favorite. They paired well with my flank steak which was literally finger-licking good. There was this amazing sauce that complimented it very well - a nice touch. Also, Joe, one half of the owner-chef team came by to say hello. He was very appreciative of us coming in and welcomed us to return. I definitely will.",0.9957,0.582,0.404,0.014,0.6692982456140351
2014-12-28,4.0,"Really good service and food quality.  We had dinner early Sunday evening.  The hangar steak was great - better than my husband's rib eye.  The cauliflower was great, adequate house salad, good lamb meatballs.  The dessert menu could use an upgrade.  All in all, very satisfactory.",0.969,0.631,0.369,0.0,0.5166666666666667
2014-12-27,5.0,"Outstanding food in a casual atmosphere.  We split the ribeye steak and ribs. Hands down the best steak I ever had. Starting with the right cut of grass feed and anti-biotic free steak. Cooked and seasoned to perfection. Melts in your mouth.  The bbq ribs were crazy good. Excellent flavor with a sauce that was a perfect compliment to the meat and not overpowering.  For the veggie lovers, it doesn't get any better than this. Spaghetti squash with toasted pumpkin seeds was unbelievable. Many more dishes to choose from.  Carnivores and vegetarians can both be very happy here.  Please go and try this place. It's a hidden gem.",0.9884,0.639,0.31,0.051,0.6305335097001764
2014-12-22,2.0,"The food was pretty delicious, but the service made this a terrible experience. My two roommates and I went here for our ""Chrismakkah"" celebration. We were really excited to try this place out, so we traveled from Lakeview! When we walked in, we were seated 20 minutes prior to our reservation, something we didn't expect! The restaurant was about 1/2 full then (6:40pm.) Our server asked if we had visited before, which we hadn't so she explained the menu to us. We basically knew what we wanted and were already salivating! She walked away and came back about 10 minutes later to take our orders. My roommate J and I ordered 1/2 house salads and my roommate K ordered a smoked tomato soup. These were all loved by us. Next, our entrees came out. J ordered the Hanger steak and cauliflower, I ordered the NY Strip and spaghetti squash and K ordered the French Dip Sandwich (it came with a side of fries). Our server said she'd be right back with steak knives. THESE STEAK KNIVES TOOK FOREVER TO ARRIVE. We waited patiently for about 5 minutes, but then flagged someone down. We didn't complain to anyone, but by the time we had our proper utensils, our steaks were cold. We did enjoy all of our food, but with we wished we ate the steaks hot. The busser removed half of our dirty plates at once and we assumed he would return for the rest. There was a 10-15 minute gap in which a plate of steak fat was sitting in front of me. K and I wanted dessert, but by the time our server was flagged down for the check, too much time had passed and we lost our appetites for dessert. Our server never apologized for anything. If she had, we would've forgave.  Unite has potential to be great with their amazing food and story, but they need to pay more attention to their customers experience!",0.9707,0.854,0.101,0.045,0.4992368742368742
2014-12-19,5.0,"I was here for an office holiday party.  The staff was very friendly and remembered my orders and preferences even though I was one of a party of almost thirty people. The food was well-made and delicious with a few unexpected (but yummy) twists.  The space has a great open but cozy feel and the cocktails are inspired by different Chicago neighborhoods, (I loved the mezcal-based ""Bucktown"", with a list of classics available as well. Each drink was made beautifully, and slightly spirit-forward. A must try in the neighborhood:). FYI, don't be surprised if the owner stops by your table to ask how everything is... It's how they roll here, but you won't know it was him unless you ask, because he won't say so.",0.9825,0.738,0.234,0.027,0.6869047619047619
2014-12-19,4.0,"I really enjoyed this place. We came on a Wednesday night for dinner with my brother and we took our time. We orders drinks and talked for the first 30 minutes and order an appetizer to start. We were having a slow dinner and never felt rushed by our waiter. He was a nice guy and gave us his opinion of the menu.  We had the lamb meatballs, cauliflower (SO GOOD!) and sliders. All were delicious. The table also had the ribs and steak. Both had good reviews from the group.  I would come back, a great addition to Chicago Ave.",0.9544,0.838,0.162,0.0,0.5981481481481481
2014-12-14,1.0,"Food was fine, but probably the worst service I've ever encountered. And it wasn't even that crowded and a bunch of (snotty hipster) waitstaff. Even after I went and physically got someone so we could order (when people just kept walking by us), it took forever to get food, no one checked back with us, couldn't get drink refills, etc. Got the bill quickly tho - they were on top of that part. Don't bother - you can get much better food at a place that actually wants you there.",-0.1144,0.811,0.103,0.087,0.40535714285714286
2014-12-08,5.0,"WOW.  I was wow'd when I came with Katy S. on a lady date. Unite was making things right from her previous negative experience. They exceeded all my expectations. Decor is super cute with a mix of romantic and modern with dim lighting and couches at the entrance. We each had a glass of wine, shared the brussel sprouts and cauliflower, I had the salmon and she the full rack of ribs. I love my veggies and if I could prepare cauliflower like that every day, I would be in heaven. It tasted literally like mac and cheese! How the hell did they do that? The salmon was a smaller portion than anticipated but its quality was out of this world. I didn't have to chew, it melted on my tongue. I have never had salmon like that, even in the fanciest of restos. She loved her ribs like none other. Don't think I've ever seen my friend that happy over a meal in the 10+ years I've known her. We then shared the peanut butter dessert which tasted like a grown-up version of a butterfinger bar. Super rich and decadent and any peanut butter lover's dream.  Service was phenom and we had such a great time. I need to go back again and again and again.",0.9956,0.719,0.26,0.021,0.5981292517006802
2014-12-06,5.0,Food was soooo delicious! Cauliflower and brussel sprouts were amazing and the white fish was super flavorful. Nothing was overly oily or overtly anything. Perfect.,0.9468,0.577,0.423,0.0,0.7133333333333333
2014-12-05,5.0,"My husband and I have eaten at many restaurants in Chicago, from high end price wise ie. Alinea, Moto, Tru, Everest to low end price wise ie. Choppers, El metro, Odges.  We are self proclaimed foodies!   While we have had brunch at Unite this was our first dinner there.  It was a Friday night around 9:45 and although they close at 11:00 we never felt rushed.  The staff, our server was Cassie,  was very friendly, helpful and courteous.   We started with the lamb meatballs and I have to say they were the best we have ever had anywhere!  For our main meal we shared the Amish chicken with the bbq sauce, the cauliflower and french fries.  Everything was amazing, my husband loved the fries where I prefer mine on the crispy side.  The chicken has to be the juiciest and most flavorful we have had at a restaurant.  I was glad to see a restaurant do cauliflower and I must say while not the healthiest it was the best I've ever had. I could go on forever!  You have to go to Unite Urban Grill for brunch also, I might be back this Sunday! Also, when we were leaving the owners Joe and Megan along with the manager Jason asked how everything was and how we heard about them,  they listened and were really interested in what we had to say.  Love that about a restaurant!",0.9927,0.815,0.177,0.008,0.5571212121212121
2014-12-04,5.0,"My husband and I have been here twice for dinner and really enjoyed it both times.  It is a warm, casual environment with very good food and drinks.  We will be back for sure!",0.9017,0.674,0.326,0.0,0.6392592592592593
2014-12-03,5.0,"This was a restaurant I found online and didn't know much about. All the reviews were great, however, I hadn't heard of anyone I know going there. This made me hesitant about the restaurant. When I walked in, it was empty. It was 6:30 PM on a Wednesday. I was concerned that it would be empty the whole nigh. Also, an empty restaurant generally means it isn't good. So, I asked the waitress why that was. She claimed it would fill up in the next hour... and it did!  The sides are fantastic. The cauliflower mac and cheese is to DIE for. However, its not a simple grilled veggies, its definitely bad for you. Veggie burger is great too... homemade and crispy.  I definitely would go back and would recommend to a friend!!",0.8333,0.721,0.159,0.12,0.47492063492063497
2014-11-23,4.0,steaks. yum. manhattans. yeah. hearts.,0.296,0.645,0.355,0.0,0.0
2014-11-09,5.0,"Delicious steaks, awesome drinks, and great customer service! This is my new favorite in the neighborhood. We happened upon this place when going to dinner somewhere else and stayed because the drinks were good and the food smelled amazing. It did not disappoint. The brunch was fantastic too!",0.9818,0.588,0.412,0.0,0.8255681818181819
2014-11-07,5.0,"Great spot on the West side! Very fresh vegetables and great meat, definitely something for everyone!",0.9334,0.46,0.54,0.0,0.6625
2014-11-05,5.0,"I can't say a bad thing about this place at all and it's literally on my top 10 in Chicago.  I've tried everything from the beef short rib sliders, the lamb meatballs, the watermelon salad, to the pastas, to the veggies.  The drinks are impressive.  What tops this place off is the fantastic servers and very reasonable portions/prices.  I've never had to wait for a table which is insane for a place this awesome.",0.9518,0.737,0.231,0.032,0.7683333333333333
2014-11-03,4.0,"The food was very good, so nice start.  I had the hangar steak, which was well cooked and flavorful.  My wife had fish--delicious.  Portions were solid. Fries were perfect!  Good beer and wine selection.  It's a long narrow space, but they did a good job making it comfortable and inviting for a Saturday dinner or sitting at the bar for drinks and a bite. Good stuff.  It's a little pricey to be a go to neighborhood spot (everything is a-la-carte), but I'll recommend it and I'm sure I'll be back.",0.9845,0.678,0.322,0.0,0.5899145299145301
2014-10-23,5.0,"This place is redic. I've been here a couple times and the service and food gets better and better!  My wife and I try and get something new every time we go and have been pleased with everything we've had: hanger steak, ribeye, ribs, lamb meatballs, burger, and sliders are all great! Great atmosphere, solid staff.",0.9589,0.716,0.284,0.0,0.5792207792207792
2014-10-20,5.0,"Sometimes in life, you have to give things a second chance to fall in love. As you may know by reading my review #1 for Unite Urban, my first visit to Unite was not very pleasant. Joe, the owner, subsequently contacted me and tried to make things right. First of all, kudos to any business owner who cares that much about their patrons that they even reach out to unsatisfied Yelpers.  I walked in to Unite on a Saturday night to find a much different scene than I saw the first time. A very dim, romantic, hip, classy restaurant with beautiful decor. On visit #1, it was still day light out and I could not enjoy it nor appreciate it as much. The restaurant is small but still welcoming; this spot is perfect for a date night.  The nice, pleasant hostess sat us immediately upon check in (I had made a reso through Joe). BTW, they e-mail you the reservation information so you don't forget. Nice touch there, Unite.  Quinn, our awesome (uber nice) server, promptly came to the table and greeted himself while I was waiting for my dining partner and fellow Yelp Elite, Angie K to arrive. He told me that they had just released a new cocktail - ""Andersonville."" This was a sparkling beverage made with gin, prosecco, and I believe peach liquor (if I remember correctly). Though delicious as can be, I would recommend this for brunch not for dinner. I later opted to switch to the Pinot Noir that Quinn recommended and boy was he right. Their pinot paired perfectly with all things consumed that night.  Now on to the most important part of all things dining: the FOOD.  When I was waiting for Angie K to arrive, I was being the typical ""food spy."" Definition: one that sits at a table in a restaurant observing what others are eating in order to determine what looks good and later copies that persons meal to the T.  What caught my attention: the RIBS. I thought, ""hmm, I am not on a date; I am with a friend. Thank God!"" I could order those ribs and eat them like crazy Fred Flinstone without being judged.  I ordered a full rack - yup, hungry girl status! Angie K ordered the salmon as she is a pescatarian (a few fish options on the menu, hooray!); as for sides we ordered the cauliflower mac and cheese and the brussel sprouts. We also had the spinach/cheese flatbread as an app.  Listen here people, there was not one bad tasting thing on our table that night. Every SINGLE item was delicious.  The flat bread was amazing. Their spinach was something I've never seen before - so green and leafy; it almost looked like kale and tasted phenomenal.  Angie K said her salmon ""melted in her mouth"" and that she was able to cut into it like butter. It looked great, though I did not try it.  The ribs were THE BEST I'VE EVER HAD. Seriously, I ranted and raved about these ribs to anyone I called/came in contact with the next day.  The brussel sprouts were so amazingly soft and perfectly seasoned (with parmesan cheese and herbs, I believe).  The cauliflower mac and cheese was my least favorite, though Angie's favorite! lol, different tongues, different strokes, I suppose. It was like, ""would you like some cauliflower with your cheese, madam?""  The cheese was a bit overpowering; still delicious but definitely too much of it.  As for dessert, we had the peanut butter mousse bar? It tasted like a butterfinger in the form of a cake. Though angelic in nature (lol), I'd choose another dessert next time as it was very rich. That cookie sandwich someone else mentioned on Yelp is a must next time.   Towards the end of our meal, both Joe (aforementioned owner) and Jason (manager) came up to introduce themselves to us. Both are very nice gentlemen and Jason is definitely not bad to look at either (eye candy alert!) Side note: the bathrooms were modern and very clean.  Overall, one of the best dining experiences I've had in Chicago thus far. This is why second chances are so important. I found out that they have a travelzoo special and bought that thing with the quickness the following day! I will 100% be returning. Thanks Unite.",0.9994,0.752,0.214,0.034,0.5391915989992914
2014-10-19,4.0,"Great atmosphere is a very subjective and cliche but it's the best way to describe this place.  The waiting area has several couch-coffee-table combos to knock back a few drinks on an empty stomach.  The food was expensive but the quality was worth it.  I got the UNITE BURGER.  It was one of the more affordable items on the menu, but not my recommendation.  The RAVIOLI was by far the best entree that I tried.  I highly recommend them, but make sure you get a side to fill the void in your stomach.  Bring your wallet, don't expect leftovers.",0.9717,0.772,0.208,0.02,0.4270634920634921
2014-10-16,5.0,"We will ABSOLUTELY be returning! My boyfriend and I last minute wanted to go out to dinner. We both we in the mood to find somewhere with steak, and thus we searched on Yelp. We actually found a place we originally were planning on dining at but they were booked with reservations, thankfully our next stop was meant-to-be! Our server's name was Aaron--super knowledgeable! He was not only friend but johnny on the spot, he was able to give us a charming date night we were looking for. As I said we were looking last minute so we came in what we had been wearing all day, very casual, but still felt as if we were dining at a friends house with the ambiance of a nice restaurant without all the white linen tables. The atmosphere was very nice with well decorated lighting and warm colored walls.   Aaron was able to give us a ""free appetizer"" card to use since it was our first time dining, we used it right away on the cheese and charcuterie  board--YUM! this had two different kinds of cheese (I'm from Wisconsin and they blew me away), pickles, honey mustard, almonds drizzled in honey, and two different kinds of cured meats. It was a perfect start to our wonderful dinner.  The cocktails were a bit on the expensive side with is my only negative thing to say BUT with that, they tasted SPOT ON! very delish, props to the bartender! GET THE HANGER STEAK!!! I have never tried hanger steak before but it was such a tender, very flavorful steak--best part= it came exactly how I ordered it. each and every bite was fantastic! My boyfriend got the steak sandwhich and it was also great but of coarse I loved mine more!!  needless to say everything was perfect and we will be back!!",0.9957,0.784,0.184,0.032,0.6081724581724582
2014-10-16,5.0,"I went here with 10 other people for a pre-Chicago Marathon meal. Most of us don't eat pasta, so this seemed like a healthy place. We were pleasantly surprised! Food was all cooked to perfection with spot-on flavors. I had the bone in pork chops & quinoa. Pork was juicy & tender. I also shard my mom's watermelon salad, it was tasty & refreshing! They were very accommodating of our large group. No issues timing the food. Would go here again in a heartbeat! Good prices for gourmet food.",0.9407,0.784,0.193,0.024,0.5754464285714285
2014-10-09,5.0,"The atmosphere and the people that work at this place are the best I have experienced in a long time. My lady and I used a Travelzoo coupon here last night, and it did exactly what restaurants hope will when offering a deal through a coupon distributor. Jason, who appears to be a manager of some level, was super friendly as soon as we walked in, both servers were very attentive/comfortable to be around. We had 4 employees come and ask how things were going, which seems like it would be a lot, but they approached and asked in such a comfortable way that it was very nice.  Must haves: The pork chops and lamb meatballs.  Also very good: The spinach flatbread In an area that gives a lot of opportunity to not repeat restaurants a lot, we will definitely be back for this one.",0.9834,0.799,0.201,0.0,0.49717948717948723
2014-10-07,5.0,"Amazing food, impeccable service, great ambiance and a free coat check! I've yet to find fault in any Chicago restaurant, but this one surpasses many of the others I've been too! Their olives are absolutely amazing, loved the seasoning. Their spinach flat bread is enough for two people, and their burger was gigantic! All entrees are definitely made for 2 people. The pricing was great-much less than I had originally expected. Their drinks are wonderful too, very sweet, and well made. Overall, a great dining experience! Totally going back!!",0.9921,0.631,0.353,0.016,0.5742592592592594
2014-10-06,2.0,"Tried, but missed the mark Any restaurant (management) that cares about its customers will try to make things right, including comping your food. For the part of both diners and the restaurant, showing respect for your fellow humans goes a long way to helping the situation. Last night, Unite Urban Grille tried but missed the mark.  I have recommended this spot to others in the past. Now, I have nothing good to recommend. I do not like sweet and sour dining experiences.  --Did the manager work to get my wife's food right? YES, absolutely.  --Did the manager tell us ""certainly you will not have to pay for that?"" YES (the problem).  --Did the manager offer her an appetizer or something while her food was re-fired? CERTAINLY.  So...what was the problem?  When the check arrived, the manager kept his word and comp'd the messed up steak. However, the manager turned around and charged for the re-fired steak. ""Something is wrong here,"" I thought.  Although we spoke to him about his original play on words and he apologized for any misunderstanding, I was no longer interested in the last minute offer of free desert. Suddenly, I lost my appetite for their food.  Look, I understand that some larger restaurants may be able to financially absorb staff errors by comping the food. I get it. After all, it is much easier to comp an appetizer or a drink than a meal. Then again, I'm not a novice on the restaurant circuit. I let the manager know what my expectations were. When the error is with the meal, then an adjustment is customary with THAT meal. Even TGI Fridays comp's staff errors.  To his credit, the manager approached us while exiting to apologize for the error. He welcomed us again by sliding me a ""1 free appetizer"" coupon, ""with the purchase of any entree"" in small print. I'll pass (it on to somebody else).  Somehow a contingent complementary item reminds me of the sour patch kids candy slogan, ""Sour. Sweet. Gone.""  And, I don't like sour patch candy.",0.9496,0.699,0.167,0.134,0.44043513957307057
2014-09-27,5.0,Great dinner.   I dine everywhere and often.   Rarely write a comment.   This place was a find.  Ribeye and Salmon both prepared to perfection.   Limited wine selection but still found a nice bottle.  Very positive experience so I give them 5 Stars.,0.9318,0.633,0.336,0.032,0.7003896103896103
2014-09-22,5.0,"What a great find! After searching for a new steakhouse to take my family to, we settled on Unite due to the good reviews and modern style. As a group, we had the strip steak and filet. Both were amazingly tender and flavorful. The French fries were amazing and had the right amount of salt and crunch! They have a wonderful cocktail menu as well. I highly recommend this restaurant!",0.9651,0.744,0.256,0.0,0.5777508854781582
