date,star,text,compound,neutral,positive,negative,subjectivity
2014-09-18,5.0,"Loved this place, we went on a whim date and ended up very pleased. We got the Caprese salad to start, then moved on to the  Hangar Steak for him-wanted it rare, and indeed served rare and perfect- and Lake Superior Whitefish for me. We shared an order of the roasted fingerling potatoes as well as the wild mushrooms. Everything was truly delicious and presented beautifully. The atmosphere for a Saturday date evening was quiet, relaxed, not overcrowded and enjoyable. Our server was fantastic and very knowledgeable, and at one point the manager himself came over and asked how everything was! He was friendly and kind- definitely left a good image. Overally, UUG is a great little date place slightly tucked away in Noble Square- don't pass it up if you are out for something quality and different with excellent customer service.",0.9953,0.659,0.328,0.013,0.6934782608695652
2014-09-06,1.0,"I hate to even give them one star. I went here last night and am honestly humiliated by their disrespectful service. I came here with family after a lovely dinner. We had one drink and were then asked by the server about having another.  When we obliged, we were told the bar closed at 11pm and was no longer serving patrons. What? Since we had spent a pretty penny on our first round of cocktails, we asked to speak to the manager for clarification as to why there was no warning regarding last call. The manager proceeded to come over to let us know that we were too intoxicated to be served. There were probably (generously and rounding up) four other patrons total at the establishment, which is embarrassing on a Friday night in the summer in Chicago. Great job driving away high-paying consumers by treating them like they are drunks, and good luck with your clearly booming business model coupled with overly excessive judgement. I would highly recommend any other establishment in the West Town/Ukrainian Village neighborhood. We only went there because we walked by on our way to another bar, and it was dead at 10pm on a Friday and had outdoor seating, and then we quickly understood why no one was else there. Awful!",0.6468,0.782,0.116,0.102,0.5586363636363636
2014-09-02,5.0,"Great food, love the sharing style. The watermelon and heirloom tomato salad was an interesting combo but nonetheless delicious! Their version on the French Dip was one of the best I've ever had and some excellent straw fries that accompanied it! The Hangar Steak paired with the asparagus was top notch. Will definitely be back and if not to dine in, will order for carry out as I saw several others doing this while there! Also definitely try some of their signature cocktails. I had a Remember the Maine and my girlfriend had the Logan Square. Both were mixed excellently with the right blend of sweet to compliment the liquor but not masking it.",0.9942,0.668,0.332,0.0,0.5057142857142858
2014-08-27,5.0,"We went on Wednesday night, Aug 27th at my daughters suggestion and this place was amazing. Every dish was great, as were the prices and service.  Can't recommend this enough....we will be back. We had the rib eye, whitefish, salmon and bbq chicken and everything was delicious. So nice to see $1.00 cookies on the menu for dessert.",0.9271,0.759,0.21,0.03,0.7666666666666666
2014-08-21,5.0,"Wow the food and service are incredible here! We had a reservation on a Wednesday night around 7pm; the place was not particularly packed so we received solid attention from the wait staff. We were unsure of which wine to have so our waiter allowed us to try two different types before making a final decision, which was a good gesture. Some rain started to leak through one of the vents near our seats and we were promptly moved without any problems (again the place was near empty this might have been an issue if the place was more crowded). The table we moved to was a little wobbly and the owner (I think) promptly placed a stabilizer under the table. Again, great service.  On to the food. This place can be $$ or $$$ depending on what you order as the priced items have a wide range. We opted to share the hanger steak, salmon, mushrooms, and asparagus. The steak was delicious and juicy. The salmon was cooked perfectly and not dry at all. Contrary to other people on this board, I really liked the mushrooms and the way they were seasoned. The asparagus was also good with some oil drizzled on it. I washed it down with an Allagash White. Their alcohol seems to be reasonably priced as well.  I will definitely come back here to try some other items on their menu and I definitely recommend the place for a date.",0.9873,0.819,0.157,0.024,0.5311507936507937
2014-08-18,5.0,Nice clean space. Amazing food. Reasonable $$. Cute waiters.   Highly recommend you check this place out.,0.9336,0.422,0.578,0.0,0.79
2014-08-18,5.0,"Went here on a date night with my husband but would also be great for a small group of friends/family. The food was excellent!! Waitress was genuinly friendly and even the owner came to our table to make sure we were pleased with our meal. Clean, affordable and classy without over doing it.",0.9859,0.596,0.404,0.0,0.7673611111111112
2014-08-14,5.0,"I've been wanting to try this place for a while since it is just down the street from me. The food is delicious and the service staff great! I took my mom for a celebratory dinner and she really enjoyed it. I had the chicken, she had the pork chop. We shared the lamb meatballs. All was delicious. I had the gazpacho, which I didn't really like but I think that's because I ordered gazpacho, and in general I don't like it. So I am not a qualified judge there! All in all I would reccomend!",0.7557,0.821,0.129,0.05,0.6736111111111112
2014-08-10,5.0,"Unite Urban Grill is one of those restaurants where I enjoyed everything I ordered so much that the next time I go it will be a struggle to try a new dish. My husband and I loved the caprese snack because of the obvious freshness. My shrimp skewers were very  generously portioned  (how often do you get to say that about seafood in the Midwest?) and had a mouthwatering flavor with a little heat and fresh mango salsa. Our side vegetables, asparagus and potatoes, were great for sharing. Dessert? I'd come back even if I could only have the dessert.    Chocolate and peanut butter flour less cake. That's all you need to know. Just order it. There is some outdoor seating but the inside is really cool and comfy. The server, hostess and really everyone we encountered was down to earth and not some aloof hipster asshole.",0.9138,0.878,0.111,0.011,0.40647653000594175
2014-08-10,5.0,"I loved this place! we came here with 1 other couple and our baby for early dinner on a Friday evening. We sat outside on the small patio and the staff was friendly and accommodating. Our server, Kevin was a class act. We ordered the cheese plate as an appetizer and I was impressed with the selection of cheeses, meats and mustard. I ate the ribs and loved the homemade bbq sause. I also thought the farro side dish was excellent. My husband said he enjoyed his burger and paprika-corn side dish. They have a more than decent selection of beer and wine and our peanut butter chocolate dessert successfully completed the dinner",0.9766,0.799,0.201,0.0,0.6185897435897437
2014-08-04,5.0,"Went here on a date w/ my girlfriend and we left pretty impressed.  The spot is way larger than it looks from the outside and very trendy.  The small outdoor seating to the 'lounge-ish' front, to the large tables in the back, there is plenty of space for everyone. The food pricing is a bit on the higher side but it is actually worth the price.  The portions are pretty large and we ended up taking leftovers for the following morning.  The French Dip + Fries was enough for two meals.  The Shrimp dish had quite a bit of shrimp on it and would recommend it.  Just makes sure to remember that the plate dishes are a la carte style so make sure to order some apps or veggies with them. The cocktails and beers are average price and the cocktail was pretty good.  They have a decent craft beer on tap and continuously change out their 3 Floyds, which is pretty awesome. If you want to bring your date here, highly recommended.  If you want to just hang out and drink cocktails and beer, not a bad spot either.  I would just say this place is not a place where you would come to just your light beers and makes a fool out of yourself.",0.9915,0.787,0.197,0.016,0.5688242210464431
2014-07-31,5.0,"My friends and I, in town for Lollapalooza, were searching for a great place to celebrate my birthday. We found Unite Urban Grille and were incredibly satisfied! I had the 8oz Hanger steak cooked perfect to my liking (medium). As for my friend's dishes, they were all AMAZING! The Unite Burger - fantastically flavorful. Everyone should definitely try the Shrimp Skewers (side dish or full entree). The mango salsa on the shrimp had the perfect sweet kick. Another friend had the salmon, which he enjoyed. And as for the desserts - WONDERFUL! We had the Peanut Butter Mousse Cake (gluten- free) and Lemon Layer Cake. Both were great! I would definitely suggest this place to anyone looking for terrific food in a chill environment.",0.9954,0.644,0.356,0.0,0.7400000000000001
2014-07-30,5.0,"Agreed to go to Unite Urban Grill with great hesitation.  Was I ever surprised!  Flatbread was kinda standard but the ribs were outstanding and the desserts alone were worth the trip.  Good beer selection,  very good bourbon selection, whiskey and scotch standard fare.  I would highly recommend a visit. May not be to everyone's liking but the choices are diverse enough to give everyone an option",0.9777,0.611,0.342,0.048,0.4586363636363636
2014-07-29,5.0,"I was invited back here with the promise of a revamped bloody mary and boy did they deliver! I went with my fiance for dinner (rather than brunch, although both menus are fabulous) The re-worked bloody mary was clearly made fresh, with quality ingredients and a fantastic kick! The presentation was lovely and the garnish high quality, with a lovely cheese and sausage to soothe the kick of the cocktail.  For dinner, I split both the watermelon salad and the French Dip sandwich, YUM! The watermelon salad with feta, arugula, and heirloom tomatoes was amazing, certainly a generous enough portion to constitute an entire meal. The balsamic drizzle and onions gave the perfect bite to a juicy meal.  The French dip was delicious; crusty bread that softened perfectly into the well seasoned au jus. The sandwich itself was a balance of smooth creamy cheese, and a nicely spiced mustard alongside the tender, uber-thin roast beef. Alongside a generous heaping of fresh fries, Unite Urban Grill really outdid itself tonight.  Honestly, as great as the food was, what impressed me most was the attentiveness to customer service, both from the staff and the owner himself. As I mentioned earlier, I was invited back in response to my previous review, showing a true dedication to give the best restaurant experience possible and personal interest in their patrons. I really appreciated the effort made to contact me about the update and that level of care and dedication is certainly apparent in the quality of food and service I received today.  All in all, fantastic, flavorful foods, delicious drinks, and a great staff. Unite Urban Grill has really hit the top of my list.",0.9981,0.693,0.289,0.017,0.5496843853820599
2014-07-23,4.0,"FINALLY!!! When I ordered my steak rare, it actually was delivered to my table.....(wait for it, wait for it) RARE!!! Thank the red meat stars!  I don't know why it's so hard even in great Midwestern steak houses to get a steak the right temperature.  But Unite did it. Bless their grill master's beating heart.  The rest of the food there was nice, the crunchy salad was nice but nothing that I couldn't make in 3 shakes of a spoon at home.  My hubby's burger was nice looking. I didn't get in between him and the bun otherwise I could tell you what it tasted like.  The couple at the table next to ours said their food was good but by far my steak looked the best.  Maybe it was my moaning while eating that made their own food seem less thrilling.  I will say, the manager/owner came around and was super nice about checking on us. Kudos for that warm gesture - I dig it.   However, our server returned after taking our wine order with a sample of another wine claiming that our bottle had to be pulled from storage and would take a few minutes, but wowwie, lookie here, we have another bottle of Hahn that is handy, would we like this one instead...it was his favorite!  Nice job on the attempted up-sell my man.  I've worked in restaurants, I get it. Get that check as high as you can so your tip will be better. Fully understand.  But come on?  Our bottle was a nice $40 Malbec, he came back with an $80 Hahn that sucked.  I'm not going for your suggestion because a) I didn't ask for your advice; b) I'm not doubling my wine spending tonight based on a sample and c) way to not be subtle about the up-sell.  I'm happy to be up-sold on lots of things like a side salad, dessert, an app, heck a bigger hunk of that awesome steak but approaching us to double the cost of our wine based on your unsolicited advice.  Thank you but no.  Kind of a stretch. Don't get me wrong...I will be back to get my rare steak.  I'll just have to continue to be firm about my wine selection and as always thank the manager/owner for his awesome restaurant!",0.9979,0.766,0.207,0.027,0.630017857142857
2014-07-20,2.0,"It was hard determining how many stars to give this place, because I had such an odd experience here. My girlfriends and I came here for dinner on a Saturday night. The atmosphere is modern and stylish: I liked the decor, but not the fact that the place was ridiculously loud almost the entire night. The bathrooms were super clean, which is always a big plus. Service was above average and the food was fairly priced, considering the fact that we were eating in West Town and received a decent amount of food for our money. Now on to the actual dining and drinking experience. First, the drinks. Unite Urban Grill offers a variety of innovative specialty cocktails. I am a pretty adventurous drinker, and I happily downed a few Logan Squares, and sampled my friend's West Town and Pilsen. At one point during the evening, I attempted to order a French martini, and they couldn't make it for me because they were out of pineapple juice, which seems like a very odd thing for a bar to run out of, but oh well. Overall, the cocktails were very good. On to the food itself. The appetizers were hands-down the best part of the meal. Our group shared the Spinach Flatbread and the Lamb Meatballs, which were both divine. For entrees, one friend ordered the Lake Superior Whitefish, which she was very happy with. My other two friends each ordered the Vegetable Gratin, which I sampled and thought was good, but nothing more than that. The flavor was a bit bland and the eggplant was a little on the tough side.  I ordered the French Dip Sandwich, which was by far the worst entree at our table. The roast beef was this very odd shade of pale elephant gray and just did not taste too great. My sandwich came with a ton of fries, which were excessively coated in salt, to the point that I could only eat a few of them. It was not good. To compensate, I sampled some of the vegetable appetizers we ordered for the table, including the asparagus and the brussel sprouts, both which were very good. For dessert, we all shared a piece of the lemon cake, which again I thought was just okay. Nothing special. So why does this average dining experience deserve only a two-star rating? Well, after I went home, I was up all night, sick as a dog. It was not pleasant. Could it have been due to something I ate that night? Maybe, but I had no way of knowing for sure...until I talked with one of my friends the next day, who told me that she also was sick to her stomach the same night after our dinner. Two very upset stomachs at the same time on the same night, right after sharing a lot of the same food does not sit well with me, my friends. For that reason, along with the mediocre dining experience in general, I will not be returning to Unite Urban Grill.",0.9972,0.74,0.188,0.072,0.5272850035536601
2014-07-20,4.0,"Yum!  My fiance and I went here for here for his birthday dinner date. He was seeking a place that was still in the two price-sign range for entrees but fancy enough for a special occasion.  He also always wants great steak for his birthday.  I have to say, this place fulfilled all of these requirements perfectly. The meat dishes we got were really the stars here.  He got the NY Strip Steak medium rare and I got the Hanger Steak also medium rare. Both cuts were juicy and bursting with flavor. The seasoning/marinade on both was delicious and they were cooked perfectly. The service was also fantastic. Our waiter was knowledgeable, helpful, and friendly. And the manager checked up on us after our meal and made us feel extra cared for.  Only not five stars because our side of asparagus was good but not amazing and our side of mushrooms was weird to us...maybe too many earthy-tones...I'm not sure what it was.  In general, I'm really happy with our dinner here and will be planning to come back and try additional dishes (especially other meat dishes!).",0.9945,0.711,0.24,0.049,0.6765355417529332
2014-07-14,4.0,"Great new restaurant.  They have a nice bar, a section in the front where you can just relax and have some drinks with friends, a more formal seating area for a meal, and they have a little outdoor area, so they kinda have it all! Loved the vegetable gratin.  Wished the portion was just a little bit larger.  The shrimp kabobs were delicious as well as the special cocktails.  Was a little disappointed in the amount of time that it took for us to get our food, but overall we had a good experience.  I definitely recommend!",0.9725,0.708,0.274,0.018,0.5950649350649351
2014-07-06,5.0,"Woah.. Best French toast of life. Hands down. I'm not even a big fan of French Toast, but my husband ordered it and of course I just had to try it. I don't know what they do to it, but the slices are as thick as 2 slices of Texas toast, and the outside is crispy but the inside is soooooo moist and delicious it should be illegal. Definitely get the French toast!",0.7279,0.782,0.14,0.078,0.29217171717171714
2014-07-06,5.0,"Watch out Flo! The new kid on this block is about to steal the spotlight soon for brunch!! The service was fabulous and our server Casey was very friendly with a cute sense of humor.  The veggie burger, stake and potatoes were prepared with delicate detail.  Will definitely come back again for brunch and recommend this place to friends and family.",0.9428,0.612,0.306,0.082,0.6435064935064936
2014-06-26,4.0,"Went to Unite recently for brunch and was really impressed! The service was amazing - super warm and friendly and super accommodating. We originally sat inside because of the patio being full, and as soon as a spot opened up, they came to let us know and move us outside swiftly and easily. The specialty cocktails for brunch are fantastic - really creative and well balanced. I wish they had iced coffee ready, as my order of iced coffee got very watery quickly because they simply added ice to hot coffee.  The food was exactly what I was looking for - unpretentious and delicious. Will definitely be back.",0.9922,0.655,0.345,0.0,0.591609977324263
2014-06-23,5.0,"A big group of us had a great experience at Unite.  The appetizers included the best olives I have ever eaten and delicious flatbreads.  For mains the hanger steak, ribs and shrimp skewers were great. I love the ambiance of the room.  It is stylish yet comfortable and warm.  It is like 3 rooms in one.  The front of the restaurant is a comfortable lounging eating area next to a large open window.  The middle includes the bar and booth seating and the rear of the restaurant in front of the kitchen worked out great for a party of 24.  There is also nice seating on Chicago Ave.  The wait staff and bar tender were friendly and very helpful.  We loved it and will be back.",0.9944,0.667,0.333,0.0,0.5489285714285714
2014-06-21,5.0,"This was our first trip to Units. Great food and service. Everyone was very friendly, from the hostess who sat us to the owner who stopped by our table to thank us and ask for any suggestions on how they can make the experience even better. Our server was very helpful in guiding us through the menu and provided us a few suggestions (salami and sausage flatbread and most of our sides) that were all awesome. Unite is a treasure for this part of the neighborhood. I'll be back on a regular basis.",0.9661,0.772,0.211,0.018,0.42102564102564094
2014-06-21,3.0,"Although Unite is my rebound boyfriend due to Flo's popularity and negligence of my existence, he is so sweet and nice that makes me feels bad for dumping him for the next guy.  What makes Unite a great rebound? 1) He is a gentleman who makes sure that your glass is filled with water 24/7. 2) Despite the fact that he does not have soy milk, he tries his best to provide you a substitute - skim milk.  3) He is soft-spoken, clean and fashionable. Why do I hesitate in going on another date with Unite? 1) The food is decent but not memorable. For my granola, I like the fact that the yogurt is not too sweet. However, the dried fruits overpowered the yogurt and the rest of the ingredients. 2) The selection of tea and coffee is limited. My favorite chai tea is not available. However, it is great to have early grey as an option. 3) Unite has many competitors, such as Bongo Room and Feast, in the area. In order to stand out, Unite has to serve a unique dish.  After reading this review, do you think I made the right decision of dumping my rebound boyfriend?",0.9763,0.793,0.159,0.048,0.5910317460317461
2014-06-17,5.0,"I love the decor, I have never had a bad server and the owner is always amazing! I have been going here since the first week they opened. Even when I bring in my 14 month old son, they are always playing with him and suggesting things for him to try. Great addition to the neighborhood.",0.952,0.73,0.27,0.0,0.5750000000000001
2014-06-12,4.0,"Recently dined here while on a whirlwind weekend. I hail from a great restaurant city  (L. A. ) so my expectations are high. I was very impressed with this place. From the food selections to the service everything was outstanding. The wait staff were very familiar with the menu and made excellent suggestions in the pairing of foods with beverages i. e. IPA's. The portions were substantial enough to share among the table. Everything ordered was prepared with expert care and was extremely tasty. I would recommend the salmon crudo, pork ribs, and goat cheese ravioli. Don't forget the toffee sticky pudding for dessert. Go to this place NOW.",0.9799,0.754,0.246,0.0,0.7294444444444445
2014-05-31,2.0,"Nice people, good service, like the space. Was less impressed with our entrees. The burger was very greasy (2 patties stacked) and the ribs were a bit tough. Didn't enjoy the homemade BBQ sauce either. Hoping they hit their stride as that specific spot on Chicago Ave has had issues keeping doors open.",0.8651,0.715,0.219,0.066,0.5472222222222223
2014-05-18,5.0,"Everything about our experience was amazing.  Our server was friendly, helpful, knowledgeable and prompt.  The lamb meatballs just burst with flavor along with the fabulous sauce.  Whitefish had a delicious crusty coating that was light.  The quinoa had a lovely combination of flavors and the roasted broccoli had a fun kick.  My friend who eats gluten-free had the vegetable gratin...it just doesn't get better than this! Fabulous food in a hip, fun atmosphere that doesn't break the bank. BINGO!",0.9862,0.634,0.342,0.024,0.675
2014-05-06,5.0,Unite Urban Grill cannot disappoint! Our first visit was a few months ago for Valentine's Day. I've dreamed about the lemon farro with roasted cauliflower ever since! Tonight we returned to celebrate my husband's birthday. He ordered the hanger steak for a second time and I had the babyback ribs - both amazing. Unite will have us returning not only for the food but because of the wonderful owners too!,0.9063,0.834,0.166,0.0,0.4761904761904762
2014-05-06,5.0,"This place is so close to our house and has become a to-go place every time we are in the mood for drinks and good food.  We love having this place at our neighborhood by the way.  Food is yumi, drinks are awesome, and the management and owner are ubber friendly! I recommend! :)",0.9661,0.692,0.308,0.0,0.74
2014-05-04,5.0,"Unite is a phenomenal addition to a rapidly growing restaurant corridor on Chicago ave.  After experiencing two dinner outings and trying the brunch today I can confidently say that Unite offers a delicious, consistent meal with a perfect atmosphere. When you walk in, you're greeted with a spacious waiting area/lounge where you can grab a pre dinner cocktail (from their phenomenal cocktail list) or wait for a table. The rest of the space is laid out nicely with a great vibe. The steaks are fantastic and the sides are equally delicious.  On top of that, the service is top notch and very personal. On two occasions, the owner has made it a point to come out and ask how the meal had gone and to talk about our night. Additionally, the servers are all personable and too off the experience.  Finally, brunch was executed perfectly with a nice variety of simple savory and sweet dishes. Perfect way to finish off a weekend.",0.9922,0.746,0.254,0.0,0.7065238095238097
