date,star,text,compound,neutral,positive,negative,subjectivity
2015-11-15,1.0,"Where do I start with The Belmont Cafe? My boyfriend and I have visited the restaurant twice now. The first trip was below average. The food was greasy and the service was slow. We decided to give the place a second shot after we were turned away from the local Ann Sather's restaurant because of the extremely long line. What we quickly learned is that we should've sucked it up and endured the pain of the line across the street rather than suffer the atrocities of The Belmont Cafe that day. Our second visit began on a beautiful fall day. The restaurant was about one-fourth full at the time we arrived, with a large party seated next to us. It took about 5 minutes before a waitress first encountered us. It appeared as if there was only two waitresses in the entire restaurant. As a result, we decided to order immediately to speed up the process. We knew what we wanted since we had been there once before. I ordered what I think to be a simple breakfast: two egg over medium, toast, and a side of sausage. My boyfriend created his own skillet in which one of the ingredients was bacon. The waitress immediately informed us that they were out of bacon. HOW IS A BREAKFAST CAFE OUT OF BACON? HOW? It's a breakfast staple. Regardless, we additionally ordered some coffee and OJ and the waitress notified us that she'd put our order in ahead of the large table next to us. What a nice lady. From my recollection (as this visit was roughly a few weeks ago), it took 5-10 minutes to receive our coffee and OJ. She served the coffee without cream and sugar either. Our waitress would disappear for long stretches at a time, so it was difficult to flag her down for these missing items. Additionally, the OJ was served with ice cubes in it. I personally have never seen OJ served this way before. Regardless, it was bitter, sour, and not fresh whatsoever. As an avid OJ drinker, I was disappointed from the start.  After a brutal 20ish minute wait, our food was served. Apparently, the simple breakfast I had ordered was not so simple for The Belmont Cafe. The ""over medium"" eggs were extremely runny, the toast was not even toasted, and the sausage was rubbery. My boyfriend's create your own omelette was twice as greasy as the first time. His toast was also NOT toasted. In addition, the toast was only served with that mandarin orange jelly stuff. Where was the classic grape and strawberry?  After we decided we had had enough, we asked for the check. This was another 10 minute process as the waitress continued to disappear time after time again. Overall, this was a horrible, horrible experience and we will not be returning.",-0.9712,0.889,0.032,0.079,0.4956619769119769
2015-11-15,1.0,"This place is weird in a sad, creepy way. My friend and I were just there for some late night snacks, all our favorite froyo places were closed and Clarke's is gone. We were hopeful about Clarke's replacement but left disappointed. The vibe is unwelcoming, the staff is rude, the lack of service made my skin crawl.  We left before we could get our food because the servers watched as a homeless man harassed the restaurant for change. It was awkward and uncomfortable, the servers also ignored us as we left. It was clear we were not welcome there.  I never plan on visiting this crapfe again.",-0.9685,0.688,0.075,0.237,0.6222222222222221
2015-11-15,1.0,"I would give zero stars if I could. Had a crazy craving for blueberry pancakes and figured a diner would do the trick. My boyfriend and I ordered thru grub hub. I got a simple order of blueberry pancakes and a side of ham with a coke. The bf got ""the Hangover"" burger which boasted bacon, egg, and buffalo sauce on a pretzel bun.  We started getting mad when an hour and a half passed by and the food had not arrived. I called the restaurant and a woman with a heavy accent answered, stating ""I guess so"" when i asked her if my order had left the restaurant recently. When I asked for a time line, she say ""I don't know maybe 5 minutes I guess?"" Ooooohkay, I was definitely not expecting the best at this point.  Moments later we heard the sweet sound of the doorbell ringing. The bf returns with the bag in tow, and I instantly was put off that I payed $3 for a ""coke"" (it was actually RC, false advertising) in a 12oz to go cup, not a can like I was expecting because as I figured, the drink was flat.  Ok let's get to the food. My pancakes (which should have been simple enough) were soggy, cold, and plain with some blueberries scattered about and a ton of blueberry syrup drizzled all over them. They were NOT advertised that they would be soaked with artificial berry syrup and I would not have ordered them if I knew that. Oh and my $3 side of ham? I stared at it for 1 minute before I remembered I even ordered it, since I couldn't even tell what it was. Two tiny scraps of meat that I could see through.  Boyfriends burger: stale pretzel bun on a medium well burger. Granted there was no option to specify how he wanted his meat cooked, but I tell you this he wouldn't have asked for a hockey puck if he had the chance to. He opted for the sweet potato fries. They were soggy, cold, and extra salty. Mmm yummy! He said the only thing that saved the flavor of his flavorless burger was that it doused in hot sauce.  Would we have had the same experience if we dined in? Maybe. Maybe not. But I tell you one thing, I have ordered from many diners before and they were pretty good experiences and didn't take 90 minutes. I cannot believe I wasted $35 here. ""The Belmont Cafe"", if you don't figure your s*** out, you will end up like your predecessor Clarke's, which was, sad to say, a much much better restaurant and I will be sure to NEVER be back as well as spread the word to everyone willing to listen to me.",0.982,0.867,0.096,0.037,0.528780284043442
2015-11-09,5.0,"Hottie Jon is the best, he bussed our tables good. Love his enthusiasm and work ethic! Give that boy a raise!",0.9411,0.52,0.48,0.0,0.5
2015-11-08,1.0,Twenty minutes to get coffee.   Thirty five minutes later for omlets. Twenty minutes to run out card at the end.   Completely empty restaurant and I see why.,-0.2716,0.923,0.0,0.077,0.25
2015-11-05,5.0,Tested out Belmont Cafe a few weeks ago and loved it.  The service was fantastic and food came out quick.  Had a half order of cinnamon roll pancakes and half pretzel. Both were amazing and I can't wait to go back and try more!,0.9117,0.766,0.234,0.0,0.44814814814814813
2015-11-05,4.0,"Okay people, overgrown teens and yuppies included, get over Clarks.  I grew up a fan of Clark and Belmont, and still never went to Clarks.  It seemed overcrowded with people who weren't doing more than drinking coffee for hours or in their for the bathroom.  I'm sure people went there to eat, but my friends didn't.  Wasn't something for me.  I want to go to a restaurant or cafe and eat, drink, and leave.  Not buy coffee at midnight trying to act cool.  What type of business is that.   So, when I noticed it wasn't Clark's anymore I was genuinely interested.  Honestly my first impression was very positive; there was a man (owner/manager/employee) washing the windows outside which I never saw before when Clarks.  A girl was waiting at the host stand when I walked by looking at a menu, which I felt was pretty inviting.  When I walked in she was ready to seat me, hand me a menu, and get me whatever I wanted to drink.  It was completely empty (people came in after me), so I felt that the service was fine.  When I worked as a server those slow times were times to hide away and steal a minute, but this staff was ready and waiting.  Breakfast all day- ummmm, yes.  I got the Eggs Benedict, a personal favorite.  It came with potatoes, and choice of toast or pancakes.  I was also handed a 10% off coupon with my water, and offered a free cookie either while waiting for my meal of after. I thought that was sweet.   When I was eating the staff seemed rather active, and a waitress who wasn't my waitress even stopped by to see if I wanted some plates cleared off.  I hadn't see my server in a little bit since there were other customer she was busy attending to, so I thought that was nice.   Any who, sorry about the yuppies comment.",0.9959,0.749,0.211,0.04,0.5856797138047138
2015-11-01,2.0,"Food is awful, just awful. If you need late night food in the area go to Subway. I don't see this place staying open for long....Clarkes was 100x better. Staff is great so giving it 2 stars for them...their 5 stars plus the foods 0 stars average to a 2.5 but food was so bad I can't round up...",-0.6887,0.737,0.103,0.16,0.6462962962962964
2015-11-01,2.0,"Nice staff, nice atmosphere. Terrible service. 43 minutes for food, inattentive to table needs like coffee, water, and silverware. And then they messed up the order....twice",0.3818,0.607,0.234,0.159,1.0
2015-10-31,1.0,"The absolute worst service I've ever received at a restaurant. The place wasn't even busy and I was waiting over an hour for my order, which I never received. I waited patiently and yet there were people who were seated and got their food before me. All I heard was ""One more minute"", ""Just a few more minutes"". Utterly disappointing experience. I could not disregard this place quicker.",-0.7931,0.857,0.027,0.116,0.5714285714285714
2015-10-31,4.0,"Ouch!  It's not that awful yelpers!  Maybe we hit it at a decent time, lunch time so we missed the hungover breakfast crowd and maybe they fall apart at dinner time but our service was just fine.  It's a diner people.  Nothing more, nothing else.  They have a huge soft pretzel that is as big as Donald Trump's head so if you need a carb fix they have it.  They have meatballs too.  I love meatballs and usually you don't find them at a diner. I enjoyed their warm goat cheese appetizer and my blt was great.  Fries were hot and cold or lukewarm fries are a huge deal breaker for me so I was happy.   Great coffee too. Prices are decent, portions are legit and it's not a chain.  Stop your whining.  It's a new restie, they'll get it together and if not carry on with your bitching.",0.9904,0.716,0.245,0.039,0.6598883572567783
2015-10-29,1.0,"Bad enough for me to register for the first time on Yelp just to write this.   I had a sandwich and it was very bad.  Sloppy and didn't taste good.   The service was not good. Slow and they seemed kind of bored.  Unapologetic about their credit card machine not working.  They kept me hanging for about 15 minutes as they tried to start and re-start the machine (after they told me it was my card).  Had to run down the street to an ATM to get cash.  The server seemed to wander around, confused. Saw people come in and sit down and, after waiting for almost 20 minutes, got up and left.",-0.9216,0.842,0.021,0.137,0.5638888888888889
2015-10-25,1.0,I went here this morning to grab brunch with some friends. Not only did we wait a long time for our meal but not a single one of our orders came out complete. We had to ask our waitress three times for ketchup and then someone (not our waitress) was bringing out our food and forgetting everything. When we got our bill they tacked on several charges we were not informed about before ordering. The food was good but the service was awful enough I would never go back again.,-0.1901,0.867,0.062,0.07,0.4571428571428571
2015-10-24,1.0,"I hadn't been to boystown in a while and was excited to go to Clark's but saw it was replaced with this restaurant. From the moment we walked in, the host was rude. Waited there for five minutes and was greeted with, ""Why didn't you tell me you were there?!"" I don't know, cause it's your job to notice we were waiting. We were seated and our orders were taken. The selections are reasonably priced and there was a good variety of different entrees. My food was undercooked and the fries were a pile of grease. After an hour, we still didn't get our food and customers ended up just leaving, (we ended up eating 2 hours after and I didn't even finish it). All the servers looked frazzled and it was completely unorganized. This establishment was supposed to be open 24 hours and they were turning people away. People were getting upset, and the way management handled it was unprofessional to say the least. I remember hearing remarks like, ""Sorry man we are closing. We aren't serving anymore. You are gonna have to go."" No apologizing, no rectifying the situation. In the end, I'll never eat at this place again. Cheesie's it is!",-0.8585,0.851,0.053,0.096,0.6055555555555556
2015-10-23,5.0,"Came in for lunch yesterday and was thoroughly impressed! The food is delicious, I got the chicken parm, recommended to me by my server. Great recommendation, and awesome service. Thanks for that Milan! Coming back soon, and highly recommend!",0.974,0.567,0.433,0.0,0.68
2015-10-22,5.0,"My friend and I went to The Belmont Cafe today, glad we did.   Our breakfasts with buttermilk pancakes rocked.  In fact both of us couldn't finish everything so we had treats to bring home.  The price is reasonable and with the special Groupon, you cant go wrong!  A big thank you to Milan, who kept our coffee cups full while enjoying our chat today.  Looking forward to another visit soon!",0.9512,0.776,0.224,0.0,0.6173469387755102
2015-10-20,3.0,"The food wasn't too bad. I was hoping for a better selection in breakfast (I'm not complaining about it) although, the place was well decorative. I would consider going back again.",0.8818,0.653,0.347,0.0,0.38888888888888884
2015-10-12,2.0,"Decided to give the place a try today.  The place was not busy...only two other tables had customers at them. I ordered the omelette with bacon, cheddar and caramelized onions, which came with a side of potatoes and I opted for the pancakes (as opposed to toast).  First of all, the onions were not even close to being caramelized.  They were barely cooked at all.  Not a good sign...don't put it on the menu if you're not going to do it.  Also, there was a very little amount of cheese and bacon in it, and the ""bacon"" may have been canadian bacon...I honestly couldn't tell.  The potatoes were decent but a bit greasy, and the pancakes were good enough, but nothing I'd specifically go out of my way to order. And although there were only 2 other tables in the restaurant, my server didn't come over once during my meal to check on me.  I had to ask for my check after he walked by a couple times after it was obvious that I was finished with my meal.  I could give him a break if the place was really busy, but it wasn't.  If I'm the owner of a new restaurant that is trying to win over the new neighbors, I would stress to my servers that CUSTOMER SERVICE is #1 priority at their jobs.  Pretty disappointing.  I doubt I'll be going back anytime soon.",0.7227,0.881,0.072,0.047,0.5215311004784688
2015-10-10,4.0,"I'm really surprised at some of these negative reviews, though I am from out of town and am not familiar with Clarkes or whatever this place was before.  My friend and I were in town for a concert at The Vic Theatre and decided to give this cute little diner a try for dinner before the show and I'm glad we did.  Our burgers were delicious and the potatoes (he had fries and I had their breakfast potatoes) were good too.  The staff was very friendly.  I would definitely eat here again if I'm in the area.",0.965,0.741,0.225,0.033,0.7050000000000001
2015-10-09,3.0,This was my first stop in. The eggs and breakfast potatoes were delicious. The service was pretty laid back so I didn't feel rushed to eat. While the service was not super fast they were very nice and welcoming.,0.8321,0.634,0.261,0.106,0.6571428571428571
2015-10-09,4.0,"The food is still good, but the service was OK at best.  Before the remodel/rebranding the service was great.  Might be back.",0.9601,0.51,0.49,0.0,0.43000000000000005
2015-09-27,1.0,"This place is the worst. My sausage omelet didn't have a single piece of sausage in it and instead of red peppers it had tomatoes. Everything I ordered was cold. The eggs were soggy. Gross, will not be going back.",-0.802,0.833,0.0,0.167,0.36904761904761907
2015-09-27,2.0,"These guys can cook a good meal but the service is very slow. Have been there 3 times since they opened, since Ann Sathers can get very busy on the weekend, and the service is always slow. If they had better, faster service they could do very well considering the location and food quality.",0.8355,0.846,0.154,0.0,0.45166666666666666
2015-09-22,3.0,"Went for breakfast for dinner (who can pass up all you can eat pancakes for $1/piece). Pancakes were yummy, but a little dry. My bf got the grilled cheese which was pretty standard. Only memorable part was their take on iced black/red tea.",0.7579,0.86,0.14,0.0,0.6833333333333332
2015-09-20,1.0,I ordered from here today and everything was awful. The eggs benedict I got was over cooked. The sauce on top looked like it had been spoiled or sitting in someone's car all day and any thing I asked to be added to my meal was completely forgotten. I even got pancakes and they completely forgot the maple syrup. I waited over an hour for this meal and the only decent thing about it was the coffee.,-0.2247,0.877,0.055,0.067,0.6611111111111111
2015-09-11,2.0,"My biased opinion of Clarke's being gone aside, the Belmont Cafe lacks service and food quality.  We ordered two appetizers, chicken fingers and baked goat cheese, and the Mediterranean salad. The baked goat cheese appetizer ended up coming 20 minutes after the salad and chicken fingers and was essentially a giant bowl of marinara with a dollop of goat cheese on top and four triangles of bread. The salad my friend ordered had cucumbers that looked past their shelf life by color. My chickens fingers were fine, but it came with a side of goat cheese instead of ranch and the other sauces promised in the menu. The waitress said the cooks must have thought we wanted that in addition to the baked goat cheese? Makes no sense to me either. We were confused and asked the waitress for our sauces and whatever chipotle flavored gunk she brought back was inedible. On top of all of this, we were charged an extra dollar for that random side of goat cheese, which the waitress did take off when I asked her to.  The waitress has obviously never waited tables before. She was aloof and spent more time watching TV than cleaning our table of dirty plates and replenishing our coffee and water. We also asked her to split the check, a simple task that she still managed to mess up.  I'm sad Clarke's is gone and really hoped this Cafe would work, but I surely won't be going there again.",-0.5734,0.855,0.067,0.077,0.516477702191988
2015-09-07,1.0,"We entered this place at 2:30am. It was packed and there were a lot of people still eating. We were given menus and water five minutes after we came in. Ten minutes after we received the menu some guy came up to us and asked us: ""You didn't order yet did you?""  To which we replied ""No we're waiting to be served."" So he says ""Oh sorry about that. You shouldn't have been given menus.  The chefs are literally walling out the door."" I'm very disappointed at the lack of professionalism of the staff. We were really excited to try the food...",-0.6705,0.89,0.025,0.085,0.68125
2015-09-07,3.0,Stopped by this place for their $1 buttermilk pancakes. But bad but not that impressive either...,-0.7394,0.642,0.0,0.358,0.8333333333333333
2015-09-05,1.0,"Clarke's was OK. It was a good late night spot after catching a show. Belmont Cafe, however, is awful. The fries are soft and limp, sandwiches are bland (some mayo would be nice!), the French toast is not really French toast (just weird chewy toast). Won't be coming back here again!!",0.4605,0.798,0.119,0.083,0.5602564102564103
2015-09-01,4.0,Good prices for a fair amount of food. One dish could easly be two meals.,0.6369,0.698,0.302,0.0,0.75
2015-08-29,2.0,This is the new Clarks and let me tell you I sure wish Clarks was still here. The food was ok but the service was not good. It took forever to get our food and our drinks. They said the back was slammed but honestly the place was not even full. It took over 45 min to get our drinks and appetizer. I don't foresee myself coming back soon.,0.6112,0.835,0.123,0.042,0.4866792929292929
2015-08-28,5.0,"Although I'm sad about clarkes closing, I'm glad this place is really great. I came here the other day and we got seated immediately. They were very attentive and nice. The food was seriously amazing. I got a burger and my friend got the cinnamon roll pancakes. We also split the Mac and cheese appetizer. Everything was seriously wonderful and came out very quickly. Great place and we will definitely be back!",0.9751,0.623,0.307,0.07,0.7775000000000001
2015-08-27,1.0,Clarke's is gone!!!!  But wait - this isn't about me and my love for divey and gimmicky cafe's.  Belmont cafe has completely remodeled the place. It's clean and pretty. The staff is friendly but a little slow. They are still learning. I ordered a coffee and was informed they serve Intelligentsia (yes!). The food was pretty good for the price and they serve breakfast all day which is another plus in my book.  I think if they could spend a bit more time training the waitstaff to have a bigger sense of urgency this place would have more stars overall. My waitress wasn't unfriendly but I waited a long time for my bill after the plates were cleared. I had to go to the counter to get my bill. It was 12.59 and she said thank you and just stood there after taking 15 bucks from me. I had to ask her to give me my change. She then gave me two bucks and no change.  I ended up giving her a better tip at the table but please train your waitstaff not to pocket tips from the money we give to pay for our order. This is a big no no.,0.9811,0.779,0.176,0.046,0.49444444444444446
2015-08-26,4.0,This was my 2nd time dining here and my daughter and I had a better meal this time for sure. We had a giant baked pretzel with cheese sauce to start. I had the steak and eggs with yummy hash browns. My daughter ate off the kiddie menu and enjoyed the chicken fingers. This place is family friendly for sure.,0.9468,0.742,0.258,0.0,0.6784722222222221
2015-08-24,1.0,"Thoroughly disappointing experience. The restaurant was empty when I came in at 5pm. I looked over the menu and selected the Fried Goat Cheese appetizer followed by Tuna Melt with Mac & Cheese. After waiting 25 minutes, the food began to arrive. I received my entree first and was told the appetizer was on its way. At first site, the Tuna Melt & Mac & Cheese looked very good, however, I was quickly disappointed. The Mac & Cheese was cold, or just barely luke warm. The Tuna Melt was cold as well. Another 10 minutes and my appetizer arrived. It was some melted goat cheese swimming in a bad marinara sauce. There was supposed to be toasted garlic bread served with it. I had to request the bread and was given a tiny, crisp slice with 2 pads of butter. Very disappointed. I asked for a manager and was informed that he's not there very often. After complaining about the appetizer, it was removed from my bill. I will not be returning to this establishment and would not recommend it to anyone. REVIEW UPDATE: I was contacted after my review by the Manager of the Cafe. In his response he apologized for the experience I had and offered to comp my meal on my next visit. I had said in my previous review that I would not be returning to this establishment, but now that I'm aware they still in their opening weeks, I will consider giving them another chance. Hopefully my second visit will be much better than my first one was.",0.8188,0.875,0.075,0.05,0.48595238095238097
2015-08-22,5.0,"Went to The Belmont for breakfast this morning, the skillet with hand cut hashbrowns was delicious and service was speedy quick. Got in and out within 30minutes, I would def recommend to a friend",0.8885,0.647,0.302,0.05,0.75
2015-08-22,1.0,"The wait here is atrocious...there were only two tables when we came in, granted there was a big group of us but it took the waitress almost 20 minutes just to take our order and another half hour to get our food when the place is dead!  One person in our group didn't even get their food. And the burger was bland and not worth $11. The ""sweet potato fries"" were basically bright orange flavorless regular fries. A vegetarian in our group got a meat burger instead of a veggie burger.  The waitress was very nice but that was the only nice thing about this visit at all.",0.8742,0.789,0.146,0.065,0.5939102564102564
2015-08-19,5.0,Try the pretzel!! It is soooo good!  Great menu options. This restaurant just opened and is in a great location. Excited to see how it grows!,0.94,0.589,0.411,0.0,0.7125
2015-08-12,2.0,"Good food, horrible service. 40 minutes is WAY too long to wait for breakfast food. When it finally did arrive, the waiter told me my side of toast would be right out. About ten minutes later, he walked by our table and said, ""Oh right, toast!"" before finally going to get it. He had also forgotten the ketchup we asked for, and didn't seem to notice that our water was completely empty. Keep in mind there were only four or five other tables with customers at the time, so they certainly weren't overwhelmed with business. The food was good, though. I recommend getting takeout so as to avoid the painfully slow staff.",-0.425,0.797,0.087,0.117,0.5678571428571428
