date,star,text,compound,neutral,positive,negative,subjectivity
2015-08-10,2.0,"Service was negligent.   Our drinks were refilled one time over 2.5 hours.  They did not have sugar free syrup, imperative for a diabetic food plan.  Any diner that serves breakfast should have options.  They did seem to have some health conscious choices.  The new decor looks much better than its predecessor.  I might try it again, but first impression was that they weren't that concerned about giving quality service.  The restaurant was not busy at the time and there were multiple servers.  Seems like other reviewers had the same experience.  Hopefully they will find tune their approach because their location is prime and people want to eat there because of the hours and convenience to the train.",0.9153,0.861,0.125,0.015,0.37643097643097645
2015-08-10,1.0,"This place still has a few kinks to work out, 'cause right now it sucks at being a diner. Seated at 10:35 am on a Sunday morning, ordered at 10:45. So far so good. FORTY-FIVE minutes later, our two omelets arrived. And we weren't alone in the absurd wait - the group of dudes in a booth across from us waited about 30 minutes, got up, and left.  Food was decent (pancakes are outstanding!) but not worth the glacial pace.",0.115,0.899,0.053,0.047,0.47067099567099563
2015-08-10,2.0,"The service was unbelievably slow and it took them an hour to bring our food out due to a ""stove issue.""  The portion size was laughable and we had to continuously ask for refills. The waiter also got our drink orders wrong and we had to request new ones.  They also forgot to put bacon on the poorly assembled mac and cheese burger and we didn't even bother to ask for it as it would've taken even longer.  The food was pretty good once we got it, which is the only reason this isn't a one-star review. However, it was not worth waiting an hour for.  I've never written a review before but this service was so remarkably bad that I felt I needed to warn others before they try it.",-0.7115,0.872,0.049,0.078,0.6451101928374656
2015-08-09,1.0,"I really wanted to like this place. It's close to my apartment and had the promise of a local no-frills brunch place. I was supremely disappointed and will not be back. Service was horrible - 10min for coffee, 30min for food Portions were too small - Their skillet failed to even fill the skillet plate they put it in The food was subpar even for standard breakfast food The brunch competition around here is stiff, and unless they can turn this place around quick I imagine they'll be gone in 6 months",-0.2815,0.809,0.09,0.101,0.365
2015-08-09,2.0,"Came at midnight on a Saturday night. Service was ridiculously slow. Our server Celia seemed to want to avoid our table. She'd walk right by and we would have empty soda glasses that we had to stop her and ask for a refill.  Our food took over 30 minutes from the time we ordered, and the restaurant was not that busy. She never came and apologized for the delay. I had to ask someone else to check on our food. Also I ordered my steak sandwich medium and it came extremely well done. But she didn't come by and ask how the food was until we were almost done with the meal.  Either they train their servers or they are going to go under.",-0.8003,0.871,0.029,0.1,0.5471428571428572
2015-08-09,1.0,"Uh. No! This place sucks. The pancakes were dry and hard. The other food was just so so. The service was very slow even though the diner was only about 1/5 full. A resounding NO! UPDATE: As I figured this business wouldn't last long. They are now closed. Clarke's really should consider coming back. It's an ideal location for dining. UPDATE 2: So a few days after my update, I'm riding past on the redline, and I see Clarke's is back in thia space. Breakfast there tomorrow!",-0.6714,0.854,0.037,0.109,0.3752083333333333
2015-08-08,1.0,"Put simply, the food was bad. Skillet and pancakes tasted like they were microwaved. There are a lot of better brunch options around the area.",0.2263,0.702,0.181,0.117,0.5079365079365079
2015-08-03,1.0,"Don't waste your time. I attempted to dine at The Belmont Cafe last night with my girlfriend around 10:30.  Their posted hours said they were open until midnight so we figured we were fine.  Upon entering there was no one to greet us, so we decided to seat ourselves (they were pretty dead, so there were plenty of places to sit).  We saw one server working who was with another table, and after a few minutes he did come over to let us know he would be right with us before heading into the back of the house. After about ten minutes passed by, the server finally came back out.  He said something to another table and then went straight to the back of the house again.  Finally he emerged again a few minutes later, only to turn right back around without ever coming by our table.  At this point we had been waiting for about 15 minutes with no service, so we decided to give up and left. It's possible this server was too slammed to get to us (there were about 3 other tables seated) or it's possible he didn't feel like dealing with another table and purposely ignored us.  Either way, the restaurant wasn't properly staffed, I won't be back, and I don't think this place will last.",-0.3773,0.893,0.05,0.057,0.3585097001763668
2015-08-02,1.0,They must have had an off day.  45 minute wait for food that was prepared wrong. Maria the waitress was excellent. She should work at a more worthy place.,0.6901,0.669,0.245,0.086,0.85
2015-07-31,4.0,"What is this marvel? A cinnamon roll pancake?  Get it and love it.  Unfortunately, They played Lynard Skynard, ew. Kept them from 5 stars.  Haiku review.",0.8321,0.613,0.313,0.074,0.8
2015-07-30,4.0,"What an improvement over Clarke's! If I'm going to get boozed and turn up somewhere and make bad late night food decisions, I'd rather it be in a restaurant that's aesthetically pleasing.  Admittedly, I can't vouch for the food with a clear conscience. I was a bit too far gone at that point to be relied upon, though from what I remember I was very satisfied when I left. Alas - I'll post an update when I go again with a clearer head.",0.7773,0.786,0.147,0.067,0.6642857142857144
2015-07-30,4.0,"Service is great, had their skillet with ham on the bone and eggs over easy with caesar salad with homemade croutons. Everything is home based fresh produce except they buy their pancake mix... They would have received a 5 if they had made their own pancake mix.",0.8519,0.819,0.181,0.0,0.7708333333333334
2015-07-28,3.0,"I will never come back to this place. The food is good but the service is horrible. Only reason for the stars is the food. Right when we walked in our server was complaining to the manager or owner about how someone didn't show up and he wasn't staying but the owner disagreed and that convo happened at the hostess podium before even greeting us when we walked in.(Real professional) Therefore, the waiter was very visibly angry to be waiting on us. I understand it's frustrating when you should be cut, but don't take it out on your customers! We didn't even receive our drinks until AFTER our food came out! Which by the way, we were one of two tables and the food took pretty long to come out. I get that they just recently opened, but I will not be coming back. This place should have re opened as a fast food joint or a bar.",-0.9217,0.819,0.055,0.125,0.5489795918367347
2015-07-27,1.0,"First of all, they took a great old diner space and ruined it with trendy accents like a huge and idiotic print on the wall that screams ""EAT.""  After the service and the food that we experienced, I would not go back unless I were sentenced by a judge to do so.  The waitress clearly hadn't received any training at all.  It took forever for anyone to approach our table and there was maybe one other customer in the place.  Then we waited about 10 minutes for our water.  The pretzel appetizer looked and tasted like shellacked antlers, the chicken strips were raw inside and I had to send them back, and the waitress was so incompetent that she brought us a bill that included the bacon we'd added to a sandwich but not the sandwich itself.  We were honest enough to let her know, but then she charged my friend's card twice and we had to be very vigilant to make sure she voided the second charge.  It was like being in a lost ""Seinfeld"" episode.  This was a truly bizarre and unpleasant experience.",0.8034,0.768,0.131,0.101,0.5472425722425722
2015-07-22,1.0,Never again. Unbelievably bad. ordered food to be delivered they didnt bring the drink. They wanted me to come pick it up.,-0.5849,0.847,0.0,0.153,0.6666666666666666
2015-07-19,1.0,"HORRIBLE!!! SO gross, I couldn't even eat what they brought me. My ""skillet"" was small, greasy and so disgusting. The eggs weren't cooked right, the potatoes weren't even cooked, it was just inedible. Can not believe I paid money for this. SO disappointed. Don't do it!!!",-0.9639,0.689,0.0,0.311,0.6142857142857142
2015-07-19,2.0,"Like most Yelpers, it takes an exceptionally good or poor experience to get me to write a review. In the case of Belmont Cafe, it's the latter. It took almost exactly 40 minutes for us to receive our food on a not-packed Sunday. One item was ordered without onions and came with them. Then we had to ask twice for hot sauce. To their credit, the food and ambiance is better than Clarke's. But the prices are higher and the portions are smaller. Unfortunately, I believe this is yet another Chicago breakfast joint that falls short on service. In a zip code with plenty of options, we won't be returning.",0.6629,0.855,0.096,0.049,0.5090909090909091
2015-07-18,1.0,Extremely sad with my visit today! Took a co worker out for lunch and thought we would try this place out. BIG MISTAKE!!!! The waitresses don't really seem to care to work. Checking their phones the majority of the time or gossiping to one another... Had to ask two different people for napkins.. The food was pretty bland as well. Got the Mac & Cheese burger and it had no taste at all. My co worker got the bacon turkey club and there were big pieces of meat in part and no Meat in other parts of the club.  I MISS CLARKE'S!!!!,-0.6286,0.801,0.077,0.122,0.5260416666666667
2015-07-05,2.0,"The menu kind of sucks.  It's like they took the old diner menu, cut it in half and shrunk the portion sizes.  Music selection is odd.  Staff asks how you are 100000 times until you want a check.  They also ruined a nice vintage space and tried to make it trendy.   As for the food.. We got breakfast food. It was okay.  I didn't not add salt.   Also, take the Clarke's sign down so people don't expect something different.",-0.4201,0.783,0.098,0.119,0.5105555555555555
2015-07-04,5.0,Randomly stumbled upon this place after getting off the Belmont stop. The inside had a good vibe and our waitress was friendly and funny. Ordered the Hawaiian burger and a side of sweet potato fries that were bomb! Pretzel bun on the burger was awesome as well. Nice new addition to the neighborhood.,0.9422,0.611,0.31,0.079,0.7130681818181818
2015-07-01,5.0,"I ate at TBC for the first time and I will most definitely be back! It was a wonderful dining experience. The food was great, the waitstaff was accommodating and attentive and the location offers a fun and comfortable atmosphere. We started off with the pretzel that could seriously feed 5 people; I could have just eaten that and been 100% satisfied, but you can't only have an appetizer with so many great options in front of you. For my meal I ordered a skillet and pancakes while my dining companion ordered the brisket sandwich - we split both meals as we tend to enjoy trying everything. Both were delicious choices, cooked well and flavorful. I am anxious to try their other meal options in the future! I would definitely recommend stopping in!",0.9873,0.706,0.256,0.038,0.595
2015-07-01,5.0,"Great atmosphere, comfortable seating. Bottomless Intelligentsia Coffee, king crimson iced tea, and fresh squeezed orange juice are some great options for a beverage. Great appetizers such as baked mac and cheese, swedish meatballs, or sliders. the mac and cheese burger is amazing with the hand cut fries. Also be sure to check out classic skillets and omelets which are available anytime!!! I'd stop in late night since they are open until 5am on the weekends or for lunch as they are right next to the belmont stop on the train it makes for great people watching. Hot new restaurant, I'd say check it out for sure you will have a great dining experience.  Hot tip: Order the full order of pretzel for the appetizer if you have a group its worth it, sooo good.",0.9908,0.685,0.276,0.039,0.584779341029341
2015-07-01,5.0,Just visited the The Belmont Cafe for the first time and it was amazing. You have to try the pretzel and the beer cheese sauce along with the Mac & Cheese Burger...both amazing. Great relaxed atmosphere and friendly staff...TBC will be a regular for myself and friends!!!!!,0.9651,0.675,0.325,0.0,0.5767094017094018
2015-06-26,5.0,"The Belmont Cafe has replaced Clarkes and I say good riddance.  The new remodel has an open floor plan and a very modern feel.  Wood, leather and metal seems to be the theme here and it works well for the space.  So far, every employee I've met has been incredibly friendly and knowledgeable about the menu.  They have typical diner fare. I wasn't super hungry so I ordered the appetizer pretzel with beer cheese dipping sauce and a side of mustard. It was delicious. I'll mention that you can order a full or half, I got the half which could easily have been shared by 3 people and was delicious.  Update: So I've been back to TBC twice since my original review and have to say the food has been pretty solid. I tried the buffalo chicken wrap which had lettuce, tomato and cheddar cheese. It was fantastic. It included fries which had sea salt and pepper. Like another person said, they could've been cooked a bit more but were still really good. Today I went again and had a burger and fries. Both were great but the fries once again could've been cooked longer and this time were missing the sea salt and pepper which was a bit of a bummer. I'm sticking with 5 stars because for a place that's only been open for two days, they are doing a great job, I've worked at several restaurants and its not easy opening month let alone opening week. Keep up the good work guys!",0.976,0.795,0.155,0.051,0.5870404040404041
