date,star,text,compound,neutral,positive,negative,subjectivity
2017-08-24,1.0,"Overrated and expensive. Small Fry is better. The burgers are good for the most part. Don't order lettuce on your burger, if you do you are subjected  to a huge chunk of thick dry lettuce leaves with the core still attached.  The fries are absolutely dreadful: fried within an inch of their lives... tasteless unseasoned sticks. Although I think sticks might have been tastier to eat.  Milkshakes are good as the drinks selection. The music is way too loud... the curse of overly confident average restaurants that sell fast food.",0.7584,0.795,0.139,0.066,0.6538888888888889
2017-08-23,5.0,"Simple burgers, but so damn good! Double cheeseburger, good meat/cheese to bread ratio... I was an instant fan!  The line was very long but it moves very fast and food comes out fast so don't let the line discourage you!",0.6026,0.62,0.226,0.154,0.5154761904761904
2017-08-23,4.0,"A tasty burger, great for the 20 something millennial crowd, too hip for my taste but I like the concept.",0.7003,0.734,0.266,0.0,0.75
2017-08-23,5.0,"More crisp, more meat focused, and less mushy than Au Cheval (not to mention shorter waits!)",0.4889,0.826,0.174,0.0,0.37083333333333335
2017-08-22,4.0,"My friend and I happened upon Small Cheval while wandering from our Airbnb in Bucktown on our first day in Chicago. I'd heard great things about the original Au Cheval and was excited to try the famed burger with less hassle (especially since there were few restaurant options on the stretch of Milwaukee Ave we'd walked). The inside is simple and cute, and the menu is equally minimal. The order line and the food service were both quick, and our burgers, fries, and shakes arrived quickly. The burger, of course, was great--hearty, plenty of cheese sauce, topped with nice pickles and tomatoes. The shake was rich AF and perfect to wash it down with. The fries weren't quite as crispy as I like, but still good. I'm curious to see how it would all stack up to the original! We also wanted to take advantage of their cheap shots, but alas it was too early in the day. Next time!",0.963,0.813,0.164,0.023,0.6040013227513228
2017-08-22,5.0,"I love this place! The beer options are great and the burger is delicious, It doesn't sit to heavy and its the perfect portion of meat and cheese. My only recommendation would be a slight improvement with the fries. Otherwise this still is one of the best burger spot in Chicago!",0.9763,0.647,0.353,0.0,0.6645833333333333
2017-08-19,5.0,"Great burger,  but suggest not to get the bacon here.  It isn't very crispy.  The bacon at Au Cheval and Bavette's will change your life, but unfortunately it's not the same here.",-0.1406,0.842,0.072,0.087,0.54375
2017-08-18,4.0,"I can't claim to be a burger connoisseur as I eat them once in a blue moon, but I thought Small Cheval was good. I liked the no frills experience and communal seating in the main dining area. The burger was probably a little overpriced for what you get.",0.6956,0.79,0.153,0.057,0.45555555555555555
2017-08-17,5.0,I'm a huge fan of their burgers and fries. The shakes are not so great though so I would say skip out on those. One of the perks is they have super cute and spacey outdoor seating for those beautiful weather days.,0.8823,0.635,0.288,0.077,0.8633333333333333
2017-08-16,4.0,"A nice option for those of us who don't have the patience to wait around at Au Cheval.  Located conveniently in Wicker Park with street parking around, Small Cheval is easy to spot with their large, iconic design on the exterior. We arrived around 615 PM on a Saturday night and there was a line out the door, though we expected as much.  We waited for about 30 minutes and then got to the front and ordered from their simple menu: cheeseburger or hamburger (""housestyle"" with dijionnaise, pickles, and onions), fries, and a large cocktail menu to order from... or in our case, milkshakes (vanilla or chocolate available, and you can add a shot of a number of liquors into it). There was some seating on the inside, though it was dark and not particularly cozy. Everyone was headed to the large outdoor patio and we followed suit. We found a spot at one of the many long tables available. The food came out relatively fast - within 10-15 minutes. Everything was as delicious as you'd expect with that Cheval name attached to the place!",0.8748,0.94,0.06,0.0,0.5236772486772487
2017-08-14,5.0,"I haven't been to Au Cheval, but this was one of the best burgers I've had. It takes a little while for the line to move, but there's plenty of space out back for seating. They have a cool selection of beers, shakes, etc. It's all about the Cheeseburger cheeseburger.",0.8674,0.837,0.163,0.0,0.36250000000000004
2017-08-14,5.0,"Get the house style cheeseburger! It's savory and delicious. You have to respect a place that focuses on doing one thing very, very well.",0.8678,0.672,0.328,0.0,0.6950000000000001
2017-08-14,4.0,"I dropped by here on my way home from the airport. At around 9:30 pm on Monday, it was pleasantly empty. The lady at the front desk taking orders was very friendly. I had been to Au Cheval before. The burger here is basically the exact same burger (minus the egg option) but in a fast food fashion.  I like their burgers very much, but I also do not think they're the best burgers out there (see my review of Au Cheval). My belief that this place is a little hyped remains unchanged.  Nonetheless, the food/drink hit the spot for me. I had the cheeseburger plus bacon, the fries, and a cup of Founders. After a week of traveling, nothing screams ""Chicago!!"" in your ears like a good old American cheeseburger that you can get at Cheval. I sat outside in the patio enjoying the warm summer night, sipping my beer and munching on my fries/burger. I loved every moment of it. God bless Chicago, good to be back.",0.993,0.752,0.241,0.007,0.37416666666666665
2017-08-14,4.0,"Never got to try Au Cheval (due to long lines, but will attempt to at some point) so this review won't be a comparison between the two. I knew this place was popular so I wasn't at all surprised with the $10 cheeseburger--it came out pretty tasty, but I don't know if it was really worth $10. I liked the chewy bun of the burger though! There was a nice patio area for people to share tables and eat under cute lights, with the cta train passing every now and then. The line also moves really efficiently so I wouldn't stress if you see a lot of people trailing out of the restaurant. Overall, the burgers are good and worth a try, but it's lil overhyped.",0.9904,0.716,0.271,0.014,0.5673076923076923
2017-08-13,5.0,"Wow! Kind of a hidden spot. We grabbed two of their burgers one Friday night to go. My boyfriend was upset because we had to drive to pick it up and ended up losing our parking spot. He told me it better be the best burger in the world since we ended up parking like 5 blocks away and guess what, it truely did end up being the best burger ever! It's similar to au cheval but with a bit of heat. The meat is excellent and the bun unique. I really enjoyed the jam like spread as well as pickles on it.  Oh and their fried pickles were the best too! Super light for a fried item.",0.9892,0.691,0.273,0.035,0.6249999999999999
2017-08-12,4.0,"Looking for a much quicker, but fairly comparable experience to au cheval? Small Cheval totally does the trick. They have a pretty decent sized restaurant and large patio with tons of seating. The big picnic tables and cute tea-lights make for the perfect outdoor Chicago eating experience in the summer.  The wait staff was super efficient and kind. The menu is extremely limited, but honestly I think they would be doing themselves a disfavor if they were to make it any larger. It's perfect for what they're doing here. The food was simply delicious! Though I did miss having the egg option available.  I had the cheeseburger with bacon, house style and fries. Obviously added on some garlic aioli to both, and had a fantastic dining experience overall.",0.9933,0.671,0.29,0.04,0.6359410430839002
2017-08-09,4.0,"TLDR: Small Cheval: A Redemption Story. Simple burgers, AIOLI, (optional boozy) rich milkshakes.  I was not a fan of au cheval. At all. (See previous review about au cheval) So, I was extremely reluctant to try small cheval as it was going to be as salty as au cheval in my head. But I decided to give it a chance after seeing some fellow yelpers that didn't like au cheval say small cheval was better, and I'm glad I did! Small cheval is located in a cool part of bucktown/wicker park. It's a small standalone brick building, matching the aesthetic of its location. We went down for lunch on a Saturday afternoon, and I expected the worst. Au cheval boasts 5 hour waits on the weekends, but small cheval had a small line out the door that zoomed by quickly (10-15 min wait tops). The menu itself is pretty simple with the choice of a cheeseburger, hamburger, and fries. The restaurant boasts tons of alcohol choices and option for boozy milkshakes. I got a cheeseburger house style with a side of fries and a chocolate milkshake...a little pricy coming to a total of about $18. After another short 10 min wait or so, the food came out piping hot. First thing to note, the burgers are all double patties, so they're pretty hearty. There isn't anything too fancy about the burger as it comes pretty bare, even with the pickle and condiments added when you get it house style. But it's a pretty damn good burger. Second, the fries were crisp and given in a large quantity. GET THE AIOLI WITH YOUR FRIES, you will NOT regret it. If I could put that aioli on all my food for the rest of my life, I would not be upset. Third, the milkshake was thick and rich, the whipped cream on top adding a nice fluffy topping.  It started to get busier after we sat down to eat, and we noticed a cool patio out back to eat. Overall, the burger was a nice and solid, albeit pricy, meal that satisfied my burger craving in a way that au cheval did not. It was not over salted or over seasoned, and I appreciated the raw simplicity of small cheval. It almost makes me want to go back and give au cheval another chance.........almost.",0.9928,0.818,0.147,0.035,0.48892000093923177
2017-08-09,1.0,"Expensive and it sucked, why? Go compare this to Maxwells Burgers, it's the same but at least Maxwells tastes better and doesn't cost over 10 bucks, wtf...",0.431,0.81,0.125,0.065,0.545
2017-08-08,5.0,"Shout out to my AirBnB host for suggesting Small Cheval because these burgers were DELISH! Super juicy burgers, crispy fries, and yummy milkshakes. It is a little bit on the pricey side but the food is really simple and tasty.",0.6049,0.882,0.118,0.0,0.48095238095238096
2017-08-07,4.0,"The burger is awesome, Albeit on the smaller side.  The fries have the right amount of salt.  This place is pricey though.    There was a line to get in so people apparently have no problem shelling out the money.  Just high enough to send me elsewhere.   Now I can only afford White Castle for a while...",0.0516,0.847,0.069,0.083,0.5532142857142857
2017-08-07,5.0,Hands down one of the best burgers I have ever had with good fries and beer in a chill setting.,0.7964,0.693,0.307,0.0,0.39629629629629637
2017-08-07,5.0,"The perfect burger! If you don't want to wait 2 hours to get a table at Au Cheval for their burger...Go to Small Cheval. Incredibly courteous staff, best burger in town and a laid back vibe. It's also very busy, but nothing like Au Cheval. Expect a 15-20 min wait to order. I go at least once a week as I crave this burger!",0.6353,0.816,0.125,0.059,0.49857142857142855
2017-08-06,5.0,Perfect simple menu with an amazing burger! I love places that make 1 thing really well and this is exactly that!,0.9401,0.505,0.495,0.0,0.5511904761904762
2017-08-06,3.0,"I've been wanting to try this place for years and I decided today to finally give it a try. So disappointed :( First of all, the burger was pretty great, but it wasn't anything special. . For the price, you can definitely get a better burger. If you can, go to Shake Shack, In-N-Out, Kumas, even Wendy's. They have a better burger for a better price.",0.9105,0.633,0.25,0.117,0.6731601731601732
2017-08-04,5.0,"If what you want is a really good burger. This is a pretty good choice.  They seem to have worked out the kinks on inventory and handling the crowds. The lines move fairly quickly and the food quality is consistent. A $3 shot of whiskey is always a bonus. The fries are solid and the garlic aioli is a nice option.  Outdoor space is great and people are totally digging the vibe. I'd go back for sure.  There may very well be a better burger in Chicago, but Small Cheval can hold its own as a very convenient choice for me.",0.9309,0.799,0.201,0.0,0.5586805555555556
2017-08-04,5.0,"Small cheval Vs Au Cheval? Small all the freaking way!  Seriously,  read my review on Au Cheval if you don't believe me... but,  dude,  I just didn't like Au at all! Thankfully I gave Small a chance and was wow'd by them! Their burger was perfectly cooked,  not slathered in sauce like the one at Au, and the vibe is so much less pretentious. It's more chill...come in, eat,  chat for a bit with your hipster friends and leave shortly after.   Oh and did I mention you won't wait four hours to sink your teeth in a delicious Patty?  Quicker,  much,  much quicker than their counterpart.   Go!",0.9574,0.736,0.184,0.08,0.5527777777777778
2017-08-03,5.0,"Can't believe I've lived in the hood for 2 years and never came here! So good. Maybe not quite to the level of Au Cheval (no eggs here people), but still delish. Definitely get a milkshake - I like to think of myself as a connoisseur of the milkshake as I spent three summers making the things.  Pick a nice day to go and sit outside!",0.9214,0.807,0.193,0.0,0.45
2017-07-31,5.0,"I WANT TO EAT HERE EVERY. DAMN. DAY. I'll never understand the people who just don't get this place because this is by far my favorite burger AND it's gluten free friendly people!! I've started to prefer this location to Au Chavel since this one wraps your burger in the perfect lettuce wrap if you can't enjoy the bunny goodness.  I think the price point can be a little high, but you know I keep paying it. I love that you can get a shot when you order your food and that they have a great selection of sodas, beers, and a cider too. There's really no words for me to put into this review. I JUST LOVE YOU, DAMNIT!",0.9605,0.689,0.22,0.091,0.6658333333333333
2017-07-29,4.0,"I'm happy I finally got to try out Small Cheval. I love that the menu is tiny. Seriously, you go here to eat a burger and fries. The place is small, but has ample seating. The weather was amazing today so we sat outside. Even though the line was out the door, I never felt like the seating area was over-packed. The service is speedy & the workers were incredibly nice. My friend really wanted a beer, but the line was out the door. A worker came and let him order a beer through her instead of waiting in the line. Both of us loved the burger! It was perfectly cooked and the sauce they use is delicious. I've been to Au Cheval, but I like the vibe of Small Cheval better.",0.9896,0.707,0.25,0.043,0.6510416666666667
2017-07-27,5.0,"Simple menu of just burgers, fries and shakes done really well. Like *really* well. Even the ketchup is amazing. This is no greasy spoon restaurant. And if you want booze, they have that too.",0.8578,0.653,0.295,0.051,0.41428571428571426
2017-07-27,5.0,Can't eat enough burgeeeeeeeeeerssss... so quick and delicious! Basically the same burger you get at Au Cheval minus that insane waite!,0.4306,0.724,0.173,0.103,0.5375
2017-07-26,4.0,"Small Cheval is solid but still a notch below Au Cheval. The burgers are pretty different, less buttery rich, no fried egg, which actually make them much better go-to burgers than their counterpart, Au Cheval which can only be reserved for special once (twice?) a year treats. Went on a Saturday late afternoon and no lines, which is a huge plus. The fries were very good, but lacked that extra crispness on the outside. Same amazing garlic aioli dipping sauce. Great stop if you're craving an all around decent burger that doesn't sit too heavy in the stomach.",0.9848,0.655,0.284,0.061,0.5229880952380952
2017-07-25,4.0,"You know a place must be good if there's a line forming out the door. I went during dinner time on a Saturday night (in the summer too!) so it was super busy.  Small Cheval is in a prime location with ample outdoor seating. I loved seeing all the babies and doggos hanging out together with their parents outside.  It's so clean for how many people go in and out-- good job on keeping keeping the condiment area looking like it's nobody's business. With a bajillion people pumping that garlic aioli dispenser every other minute, I really have to commend Small Cheval for being on top of it.  Service was pretty good too. I appreciate any eatery that can keep their cool and treat everyone with respect through all the craziness. I have to admit though... my burger was only delicious because of the condiments I slathered onto it. If you look at my pictures, the hamburger looks verrrrrry plain. I got it with all the complimentary toppings but still *shrug shrug.* I am convinced the only reason why this burger was so delicious was because of the garlic aioli and ketchup.  ALSO, this is NOTHING like the Au Cheval burger!!! Do not come here for that! It's far less decadent, and much more plain. It kind of reminded me of a very naked In N Out?? Like it could've been In N Out but it couldn't.",0.9908,0.793,0.2,0.007,0.5908078231292517
2017-07-24,5.0,"Quick, speedy and helpful employees. I suggest sitting outside, because inside can get hectic and loud. Outside seating on a nice summer day is the way to go. One of, if not thee tastiest burger I have ever had in Chicago. Fries and Milkshakes are also delicious and should accompany your order. Will definitely be back.",0.9001,0.803,0.197,0.0,0.48571428571428577
2017-07-24,5.0,"Oh, that burger!  I mean, if you're going to hit up Small Cheval, you don't really have a ton of options... but why would you want any more options than that burger?   Some wonderfully perfectly crispy fries on the side?  Yes please!  And maybe a shake?  Hmm, how about a spiked shake with a shot of whiskey or some other tequila?  Now you're talking! Admittedly, I was a little disappointed to not be able to include a fried egg on my burger at Small Cheval to really make it an Au Cheval burger... but to be able to enjoy this awesomeness without the hour and a half wait, it's all good! Burger from Small Cheval, you're my burger in shining armor... and I will be back to enjoy your greasy delicious goodness time and again! *****FIVE STARS*****",0.9905,0.693,0.26,0.047,0.4962719298245614
2017-07-23,5.0,"Spectacular burger. Had high expectations and they were surpassed! Outside of the burger, the garlic aioli adds a nice touch to the fries and the vanilla shake doesn't disappoint.",0.5647,0.78,0.167,0.053,0.6225
2017-07-21,4.0,"The burgers here are mediocre at best, but the vibe is excellent for hanging out after work, sporting events, etc. The only real downside I can think of is the fact that the L passes right behind the outdoor seating area, so you'll have to (most likely) pause your conversation lol.",0.8705,0.765,0.193,0.042,0.7035714285714285
2017-07-19,5.0,"1000% the best burger I have ever had. The cheese was melted perfectly and complimented the patty along with the bun for the perfect trifecta. In my boyfriends words: ""if there is one thing that would make me permanently move to this city it is that burger""",0.9423,0.738,0.262,0.0,0.7666666666666666
2017-07-19,5.0,"Always have to stop when I'm in the neighborhood. Not as good as Au Cheval in my opinion, but the second best burger I've ever had. Will be back as always!",0.8147,0.744,0.214,0.043,0.22500000000000003
2017-07-18,3.0,"Small Cheval's burgers are awesome. They're juicy, seasoned perfectly, and just taste very good. The fries were also very delicious. The menu should be a bit bigger (only had 3 items) and their service should be better (the employees didn't really help with my order).",0.951,0.639,0.318,0.043,0.663
2017-07-18,4.0,"This gem always has a fast-moving line as it seems to have perfected the idea of having a few solid items that they cook well! It sits perfectly near the 606 Trail, so it's a great stop-a-long. Burgers, fries, shakes, and beer! No frills - simple, easy, and delicious. it's a great place for take-out although their patio is lovely for a summer day. It gets loud inside given how small and cozy it is, though is great outside (barring the occasional train noise). I'm only giving it a 4 because the last two times have not been as exceptional as the many times before. By that, I mean I am being nit-picky and the burger patty was cooked a bit more than it typically is.",0.989,0.719,0.266,0.015,0.5531655844155844
2017-07-17,5.0,"Love bringing out of town guests here. When a place serves only burgers, fries, shakes and beer, you know they're good at what they do. Crispy, salty fries, dijonnaise (do not pass on that) and god I could drink the garlic aioli by the bucket. Lots of outdoor seating but communal seats inside, where you'll be crowded by the long line and loud music. Go and thank me later.",0.81,0.871,0.129,0.0,0.5666666666666668
2017-07-17,4.0,"Alright so here's the scoop. If you're venturing here in replacement of the OG big papa Cheval with high expectations, lower them juuuuusttt a tad.  I suggested this location with a group of friends after our hearts were set on that of who shall not be named. To avoid over an hour to two and a half hour wait on a Sunday, we decided to try lil bro instead after much much word around town. To reiterate, if you're looking for the similar to spot on version, it's not here. Although the style is similar with a double patty, the bacon(extra 2.00) is NOT pork belly and just all around a good/more decent burger.  Don't get me wrong, it was a great burger in a fast food style sit down location. Service was friendly and the price was still relatively high, but I am firm believer in getting what you pay for, and this meat, is quality all day.  If we must do comparisons I'll say it's a step below big bro and a step above Five Guys. It'll do the trick for a burger fixing and booshie budget when you just don't have 2 hours to wait at their counterpart.  My friends were impressed considering the nick of time we had. However, I kept getting the, ""it wasn't the same, it just wasn't the same."" Okay, it's NOT the same. But can you honestly duplicate perfection? I digress.  Overall, if you're in a crunch of time, come here. If you have all day and no set plans, you already know which way to go.",0.9631,0.854,0.106,0.04,0.3928009259259259
2017-07-16,4.0,"They are a small menu lol.. I would suggest the cheese burger house made (includes the toppings) and a side of fries.. also their shakes are really good! They have a few choices for condiments.. the aoli is good!! They have seating inside but when it is nice out they open the back area.. it's really cute.. simple but nicely decorated with some greenery and patio lights... it's nice for a first date, hanging out etc. the staff noticed that we were celebrating a birthday and we got free shakes! That was very sweet! We come here often and if you like burgers I would suggest it! The patties are juicy! It is a double patty!!",0.988,0.745,0.255,0.0,0.577217261904762
2017-07-12,4.0,"I was happy that the food lives up to the raves but the line is a negative. I made sure to get there just as they opened and decided to get the food to go.  I don't live far from it - I knew the food would not suffer for a short trip home.  Very hot day  - sitting outside not what I wanted to do-inside too crowded.  Vanilla milkshake, fries, hamburger with house toppings and garlic aioli were all delicious. The aioli can go on fries or burger. The price is way up there for this kind of food, but I didn't mind once I tasted it.  This is a little gold mine.  I hope it stays consistent because they could become complacent with all their success.",0.9526,0.786,0.166,0.048,0.5991452991452991
2017-07-11,5.0,Burgers are solid...love that 'micro-brew' ketchup...make sure you get a shake with that meal!!!,0.3561,0.693,0.2,0.107,0.8888888888888888
2017-07-09,4.0,"Fun little whole in the wall joint with a great patio. Limited menu is fine as they focus on what they do best ( Burgers, fries and shakes). Great burgers- wish there was a veggie burger option but the burger and fries were delicious. Kids sized burgers available even though they don't advertise it. Great choice for a very casual place right off the 606.",0.975,0.646,0.335,0.018,0.5560439560439561
2017-07-06,5.0,"Great burgers and fries! Definitely worth the wait, and although the lines look long, they get your order in very quickly so it goes faster than you'd expect. The house ketchup isn't my favorite, but they also provide Heinz, thank goodness. Didn't try the milkshakes, but they have good beers on tap and in cans. My friends and I sat outside on the patio, which was much better than the slightly stuffy atmosphere inside.",0.9735,0.703,0.277,0.019,0.46851851851851856
