date,star,text,compound,neutral,positive,negative,subjectivity
2016-12-06,4.0,"This place is perfect if you are in the mood for the same flavor as Au Cheval, without the egg, or wait.  The Good: I was in and out within 15 minutes.  The taste was amazing, with the same flavor you'd get from the full restaurant.  The Bad: You can't order egg, and the bacon is thin average bacon.  Small Cheval does NOT serve the thick cut honey glazed bacon that really makes the burger at Au Cheval. In a pinch - there is no better place, but be warned your meal is going to be $15 with no drink.",-0.296,0.819,0.08,0.101,0.5224358974358975
2016-12-05,5.0,"Everybody is all about au cheval and there's so little chatter about this cutie pie. Small cheval is, IMO, better and faster. I find the taste here to be a little more peppery, and a little less rich than Au Cheval. It's also really easy to order here. The time from arrival to food in your hands is usually around 10-20 minutes, which is amazing. My favorite burger, my best friend- Thank you, Small Cheval",0.9812,0.687,0.313,0.0,0.5266666666666667
2016-12-03,4.0,"The little brother to Au Cheval. Smaller, less crowded burger joint.. yet still huge in taste! Came in on Friday evening, Not too busy.  This is your typical fast causal restaurant. Walk up and order your food and they bring it to you, super fast! Minimal seating inside.. huge community table.  Burger was delicious. Ordered the bacon cheeseburger .. ""single"" aka double.. juicy and flavorful. Cooked perfectly. They have a side bar of ketchup and garlic aioli (Delish!) small fries and their founders Ale. Great combo!  For those who don't know this. Mmmmmmmm mmmmhmmm. A single burger is actually a double .. a double is actually a triple..",0.9708,0.817,0.183,0.0,0.46723356009070294
2016-12-03,4.0,Easily the best burger I've ever eaten. The only reason I didn't give 5 stars here is the fries were unbelievably salty. Like someone couldn't remember if they salted them (but had) and gave them a heavy handed salting for good measure. You had to wipe the salt off of the fries to even consider eating them. Service was awesome and super quick! My dinner companions said the shakes were killer too.,0.9457,0.714,0.237,0.049,0.7111111111111111
2016-12-03,1.0,"I wish I could get my money back. No, I wish, the order taker would have told me they changed their bun to service those with dairy allergies. That bun tastes like rubber and it ruins the taste of the burger. It's super fucking chewy. So, if you go there, know, it won't have the same taste because according to dude, the bun changed.",0.7717,0.765,0.164,0.071,0.35833333333333334
2016-12-01,5.0,"WHAT BURGER DREAMS ARE MADE OF! I came here with my friend a few weeks ago and have been drooling over it ever since. The service was quick and friendly, the outside patio looked great as well. The meat was so fresh and the flavor was incredible, not to mention how perfectly melted the cheese was with the buttery bun. The fries were perfection and I would bathe in the garlic aioli if I could. I can't wait to come back here! Plus they had Vernor's ginger ale, doesn't get better than that.",0.9779,0.725,0.253,0.022,0.4800000000000001
2016-11-29,5.0,"Place was perfect. One of the best burgers I've ever had. I thought my favorite burger was at My Brothers Bar in Denver, CO but not anymore.",0.714,0.768,0.232,0.0,0.7666666666666666
2016-11-26,2.0,Mediocre. Having had an amazing experience at Au Cheval I probably had unfair high expectations...still there's nothing overly exciting about this spot.,-0.233,0.654,0.138,0.208,0.8480000000000001
2016-11-25,4.0,While I am not a fan of carryout burgers I have to say this one was delicious and that was after they had been made probably 15 minutes earlier before we got home. Make a stop at this place. It is well worth it. A great burger. Most likely one of the top burgers I have had if I would have had it fresh. The ladies who picked up our carryout were a bit slow getting home as they were sitting there having a beer while they waited. The fries are good as well.,0.9407,0.75,0.209,0.042,0.585
2016-11-22,5.0,"Small Cheval is the offspring of its very well known parent, Au Cheval; a place I've been to a few times. I came here with two of my friends that were visiting me for the weekend in order to skip the unbearable wait at Au Cheval. Honestly, it's ridiculous. I've been quoted 6 HOURS. There was virtually no wait here.  I didn't realize it when we decided to come here, but Small Cheval's burgers are actually smaller than the original that swept Chicagoland. They offer the same two patties, but much thinner bacon and no egg. I truly feel I'm going to die after eating at Au Cheval, so I found this equally delicious version of their burger preferable. It allowed me to also indulge in some fries and a shake, and walk away without worrying that my stomach would explode.  The fries and shake were as notable as the burger, and both my friends agreed that this was the best burger they had ever eaten. However, none of us are avid burger consumers.  IN SHORT, come here. Get everything.",0.968,0.752,0.172,0.076,0.49107142857142855
2016-11-15,4.0,I love this place there is no 3 hour plus wait it is more like 15 minutes or less wait for a delicious juicy burger.   I can get my au cheval burger crave satisfied at small cheval. It will only set you back about $9.95 and you can get their famous fries so delicious! I like their garlic aioli my favorite dipping sauce with their fries.,0.9664,0.68,0.292,0.028,0.6878787878787879
2016-11-14,4.0,"If you have ~$15 to spend, craving for a double patty burger, with fries, and a chill place to hang out with friends - this is it. While the burgers may seem to be on the pricier side, this place is definetly something to try.  My friends and I were lucky enough to go on a not so busy night so there wasn't any line. I love the whole, order in the front, pay for your meal, and take a buzzer type of establishment because it makes it easier for individuals in a group to order and pay. Definitely a casual place for burgers and beers. Their garlic aioli was pretty bomb for something I suspect is just mass produced without any love. But that's okay, cause it went delciously on both my fries and burgers. I'd come back here for a summer night since outdoor seating was plentiful. Downside was that the CTA runs every other like 5 minutes and it can get noisy though.",0.7402,0.763,0.133,0.104,0.4979166666666666
2016-11-13,5.0,"These burgers are my favorite. I've been to Au Cheval also, I'm not sure if it's worth the wait when I can just go to Small and it's was closer to me! Burgers and fries always  The have shakes, shots and beers available as well. Staff is fun. Open seating policy, but even when it is super crowded I've always found a spot. They've also changed the layout of the inside over time. This is not a boring spot and I've never left less than satisfied. Last time I went I wished I had gotten another cheese burger to go... haha. I recommend getting cheeseburger with all the toppings. Don't skip out on the golden fries either. There are 2 ketchup options and an aioli option. I get a little cup of each and switch off dipping.",0.9729,0.811,0.179,0.01,0.47430555555555554
2016-11-12,5.0,"First of all, while you wait in line, someone asks you if you would like a drink while you wait - hell yes I do! Why doesn't every place ask you that question??? I had the pilsner local beer which was great and my husband had the local IPA which he liked as well. We both ordered cheeseburgers house style and shared a side of fries. We both took one bite and knew it was the best burger we have ever had. I did sub out the dijoinaise and added garlic mayo with ketchup and I'm glad I did. My husband contemplated 3 times if he should go back to the line and get another one :). Believe me, he would have if we didn't have plans to go to Mindys for hot chocolate and dessert. If you live in Chicago, you need to make this part of your weekly menu, if you are visiting, you can't leave Chicago without one of these burgers.",0.9594,0.828,0.146,0.026,0.503030303030303
2016-11-12,5.0,"I was skeptical at first, due to the limited menu. How can anyone be that confident in two items on their menu (burger and fries)? I was COMPLETELY wrong. I will argue that this is the best burger in Chicago. There are plenty of great gourmet burger spots in Chicago, but this place is hands down the best for a classic, juicy, no fail burger with a side of fries and a milkshake. ALSO-- the outdoor patio is a perfect hangout with friends (and your dog!) Don't doubt. Just go.",0.9158,0.633,0.228,0.139,0.47615995115995113
2016-11-12,5.0,"AMAZINGLY DELICIOUS!!!!  what a great burger, the French fries, the garlic sauce, tomato sauce and the milkshakes are a perfect combination for a great flavor!  Unfortunately I can't give it a five star because I found very uncomfortable if not upsetting the really bad attitude of the guy who takes the orders, grumpy face all the time ( he is upset all the time!!!!) poor communications skills with costumers and more upsetting the way he looks (in a very upsetting way) at families with children.  My boyfriend and I were surprised of how unprofessional his attitude was towards them, every time a kid make any kind of noise he was upset about it his facial expressions were not quite friendly . Finally the guys in the kitchen were awesome! They had a great attitude !  Thank you for  messaging me ! DEFINITELY A FIVE STAR RESTAURANT!! Thank you for addressing the problem, the last couple of times I went there the guy taking orders had a nice attitude very very cool",0.9735,0.639,0.233,0.128,0.6831060606060606
2016-11-11,3.0,"Now that I think about it, Small Cheval tastes a lot like M Burger. But I gave M Burger four stars, not sure why but I do like M Burger more lol.  Burgers are good quality but nothing like ""WOW my life has changed"". Fries are good, and the garlic aioli is awesome. They also serve Sir Kensington condiments, which is great.  Will have to go to Au Cheval to try the life altering burgers, but this does hit the spot when you have a taste for burgers and too lazy to go anywhere.",0.9743,0.646,0.271,0.083,0.7438888888888888
2016-11-10,5.0,My second time in Chicago and the first place that I really liked. Amazing burgers. They have every ingredient figured out. Before you even ask your question they have an answer because they know what people want. I ended up eating twice as much than I could.,0.8162,0.829,0.171,0.0,0.44666666666666666
2016-11-09,4.0,"This location has a limited menu but the food tastes just a good.  I had the cheeseburger with everything, fries and a chocolate shake on a lettuce wrap (gluten free option). The burger was tasty as well as the fries. The shake was a nice addition to the meal. We sat outside in the back and I enjoyed the atmosphere.",0.9481,0.646,0.274,0.08,0.4704081632653061
2016-11-08,3.0,"3 1/2 stars if considering things that arent food I was really excited to try this place. Ive always heard amazing things about Au Cheval's famous 'best in the us' burger so expectations were high. tdlr: Good place to bring large group of rich drunk friends on a friday night for an unusually creamy/overall meh burger and drinks. Come if you like mayonnaise. Get a shake. Cute atmosphere. Overpriced/overrated Burger: Single cheeseburger (2 patties) come out to a bit above $10 with tax and comes with dijonnaise, red onions, and pickles  The meat on the burger itself was nothing special and formed into thin patties cooked medium. The patties did have a decent crust on them and black pepper pepper on both sides (both are signs that they know what theyre doing) The cheese was between the patties (nice!) and on top of the meat. They used yellow american cheese which adds no taste (american cheese sucks and isnt cheese) but is melty  Bun was only a little sweet (good), quality, and came toasted Dijonnaise was REALLY piled on there and only tasted like mayonnaise with no dijon kick/contrast with the rest of the burger. I did think it was a nice that the red onions were chopped instead of sliced. Im not a fan of sweet pickles so I got my burger without them, and since theyre sweet I dont think theyd provide much contrast and would just be lost in the overwhelming creaminess Overall burger had very little/no contrast (taste or textural). If you have to add expensive bacon or a fried egg to a burger (recommendations i always see for au cheval) for it to taste good youre doing it wrong I didnt order the fries since they didnt look like anything special. The shakes did look really good and were a fair size for the price (considering the priceiness of the burger and basically everything else here) The staff here are very kind, have a good attitude, and move quickly and efficiently. The place itself is pretty cute if you care about that stuff (I honestly only care about food). Theyre open late and have a large patio with picnic tables and pretty string lights.  Small Cheval is on milwaukee walking distance from the damen blue line north of all the bars. The neighborhood is bucktown so expect trust fund hipsters, yuppies, and yoga moms I wont be coming back here but Im interested in trying Au Cheval's cheeseburger to see if its any better or if people in the midwest are just tweaking",0.9975,0.749,0.201,0.05,0.5771912832929782
2016-11-08,5.0,"I usually do not like burgers, I find them to be a big slab of flavorless ground beef with toppings, so I probably only eat them a couple of times a year... but after trying a cheese burger from this place I can't wait to go again! I am honestly not a big meat eater, and was a bit put off when I saw there were two beef patties on their burgers.... but man... I finished the whole thing! I didn't need to add any ketchup either. I did order the fries but I didn't think they were that special to be honest. Even though the burger was good on its own, I am happy to see they serve Sir Kensington products. I love the ketchup they make. This is a heavy meal though, so go hungry! I also tried their chocolate shake with bailey's.... oh... my God. My boyfriend had the chocolate shake but he preferred mine. It makes for a pricey shake (I believe $8 with Bailey's) but it's a treat!",0.9853,0.769,0.188,0.043,0.5851190476190476
2016-11-08,5.0,"This burger will be a party in your mouth. Ridiculously good. One of the BEST burgers I've ever had. Simple ingredients done very well. A bit spendy in my opinion but if the mood strikes me again for a burger, I'd go back b/c I know how exceptional it will be.",0.3639,0.753,0.156,0.091,0.42619047619047623
2016-11-07,4.0,"Came here last night with a few friends. Was able to quickly order and sit outside on the patio. If you can't find time to wait in line at Au Cheval, come here for the same famous burger and fries for a much shorter wait.  While I thought the burger was good, it wasn't omg good. Maybe I just had too much of an expectation? Certainly didn't seem like one of the best in the country...certainly wasn't the best I've ever had. The fries were good with the garlic aioli.  No need to rush back. I got to get the Au Cheval burger everyone talks about. Over rated. Giving four stars because nothing was wrong with the meal, just wasn't the greatest.",0.9632,0.749,0.196,0.055,0.42989417989417994
2016-11-05,4.0,"Really enjoyed my first time visit at small cheval! Although we got our food to go, really is a good spot, super casual, and not over crowded. Definitely hit my burger craving! The fries are super good - I want to say they are double fried? Idk what that even means - but either way they were super delicious! Also they have dipping sauces to grab including garlic aioli. As someone grabbing food to-go, I definitely appreciated that they had to-go cups with lids so that I could get a taste! It's the little things... They serve beer too! Nom nom nom",0.9844,0.693,0.283,0.024,0.5428571428571429
2016-11-02,5.0,"I'm a huge fan of the burger at Au Cheval, but I guess everyone else is too, so I can't get in there too often.  I went to Small Cheval and was excited to find out I can get my Au Cheval burger with a much smaller wait time.  This place is pretty simple; love that they have fun sodas in a cooler self serve and the outdoor patio is great--spacious and cute.  The burger is awesome!  Same with the fries!  The only thing that would make this better would be if they offered an egg on the burger like Au Cheval.  Hands down my fave burger.",0.9927,0.675,0.325,0.0,0.6157879818594105
2016-10-29,2.0,The burger is way to salty! And why does it only come 1 way ? Also why a fucking huge community table taking up the entire space ? Why not multiple small tables ???,0.592,0.883,0.117,0.0,0.585
2016-10-28,2.0,"A double cheeseburger, fries and a can of ginger ale is overpriced at $17.  Food was OK, nothing special.  They have a patio.  You place your order with cashier who gives you a device which buzzes when your food is ready.  You go and get it, so no service except when dealing with cashier. I'm no longer curious about this small building I see on my way home via the Milwaukee Avenue bus.  Not planning on going back.",-0.0663,0.81,0.093,0.097,0.4244897959183673
2016-10-26,5.0,"This is my go to burger spot.  Whether you want to sit down or take out, the food is always great.  Simple menu, liquor, shakes...  The patio area is huge now, and there is plenty of parking.",0.7717,0.815,0.185,0.0,0.5740079365079366
2016-10-26,5.0,"Best fresh, quick order double burger, Chocolate shake, and fries in a long time; a can't-miss lunch!",0.7263,0.586,0.331,0.083,0.34
2016-10-24,5.0,"mmm found my favorite burger in Chicago!   Came on a Sunday afternoon around 1PM and the line was about 15 people out the door.  The line moves kind of slow since there is only one cashier but there was plenty of seating indoors and outdoors.  The burger and fries were ready fairly quickly and it was delicious, great patties and love their pickles.  The burgers come with 2 patties, I would have been pretty happy to have only 1 patty as the burger was pretty big with 2.  Only thing I didn't care for was the ginger soft drink, it tasted very artificial and left a bad after taste, forgot the brand but it was not Seagrams or Canada Dry.   Definitely will come back again.",0.9873,0.695,0.252,0.053,0.6757575757575757
2016-10-24,4.0,"Small Cheval isn't quite as great as the big brother Au but still does a fine job. I like the more casual/laid back concept Small Cheval offers. The burger was really good and had the same type of flavor. I think the bun was a little more crisp but it wasn't a bad thing. I didn't get the bacon but I hear it's not the same as Au Cheval's. My burger fix was more than satisfied so I would recommend coming here when you have an Au Cheval craving as it will hold you down. Service was fast and friendly. #RefereEats ""I call it like I eat it.""",0.981,0.743,0.238,0.019,0.42361111111111105
2016-10-24,5.0,mmmm nothing like 11am burgers and beer after a long weekend of pizza and beer visiting chicago :),0.224,0.746,0.149,0.105,0.7
2016-10-23,5.0,"For 10 bucks, you absolutely won't find a better burger. So simple, so good. Fries are legit. 4 dollar beers. Fast service; beats waiting at Au Cheval to get your fix.",0.3402,0.8,0.121,0.079,0.5914285714285714
2016-10-20,5.0,"I choose this place every time over au cheval. The burger that most people wait three hours for is available here with little to no wait. There's shakes are wonderful and the employees are so nice. Every time I order a burger here I am able to have my meal within a few short minutes. This helps because the wait is absolutely unbearable since it is so amazing! Do yourself a favor and order it the way it comes because you will not be disappointed. I recommend this place to anyone visiting Wicker Park. The alcoholic milkshakes are just a plus. You may want to Uber because the milkshakes are a must try, but parking is available for others. Enjoy!",0.9329,0.821,0.155,0.025,0.5982142857142857
2016-10-13,4.0,Burgers are good. Just not $12 good. Over priced for burger king sized burgers. Fries are good.,0.8271,0.617,0.383,0.0,0.6000000000000001
2016-10-13,5.0,"Addicted. This is located within steps of my house and I could eat here every night! So simple, yet so GOOD. The staff is super friendly and welcoming all hours of the day and night!",0.9455,0.663,0.337,0.0,0.5447619047619048
2016-10-11,4.0,"Great burger, beat in Chicago. Ha a nice afternoon lunch. Lots of good drinking options if you are up for a session. Definitely a cool layout- similar to a  classic Chicago dog/ burger joint.  Also enjoyed the outdoor seating.",0.9612,0.577,0.423,0.0,0.6095238095238095
2016-10-04,1.0,"Walked in, walked right out. Horrible service from the start. Came in and signed in, the hostess was incredibly rude, very obnoxious, steer clear, try small cheval in bucktown instead.",-0.8169,0.663,0.073,0.264,0.5365079365079365
2016-10-03,5.0,"Ok, so Burgers are my thing. If I am trying a burger for the first time, I get it just the way they make it. I don't enjoy slathering a burger in so much ketchup or sauce, that you can't taste the beef.  This burger needs nothing on it. It has a luscious flavor. The meat is so flavorful. Their menu is simple, burgers, two kinds. Hamburger and cheeseburger and fries. They have achieved perfection. I think the bun is potato bread, with a golden crust. Dijonaise, pickles, and onions come standard on the burger. The cheese was melted perfect, and the fries were crisp yet soft enough.  The atmosphere of the place is awesome. One large room, with the kitchen open to the dining area. Tin ceiling, and liquor around the wall. They have outside seating, which is cute and allows you to watch the world go by.  They have a limited drink menu, with some liquor options. With the burger as perfect as it was, I regret not buying a cocktail here.  Try this place. If you love burgers, this is where you go.",0.96,0.838,0.125,0.037,0.49360902255639094
2016-09-28,5.0,"These burgers are life changing. The garlic aioli? The fries? The milkshakes? God, just writing this review is making my mouth water. Their outdoor seating area is gorgeous if you get the chance. If this place were more affordable on my tight college budget, I'd be here more often but I've eaten here 4 times this past year and each time was phenomenal. A must try! Maybe bike there off the 606 to relieve any food guilt or coma this place will inflict upon you.",0.5396,0.879,0.092,0.03,0.4193877551020408
2016-09-27,5.0,"In every way this burger was *exactly* what I thought it would be and at minimum met my sky high expectations, would even say it exceeded them. Came here for take out around 7ish on a Monday. Place was 1/3 full dine in with maybe five or so ppl waiting to get their food to go.   Step up to the register and order Cheeseburger w Fries w all toppings offered. Also grabbed a Half Acre Beer//not.daisycutter, was given the buzzer and sat down at the larger communal table in the middle.  In about 7 minutes buzzer goes off, grab and go. Burger, Fries and Beer - $21 and change.   15 minutes later at home, open up and happy to see that this burger traveled quite well and it probably even set up better wrapped in its foil packaging giving it time to rest and allow all the toppings to sort of get happy together. Fries were also still hot and crispy. You know the rest, two seared patties cooked to a perfect medium in true diner style fashion.  The bun is perfect in size, taste, and look for all that is going on with this masterpiece.  They strike the perfect balance with all the ingredients - cheese, dijonnaise, pickle and onion (no bacon necessary imo) - still allowing the excellent beef flavor to shine through.   [X] Will be back -",0.9898,0.834,0.16,0.006,0.5897777777777777
2016-09-26,3.0,"On a recent visit to Chicago, I was excited when I passed Small Cheval.  I've always wanted to try Au Cheval, but could never stomach the wait time. Overall, decent experience.  The inside of the restaurant is designed to look like a shack...and it feels like a shack.  The outdoor patio is gorgeous, so I would opt for that. Burger: I went with no cheese and added BACON.  I also asked to add lettuce and tomato (available by request).  Overall, burger was pretty good but nothing to write home about.  I prefer burgers with lots of toppings, so it might be better for the ""purists."" Fries: Great and a huge portion!  The condiments on the side (aioli and two types of ketchup) were great as well. Chocolate Shake: Classic and delicious.  'Nuff said.",0.9932,0.674,0.296,0.03,0.5645833333333333
2016-09-26,5.0,"Honestly, I don't understand why people wait in 4 hour lines for Au Cheval (I'm guilty of it myself), when they can just come to Small Cheval for an infinitely better burger and little to no wait. I've now been to Au Cheval 4 times and Small twice and really don't understand what the Au Cheval fuss is about. Now that I've had both burgers within a week of each other, I can confidently say the Small burger is superior to the Au burger. Something about the patties, the flavor, and the buns. Both times I've been to Small Cheval I've been in burger heaven, and all times I've been to Au Cheval, I've left pretty underwhelmed. Maybe it's just me, but next time you consider waiting in a four hour line, consider Small Cheval as a worthy alternative.",0.8998,0.862,0.115,0.024,0.5416666666666667
