date,star,text,compound,neutral,positive,negative,subjectivity
2015-12-05,5.0,"The burgers and fries are amazing, make sure to put the garlic aioli on everything. Service is pretty fast considering how busy they usually are. The only downside is it's a bit pricy for a burger and fries, but it's well worth the price in my opinion.",0.7615,0.772,0.199,0.03,0.629861111111111
2015-12-01,5.0,"Amazing! Simply amazing.  I'm not sure what kind of magic they perform on their burgers but they're awesome! It's nothing fancy, just a nice little burger joint with a straight forward menu. The prices are on the premium end, but in my opinion, well worth it.  This has become a place that we literally get cravings for now.",0.9313,0.673,0.263,0.064,0.7588888888888888
2015-11-29,4.0,"if you can drop by during their off hours, this is one of the best burgers you can get in Bucktown. Their house mayo, aolie and ketchup taste great - get some extra to take home. Amazed by how consistently they nail the medium rare patties every time, especially considering how thin they are. The fries are crisp but not greasy. You may want to sprinkle some extra salt on though - but that's just me. I'll admit, I'm not a huge fan of the buzzers they use to alert you when your order is ready. What is this, Fuddruckers?",0.8595,0.788,0.154,0.058,0.5515151515151516
2015-11-29,4.0,"It was just another day at work, and I needed adventure. Time for a lunch break. It was cold and windy, almost too cold for the walk I made to Small Cheval, but nothing prepared me for the shift between atmospheres once I walked in the door. Holiday season was full throttle, drinks were being had, and connections were being made. It was the older clientele that threw me off. No one in here seemed unattractive to me, but then again, Parallel Lines by Junior Boys was pumping through their sound system. A song I hadn't heard since my apartment was robbed, and all my music was taken away. Even the staff seemed sexual. As the track switched to Feel it All Around, by Washed Out, I knew I was right. This place not only cranks out excellent cheeseburgers, they are sexual cheeseburgers. I'm not gonna lie, I was a little intimidated about not knowing what I was getting myself into. I stepped up to the counter and the man at the register already had that look on his face that said, ""We only like customers who know what they want."" I didn't know what I wanted. I had never been here before, and I tried to put on my best face that said, ""Be patient with me. It's my first time."" It felt like they were about to rob me of the last piece of innocence I had. Once I had that burger in my mouth, I enjoyed every minute of it.   They made me wait. While I waited, I felt my anticipation grow. Or was it my anxiety picking up being surrounded in such a small space by sexual holiday foodies? I couldn't tell. My emotions were all over the place. I finally found my second wind of confidence and began to look around the restaurant. Along with the Richard Geres (circa early '90s) in puffy Columbia Jackets (ribbed for your pleasure), I began to relax as I noticed maybe 2 other normal people, being painfully normal. A young couple, oblivious to their surroundings, trapped in their bubble of heteronormative lifestyle. They stood out like a sore thumb. I began to wonder if this entire experience was all in my head like a David Lynch film. There was a host, more like a Maitre d, who managed to make eye contact with me. I had forgotten about the vibrator in my had, which would signal that my order was up. He assured me everything would be fine. The wait would not be much longer, and my food would be everything I needed it to be. I'm glad I ordered my food to go. As soon as i got my burger, I ran. More like a brisk walk. I knew that burger needed a minute to cool down to a temperature that would allow me to swallow without burning my throat. I was breathing heavy, and for the first time, I exhaled as I charged through the doors of my work and into the break room. For a moment, I was alone, and I undressed, I mean unwrapped, that burger slowly.  Then I showed that burger who's boss, sinking my teeth in like Lorena Bobbitt. Alas, I was in love, and she was beautiful. Pink on the inside. Moist. Medium, just like the man at the register told me it would be. My entire daydream faded as quickly as the onset. ""WHERE DID YOU GET THAT?"" It felt so confrontational. I was guilty. I stumbled over my words. It didn't take long to pull my coworker into my world. She didn't need to touch or taste in order to tell I was having a love affair with a burger. She only needed her sense of smell and the visual of the melting cheese and immediately knew what was going on. Finally, she left me alone so I could finish.",0.9937,0.786,0.14,0.075,0.5574772192827748
2015-11-25,4.0,"Yeah, yeah , yeah, I hear that everyone enjoys the burger from Small Cheval's older brother, Au Cheval. What if you don't want to schlep yourself and your homies all the way to the West Loop? Our answers have been answered by offering delicious burgas in Wicker Park.  Amen! Small Cheval's menu is much more simple than his older brother. I walk up and see a line but its moving because the guys on the line are cranking these burgers out in record time. I ordered a burger, no cheese with all the fixins with the bacon, fries and a shake (don't judge me). The place is small with extended outdoor seating. Everything here is super simple pop-up-esque dining.  I love it. You order. You pay. You find a seat and eat. First you need to recognize the amazing condiments line. Shout out to the garlic aioli! I have already decided to dip my fries and slather that on my burger. Our order arrived and the first thing I do is bask in this mighty burger's glory. Perfectly cooked and not overcooked which a lot of burgers can be. Mr. Sodikoff aint goin' out like that. The dijonaise on the burger adds a different level of flavor and adding to the juicy flavor. The bacon really makes the burger in my honest opinion. This burger is not the exact same as its older bro, Au Cheval and thats OK with me. Small Cheval has its own burger identity and I am a fan. The fries where golden brown and(dipped in garlic aioli) made that whole trip worth it and my chocolate shake (ps. You can make it a boozy shake if you want) was the cherry on top of an awesome dinner.  Prices are reasonable for a quality gourmet burger. They offer all kinds of drinks alcoholic and non-alcoholic alike. Easy to get to with street parking.",0.9948,0.783,0.176,0.041,0.531998556998557
2015-11-24,2.0,I don't get it.  It is a mediocre hamburger in a nasty space. The foodies love Cheval. I left scratching my head.,0.1531,0.672,0.176,0.151,0.65
2015-11-22,3.0,Small cheval is a really good burger and a pretty decent patio.    I was just expecting amazing which im not sure that the burger was.  The bacon and the sauce definitely make the burger.  They've got schlitz was a bonus as well.,0.948,0.602,0.359,0.038,0.707936507936508
2015-11-20,5.0,"Small Cheval does have a very limited menu but it definitely has one of the best burgers I've ever had.  The fries were on point as well.  A+ for also have garlic aioli, mayo, ketchup, etc on the side for convenient access.  Would definitely go back again.",0.9428,0.705,0.267,0.027,0.2771428571428572
2015-11-20,4.0,Burgers were delish... a little pricey.. but worth it.. for me... it was a little salty... but I usually like a little more bland than salty..... u must try their shakes,0.6375,0.822,0.178,0.0,0.4547619047619048
2015-11-20,5.0,"So this place has to be a cash cow. They simply churn out a very small menu, hamburger and slap some cheese on it and you have their second main entree, the cheeseburger. What a great concept! Sell one of the most popular burgers in Chicago in its own little hut...you have small cheval. If you haven't been here or its big sister Au Cheval, you're definitely missing out! Pit this on your bucket list. Also, the garlic aioli is an awesome touch. Now, If you're reading this Mr. Sodikoff, where can I find the pizza from the previous tenants?!",0.9357,0.828,0.152,0.02,0.44958730158730165
2015-11-19,4.0,"The part that I love most about this place is the simplicity of the menu. Do you want hamburger? Y/N Do you want cheeseburger? Y/N Fries? That's about it. Burgers were filling and made it hard for me to breathe later. The beer was on the pricier side. Walked away spending $30 on 2 burgers, a beer, and fries. Eeeeek. You can save money elsewhere, but if you're around, yeah this is fine.",0.8534,0.821,0.163,0.016,0.42833333333333334
2015-11-18,5.0,The coffee milkshake is amazing! The great Cheval burger without the wait and the best service I've had with this company yet! Great job!,0.9588,0.539,0.461,0.0,0.675
2015-11-18,4.0,"My favorite dish at Au Cheval is their burgers so instead of waiting for the usual hour I just head over to Small Cheval! I would save this for a recovery meal and for your hear day bc you'll want the burger, fries and the Shake!",0.7494,0.799,0.166,0.035,0.5499999999999999
2015-11-17,5.0,"Small Cheval is a amazing addition to the hog salt family. Delicious Burgers!, excellent service, and a staff that cares. Bravo Small Cheval!",0.9411,0.535,0.465,0.0,0.74
2015-11-16,5.0,"After debating for hours about whether to go to Au Cheval or Small Cheval (here after referred to as Regular and Small, respectively, as per our nickname for the places), my friend and I took the plunge and decided to try Small this past Friday. She was insistent on walking and avoiding public transportation (an abnormal New Yorker) and Small was only a 20 minute walk, whereas Regular was an hour and 20. Small won by a landslide (considering the 35 degree weather). The menu was horribly extensive (just kidding) - a whole 3 items to choose from. But really, those three (or for my needs, two) items on the menu are all you need - fill your stomach with an out of this world cheeseburger and an order of their delicious golden fries and you'll be thinking about this meal for days, as I've been doing. Another one of the best parts is the 5-part condiment line, including 2 different kind of ketchups, mustard, mayonnaise, and garlic aioli. Yes, that's right folks, UNLIMITED GARLIC AIOLI.  My friend and I rated the cheeseburger an 8 - it was double-pattied juiciness, with a great dijonaise, pickles, and lettuce. It was probably the best burger I've had in a longggg time and definitely more than I expected from Regular's smaller sibling. To be honest, I would say that in some instances, this burger may actually be better than Regular's. Yup, that's right, I said it. Avoid the long lines and wait times at Regular and go to Small for a hella good burger.  And even though we were so full and ate so much we felt like vomming, we took the plunge and got a milkshake as well. Chocolate? Vanilla? Hm, vanilla. No, chocolate. Most people have chocolate. But I usually like vanilla. The debates continued so my friend went ahead and asked someone who worked there what he would do, and he recommended chocolate, so we went for it. When it came out, he also brought us a complimentary vanilla milkshake, which was so nice of him. That milkshake was so good. Chocolate won. Small wins.",0.9961,0.787,0.187,0.026,0.43205885024066853
2015-11-15,4.0,"This is the little brother of Au Cheval, of legendary burger renown. The burgers here are not as huge and amazing as the original, but still outstanding. The place is much more casual and much less busy. You order at the counter. If you don't go in expecting Au Cheval 2, then its a great place with a great burger.",0.975,0.671,0.309,0.019,0.6798611111111109
2015-11-15,5.0,"If i was blind folded and had to taste test multiple burgers to guess where theyre from, I would guess Small Cheval's burger right every time! Truly a tasty burger!! Small place, so avoid busy times or take to go.",-0.5487,0.784,0.067,0.149,0.3837301587301587
2015-11-13,5.0,"The cheeseburger was incredibly delicious and I absolutely loved the fries with garlic aioli dipping sauce. I wish I could eat more, but the burger was very filling. We went around 6pm on a Thursday and the wait was not bad at all. Loved the vibe. It was too cold to sit outside, but seems like its a great outdoor space in the warmer months. I would definitely recommend Small Cheval to any carnivore.",0.9878,0.627,0.373,0.0,0.6151515151515151
2015-11-11,4.0,"Yasssss! Why had I not come here sooner. Burger meat is just like Au Cheval's. Comes with Dijonnaise, pickles, and onions. You have to pay extra for bacon. Lettuce and tomato are complimentary if you choose to add it on. Very simple menu. Fries are ON POINT. Perfection. Thick, but not too thick. Every surface area of each fry was crispy. Love that they let you get condiments, including garlic aioli, yourself. It's an order, get a buzzer, and pick up your order kinda place. It is a little pricier than other ""casual"" burger joints, but you do get an amazing burger. There is a little bar with beer options. Friendly staff. One point off for no egg as an add-on option.  Btw, their bathroom soap smells really good. LOL",0.9836,0.767,0.206,0.026,0.5397108843537415
2015-11-09,4.0,"Delicious burgers, delicious fries. I'm definitely a fan. I wish they offered a smaller portion because I definitely cannot finish a burger this size!",0.9523,0.418,0.582,0.0,0.7
2015-11-08,3.0,"If you don't want to wait forever for the real thing at Au Cheval, head over to here to Small Cheval.  Cool space and more room to eat and breathe compared to the cramped diner of the original.  Simple menu of hamburger or cheeseburger with or without bacon and a side of fries.  You spend more time thinking about what you want to drink than eat here and which condiments off to the side you want to use.  I was a tad disappointed in the actual burger, the bun seemed sad and not as toasted buttery goodness as the original, and the patty was on the dry side and not as juicy.  Sigh.  The crispy fries and the amazing garlic aioli were the redeeming factors.  I wish I could have tried one of their boozy drinks (the double chocolate martini caught my eye) or milkshakes, but that will have to wait for another time when I'm back on the dairy wagon and no longer nursing.  Or I can just go to Au Cheval, it really is worth the wait and trek.",0.5715,0.864,0.075,0.061,0.4798319327731092
2015-11-07,3.0,"If they didn't have Cheval in the name it would be a four or five star burger.  The burgers are perfect.  Juicy and flavorful. My biggest complaint is the bacon is not the same peppery bacon slab they serve at Au Cheval. It was two little half strips of bacon.  Plus you can't get an egg on it. I was hoping this would be a great way to get an Au Cheval without the multi hour wait. This is just a good burger, but costly.",0.6757,0.863,0.101,0.037,0.48020833333333335
2015-11-06,5.0,Loved my coffee milkshake and burger!  Outstanding combo!,0.8585,0.414,0.586,0.0,0.8375
2015-11-05,5.0,All I will and can say is I had one of the best burgers of my life here. Their chocolate milkshake was also a glorious treat.  Everyone should come here.,0.9022,0.684,0.316,0.0,0.3
2015-11-04,2.0,"Nothing special. It's not terrible, but a hamburger is not worth nine dollars unless it's some kind of special grass-fed, locally sourced, organic thing. And three dollars extra if you want fries? You're better off going to steak n'shake or in and out burger.",0.8583,0.719,0.242,0.039,0.4678571428571429
2015-11-02,5.0,Great burgers.    Quick and easy without the lines.    They keep it simple.   Cheeseburger or hamburger?   Wait was very short.,0.7906,0.708,0.292,0.0,0.5660952380952382
2015-11-02,5.0,I go late at night during the week to avoid the crowds. Nothing is as delicious as this burger. Also love the patio.,0.7717,0.653,0.271,0.076,0.7333333333333334
2015-10-30,4.0,I'm not huge on presentation or paying extra for anything fancy but I do love food. I think these burgers are still really good. I wanted a little late night snack so my friend and I split a burger and we liked it!,0.9653,0.612,0.36,0.028,0.5857142857142857
2015-10-30,1.0,"I usually wait for a few visits before writing a review... BUT.. the bad taste from my one Sunday Afternoon stop has me bewildered.  Many times I have driven by the large painted sign advertising the micro-menu, so when I stopped in and was told that the signature burger was not available at 3:30pm 'while they change over' ... I was put into shock.   The staff offered a shake as the only menu option in token consolation.   A G! D! burger shack... cinder block building with a service bar and simple seating has no room closing down a micro-menu for a change over seen in full menu restaurants.   This encounter with inflated self-worth and egotism has me doubtful that I will ever taste this burger that has been so well received.  -  update: I did stop in and was actually served ... tasted like what I remember Wendy's tasting like but 10 or 11 bucks for an OK cheeseburger that left me still hungry -I bet with a fry I would have been filled but that would have left me at $15 or so.",-0.5351,0.85,0.052,0.098,0.4338293650793651
2015-10-29,4.0,"Great burgers and fries at Small Cheval.  The line was wrapped around the inside when we visited, but it probably only took about 20 minutes to get to the front and order.  Once ordering our food was ready super quick.  Love that you can get your own condiments including the Garlic Aioli!  I do think the burgers are better at Au Cheval, but for the quick wait,  Small Cheval is well worth it!",0.9806,0.711,0.289,0.0,0.5763888888888888
2015-10-25,5.0,"For those who don't want to make the trip to Au Cheval and wait 3 hours to be seated, this is definitely the place for you. You're limited to only burgers, however they are amazing. Highly recommend slathering some of their garlic aioli  on your burger. They also offer some cheap beers/liquor. Not a ton of seating available but they do have a nice patio out back.",0.8066,0.824,0.14,0.036,0.5758730158730159
2015-10-24,4.0,"One place I know that's probably best known for their sauce, but it's worth the trip! Garlic Aoli!! Dip your fries in it. Slather your burger with it. Or stick your straw in it! I just loved it and how they make all their condiments themselves. It really showcases their attention to detail.  Their fries were perfectly deep fried where it's not soggy and had that tiny snap in it with every bite. Plus the standard medium rare burgers were really above par than other rivaling places. And the $3.99 vanilla shake was really a steal for the sweet creaminess that it was.  But the burgers and fries, as good as they were, wasn't worth their asking price. If the burgers were a few bucks less or, honestly, slathered with their garlic Aoli, this place would be rated so much higher.  All in all, grab the cup for water and fill it with the Aoli and you'll forget whatever else you were having. Nice people, great location; this place is worth the trip back!",0.9888,0.75,0.206,0.044,0.39280303030303027
2015-10-24,5.0,"Finally went here today for a cheeseburger.  We got there about an hour after they opened and there was only one table open inside.  Luckily, it was gorgeous today and there are plenty of tables outside.   I had a cheeseburger with bacon and fries.  The food didn't take long to be ready.  My burger was awesome!!!   It definitely lived up to all of the ""hype"".  Was it the best burger I have ever had - maybe.  I honestly can't think of the last time I had a burger that delicious.  The fries were great too but nothing special like the burger.  You can only order a hamburger, cheeseburger and fries (foodwise).  The inside is pretty dark and small.  Street parking was easy but we were there early.  I had a vanilla shake on the way out.  It was yummy!  I want to come back to this place next time I am craving a cheeseburger.  I am always craving cheeseburgers so I will be back soon!",0.9778,0.755,0.202,0.043,0.5681904761904762
2015-10-23,5.0,"When I stuck my head inside to inquire if my dogs could sit at the very cool back patio, the manager smiled and said,  ""Absolutely!"". The place has such a great vibe! Totally yummy,  Cheeseburger  with Bacon,  fries and Chocolate milkshake with a shot of Baileys,  yummy again! Sat outside on a gorgeous night with my 2 Labradoodles (who incidentally were watched by 2 gorgeous angels named Alice &  Rebecca whilst I ordered) and we were all loving life!!  Everything was just exactly perfect!!!   Will return many times!!!  Thanks for reading hope this was helpful.",0.9917,0.622,0.361,0.017,0.6032142857142857
2015-10-22,4.0,"So this is the little, less attractive sister of Au Cheval huh?  If you ask me she looks plenty attractive, and can hold her own. I love that this place is just straight to business, which is making some succulent, make you taste buds do the whip and nae nae type burgers.   Burger and a shot is a nice touch, but I was on my lunch break, so burger and a Coke suited me fine.The burger was oozing with flavor, and that ooey, gooey, cheese on top was like icing on the beef patty cake.  This is a nice new addition to the Wicker Park dining scene They have a nice outdoor patio on warmer days, and the 606 trail is literally across the street. So you can, walk, bike, or jog off some calories if you wish. I already picture myself here next summer, basking in the sun with a burger in one hand, and a beer on the other. FYI: That garlic aioli is that crack sauce!",0.9865,0.801,0.199,0.0,0.6354437229437229
2015-10-22,5.0,"Rivals Au Cheval for it's burger and fries, no questions. Have been here twice now, burgers both times (it's all you can get). But the burgers...man.... they rule.  Top your char-broiled, cheesy, mayo, pickles off with some aioli from the complimentary condiments bar and you're on your way to a great afternoon in Bucktown.  Easy entry, solid food, great hipster selection of beers, and GET A MO**ER F**CKING MILKSHAKE.",0.9349,0.754,0.219,0.028,0.6333333333333334
2015-10-21,3.0,"Burger patties don't come hot and fresh, they sit in a metal tray.  The kitchen is tiny so there is a backup of some sort, causing the patties to sit on standby. Burger is still very good regardless but they need to do something to improve this.",0.7647,0.847,0.153,0.0,0.6575000000000001
2015-10-21,4.0,"I'm so glad I was able to check this place out before the cold sets in. I got here around 6:30pm on weekday and there were only 3 people in front of us. Awesome! The inside is small, dim and a bit noisy. The outside patio is cute and spacious and we luckily came on a warm fall evening. Not sure how accessible this place will be during the winter when there is not enough room to sit inside. The bf and I both got the cheeseburger with bacon and shared an order of golden fries. We both thought the burger was really good. The taste is veeery similar to au cheval's burger. The fries are crunchy and cut a little thicker. And the garlic aioli is addicting as ever. I feel like the amount of food was perfect. I had just enough space to grab some dessert afterwards. Overall, this burger is one of best burgers I've had. It's not as decadent as au cheval's, but it does the trick and it's much easier to get ahold of. I'll be back, for sure.",0.969,0.826,0.153,0.022,0.5864444444444444
2015-10-21,3.0,"Very underwhelmed. Maybe it's because I've never been to Au Cheval, so I don't have a reference point; but I do know that 30 for two cheeseburgers and fries was a little excessive.  The burger was good. It reminded me of burgers from back home. The fries were...well, fries. Nothing to even mention. The aioli was really boring.  The service was really good for being self-service. Everyone was kind and helpful.  Do yourself a favor and just go to Parts and Labor. Same thing, cheaper, without the little-kid-trying-to-fill-big-brothers-shoes vibe (think ""Stand By Me"" but with more burgers).",0.9528,0.789,0.179,0.031,0.5525
2015-10-20,1.0,"Nothing like its predecessor, Small Cheval promises to underwhelm. The line is not nearly as long as at it's big sister spot... So that's a plus. At a bare minimum, at least I didn't have to wait as long to be disappointed. When they say, ""no substitutes"", what they mean is... We mostly pre fab your burger like on a conveyer. Henry Ford said it well.... You can have any color Ford you want.... As long as its black.  The people were really nice. But, it seemed to be a huge ordeal, and just not possible to avoid putting mayo on my burger. Hey mayo... F$&# you! That s#!+ is disgusting, and I have an allergic reaction to that horrible stuff.... Ok. Maybe it's partly in my head. Like most people's gluten allergies. Hahaha. But, I wasn't asking for a substitute. Only that you skip a step. I get that you have a small kitchen, and can't have all the things that one can order on their burger at the main location. But, they then proceeded to tell me that I could order two kids cheeseburgers, and reassemble them to make a single adult burger.... Oh, but it would cost me twice as much. Seemed a bit petty and insulting. That only said, ""We can do what you're asking. But, we're too stuck up to actually do it.""  I felt pretty embarrassed in front of my friends that, over the last three years, I've convinced they were going to eat the best burger of their lives. I had to order the mediocre fries, and pretend to be happy with them. But, the ketchup was fantastic. If you like mayo, it's probably not a bad experience. If you want more say in what goes onto your plate, check out Revolution. They have a great burger, that you can get without mayo.... I mean, seriously.... It's a food item that smells like morning breath. Hahaha.",0.9932,0.746,0.189,0.065,0.5860500610500611
