date,star,text,compound,neutral,positive,negative,subjectivity
2016-06-01,4.0,"Now you can get Au Cheval's famous -- justly famous -- burgers in Wicker Park, and without having to wait in line for two hours to fight for a table. Almost.  It seems to me that the burger here is in the *spirit* of Au Cheval's, but isn't quite the same. The whole thing is a little more orderly, a little more assembly-lined, and has just a hint of fast-food about it.  It's still an extremely good burger, the pickles and sauce and bun are still very nicely done, but you are a little more likely to think about it competing with Shake Shack. One other difference from Au Cheval is that you can't get an egg on your burger here.  I'm not sure they should keep ""Cheval"" in the name if they're not going to go around sticking eggs on things, but I guess frying eggs to order would destroy their ability to turn these things out at high speed. Bottom line: It's not going to replace Au Cheval in my life -- but I'm still glad it exists.",0.7569,0.862,0.081,0.057,0.6071604938271604
2016-05-31,2.0,"I was expecting more of a burger to be honest. I wish I had known that I could add lettuce and tomato. This information wasn't available on the menu, instead it was on the outside of the building on the wall.  The burger was pretty average. Meat was cooked nicely, but a bit greasy. Fries tasted fresh.",0.8402,0.807,0.193,0.0,0.59375
2016-05-30,2.0,"Please, $8 for a burger you can get at steak and shake? Plus milk shakes out of a machine not hand dipped? Ambience yes food no I went to Mariano's purchased a pup burger from the butcher they grilled it 5 times better and $ 3.00",0.4082,0.697,0.169,0.134,0.5
2016-05-29,5.0,"Fantastic greasy burger and fries. Beautiful and large outdoor seating area - small indoor space. Best enjoyed outside during nice weather. They come by and will serve you a beer or whiskey while you are waiting in line to order. No frills menu: burger (with or without cheese), fries, and shakes. As well as a few sodas from the cooler, a small selection of whiskey plus perhaps a cocktail or two and 5 or so beers on tap. Haven't had the shakes yet but plan to - a table near us said they were really worth it.",0.903,0.824,0.16,0.016,0.48154761904761895
2016-05-27,5.0,Top five burgers I've ever had. Just my kind of place.,0.2023,0.847,0.153,0.0,0.7
2016-05-26,3.0,"The highlights are pretty much the patio and the bun, as the burger was just average for me. The location is pretty cool - situated on a corner, with a simple & open interior and a secluded garden-style patio that is actually larger than the interior. But, this is a burger joint - so the food is what counts. While the burger was well cooked, especially for thin patties - it was entirely, entirely over seasoned. The overwhelming strong presence of salt was the primary flavor, which unfortunately didn't let the beef shine. I'm sad to say what I ate was essentially a nice & juicy cheesy salt-patty. The bun was by far my favorite part, and the savior of the experience. It would be a good sandwich to have for a late afternoon snack when you're having a late dinner - but double up on the water cups! The place was quick - both in paying and in preparing the food, and they had some good tunes playing while I waited. But, since the food was mediocre and, per other reviews here on Yelp, there is supposedly a better version of their food elsewhere, I would just recommend checking the original Au Cheval. Given the high praise for this concept, I'll have to reserve judgment until I conclude Chicagoans just don't know a good burger - but this was mostly a let-down, unless salty Shake Shack was the goal.",0.9866,0.813,0.166,0.021,0.6685434173669469
2016-05-25,3.0,"Outdoor seating. Burger looked delicious. Fries were great. Open late. Couple of things dropped ratings.. 1) Rats. We definitely saw at least one rat. It was running around behind the potted plants within the patio area. It destroyed any appetite we previously had. This brings my review to 3.5-stars.  2) Attitude. When I got up to the counter to order a drink, I ordered a straight vodka, which they don't carry (?). So I asked how big the house drinks were. The guy explained it was ""a 5 oz pour."" Cool man.. I don't really know how much that is (I don't think the average person has a really good sense of how much that is..). So I ask how much that fills in the cup - he got flustered and shrugged - which did not help me answer the question. To be fair, he didn't raise his voice or anything, but I was out with a friend and it was embarrassing for me to ask to begin with. So it only drops the review by half-star. This brings my review to 3-stars. So bottom-line, last night I had a 3-star experience. Would've probably been 5-stars on a different night. I'll probably try it again - and when I do I'll certainly update my review.",0.8851,0.861,0.098,0.04,0.4865800865800866
2016-05-24,3.0,"If I'm comparing Small Cheval with all the similar burger options out there, I'd have to say that it's okay. Don't get me wrong, a solid burger option for sure, but nothing out of the ordinary.  What I like: - If you just want a less sophisticated version of the Au Cheval special, you can get that burger with a lot less fuss! (Maybe minus some of the fancier ingredients like the egg, but I can't remember) - I also like the casual, communal vibe of Small Cheval - It's in Wicker Park, so duh, I like that  On the other hand: - If you want anything other than beer, burger and fries, you're pretty much out of luck Overall, I think Au Cheval is okay and likewise, Small Cheval is too. If you're in the area and looking for a good, classic burger in a laid back atmosphere, this is your place!",0.9933,0.702,0.298,0.0,0.43907936507936507
2016-05-23,5.0,"This is the best burger in the USA. I've been all over and this is the only burger that I genuinely crave whenever I'm in town. I used to think the Burger Joint at Le Parker Meriden, NYC, was it... But this burger holds all cards. The meat is juicy and flavorful. The bun is butter toasted. The ketchup has a certain twang to it... It's an orgasmic eating experience worthy of media coverage.",0.8481,0.881,0.119,0.0,0.6742857142857143
2016-05-23,5.0,"Top 5 burgers in the city, no question. For the price, there isn't a better burger. If you aren't up for the wait at Au Cheval, this will get the job done.",-0.4226,0.808,0.054,0.138,0.5
2016-05-17,5.0,"Quite possibly the best burger I've had this far. Make sure to add bacon, you will not be disappointed!",0.8628,0.625,0.375,0.0,0.7877777777777777
2016-05-16,5.0,"Super simple menu, everything was cooked perfectly.  Awesome condiments available and a few cocktails on tap.  Great little date night spot or for a large group given the picnic table seating - outdoor patio too!",0.9558,0.628,0.372,0.0,0.5252976190476191
2016-05-15,4.0,"Sooo good, can't wait to go back. And the line went by pretty fast for how packed it was. The only reason I didn't give it 5 stars is because the Fries were not that great.",0.4226,0.767,0.151,0.082,0.6583333333333333
2016-05-15,3.0,Overall pretty good but not fantastic. The shakes are awesome but the fries were way too salty. The music was so loud you couldn't hear yourself think.,0.7017,0.629,0.265,0.106,0.7166666666666667
2016-05-15,5.0,"This is my most favourite burger. Here's why: - it's perfectly cooked, with the teensiest of pink remaining - the buns are not an afterthought: they complement the burger and toppings, and don't collapse. Also: are they glazed with butter? I don't know if I want to know the answer to this question, but also: YUM - get it 'house style' with pickles et al. Trust. Just do it. There are three options: hamburger, cheeseburger, bacon cheeseburger. Not to get all Goldilocks-y but I think the hamburger benefits from the cheese, the bacon is gilding the lily too much and so: the cheeseburger reigns supreme here.  The fries are an afterthought in this review (DEM BURGS THO) but really aren't second fiddle at Small Cheval: they are deliciously crisp, perfectly seasoned, skin-on taters. You should go for 'em. Bonus points: unlimited access to garlic aioli. This ain't no ketchup-mustard-mayo only joint. Watch-out: no options beyond fries for vegetarians. Yelp note: COCKTAILS ON TAP, whatddup old fashioneds (and other delicious concoctions!).",0.9911,0.787,0.207,0.006,0.4493589743589744
2016-05-11,5.0,"Violet Hour followed by Small Cheval is a winning combo! I got there on a Tuesday night around 9pm. There was no wait, and our burgers were ready in no time. They were really tasty, the meat was juicy, fries were excellent... you got the point ;-)",0.5848,0.756,0.159,0.085,0.6416666666666666
2016-05-11,5.0,So Ive been going here at least once a month. I dream of their food. The fries are cooked perfectly. Garlic aioli is on point. Fast. Never too crowded. Great vibe. Eat here.,0.8834,0.731,0.269,0.0,0.6875
2016-05-04,4.0,"Really enjoyed Small Cheval. Service was good, and the burger (all the way) was very tasty, with a hearty side of fries.  Atmosphere is really cool, especially the patio, which was a great place to eat in the spring. They actually served Vernors...! Highly recommend this place",0.9457,0.711,0.289,0.0,0.56
2016-05-03,4.0,Great burger and atmosphere. Fries are okay. The only thing I'd knock a star off is for the price. Burgers should always be cheap! They do offer a lot of liquor for decent prices which is cool I guess.,0.8221,0.793,0.207,0.0,0.7111111111111111
2016-04-30,4.0,"A really great burger and fantastic beverage program (shakes, drafts and shots etc). Dinged it a star because their frys are weak, always. Love the focused menu (only burgers, frys and drinks) and the tight execution. If you're craving a cheeseburger, this spot (as well as the mothership, of course) needs to be on your radar.",0.9324,0.704,0.253,0.043,0.6934523809523809
2016-04-30,5.0,"Simply loved the burgers and fries, the customer service was by far amazing and very friendly faces to see as I walked in! Worth the wait and worth just siting in and eating there.  Also the ketchup and the garlic aioli, it gave the burger and fries such an extra kick! Just love, love, love the place.  Really looking forward in tasting Hogsalt's other locations!",0.9826,0.663,0.337,0.0,0.5019230769230769
2016-04-29,4.0,"The burgers are tasty. Not the best burger ever. The patties are thin, Well cooked; lightly pink in the middle.  Fries are yummy.  The patio and booze are a BONUS.  It's a Friday at 3.  They aren't very busy the service is quick.   You place your order at one counter, receive a pager to pick your order up when the pager goes off.  There is a large square family size picnic table in the middle  and diner  bar style steating along the wall.  We ordered 1 cheeseburger (9.95) with bacon ($2), fries (2.95) and a 7 acres beer(7) the total was $24 something with tax.",0.9317,0.871,0.129,0.0,0.39095238095238094
2016-04-26,4.0,"I was looking for a good burger. Read some of the reviews and decided to check it out. Went on a sunday night. It wasnt too crowded. There was a line. But the line moved quick. Ordered the cheeseburger and fries. Also got the chocolate milkshake with baileys added.  The burger was so good! Its a simple burger. No fancy toppings. Thats exactly what i was looking for. The fries would good, a little too salty. The ketchup was good too. Not heinz! Milkshake was amazing. Its thick unlike other milkshakes i have had before. Definitely worth the wait. Only thing that is a con was the pager system. The day i went i guess they were having issues. Mine and a couple others pagers werent working. So the food was sitting there for a couple minutes getting cold.",0.9544,0.838,0.146,0.016,0.5612244897959184
2016-04-24,3.0,"Your burgers are tasty. This format is far more easy to deal with. Also closer. The fancy burger dad is getting old, but their barebones delish burger doesn't get old. Yum!",0.3375,0.926,0.074,0.0,0.5466666666666667
2016-04-23,4.0,Perfect greasy burger joint. Simple menu. Quick service. Milkshakes are killer and the various homemade dipping sauces are great on fries or even on the burger. Fries are a tad too salty but that's probably just me. Outdoor patio is fantastic too. Overall atmosphere is great.,0.93,0.688,0.266,0.046,0.5946428571428571
2016-04-23,4.0,So dang good! The boyfriend and I came here for dinner last night. I had a cheeseburger to which I added their delicious garlic aioli and he had a bacon cheeseburger. We shared a side of fries. Their burgers are solid and their fries are perfectly crunchy on the outside and soft in the middle. I'd definitely come back here again. The prices are a tad on the higher side.,0.9522,0.759,0.241,0.0,0.37878787878787873
2016-04-22,5.0,"My 9 year old loves burgers and fancies himself a food critic so when he said ""this is my new favorite burger place"" I knew I to give them 5 stars. The menu is simple. Burger or cheeseburger. Fries or no fries. And a great selection of beer. And the ketchup, Sir Kensingtons, is the best damn ketchup ever to hit my fry loving mouth.",0.9313,0.663,0.246,0.091,0.5730983302411873
2016-04-22,5.0,Great restaurant!!  The burgers were juicy.  The fries were great.  I loved the staff because they were super friendly.,0.9674,0.397,0.603,0.0,0.6933333333333332
2016-04-20,4.0,"All I can say after eating here is, wow! The burgers were cooked to perfection and the fries were fresh and crispy (not overdone).  The wait however is another beast. Prepare to spend about 30 minutes or so in line and waiting for a seat. The seating arrangements are along the outside of the building and a community table plopped in the middle. When arriving, I didn't expect for that long of a wait, but I'm glad I waited!  The service was good, even though you're waiting in almost a painfully long line, servers approach to take your drink order while you wait (huge plus). You just make sure to add it onto your bill at the counter.  You MUST get the garlic aioli dipping sauce. I dipped my fries and burger in it. I honestly wanted to take some home with me. Absolutely delicious!!!!",0.9532,0.828,0.145,0.027,0.6365740740740741
2016-04-20,4.0,There's a pump container of garlic aioli alongside the ketchup.  What more do you need to know?,0.0,1.0,0.0,0.0,0.5
2016-04-20,5.0,"The burger is top-notch and I would put Small Cheval in front of other Chicago favorites. I've never waited in line and the seating allows for easy in / out. In addition to the great burger, the food is reasonably priced.",0.8689,0.786,0.214,0.0,0.6597222222222222
2016-04-19,4.0,"I had always wondered what this establishment was because it looked weird from the outside, finally decided to visit and was I surprised. First off the decor was really cool it reminded me of a little cabin, then the food, oh my the food. You can't really go wrong when making a cheeseburger but small cheval went right, from the toastyness of the bun to how much the cheese is melted it is definitely one of the better burger places in chicago. Only reason I'm giving 4 stars is because I've never liked their fries and it's a bit expensive for a burger joint. But definitely a nice spot to check out, I have yet to sit in their patio.",0.9554,0.788,0.178,0.034,0.6452380952380953
2016-04-18,5.0,"Small Cheval is the BBE - best burger ever. If you don't want to wait 4 hours at Au Cheval, especially if you are just going for the burger, switch over to Small Cheval. The menu has three items - Hamburger, Cheeseburger, and Fries. No more, no less. The hamburger is the best in Chicago if not the best you will find anywhere. The meat is juicy, the cheese is creamy, the sauce drips down your hands, and the pickles are crunchy. There is something special between those two pieces of buns. The garlic aioli pump can get real naughty real fast. Get the fries well done for crispy goodness.",0.9476,0.788,0.164,0.048,0.5022486772486773
2016-04-17,4.0,"What can I say that hasn't been said already. Got the cheeseburger with bacon, chocolate shake, and fries. Small quantity of fries, and just a regular milkshake. The burger, obviously, is where it's at.  Great bun, good patty, and just plain delicioso overall. Sit outside on the patio and grab a drink with a burger; you won't be disappointed.",0.834,0.819,0.153,0.027,0.38711843711843713
2016-04-17,4.0,"Nice place. Cool outdoor area, very small indoor space. Can get busy, but not unbearable. Only downside is that it's pricey for a small burger joint. Overall, good place to go when you're craving a burger.",0.8181,0.759,0.241,0.0,0.55875
2016-04-16,5.0,Best hamburger I have tasted EVER in my life. Like seriously that greasy brioche bun  with the extra mayo and cheese mmmm,0.7184,0.682,0.254,0.064,0.35555555555555557
2016-04-16,2.0,"Go to the main Au Cheval. Small Cheval isn't worth the price or quality compared to the main location. I was quiet disappointed. Yes, it has a trendy appeal and a nice patio but don't settle for anything less than the main headquarters.",0.0943,0.835,0.087,0.078,0.45499999999999996
2016-04-10,4.0,Same burger as Au Cheval without the wait. One of the best burgers I've ever had. Decent beer list and shakes.,0.6369,0.826,0.174,0.0,0.3638888888888889
2016-04-10,4.0,Great burger and the fries were ok. The menu is very simple and the place is small. The inside gets packed during lunchtime. There is one communal table in the center and bar seating on the perimeter of the restaurant. The outdoor area looks really nice. It is pricey for a burger but the price is written outside of the restaurant so you should know this going in.  Did not have a shake but they looked awesome!,0.9172,0.834,0.166,0.0,0.5330357142857143
2016-04-10,4.0,"Small Cheval is a pretty darn good burger joint. This younger sister restaurant to Au Cheval is a no-frills, pared-down sibling to its more elaborate predecessor. Only serving burgers, fries, shakes, and boozy adult beverages at a marginally smaller size, but doing it oh-so-well. Went here around noon on Sunday for brunch. And just a word of advice: please if you wake up early enough, get there before 12:30 pm, because this small place fills up pretty rapidly. We had new patrons hovering and hawking our corner spot like a predatory bird waiting for mice, prior to leaving. Yikes!  I got the cheeseburger, and my S.O. got the cheeseburger + bacon, tomato, and lettuce for $2 extra. We shared an order of Golden Fries and had two hair o' the dog as well. The cheeseburger at its base had two perfectly griddled beef patties cooked to Medium (my favorite cook for burgers/arguably the best! Thanks, Small Cheval!), a quick smear of dijoinaise, a smattering of minced red onions, a handful of tangy pickles, and melty, gooey American cheese. As for the double-fried Golden Fries, they were so mouth-shattering good. Like as soon as you bite into it, a nice crispy crunch would yield. A pitch-perfect amount of salt on it, too. Reminded me so much of Hot Doug's duck fat fries. R.I.P. Hot Doug's  :-( My only -- and I mean only complaint -- is that their use of the all-natural Sir Kensington's ketchup for their fries was just a touch too grainy and reminded me of flavored tomato paste. Sorry, y'all !!! But I am firmly a Heinz ketchup type of gal. Revision: There was a Heinz ketchup dispenser! It was just less vivid and appealing than the bright red Sir Kensingon's ketchup dispenser. Ooops! My bad! :/",0.9901,0.78,0.164,0.056,0.5738973063973064
2016-04-09,4.0,Has a lot to live up to my friend said being voted best burger in the USA.  Burger was very juicy and lovely added bacon and the fries  were good.  A little pricey and it was way to packed felt a little hurried but all and all liked it.,0.8975,0.761,0.239,0.0,0.53125
2016-04-07,2.0,"If you've got a hankering for something resembling Au Cheval's burger, this is it. If you're also looking for the most overpriced casual meal for 2 in Chicago, this is also it. The good: Solid burger, good fries, nice small beer selection. The set up is cool, open seating, communal, a bar rail around the perimeter with stools.  The bad: 2 burgers, 1 medium fries to share, and 2 beers: $42. FORTY TWO DOLLARS. There are no waitresses, you order at a counter and come pick up your own food from the grill. Cans of soda are in a cooler on the floor. The burger is wrapped in tinfoil, comes in a plastic basket. Fries are in a paper bag. The beers come in plastic cups. The silverware is plastic. So for a restaurant where I get my own food wrapped in tinfoil, don't get a real plate, glass or silverware, and am not seated at an individual table, how the hell can it cost FORTY TWO DOLLARS for 2 burgers, a medium sized french fry and 2 beers?  If you want bacon on your cheeseburger it's an extra $2, so you can definitely make it a more expensive date if you're feeling a little kooky.",0.8043,0.842,0.108,0.05,0.5441666666666667
2016-04-07,4.0,"If you like grilled meat with toppings and bread on either side, you will like this. Double-decker hamburgers and cheeseburgers built with thin patties that remain juicy but not dripping. First bite was an absolute rush of flavor that overwhelmed the senses.  Fresh cut golden fries are pretty good and serve as a nice delivery vehicle for garlic aioli, mayo and gourmet or regular ketchup.  Austere decor is a bit divey but cozy. Their website shows several sit down tables but when we went there was one community table in the middle of the room with bar style seating around the perimeter.",0.9428,0.805,0.172,0.023,0.5230111768573307
2016-04-06,4.0,"(Read this with a little twang....) So this right here place is delicious.  Burger is nice, sloppy, and greasy. No distractions: just burger +/- cheese and a pickle. (that's what I know at least.) Smother your face. Mmm, just like that. Now dip your fries.  Ketchup. Their fancy ketchup with the little man in a monocle.  Holy cow, I think I eat more of this then the actual food. (But both are good.) If you want, order a pop, beer, or drink. They have it. (Just don't think you're going to get fancy and have a glass of wine. No room for that.) You'll see a lot of date-type/couple nights here. Don't go trying to bring a big group and expect seats for everyone. Be prepared to sit in a big a.s table and have to manipulate yourself so you're not awkwardly making eye contact with the stranger across the room. OR you can sit along the sidelines bar-type stools.",0.64,0.855,0.089,0.057,0.5180272108843537
2016-04-06,5.0,"Dear Small Cheval, Thank you for being you. Don't ever change.  Love Always, Laura  I LOVE small cheval, would it be fair to say one of the highlights of moving to Bucktown was this fine establishment. I've never had Au Cheval, but those who have, have said they're almost the same (about 90%) there, I like those odds. The burger is juicy and delicious, and the French fries!? I also love the selection of dipping sauces, because what would a great burger place be without a million and 1 dipping sauces.  Warning: it's small and has communal seating, so it's best to go during ""off times."" Also typically tough for a big group, but nevertheless worth your while.",0.9864,0.682,0.269,0.049,0.4755208333333333
2016-04-01,4.0,"If you're looking for a good burger, beer and noisy, festive atmosphere. Small Cheval is a good stop. You walk up to the register, order and food is out quickly. No long wait like at their mother restaurant. However, it is NOT Au Chavel. Though prepared similarly, the burgers were not as good. Can't tell you exactly why, they just aren't. But matching Au Chavel is a high order. And on a weekend, you'll be lucky to find a place to sit, especially during the winter when the patio is closed. And be warned (or happy) this place is loud! Loud music, loud people. But also very social. The giant table promotes conversation and meeting people, so go expecting upbeat fun, not an intimate evening. A great sports debate broke out on our visit which left us all smiling.  Final warning... not a good choice for families for most of the above reasons. If your kids want burgers, get them to go, because even if you find a place for more than two to sit, it would be like taking your 8-year old to a boisterous bar after a Blackhawks game.",0.9792,0.765,0.183,0.052,0.5378571428571427
2016-04-01,5.0,"Small selection, big taste! This is Au Cheval's kid brother.  It is an old school burger joint but with high quality burgers, and awesome shakes! Culvers = No Steak & Shake = No Small Cheval = DUH!",0.2206,0.672,0.131,0.197,0.4628571428571428
2016-03-28,5.0,"This place is perfect. I absolutely love Au Cheval, so naturally I was ecstatic when I heard Small Cheval was opening.  I usually go at off-peak times and have never had to wait in line for more than 5 minutes.  The burgers are so delicious and satisfying, I don't know how they do it.  I usually just get the cheese burger house style with no additional add-ons, and everytime I go it exceeds my expectations.",0.9616,0.735,0.238,0.027,0.6000000000000001
2016-03-28,5.0,High end walk in dinner with to die for burgers! No matter if you're in the mood for a beer or a great milk shake they got it all. You will not be disappointed!,-0.1606,0.617,0.184,0.199,0.68
2016-03-28,3.0,"The burgers here are great. However, we are in Chicago, and at $12 for a Bacon Cheeseburger, there are many places where BC's are excellent. As you'll read everywhere, it is not as good as Au Cheval (and there are not egg options to make it so). If this burger was $8-$9, I would walk over more than once or twice a year. Make no mistake, this will definitely fit the bill if you're craving a burger. But with advance planning there are better choices.",0.8718,0.761,0.166,0.073,0.6071428571428571
