date,star,text,compound,neutral,positive,negative,subjectivity
2016-06-22,2.0,Have been to Fairways twice. First Time we had lousy service and didn't come back for 2 years. Tried again tonight and it's Dead and depressing. We ordered a cider and they didn't even any. Just feels like they don't care.,-0.8892,0.686,0.05,0.263,0.42666666666666664
2016-06-07,5.0,"Mark and his staff at Fairways were absolutely awesome! They accommodated our crowd of 20 and the staff was everything we could ask for. They were very available and willing to meet the needs of the crowd. On top of having a fun and energetic evening, the staff made sure we were satisfied and had a great night. The ambiance was everything I expected and more. I will definitely be back and will be sure to spread the word to others to check this place out! The food was great, the drinks were great, the staff was great, the golfing was great. Could not have asked for any more.",0.9922,0.677,0.323,0.0,0.6332098765432099
2016-06-06,5.0,We went on a recent Friday night and were impressed with the quality of the food. Not your usual tavern fare. The street tacos and flat bread was especially good. Also excellent drinks from a friendly bartender.,0.9254,0.697,0.303,0.0,0.5892857142857143
2016-05-16,5.0,"So enjoyed the Brunch menu....from the luscious, warm beignets to the cinnamon swirl French toast with slices of duck you will love breakfast. Lunch is just as delectable with pulled pork/frites/farm cheese curds or veggie skewers of mushrooms, peppers, and Amish chicken over a bed of warm hummus...",0.9381,0.731,0.269,0.0,0.575
2016-04-06,3.0,"This is a good local area for a drink and bite.   I've been numerous times and service is not consistent.  The last time there, it took over twenty minutes to even place a drink order, and another fifteen to receive them.   The service remained slow the rest of the day.   Other times have had slow points, but this was by far the worst.  I've been in big and small groups.  The food has always been enjoyable.  Nothing memorable for being outstanding, but a good place visit.",0.8591,0.787,0.155,0.058,0.5104166666666666
2016-02-13,5.0,"Great food, great service AND we love the indoor golf. Perfect way to get our golfing fix in!",0.9545,0.461,0.539,0.0,0.775
2016-02-06,4.0,"I enjoy the concept and love the decor. It's a very spacious bar for Lincoln park, so it's great for crowds. Food was decent, but could have been better. Many standard items like nachos or charcuterie plate were meh, but the bison poutine was a winner.",0.9598,0.63,0.345,0.025,0.47708333333333336
2016-01-30,3.0,"Came here for the bottomless brunch. The atmosphere and food were great. It's a small breakfast menu but we ordered 4 different dishes and each was delicious. Gave it 3 stars for the terrible mimosas. We each had a good 7-10 drinks and left sober. The orange juice to champagne ratio was easily 3-1. So if you want to get your vitamin c fix, come for the bottomless brunch. Otherwise get the food and skip the mimosas.",0.9505,0.71,0.244,0.046,0.5981481481481481
2016-01-17,4.0,"Fairways delivers on the plate as well as the glass. They have a solid bunch deal at $25 for 1 brunch item and bottomless mimosas in Saturday's and Sunday's.  The nightlife here is severely underrated. I've came here the last two Saturday's and music, crowd and drinks were all on point.  Never tried the golf simulation.",-0.0772,0.884,0.064,0.052,0.08333333333333334
2016-01-10,2.0,"Pretty dissapointing! I had been looking forward to going to this restaurant for a while. We went in to grab some lunch and watch some football.  $50 got us a chicken club, primerib sandwich, a mimosa and a beer.  The chicken club had nothing to it. It was WAY more bread than anything else. Didnt even seem like a whole chicken breast for the entire sandwich. I was very hungry and left the restaurant still mildly hungry. (You do no get any side btw - we heard a guy get pretty angry at the table behind us.)  The prime rib sandwich was good. However we were charged a dollar more than on the menu and again...no sides so worth it? Prob not. The beer/mimosas were at a good price  (didnt qualify for bottomless mimosa because I wanted lunch :( )  Our waitress was great!! The only reason we would even think of returning.",0.918,0.799,0.137,0.063,0.6712499999999999
2016-01-02,5.0,"We went here to celebrate New Years Eve 2016 based on a recommendation from a friend, though we had never been there previously. Overall we were very pleased with the decision! It was mostly late 20-mid 30s and was not overly crowded at all. We paid $65 for an early bird ticket and were able to reserve a table for our party at no additional charge, though we had the option of adding bottle service for a fee. Our coats were immediately checked as we were shown to our table.  Passed appetizers started around 8:30 and there was also a buffet dinner that was refreshed periodically throughout the night. I thought everything served was tasty and much higher quality than any other NYE bar food I have had. They served things like crab cakes, flat bread pizzas, chips and guacamole, bbq brisket, shrimp and prosciutto crostini, etc.  Overall, I was most impressed with the drink selection- top shelf liquors were part of the ticket price: Grey Goose Vodka; Titos; Makers Mark Bourbon; Knob Creek Bourbon; Don Julio Tequila; Glenlivet 12yr Whiskey; Hendricks Gin in addition to standard stuff like Captains and Svedka. I drank Moscow Mules and Dark and Stormys all night- and they had real ginger beer (not ginger ale) which made me a very happy customer! I saw many other customers with drinks that are rarely offered for large party events because they are more time consuming or liquor heavy, like manhattans, long islands and old fashioned.  The DJ was also rockin-- he read the room really well. While there was not a defined dance floor per se (and it would have been nice if they turned down house lights once people did start dancing) people definitely got up to dance and they  had consumed more liquid courage. Once the DJ found a genre that the crowd appreciated he played a lot of crowd favorites and his transitions from song to song were spot on. Lastly, it's not on a crazy crowded bar street so it was very easy to catch a cab after the party wound down-- which is a huge plus on NYE nights when you're often fighting with a lot of other people trying to catch a ride.  I would definitely head back to this bar for both drinks with friends and future NYE!",0.9959,0.82,0.168,0.011,0.4565223665223665
2015-12-21,4.0,"Great food, good atmosphere. Only one waitress who had to do all the running back and forth. Their kitchen is upstairs which makes it a bit hard and totally inconvenient. Lack of the service aka just one waitress is for taking away a star but other then that the food was wonderful. Will be back",0.7727,0.766,0.156,0.079,0.5851851851851851
2015-11-15,2.0,"I was not impressed with this place at all. I met my girlfriends here for brunch and based upon the amount of food left on everyone's plate I don't think any of us enjoyed it. First off, the food took forever to arrive which was ok because we were chatting but still... I ordered chicken and waffles but was really only able to eat about 3 bites of chicken because it was basically fried fat and skin. The waffle part was pretty good so I settled for eating that. When the bill came and my terrible tasting coffee that I only drank about half of was $4, I decided that I would not be coming back.",0.7161,0.85,0.1,0.05,0.6549999999999999
2015-10-24,3.0,"This is simply a review of the service*** My friends made reservations for my birthday.  We were a party of 10 (all mid-late 20s) on a Saturday afternoon for the mimosa brunch special.  We had plans to eat and drink, then head up to the golf area. Our server, Michelle, made us feel like we were the biggest burden.  As someone who has been working in the industry for over a decade, I totally understand that Saturday morning shifts aren't always fun and large parties of mainly women are always hit or miss...I get it! However, this is an industry where you need to fake it sometimes.  We were very tame and trying to celebrate a birthday.  Michelle was very curt and made no effort to go above and beyond her basic serving role (my drink was always full, and I never had to ask for more water).  We asked for 1 round of shots and decided to go with Vegas Bombs, she asked how to make them so we told her, but said that the bartender would probably know.  She responded with a condescending tone, ""oh I mean we just don't get many bombs"". Ok, I know these shots aren't great but the least you can do as a server is to go talk bad about me to the bartender or the other servers and pretend to enjoy my patronage while I'm sitting in your section.  Shortly after this and after several other backhanded comments I made the decision to get out of there as quickly as possible. I don't require much to enjoy a dining experience, and it really takes a lot for me to be upset about my service.  I made sure everyone still tipped 20%, because I'm not a monster. However, Michelle could have made a lot more money because we were planning on staying there for quite some time.  I will say- the hostess this morning (Oct 17th,2015) was fantastic.  Very personable!",0.8718,0.844,0.092,0.063,0.4762562003968254
2015-10-09,3.0,It was a nice place. If you order something on the rocks they charge $4 for ice on your bill but it's for an extra ounce of booze. They should change that on the bill to avoid confusion. Little sense of humor from the waitress.,-0.3497,0.804,0.083,0.113,0.5333333333333333
2015-09-26,3.0,"Came here for brunch on a Saturday afternoon. The positive: brunch deal is $25 for food and bottomless mimosas. Pretty good deal! The negative: the breakfast food isn't that great... There aren't many options, and you can't swap lunch food into the deal.  The interior is really cool, though. It's all new and decorated well and it's a fun atmosphere to be in. The windows also open up pretty big, so it's kind of like being outside.  They also refill your mimosas really quickly, so that's a big positive!",0.9705,0.71,0.255,0.035,0.5173796791443849
2015-09-22,5.0,"LOVE LOVE LOVE this place! The menu is amazing! The drinks fantastic! And the entire staff is awesome! I am so happy to have a place like this in the neighborhood. The upstairs golf experience is great, especially having the ability to golf some of the top PGA course in the world! Not to mention there AMAZING custom made shuffle board table in their main dining and bar area downstairs. This will definitely be a regular spot for my friends and I.  I HIGHLY recommend the flat bread pizzas, they are all DELICIOUS!! Great Job Fairways!",0.9967,0.536,0.464,0.0,0.6777920227920228
2015-09-20,5.0,"Really good burger with quality beef and done well as requested. While the theme at Fairways is about golf, it's actually a great gastropub and with numerous TVs for watching sports. All-in it's a great mix of high quality food, good service, a very good craft beer list, solid music selection and enough TVs to find all your games. Highly recommended.",0.9704,0.68,0.32,0.0,0.5660000000000001
2015-09-20,5.0,"A lot of fun and great to have somewhere close to DT to swing a club. The guy who helped us was awesome, couldn't have done a better job. I went on a date with a girl who didn't know how to play golf so I ended up drinking more than swinging but win-win in either case. It's refreshing to find a place that truly cares about guest experience. Cool spot.",0.952,0.719,0.258,0.022,0.6571428571428573
2015-09-17,5.0,"Definitely a great addition to the neighborhood, an upscale bar with great food, not your average frozen bar food cuisine.  Been to several private parties there too - great service, and great Moscow Mules on their new happy hour menu.  Constantly changing and improving menu, my only complaint is lack of Michalob Ultra, my favorite beer.  Great shuffle board fun!",0.9887,0.509,0.441,0.051,0.5808585858585857
2015-09-17,5.0,"Love this place! The new menu is definitely something to check out - Farmer's Daughter flat bread, Duck Quesadilla, and ALL of their salads are my favorite. I'm the type of person who orders the same thing every time at a restaurant, but I can't do that here because all of the food is so good!!! I'm also a huge fan of spicy cocktails. The spicier, the better! The waitress asked the bartender to make me something special. She brought it back, and it really wasn't as spicy as I usually like. The owner himself came out with a special chili infused simple syrup and let me add as much as I wanted! My mouth was on fire - just the way I like it! While my husband is golfing upstairs, you can find me downstairs with my girlfriends enjoying the $25 bottomless mimosa deal for brunch :)",0.9915,0.723,0.259,0.018,0.47525252525252526
2015-09-15,5.0,"Surpassed all of my expectations! Came here with a group of friends and we tried almost all of their sharing/small plates- everyone loved everything (duck quesadillas, lettuce wraps, crab dip, veggie flatbread, chicken tacos, dumplings and a couple more items but I was toooo full to try). I know it's weird to mention, but I loved their wine glasses! We had attentive service, they played good music, good crowd of people. Already made plans to come back this weekend for their mimosa brunch!",0.9653,0.739,0.227,0.034,0.6699999999999999
2015-08-17,2.0,"Not sure how much longer this place can manage to stay open. I live across the street and the place is always empty!! I've never played golf here and maybe that is where their main focus is, but the bar area is a sad sight on Friday and Saturday nights. Their hours are also so sporadic; closed on random nights for no rhyme or reason. I've been here to eat a few times and it seems hit or miss. Food is ok, but seems like they're trying way too hard. Should consider simplifying their menu and offer some specials as it's incredibly overpriced. A burger (good) and fries (cold) was $15.00 and a daisy cutter was $9.00. Service is consistently bad. This past weekend we were charged for beers that they were out of, and our server was super unfriendly and missing in action throughout the night. I would hate for this place to go under as it has the potential to a great neighborhood spot.",-0.8721,0.74,0.097,0.163,0.5455314009661836
2015-08-06,5.0,"The $25 bottomless mimosa brunch is amazing! First off, the ambiance is great here; very clean, chic and not too crowded or noisy!  I had the omelette w/ potatoes and they were by far the most delicious potatoes ever! The mimosas were made with fresh OJ and our server had a round of mimosas ready after every glass we finished.. They were NOT stingy about the mimosas AT ALL! They even asked us if we wanted another round AFTER we paid our check!  EXCELLENT SERVICE! Can't wait to go back!",0.976,0.709,0.252,0.039,0.6302564102564104
2015-08-02,2.0,I've been to this bar before loved it.. Went back total disaster. So I guess they change their menu. I order a fried chicken sandwich which it took 20 mins to cook. Which I was aware. Mayb i thought is worth the wait. Wrong ..... It was the most disgusted thing you can possibly get. It was pretty much nasty fried breading it was sick. Mix drinks were horrible... I don't think the bartender knows how F*** to mix drinks...I guess there was one waitress for the night so it took forever to bring the bill... I will never come back..,-0.8687,0.762,0.08,0.158,0.6738095238095239
2015-07-20,5.0,Our daughter invited us to dinner where her boyfriend his the chef. Let me tell you when got there I had reservations I thought it was nouevva tavern all over she took us there and that is worst place on earth. But back to review the Claudio the part time bartender he was outstanding got my daughter a new fashion and me a fancy craft beer wow so delicious. We were even blessed to ha e my youngest join us from Miami via face time it is always a pleasure she is such a joy anytime she is with us. The chef came out to the table wow that is really neat. As for the food it was outstanding can't wait to comeback,0.9887,0.704,0.268,0.028,0.6458677685950414
2015-07-19,4.0,"I had the Sunday brunch special, which is $25 with unlimited mimosas and a breakfast item. I ordered the cowboy skirt steak, which comes with an egg, skirt steak and gravy and fried tortilla with guacamole. The skirt steak was very tender and the gravy was more dark and savory than traditional gravy, and both were delicious. The remainder of the dish was decent, but it was balanced enough for the flavors of the steak.  I also was able to try the chicken and waffles, which were great--crunchy, juicy and a little sweet but in a pleasant way. We also had French fries with the bone marrow dip. I found the dip to be strange and more of an acquired taste but our companions enjoyed it. The mimosas themselves were good, and it seemed like they used freshly squeezed orange juice. It's definitely a good deal for Sunday brunch! There is also an indoor golf simulator on the top floor, which you can actually test out for free. It's about $70 per hour, so I would suggest bringing a group to get the best value. The servers were attentive, especially when refilling drinks, and they were fast as well. I recommend this place if you're into golf or just like the golf theme of it.",0.9951,0.762,0.229,0.009,0.5788800705467372
2015-07-11,5.0,"One of the best bottomless brunches around! Great service, fresh OJ and amazing food. Erin (our server) was the shit!",0.9637,0.441,0.559,0.0,0.65
2015-07-11,1.0,"Worst service I've ever received at a restaurant. I digress.... You'd think when you make eye contact with a server she would know you need something. Not Anna. Not only did she physically and mentally offend me by existing, but she just makes me hate life and wonder how we have evolved as a species. She's awful. She shattered a glass on my boyfriends plate and then felt personally victimized when we asked her for the replacement entree. Then only brought out a small plate of potatoes... Then over charged our card.. And displays a severe lack of empathy for human beings",-0.9828,0.744,0.0,0.256,0.6042857142857143
2015-07-01,3.0,"Came here for dinner and drinks with friends.  The burgers were good, the fries were average. It's a unique concept.  I didn't even know they had a golf simulator.",0.7184,0.8,0.2,0.0,0.6666666666666666
2015-06-16,3.0,"I've been here a couple times, both for dinner and brunch. For dinner, the dishes were very hit or miss. The waitress steered us toward some of the better options, so definitely take advantage of their expertise. Most recently, I visited Fairways for brunch with all-you-can drink mimosas. Mimosas are delicious. For an entree, I ordered the breakfast pizza -- it was tasty, but I had a hard time finding the chorizo in the dish. The sauce drizzled on top was tasty and reminded me of the sauce on Taco Bell quesadillas. Overall, if a boozy brunch is your objective, Fairways is a good option.",0.8734,0.841,0.131,0.028,0.43560606060606055
2015-06-10,5.0,A great place to go to catch games.  Food is okay but service is fantastic and who else has golf simulators upstairs?  Pretty good selection of beers on tap and in bottle.  You can play shuffleboard which is nice.  When I lived in the area this was my go to place to watch games.  If anything could be better some of the food could be improved but still above average for bar food.  All in all a great place.,0.9902,0.638,0.362,0.0,0.65
2015-06-10,5.0,"Been a handful of times with friends for food, drinks and games. And EVERY single time, its the absolute BEST SERVICE we've had anywhere in Chicago. The entire staff is always friendly and helpful, bartenders make good drinks and will chat about how terrible Cutler is. Food is also pretty tasty and the golf simulator upstairs is the icing on the cake. They did a chip and long drive challenge once at halftime of a Bears game and it was a blast.  Also, for some unexplainable reason, they have the BEST WATER ever. I know it sounds weird, but their water is insanely refreshing. Try it.",0.8953,0.816,0.154,0.03,0.6337912087912088
2015-06-06,3.0,"Food was decent. Beer selection was decent. Prices were too high, especially for golf.",0.0,1.0,0.0,0.0,0.7183333333333333
2015-05-20,3.0,"So I've been here a few times for both brunch and dinner. The first time I came here was for brunch because Zella was too crowded and this ended up being a nice alternative for our rather large group - mimosa's were large and tasty and the bloody mary's spicy and strong! Brunch food selection was minimal but since then I've noticed the menu has expanded and they now offer a bottomless drink selection for brunch.  Fairways straight up just has poor service. Myself and two friends went here a couple weeks ago and after we were seated, our waitress did not approach us for about 15 minutes and then took another 20 minutes to get our drinks to us. We had two different people coming to our table to take our order/check up on us which just got to be confusing for everyone. We waited over an our for our food (burgers and fries) and they honestly were not even that good - I asked for my burger well done and this thing was straight up rare & bleeding. No thanks!!   Only reason I'm not giving 1-2 stars is because of the golf upstairs (dying to try!) and the weeknight drink specials. These two things are likely reasons why I'll be returning..",0.7754,0.824,0.103,0.073,0.606516290726817
2015-05-14,5.0,"My company had an event upstairs last night and the staff did a GREAT job. The management catered to our (many) needs for the event with out any issues. The drinks were pouring, the food was delicious, and everyone loved the golf simulators. I highly recommend Fairways for corporate events! Hopefully we will be back soon!",0.9613,0.726,0.274,0.0,0.4570833333333333
2015-05-13,2.0,"This is a review for brunch downstairs. I went on a Saturday with a group of 6. We had a reservation. The atmosphere and actual bar were very cool. Our waitress was MIA most of the time. Then the food came and mine was cold. Not lukewarm. Cold. I could have let either one go but not both. I won't be returning here, for the food that is. Drinks or golf and you're probably fine.",0.257,0.916,0.056,0.028,0.6575000000000001
2015-05-10,1.0,"I went here for mothers day brunch and it was 90% empty. Terrible service. It took an hour to get crappy food. My chorizo breakfast burrito turned out to be a ""potato burrito"" with zero meat in sight. I will never return or recommend this place to friends or family.",-0.7587,0.754,0.056,0.19,0.75
2015-05-10,5.0,"Having read all of the previous Yelp reviews, I really didn't know what to expect. Made reservations for brunch for a party of ten for Mothers Day. Well it was five stars in all respects. The six adults had a round of Bloody Mary's and the four kids (ages 4, 6, 8 and 10) had milk and lemonade. Service was excellent and the drinks were flavorful and tangy. I had the omelet with delicious potatoes on the side. A couple of the ladies had salads and the guys had sandwiches which everyone enjoyed. The kids ordered off the kids' menu and they gobbled everything up. They really enjoyed playing shuffleboard while waiting for their food. We were so stuffed, we passed on desserts, and our total bill for six adults and four kids was $111.00. I gave our waitress a $30.00 tip, and we'll be back again, probably for Fathers Day with our same crew of ten.",0.96,0.843,0.14,0.017,0.4570512820512821
2015-04-28,3.0,"First of all, this is a review for their downstairs bar, we didn't play golf upstairs, although that does look cool and I'd like to try it sometime.. We came here to watch the Blackhawks the other night, they won so that's always a plus! First of all, I give this place 5 stars for TV's and watching a sports game. There's massive TV's everywhere, they play the sound too during the game and cut to music during commercial breaks. Overall great place to watch games. We had reservations and were seated right away which was also good. Where does it fall short? Well.. I'd say food and service. After we ordered some drinks and apps, we didn't see our waitress for almost 20 minutes, even though we wanted to order dinner. Finally we order dinner, and almost 1 hour later it comes out. Whatever, they seemed understaffed and they were super busy for the Hawks game. The food comes out, and its pretty large portions (see picture), but why the hell are they on tiny wood square plates with no lips? Now we have sauce and salad dressing dripping over the side of the wood block onto the table making a mess.. The burger was way too smokey and the bottom of the bun honestly felt like it was dipped in water before they served it, that's how soggy it was. I get it, buns get soggy. But right out of the kitchen? Come on. Then we had to wait 5 minutes to get knifes, no big deal, but kind of annoying.  My smoked brisket slabwich was falling off the plate everywhere because again, it's a small wooden block. The brisket was dry and wasn't that good unless it was smothered in the bbq sauce. The side salad was good though.  Definitely a nice establishment and I'd come back again to watch a game, but might have to just stick with drinks and apps.",0.6493,0.804,0.105,0.091,0.48564814814814816
