date,star,text,compound,neutral,positive,negative,subjectivity
2013-12-17,4.0,"I went to Fairways last night with three of my buddies for golf, dinner, and Monday Night Football. Overall, it was a pretty solid experience. The golf simulators are cool and the restaurant provides good golf clubs for you to use.  Each simulator even has its own refrigerator stocked with beer so that you can self-serve.  The food was good but not great. Finally, the staff was very friendly and attentive.  There is one big problem with the golf simulation area that should probably be addressed sooner rather than later. The area, which houses 4 simulators and a bunch of couches and chairs, is too compact to accommodate the current setup. Patrons and employees often have to walk directly behind golfers in the act of swinging in order to exit the simulation area. If either the golfer or the person walking behind the golfer are not paying close attention this could easily result in some lost teeth or a giant bruise on the head. Even if they are paying attention, the person trying to exit the area must delay his departure until the golfer finishes his shot. Kind of irritating.  Overall, Fairways was a fun experience. I just hope they heed my advice and alter the setup of the simulator area before someone takes a RBZ right to the chin. 1/26/14 Addendum:  I went to Fairways again last night for a friend's farewell party.  She's moving to Tampa Bay.  Can't blame her,  given that the high temperature tomorrow is projected to be -6 degrees here in Chicago.  In any event, I was happy to see that Fairways addressed the safety problems in the golf simulator area.  I still think the furniture setup could be better.  There has to be a way to route people entering and exiting the area towards the middle of the room rather than through an aisle that separates the simulator and the chairs for the group of people at the simulator.  In other words, ideally Fairways will figure out a way for patrons and employees to enter and exit *behind* a group's chairs instead of in front of them.  It takes away from the experience if you get assigned to one of the simulators closest to the entrance/exit and you have patrons and employees constantly shuffling through in front of you.",0.9752,0.835,0.114,0.051,0.5454761904761904
2013-12-17,5.0,"The fried green tomato club was the best thing I've ever eaten. I'd give 5 stars just for that!!! I also loved the 'Merica Mule cocktail (get in my belly ginger beer) and beautiful interior. Super friendly and attentive staff that actually seem happy to be there. I haven't tried the golf yet, but heard it's free for restaurant industry folks on Mondays so I need to find out more. What a great new hang out.",0.9771,0.71,0.29,0.0,0.6208624708624708
2013-12-16,1.0,"Went on Saturday night night to watch Hawks game and grab some food.  First they were out of Pinot Grigio.  6pm on a Saturday night and you of one of the 4 white wines you serve, not good.  We ordered the French Onion soup to start, which was just okay, I will not order it again and before I could even eat a third of it the server was pushing it out of the way with my entree and I mean he was pushing it out of the way with my entree.  We had the shrimp tacos, they were nothing special, I have had so much better else where and the turkey grinder.  The turkey was dry and cold and again nothing special.  Could of made it a home.  Overall very lackluster event.  Very disappointing.",-0.6527,0.886,0.037,0.076,0.43585565476190474
2013-12-10,3.0,"Service good, ambiance is nice, golf is cool, food has nice presentation but needs improvement.",0.8555,0.467,0.533,0.0,0.8125
2013-12-04,5.0,Good selection of beer and booze and decor is simple and modern. Staff is friendly and fast.,0.7269,0.711,0.289,0.0,0.4714285714285714
2013-12-04,5.0,Great food and a great place to golf.  The golf clubs were top of the line and the screens were so clear you actually felt like you were on an actual course.  What a wonderful addition to the Lincoln Park area.,0.9616,0.628,0.372,0.0,0.511904761904762
2013-12-03,5.0,"Stopped by for the soft opening. Tried a few of their custom bourbon cocktails. All were good but the Yuletide and New Fashion were excellent. Tried the duck sliders and Fairways Burger and would order both again. Highlight of the night was the tour of the upstairs golf lounge. The manager showed us around and let the sig other try out the simulators. Let's just say he's hooked. Before we even left the second floor he was already talking about the possibility of bachelor parties, holiday parties, and a Tuesday night golf league.",0.9652,0.791,0.195,0.014,0.35994318181818186
