date,star,text,compound,neutral,positive,negative,subjectivity
2015-04-26,5.0,"I had a surprise 30th birthday party last night for my boyfriend and I immediately wanted to post a raving yelp review because of my experience from start to finish. I coordinated everything with Mark back in January. I am not the easiest person to deal with when it comes to contracts/reservations because I've had some bad experiences in the past. I must have asked 30 questions via e-mail and Mark was always quick to reply back and explain things for me in further detail.  We rented out the entire top floor so that everyone could play golf and hang out. Mark was very attentive and even let us bring in our own cake the morning of the party. There was a small misunderstanding on my part from the contract when it came to payment and Mark was the first to compromise with me to ensure that it didn't ruin the party. From small things like having him send a ""fake"" tee time confirmation to my boyfriend, to letting us stay past the time proposed on the contract Fairways blew my expectation away.  Side note: our bartender Ryan was amazing!!! Knew how to make the best drinks and was so fast in making sure everyone's order was put in and taken care of. Considering we had over 60 people, none of my guests complained about the service we received.  Would most definitely rent out the space again here for future events given that this was by far some of the best service I've received. Thanks again for making it a great night!",0.9899,0.786,0.175,0.039,0.4912698412698413
2015-04-24,2.0,Super disappointed. I had high hopes for this place but the mixed drinks tasted watered down and the food was subpar. Dessert was horrible.,-0.5346,0.63,0.144,0.226,0.5825925925925926
2015-04-17,4.0,"Went here at like 1230 last saturday night, thankfully it wasnt too packed or loud, the drinks werent too expensive and they had a good cocktail and beer list, I liked both that i got, honestly i wasnt there too long, about an hour, but id still go back if i was ever out there again",0.7579,0.829,0.171,0.0,0.5333333333333333
2015-04-07,5.0,"We hosted a 30th surprise birthday party at Fairways, and they provided an amazing experience for us!  They reserved a large area downstairs for our group of 30-40 people( and offered a wristband deal for 3 hours), which was even more impressive considering it was during March Madness and we took up a large portion of the stage.   We also reserved golf simulators upstairs for an hour of the party, and Fairways was super accommodating with allowing our group to float back and forth between our reserved area downstairs and our simulators upstairs.   Prior to the party, they also let me bring in balloons & treats and stored them at the bar all afternoon for us.  The manager and staff even let us stay after closing time on a Saturday night and didn't rush us out at all--I'm pretty sure we were there close to an hour after closing time!   After the party, the owner emailed me to make sure we had a good experience and even sent a thank-you note for hosting our party at Fairways.  This was an amazing experience and I would absolutely recommend Fairways to anyone looking to host an event.  I can't wait to go back!",0.9907,0.784,0.203,0.013,0.6067724867724867
2015-03-19,5.0,"I threw my husband a surprise 30th birthday party at Fairways over St. Patty's day weekend. There are just not enough good things to say about this place! We rented out the upstairs part of the bar where we had our own private bar, and golf simulators for our guests. The food was incredible for a bar...everything tastefully done. I met some of the chefs who all seemed so passionate about cooking and so happy to be there. Our bartenders were so friendly and accommodating; anything I asked for they provided. The managers were so easy to work with and so grateful to us for hosting. It was such a memorable experience and everything was executed perfectly thanks to the help of Fairways! It's a great venue for celebrating any event, reasonably priced too! Thank you Fairways, we received so many compliments on the food (bison burgers to die for) and overall fun time! Perfect 30th!",0.9944,0.675,0.293,0.032,0.6282407407407407
2015-02-14,3.0,"Being a golfers wife, I know the withdrawals he goes through every winter (being a golfer in this part of the country isn't easy). Thank god for indoor golf simulators or else he would go nuts lol.  I made a reservation for two of the four simulators for my husband and a bunch of his friends to celebrate his bday. When we arrived (about an hour early), I believe it was the manager, who asked us if we really needed both simulators...said there were guys waiting for one to open. Well at the moment we only had four guys (still enough for two simulators, and me and another girl were willing to play until the rest showed up). The rest were running late so my husband felt pressured to cancel one of them, so he did. Should have stuck with what our reservation was for. Well, we had dinner downstairs to kill time-food was good! Def recommend the tacos and the bbq chicken flatbread.  After dinner we went upstairs to play. It gets pretty crammed in the area..but there are couches, tables and a few chairs for those (us girls) not playing. There's also a bar and a server. Had to take off a star because the service upstairs was soooo slow. We were always looking for the bartender/server. Anyways, more guys showed up, had about 12 total, and of course we wished we hadn't given up that second simulator Took off another star for being pressured to give up a simulator :( It was still fun though, the simulators were the best ones I've seen. Very realistic. Everyone took turns and our server brought over a little dessert with a candle :) Im sure my husband will be back before spring.",0.9588,0.8,0.127,0.073,0.5602222222222223
2014-12-22,3.0,"First off, the customer service was top notch. Lincoln Park has plenty of great restaurants, but to be honest, Lincoln Park isn't exactly minority friendly. As a middle class minority, me and my dates have had our share of bad customer service in Lincoln Park. Nevertheless, this spot is definitely a nice venue. I thought the food was below average for the price. This place was named as having one of the top burgers in Chicago, but I would give the fries and burger a 4 out of 10. Maybe I just caught the chef on a bad day. The atmosphere is more for frat boys. This is not my type of spot, but for the customer service alone, it's worth giving it a try.",0.8252,0.713,0.181,0.107,0.5047619047619049
2014-12-17,3.0,I didn't even know golf bars were a thing. Nature is overrated anyway... Said no one ever. Nice beer selection. Didn't eat the food.,0.1531,0.8,0.112,0.088,1.0
2014-11-27,5.0,This is a first class restaurant and indoor golf venue. The indoor golf simulators are about as real to outdoors as it gets. The staff from Mark and Cam are great guys and always check in on you and make sure everything is okay. Definitely a must for food or golf!!!!,0.9036,0.787,0.213,0.0,0.5453703703703704
2014-11-17,5.0,"Amazing food. Great service. A group of 6 friends and I showed up on a Friday and were seated right away. The waitress was very nice and recommended the dates and chicken sandwich which were amazing. Definitely going back! The drinks were strong, just the way we like them. The music was great. Excellent place to go to get the night started. Would highly recommend!!!",0.9907,0.549,0.451,0.0,0.7132539682539681
2014-10-28,5.0,"Went there when the esquire crew was filming best bars of america. Place was crowded but we still managed if get a table (lucky!!!!).  Our server came out and took our drink order pretty quickly and warned us the wait might be a little long for food. They were busy so we understood. Food actually came out pretty fast given circumstances and was absolutely amazing. We had the artichoke dip, wings, shrimp poboy and duck fat fries (OMG!!!!!). Everything came out perfectly and everyone at our table was happy. Watching esquire do the show was pretty interesting and added to the atmosphere. They even had us sign waivers for the show so my friends and I might even be on TV haha!!!! Great experience...will return.",0.994,0.691,0.292,0.017,0.6460784313725491
2014-10-20,4.0,"Great spot for a birthday party!  Only came here for drinks, so I can't say much about the food/golf.  The service was great, especially considering we had a large party.",0.9312,0.623,0.377,0.0,0.6880952380952382
2014-10-18,1.0,"20 minutes for waitress to greet us - manager offered free app to apologize. Plates were provided after app was finished. 3 out of 4 meals were made incorrectly, wasn't able to eat together. Unexplainably terrible service.",0.4404,0.748,0.175,0.077,0.8083333333333332
2014-09-19,4.0,"Went here on a Wednesday evening (4pm) because my boyfriend and I had a Gilt City coupon for two beers and an hour on the golf simulator. We arrived about 15 minutes early and everyone was really nice and accommodating about it. Even though they were still setting up, one server stopped and took our drink orders. They let us start the golf simulator 15 minutes early and let us play as if our hour had started at 4pm. Our server explained how the golf simulator worked in a simple manner (I had never used one before). As for the food, we only ordered the duck fat frites but they were delicious!",0.8243,0.908,0.079,0.013,0.6595238095238095
2014-09-15,5.0,"Great atmosphere, great food, great drinks. Can't wait for the new menu to come out October 1st!",0.9273,0.526,0.474,0.0,0.6761363636363636
2014-09-14,5.0,"We kicked off a bachelor party here on a Saturday afternoon. I worked with Mark to arrange everything, and we had 7 guys using 2 golf bays. This place was great because: - The golf simulators seemed true to real golf. I've been to other simulators that are not quite right. These are the best I've ever used by leaps and bounds. - They provide nice clubs for you to use. - They provide a fridge of beer at each bay to help yourself to. No waiting for a drink order! The take inventory at the end and just tack it onto your bill. - The food was surprisingly good. I would go just for that. Think upscale bar food. - The service was fantastic. Very attentive servers. - The prices are super reasonable, even during peak weekend hours. 7 guys split 2 golf bays, ordered 6 apps to share, drank nonstop for 2 hours and we came in just under $325. Split that 7 ways, it's a great way to spend a few hours. Overall, It's just a unique experience that you should do at least once. Even if you don't play real golf, try it. It's just a good time. You'll eat well, you'll drink pretty cheap, and you'll just have fun.",0.9926,0.761,0.22,0.019,0.578517316017316
2014-09-13,5.0,"This is a diamond in the rough for Chicago.  I hope this place the best of luck.  Great food, the decor is amazing, and it is a great night out for any day of the week.",0.9764,0.515,0.485,0.0,0.62
2014-09-12,2.0,"Food is delicious. This review has nothing to do with food or drinks, or golf for that matter. We had a great time.  We spent our 90 minutes golfing then all over. This was at midnight. Upstairs staff told us to go downstairs to continue to drink. We went down, 2 people in the whole bar.  I assumed they were closed until a waiter said still open.  We were a party of 8 and sat down at a booth and finished our cocktails from upstairs.  Not 3 minute after sitting down and planning on drinking more and staying did a server come over and say last call.... It was 12:30.  With 2 patrons and out party that made 10. You would think they would at least do last call at the right time or at least say hey, we're closing up early today.   While I loved the golf and food, servers should work on being a little nicer.",0.9628,0.87,0.13,0.0,0.40476190476190477
2014-09-06,4.0,"Went for dinner with a friend last night (Friday at 7pm-ish). The place was surprisingly empty, at least the downstairs. We did not make it upstairs, and actually, I didn't realize there was an upstairs until I was looking at Yelp reviews after the fact.  The service was great. Our waitress was always there when we needed anything and was knowledgable and helpful when answering questions about drinks and food. I had the tequila/pineapple/jalapeño cocktail, which was really tasty. Not a super strong drink, but still tasty. The french dip sandwich was delicious, except that the dip itself was a bit on the salty side. But overall, very pleased with the food. Definitely well-above-average bar food.  I'd come back (or at least recommend it to friends in the neighborhood), and if it's usually not too crowded on the weekends downstairs, it'd be a great place to bring a group of friends. The huge sunny front windows complement the darker ""bar"" feel toward the back, but the whole place is very modern and clean on the inside. I'll have to check out the upstairs sometime.",0.9946,0.743,0.25,0.007,0.4412121212121212
2014-09-06,2.0,"Went here on a Friday night around 7pm because the burger and fries come recommended by Timeout Chicago. To be honest, I have no idea how this burger made it on the list. I'd much rather bring my own beer and head to the Butcher & the Burger down the street.  To start, there was only one other table in the whole place. When we asked the server if the place had recently opened, she noted that they've been open since December! If they don't get more people in the place soon, I don't see this place sticking around. There were no Friday specials (at least not that we were told about) and the drinks were on the higher end, with basic cocktails starting at $10 and nicer ones being around $12. I had a moscow mule that was fairly standard - I've had better, I've had worse but it wasn't really worth $10.  I ordered the Fairways burger and fries and was sadly disappointed. The meat was bland and the overall burger fairly tasteless, despite the fried onions, cheddar cheese, and tomato jam. There was a hint of tomato jam taste, but the fried onions didn't taste very fresh and the cheddar cheese was basically invisible under the jam. The burger was overcooked for my medium-rare order. There's too many other good burger places in this city to waste time and money eating a burger here.  The service, however, was excellent. Our server was very cheerful and did a good job of answering our questions about the drink options. The decor was impressive - very chic with big bay windows at the front that I think might open up during the summer months. They also had a nice outdoor patio, but since it was raining, it was closed. The place was huge - definitely great for big groups.",0.9837,0.793,0.143,0.064,0.5050569800569801
2014-07-24,2.0,"This is strictly about the food. It is way too salty and i like salty foods. We have been twice and will not return.  First time we got the tacos and they were very salty. The second time, we got a roast beef panini and a flatbread. Both were salty. So much so you can't drink enough water to get the taste out of your mouth.",0.3612,0.961,0.039,0.0,0.26666666666666666
2014-07-21,2.0,"Having just moved to the neighborhood, the bf and I wandered around the area and stumbled upon Fairways. Fun-looking, high-end atmosphere, and what's more, it happened to be 9:05pm on a Monday, which meant FREE simulator time upstairs! So up we went, happily ordering the Duck Fat Frites, a Sawgrass, and a mead.  Sadly, the frites were wayyyy over-frited and also salty. Even with the dipping sauces (the whitish one was congealed a bit, which was off putting), we couldn't eat them. The drinks were super watery, even the mead came with ice (in my limited experience, I've never had mead with ice), and neither tasted good. The bartender was really cool and brought us a beer and another watery drink, Smash. The beer was normal! We didn't finish any other drinks or the fries, though.  Overall, free golf sim time, which was fun, good atmosphere, and friendly staff. The food/drinks themselves, very meh.",0.9469,0.792,0.143,0.065,0.5490327380952381
2014-07-14,4.0,"Really no other place around like this that includes actual sport within a bar, at least a nice one (e.g. Sluggers). Luckily I snagged a Gilt City deal for $56 for 4 people for 1.5 hours of tee time, 1 sharable plate and 4 drinks, otherwise it can be pricy for the golfing upstairs. Service was splendid from the get-go, as they e-mailed me back promptly about my reservation and was super friendly. I even called to let them know about running 10 minutes late and they did not have a problem and were very welcoming. We shared the shrimp diablo which was very good. Shrimp was perfectly cooked and tasty. The shiitake mushroom flatbread was also pretty good. Obviously, a little pricy and not huge portions, but was reasonable for this type of place. I had the No Island drink and it was pretty good. Could have been a tad stronger in alcohol, but by no means was it weak. My only qualm was there was only one lady covering the whole upstairs. We found ourselves waiting just a bit for service. She was very friendly and helpful, however, especially explaining the whole golf simulator to us. As noted in other reviews, simulators do not seem very accurate...but a fun and different place nonetheless. Love their unique menu with many dietary restriction options and would come back downstairs just for that.",0.9898,0.726,0.214,0.06,0.6115714285714287
2014-07-12,4.0,"AMAZING, first things first... I found this place in yelp, and I was not disappointed! This place is unbelievable.  Fairways is - amazing delicious food, great service, and extremely nice staff! This place is a jewel and I will be coming here regularly now. Interior of Fairways was much more clean, modern and cozier than I had expected, it's a good place to hang out with friends. It was wonderful!  Welcoming atmosphere and simple menu, we ordered the House Pressed Tacos, Chips & Guacamole to shashe. Also Shiitake Mushroom and Fairways Greens salad. And I had the Fairways Burger with White Cheddar which was the bomb! Plus few drinks (Sawgrass, Smash, The Last Yand) and beers. The food is fantastic... So delicious, it was unbelievable. The service was fast and courteous, the staff is super cool and accommodating, and the food came out reallu fast. Good people. I'll be back to try their Pebble Beach Club. It looked delicious.",0.9967,0.653,0.347,0.0,0.6156150301311593
2014-06-23,3.0,"An indoor golf course? Not being a golfer, avid or otherwise, I never would have known about this place, but a friend suggested it for The Superbowl. Plenty of tv's, food was okay, but, other than that I can't imagine I'll spend any time here. They have a really good beer list.",0.9107,0.774,0.226,0.0,0.61875
2014-06-23,3.0,"We didn't get a chance to do the virtual golf upstairs but it looks like a great wintertime activity. Came here on a Sunday for a few drinks. The service was good and although we weren't hungry, nothing on the menu really stood out. I can see how this spot may be considered fratty, given the fact that it's an upscale sports bar in a yuppy part of town so I'd avoid coming here for big games or for the night scene.",0.8796,0.804,0.144,0.052,0.35000000000000003
2014-06-18,5.0,This place is so fun. Great good. Cameron is CuTe and so helpful. Love him & that place.,0.9731,0.33,0.67,0.0,0.63
2014-06-18,3.0,"I came here for a work event. The golf simulator was fun, but can't say it's accurate. A few times it didn't register my shots.  The drinks are good and the food was good. Fun experience.",0.936,0.67,0.33,0.0,0.388888888888889
2014-05-30,5.0,"We hosted an event at Fairways last night and it was the most positive experience I could've ever imagine. The owner, Mark, and his staff were super willing to help with anything we needed, with smiles on their faces.  All of the guests were raving about the service, food and overall good energy of the place. Of course, I topped off the night with the Thursday $10 beer and burger special upstairs near the golf simulators.  Unbelievable night!!!!! I definitely recommend Fairways for events, date-nights, going out with friends. You won't be disappointed.",0.9863,0.69,0.31,0.0,0.5291847041847042
2014-05-30,5.0,"Held a private party today, Owners Mark and Mike personally opened for us and gave us the 5star treatment. Food was great, had the new French dip. Excellent! HD Sims were crisp and new had a great round of indoor golf. Parking is a bit challenging. Overall we had a great time!",0.9678,0.668,0.332,0.0,0.5115967365967367
2014-05-28,1.0,service was awful.... food was cold... great atmosphere and a large beer menu but be prepared for long waits and cold entrees,0.5994,0.795,0.205,0.0,0.763095238095238
2014-05-25,2.0,"It was my first time and probably my last at Fairways.  The food was ok. We all ended up getting the burger with duck fat fries. The burgers were tasty and all three of us cleaned our plates. The meat was cooked correctly, the buns were good, the onions were crispy and all together a good burger. $13 worth of burger, thats another question.  But we didn't come to eat, who goes to a bar to eat? We came to drink and watch a hockey game.   We all ordered ""'merica mules"" and if these ""'merica mules"" were anything like ""Moscow mules"" Then you should be on your ass in 2 or 3 drinks. We each had 4. Sure we had a little buzz after 4 $10 mules, but I have lofty expectations for my mules and this place did not deliver.  With tip our tab came out to just over $70 each. While there wasn't anything BAD about the place, for that price, I expect a bit more. I wouldn't go back to somewhere that pours weak drinks and the burgers are ""pretty good"" when there are countless GREAT places to go to in the city.",0.971,0.828,0.143,0.029,0.5076797385620916
2014-05-09,2.0,I'm sad to say that Fairways is not a great dinner option in Lincoln Park.  We have been there twice - once at the bar for cocktails which was just fine.  i do like the decor and ambiance of the place and the service was friendly and attentive.  But the second time we went to Fairways we went for dinner before a Hawks game and everything we ordered was just ... not... good.  :(  We started with the calamari.  This was literally like steamed and chilled calamari - not grilled or breaded an fried - just slimy calamari with an overpowering smoky sauce behind it on the plate.  Made me gag. My hubby had a burger and I had the black bean burger and again it was like someone had just smooshed a half pound of black beans on a dry bun and called it a day.  There were no spices or grains or anything to liven it up a bit.   The hubs said his burger was so-so.  It was disappointing since we live nearby and always want to support new local businesses... in the future we will stop by again for a drink before eating elsewhere.,-0.2249,0.814,0.093,0.093,0.513835725677831
2014-05-05,3.0,"Recently came on a Saturday afternoon with a friend because Fairways' signature burger was recently voted among the city's best.   We sat at the bar on Derby Day, and the place had folks dressed for the occasion, which was nice.   I had their signature burger, served with crispy onion strings and a tomato jam (on a Gluten free bun).  The sandwich was too tall to conquer without removing the top half of the bun.   The burger was cooked as requested, and was tasty.  The fries were delicious.  Among the city's best?   Debatable.      A bit pricey for what it was, but the room was nice, had plenty of screens to watch whatever games are on, and the service was good too.    We did not go upstairs to see the golf simulators.  My review is limited to eating a burger at the bar!",0.9509,0.831,0.144,0.024,0.5257936507936508
2014-05-03,2.0,"1) Frat boys galore. Loud ones. ...who think an appropriate way to leave an establishment is through its open windows. One strike. 2) Terrible service. Holy crap was the wait long. For everything! It was just a mess. Every single time we needed anything, it was SOL for us because our waitress (who just stopped serving us at one point altogether) was nowhere to be found. Two strikes.  It looks like they have a cool simulated golf driving deal on the second floor but there is no way I would come back here to check it out.",-0.7809,0.826,0.033,0.14,0.45811688311688314
2014-04-27,5.0,"This place is like a classy version of Sluggers. There is a fully kitted out golf simulator upstairs which is awesome. Before our 'round', we ate here and I ordered the burger and added blue cheese, onions, jalapeños and pork belly. Superb.",0.9274,0.72,0.28,0.0,0.6799999999999999
2014-04-17,5.0,"I've  been going to Fairways quite a few times since they opened and always had a pleasant experience. A new concept and amazing decor, we always have tons of fun playing the golf simulators upstairs and the food always hits the spot. Favorite dishes are the short rib tacos, kobe sliders, and, of course, the duck fat fries and they do source their ingredients locally. While I'm not a big beer fan, my friends are always digging their selection. I do like their wine list and crafty cocktails.",0.9574,0.767,0.213,0.02,0.4921212121212122
2014-04-13,1.0,"Worst service of my life! Not only did we wait an hour for the waitress to even order our meal, I had to physically walk around and find her to get an order in. The place was crowded but not packed, there were open tables, and no excuse for how quickly she forgot about us.  In addition to poor service, our food came out COLD another hour later. AND our friends who joined us 40 minutes in? Sorry, can't order, kitchens busy. Anticipate business on weekends and staff your restaurant better. NEVER going back.",-0.2003,0.806,0.089,0.105,0.5071428571428571
