date,star,text,compound,neutral,positive,negative,subjectivity
2015-01-29,5.0,"I actually signed up on Yelp to drop this review. This was my first experience with this place, and what an interesting one! Want to know why? Was looking for some good Italian that delivered, and this place popped up on my radar. Reviews were positive, so I gave it a shot, especially since the arancini was highly recommended, and after a stint in Boston's North End... That stuff is like crack. All in. So, I place my order over the phone, arancini and the papardelle with mushrooms and truffle butter. I get the standard 55-1hr delivery time. 90 Hangry minutes later, no food, so I call. They say the food went out some time ago, so try to get a hold of the driver, and get nothing.  They offer to fire up a new order for me and get it over quickly.  I get a call about 20 minutes later, and I'm surprised the host can hear me over the sounds my stomach is making: somewhere between stretching rubber and a frog croaking.  What the host, Lindsay said next put an immediate stop to that.  ""We apologize, this hasn't happened before, so tonight your Meal is on us. The owner is on his way to your house right now to apologize and bring you your meal."" What??? Holy shizz, I was floored! This one star review based on service just catapulted to five stars faster than Hussain Bolt on a case of Redbull! As he says his fair well, the other driver shows up with the original order, over two hours later. Comedy ensues. (Dinner AND a show?!) Normally, I would post some pic of the food, but it was in to-go containers and wouldn't be nearly as fair to a place that prides itself on it's product as much as they do. So? I'll just tell you how it was. The arancini had sausage inside with a nice red sauce around them. It came with some bread as well. The papardelle with mushrooms and truffle butter? Well... You could put truffle butter on a shoe and it would be the best thing you ever ate. This was not much different. They also included a wonderful slice of cheese cake to top it off. Totally not expected. For the food? I had to go back to a four star rating.  Fast forward to the following day. Based on the amazing customer service experience and four star food, I have to give these guys another shot, as it was that good the night before. Night two? Arancini... Again. Strangely, it was better than before. Also, ordered the Tagliatelle Rosina with sausage and peas in a nice creamy sauce. The food this time? Boom: five stars. Delivery? Guy showed up in less than an hour. This place just keeps getting better, and is by far and above the best Italian I've had in The neighborhood. I've told my neighbors, and a few friends already, and plan on this being a regular or go-to.  Big ups to Lindsey and Fabio. You made my week, and have my business! Keep up the good work!! I plan on eating the whole menu.",0.9966,0.843,0.141,0.017,0.42199259923749727
2015-01-13,5.0,Fantastic hand crafted pizza and excellent service. Couldn't possibly ask for any more. I will HAVE to come back on another night for their handmade pasta.,0.8885,0.677,0.323,0.0,0.6799999999999999
2015-01-06,5.0,"We had been here twice for baking goods and caffe or hot cocoa. Last Friday we finally went for dinner. It was fantastic! We had the great arancini filled with goat cheese, wonderful tortellini and the marinara pizza that comes without cheese but great tomato and basil. Dessert: chocolate cake! Letizia stopped by the table (as she did with all tables) to ask how it went, we discussed the different recipes and the great dough. She gave me some good cooking advices. Service was top and pricing is just right. We also had each a glass of wine. Food here is made with natural and fresh ingredients. It is simple as Italian food is, not mixing 10 veggies in a plate, just a couple so you know what you are eating and can enjoy the products. We like that, some people like many sauces, many spices and tons of veggies and meat in the same plate, but that is not what Italian food is about and I appreciate a place that gets it right. We will keep coming back for the sweet stuff sometimes and other times to dine. Great spot, close to home!",0.9948,0.753,0.237,0.01,0.5331569664902999
2014-10-23,4.0,"From the outside you wouldn't expect the massive amount of room this place has. The decor has that vibe of a modern restaurant with old world flair, classic graphic design posters so a lot of attention was paid to the details. The service was very attentive and friendly. I was seated right away even though my date didn't show up yet which was nice and they also served me bread and olive oil while I waited.  She finally arrived and we decided to go with the whole experience. We started out with the Arancini Cardinale which was fried rice balls with cheese and beets. Three delicious treats floating ever so lightly on their marinara which was great for Fare la scarpetta! For those who don't know that is the ritual of using the table bread to sop up the sauce.  We also got a caprese salad which was full of flavor but way too cold in my opinion. Not a deal breaker and it was tasty but I don't want to taste the cold initially.  The main dishes were the star of the show. My dish was the Fall special - Sweet Potato Gnocchi with sage butter.. it was great! My date had the salmon ravioli and that was good too. We complemented the meal with a really bold Sangiovese which I forgot the name but it went well with the meal. We ended with a slice of pumpkin pie which was decent.. It was surounded by these spots of sugary caramel spots that were great for dipping.  Overall it was a good dining experience with delicious food, attentive service and a pleasant environment to eat in. I'm looking forward to trying out the patio area in the summertime.",0.9948,0.83,0.166,0.004,0.6252232142857143
2014-10-22,4.0,"We were glad the SB on Logan was too crowded for comfort.. we mosied on down here for some coffee, wine, and treats! Lisa had a nice glass of Sangiovese and Ian and I both had coffee.. I went for the Red Eye.. well, just because. We had dessert at the restaurant that we were just at.. but this all chocolate cookie with chips piled on top was calling my name.. how could I resist? Then Ian heard his name being called by a piece of cheesecake drizzled with caramel.. by the looks of it I was wondering if maybe I had misheard the cookie.... Comfortable atmosphere, pleasant staff that talks to you.. A really nice experience I would like to go back in decent weather and eat some pasta on the patio. Well, not ON the patio.. but at a table on the patio.....",0.9762,0.827,0.173,0.0,0.6222222222222222
2014-09-29,5.0,"This is a neighborhood gem. It has become our go-to. They make all homemade pastas, and every kind that we've tried so far has been not only delectable, but also creative and unique. They have a wonderful outdoor seating area and even a bocce court.",0.8758,0.743,0.217,0.041,0.9833333333333334
2014-09-27,4.0,I came here Saturday afternoon I enjoyed some great coffee and a hazelnut chocolate chip biscotti..people in the area are friendly and the staff here is pleasant. When I'm in the area with some extra time I'll be sure to check this place out again.,0.9451,0.695,0.305,0.0,0.6509259259259259
2014-09-19,5.0,"I come here almost every weekend (at least once) for their lobster claws aka chocolate croissants. That has always been one of my favorite pastries - and I have yet to find another in the country that compares. Theirs are crunchy on the outside, the chocolate on the inside is always generously portioned - it is rich, but light - delicious!",0.8896,0.818,0.182,0.0,0.65
2014-09-15,4.0,"Absolutely the best thin crust pizzas in Chicago.  I grew up in NYC - this place rivals some of the best thin  crust pizzas in all of Manhattan, Brooklyn and Staten Island.   Really good stuff.   The only knock is if you order to go, the order arrives VERY cold and the pizza gets soggy, so I would either eat in, or pick it up.",0.9209,0.827,0.173,0.0,0.725
2014-09-14,5.0,"We visited on a Saturday night with a reservation for 7 and were seated immediately at a lovely table with Emily as our very informative, pleasant and attentive server.  We all loved the bread, fried risotto and cheese tray before dinner with great wine.  Every entree was delicious, herb gnocchi, tagliatelle, risotto special...so different and full of great tastes.  We thoroughly enjoyed ourselves.",0.9813,0.66,0.34,0.0,0.7333333333333333
2014-09-11,2.0,"I would recommend this place to run in and get a coffee and muffin but we won't be back for dinner.  Food was good/decent, service was HORRIBLE.",-0.7269,0.752,0.057,0.191,0.5
2014-09-10,3.0,"Good pastries and nice atmosphere. Only been in a few times but the pastries are good, especially the cookies and muffins. But the building in Logan Square is a bit confusing, sometimes the staff is there, sometimes no one is at the front. Their coffee making skills could be revamped. I would like to come in for dinner sometime to try it out.",0.7003,0.77,0.156,0.073,0.6714285714285716
2014-08-28,5.0,"The pasta dishes were so delicious. Had a dish with a spicy garlic marinara that was so good, and my mom had a risotto that she loved. Good wine. Nice patio. Great service. I'll be back!",0.9735,0.546,0.454,0.0,0.6785714285714286
2014-08-25,5.0,My absolute favorite place for breakfast on the weekdays. The breakfast sandwiches and other pastries are a great on your way to work breakfast. Coffee is good atmosphere is great and if you do work from home check out the back patio. It's shaded and a great place to get work done,0.9595,0.712,0.288,0.0,0.640625
2014-08-23,1.0,"Went to dinner last night with my girlfriend at this place for the first time. Had one of the worst experiences of my life. We were seated outside on their side seating area and it took about 10 minutes for the server to even acknowledge our presence. The buser was very attentive and we probably talked to him twice before I asked him to ask about our server. The server came over and took our order for wine and salads and then we did not see him again for 20 minutes at our table, he walked by us a couple times, but never acknowledged our existence when we tried to get his attention to order our main courses. He then just drops off our salads and wine and then again walks away for awhile. He took our main course order finally about an hour after we sat down. He made excuses that the restaurant was poorly laid out and not conducive providing easy service and that is what the delay was, but how is that possible when you walk by your tables and ignore them multiple times when they are trying to get your attention. That is not a layout issue, that is a server issue.  The food was so so, but the service was so bad we discussed twice just asking the buser to tell our server to bring our check (once before our salads arrived and once after they did before we ordered our main meal).  I will never go back to this place ever again. I understand places have off nights, but this was beyond anything I could even remotely tolerate.",-0.9589,0.935,0.0,0.065,0.472875816993464
2014-08-01,4.0,This is my go-to place for breakfast sandwiches; I love their breakfast classico panini.  They make great coffee too.  Haven't tried dinner yet but their lunch sandwiches are just as great.,0.8957,0.714,0.286,0.0,0.7000000000000001
2014-07-31,4.0,"This was a really nice place.  They have a beautiful patio but the summer night I went was just a little too chilly.  I had a nice time on a ""double date"" with two lovely ladies.  The girls got caprese salad, something that sounded like a stevia salad with arugula and I got the red beet risotto with goat cheese balls for appetizers.   We shared a pizza.   Everything was all really great. For dessert we had chocolate tiramisu which was a gigantic portion even for 3 people.  We had drinks as well and I think we paid less than $35 each.  Reasonable prices. Adequate service.",0.9852,0.726,0.274,0.0,0.575
2014-07-25,5.0,"Excellent coffee, pizza and desert. I can't wait to try their dinner.",0.5719,0.73,0.27,0.0,1.0
2014-06-30,5.0,Great Italian. Not too pricey but very good. Speak easy downstairs is legit.,0.9019,0.474,0.526,0.0,0.5908333333333334
2014-06-26,4.0,Came here for a birthday dinner with one of my best friends in the world and we had a wonderful time. Our server was very attentive and the food was great. I am not a fan of the pots they have as decor covering the walls in the back room but it hardly detracted from the experience. There is also a speakeasy in the downstairs that looks like a good time. I had the ravioli and it was wonderful. Not as filling as I would have liked it to be but I had my fill on drink and bread. I would go back!,0.9756,0.756,0.231,0.013,0.5991666666666666
2014-06-25,4.0,My wife and I came her sister and husband on a Saturday night and had the 5 course meal with wine. What a great meal and the service was excellent. We really enjoyed the prosciutto and preserves with cheese. Pizzas were very good.  We had so many different things that I would have to write a small novel here to describe the fantastic flavors that we had. I would venture to say that I felt like we had half the menu and it was all very good. Whatever you get I think you will be very satisfied with the quality of food (fresh pasta made everyday in-house) and the service. Give it a try. Nice little Logan Square gem that is family friendly on the main floor but has a nice bar in the basement for folks with no kids.  Side note: do not leave here without getting dessert or if your full get something to go. The desserts are made fresh here as well. Very good,0.977,0.784,0.2,0.016,0.6590476190476191
2014-06-04,5.0,"This place is my favorite place in Logan Square! You can start your day with a great coffee drink and delicious bakes good, have a fresh panini and lemonade for lunch, or end the day with an authentic Italian dinner and excellent wine and dessert. Love that Letizia and her son float around and entertain/chat with the guests as well!!",0.9796,0.65,0.35,0.0,0.6888888888888888
2014-06-04,5.0,"I love this place.  I will admit that not being much of a coffee drinker the majority of my trips have been for dinner.  Their homemade pasta and gnocchi are always excellent and feel perfectly rustic.  It amazes me that this place isn't always packed.  I do miss the wild boar pasta, however the tagliatelle rosina was fantastic.  Always awesome outdoor patio and bocci ball court.",0.9756,0.672,0.308,0.02,0.7285714285714285
2014-06-02,5.0,"We took some friends here to celebrate their engagement, and we loved it! Everything we ordered was amazing and tasted like it was fresh from Italy. We can not wait to go back!",0.9715,0.532,0.468,0.0,0.55
2014-06-01,5.0,"The food is excellent, with fresh made pasta and fresh ingredients.  The service is friendly and the wine selection decent and not too pricey.  Great place for an intimate, quiet gathering. They will accommodate special requests, though their sauce and ingredient pairings tend to be spot on (I learned the hard way, substituting a marinara for a sauce with a bit of cream, and then tasting a fellow diner's dish of the same entree with the offered sauce). All in all, great place for a date, gathering with friends and/or family, and other intimate occasions.",0.9494,0.756,0.2,0.044,0.558078231292517
2014-05-08,3.0,"Space: awesome.  Service: great - we sat at the bar downstairs and the bartender couldn't have been nicer (beard, flannel).  Calamari, cheese: very good.  Cocktails: perfect.  Pizza: WTF? Bad crust, no oil or anything, and then just a big salad heaped on top.  No cheese, no sauce, just....cracker, and salad.  It sucked, and it was stupid. I eat and cook a lot of Italian, and have Italian relatives, and I have never seen this anywhere here or there.  So, just be aware. I will totally go here again, though, and order the pasta.  I'm betting it's good, and for hanging out, I'm on it.",-0.2708,0.657,0.159,0.183,0.5997619047619047
2014-04-13,3.0,"First time there . . . night out with the girls (3 of us) . . .  Bottom Line:  Food was decent, basic trattoria.  Service sucked. Specifics:  Potato gnocchi with venison bolognese.  The gnocchi itself was decent  -- tasty but could have been a little lighter.  The venison bolognese sauce was mouth watering  --true  five star  -- deep and rich and wonderful flavor. Chicken thighs:  Ok.  Pretty standard, nothing to complain about but nothing to  write home about either. Shrimp entree:  Same sides as the chicken thighs -- carrots, broccoletti (a touch too al dente) and roast potatoes.  Again, okay, but nothing to write home about. Coffee:  Dead and cold. Service:  What would have been a perfectly pleasant evening was ruined by the lame service.  There was one server (male, Sunday night) who had -- count them -- all of four small tables to take care of the entire evening.  It took him 20 minutes to bring a cocktail to the table.  Another 15 minutes to bring a glass of wine.  We ordered two entrees to share between three people and he couldn't get the concept of bringing dinner plates for each of us and spoons so we could scoop up the food and put it on our plates.  When we asked for these things, he mentally rolled his eyes like we were being way too much work.  At the time, the dining room was basically dead. Hopefully, this place will soon start doing better business and be able to attract some professional staff in the FOH.",0.9871,0.746,0.183,0.071,0.531547619047619
2014-04-08,4.0,"We ordered the stuffed mushroom appetizer, the gnocci and another pasta dish, tiramisu, and wine... all were fantastic.   Great service (very knowledgeable server) and good ambiance... Will definitely return!",0.9273,0.648,0.352,0.0,0.61
2014-03-24,4.0,"Great place for an Italian dinner. My bf is Italian so we rarely eat it out, bc homemade is always better. This place is just as good! Always have new specials to try as well. Yum!!",0.9165,0.713,0.287,0.0,0.4577922077922078
2014-03-17,3.0,"I come here for muffins and coffee. Excellent.  Service was frustrating when LF first opened a couple of years ago, but staff members behind the counter are MUCH better, in terms of attentiveness to customers and not forgetting orders. I went twice this weekend, and enjoyed good coffee, muffins and espresso drinks. Unlike Starbucks, just a block away, this place is not busy, the prices are good and the beverages and food taste better.  Only thing I don't like is the seating. Whoever designed the wood benches must not be human. I have never gone to dinner at LF because I cannot imagine sitting for 90 minutes on a cushionless bench.",0.9407,0.754,0.178,0.068,0.6027777777777779
2014-03-13,5.0,"I've been coming to Letizia's Fiore for a while for morning coffee and their delicious (and gigantic) muffins (raspberry almond is the best), as well as the breakfast sandwiches.  And I also have frequented their downstairs speakeasy, which recently has gone through a concept change. It's called Parlare, and most the cocktails use Italian liquors and liqueurs in some way. Kraig is a new bartender there and he made a perfectly balanced drink with basil vodka, campari, aperol and orange San Pelligrino. I'll be drinking it on their giant patio in the summertime! And I finally came here for dinner. Mamma mia! I have spent years of my life in southern Italy, and I am officially a snob when it comes to Italian food. We started with the wood-fired mushroom caps - highly recommended. The caprese salad had super fresh burrata - so fresh that I had to know where it was from because I suspected they might even make it themselves (they get it from not far). And the pizza is killer. Again, super fresh mozzarella, very flavorful sauce, and wood-fired. Our server, Vittorio, an actual Italian waiter at an Italian restaurant (pretty rare in Chicago), gave great description of all the dishes and all-around excellent service. It should be noted that the restaurant is owned by Italians from Italy, not the second- or third-generation Italians that usually serve up canned tomato sauce and make food that scarcely resembles its origins. And caramel cheesecake for dessert - do it.  Not sure why this place seems to be off the radar for many people in the neighborhood. It's a million times better than any other Italian restaurant in Logan Square that I know of.",0.9817,0.829,0.133,0.038,0.484050505050505
2014-02-28,5.0,Great risotto. Grand Avenue pizza is totally different and delicious.,0.9014,0.388,0.612,0.0,0.8375
2014-02-05,4.0,"This place is like no other, welcoming and comfy, besides the greatness of the place, the food is great, I had a pizza from here, they actually use the wood burner and hand tossed. =) The flavors just busted in my mouth =)",0.9509,0.615,0.345,0.04,0.645
2013-12-31,5.0,"Letizia's has quickly become our favorite Italian spot and our favorite place to bring guests looking for less-than-adventurous cuisine.  That's not to say that it's not creative and completely delicious!  To start, they bring you this amazing bread which which they are gracious when you ask for seconds (or thirds or fourths).  They make homemade risotto balls and a fresh risotto of the day and they are both scrumptous and always creative.  We have had ones with different Italian hams or shrimp or vegetables and each has been a treat.  Their wine menu isn't large, but has a great selection and you'll surely find something that you love.  They also make amazing homemade pastas and all of their pizzas are handmade in a wood fire oven.  The decor is great and the outdoor patio is wonderful when the weather is nice.  I am happy that they have opened in the neighborhood and am looking forward to many meals together.  Also, if you're in for a post-dinner libation, head downstairs to the Speakeasy where there is a full bar and live DJs.  You'll have a great meal with great late night entertainment, all in one spot!",0.997,0.68,0.293,0.027,0.7102869352869354
2013-12-30,4.0,"We really liked this place. We spontaneously chose this place to have dinner on New Year's Eve Eve and were pleasantly surprised to find a special of $5 for a glass of wine on Monday nights. All the bread and pasta was fresh, the atmosphere was pleasant and it's a fine neighborhood place to have a quiet dinner after a long day.",0.945,0.733,0.267,0.0,0.6325974025974026
2013-12-27,5.0,"I had previously only been here for coffee and soup or other quick lunch items, which were all pretty good.  Then towards the end of summer my wife and I went out on a limb and booked a dinner reservation at Letizia's with 2 other couples.  We were a bit apprehensive, as we booked via Open Table on fairly short notice for a Saturday night (for a party of 6) and they had wide availability. We sat outside, and they had some nice lighting around the seating area... It was a really nice atmosphere, plus it helped that the weather was great.  I had never realized coming during the day that they had outdoor seating for dinner, so that was my first pleasant surprise.  Our waitress was also very attentive and friendly, so that was good as well. My expectations for the food weren't super high to be honest, but boy was I blown away!  And it wasn't just me... Everyone seemed to love their food.  I had a pasta dish with mushrooms for my main course and it was awesome!  The pasta was so fresh and al dente... It tasted like it had been made from scratch just before being boiled, which it probably was!  And the sauce was spot on as well. No offense to nearby Buona Terra, but I went there for dinner once and came away not understanding what all the hype and positive reviews are all about... It was ok, but in a Sapori Trattoria kind of way (overcooked pasta that tasted like it was store bought), which I also don't get the rave reviews for.  Not trying to hate, just being honest from my experience at each.  Letizia's was WAY better than both in my opinion.",0.9935,0.765,0.197,0.038,0.6463049853372432
2013-12-22,5.0,"Super cool atmosphere in an unexpected location, with fantastic pasta and pizza as well as friendly staff and good wine! It's that hole-in-the-wall trattoria that you know you've been searching for, with delicious, satisfying, comfort food and a feel-good vibe.  The terra cotta pot decor is super cool! We had the margherita pizza as an appetizer, which was really to-die-for.  My friends enjoyed their arancini, though it had sausage in it so this pescatarian/vegetarian couldn't partake.  But for my entree I had the farfalle in the tomato ricotta sauce on the recommendation of our server, which was really a treat. I couldn't finish it, so I'll get to treat myself to it for lunch tomorrow as well! I love that the wine list makes food pairing suggestions, makes it really easy to make a great choice.  I'd recommend this place to anyone in a heartbeat!",0.996,0.651,0.349,0.0,0.6822916666666666
2013-12-18,5.0,"My besties and I went here and we had a great time. We shared garlic bread, rice balls and a pizza. We ordered amazing desserts and shared. Such a lovely place. Simple and food was tasty. We came on a Sunday afternoon. We waited for dinner service to start at 5. It was worth the wait.",0.9545,0.71,0.29,0.0,0.5595238095238095
