date,star,text,compound,neutral,positive,negative,subjectivity
2012-02-11,1.0,"Nothing like spending $100 plus on a nice dinner with your wife and realize half way through your meal you're sitting in the middle of a private surprise party.   That pretty much sums up our experience at Letizia's this evening.   We  were seated downstairs in the bar at a table, ordered our appetizers and realized it was getting really crowded down there.  We continued with our meal and were eating our entrees and then out of no where the all the people around us yell ""surprise"" and then a couple minutes later they all start singing ""happy birthday,"" I'm not talking 5 people, I'm talking 30 people. Yep, we were seated right in the middle of a surprise party, and I do mean the middle.  We were surrounded, and for those of you that have been there you know it's a small space. The hostess, who I believe is also the owner should have told us this before seating us down there.  Also, there were seats available upstairs when we got there and when we were leaving so I'm not sure the logic behind this place. We won't be returning.",0.9557,0.857,0.121,0.022,0.4279761904761905
2012-01-23,5.0,"To the hard working staff who make the perfect garlic bomb; Please make them the way you used to; a bit doughy, chewy, crispy and so damn good.  My last two attempts were just ""wonder bread"" like...  Did the recipe change?  Not enough oven time?   Sincerely I -still-adore-this-place!",0.704,0.65,0.215,0.135,0.5347222222222222
2012-01-18,5.0,"Cafe Latte - decaf with soy: yum and the lady behind the counter kindly asked if I wanted a real mug. the kind of service I like. yes I want a mug if I'm dining in! calzone -- holy fucking shit. I don't know if I've ever had a calzone (even when I wasn't vegan) but I had a VEGAN one and it was ridiculously delicious.  who the hell needs mucus-building cheese?  PERFECT olive oil painted crust. PERFECTLY savory fill of asparagus, zucchini, tomato, and mushroom.  the flavors melded together PERFECTLY.  with a generous side of marinara, I ate slowly (which I don't normally do) and ate it all. It was huge. I didn't want to doggy bag this one b/c I sensed that the flaky golden crust would be a one time deal. I need more calzone. right. now. bravissimo!",0.9839,0.672,0.254,0.074,0.7390476190476192
2012-01-17,3.0,"I had really wanted to like Letizia's and I did...somewhat....  First of all, I think it's been written up in at least 3 publications, plus, it's totally adorable! I visited for a quick cocktail/dessert.  Upon arrival, the host asked if we wanted the restaurant or the downstairs speakeasy...after finding out this was more of a dessert mission, he elected to take us downstairs...where we were the only people there (though, to be fair, we would have been one of two tables upstairs).  In any case, the bar was cute (as was the upstairs) and the servers were nice. However, the bartender, when asked about the various Italian wines, knew not as much as I would have liked (or wasn't sharing).  I don't know anything about Italian wines, but I know what I don't like (sweet and usually rose)...so, I asked for a small tasting and explained my likes and dislikes.  So, not only did I receive a slightly sweet wine, but also a rose...not really what I was going for, though I admit they weren't typical of the style I usually do not enjoy.   And, as mentioned above, I wanted dessert...so, when the bartender didn't know about the dessert and didn't have a menu, to his credit, he went upstairs and asked.  However, he came down with a slight list versus all of them.  That's fine, I ordered something and it was delicious, I just was hoping for a bit of a menu, or a bit more knowledge of what the options were. In any case, the spot was cute, I just think there were a few tweaks that could have been done to make my visit more enjoyable.  I may visit again if nearby as I really wanted to enjoy myself there!",0.9877,0.806,0.159,0.035,0.5125396825396826
2012-01-17,5.0,"Tremendous. That alone justifies the five-star review from these hands. Letizia's, to me, was always another neighborhood café. But recently they decided to turn the café to an upscale Italian eatery during the evening hours, boasting of their 40 bottles for less than $40. (Don't worry: most of them are between $30 and $35.) I made a last-minute reservation for a Friday night on OpenTable for about 6:30p and came into an empty restaurant. We thought we had made a mistake but it quickly filled up. The ambiance is quiet, easy to have a date night in but also one can imagine having a small group of friends for a going-away party or something low-key. The crowd varied for sure. Now, on to the food. The menu was, well, pricey. And that's okay because the experience of eating was well worth the cost. We started with insalata finocchio, which they nicely split for the two of us. The oranges were the highlight of course one, dominating the calming flavors of the fennel and the strangely-tasteless olive. Next was the garlic bread. This is when I realized I needed to suspend the idea of Olive Garden-style Italian food. Here was a thin slice of bread gently garnished with delicious olive oil and garlic. It wasn't overwhelming, but just right. Then came the mains. Homemade. Scratch made. Totally-made-for-me pasta. The black grouper was just heaven. The noodles were imperfect but had a great taste on their own. The mini tomatoes burst in your mouth and touched every one of of my taste buds individually shaking them from their dormant state. I love fish and this was prepared by someone who gets that and isn't scared to make a fish dish fishy. My partner's eggplant ravioli (and she does not like eggplant) was done to perfection. For once the eggplant wasn't mushy. It nearly had the texture of a fine ricotta. It was pressed into a hand-made ravioli and brushed with a scrumptious tomato cream sauce. (I am using a lot of adjectives I don't normally use. I apologize.) Now, we're full at this point. But we cannot stop ourselves from at least looking at the menu. And we're not committed by any means. We can stop. We ... will ... try at least. But we lose to a pumpin cheesecake and a chocolate cloud. Let's start with the cloud. Imagine a round ball of chocolate, about the size of a softball, maybe a little larger. Then imagine it filled with a mousse-like substance. Then imagine putting big pieces of cake inside this mass. It doesn't seem possible, but it is incredible. And I've saved the best for last. I love pumpkin and cheesecake. The best cheesecake I've ever had was at a place that no longer exists. But this one is out of this world. The owner herself made this recipe and it is by far the most amazing cheesecake. It's like the entire month of November was dumped into this one slice. There are notes of nutmeg, vanilla, rich pumpkin and the sweetness (not over sweet) of the cream cheese and a bit of sugar. Then topped off with a semi-sweet caramel. It's just incredible and just works so well. With two apps, two entrees, a bottle of wine and two desserts the total comes to $101. That's a great date night, but definitely one of those places you cannot go EVERY night. To top it off, Letizia herself came around and chatted with us a couple times as though we had known each other for ages. And that's what sends it over the edge for me. You know it's made with love, tenderness and with passion. And every bite shows.",0.9991,0.75,0.205,0.045,0.5615427457532719
2012-01-12,5.0,this place is awsome! my girlfriend or i go her just about everyday. the workers are super friendly. THEY ARE LOCAL! help out the little guys this year!,0.8928,0.692,0.308,0.0,0.4533333333333333
2012-01-08,5.0,"Perhaps the most authentic Italian restaurant in the city.  What I mean by that is that if you go to a neighborhood restaurant or nice trattoria in Rome, it's going to be just like this.  Well-curated wine list, inventive cocktails, tight menu with incredible house-made pasta and entrees from their wood burning oven.  The main dining room is very nice and the downstairs wine bar is cool and cozy. Most Italian restaurants in Chicago just punch the clock when it comes to pasta, but Letizia's knocks it out of the park.  Pasta here is seriously a must-try.  My carrot gnocchi was exceptional and my wife raved about her tonnarelli with wild boar ragu.   Service was great and the bartending was top-notch. Letizia's Fiore gets my HIGHEST POSSIBLE RECOMMENDATION.",0.8689,0.889,0.096,0.015,0.6586607142857143
2012-01-03,5.0,"This place has a charming personality, inventive menu and friendly staff. What a gem!",0.807,0.578,0.422,0.0,0.8333333333333334
2012-01-03,4.0,"Was excited to eat at the restaurant after enjoying the bakery, and chose it for a birthday meal.  Very tasty, excellent homemade pasta.  Definitely worth a try!",0.9283,0.577,0.423,0.0,0.55
2011-12-28,5.0,"hand made pasta...from the sweetest lady in the neighborhood...doesnt get much better than that!  not only do i love this place as a bakery, its my new favorite italian restaurant!",0.7443,0.648,0.261,0.091,0.5924242424242424
2011-12-16,4.0,"Another two-parter: 1. The cafe rocks. Best coffee, best environment for working or meeting with people, because you can actually talk and hear each other! They DON't BLAST CHRISTMAS CAROLS, or anything else, like some other area coffee shops. 2. The bar/restaurant: LOVED the bar downstairs! Just discovered it for the first time last night. Brian - the bartender, who is awesome - kept our prosecco glasses full. (It was $5 prosecco night... who knew?!)   The salad we had was delicious (fennel, oranges, fresh basil) - but I'm a little limited on the food b/c so many of the items have wheat-flour.  Will definitely be back to try an entree or two...  The place transforms at night... it's warmly lit and very cozy. Definitely recommend.",0.9818,0.763,0.223,0.013,0.4693609022556391
2011-12-13,5.0,"Cozy, friendly new format. The prosciutto farfalle was the best I've had in a looong time.  Surprisingly good beer selection and awesome extensive wine list.",0.9485,0.534,0.466,0.0,0.5625541125541126
2011-12-10,5.0,"Fantastic!  Just hosted my staff holiday party at Fiore and could not be happier.  It was an amazing dinner with cocktails, appetizers,dessert and the best atmosphere.  We hosted our event in the bar area in the basement.  When we arrived we were greeted right away and lead to our event where we were promptly served a delicious cocktail.  The pasta is out of this world.  It's handmade and you can tell!  The staff were all very attentive and made sure we had everything we needed.  I have also been to Fiore for dinner and lunch as well as to just stop in for a pastry and coffee.  I have never been disappointed by the place and will continue to make it a regular stop.",0.9725,0.739,0.211,0.05,0.7057251390584725
2011-11-18,5.0,"First time I ever posted a comment online for anything and it's for Letizia's  Fiore.  If you are in the mood for authentic Hand Made pastas not seen anywhere on this side of the Mediterranean along with artisanal sauces from all the different regions of italy, letizia's is the place.              The restaurant atmosphere is serene and warm and the lower level dining area is reminiscent of a Chicago speakeasy from the days of prohibition with a twist of artistic flare bringing cell phone lovers truly back to the future.    The wines are priced right as they should be, in italy wine is not over priced and marketed to those who have money but is a main ingredient for an overall dining experience for all and Letizia's Fiore makes this possible with a selection of forty great wines for under forty dollars.                I can't wait to go back and try other dishes",0.9144,0.89,0.1,0.01,0.4601587301587301
2011-10-27,5.0,Try a caramel hot chocolate! Delicious!!!,0.7067,0.451,0.549,0.0,0.925
2011-10-27,5.0,"I love this place...the food is always fresh and so good!  Now the place as got its liquor license and I'm excited the prices are resonable $6 for a class and average under $40 for a bottle, Yay!   Plus the staff is so nice and the owner makes all his food with a lot of love.  Its that ""real italian love of life"" that shines through when you get your food, plus you know that there are some good family recipes you are eating. MangIa, Mangia!  So good!",0.9883,0.679,0.321,0.0,0.5681818181818182
2011-10-24,5.0,"Finally, a neighborhood restaurant with a shot of class, but no pretension - not to mention a pretty fabulous wine list. Try: The carrot gnocchi, eggplant ravioli, risotto ball appetizer.  If you're sampling the Italian cordials and cocktail menu...give yourself some time, you'll want to try them all.",-0.0495,0.765,0.116,0.119,0.75
2011-10-20,5.0,"The fiore has blossomed.  A humdrum neighborhood bakery has been transformed into an Italian food paradise with one swoop of a liquor license.  The place now serves a complete dinner menu, the highlight of which are the handmade pastas and the eggplant arancini.  There are 40 bottles of wine for under $40 and an ample selection of fabulous, carefully-crafted cocktails as well. Make sure you visit the vino bar in the basement.  Use the speakeasy entrance at the rear.  The bar has a telephone theme thanks to Antonio Meucci, the actual inventor of the telephone - make sure you ask the owner Fabio about him and bring your old cell phone in for a free drink!",0.969,0.815,0.185,0.0,0.4975308641975309
2011-10-17,3.0,"Took my dad here for lunch on a Sunday.  I had the spinach/pesto pizza and he had an egg wrap.  By lunch time, they had run out of a lot of stuff which I wanted to try, so really, the pizza was like a triple back up for me.  The food was average at best.  It just wasn't filling or worth the price, I could've made it at home.  The dessert and coffee however was really good.  We had chocolate raspberry cake which was rich and smooth and seriously made my day!  I wish I found the food here to be more than average because it is a really cute building.  The staff is friendly and helpful.  I would probably go back here for coffee and cake and maybe to just sit in their back room to work, but probably not again for a meal.",0.9072,0.863,0.119,0.019,0.3944444444444445
2011-10-16,5.0,"Just had dinner here for the first time in their caverous and quaint basement wine bar. Being there, you will never believe that the bustling daytime bakery is located upstairs. I only tried the eggplant balls antipasti and the grouper pasta entree and they were both scrumptious. The entrees seemed to hover around $18 each.  I will definitely be back for dinner again soon to try some other dishes and vino!   I was blown away by their marinara sauce!  I wish I would have taken the few drops I had left home with me now!  The service was great especially considering the dinner/wine bar has only just opened. The Italian wine list is charming and best of all, decently-priced at around $6-8/ glass and all bottles under $40. See you again soon, Fiore :)",0.9763,0.832,0.168,0.0,0.5275641025641026
2011-10-11,2.0,"So I heard Letizia's was starting to offer dinner. So, my wife and I figure out what we want with their online menu, and I walk over to get the food to go. Then the confusion ensues... Me to hostess: You do carry out, right? Hostess: No, I'm sorry we don't.  Me: You don't do any carry out? Hostess: No. But we have a new wine bar in the basement. Confused as to why she would mention the wine bar in the basement, I head to Anong Thai and get a bunch of quick take out. Then, just to double check, I stop back in at Letizia's. Me to hostess: Hi again. I just wanted to double check. Will you eventually be doing take out? Or will it always be dine-in only.  Hostess: Well, right now, we can only make these things to-go (she points to entire dinner menu).  Isn't that carry out? I guess their hostess thinks carry out only refers to alcohol? I didn't want a six-pack to go. I wanted to drop a bunch of money on your food! Maybe next time....if they really do carry out.",-0.8765,0.891,0.025,0.084,0.47818587662337664
2011-07-12,3.0,"Even though Letizia's opened this second location about a year ago, I just made it in for the first time last week. There's a lot to be said by an open, wood-burning oven. I came in & tried the smoked turkey piadini sandwich, but I didn't really take a look at any of the other baked goodies. So, while I was waiting for my sammy to get toasted and melted to perfection, I started drooling at the donuts the size of your face, different flavored shortbread & tarts.  Back up to the register I went and nabbed a chocolate shortbread cookie w/ the vanilla filling. My grandma used to make homemade shortbread cookies, so I was a bit skeptical. However, it was delicious.  My only food issue was the piadini sandwich, while quite large, was a bit bland and lackluster. The cheese was delicious and the turkey was great. But for the amount I paid for it, I was a bit disappointed.  Still going to go back & try some other things. They make most of their things there. And I love that....and the fact it's an all-natural bakery.",0.9723,0.826,0.136,0.038,0.4905952380952381
2011-06-27,1.0,"I just walked in here for a coffee, and stood there for 5 minutes while an obviously harried counter worker prepped some kind of baked good. That didn't bother me. What did was that the entire time I was waiting the owner was standing right there yukking it up with two of her buddies. Since I could easily see how much my satisfaction mattered to her, I decided I'd rather eat at the Starbuck's up the block.",0.6041,0.807,0.127,0.066,0.5991496598639455
2011-06-02,5.0,"Love the atmosphere and great, real Italian coffee.  I agree with the breakfast sandwich part- it's plain if you don't know how to order it.  Make sure you get it with Pesto and Sun Dried tomatoes, or any of the other  flavors they have.  Staff is friendly, space is clean and it's a great place to sit and work for a while.   Love, love, love.",0.9888,0.593,0.407,0.0,0.5631562881562882
2011-06-01,2.0,"I wanted to love this place for all the usual reasons - it's on my commute, it's locally owned, it's baked goods (HOLLA), and it's quirky. It's also just about a block away from the Starbucks on Logan and California, and I was really happy to have another after-work coffee spot in the area. What's good about it:  -- Doughnuts. My roommate isn't a fan, but I think they're tasty. -- Cookies (variations on espresso shortbread with chocolate frostings... very good.) What's not so good: -- The breakfast sandwich. I got it one early morning on my way downtown, and was disappointed that is was just cheese on flatbread. It needed... something, like pesto or some kind of spread. It was just not worth the money. -- The service is really patchy. It seems to depend a lot on who's in that day. I've had friendly, quick service on more than one occasion, but I've also had slow, inattentive service several times. I really hate that feeling, when you're standing there in front of the counter and everyone behind it is running around (or just staring at the credit card machine, working on a glitch) and no one even looks up at you to reassure you that you're on their radar. I've worked in retail, and I know how it gets sometimes when you have a lot to do. But job #1 is always connecting with your customers.  In summary: hit-or-miss food, hit-or-miss service. I've experienced better. I can deal with not loving all the food (can't expect everyone to love everything you make), but the service made it a meh place for me.",0.9119,0.804,0.117,0.079,0.56375
2011-05-30,5.0,"My wife and I absolutely love this place.  I highly recommend pairing one of their sandwiches with a cup of the tomato soup.  The sandwiches are a perfect size that you don't end up feeling disgustingly full like so many other run-of-the-mill sandwich shops out there.  The pastries and other sweets are pretty darn good, too.  We tried the caramel cheesecake the other day.  It was awesome.  Even though we always finish our lunch there with something sweet, I never feel uncomfortably stuffed after eating here. This is one of those places that I am so happy to have here in Logan Square.",0.9857,0.666,0.292,0.042,0.6832142857142857
2011-05-28,2.0,"Be prepared to be wowed by a cutesy exterior and underwhelmed by everything else.  Seems like it was designed to be ready for the influx of strollers that is bound to arrive. How does a bakery mess up a sandwich?  The truth is that they are running this place their own way.  Which is donuts, cookies, and piadinas.  Want a sandwich?  Nope.  Want a bagel?  Nope. I wish that they would keep this type of place in Lincoln Park and let all the rest of us who like strong coffee and sandwiches live our lives.",0.9684,0.719,0.257,0.023,0.5816666666666667
2011-05-28,2.0,"They spent all that time on the building to open up a mediocre bakery? I wanted this place to be good. It's not. The food isn't that good, and the prices are too high. $6.50 for a muffin and OJ? nah... Pretty on the outside, no substance on the inside.",0.7998,0.788,0.172,0.04,0.54875
2011-05-28,4.0,"With friendly baristas, funky decor, lots of space, well-made drinks, and a big assortment of delicious pastries (the carrot-raisin muffins are excellent!), this place is welcoming and keeps me coming back for more. I much prefer it to the Starbucks down the street.",0.8655,0.763,0.208,0.029,0.4486111111111111
2011-05-09,3.0,"OK Whoa! Bad donut. Good White bean soup, So-so garbanzo bean salad. Er....*interesting* decor (terracotta pot explosion, anyone?) Good service, terrible transportation. No tray????  (So, yeah,  I had to balance the salad on top of the soup and carry my coffee all at once to my table. Once there the staff was very accommodating, bringing me everything from an extra bowl to vinaigrette, but the balancing act was scary.) Wanted an arancini but was told they weren't ready. Even though they supposedly would be done ""in ten minutes"" they still wouldn't sell me one. Bummer. That's why I came there! But back to the donut. Beautiful, fluffy, glistening with sugar. Biting into it was no better than trying to eat your down coat. Dry, oddly tasteless, and disturbingly firm.  And this was a fresh one?  hm. Save you money and take it to any other donut shop on my list.  Letizia's - eh? Just OK in my book.",0.9108,0.733,0.165,0.103,0.4882850241545894
2011-05-09,3.0,"This review is based only my doughnut experience here.  I was soooooooooooooo excited to come here for doughnuts.  Last week I stopped in late morning and picked up a chocolate glazed doughnut to go.  It looked beautiful.  It was unusually heavy for a yeast doughnut, and promised great things.  However.  I was very sad when I tasted it!  It was so bland!  It's so heavy because the dough is very dense... and such a dense dough demands more flavor packed inside!  Instead it tasted like a thick pile of nothing that was glazed with chocolate that itself lacked the usual vibrancy of a chocolate glaze.  I can't believe I'm going to say this, but your average doughnut from jewel or dunkin donuts had a lot more flavor than this one.   I was disappointed all around.  I love doughnuts and wanted so badly to love their doughnuts too.  Perhaps I'll be back to give it another try, they could have just been having an off day and forgotten to mix in the ""flavors"" part of the ingredient list.  You never know.",0.8832,0.787,0.133,0.08,0.5654761904761904
2011-05-04,4.0,"My favorite coffee place so far!  Walking distance from my house.  The staff is super sweet.  Their pastries are excellent.  Their space is adorable!  Big room in the back and a new bar coming soon.  Their warm food variety is limited, but I've tried just about everything they offer and I keep coming back for more.  I highly recommend!",0.9311,0.719,0.26,0.022,0.5467192331478045
2011-03-16,4.0,"Well, it IS the first day of 60 degree weather, so that MAY be tainting my review, as the door at Letizia's is thrown wide open and everyone is in a fantastic mood. All Vitamin D-bias aside, this place rocks, for snacks and especially as a place to work.  Spacious! Tons of tables, tons of windows, upstairs, downstairs, and tons of plugs for my crappy Dell work laptop. The WIFI works - consistently! And it's free! Music! But it's GOOD! And at an appropriate level, loud enough for toe tapping, but not enough to distract me from my ENTHRALLING PowerPoint editing. Drinks are plentiful and come out quickly - iced coffee drinks and hot coffee drinks are the mainstays, plus delicious-looking homemade juices I haven't tried yet. Naked smoothies in a fridge also. Food - mainly Italian-type lunch stuff, but don't let that fool you. The pizza slices (4 bucks) are shockingly delicious, and the Piadinas are also quite surprisingly good, if not slightly dry on occasion. They also have a yummy breakfast sandwich, but you have to pay extra to add meat. One day I will eat the Garlic BOMB! But today is not that day. They have boxed salads and parfaits as well. No fruit though :-( ALSO, tons of baked goods, delicious looking. If they have them, EAT A CANOLI. Come on. You only live once. And it's a canoli. Service, great! Friendly, cheerful employees. Summary: Great, sunny neighborhood spot to work, get a bite of lunch at a decent price, or grab a coffee. I hear they are adding a rooftop vegetable garden!! Also have a patio out back and will ultimately be open for dinner, but for now they close around 5.",0.9943,0.748,0.199,0.053,0.6172043010752689
