date,star,text,compound,neutral,positive,negative,subjectivity
2016-05-09,5.0,"No more dinner service here! Saw a sign on the door yesterday that said it was closed and the last day of service was April 30 (2016). This place will be missed, best pasta in Logan Square no doubt.",-0.4926,0.708,0.09,0.202,0.24166666666666664
2016-04-03,5.0,"Highly recommended!  I have rarely had such an amazing overall experience.  Service was spot on. But the food... The food! Had never tried a hand-made pasta called trofie.  It's so good and the sauce was perfect.  Also the table-side polenta was truly the best I have ever had. Lots of options for the vegetarians who were with us.  The owner was consistently rounding on every table to ensure every guest was having a great experience.  Then we splurged and had some shared desserts. I couldn't choose a favorite. The chocolate cake, the caramel cheesecake, and the tiramisu were all so very good.  And I have to add that I am very particular about dessert - usually I just pass it up.  I'm so glad we didn't!  I will always come here when I'm in town!",0.9889,0.733,0.251,0.016,0.6135555555555555
2016-03-30,5.0,"The food here was absolutely amazing. I couldn't believe they had both wild boar and venison on the menu. Our waiter was super nice, and the atmosphere made it feel like we were in Europe rather than in Logan Square. The Tiramasu, while not what I expected was truly excellent. After eating we went down to the speakeasy where I had a delicious cocktail. I would definitely recommend this to anyone looking for a good place to eat in Logan Square.",0.9844,0.672,0.328,0.0,0.6755555555555557
2016-03-23,4.0,"Another great spot in our hood. We wanted to do a grub crawl but got here and stayed. I went because I'm addicted to wood fired pizza. I'll get back to that. We were quickly and graciously greeted by our server Steven who went over the specials and quickly got us a drink and some calamari. The space was warm and cozy. He picked my girl a nice glass of red I had a Stiegle on tap! The calamari was decent, not as good as BT's down the street closed on Monday hence our first visit here. We then split their Brussels sprout / arugula salad, a knock out! My favorite use of arugula ever. When discussing the pizza, Steven in his most professional, tactful way tried to explain that this place is clueless about pizza. He warned me that it would be a soggy mess in the middle but have nice crust on the edges. I ordered one anyway as I said I have a pizza problem. Here is what bugs me. Their oven was perfectly hot. I passed it on the way in. The ingredients were generous and of high quality. The dough was a nice dough. It really wanted to be a good pie. The execution is where they fell on their face. It was exactly as Steven had warned it would be. It was great along the edges and a bowl of pizzaish soup in the middle. So close yet so far! No biggy, I took it home and added more dough and cheese and rebaked it the next night. Now we also got their fungi pasta.....swoon! To say we both loved this dish was an understatement! Perfectly textured fresh pasta just covered in killer rich truffle cream sauce and tons of shrooms! No joke this may be my favorite pasta dish ever. We will be back for this alone! Steven picked my girl a different wine for this course, listening to what she wanted he got her a nice super Tuscan that we both loved. He packed up our pizza soup and as we were chatting about all being industry and clearly not impressed by the gloop. He brought us each an Amaro and an truly amazing tiramisu! I'm scared to say how much I enjoyed them together. I just can't admit to liking Amaro. I'm afraid I'll grow a mustash and get skinny jeans and a cowboy shirt and start making my own bitters! Anyway. Great service, salad, drinks and pasta. The pizza reminds me of the classic movie the jerk in that it should be served in a cup.",0.9957,0.69,0.201,0.109,0.5768171296296296
2016-02-10,2.0,Ordered delivery. The salad had rotten soggy smelly tomatoes and frozen arugula. The dressing was not a great pairing even for fresh veggies. The pizza was alright but the sausage tasted terrible - rotten old pork. Will not order again.,-0.8945,0.666,0.066,0.268,0.6125
2015-11-13,4.0,Very good food at reasonable price. I really enjoyed my dinner at Letizia's restaurant. She welcomed me warmly and recommended some really good dishes. I really liked the herbs gnocchi and the boar ravioli. The tiramisu was non-traditional but good.,0.9297,0.628,0.372,0.0,0.6685714285714285
2015-11-12,5.0,"Can't think of anything that would give this place anything but a 5 star review. Everything I've tried here is so delicious, especially their del bosco pizza! Service, great and waiters are so friendly. Depending on the night it would be perfect for a family or for a casual date night. Atmosphere is perfect. Parking, generally easy, service is quick.",0.9901,0.588,0.412,0.0,0.8277777777777778
2015-11-05,5.0,"Solid pizza place.  We had a gilt city deal that included 2 drinks and a pizza each for a nice price. I made a reso using open table and hopped on over on a Thursday night when they have jazz or some other live music in an adjacent room.  We were greeted and seated quickly and told the specials. I quickly picked one of the specials as soon as I heard the world truffle in the ingredients. Hubby had the basil and ricotta which has globs of gooey cheese. When the pizzas came out, I realized there was meat on my pizza. I asked the waiter if it was a mistake and he said nope. It was just my impulsiveness, not listening to the rest of the ingredients. I asked if we could switch for anything else and without a problem or any attitude, he got me another amazing mushroom and truffle pizza in a jiffy.  The place was a little tight with seating but had cute decor with an intimate vibe. I thought the food was solid and the wonderful customer service just took it to the next level. I was full and tipsy by the time i left (2 most important post-meal feelings!) and didn't make it to the Jazz as it was a weekday but I would definitely go back and check it out.",0.9702,0.875,0.118,0.008,0.49553571428571425
2015-10-31,2.0,"We went here on a lark. We wanted a decent dinner without dealing with the crowds on the Square. So, we found Letizia's on an Open Table search. But we didn't make a reservation, and this seems to have been a mistake. When we told the fellow (manager?) that we didn't have a ""resie"", we were escorted to the basement...excuse me, the ""Speakeasy"". First impressions of the place is that it's cute and well put together, but the basement was, well, a basement, complete with giant trash can and smelly mop bucket.  We like to go out to eat and spend a little more than the food is probably worth for the experience. Atmosphere is very important. The last thing I want is to look at a trash can with dirty dishes pilled on top and smell bleachy mop water while I'm drinking a $9 glass of wine. The basement area was a mess. It seemed as though they had thrown it together with little thought to its actual utility. But more importantly the SMELL was terrible.  Our server did her best under the circumstances. This place clearly has some management issues. There were 6 or 7 tables in the basement and one server. This wouldn't be such an issue, if they hadn't sat ALL of the tables within a 20 minute period. Our poor server was slammed, but she handled it with a smile. Meanwhile, other servers and the *owner* simply looked on without lending a hand. So, it took us much longer to actually get food and drinks than it really should have. We left a big tip for our lovely server. Meanwhile, the wet mop sat in the corner smelling up the place and the phone rang LOUDLY and incessantly. It felt more like a crappy sports bar than a nice-ish restaurant.  I figured that the main dining room upstairs would be packed when we left - surely this would explain why we were relegated to the bowels of the building. Alas, there were at least 4 empty tables when we left. I'm sure the upstairs experience is far superior. The food was good, though our order was wrong (we didn't say anything as we were moving into hour 2 and needed to get to a party). A messed up order happens in that chaos (again, management should have stepped in to help our server). I haven't written a yelp review in years. I don't like to complain in public forums unless it is to serve some purpose for others. So, I just want to warn potential patrons to ask to NOT be sat in the basement. And hopefully, the management will see this and do something about it. Take into consideration that your patrons are not just paying for food, but also for the experience. Build a broom closet, for crying out loud. Organize the place and make sure the musty basement, mop water smells are gone before you ask people to eat there. I also plan to write an e-mail to the restaurant to alert them to these issues.  I'm sorry to say that, despite the delicious food, we probably won't be back.",0.9698,0.773,0.135,0.092,0.5286147186147186
2015-10-21,5.0,"Had a lovely dinner here last night with a friend and will definitely come back again. Very pretty setting, great service, full bar, and delicious food - and the owner is so friendly! They even have a cool lounge in the basement if you want to hang out before or after dinner.",0.9822,0.571,0.429,0.0,0.5766666666666667
2015-10-12,2.0,"The hunt for good Italian food continues to make me believe, since it's a relatively easy cuisine, that I'm better off making it at home versus going out. Don't get me wrong, the pasta here is fresh and it was good. But I found the portions small, the food (again, very tasty and obviously fresh) pretty standard, but the thing that makes my review so low is this place was expensive.  I don't see any reason to pay fifteen dollars for pasta with marinara and peas. Not very filling. Just not a spot for people who don't like to burn their money. It was a very nice set up inside, and the staff was attentive and even helpful with recommendations. (Not just looking to tack on the bill, but actually helpful and knowledgeable. They pitch well.) It wasn't the worst experience in dining, but not impressive enough to go back.",0.9421,0.761,0.172,0.067,0.5424242424242425
2015-10-09,5.0,"Excellent service.  White pizza with tallegio cheese and truffle oil was delicious.  Got everything what expected.  Interior decor,  service and great food.",0.91,0.623,0.377,0.0,0.63
2015-09-17,5.0,"This place has everything: terracotta planters on the wall, Malort, fried beet & goat cheese balls. Seriously, all of that is real...and it's adorable/delicious.  They also have handmade pasta with amazing wine pairings and desserts so decadent they're evil. We came after friends won a dinner here via a silent auction, so all of our courses were selected by the house and turned out to be wonderful. I couldn't get enough of the mushroom pasta, arugula salad, and calamari.  Logan Square, you're good; no more restaurants needed. I know that's not happening anytime soon, but truly, Letizia's got it covered.",0.8469,0.806,0.14,0.054,0.6583333333333332
2015-09-06,5.0,"We showed up a bit after the main dinner rush on a Saturday night and sat on the patio.  They have a cute little bocce court next to the patio which was charming.  Interior is modern and pleasant, and the store in front was interesting.  We had the sauteed calamari, the salad estiva, their tagliatelle with sausage in tomato cream sauce, and the wild boar pizza... everything came out looking excellent and tasted just as well.  Service was just attentive enough for us to enjoy a leisurely meal without feeling rushed, which is always appreciated, a great little spot on this stretch of California, will definitely be back and recommend to friends.",0.9883,0.707,0.282,0.01,0.5441176470588235
2015-08-31,4.0,"Excellent fresh, local Italian food. You'll see Letizia at the Logan Square Farmer's Market or around the restaurant and she has so much positive energy and cares deeply about her customers. The food is more expensive than most neighborhood options but worth it. Menu is surprisingly large with plenty of vegetarian options. Try the white pizza with truffle oil! Excellent wine list, including options from the shop to takeaway that are very affordable. In warmer weather be sure to ask for a table outside, really cute sidewalk cafe. Highly recommended.",0.9846,0.695,0.305,0.0,0.46960638127304793
2015-08-23,4.0,Came for my birthday. Was not sure what to expect. Had the grand avenue pizza and the gnocchi. It was surprisingly delish! I would definitely come back!,0.7595,0.678,0.261,0.06,0.5777777777777777
2015-08-13,4.0,"Love this place.  Our first time here was last April when we stumbled upon it using Yelp reviews. We had pasta (forgot what we had, but it was great) and then went downstairs to their Speakeasy for a post-dinner drink.  We promised that when we returned, we'd try the pizza made in their wood-burning pizza oven.  Fast forward more than a year later and we made our way our to Letizia's from our River North hotel. The restaurant was weirdly empty, but oh well!  No one to judge us for eating too much. And bonus: we learned that Tuesday and Wednesday are $10 pizza night. (All pizzas on the menu are $10.)  We started with the calamari saute appetizer.  Delicious!  Next time we might just order that for our entree! We then had the Caprese Invernale.  Turns out I'm not much of a fan of roasted tomatoes. It was ok, but I'll skip it next time.  We ordered the Capricciosa pizza with an egg on top, and then followed with dessert (chocolate cake thing).  Pizza was great.  We also ordered a bottle of wine with dinner. Service starts with the usual bread and olive oil.  The bread wasn't anything too special. Service was excellent.  It's very relaxing. They have a lovely outdoor dining area plus a small bocce ball court.   What makes Letizia's so special is its relaxed vibe, consistently good food, atmosphere (great music track), and service. It's worth it to make your way here. Get away from the crowded, noisy restaurants with long waits and average food. Letizia's is about 4 blocks north of the California exit off the Blue Line, so easy to get to/from downtown (for you out-of-owners). There's also a Divvy station right next to the restaurant.",0.9932,0.764,0.177,0.06,0.4394345238095239
2015-08-08,4.0,"Wow, so happy this place exists. My wife and I enjoyed everything about it. Here's the blow by blow... Cocktails: Negroni was spot on and Ugo was a refreshing gin & elderflower drink Arancini cardinale: killer crisp exterior with great flavor both inside and in marinara that surrounded Insalata Estiva: Salad was amazing - great use of limoncello to provide acid and sweetness  Pizza: oh, my goodness, right on. Got the del Bosco and loved the mushrooms. But, the crust and oven-fire cooking made the real different. We're sure all of the pizzas are delicious and intend to find out. Give us time. Pappardelle ai funghi: great truffle flavor without being too rich and overbearing. Homemade pasta was a perfect al dente. Wine list was not overwhelming number of choices but definitely provided lots of options. Sat outside. Could imagine inside being loud with a full house.",0.9745,0.759,0.205,0.035,0.7638699924414212
2015-07-29,4.0,We ordered a pizza and a pasta and they were both great! Quick service and we sat outside which was nice. The food is a bit pricy and the wine was very pricy but it's a nice Italian place with quality food!,0.8287,0.8,0.2,0.0,0.5142857142857142
2015-07-18,5.0,"Incredibly Roman and just down right delicious. Service is also superb. Go there, now.",0.8316,0.606,0.394,0.0,0.744920634920635
2015-06-29,5.0,"Authentic Italian, food was home made like Nonna's, service was great friendly and not at all stuffy. We enjoyed our meal outside and even played a round of Bocce in between courses. Fun and good.",0.967,0.554,0.446,0.0,0.4388888888888889
2015-06-17,3.0,Letizia's-- PLEASE take down the flower signs on your building! It makes you look like a florist and it's confusing to those driving by. It does nothing to promote that you're a restaurant. I've been wanting to tell you for 2 years.,0.41,0.779,0.13,0.091,0.34444444444444444
2015-05-30,5.0,"We had our first date here a year ago today.  The weeks later, we got married. Came back for our anniversary.  The home made pasta is superb. Logan Square is lucky to have this gem.",0.7845,0.823,0.177,0.0,0.40277777777777773
2015-05-18,1.0,"It has to be bad for me to give one star and boy was it ever. Horrendous service + mediocre food. The server would disappear for long stretches and it took forever to get anything, from her or the assisting waitstaff. We had to ask for drink refills and more bread (and were lucky if they came quickly... or at all). One of my guests was condescended to when asked if they just had basic spaghetti: ""Ha um, no, we don't have that here."" (She actually laughed a little. Nice.) After waiting 15-20 minutes to finally order, she told us she'd ""just found out"" that they were out of all three of their meat pastas. ALL THREE. There are only 7 or 8 pastas in total! And really? At 6:00 on a Sunday? The food wasn't bad but it wasn't good. Oh and they messed up one of the pizzas, of course for the person she was rude to earlier. Even getting the food was an ordeal... it took 5 solid minutes to get everyone's food out, despite the fact that three people were serving. And then the check... we were charged for two bottles of a particular wine instead of glasses, and the funniest part is that person had only had one glass because she never brought the second one they'd asked for. And while I understand that mistakes happen, she didn't even take ownership of the error! She blamed it on someone else in the back! She was definitely the worst part but the service was terrible overall. I have several more examples but I'll end it here. You get the picture. I feel terrible that I put my family through that. What a waste of time and money. Needless to say, never going back to this place.",-0.9881,0.799,0.048,0.153,0.5295454545454545
2015-05-02,4.0,Excellent Italian food in Logan Square.  Great service and atmosphere.  Pizza is crisp and thin.   Try the boar ravioli.,0.8316,0.685,0.315,0.0,0.6033333333333333
2015-05-01,3.0,"Great service, pretty average food. It was my first time eating here.  My family and I shared the Calamari appetizer, two pizzas, and an order of their pasta.  While the place is really cute, and the service was excellent, i enjoyed the food, but wasn't all that impressed (especially given the Yelp reviews).  Maybe the best dish was the Calamari appetizer.  It had just the right amount of kick and it was a pretty generous serving. The pizzas were dispassionately average.  The salami and the sausage on the pizzas were very unimpressive, and the dough/crust was majorly disappointing for having come out of a wood fired oven.   The pasta was ok, but nothing I felt I couldn't make at home.  I'm happy to have this place in the neighborhood, and I might come back in a pinch, but i'd rather go to Reno for Pizza, or drive a little further for better pasta.  I'm hoping it was an off night.  I'll go back and give it another shot, but i was expecting better on my first foray.",0.9808,0.704,0.218,0.078,0.5938492063492063
2015-04-26,5.0,Never disappoints. Not too pricey good Italian food. Homemade pasta and delicious wood fired pizzas. The eggplant pizza and pasta is my favorite.,0.5267,0.533,0.284,0.183,0.65
2015-04-25,5.0,"First of all, I had the Pappardelle Ai Funghi, which is pappardelle, crimini mushrooms, parmigiano and truffle butter.  Holy cow!  It was beyond amazing and I can actually say it was the best pasta dish I've ever had.  The restaurant was warm and cozy.  The staff did a great job and made us feel at home.  When we were done, they thanked us for coming multiple times and seemed genuinely touched when we talked about out love for the meal.  Go there...you won't regret it.",0.9742,0.76,0.24,0.0,0.45454545454545453
2015-03-25,4.0,"Another great meal from the same people who own Enoteca Roma on Division.  This place is bigger and has different dishes.  Their music was more 90s hipster whereas Enoteca was soul - and that kind of describes the differences as a whole. We shared a bottle of red wine which was good.  My boyfriend had to try their Italian version of an old fashioned.  It was yummy! We started with a salad which was perfectly balanced, and the arancini.  How can fried rice with cheese be bad? I had the spaghetti that's served in a Parmesan cheese nest.  Its like fancy mac 'n cheese in a good way.  Maybe a lot of cheese for one meal but I had to see what it was about.  My boyfriend got the chicken thighs which he loved. I would definitely come back!  Enoteca has a slight edge because in nice weather we could walk to it.  Both places have that great bread, great service, and everything is homemade.",0.989,0.773,0.215,0.012,0.5547101449275362
2015-03-23,5.0,"I wish, more than anything, that you would bring back the morning coffee and Panini's!!! That place during the day was my heaven! So sad you aren't doing that anymore.",0.5824,0.711,0.196,0.093,0.5
2015-03-07,5.0,"What a nice surprise! I'm upset that I've lived here for years and just now decided to have dinner here. I will definitely be back. Nice to find another good spot in the ""adult"" side of Logan Square. The meal starts with wine and cocktails. They have a nice wine menu with a map of Italy to show you the region your wine is from. I thought the cocktail menu was pretty creative, lots of Italian themed drinks that sounded good. Home baked bread, which was delicious, and olive oil as well. We ordered the salami plate antipasti. Very generous portion for the price, and it featured some excellent prosciutto. Highly recommended. The pastas are all made in house. The gnocchi was great, tagliatelle was excellent, sauces were so good, and the portions will satisfy even the hungriest diners.  The only notes I have are related to the service. Nothing bad, just slow. I actually didn't mind, it was very relaxed, but if you're in a hurry you might want to let your waiter know. Also, the menus sort of crowded the table, but that is nit-picky.",0.9775,0.781,0.199,0.02,0.6328985507246376
2015-02-20,3.0,"My boyfriend and I made a reservation for Feb 13th to celebrate V-day while avoiding the craziness of a Saturday V-Day dinner outing.  The food was delicious. The service was pretty bad. BUT I definitely do not blame our server. Joey was great, considering the circumstances.  It was pretty packed in the restaurant and for most of our time there Joey was the only server I saw. I'm pretty sure he was waiting on all of the tables in the back room.  So when we got the wrong appetizer, I understood. When it took over an hour for Joey to take our order for dinner, I understood. When the charges on the bill were incorrect, I understood.  So I don't blame the server. I blame the establishment that would expect a single server to wait on so many tables alone.  Again the food was really good. We had the risotta balls were yummy. The Tagliatelle Rosina was so creamy and delicious! But overall I'm hesitant to go again because it seemed like the restaurant was poorly managed.",0.9897,0.671,0.245,0.084,0.6378863826232246
2015-02-14,5.0,"Just got back from Valentine's pre-set dinner with wine pairing. I just had to write this before I forgot! Everything delicious, house made, and so fresh. The staff was also super-friendly, and it was wonderful to meet Letizia and hear a bit about how everything, from the bread to the pasta were made there by hand. Good to see that they take so much pride in their food and service! A great dinner experience!",0.9754,0.723,0.277,0.0,0.5785714285714286
2015-02-08,5.0,"I love this place, they serve the best cappuccino I've had in a long time. And the baked goods are amazing. Its got a great atmosphere, the baristas are wonderful.  Also, I'd recommend the Bella Capri on grain bread instead of the baguette, it is really yummy.  The only thing that could make this place better is if it were open longer. I know not many people want to drink coffee after 7pm but its a great place to get homework done and a couple more hours would help. But overall, this place is absolutely wonderful.",0.985,0.695,0.296,0.01,0.5933333333333333
2015-02-08,4.0,"I have been to Letizia's a few times since moving to Logan Square & every time I am surprised by how good it is. Everything tastes so fresh! I try to get something new each time, but I can't stay away from the Saltimbocca pizza. They have a great atmosphere, incredible food, excellent wines & a very friendly staff. What more could you ask for?",0.9688,0.703,0.297,0.0,0.6354545454545455
