date,star,text,compound,neutral,positive,negative,subjectivity
2011-04-08,4.0,"Friends and I went here last night after trying to dine here last Friday. Place was packed then because people were trying to use their Groupons at the last available date. I kinda felt bad for the workers since they had no idea what to do with so many people. And it's a shame people are giving poor reviews based on that. Anywho, we ventured in about an hour before closing and the place had about 4 other tables. It's a medium-to-small sized dining area. Ambiance was beautifully lit, decor was stunning and the seating was very comfortable. Now, my friends and I dabble in Indian cuisine quite a bit so we usually know what we're in the mood for and always order a variety of food to get a good taste of everything. We ALWAYS have leftovers. We ordered our ""usual"" (the items we always order from a new Indian restaurant to test the waters). Upon ordering, our server gave us a few alternative recommendations and we accepted. We got their Klay Oven Naan (regular indian naan with spices and raisins), a spicy Shrimp Masala, their Lamb chop tandoori, a chicken green masala and yellow dal. He recommended the shrimp masala and chicken green masala over what we initially ordered (shrimp biryani and chicken tikka--generic I know). We also ordered Mango Lassis to start, and I have to say, they were the best I had. The texture was nice, and they used fresh yogurt. The yellow dal was fantastic, smooth and mild. The bread was amazing (it was 5 bucks a piece, we would've ordered more if it wasnt so expensive for a small piece). The lamb was amazingly seasoned and very filling. The chicken was good and spicy and I'm glad we ordered that over the norm. Now, the shrimp was a bit disappointing ONLY because I think we were in the mood for a biryani. Our own faults, we shouldve stuck to our guns. All in all, it was a very pleasant experience. We frequent another Indian establishment but would not mind coming in here a few times instead.",0.9411,0.864,0.097,0.038,0.5287638086551131
2011-04-06,2.0,"We got there when they were about 15 mins from closing the kitchen but the hostess was gracious enough to still seat us so that we could partake in yummy goodness that many Yelpers have raved about! Yelpers have never failed me but the food fell short! We ordered Korma Chicken, Yellow Curry Chicken, and Potato Samosas. The food was bland and I ate two bites of each and didn't feel the need to eat more. Although I was starving when I got there I quickly lost my appetite.  Maybe I will give them another try in the future and not when they are closing for the night.",0.9117,0.797,0.145,0.058,0.49621212121212116
2011-04-05,2.0,"The food was good BUT the service was awful. I am sure it had to do with every single table being filled due to the last day of the Groupon but THAT ISNT MY PROBLEM. Dont offer groupons if you are going to have an attitude. The food was great but we first received food we didnt order, after waiting more then 30 minutes. We told the waiter it was wrong and he told us that it was exactly what we ordered, we in turn reminded him no that is not correct and he said he would fix it but not until a big attitude. Just because I am coming to an Indian restaurant and my not know what all dishes are I know what kind of meat I ordered. I compare it to a person going to a Mexican restaurant for the first time you order tacos they bring you enchiladas, clearly that is not how the menu explained it. Own your actions Klay Oven and drop the attitude.",-0.5345,0.84,0.07,0.089,0.5274911816578484
2011-04-04,4.0,"We used our Groupon last weekend, and had no problems at all. It clearly states on the Groupon, ""One Groupon per table."" That said, if you're trying to use multiple Groupon, of course you're going to have problems.  The staff was friendly and the ambiance was wonderful! It was a nice, quite, romantic-type dinner.  The food was great and authentic. We always get the same thing so the waiter actually suggested our whole meal.  It's a fabulous place!",0.9311,0.705,0.215,0.08,0.50625
2011-04-03,4.0,"Mmmmmm.  Used my groupon today for carry out, and we thoroughly enjoyed our meal.   Upon calling, the person on the phone was very helpful, suggesting a chicken and lamb dish to try.  Loved the chicken, chooza tikka masala.  The lamb kabab was fine but not something I would order again.  The chick peas (channa masala) was tasty and a tad spicey.  The palak aloo (peas and potatoes) and garlic naan were  nice accompaniments to the other dishes.  Totally LOVED the Klay Oven Bread, which was a flat bread with a sweet filling of nuts and raisins.  Fabulous! Looking forward to another meal from Klay Oven!",0.9777,0.746,0.229,0.024,0.6791666666666667
2011-03-21,1.0,"STAY AWAY. I have never had so many problems trying to use a Groupon. One would think that if a restaurant offers a Groupon, they will be receptive to receiving it. Not so. Not only was the service incompetent, but the servers are indifferent about it.  My fiance and I both love Indian food, so we each bought a Groupon. Four attempts later, we have not been able to use one without a problem. FIRST ATTEMPT: Arrived for lunch on a Saturday with Mr. Fiance. They informed us that they have a lunch buffet. It was much cheaper than the menu options, so we said that we would do that. We then asked our server if we could order an additional dish to go (for dinner), since the buffet for two wouldn't add up to the $40 Groupon. He said that was fine. So we both got the buffet and I ordered a mango lassi and lamb vindaloo to go. When the check came, the same server informed us that we couldn't use the Groupon on the lunch buffet. Normally that would be fair, if we hadn't already discussed using the Groupon with the server! What!! We asked to speak with his manager, and was told unapologetically that rules were rules, and that the first server was mistaken about the Groupon but there was nothing he could do. I cancelled the lamb vindaloo but had already started in on the mango lassi. The entire affair was worth $30 down the drain. SECOND ATTEMPT: I returned with a friend for dinner on a Wednesday night. We ordered off the regular menu and everything went fine. The bill came to a little over $40. Since I was providing the Groupon, my friend offered to pick up the rest of the tab / tip. But, our server informed us that he could not accept a credit card for the remainder of the bill if we used a Groupon. What??? He said that when you use a Groupon, the remainder is cash only. We asked to speak with his manager, who confirmed this absurdity. My friend told him that it was illegal for him to impose such unfounded conditions and that she would report him to the Better Business Bureau. He shrugged. THIRD ATTEMPT: My birthday. No bigs. Mr. Fiance and I arrived for lunch again. Already knowledgeable about how buffets and Groupons don't mix at Klay Oven, we agreed ahead of time that we would order off the regular menu and finally shed our cursed Groupon. When we arrived, however, our server informed us that they were catering a special event that day, and so we couldn't order off the regular menu - - we could only do the buffet. But they couldn't take the Groupon for it. Since we were already there, we decided to chuck another $30 down the drain on the buffet. FOURTH ATTEMPT: ""Hello, welcome to Karma Kitchen!"" Er, what? When I heard this upon walking in, I thought that Klay Oven's nasty tricks had finally caught up with them, and they had gone out of business. Karma, indeed. But nope, instead, the servers informed us of a new thing they have going on, the first Sunday of every month I think, where you pay nothing for your meal because someone already paid for you the month before. You have the option of paying for someone else's meal the next month. Exasperated, we asked if we could put our Groupon towards someone else's meal and be done with it. They said yes. Hallelujah! But upon sitting down, we were presented not with Klay Oven's normal menu, but with a ""Karma Kitchen"" menu, which had only vegetarian options. Since the fiance and I are both paleo (basically a high-fat, high-meat, low-carb diet), this was untenable. Also, what a scam! No reasonably-sized person could eat $40 worth of vegetarian food in one sitting because it costs NOTHING to make! No wonder it's free (although I must suggest that Karma Kitchen seems like a very dubious business model). In short, we decided not to go through with it because (1) we wanted to eat meat, (2) this is not normally a vegetarian restaurant, so we felt that we were misled, (3) we could not possibly have eaten the whole Groupon's worth of spinach and would thus lose money, and (4) we were just generally really pissed off that Klay Oven consistently finds sneaky ways to get us to pay for food we never wanted. We just wanted to use our Groupons. And after four attempts, we have not been able to do so. I want a refund.",0.788,0.833,0.085,0.082,0.4646310479643812
2011-03-15,2.0,"We came for lunch on a week day with full intent to use the groupon. However, once we arrived, we were informed that they had lunch buffet. We agreed that it is a better value, since the entrees on the menu were highly priced (around $15-20 each) for lunch. The buffet was ok, not many varieties, but greasy. I was seriously full for the rest of the day without addition in take of calories.",0.4118,0.882,0.091,0.027,0.5233333333333333
2011-03-02,4.0,"We live close by, but for some reason it took us months to finally come by and redeem our Groupon.  When we did, we were extremely surprised with how wonderful it was given some of the mediocre yelp reviews.  I thought the atmosphere was cute and lively, given that the place in such an odd location. We did the veggie samosas as an appetizer.  These were huge and very tasty!  For the meal, we shared palak paneer and bombay aloo with rice and garlic naan.  Everything was delicious, and the garlic naan was some of the best I have ever tried.  We had a bottle of pinot noir with dinner as well.  The bill came to around $70 which seemed reasonable, but with our groupon we left feeling like we had robbed the place.  Will definitely be back.  Sure, I love going up to Devon once in awhile, but when I am not in the mood for that trek I will be heading to Klay Oven.",0.9945,0.722,0.263,0.015,0.6243827160493828
2011-01-28,1.0,"It's like walking into someone's home.  The atmosphere is decorated with warm, earthy tones, there are booths with colorfully beaded pillows, and elegant curtains.  Both the host and waiter were very friendly. I also noticed this was the only Indian restaurant I've been to where they have their own cocktail list.  A mojito with my naan and chicken?  Sure! So it comes down to value of the meal and quality of food here.  I really wanted to like it more.   But sharing a combo appetizer (all of the offerings were battered and fried - the veggie hash, potato, shrimp, and chicken - with the exception of the samosa), ordering the chicken jalfrezie, naan, a drink and tacking on tax and tip totaled a whopping $40 for myself alone!   The $14 chicken entree was meager in portion size and a little heavy on the peppers and onions.  I wouldn't order this again, as it was salty and otherwise had little flavor.  The naan was okay, but I would have liked it to be more doughy. Easy street parking on Hubbard.  +100 on Opentable.",0.9592,0.859,0.133,0.008,0.7027777777777777
2011-01-25,1.0,"I went there for lunch, therefore the food was terrible. I think it is better if you order the food ( I think) but having a bad food during lunch, would prevent me to go back for dinner. lol",-0.25,0.681,0.16,0.16,0.5733333333333333
2010-12-10,2.0,"We tried this restaurant last week. We used a Groupon.  We arrived for dinner and there were approximately 3-4 other diners.  We kindly asked if it were possible to sit at one of the numerous open booths versus their offering of a tiny inner table. We were told they cannot accommodate this request because we did not make reservations.  Our meal took over 1 hour and the food was descent. There was a black hair in the green sauce, but the waiter didn't seem to care. Their were several waiters/staff but the service was marginal in quality. Afterwards we inquired about the reason we again were not seated at a booth when there was still a plethora of booths open? We were told by the waiter that this is their ""policy.""  We figured we should have placed a call for reservations, standing ""outside"" the restaurant therefore the have better seating options. On the way out I again asked the owner if this was his policy about reservations and seating.  The owner indicated it was not. I was dining with my friend who is African American. I asked if this was a possible factor in refusing to seat us in a more comfortable location? The owner said that it was not; however, not sure about the waiter's position on the matter.  I would call for booth reservations, even if you are standing outside their front door.  Otherwise, maybe use your Groupon during the lunch hour. It may work out better.",0.939,0.885,0.088,0.027,0.44045893719806767
2010-12-02,4.0,"I work right by the Klay Oven, and while I haven't participated in the buffet during lunch hours (prob not a good idea for the tum-tum), I did order myself some soup and naan. If you order online, this will only cost you $7.28. There are 3 soups offered(chicken based, tomato based, and a vegetable one) I opted for the regular naan $4, because garlic was $5. Hey, I'm not gonna put down $10 for lunch, yo. If I wanna do THAT, I'd go to ""Au Bon Pain in my wallet""! Anyways, the soup runs $5, so the 18% discount online is a great deal! I had the chicken soup(Mulligatawny) which was reallly good, and it had a good amount of spice* to it. It was served in a 7 ounce or 8 ounce cup, which is more reasonable than most soup places. The order of naan was huge! And it was nice and hot, most importantly.  *They didn't give me napkins which didn't aid me in my, ""oh man this is spicy let me wipe my nose"" routine. :( There was also no spoon, so I had to request that (which took 4 minutes). Who knows why... But, simply put: This lunch was perfect and I will totally do it again.",0.412,0.852,0.072,0.076,0.6837461480318623
2010-11-30,4.0,"My folks were in town over the Thanksgiving holiday and mentioned wanting to go out for Indian food. I initially thought of taking them to Devon but remembered that I had a Groupon for Klay Oven.  From the start I was impressed. After reading the Yelp reviews, I expected slow service and mediocre food. Not so! Maybe it was because the staff knew I had a Groupon or maybe they stepped up their game. Either way, everything was on point.  Our service was fast and very friendly. We were trying to decide on meat or veggie samosas. The appetizer offers two pieces and we did not want four (two veggie, two meat) since there were only three of us. Our server kindly offered to bring us three of our choice. Very nice!  I had the palak paneer (good but not spicy enough), Mom had the Chicken Tikka Masala (very tasty, smoky flavor and spicy) and Dad had the Quail--I think also in a Masala sauce (had an heavy sauce that overpowered the taste of the meat--Dad said it could have been chicken, lamb, beef, etc., the sauce made it impossible to taste the meat).  We also ordered a bottle of wine that was well presented and a basket of Naan that was hot and fresh.  I loved the dark atmosphere. What a lovely place to have a date. I will put it on my list for such an occasion.  Overall, I was very impressed and surprised. I would recommend Klay Oven for a downtown option in Indian cuisine.",0.9935,0.827,0.168,0.005,0.6375000000000001
2010-11-23,4.0,"Very solid Indian food. We'd ordered delivery from Klay Oven before, but for Mister's birthday we decided to head out to the actual restaurant (which happens to be within walking distance almost directly between our places of work). The restaurant was cute, though the decor wasn't as awesome as my current fave. We got the vegetarian appetizer platter to start, which was good. I really loved the samosa, though it was not exactly to Mister's taste. (For him, samosa can really make or break an Indian restaurant.) The water guy was extremely attentive (I had only had two sips and he refilled! XD) until we actually got our food, and then curiously disappeared, which was sort of annoying. I got chana masala, which was pretty standard (if a bit spicy), and Mister requested a vegetable korma, which was very good. The Naan was pretty fantastic. I would definitely consider going to Klay Oven again if I didn't very slightly prefer another place about the same distance from my work.",0.9853,0.747,0.2,0.054,0.5783333333333333
2010-11-10,2.0,"I've been here a dozen time during lunch buffets since its the only Indian restaurant around my work. Lunch is around $12 (w tips + tax included) - its a good deal with lots of variety. Foolish me decided to give this place a try for dinner. Here's what we got: Matar Aloo Samosa (2pcs)- It was BIG but I can care less because it was not good. The dough wrapper was hard as rock and way too thick. It was not fluffy or tasty. The filling was too dry and the flavor was very dull. I ordered this because of the beautifully worded description ""mango seasoning"" - yea, FAIL. What mango? There's not even mango poo in sight or taste... not that I know what mango poo taste like. Naan- Nice and hot. It was the norm.  Rice - Good texture, perfectly cooked but just warm. Murg Saag- Sigh. The sauce was super dried and it was lacking probably 100 spices/ingredients. Like the Samosa- it was very flat and the taste was very single note. Its a disappointment.  Lamb Curry- My bf got this and the curry itself was good but the lamb was beyond dry. I suspect that it was leftover from lunch or last night and was re-grilled then dumped into the sauce.  Indian Beer- Light. Decent. Overall- I would come back for lunch only. It was definitely not worth $60.",0.9808,0.721,0.186,0.093,0.5233678955453148
2010-11-03,4.0,"We recently went on an Indian kick and in less than a week at here and at India House.  I'm giving both 4 stars, but push come to shove, we're going to come back to Klay Oven rather than India House. Pros: Great food- the Naan was delicious, the palak here was better than the one at India House and overall, I felt the food here was a little bit better. Cons: Impersonal/slow service.  I certainly don't expect my server to fawn over me, but the service was seriously slow.  Sure the water glasses were kept full, but it took an eternity to get our leftovers boxed up and our check dealt with. So, as long as you've got some extra time, Klay Oven is pretty darn good.",0.9875,0.757,0.23,0.014,0.4751167133520075
2010-10-22,2.0,"We'd been dying to try this place out and use our Groupon. But were discouraged because every time we tried to make a reservation on Open Table, we found that there was no availability in the next 3 hrs. I gave up and called Klay Oven and got a reservation a half an hour later. We were literally the only people in the restaurant. When we entered the restaurant they seemed unprepared and treated us like we showed up early. Something is off there. We started with the garlic naan, chili paratha naan, and paneer paratha naan. The garlic was a bit too strong, the chili paratha was so hot my nose ran, and the paneer paratha felt like a cheap, spicy french bread pizza. While our water glasses were always filled, the service seemed impersonal. I didn't feel our business was valued, despite being the only patrons there. We can't be the only ones, I watched a lunch patron come in and complain about their order. The portions are much smaller than their competitors.  My boyfriend's Chooza Tikka Masala was sort of bland.  And my Matar Paneer do Piaza was simply ok. I can't see myself returning here again. This place can't compete with India House or Gaylord's. Never mind Devon Street.... Sorry Klay Oven. I can't help wondering if this is a place that strictly caters to the lunch crowd and simply coasts at night.",0.2828,0.889,0.056,0.055,0.5744708994708996
2010-10-20,3.0,"The food was pretty good, however the service is very standoffish to the point of being weird and unfriendly. We have an issue with our groupon this day and was told by management in a blunt way, ""take it up with them."" Ok, but won't go out of my way to make it back here.",0.3716,0.848,0.098,0.054,0.5666666666666668
2010-10-19,4.0,"After reading reviews on Yelp decided to give it a try. We visited it on Sunday afternoon.Luckily when we arrived they were having 'Karma Kitchen'. The waitress explained this unique concept. In Karma Kitchen the guests are given zero dollar cheque at the end of meal. So one would wonder who pays for the bill. The person who just ate before us gave some donation in according to his understanding, like this the cycle continues. We could not try much since during this Karma Kitcen they just have only option of food which is Thali.Thali basically has small quantities of Vegetarian Items. We started off with Mango Lassi which was good.Thali has Lentils,Aloo Matter(Green Peas cooked with Potatoes),Chick Peas,Rice,Tandorri Roti(Bread),Curd and Salad.Food is foloowed by Masala Chat(Tea) and Kheer(Sweet Dessert).Everything was very tasty.Would definately stop by again to try some regular menu food items. Note: Karma Kitchen happens on one Sunday of every month for 3 hours.",0.0094,0.969,0.016,0.016,0.49615384615384617
2010-10-18,3.0,"Bought a groupon for this place and overall it was good, we went to the downtown location.  2 stars taken off though for sloooooww service, we were there over 2 hours!  Which I get, it's date night so you shouldn't have to rush, but it took 20 minutes before our waiter came over, a long wait for food, and then our dessert took over 40 min to get to our table - then we had to wait even longer for our check.  IMO that's too long.   The things we did like though:  It felt like we were visiting someone's home and not sitting in a restaurant, loved the decor and intimate setting.  The food was great, LOVE nan.   Although... it was probably just as good as other places...  The mango cheesecake was good, but since there was a mix up they had taken it from the freezer and placed it in the microwave so half of it was frozen and the other half was warm.  Not so great, especially since we waited 40 min for it.   and I think there was only 1 waiter for the entire restaurant with several bussers running around filling our drinks, clearing our plates, serving our food - we saw our waiter 2, maybe 3 times all night.   Gosh, maybe I should give this 2 stars!  hmmm..",0.993,0.823,0.177,0.0,0.5204166666666666
2010-10-09,4.0,"Great vegetable curry, tasty tandoori chicken, perfect garlic naan. This is still my go to Indian restaurant for me and my husband( who is Indian). Love this place!",0.923,0.67,0.33,0.0,0.8250000000000001
2010-10-06,5.0,"this is one of my favorite indian restaurants! the food is great, the ambience is romantic, sanitation excellent, and service is good. above all...i think the price is reasonable for the decor!",0.9515,0.614,0.386,0.0,0.65
2010-10-06,2.0,"We ordered using the recent Groupon.  I am glad we had the Groupon discount because the regular prices are high, especially for average quality food.  We had the boti kabab and lamb biryani.  the boti kabab was very good, but it was about 7 pieces of lamb for $18?  and the guy seemed upset that we were using a Groupon (why offer then?), he refused to accept my credit card for the $4 in tax.  I would say I will only order Boti Kabab or buffet there, and only if I get a 50% discount.",0.6195,0.824,0.113,0.062,0.6718803418803418
2010-09-18,4.0,"Lunch Buffet is a good value... Pretty damn good. Trademark heat of indian food prepared as good as or even better some of the better Indian places I've eaten. I don't pretend to know ""authentic"" or ""great"" Indian food, but this place gets the job done right. Good service = +1 star",0.909,0.659,0.309,0.031,0.6435714285714287
2010-08-13,5.0,"I see that someone gave it three stars but said the food was excellent. I give Klay Oven an enthusiastic 5 stars!  Co worker and I have been doing the Indian Lunch buffets once a week for the last 6 weeks.  This was the most recent place and it was so good I was compelled to get on yelp, which I do once in a blue moon to write a review. Out of the 5 places I visited in the last 6 weeks, Klay Oven is the only place where I made 4 trips to the buffet.   4 trips.  The Chicken Tikka Masala was splendid as was the Daal Makanni (sp?).  The Tandoori chicken was very moist (and we caught the tail end of the buffet!). The service was excellent.  There was a host that helped us at the buffet when we had questions about a dish that you were to make on your own.  The bus team even came up to us to tell us that if we were going to make another trip to the buffet, that we had five minutes before they started tearing down.   After going to numerous Indian restaurants in the last month, I have finally found the Indian Restaurant to take my wife to the next time we are  downtown together.",0.9834,0.877,0.123,0.0,0.5769444444444445
2010-06-21,3.0,"Not the best Indian restaurant you can have in Chicago ... but if you are working in one of those river-side/ lake-side offices - this is easy access. The food is excellent - the service isn't., and the pricing (presumably for its location) is a bit steep. I'd rather opt for the lunch buffet which is money well spent.",0.9343,0.786,0.214,0.0,0.5583333333333333
