date,star,text,compound,neutral,positive,negative,subjectivity
2010-06-20,3.0,"This is an awkward 3 stars.  The food is pretty excellent.  Their samosas (both meat and vegetable) are fantastic, just the right crispiness and flavor inside.  Their chicken tikka masala is equally great, being extremely well spiced and well cooked.  The naan is solid.  On food quality alone, I would eat here in a heartbeat. Unfortunately, the service and the prices are terrible.  4 people getting two appetizers, four beverages and four entrees should not be able to amass a $120 check.  But that's what happens when standard indian food entrees are priced at $14-20 each.  Also, we sat eating spicy food without getting water refills for the entire meal.  The experience as a whole was tasty but left me bitter and spiteful.",-0.2748,0.787,0.106,0.107,0.6697478991596639
2010-06-16,5.0,"I only had the Samosas and Aloo Tikki, but holy moly! So awesome. They have a cheap lunch buffet which I might try next time, but the samosas are enormous! You get 2 in the appetizer with a side of mango chutney and cilantro chutney (and yoghurt  I think). Just to size the samosas, hold up your hand and make a fist. The samosas are as big or bigger than that and two of those are only $5! Definitely go here when you want indian food. So yummy and great prices!",0.9844,0.738,0.262,0.0,0.645
2010-06-16,2.0,"I stopped in for a Friday lunch and got the buffet. Dangerous, I know. But the husband came out to join me and I decided I was willing to risk the food coma.  Not a ton of vegetarian options, and they were out of samosas?! My old standby, palak paneer, was merely okay. I did like that they had a make-your-own papri chaat station, although it was served cold which is I guess the traditional preparation.  We had to wait for the check for while, which is pretty much the only way to screw up service at a buffet.  The price (around $15 with tax) was steep for me, as I usually spend $5 on lunch. They have a punch card deal where you get a free lunch after so many visits. I skipped it since I can't fathom eating here enough to make it worthwhile.",0.807,0.833,0.109,0.059,0.59
2010-05-01,1.0,"I assume one of the owners or management staff was very kind and sent me an apologetic email for my experience there and offered to extend, what I can only assume, a token of apology. I appreciate that type of follow up. I guess I was wrong about their customer service. Will update again pending re-visit! UPDATE: The manager/owner who asked for my address to send some sort of consolation gift never followed through. I emailed him again to find out what he was talking about exactly asking for my personal home address and no response. Perhaps he hasn't checked it, but it's over 1 month now. This just attests to poor form, I like the business saavy-thought though ""Oh I'm sorry, let me send you a token of appreciation and feel free to re-write your review so our establishment doesn't look so bad."" Well ya know what? This goes to show that it's utter crap! Have fun feeding your customers watered-down indian food (make sure you fill their water glasses every 10 seconds during buffet time so they eat less and you profit more) and don't forget your secret ingredient-- more bits of brillo pad, the department of health would really love to hear about that, I'm sure.  As I said before,  ""Never been back. Friends have never been back. Never suggested it to anyone. Better food, service, and ambiance at another Indian restaurant not so far away. """,0.9916,0.755,0.199,0.046,0.6157004830917874
2010-04-24,5.0,"I had the pleasure of going to the Klay Oven during luch one day.  Their luch buffet was wonderful, I really enjoyed it.  They have a really good variety of different dishes.  Loved it!",0.9606,0.586,0.414,0.0,0.74
2010-03-13,2.0,I brought a friend from out of town to this restaurant. I had heard good reviews and was excited about coming. The service was rude and the food came out cold. I was embarassed and will not be going here again.,0.6705,0.742,0.191,0.067,0.7375
2010-02-10,4.0,"This review is for their lunch buffet.  No clue about the dinner menu... Do you like Indian food w/o the over-powering, sweat inducing, tear-jerking, stomache-cramping, firey-bathroom-trips?  if you do, check out their lunch buffet.  A decent selection of lamb, chicken, vegetable dishes, tandoori chicken, yogurt, salad, rice pudding awaits you.  I had the chicken, lamb, tandoori chicken and all were very tasty with a little bit of ""zing!"" to them.  Not a lot, just a little bit.  IMHO and I'm not a spicy food eater. Restaurant was very clean, the wait staff was attentive without being intruding.  Best part is that afterwards, when you're home/back in the office, you don't stink like the thousand spices that were used to cook the food.   So yeah, go here for their lunch buffet.   If you're a hardcore spicy food lover, the lunch boofay is not for you.",0.8902,0.844,0.12,0.037,0.7160606060606061
2010-02-10,3.0,"For a restaurant, this is more like three stars.  For a buffet, it's a four star.   I happened to be off of work one day and my Mr. was craving Indian.  So I swooped downtown to pick him and a couple friends up and we headed over to Klay Oven.   The buffet was plentiful and the options were good ones.  Everything was fresh and delicious.  We are the hawks that eye the buffet and when fresh things comes we SWOOOOOOP in and grab them up.   We're buffet professionals.   The water glasses were always full and the dirty plates were wisked away swiftly.  Always appreciated.   Parking is kind of a pain down there and since when I eat Indian food, I generally do not prefer buffets... but I suppose I'd try it again.",0.7935,0.851,0.116,0.032,0.5671717171717172
2010-01-25,5.0,"Time and again, Klay Oven delivers above and beyond my expectations. Had the pleasure of dining here for the third time last weekend and was as impressed as ever. I brought my girlfriend who had never tried Indian food and she instantly fell in love with it. The tiger prawns and seafood offerings here are above and beyond any other Indian establishment in the city of Chicago. I first dined here about 3 years ago and have tried other places... none match up to Klay Oven - especially the lackluster, overpriced India House located nearby.  What to try: samosas are good, mila jhula appetizer plate, good vindaloos, any seafood dish, tandoori mixed grill, channa masala, and gulab jamun for dessert. This is just what I've tried; I'm sure the rest of the menu is always appetizing.  Klay Oven also offers ambiance unmatched by any other Indian establishment in the city. The dimly lit, elegant inside is a perfect place for a date or to take clients for work.  Highly recommended! Will return for dinner and hope to also try the buffet.",0.9832,0.835,0.159,0.007,0.49866161616161614
2009-12-17,3.0,"Pretty tasty, and close to the office. Not the  best samosas I've had, but definitely decent Indian food. The decor is cool, they get a good crowd and the servers are fine. When I say fine, I mean that they'll ask you if you're having the buffet three times after you ordered a huge plate of apps and refill your water four times in an hour. But, hey, I get it, they think it's not enough food for two. Yay! Luckily for me and Rachel G. it was more than enough. And I'll be back for the buffet soon.",0.9845,0.726,0.274,0.0,0.5812499999999999
2009-11-17,2.0,I basically firstly judge indian by its vindaloo.  This is for that.  It was ok spiciness and flavor but the sauce was very ketchup like and not very complex.  I won't be back but would eat there if someone else is paying.  I'm sure everything else is very good.  I usually like to say a place I'd rather go when I give a weak review but haven't found anything in Chicago.  I liked marigold but its very trendy and more indian fusion also good not great so apples and oranges.,0.942,0.695,0.227,0.078,0.5453510378510379
2009-11-16,3.0,"I haven't had Indian food in a very long time, so my friend decided to take me here for lunch. We went about 12:30 and got seated right away. The thing that bothered me, which isn't a huge deal but kind of annoying, was we had soemone to seat us, someone to ask what we wanted to drink, someone to take our order, someone to pour our water, someone to give us our check and then another person to bring back the check....ummm can we say confusing! I had forgotten who our waiter was by then! The food was pretty good. My friend and I got the appetizer dish Mila Jhula (which is a combo of 5 dishes) and the garlic nan bread. The bread was out of this world good. I am drooling just thinking about it now! The Keema Samosa was really good too, but the Murg Pakora chicken was rubbery and not tasty at all! I think our waiter was mad that we didn't get the lunch buffet (he only asked us 3 times if we wanted it)...but we might next time. I have to take baby steps here! Overall I had a good experience and would go back. The fish pond is neat and the atmosphere is nice, but the smell of the curry and other spices got to me after awhile. I guess I am just not that used to it! Remember...baby steps!",0.9732,0.801,0.137,0.062,0.5940357142857142
2009-10-03,2.0,"Okay okay. This was my first experience with real Indian food. My friend likes Indian food so I thought that I should give it a try. I go the school at the Merchandise Mart so this was the closest and only Indian restaurant that I knew of in the area. I love the inside of the place. It's dimly lit, good for a date. I didn't like where the bar was located. I'm not sure why I just think it looks sort of goofy being at the entrance. On to the food!! I ordered the Nawabi Biryani (Bismati rice palif with chicken) It was good, but it was too dry for my liking. I also got the nan and I ate that with the green sauce that came with those crackers with the seeds on them. I have no idea what it was, but it was spicy and I liked it.  Since I went on a Thursday they have $4.00 Mango Margaritas. Those were good, but too strong. Tone it down on the tequila fellas.  The service was good. Our waiter looked like he owned the place so obviously he was knowledgeable on the items on the menu. My favorite part? The fish pond at the entrance! Nice! I'll give this place another try, only because it was my first time and I had no idea what to expect.",0.984,0.785,0.169,0.046,0.6469907407407408
2009-10-02,2.0,"The fish pond IS cool, I'll give them that, but everything else was lackluster.   I ordered online and was told my food would be ready at 11:45, had to wait around til 12.  Also, the online prices don't match the actual prices.  Although this was quickly fixed, it's something they should keep up on.  It's no fun to be faced with a higher bill than you were expecting.   The food was just ok.  Not excellent, not bad, and sorta bland when I was craving spice.  Also, my food didn't even come with plain rice which is a little weird.  I'm used to paying extra for naan or biryani, but not plain rice! I don't think I'll come here again.  Unfortunately, my search for good indian food that's available within a typical Loop lunch hour, continues. Somebody, please, make thali's to go for downtown!",0.9714,0.778,0.175,0.046,0.5244360902255638
2009-09-17,3.0,"Klay Oven manages to avoid two of the most common faults of a traditional Indian restaurant by offering an upscale dining environment and professional service.  Dimly lit, immaculately decorated, and retaining the exposed wooden ceilings of an old warehouse, the Klay Oven is eminently suited for a business dinner or a romantic date.   On my visit I sampled a variety of dishes.  The standouts were the Mulligatawny soup, the Rogan Josh (lamb curry) and the Gulab Jamun (milk based balls served in a caramelized sugar syrup).  The chicken masala and naan were average.  I would steer clear of the Masala Shrimp appetizer.  The menu advertised it as stir fried seasoned shrimps in wine sauce but they tasted like boiled shrimp doused in a creamy sweet sauce. The food served at the Klay Oven was a little blander than at a typical Indian restaurant probably because they cater more to a western clientele.  There were no Indians dining at the restaurant.  For a traditional Indian dinner I would stick to the restaurants on Devon.  However, to impress business clients, the Klay Oven would be my Indian restaurant of choice.",0.8406,0.881,0.078,0.041,0.44074074074074077
2009-09-05,4.0,"I went to Klay Oven on Thursday night and was pleasantly surprised.  When I walked in, I was worried I might be a touch under-dressed in a polo, jeans, and gym shoes; however, I feel like it's one of those places that gets an interesting cross-section of visitors. I asked the server which dish was most comparable to a traditional Chicken Curry and he recommended the Bhuna Chicken.  I also ordered the garlic naan and a half order of basmati rice based on previous reviewers' recommendations. When the food arrived, it was brought out on a rolling tray (a nice touch).  The portions were actually quite generous based on previous Indian restaurants I had visited.  The Bhuna Chicken was delicious -- as was the basmati rice and garlic naan. When evaluating any Indian restaurant, I put it up against Indian Grill in Lincoln Park and Veerasway on Randolph.  Klay Oven is right up there with those two. Ambiance-wise, I would actually recommend this place for a date, as the light is very low and it's very quiet.  But, obviously, with any Indian restaurant, make sure your date is up for that type of food. My only disappointment was that it was somewhat pricey.  My meal was $26-$27 including tip.  Compare that to $20 at Indian Grill.",0.9517,0.843,0.121,0.036,0.5930880230880232
2009-08-31,4.0,"We have a handful of places we order carryout from, and this is definitely one of them. He likes the murg korma and I like the wide variety of vegetarian dishes.",0.7906,0.765,0.235,0.0,0.45
2009-08-26,5.0,My visit to Klay Oven was fantastic! Ambiance and decor are wonderful.  I was at a casual dinner with two girlfriends and we all remarked that it was the classiest get together we've had. Service was fantastic.  Waiter was attentive and other servers were quick to notice empty water glasses.  As soon as we sat down we were served crackers with two sauces.  I know this is common in Indian restaurants and I'm embarrassed I don't know what they are called. We ordered all vegetarian fare.  The samosas were excellent and large. We ordered two entrees and an order of nan as well.  We had the Bhindi Masala  and Dal Makhani.  Both fantastic.  I wanted to eat the bhindi masala and that okra all day!  There was plenty of food for the three of us although I think some rice would have been a yummy addition to the flavors. Our bill was also very reasonable around $30. I can't wait to visit their lunch buffet!,0.9722,0.827,0.148,0.024,0.7027947845804988
2009-07-09,5.0,"ahhh...I think this place is under-rated.  It is such a gem. You can go there all dressed up but the people and the place make you feel so at home...It was only my second time dining out for Indian food...and I have to say it was soooooooooo yummy. I am vegetarian and definitely found many dishes that were just delightful...I can't remember the names...I know there was this little hot pocket type of dish that was scrumptious...and so were the lentils...oh and this rice stuff with melted cheese...yummy! The staff is very sweet and the beer hit the spot. Next time, I'm in Chicago...I'll be sure to hit up this place once again.",0.9504,0.87,0.13,0.0,0.5583888888888889
2009-07-06,5.0,"I've found this place to be very consistent in my years in Chicago, both for dinner and for the buffet. The restaurant is a nice environment -- I also like the professionalism of the staff enough to book them for my wedding. Very responsive to our needs.",0.796,0.838,0.162,0.0,0.53125
2009-07-02,4.0,"Pretty good.  I've been here several times, and always for their lunch buffet (although a few years ago I did come once for dinner).   Most recently, I came here with several co-workers, one of whom is Indian and she commented that they serve mostly northern Indian cuisine, which is not as spicy as the southern variety.   The lunch buffet selection is good.  Not as huge as India Garden, but still sufficient.  What I really enjoy is that even though it is a buffet and the food is mass produced, it still is very tasty, and the meat in the curries is very very tender.   Unfortunately, they don't have fish curry, so that is the only drawback.  Otherwise, if you're looking for great, quick lunch, this is the place. You get in, grab a plate, order a kingfisher if you want, and stuff yourself full, then go home and take a long nap.  Then you wake up with a tummy from all the rich food, which gives you an excuse to go to the gym before dinner.   I should also mention that their lunch buffet is $11.95 per person.",0.9634,0.85,0.131,0.02,0.48363636363636375
2009-06-16,4.0,"Yes.  Def a yes.  It's a little more intimate than India House and the lobby has a fish pond, so how cool is THAT?  2 stars just for the fish, babies. The lunch buffet is a tad on the small side, but they make up for it in quality.  The tandoori anything is excellent here, and the waiters are very sweet and didn't even kick me out when I spilled my water. The seating is varied, with sections separated by curtains, which I found a nice touch.  Made me think I was dining in a caravan in the desert, surrounded by doe-eyed boy slaves and... Oops, did I type that out loud? MOVING ON, the dishes are spiced well, a tad on the tame side, but very tasty, and the place is always clean and inviting.   Pricing is decent and good seating is usually available at short notice.",0.985,0.791,0.209,0.0,0.5923958333333333
2009-05-13,4.0,"The lunch buffet is a delight.  Great variety, fresh, hot food.  Staff is courteous.  The only issue is I tend to hit the buffet line one time to many (with regularity) and suffer through the afternoon...but's that's my issue... If you have a friend who says they don't like Indian food because they've never tried Indian food, the buffet variety is a great place to break them in.",0.9459,0.679,0.253,0.068,0.7642857142857142
2009-05-03,1.0,"HORRIBLE experience - never going back.  The nice decor & memorable name (clay w/ a K) do not live up to what you would expect. We had absolutely horrible service throughout the entire dinner.  Took them too long to do everything (e.g., 20 min before anyone came for us to order drinks, another 30 min before we got our drinks, etc.).  Then I ordered dessert (was really looking forward to some Indian rice pudding), but it took me asking them 20 min later if they were bringing it out for them to tell me that actually they don't have any left (then why the heck did you let me order it in the first place?!?).  Then it took them another 20 min to bring the check when we were one of the few tables left in the restaurant. The drinks weren't good (don't get the mango margarita).  The food was okay (the aloo tiki and raita were good, the chicken dish we got was not good). Overall I was very disappointed & I'm not going back.",-0.934,0.892,0.018,0.09,0.45579710144927527
2009-04-29,3.0,"Ate at the lunch buffet, which will set you back $11. Pretty good price for an all-you-can-eat in River North. The selection is sizable and includes 2 types of curry, dal makhani, chicken tandoori, some potato appetizers, and dessert (rice pudding and gulab jamun). During lunch, the waiter service consists of refilling your water glass; it's all about the food, so that's what I'll be reviewing. Honestly, I thought the entrees were just ok. Not as flavorful as India House, but good nonetheless. The chicken tandoori was a bit dry and not very spicy. My favorite dish would have to be the potatoes, which were more spicy than any of the meat dishes. I was ready to write this place off as a total loss until I tried the desserts. The rice pudding was excellent and the gulab jamun was even better. It was miles above India House's offerings. I would probably come back for the lunch buffet, but not very often. While the desserts made an impression, the rest of the food was slightly above average.",0.9787,0.827,0.158,0.015,0.5499999999999999
2009-04-20,4.0,"Went on a Friday for All You Can Eat Lunch Buffet.  Went to taste same at India House the previous Wednesday for comparison. Klay Oven:  Very Reasonable but little variety; Overall Tasty; Tandoori chicken really good; rice did not seem to be high quality basmati and was a tad sticky; very nice and attentive wait staff; felt at home. India House:  Pricey but more variety; Overall Tasty; some dishes a tad watery; basmati rice high quality, perfectly cooked and fresh; Tandoori Chicken served separate from buffet had great presentation but not as tasty as Klay Oven; DO NOT arrive ""late"" for buffet as they frown on this and as a result service may be less than friendly.  Mostly I felt rushed and like my patronage was unwanted even though the place was practically empty.  (I showed up 20 minutes before 2:30 pm which is when they shut the buffet down) I give each of them 4 stars.  The differences balance these places out. Granted I have never been to India and don't know what ""authentic"" tastes like but I do love, love, love me some good tasting food.  The black bean dish at Klay Oven was really tasty. (sorry can't remember name).  Loved the chicken tikki Masala (not sure if this is what they called it but it was similar to this) and the mushroom vegetable dish (again sorry I don't remember the name).",0.9954,0.745,0.218,0.037,0.5855401234567901
2009-03-23,5.0,"I couldn't decide between 4 and 5 so i just gave them 5.  Klay Oven is very, very tasty.  I like the booths on the wall in the second room, they are romantic.   I love indian food and they do it well and the meat is good quality and just the right spicy and i love the servers in their suits.  And I love the Chutneys here too.  Mmmmm Mmmmm Mmmmmm. Its a little pricey for me because I am poor, but It is worth it for sure.",0.9374,0.751,0.226,0.023,0.49288359788359787
2009-03-08,4.0,"I think maybe my reviews are biased because of the company I keep while visiting establishments.  After dinner, my date filled in the comment card given to him in the check folder and we agreed that all squares be checked ""excellent.""  Food, ambiance, service.  mmmm yep...all excellent. Fair?  I'm not sure.  I had a great time and I love food, and most especially of all foods I love bread.  The garlic nan here was superb.  What's better than bread with garlic? Foodwise? Nan wise?  Bias again sways me. The garlic nan is what I remember most savorly. Any form of bread flavoured with garlic is a safe bet for me.   The food was excellent, had to be. That's what we agreed to and I'm no liar.  We enjoyed simosa, masala and Palak Paneer. The service truly was excellent.  We were checked upon frequently and by, if I remember correctly, five different staff members.  All were finely dressed, perfectly polite and eager to please.   I finished my meal with a cup of mellow spiced tea with milk and a cute smile from the hostess.  The bathrooms were a walk away.  You go upstairs, down an awkwardly turning hallway and then into bathrooms that were decorated in the 80's.  No cash spent here.  But....and I must make note of this...there was hot water to wash hands with.  Thank you.",0.9929,0.693,0.237,0.07,0.7134920634920635
2009-03-06,3.0,"Been wanting to try this restaurant for a while now because it's supposed to be punjabi food (northern indian). But the place failed to really impress - If I lived a block or two away, I might go more, but nothing that will pull me here all the way from Streeterville when there's India House on the way! Their veg biryani and raita were good, but their dal makhni was a little too watery and their samosa was undercooked. In general, the food was on the bland side, almost as if catering to a non-Indian, American clientele. The music was not Indian either - it was lounge-ish. The service was okay - not rude but not stellar either.  I'm not sure why I should go all the way here when there are the options of Gaylord's, India House and Jaipur around! And if they are a tandoori/north indian/punjabi restaurant, they didn't even have paneer tikka!?",0.7814,0.879,0.079,0.042,0.4726851851851852
2009-02-24,3.0,"The food... good, almost great.  The service... mediocre at best.",0.8981,0.391,0.609,0.0,0.6625
2009-02-23,5.0,"I went to the lunch buffet last week, and I was pleasantly surprised.  The restaurant was filled with tables of Indians, which is always a good sign in an Indian restaurant. Even though we went at 1:30, everything in the buffet was hot, and nothing was soggy.  The lamb curry was perfect, and there was a vegetable dish with green beans that was so good.  Those were the best green beans I have ever had. Writing this review is really making me want to go back today, but I think I have to wait until later this week.",0.8635,0.86,0.14,0.0,0.46282051282051284
