date,star,text,compound,neutral,positive,negative,subjectivity
2009-02-22,3.0,"It was Saturday at noon when we decided to venture out for some Indian.  My husband and I enjoy India House, but we live really close to Klay Oven and decided to give it a shot.   When we arrived there was one other couple there.  That's usually never a good sign for a lunch buffet.  Just as I had expected, the food was warm at best.  I believe the buffet starts at 11 and it seemed like this was the first batch of food that had now been sitting out for over an hour without much heating.  All of the dishes have lids that hang over them, but nothing that goes directly over the food to keep it warm.  The small burner that is supposed to keep each dish warm is so far from the bottom of the dish - it would be impossible to heat it.  Too, the restaurant didn't seem to be very well heated so that may have also contributed to the cold food.   The flavor of each of the dishes was very good.  It's just a shame that it wasn't hot.  Labels for each of the dishes would be helpful as well.  I overheard several people asking which dish was which.  The selection of buffet was a lot smaller than the India House buffet, but the price tag was a lot smaller too.   I think we will give it another shot, but we will probably order off the menu next time.  The restaurant did have three other groups come in while we were dining, but never really had a crowd.  I doubt there would be a lot of food turnover - so I definitely wouldn't recommend going near the closing of the buffet.",0.9407,0.836,0.108,0.056,0.479047619047619
2009-02-16,4.0,"We went there with another couple for Valentine's Day.  Not for the hallmark holiday, but because it just happened to be Valentine's Day. The naan was very good.  The Basmati chicken rice was also very tasty, as were the samosas.  My only complaint was the service.  I can't say that this is the way that patrons are always treated.  But we equally saw this service everywhere across the restaurant: customers are kind of ignored.  Once you manage to get seated, you'll have your water glass filled by the hostess/gopher/everythingelse gal, but a man in a suit will take your order, another man will deliver the food, and still others will visit your table to take away your food.  But none of this (besides getting the food itself) actually happened at a regular interval. Asking for something to get wrapped took 20 minutes.  Asking for the check took another 20 minutes.  And we were never asked if we even wanted dessert.  The restaurant does well on its offerings and flavors, but falls way short in terms of the service you'd expect.  It didn't really bother us enough to ruin our night.  Rather, it served more as an amusing diversion.  We would go back, but perhaps we'll try the Oak Park location and save on the parking costs of downtown.  And we'll always go expecting to spend two hours there...whether it's just the two of us, or more.",0.8113,0.877,0.078,0.045,0.4974660633484162
2009-01-18,3.0,"My Indian friend recommended this as one of his favorite Indian spots in the city.  That was good enough for me, so away we went. The food overall was very good.  I started with mulligatawney, which was fine but a bit bland.  Apparently this place is known for its tandoori grill dishes (i.e. the eponymous oven).  So we definitely wanted to get a couple of those.  We shared the apparent: 1.  Bhindi masala (okra and other vegetables with roasted pomegranate seeds):  B.  Somewhat oily, although in general, the food here is not nearly as greasy as most other Indian spots.  This is much better while hot; cooling is not kind to bhindi masala. 2.  Basmati rice:  B.  Rice is rice, but this stuff had its own flavor which added that much more to the meal. 3.  Chooza (chicken) kabab:  A.  Tender and very tasty. 4.  Seekh (lamb) kabab:  A-.  Very, very flavorful, though perhaps a tad too salty. 5.  Garlic naan:  C+.  Good, but garlic taste was a bit stringent. 6.  Keema naan (with ground lamb):  B+. It was a feast. The service experience was unusual.  It's a long story, but the gist is that there were problems with a missed entree and an erroneous bill.  Each time, at first they resisted (seeming to disagree that there was even a problem), then relented and fixed the problem.  At the end, the manager/server comped the entire meal, which was way overboard for the problems that we'd had.  Then my friend and I both felt badly because the restaurant was mostly empty. So the food is worth four stars, but the other aspects tend to lower the rating in my mind.  I would return based just on the food, but would hope for fewer snafus next time.",-0.0763,0.79,0.109,0.101,0.5139814814814815
2009-01-05,4.0,"A group of friends and I hit up Klay Oven after the One of a Kind Show at The Mart last month and it was just as good as I remembered it to be. I hadn't been there since umm the early 90's when I worked around the block from the place.  Unfortunately the place was pretty dead on a Saturday night. Granted it was hella cold outside but still...it was pretty sad. Service was top notch, great selection of wines and the food....OMFG. I asked for my dish to be extra spicy and they definitely delivered. Usually places don't think you can handle the extra heat and will just give you the normal amount of heat but these people did not hold back.  Our server gave us extra rice and naan for our table at no charge and were also very efficient when someone at our table spilled a glass of wine by bumping it with their menu. I swear you can't take some people anywhere.  Yup, I'll be back when I want to get a nice sweat going on...extra spicy please!",0.9735,0.743,0.186,0.071,0.5028985507246376
2009-01-05,3.0,"I used to frequent their lunch buffet quite a few years ago, and for that I'd probably have given 4 stars, but this review is for a recent dinner.   Came here with some friends on break between a matinee and evening theater performance.  Therefore we caught them on the early side.  Extra star for opening a few minutes early because they saw us waiting. The service was pretty slow, but I can write that off to waiting for the kitchen to ramp up for service.  They also missed one of our app's.  The main thing that turned me off this visit is that my chicken was pretty... rubbery.  I think they may have rushed prep of it as it was the last main dish to come out - I picture Indian food stewing all day in delicious spices, just waiting for me to arrive.  Not zapped in the microwave because it has to get out to the table.   The samosas, naan, and other entrees were very good though, so that saved the meal.   Probably overall a two-star experience, but I'll bump it up one because of my previous good experience at the buffet and because they opened early for us.  Being close to Devon now though I don't see myself returning to my old haunt Klay Oven, though.  K.O. k.o.'ed, I guess.",0.9714,0.861,0.112,0.027,0.40704545454545454
2009-01-03,4.0,"I can't believe I haven't written a review of this place!!!   I've gone here several times with my boyfriend for their lunch buffet and this is my favorite Indian buffet in the city!  They have a great chicken tandoori and chicken curry.  Also, the service here is great compared to other Indian restaurants in the city.  I am an absolute fan of this place and will definitely continue to go back.",0.9543,0.778,0.222,0.0,0.6175
2008-12-27,4.0,"The service and atmosphere at this restaurant is great! I've gone twice and both times it was raining but that never dampers my mood to eat at Klay oven.  The restaurant is quiet, even when its half filled with patrons. The mango salad, garlic naan, eggplant dish, talapia dish, and mango/raspberry sorbet are delicious!!! I had a show immediately after dinner and the wait staff was very accommodating at bringing the food quickly so that I would not be late!",0.8679,0.895,0.105,0.0,0.56875
2008-11-02,2.0,"I had the murg (chicken) vindaloo.  The waiter asked which spice level I wanted: mild, medium or hot.  I chose medium.  Apparently in India, ""medium"" means ""nuclear-grade hellfire.""  That stuff was way, way spicy. I did enjoy the garlic flatbread, and when I extricated my chicken chunks from their magma basin, it helped to lessen the intensity.  This is the kind of place where fans of Indian food will probably flip out, but for me, the food was only worth three stars. I deducted another star for the hapless waitstaff.  My table ordered two servings of samosas.  A different waiter delivered one plate to us, and our other plate was dropped at another table.   When our main courses came, they were lined up on the table without placing the proper dish in front of the proper diner.  One brave member of our group smelled each basket of flatbread in an attempt to determine which bread went with which patron. If you go, I recommend taking up smoking for roughly six years beforehand so your taste buds are deadened enough to appreciate the total lack of subtlety in the flavor.  Oh, and have each member of your party sit at a different table so there's a shot at getting the right dish delivered in front of the right person.",0.9239,0.887,0.086,0.027,0.5877164502164502
2008-09-23,3.0,"I thought this place was OK but it was a little pricey for what I got. It does have a really nice ambiance inside though. I'll give it that much. The portion sizes are about right and the staff were very friendly. I got some dish that had lots of veggies in it. The naan was quite tasty but you can't really mess that up. Overall, I wasn't that impressed. It's just average.",0.8886,0.783,0.175,0.042,0.49607142857142855
2008-09-15,4.0,"And I quote ""The best tandoori chicken I've ever had"". YUM. This place is so good. My Indian friends took me here for dinner after hearing good reviews themselves. Prices are a little cheaper than India House. I think their Tandoori grill is much better than India House. I also love that they have takeout. They accidentally threw away our leftovers when we asked to doggy bag it, so they made us whole new dishes! I haven't been here for the buffet, but I'll take everyone's word that its not better than India House, because they have a pretty darn good one. Give this place a try if you like India House, it may or MAY NOT reign over them, but it'll come to a good close second if it doesn't.",0.9874,0.747,0.241,0.011,0.5431818181818181
2008-08-28,4.0,"As the sole Indian represenative of all the girls I work with I decided to take them to Klay Oven for a couple of reasons: 1. The Chicken Makhani (butter chicken) is the 2nd best I have ever eaten 2.Its walking distance from where we work. This place did not disappoint although I don't think their cocktails were as great. We started off with kabobs and then moved to the food. The Dal, eggplant bharta and the chicken were great. The nans were buttery and hot... everything was so yummy. I am normally pretty fussy when it comes to Indian food but this place is soooo good. I do think the prices are slightly expensive but if you go in a big group and order family style it shouldn't be too bad. They also have kulfi which is like an Indian version of Mochi... so good :) I cam away from Klay oven extremely satisfied.. would totally recommend this even to my Indian friends.",0.9906,0.776,0.224,0.0,0.6759259259259258
2008-08-24,4.0,"I am in no way a competent judge, but I think this is pretty tasty. A Indian (and Jain) friend of mine insisted we try it for dinner one night, and as he is pretty critical of Indian food, I figured if he liked it, it would be worth a shot. He's right - it's really quite good. We started with vegetable pakora, which had a nice mix of crisp fried onion and tasty potato. they were light on the peas that sometimes get included (and I like the peas) but they were quite delicious. Their mint/coriander chutney was pretty tasty as well. For entrees, I had my standard measuring stick, the lamb vindaloo. My friend ordered a dry grilled paneer dish, the name of which I don't remember, and we shared some dal makhani. The lamb was very good, tender and flavorful, but light on the potato. I love the potato. Plenty of sauce, which I love to sop up with breads. The vindaloo had excellent heat, which sometimes is missing when the guy ordering is not Indian. I try my best to keep up, and this was just right. The dal was also very good. Not quite as spicy as I would have liked, and with pinto beans. I've never gotten consensus on whether the addition of pintos is accurate, but I want to think it's not. Either way, I prefer the dal without - What I make for myself doesn't have any. I managed to make the dal plenty hot with the addition of some wicked jalapenos that my friend requested. Finally, the paneer was awesome - easily the standout. Skewers of bell pepper, onions, tomatoes, and squash, with big cubes of seasoned and grilled mild cheese, served dry. All wonderful. I'd never had paneer without some kind of sauce, so this was new for me, and I'll have it again, for sure. My only complaint is the price - as with most Indian restaurants, the price spiraled pretty high by the time we ordered a couple different kinds of bread (which might have been overkill, but what the hey) and some basmati rice (which was good - with saffron and peas). Oh - and I didn't see khir on the dessert menu. I love khir...and I can't turn it down...but none in sight! I have heard lunch service is very slow - in fact, the same day I went for dinner, two other coworkers went for lunch, and it took nearly two hours. My experience was nothing like this, but just something to mention.",0.999,0.715,0.255,0.029,0.6281345669580964
2008-08-20,4.0,"Due to the fact that my entire office decided to drive up to Milwaukee and go to the Brewers game without inviting me I decided to stuff my face with all you can eat Indian food.  This was a very good decision!  I've only had Indian food a few times, but this was as good as any.  The Curries were flavorful and the meat was tender.  I'm not sure if there is a better deal in the city for $12.  Be sure to save some room for their rice pudding!",0.8946,0.786,0.15,0.063,0.6157777777777778
2008-08-06,4.0,"This is one of the most wonderful inexpensive downtown lunch spots I've found in 3 years of working in the loop. Today was my 4th visit to their lunch buffet in the past few months and I've found the food to be extremely consistent, delicious, and an excellent value. $12 for all you can eat Indian food at lunch does NOT get much better than this. I highly suggesting arriving around 11:40 to beat the rush. As I've never eaten dinner here and experienced actual ""service"" -- my 4-star rating is solely for the lunch experience.",0.9514,0.84,0.16,0.0,0.5581818181818181
2008-08-02,4.0,"Did brunch after a downtown movie and really enjoyed the buffet. Reasonable price and reasonable food. Parking is, well downtown Chicago; deal with it.  I'm going to try to ordering for pickup after work because the sag paneer and garlic naan sound yummy and I'll try it at least once.",0.8439,0.835,0.165,0.0,0.5399999999999999
2008-07-30,3.0,"I had to rethink what I was going to write about Klay Oven after I went to India House. Klay Oven has great food, don't get me wrong. They are friendly and reasonably priced. I guess I just have to say that ""it's average."" Did not totally impress me, and the location is out of the way for a lot of people.",0.8037,0.806,0.153,0.041,0.65
2008-07-02,5.0,"I've ordered in from this place a couple times, and each time it was amazing. Love love LOVE the murg korma and garlic naan...",0.9592,0.526,0.474,0.0,0.675
2008-06-13,4.0,"Awesome.  I've been there for lunch and dinner.  at dinner the owner brings out every meal, went for the buffet lunch today.  it was great 10.95 all you can eat great selection and salad and they had some healthy stuff out there.  the staff is really good at refreshing the buffet.  also the water boy is excellent. My advise TRY THE DESSERT during the lunch buffet BOTH are amazing!",0.9798,0.705,0.295,0.0,0.8125
2008-05-23,4.0,"We finally tried KO for dinner the other night after only having enjoyed their buffet (and that was several years ago when I worked in the area) and going to both the old and new locations of Gaylord and being SOL. I found the food to be excellent, with standouts being the tandoori fish, mustard greens, and lamb vindaloo, which was somehow leaner AND more tender than the same dish at other restaurants.  Also, the Sauvignon Blanc on the wine list pairs really well with the spicier dishes. Last but not least, the younger waiter is a hoot, non-creepily flirting with my younger sister and her friend and making us 30somethings chuckle with leftfield Linda Evangelista jokes.",0.9497,0.851,0.149,0.0,0.39976325757575765
2008-05-18,3.0,"Not bad judging that it was Sunday and they have a sunday lunch buffet. I was happy with the vegetarian options full of spice and warm and yummy. Not stale or cold as some places i have been to. I will be returning to try dinner without the buffet aspect. I would have liked if some of the items were labeled since I'm a vegetarian. I had to kind of guess what some of the items were, my cousin was of some help however since he had been there before. The other thing was that we didnt even know that it was a lunch buffet. We were sitting at our table waiting for a menu and had to go ask . overall they were super nice and the food was yummy so i can't complain. Will definately try them out again.",0.9701,0.797,0.179,0.023,0.6715277777777778
2008-04-30,3.0,"I had tried this place as an alternative Brunch to India house.  It was not as busy, but the atmosphere is one of a nice small restaurant.  Service was decent.  This review is primarily for the Brunch Buffet the spread is noth quite as impressive or large.  Food is decent, and the taste and seasonings seem to be on the more subdued side.  The samosas (sp?) were very very nice though.  I am eager to back on a non-buffet day and sample the menu, as I suspect on the whole the quality is better on individual entrees than taking the Buffet as a whole.  But until I can update 3 starts for buffet.  Parking is an issue in this neighborhood as well, no matter what the time.",0.9556,0.793,0.167,0.04,0.5441269841269842
2008-04-11,4.0,"No complaints.  We ordered this in (someone had to go and pick it up, however), and though there was a slight mishap with the order, it was easily remedied.  Everything was tasty, but the sag paneer (not on the menu, but apparently orderable) was out of this world.  I'm a very picky sag paneer orderer, and this stuff was just incredible.  I could have eaten a whole order with no help.  The samosas were large and good, though I like a crispier pastry more, and the naan was excellent.  I liked the Murg Makhani, and what little I tried of the Tandoor mixed grill was good--the ground lamb spicy rolls.  I didn't like the Chicken Korma, but my boyfriend really did.  He thought it cut the spiciness of the other food perfectly.   As I said, no complaints.  I'd happily eat here again.",0.9744,0.699,0.21,0.091,0.5863095238095238
2008-03-27,4.0,"Food was very good, Service was good, and the Staff was friendly. Three most important things for a good restaurant in my book. I did think it was just a tad pricey and the decor was nothing to write home about.  Will definitely go back.",0.9483,0.672,0.328,0.0,0.5685714285714286
2008-03-21,3.0,"Full disclosure: My yummy Indian friend Harsh works here, so I go here and am Set Up. Here with two friends on Friday night, we let H order for us. Didn't order anything too out of the ordinary (paneer, me: lamb vindaloo and butter/tomato chicken - forgot the indian name of this dish). But OMG, delish. The interior could use a rework, and the bathroom a cleanup, but I happen to know H is working on a yummy new drink menu. So, it's due to improve.",0.9161,0.811,0.167,0.022,0.5882575757575758
2008-03-16,2.0,"i came here 3 years ago and had oh-so-fond memories of Klay Oven.  However, on my most recent trip back (with a fellow Indian friend), it was SOO disappointing, which is a shame, since I had been looking fwd to rekindle my love for Klay Oven for a while. The ""bread"" that was available to eat was this minty wafer with coriander - I wasn't a fan of it.  TO start with, we had the appetizer sampler to start out with, with an extra order of samosas.  The samosa skin was dull (not flaky at all), and was pretty bland.  Among samosas, there were 3 shrimps, chicken pieces, veggie fritters.  For entrees, the 4 of us shared the tikka masala (chicken cubes), matar paneer (cottage cheese and peas), malai kofta (veggie dumplings) and the meat sampler.  To our dismay, nothing was really al that tasty.  All dishes (aside from the meat sampler) is eaten over basmati rice and/or naan, and the sauces were a lot more watery, less flavorful, than other places in the city (like Udupi on Devon, or even India Garden).  The naan here was also just so-so; a little on the doughy side, it also lacked flavor.  The prices here was also not cheap, which made the experience worse.  There are much better options in the city than to come here. Don't come here for Indian food.",-0.4874,0.875,0.054,0.071,0.51125
2008-02-27,2.0,"I went here the other day for a sunday buffet.  It was just horrible.  I am so used to India House (which is absolutely amazing).   Comparatively, this place had cold, stale, tasteless food.  I would never go there again.  It was empty for a Sunday - and now I know why.  I am Indian and I've had indian food all my life.  This place was horrible. If you want good indian food, go to India House.",-0.6808,0.829,0.055,0.116,0.7527777777777778
2008-02-10,4.0,"This is definitely one of the better indian restaurants in Chicago.  They have a good extensive menu and everything is a la carte.  The murg makhani (butter chicken) is really good, and I am a big fan of the tandoori mixed grill, which includes chicken, mahi mahi, tiger shrimp, a kabob, and lamb.  Their nan is also pretty tasty, and I inhale that with my food.  Service can be somewhat slow on a busy night, but if you go there between 6-8pm on weekend night, you can own the place.",0.8151,0.871,0.129,0.0,0.5756410256410256
2008-02-01,4.0,"I rather enjoy it when I go to a restaurant and it is virtually empty.  This practically ensures that I am going to get awesome service.  So when I walked in at 6pm on a weeknight to see only 2 other tables taken I was psyched.  And Klay Oven did not disappoint.  It was like having your mom over when you are sick.  ""Can I get you anything else dear?""  ""How are you doing, is everything to your liking?""  I loved it. Things that I would recommend from the menu: Kesar Chaval (basmati rice pilaf) Garlic Naan Seekh Kabab (I generally dont like lamb but I LOVED this) Chooza Tikka Masala  I would stay away from the Matar Aloo Samosa appetizers, as they were dry as well as the Aloo Tikki, which had little flavour.     All in all, a good downtown choice for Indian food.",0.9667,0.8,0.176,0.024,0.669345238095238
2008-01-28,3.0,I have only ordered deliver from a private delivery service from this place and it just wasn't worth what I had to pay for it. The food was OK but I can probably cook my own Indian food better if I want to put my kitchen through that hell.,-0.3953,0.701,0.134,0.165,0.5791666666666667
2008-01-13,4.0,"I'm probably not the best judge of Indian food because I haven't had much of it in my lifetime, well, besides the semester in college I spent in London. And there I ate lots of Indian food since it was the only thing with taste.  But then again I was also eating lots of subway and McDonalds that semester. So with my limited experience of Indian food I found Klay Oven to be really good. My fiance and I scored these reservations last minute on a Saturday night- we even received 1000 points from  opentable.com  for dining there.  When we walked in the restaurant was practically empty- hmmm, so that's why we got the 1000 points! Have to admit  I was a little worried about the lack of people dining here on a Saturday night, but immediately liked atmosphere of this loft style restaurant.   Once seated we were immediately given some crispy bread (not nan, but more like crackers) and delicious sauces to dip it in....mmmm. We devoured it and I was all ready to ask for more, but my fiance reminded me we would soon have nan on the way.  We had more  than just nan on the way- somosas, crab masala, palak paneer (cube cheese in a yummy sauce), rice, and yogurt. Everything was absolutely delicious!! I especially enjoyed the nan (any type of bread usually has my name all over it), the somosas, and the palak paneer.  The yogurt didn't really do it for me, but others may like it because my fiance was all over it.   And the service may have even been better than the food- they were so attentive (yet not overly so) and the timing that we presented with all the food was just perfect.  There's something to be said for being one of the only few tables in a restaurant!  I haven't tried many Indian restaurants in Chicago so I'm not sure how Klay Oven compares, but they get a stamp of approval (or I guess 4 stars) in my book!",0.9937,0.823,0.147,0.03,0.5595543345543346
2007-11-05,2.0,"My experience at the Klay Oven for their lunch buffet; The naan: not fresh.  The dishes: bland and lackluster.  The staff: pushy and unpleasant. My boyfriend and I: Won't be back Tip: If you are in River North looking for Indian food, go to the India House.",-0.7321,0.86,0.0,0.14,0.5708333333333333
