date,star,text,compound,neutral,positive,negative,subjectivity
2017-01-26,5.0,"This review comes almost a year after the night my now husband proposed to me, on Groundhog Day 2/2/2016. We started our evening, a gloomy and rainy Tuesday, at this location that he picked out. It was absolutely fabulous to the point of a 5-star review, even upon discovering that they are now closed (bring on the tears). We had hoped to come here for our ""engagement"" anniversary. Service and quality were excellent and authentic and I was so much looking forward to getting leftovers from the dish I ordered a year ago, when it was the only time ever that my now spouse suggested I don't get leftovers because we were going somewhere else afterwards (proposal spot!) I just thought I'd share this story. I wish the owners and operators of this establishment the best and would like to extend my thanks. I will never forget the best date night of my entire life over one of the best and most authentic italian dishes I've ever had.",0.9869,0.785,0.199,0.016,0.5017857142857143
2016-12-10,5.0,"I'm so sad to find out they had closed their doors for good. One of the best Italian restaurants I'd ever been to. I had only dined there once but was one of the best experience with great food, and local places I've dined to date. I hope they can reconsider opening up again for another 25 years. I hate to see such wonderful place close its door.",0.962,0.639,0.279,0.081,0.5375
2016-11-11,5.0,"PLEASE PLEASE PLEASE PLEASE come back! You guys make the best gnocchi I have ever tasted. I'm Italian and your gnocchi is even better than my mothers (don't tell her I said that!) But in all seriousness, I felt like crying when this restaurant closed so I'm begging the owners, please open a new one! My friends and I always talk about how your dishes, portions and atmosphere were the best in the city.",0.9816,0.61,0.344,0.046,0.30606060606060603
2016-09-30,1.0,Terrible customer service.  No wonder they are going out of business.  Been a regular here for more than two years and they could not even offer takeout for one last meal before they close because allegedly they do not have the capacity to cook and wrap a meal (something that takes less than 20 minutes),-0.6486,0.906,0.0,0.094,0.3017094017094017
2016-09-28,5.0,awesome Italian restaurant! Too sad that they had to close it:(,0.3164,0.546,0.266,0.188,0.75
2016-09-26,5.0,"Literally dying that this place is closing. Hoping that they'll have some change of heart after seeing the outpouring of love that they've had since they announced their demise. Absolute best Italian for the price, especially as a neighborhood restaurant that could charge so much more. Dining in here is like being in your favorite Italian Aunt's kitchen - so full of warmth and comfort. I will truly shed a tear when I eat here one last time this week.",0.976,0.725,0.275,0.0,0.4916666666666666
2016-09-23,5.0,"They have one of the best hearty Italian food in Chicago and in big portions. I'm so sad that they are closing. It is dimly lit and a perfect date spot. I have tried most of their menu and I have not been disappointed. I got the linguine al fruti mari with plenty of seafood from mussels,  squid, shrimp, one of my favorites.  They are closing October 1st so try to make it before they close!",0.8609,0.793,0.16,0.047,0.51875
2016-09-21,5.0,Love this place ! Please don't close.  Have been coming to this fabulous restaurant for many years. No other place like it.,0.902,0.508,0.422,0.07,0.61875
2016-09-10,1.0,"Not good. If I could write just not good I would leave it at that but Yelp won't let me post a review unless I write more. I wanted to like it because the decor is really lovely but unfortunately I was terribly disappointed by their pasta.  Why in the world is it ok to just throw whatever you have in the kitchen in your pasta dish? That's what it left like...it was just too much stuff not well put together. One of the pasta dishes had giant pieces of sausage and peppers cut fajita style and put on average tomato sauce, it was hard to eat looked sloppy and the pasta was undercooked (I they have the meaning of ""al dente"" confused).  Our other pasta dish was swimming in cream sauce, very bland. The dishes reminded me of when I was a server, at the end of the night the cooks used to experiment with whatever was left over and ask us to try it. I overheard someone asking the server if the owner was Italian and he replied no that he was once married to an Italian...so I'll just leave it at that.",-0.6742,0.811,0.086,0.103,0.5219298245614036
2016-09-09,5.0,Italian food place Yummy stuff and good service Sad to see them go. This was a Haiku Jew Review!,0.5411,0.607,0.267,0.126,0.5333333333333333
2016-08-29,2.0,"I was really looking forward to my first time at Rose Angelis, but it was so disappointing :( We went with a group of 9 and the waitress was awesome! Super nice and friendly.  The appetizers were good:  steak brushetta and calamari (it's grilled though, so if you're looking forward to fried ones, these are not it) The Bad: 1) I ordered the duck tortellini, but I thought the tortellini was bland and it did come with a very soupy sauce that did taste good, but it would have been better if it was thicker. 2) I tried my friends' food as well, but nothing really stood out as amazing. 3) We sat in the middle room, but unfortunately we could smell the odor of #2's when people would come in and out of the bathrooms which are close to where we were sitting.  Not really the restaurant's fault, but it definitely did not help with the experience. Because of all the great reviews and my friends really like this place, I'll give it another go.",0.9935,0.641,0.274,0.085,0.591304347826087
2016-08-25,5.0,"Great authentic Italian food! Intimate, sophisticated, and charming. Go now! Outdoor patio and reasonable prices take this place over the top.",0.9311,0.55,0.45,0.0,0.6499999999999999
2016-08-14,4.0,We arrived a few minutes before the restaurant opened and waited outside.  The restaurant opened promptly on time. Service was friendly and accommodating.  We were having a business dinner and asked to have the music turned down which was promptly taken care of.  We tried several dishes.  I had the gnocchi in cream with bacon.  It was a large dish and flavorful dish.  We had the bruschetta appetizer and along with the steamed mussels.   We were so stuffed we didn't have room for desert. I'd definitely come back.,0.8442,0.899,0.101,0.0,0.23343253968253969
2016-08-07,4.0,"The outdoor patio was lovely and the food was delicious. I got chicken stuffed with spinach, on top of risotto. Yum! The inside of the place looked cute too, like someone's old house. The only down side were the flies that were swarming our table. I wish they had been proactive and lit some torches ahead of time.",0.9617,0.704,0.296,0.0,0.7111111111111111
2016-07-31,4.0,"Wow, what a pleasant find! We found this place by searching for Italian restaurants with outdoor patios. The patio here is beautiful. It's like sitting in a backyard and is well decorated with lights, tiki torches, etc - it was a really nice ambiance at night. It is worth noting that the indoor dining room was beautiful too. There were multiple rooms that each have a different feel and overall it is very homey and romantic. The server was very friendly and brought us bread and olive oil right away. She was helpful recommending red  wines. For our entrees, we had the lasagna and spinach shell pasta. The lasagna was massive, a giant brick that could feed a family - not a bad value for $18. The size was very impressive although we thought the taste was only good, not great. The spinach pasta was tasty and a very large portion for a reasonable  $15. Overall, this is a beautiful, homey Italian restaurant definitely worth visiting whether you eat inside or outside. The only reason I left off a star was the food did not blow me away, but it was still tasty and a good value. I will be returning.",0.9756,0.786,0.184,0.03,0.5492559523809524
2016-07-30,5.0,"This is just great Italian food.  Their homemade marinara is amazing.  I always get a quart to take home.  It is so fresh and flavorful you could eat it as soup--it is that good.  Every meal I have ever had here has been fantastic.  My friend is a bread pudding fan and he raves about it--I think it is good, but I have never been that fond of bread pudding--their caramel sauce is TDF!  I love their salads, great Lasagna--great seafood/pasta dishes as well.  I would go every night if I lived closer--a treat to go to a place that always has great food, great service and never disappoints!",0.9923,0.621,0.356,0.023,0.6454545454545454
2016-07-20,1.0,"I was so excited for my duck tortelloni. When it finally arrived, I was devastated. It was swimming in sauce and the spinach looked weird (like it was over cooked and canned). Now, I don't really care if my food looks pretty as long as it tastes good. Unfortunately, the presentation was a mess and it tasted awful so it was like adding insult to injury. I definitely don't think whatever meat was in the tortelloni was duck. It went straight to the trash. What a waste.",-0.8477,0.614,0.15,0.236,0.6173076923076923
2016-07-20,5.0,"WHY have I never reviewed this place?  LOVE IT,  LOVE IT!  Love the staff, food everything!  Thanks Rose Angelis you are like our 2nd family.",0.9684,0.487,0.513,0.0,0.49166666666666664
2016-07-18,4.0,Very good authentic Italian food. My husband ordered the salmon special and said it was great. Huge portions!,0.9115,0.527,0.473,0.0,0.6252380952380953
2016-07-09,5.0,"Great meal had their specials...mussells, vegetsble salad and manicotti...great flavor and srvice was outstanding!",0.8553,0.588,0.412,0.0,0.8125
2016-07-06,5.0,"Wow, is all that I can say.  Just bought a new condo in the neighborhood and have been wanting to check out this place.  Went for dinner last night to celebrate our Anniversary and all that I can say is ""WOW"".  Service, food, ambiance, everything was on point.  Had the NY Strip and it was the best steak that I have ever had.  On top of it all, it was 1/2 off bottles of wine, which was a welcomed treat.  The portions are huge, we left with a ton of leftovers, which I am so excited to have dinner now tonight.  I can't stress enough, this place is fantastic and such a hidden gem.  Thank you for making our night that much more special.",0.9866,0.744,0.256,0.0,0.5517316017316017
2016-06-26,1.0,"I will tell @ the end of the review why the 1 star.   Never have I given a bad review before. Of the over 20 tables, only 3 were occupied on this past Friday @ 7:00 PM. The room was very noisy. We were a party of four & my wife ordered gnocchi which she usually loves @ previous Italian restaurants. The ingredients were weird. Raw scallions & apricots & thick & gloopy sauce. She did not like any of it. I had to specially order spaghetti with marinara sauce which was not on the menu. It was less than average. Now the reason for the 1 star. After the waiter  accidentally spilled my full glass of Pellegrino on our table in front of me which soaked my linen pants, the Maitre'd graciously offered to replace them or pay for the dry cleaning which I declined.",-0.1035,0.841,0.067,0.091,0.45053113553113544
2016-06-20,5.0,"I went here with a group of 8 and they were very accommodating although we were unable to sit on the patio due to our size, but inside was just fine. The food was delicious and there was such a variety. Everyone enjoyed their food and we definitely had leftovers. I would highly recommend visiting this restaurant, you won't be disappointed.",0.9728,0.692,0.308,0.0,0.5665
2016-06-18,3.0,"I wanted to love this place... the ambience and the service was definitely five star. When your signature dish, the lasagna misses the mark and the chicken parmigiana is about is average as it gets, I would come back and try other things but not lasagna...the house salad was tasty and the  Italian bread pudding was amazing with caramel sauce.",0.8481,0.829,0.148,0.022,0.46562499999999996
2016-06-16,4.0,"BREAD PUDDING! The best I've ever had! Rich, warm and dense... the decadent caramel sauce alone is to die for... If you come here and could only order one thing, i'd get the bread pudding. Period. You would be missing out if ya didn't",0.4912,0.674,0.182,0.144,0.5399999999999999
2016-06-12,5.0,Fantastic duck tortellone and their Rigatoni alla Lorena is incredible! Nice little outdoor patio; great in the summer.,0.8892,0.588,0.412,0.0,0.8099999999999999
2016-06-04,4.0,Outstanding. Classic old school dining. We had two vegetarians plus two carnivores in our group. Plenty of choices for everyone - no one had a bad dish.  We'll be back.,-0.1779,0.72,0.115,0.164,0.38166666666666665
2016-05-29,5.0,"Fantastic atmosphere...delicious food!  We dined on the patio which was beautiful but walking through the restaurant was also a delight. The whole place has such character. Next time we are in Chicago, definitely making it a point to go there again!",0.9353,0.711,0.289,0.0,0.5499999999999999
2016-05-24,5.0,Hidden neighborhood gem. All I will say and all that I need to say. Attached is a photo of my husband's dinner tonight.  Amazing!  Oh and definitely walk around and check out the monster amazing trees on this street.,0.8908,0.757,0.243,0.0,0.6583333333333333
2016-05-21,4.0,"This is a very snug restaurant and gives off an authentic vibe. The fold portions are HUGE and very fairly priced. I can put away a lot of food but had to take my leftovers to go. I had the Lasagna, it was good but too cheesy for me.",0.7065,0.88,0.12,0.0,0.7583333333333334
2016-05-08,5.0,"Rose Angelis hits the mark in every way-- the food, the atmosphere, the staff, and easy to get reservations on a Saturday night.  If you're looking for a little flare on the typical Italian dishes, they have some amazing options. Including: - Steak bruschetta (OMG... get this!! So, so good) - Pasta specials with combinations you would not have thought of yourself You will not be disappointed. GO!",0.8787,0.858,0.142,0.0,0.6291666666666667
2016-04-20,3.0,"I do think we got them on a bad day... There were several giant parties at once. However, I probably won't be back. Pros: -Our waitress was very sweet and informative -The portions were gigantic. Like, definitely meant for 2 to share -We were seated quickly even without reservations. -My SO's sauce was delicious as was the broth for my soup and the herb infused olive oil. -they had a lot of seperated dining sections Cons: (I would have overlooked 1 or 2) -I got Zuppa di Pesca and everything BUT the scallops was overcooked. Everything was rubbery and SO chewy. Like a livestrong bracelet. I think they must have reheated it then tossed the scallops in after. They should have done that for all the fish -The table bread was cold and not even sliced all the way through. -After we got our food, our waitress only checked on us once, RIGHT after our food arrived. I would have sent my soup back if she'd come back. Instead I barely touched it and shared the other plate we ordered. -It took from 8:30 to 9:12 to get our check. Because no one checked on us.",0.8688,0.879,0.09,0.031,0.5326488095238096
2016-04-14,5.0,"Classic. Italian. Fantastic. This once family home has been converted to my favorite Italian restaurant in Chicago. There is a little bar in the front with a TV if you are looking for a more casual meal, or you can make a reservation for the back rooms.  To start, the wine menu is fantastic. Get a bottle or 2 of your favorite Italian blend for the best bottle. The potions of food are huge and can definitely be shared among 2. GET THE LASAGNA! You won't regret it. You must check this place out.",0.9809,0.725,0.275,0.0,0.5022222222222222
2016-04-10,5.0,"Rose Angelis is a cozy Italian restaurant that seems small at first, but just keeps on going once you get inside.  I've eaten here a handful of times and have never been disappointed. If you go during the week, be sure to try the Pollo al Vesuvio. I can also vouch for the Pollo Florentino, Rotini alla Putanesca, and Ravioli alla Luigi.  The wine list is extensive and competitively priced. If you like things on the sweeter side, you'll be a fan of the sangria.  Great for a dinner date or having a meal with friends. Come hungry -- the portions are huge!",0.9788,0.779,0.221,0.0,0.6055555555555556
2016-04-03,5.0,We are new to the neighborhood and decided to try Rose Angelis. What a find! Who knew what appeared to be a small little restaurant was as vibrant and large? The food was served with very generous portions and was delicious. We were thrilled and delighted to find this gem.,0.953,0.714,0.286,0.0,0.5766450216450216
2016-04-03,5.0,"We went here for a romantic birthday dinner and everything was perfect!  We were seated promptly. The service was attentive and thoughtful, and the ambience was perfect for what I wanted. We ordered a special salad that seriously could have fed four and was very unique.  Our entrees were both stuffed pastas (duck tortellone and a shrimp raviolini special) and both were delicious and massive.  The Italian bread pudding is a chocolate bread pudding slice nearly as big as your head, in a divine caramel sauce.   Highly recommend!",0.9761,0.724,0.259,0.017,0.6678231292517005
2016-03-30,5.0,"Amazing food!  Chef made a ravioli special with cream sauce, mushrooms galore, cherries, olives and many more healthful, delicious ingredients such as shaved almonds on top!  I brought half of it home for dinner tonight.  The place was crowded and everyone seemed happy.  It was a fun atmosphere and there were myriad menu choices for carnivores, fish lovers and vegetarians.  Great wine list as well.  We live nearby and Rose Angelis is a real favorite!",0.9858,0.651,0.349,0.0,0.645578231292517
2016-03-28,5.0,Our family always enjoys dinner at Rose Angelis. We've been regulars for over 15 years and appreciate what they bring to the Lincoln Park community!!,0.7639,0.777,0.223,0.0,0.95
2016-03-18,5.0,"The lasagne is excellent - humongous, and big enough for two hungry people. My partners shared one meal (which is the wise option!). I'm taking home enough to feed two adults tomorrow. Atmosphere created by the music and setting is great. Servers are presnt, without intruding. This is indeed a great spot for authentic italian cuisine.",0.9622,0.709,0.291,0.0,0.5833333333333334
2016-03-09,5.0,"Wow! What an amazing little hidden spot in Lincoln Park! The menu and wine list was very extensive, without being overwhelming. The Tortellone (the one with the grapes and walnut pesto) was by far THE MOST INCREDIBLE Italian food I have ever eaten. I'm currently just a tourist, but that pasta made me want to move here so I could enjoy it all the time. Staff was courteous and I even got to sit outside to enjoy the lovely Chicago weather while having a spiritual pasta experience. 10/10 would recommend to anyone looking for Italian in the heart of Chicago.",0.9837,0.749,0.251,0.0,0.5500000000000002
2016-02-27,5.0,"I have been here quite a few times in the last ten years and this place consistently exceeds expectations. Food, service and ambiance are all spectacular.",0.0,1.0,0.0,0.0,0.2633333333333333
2016-02-18,5.0,"It was by chance my spouse and I ended up at Rose Angelis last night. I had been here twice before, but it has to have been well over six years ago. I am so happy that the quality of service and of food is still so very strong. The staff was kind and welcoming. Our server was very knowledgeable, incredibly affable and most importantly, made the experience seem like we were dining at a friends house. As luck has it we dined on a Wednesday and were able to take advantage of their four course dinner for two special, $59. Everything from the appetizer to the dessert was delicious. The ingredients are top quality, the flavors well balanced the portions were perfect. My spouse had the evening's special of Alaskan blue crab stuffed ravioli in a lemon marscarpone cream sauce with roasted red peppers. It was surprisingly light, a the taste of the crab was subtle and fresh. Perfect. I indulged in the gnocchi con prosciutto e albiococca secca, which is gnocchi in a mascarpone cream sauce with dried apricots, prosciutto, scallions and walnuts. Basically heaven on a plate.  Everything from the prosciutto wrapped asparagus with bell pepper puree appetizer, to the soup and salad, through entree and dessert was fantastic. I cannot wait to go back.",0.9981,0.687,0.313,0.0,0.6349107142857142
2016-02-07,5.0,"Great atmosphere and much bigger than we thought it was. We had the grilled calimari as an appetizer and that let us know how big the portions are. We also got the special manicotti, which was also delicious. The price of the food was extremely reasonable. Great experience all around.",0.9393,0.759,0.241,0.0,0.6102040816326532
2016-01-30,5.0,"As a former Lincoln Parker and now a suburban nite,  Rose Angelis is my favorite Chicago restaurant of all time. Amongst rows of brownstones you'll find a quaint Italian restaurant. On any weekend night it'll sure be bustling.   it's a great place to take the family or a date. The price is right the quantities are large and the food is excellent.The unique location and interior make it a charm.",0.9022,0.832,0.168,0.0,0.5553174603174603
2016-01-24,5.0,"Awesome little neighborhood restaurant...originally a charming home before being transformed into the tucked away gem it is today. Tourists won't find this place easily if they stay in the ""touristy"" areas, and a few Uber drivers have been known to drive right past...but once inside, a treat awaits. Hand made pasta, fresh, traditional with a modern twist. Best Italian food I've had in this city. The atmosphere is warm and casual enough for catching up with a friend while still being nice enough for a family gathering or romantic dinner. The menu is appropriately focused, mostly classic Italian dishes. Good portions, fresh ingredients and fair prices, I think. The rotini alla putanesca was wonderful, as is the gnocchi and manicotti. Well done!",0.9933,0.647,0.353,0.0,0.574095238095238
2016-01-17,5.0,"This restaurant now holds the record for my favorite calamari and gnocchi. The prices for everything are reasonable, especially for Chicago. The portions are huge and will serve as a decent size lunch the next day as well. The olive oil for the bread is also terrific because the oil is soaking in a bottle with rosemary and other herbs and spices. Also great ambience.",0.9274,0.799,0.201,0.0,0.6990740740740741
2016-01-15,3.0,"Solid Italian, but did not live up to the hype. Great portions and quality comfort food with a cool ambiance of a converted old house.",0.9209,0.591,0.409,0.0,0.3666666666666667
2016-01-14,1.0,"As this place was recommended by a friend, I had high hopes. When you walk in the space and decor is charming, rustic, cozy, and authentic. I loved the feel and atmosphere of the restaurant, and our waitress could not have been sweeter. Unfortunately I cannot say anything good about the food. I ordered the mixed salad and a special salmon dish, and my friend ordered the minestrone and a special ravioli. None of the dishes even met our expectations. Everything is doused in a heavy sauce, and while my portion of fish and veggies were HUGE, the sauce was so heavy on the fish and the steamed veggies had absolutely zero taste or seasoning. My friends ravioli was also swimming in a heavy cream sauce, and the flavors were uncomplimentary. Overall the food was really mediocre. I wanted so badly to like this place. But when i want to go to a small neighborhood italian restaurant, I would far rather spend my time and money at Sappori Trattoria or Ricardo' Trattoria.",0.9735,0.77,0.183,0.047,0.6285487528344671
2016-01-13,5.0,I love this place! The food is always fresh and the atmosphere is so cozy. I had my wedding here in 2014 and couldn't have been happier with the service and food. Everyone said it was the best wedding food they have had. I think that says a lot! Thanks guys!!!,0.9184,0.705,0.248,0.047,0.47000000000000003
2016-01-11,5.0,"This place was great.  We went on a Saturday night around 8:30 My fiancé and I went here with my best friend and her husband.  It can be hard to please all four of us in one restaurant but this place did that.  I started with the prosecco and the steak bruschetta which was incredible and flavorful.  I ordered the lasagna and cannot say enough good things about it.  The flavors all blended perfectly.  It was HUGE, so I only ate about a 1/4 of it but it was great as leftovers also.  The duck pasta was fabulous as well.  Everything we got was wonderful.  The dessert looked amazing as well but we were much to full to try any!",0.9915,0.675,0.295,0.029,0.7636904761904763
