date,star,text,compound,neutral,positive,negative,subjectivity
2011-02-18,5.0,"Absolutely incredible.  Everything about this place was better than we expected.  Nestled between cute 3-flats in a very quiet residential area, the restaurant looks small and quaint from the outside.  I didn't expect it to go back so far!  We sat in the main dining area, the last room of four in the restaurant.  It was dimly lit, with candles and Italian-vista murals on all the walls.  It wasn't too crowded when we sat down at 7pm on a Thursday, but it got quite busy (and loud!) throughout our meal.   We started with fresh warm bread dipped in their homemade herb-infused olive oil (so wonderful!).  With the $49 for Two special (avail. Wed/Thurs - awesome value), you get to order one appetizer of your choice, 2 caesar salads, 2 entrees of your choice, and 1 shared dessert of your choice.   It might not sound like too much food, but IT WAS TOO MUCH FOOD.  I can't believe how large the portions were!  I haven't brought home that much food in a long time.  To add to it all, everything we ordered was OUT OF THIS WORLD good.  We really enjoyed with the pizza del giorno appetizer, and devoured our deliciously light and fresh-tasting caesar salads.  After that we were full.  Then our entrees came.  Aged New York Strip and Manicotti del giorno.  Both totally excellent, but we couldn't even make a dent.  How were we supposed to eat this incredible homemade chocolate peanut butter ice cream with blackberries and bananas and caramel?  Well, we found a way.   We literally rolled ourselves out of there, traditional post-Italian-meal style, but it was worth it.  We'll be back.",0.9924,0.837,0.154,0.009,0.5034261534261534
2011-02-16,2.0,"As I mentioned on Monday, Erica and I went to Rose Angelis for a Valentine's Day dinner. We had never been and had only heard good things. What made it even better was the dinner special for two, that included a bottle of prosecco, an appetizer, two salads, two mains and a dessert. Unfortunately the value may have been the best part of the evening, besides the company of course, since our food was only so-so. Oh well, it wasn't the first time a neighborhood Italian spot has dissapointed, and since they are still full most nights I guess I'm in the minority. The place is cute enough, set inside an old house that feels as if they've been there forever. I was surprised how far back it went, and how many seats were actually there. Everyone talks about the romantic charm and feel, but I'd say it just feels quaint and old fashioned. Old does not necessarily mean romantic and charming. Our service was very good and attentive, always filling glasses and removing plates as necessary. The food however was disappointing. Our appetizer was one of the specials, a pizza topped with all sorts of good stuff - sun dried tomatoes, cheese, pine nuts, mushrooms and a tomato pesto spread. It's hard to explain but the pizza was not that tasty. I loved the crust, and each ingredient was fresh, but the total flavor package did not work for me. It certainly was filling, we left a few pieces on the table to make room for the entrees.  Our cesar salad course came next. It was fine and plenty large, the dressing was not overpowering. For our entrees I chose spinach pasta half-moon filled with ricota, served in a brown butter sauce. Erica ordered a seafood linguine in red sauce. My pasta was the best dish we ordered all night, with plenty of flavor and well cooked pasta. The sauce was a little sweet for me, but it tasted better the following day. Erica's dish did not have good flavors, with a very watery and lackluster red sauce over undercooked pasta. The seafood was fine, though hard to tell since the red sauce was so bland.  Our dessert selection was great though: chocolate fondue. It came with some fruit, pound cake and cheese cake. If I had my way there would have been some marshmallows, but even so, it was very good (with many tables around us inspecting our choice). I don't mean to sound like a downer, since we had a nice evening at a local spot with good service and value. We were dissapointed with the food, especially after all the good things we had heard. It happens, but with so many ""cute"" Italian restaurants in the city it's hard to say we'll be back soon. I'm glad we ended on high note, and after all, the only thing that matters on Feb 14 is the person sitting in the seat across from you.",0.9975,0.79,0.178,0.033,0.5403796653796654
2011-02-16,5.0,"Best Italian restaurant in Chicago.  Every time I go, I order the weekly special pasta and it never fails to be amazing.  Great for ""date night"" or dinner with the family.  Highly recommended!",0.9613,0.562,0.438,0.0,0.4802040816326531
2011-02-05,4.0,"When a restaurant takes your name & cell number, lets you leave for a few hours, and calls you when your table is ready - that's a reputable place in my book for 2 reasons: First, they make it convenient for customers, and Second - if you have to wait a few hours for dinner, it must be good.  Sometimes the second reason isn't always true, but in the case of Rose Angeli's, it certainly is.  Seems like every appetizer and entree is of massive size, and equal taste and flavor.  Perfect for dates, groups of friends, and in the summer - their outdoor patio is a destination worth waiting for.",0.9637,0.781,0.195,0.024,0.4636507936507936
2011-01-30,4.0,"Food- Yum, Yum, Yum! I'm not a huge pasta fan, but the fresh pasta at Rose Angelis is delicious, along with the creamy homemade sauces. My sister really loves ordering linguine with buffalo mozzarella and red sauce. This is not on the menu, but Rose Angelis happily makes this simple and yummy dish for her. We also had the ravioli and sun dried tomatoes. The sundried tomatoes were a perfect touch to this straightforward dish!  Décor- This is such a cute and warm place with a romantic European feel! I love it! Prices- Very reasonable prices for fresh Italian homemade food! I recommend Rose Angelis for a romantic date, a girl's dinner night out, or even as carry out when you want to treat yourself to fresh homemade food!",0.9964,0.611,0.371,0.018,0.5942559523809522
2011-01-29,4.0,"Rose Angelis never fails. I've been there a handful of times, and it is always consistently good. The food is scrumptious, the prices are reasonable, and the service is normally spot on. Was there most recently on Friday night, arriving at 6:30 to beat the dinner rush and wait. We shared two of the specials, a large salad (a bit overdressed) and shrimp with raviolini, and this was plenty of food! Rose Angelis is an all purpose restaurant - good romantic dinner spot, a great place to convene with friends, great place to celebrate a birthday or dine with out of town guests. Parking is easy too, fyi. We asked the host, and he mentioned several spots that were not permit parking.",0.9876,0.743,0.257,0.0,0.5774603174603176
2011-01-29,5.0,"Definitely my favorite Italian restaurant in the city!  It is hidden away on Wrightwood and you will drive past it if your not careful.  I love that it is just a residential house converted into a magnificent dining experience.  Tuesdays are half off wine bottles, including the reserve list.  They also change the speicals up very often and blow my mind every time.  I almost always order one of the chef's specials, but the menu is not lacking anything either.  The portions are huge, and perfect for lunch at work the next day.  I have never had a bad experience here.  Check the website out for weekly pricing specials.  They used to have the NY strip for like 12 dollars and it was to die for!",0.9209,0.782,0.156,0.062,0.5551282051282052
2011-01-17,5.0,"this place was very romantic. aside from the location and the parking situation, once you land inside the place it is very romantic. the kind of place you could imagine a gent throwing his jacket over the puddle that stands between you and the door. the kind of place where all the italian guys with real italian accents make you wanna dye your hair black once and for all as well as show up no short of an endearing red chiffon dress, with short sleeves and a classy neckline. the kind of place you will not be embarrassed to smoke those skinny cigarettes. the kind of... ok you prolly get it by now... i LOVED that my waiter sorta somewhat spoke a tid bit of english. his italian accent made me want to ask, ""what is that you say sir?"" a million times just to hear the accent (as well as what he was really saying sure). ahhhh... he recommended the special appetizer... some sort of shear-sliced tuna tartare insalata with a zingy garlic sauce, radishes maybe, spinach.. my memory is a little foggy but i remember it was an intense dish... not for everyone's palate then the vino... good selection and reasonable... we were seated in the patio area (with the weather-proof enclosure to keep out the cold)... and the only people i saw around the restaurant at the time... either it was the weather or location that kept us isolated there, but i will never complain about having all that attention to our table alone! and my dish was PERFECTO: Raviolini alla Maria - salmon filled raviolini in a basil pesto cream sauce with chopped kalamata olive... if you get this and love salmon you will not be disappointed! i LOVED it. and it was soooooo good i couldve gorged the whole monstrous plate if there werent so many gents, or one very nice one across from me... so i saved half... and yes i ate it cold at my work the next day because there was no microwave... and it was still delicious i tried: Polenta con salsiccia del agnello - baked polenta served with homemade lamb sausage and sautéed spinach in a red wine reduction sauce.... i remember it being similarly delicious, especially the sausage... but i also remember being attached to my choice! the glasses stayed the full as well as our stomachs were! the waiter was superb and the experience was lovely. id go back in a heartbeat, if just alone to make my heartbeat...",0.9974,0.785,0.189,0.026,0.5871808143547275
2011-01-10,2.0,"Really good prices for large servings of food. Monster salads and always interesting specials. I like this spot because I've gone a dozen times and always enjoyed myself. But... Certain things that are a setback are that the tables are on top of each other, its tiny inside, its extremely loud inside, and they don't take reservations. Its also not close to any public transportation so unless you're from the neighborhood you're probably going to cab it.  If you can handle all that, you can check it at rose angeli's and go across the street for some pre dinner cocktails at Mauve and wait for them to call you. On a weekend you could be waiting for well over an hour though. At that point you might want to just stick with the drinks or bar food will get the job done. I wouldn't recommend for a first date. I'd recommend for a couple who is from the neighborhood, but that's about it. Otherwise you might want to skip it and go to Olive Garden.",0.7806,0.897,0.085,0.018,0.5270833333333332
2011-01-09,3.0,"When I moved to Chicago here 5 years ago, one of my friends, a life-long Chicagoan (actually a Skokie-an, now a Chicagoan), told me she and her husband's favorate Italian place was Rose Angelis.  I never had the chance to come until last night though.  I came with 3 friends, and FYI they don't take reservations, so it's first come, first serve.   We came at 7pm on a Saturday, and were told the wait was 45 minutes, actually turned out to be an hour.  We were seated in the first small room, which I think was probably quieter than the main dining area, as there were only 4 tables in this room.  So that was great.  Our waitress was hilarious, kind of theatrical, and really nice.  There was a good 40 minutes that she kind of seemed to disappear and we could have used another glass of wine.  I had the red house zinfandel, which was really good.   The olive oil was awesome!  With the bread of course.  One friend ordered the lasagna, which he loved, and another friend ordered gorgonzola tortellini which she also liked.  Two of us ordered the special for the night, which was a linguini with duck sausage, a cream asiago sauce, and spinach, bell peppers, and mushrooms.  It was ok.  The sauce was really heavy and the duck sausage just tasted a little weird to me, and I generally love duck, but I guess sausage is different.  Could have used more vegetables in the dish.   Also, this is kind of weird, but the only steak on the menu is NOT available on Friday/Saturday nights, which I thought was not only strange, but disappointing for my friend, who had his heart set on the dish.  Everyone got doggie bags, except me, and I thought the waitress was going to cry from disappointment.  I definitely want to come back to try some different dishes.",0.9609,0.809,0.135,0.056,0.5647959183673469
2011-01-08,5.0,"Rose Angelis is my new favorite Lincoln Park Italian spot. The service is very friendly and all the wait staff is extremely helpful. A wonderful selection of authentic appetizers, pasta dishes and traditional Italian entrees that are all reasonably priced. Unfortunately, we were not too hungry, so we just ordered the appetizer special --- a whole wheat pizza topped with capers, artichoke, mushrooms, peppers, kalamata olives, covered with parmesan and mozzarella cheeses and a touch of garlic and pine nut/ tomato pesto  sauce --- EXCELLENT. Although it wasnt needed, I used the house infused olive oil on the table for an extra finishing touch. We complimented our pizza with a few glasses of red wine, a nice selection with modest prices (either by the glass or bottle) served in juice glasses, just like in Italy :).  We will be back soon !",0.9792,0.799,0.186,0.015,0.6011806375442739
2011-01-07,4.0,"good food, large portions, great atmosphere and prices are absolutely fine",0.8439,0.468,0.532,0.0,0.5696428571428571
2011-01-04,5.0,"This place is awesome. The food is delicious and unique, its huge but very romantic, our waitress was excellent, and the portions were so big we ate them for three days. Very cozy and yum! I'll be back.",0.9421,0.675,0.325,0.0,0.7361111111111112
2011-01-04,5.0,"It truly is a taste of Italia in Chicago. Off the beaten path, you come across this restaurant and upon first entering it seems like a tiny establishment in an old house, but as the host leads you down the hall you realize that it's actually a huge space that somehow maintains a wonderful level of intimacy.  The servers are very helpful and ours definitely earned his tip with excellent service. The food was on point, filled with distinct flavors just as you would expect with well-made Italian food. I dined here for the first time with a group of 6 and three main entrees were more than enough.  The desserts were equally filling and I think the next time we'll stick to just ordering the strawberries (in a delicious caramel based sauce) as a light end to a hearty, delicious meal.  I cannot wait to go back here with friends or even on a date!",0.9906,0.764,0.225,0.011,0.49267676767676766
2011-01-01,5.0,"I came here last night with my boyfriend for NYE, and we were extremely happy when we left!  The bread pudding is AMAZING!!!  The deal was good, $130 for two people:  a bottle of wine, appetizer, cesar salad, main course, dessert, and a champagne toast at midnight.  Our server was wonderful.  She helped us pick out a bottle of wine and was very intent on making sure we were happy with our choice.  She seemed to be pretty busy, but we got just as much attention as if we were her only table.  Just before midnight, the bussers brought around party favors and hats for everyone.  The atmosphere, the service, and the food were all wonderful.  Plus, the portions were gigantic, so we were able to finish our main courses this afternoon for lunch.  Bonus!",0.9854,0.776,0.224,0.0,0.6204248366013072
2010-12-31,2.0,"I no longer live in Chicago, but was very much looking forward to my Birthday Celebration at Rose Angeli's while I was back in town.  As usual, the food was quite good - with one exception.  We mostly all ordered the prixe fixe dinner which came with a caesar salad.  The caesar salad was very disappointing.  They gave you a plate of lettuce, with some croutons, and dressing on the side.  Caesar should really be pre mixed with the dressing - not so easy to do on your own at the table. The service on the other hand, was very disappointing.  One of the managers, Brian, was still setting up our table when we arrived (10 minutes before the reservation).  He was rude to us and practically kept pushing us out of the way when we tried to make our way back to the table to wait (b/c the area up front in the restaurant was too crowded to wait).  Our server was also rather ""absent"" the entire night.  She seemed quite overwhelmed with serving a large table (17 people) and didn't really know how to be attentive to the table.  It probably didn't help that she knew she was including a set ""tip"" amount with the bill, so her service didn't really have to be all that great and she would still receive a good tip for the overall table.   Overall, not the best experience and wouldn't recommend it based on service alone to a large group.",-0.8875,0.812,0.073,0.115,0.46557319223985894
2010-12-23,3.0,"THe night we used our gift sertificate here was a real romantic time and the right place for it was this hidden restaurant somewhere between residential living.  Breads, pasta dishes we ordered were very garlicky and yet balanced out by the olive oil and vinegarette.   Very intriguing and inviting here. Romantic no doubt and the staff just as fit for the moods and atmosphere.  Very lightly chilled in room temperature and dimly lit that mysterious limelight feeling presence can hit you and your partner.  Definitely a nice surprise here in every course and proximity of staff and spacious layout.",0.9409,0.76,0.199,0.042,0.6135497835497835
2010-12-22,5.0,"I've been to this restaurant many times - it's a favorite of mine for special occasions.  They're often crowded.  If you're concerned about a long wait you usually do not have to wait much if you get there early.  I've had different dishes and desserts here and every one has been pretty spectacular.  It's not the cheapest restaurant in the city but it is one of the few that the value/outcome is greater than the cost.  Portions tend to be large and I think I left with a doggy bag every time.  Try it, I think you will really like it.",0.8977,0.873,0.127,0.0,0.4633333333333333
2010-12-19,4.0,"what a charming restaurant! i went with my boyfriend and his parents at around 8:00 on a saturday night and it was packed! they do not take reservations (unless it is a party of 8 or more). we had a considerable wait (about an hour and a half) but we enjoyed the bar area so much, that the time flew by.  i love the way the wine was served in little juice glasses. great touches all over the place at rose angelis. we ordered the pizza de giorno, which was a whole wheat crust topped with spinch pesto then topped with gorgonzola cheese, bell peppers, roasted garlic, grape tomatoes, carmelized onions and grilled zucchini.  i found the pizza to be delicious, sweet tasting and the whole wheat crust had a nice crunch.  when we were seated at our table we were greeted by a fabulous waiter who mentioned he had been working at rose angelis for 18 years! he was very knowledgeable and gave some great recommendations. i ordered the ravioli alla luigi -ricotta filled ravioli served in a sun-dried tomato cream sauce topped with toasted pine nuts and parmagiana. probably the best pasta dish i have had in a year. and the portions are HUGE. i brough home half of my plate and i was stuffed last night! overall, a great dining experience. i would highly recommend this place to anyone looking for an intimate date spot with reasonable prices. i will definitely be back!",0.9971,0.744,0.245,0.011,0.5696666666666668
2010-12-15,1.0,"I have been here three times.  We went for the 1st time about 5 years ago and I remember thinking it was just okay.  We tried it again pretty soon after and I felt the same.  This past Saturday, we decided to give it another try 5 years later.  I was very impressed with the wine list.  Lots of great wines to choose from and reasonably priced.  Lots of appetizers and entrees to choose from too.  I got 2 items off the specials menu and my husband ordered the Duck Gnocchi off the regular menu.  The skirt steak bruschetta was good, not great (definitely not an italian dish).  My dish was one of the worst things I have ever tasted.  I ordered the ""Chicken Vesuvio"" ravioli.  It was described as flavorful and full of Rosemary, Chicken, Lemon, and Garlic (true to the Chicken Vesuvio) I know and love.  When the dish came, it was essentially a bowl full of cream and raviolis.  My first ravioli bite consisted of all garlic (but in a bad way - bc I usually LOVE garlic).  The next and third bite were super spicy and I could not take the chicken or anything else.  Just pepper or some spiciness.  I had my husband try to make sure I was not crazy, but we agreed something was wrong.  It was the worst thing I have ever received in a restaurant.  I pushed it to the side and had some of my husband's gnocchi which was okay, not great.  The waitress was very understanding (and kind of shocked when I explained how spicey it was and how it did not represent Chicken Vesuvio flavors).  I actually was not charged which is a plus.  She was very nice about it and I wish I could recommend something I had there.  I will not be back.....ever.",0.9697,0.799,0.145,0.056,0.6089369658119657
2010-12-11,5.0,"Great food at very reasonable prices for Lincoln Park. It is not the absolute best Italian food in the city, but it has more character and lower prices than many of the nice places. Favorite items are the large salad with an array of fresh vegetables, the thinly sliced eggplant appetizer, and the pasta with walnuts, gorgonzola, and grapes. Great place for a date, but remember it's crowded and you'll have to wait on weekends. I've been here at many different times (including Valentine's Day--don't try it!!!), and I've decided the best time is at 8pm on a week day, preferably on a warm summer night when you can sit outside on the patio and have a leisurely, delicious dinner.",0.9595,0.741,0.19,0.069,0.595187969924812
2010-12-11,5.0,"Hands down, best authentic southern italian comfort food restaurant in Chicago!  Service is great, pasta is homemade including some of the best manicotti and lasagna I have ever tasted.",0.9459,0.611,0.389,0.0,0.3412698412698413
2010-12-09,5.0,"Wonderful food, great staff and so much bigger than it looks.  The entire first floor has seating, including 2 outdoor areas that are perfectly lit for dinner.  Great date place or for a friendly gathering.  They have a meal 2 for $50 on Wednesday and Thursday that's amazing.  Homemade pasta, bread, and the olive oil for the bread is very flavorful.  I live in the neighborhood and will definitely go back to this place frequently.",0.9794,0.709,0.291,0.0,0.5737179487179488
2010-12-06,4.0,"One of my favorite restaurants in the city. Very homey and reminiscent of real family-run restaurants in Italy. The food is rustic, not too pricey and the service, in my experiences, has always been great. I realized today how much I miss it and I definitely plan to make it back the next time I'm back in Chicago.",0.8481,0.817,0.157,0.026,0.35500000000000004
2010-11-08,4.0,"I have been dying to try this place for awhile now...It is located on a quiet tree lined street in LP and so adorable! They basically converted this old house into a little restaurant. The ambiance and decor are so cute and this alone will keep me coming back, appetizers, dinner or just a glass of wine. The prices are very reasonable and the food is pretty good. I say this because we ordered the pizza of the day for an appetizer and the crust was hard and awkward. Maybe it was the whole wheat crust, i don't know. But i wouldn't order the pizza again. The pasta was great though! I would definitely recommend this place to friends though! Great for a date night!",0.983,0.739,0.226,0.036,0.6236666666666667
2010-11-07,5.0,"Rose Angelis is one of my favorite neighborhood restaurants. The interior is very cozy and inviting. It feels like you are eating in someones living room. I've been here quite a few times and have always had a very friendly wait staff. The food is so delicious. The gorgonzola tortellini is one of my favorite meals in the entire city. If there's a long wait, you can either sit in the bar at the front of the restaurant or go to the bar across the street for a glass of wine. I recommend this restaurant to anyone.",0.9674,0.796,0.204,0.0,0.7444444444444445
2010-10-31,4.0,"Fantastic authentic Italian in a casual atmosphere.  Favorite Italian restaurant in Chicago.  Service is always terrific, the only down side to this place is they don't take reservations so a wait is common.",0.8885,0.701,0.299,0.0,0.6305555555555555
2010-10-20,5.0,"Everything was tremendous from the food to the service and ambiance.  We had a table of 6 and never once waited or had to ask for anything.  The food, while inexpensive, is the best Italian I've had in the city and the portions are not your typical chintzy amount found in most other Italian eateries.",0.6369,0.925,0.075,0.0,0.3821428571428571
