date,star,text,compound,neutral,positive,negative,subjectivity
2013-12-08,2.0,"Front of the house was lacking again.  Sort of as if they are reinventing the seating chart and entire spatial layout each time you come in.  The food was excellent, as always, but the service is making the experience much less than worth the wait.  Hope they get it figured out.  We saw a number of frustrated would-be patrons give up and leave while there were still plenty of empty tables.  Made no sense and felt like something less than what we were used to in the past.",0.2341,0.767,0.126,0.107,0.3510416666666667
2013-12-03,5.0,"I freakin' love this place.  Second time going there in a few months w/ the Mrs, which should say enough, and both times I've ordered the same dish, which should also serve as a compliment in itself.  The bruschetta is awesome, definitely the best way to start off your meal.  For the entree I have ordered the tortellone con salsa di noce each time, which is ridiculously good.  I'll have to force myself to try something new the next time I'm in there, which will be soon I'm sure, but if you haven't been yet give it a shot.  The atmosphere is great, perfect for dates or small groups.  You'll probably have to drive or take a cab, which is it's only downfall, since it's not exactly in an ideal spot for CTA travel, but doesn't take away from the fact that it's a 5-star review and is my most recommended restaurant in Lincoln Park.  BOOM.",0.9841,0.797,0.193,0.01,0.5399130190796858
2013-11-23,5.0,"Rose Angelis always gets it right!!!  This place trumps all for good Italian food.  The food is always amazing, fresh and unique (salad/dressing and pizza specials are always changing and never disappointing).  The customer service is spot on (polite, friendly waitstaff and no unusual up charges for special requests).  The atmosphere is cozy and inviting.  Finally, the prices are extremely reasonable for the quality that you get....not an attribute easily found these days!",0.9474,0.719,0.233,0.048,0.696031746031746
2013-11-15,1.0,"Inedible food. Filthy dining room. Factory assembly line service. Disney style Italian atmosphere. I've been hearing about this place for a long time and, after many years living, eating, & loving life in Chicago, I finally tried it.   Never ever ever again.   This place is a WASTE OF REAL ESTATE in a great food town!  There are countless GREAT Italian restaurants here. This is NOT one of them. Please, do the neighborhood and real Italian food lovers a favor and get while the getting is good.  Then a real restaurant can move in.",0.9678,0.736,0.231,0.033,0.47
2013-10-28,3.0,"Great Wednesday night special. For $55 for two people you get an app, two salads, two entrees and a dessert. For the apps, I would recommend the pizza. It was a special the night we were there and delicious. We did not really like the grilled calamari. It came out in little slivers with a huge portion of spinach. I just didn't care for the sauce.  We tried a chicken dish and the duck tortellini for our entrees. Both were good, but neither blew us away. They were extremely rich. Someone else tried the lasagna and that was fantastic. The bread pudding here was one of the best I've ever had. It came sitting in an amazing caramel sauce that tasted like Garrett's popcorn. It was the best thing we had all night. We all left stuffed and with leftovers to take home.  Wine prices were extremely reasonable. Service was spotty. It took a long time for someone to come to our table and a long time for them to bring us our wine. They were extremely busy because of the special, but I still thought it took too long. 262/365",0.9905,0.765,0.205,0.03,0.5649659863945579
2013-10-21,5.0,"One of my favorite restaurants in Chicago.  The food is consistently great (although I'd avoid the pasta dishes with fruit, which tends to be a bit too sweet for me), there's an awesome wine selection, and the waitstaff is top notch.  Oh man, and the patio is really great in warm weather.",0.9641,0.637,0.33,0.033,0.75
2013-10-11,5.0,I went here for a quiet double date night. Something about finding a wonderful hole in the wall in a pleasant neighborhood is always heart warming. Our waiter was excellent. Always attentive to our needs but never pushy or hurrying us. We followed his recommendations and each dish was delicious. Perhaps the olive based pasta was a little strong for my liking but the gnocchi in the cream sauce is a must and the deserts were large and filling.,0.9682,0.739,0.261,0.0,0.6861904761904762
2013-10-05,4.0,"I love Rose Angelis. LOVE it. I took my parents here when they visited Chicago - my mom wants to come back every time they're in town. I've taken my girlfriend there on dates - she loves it as much as I do.  There's nothing better, in my mind, then the lasagna. It's huge, but more importantly, it's just the best I've had. I don't even need to write much more about it - it's just great. Desserts are also consistently delicious. Can't go wrong, they're really good. Now, that being said, I will caution you: I really did NOT like their putanesca (too salty), and I've been burned twice because I've wanted alla fruiti de mare (i.e. seafood), I think because it was too fishy. But the ambiance, prices, portions, and staff are more than enough to keep me coming.",0.9912,0.737,0.252,0.011,0.5578947368421051
2013-09-29,4.0,"A hidden gem in the heart of Lincoln Park. Come hungry - the portions are massive! But here quantity does not sacrifice quality. Everything was amazing, and there is something for everyone. I got the lasagna and it lasted me 3 meals! My mom got the Salmon Pesto Ravioli, boyfriend ordered the Duck Fettuccine and my grandma got the Shrimp and Scallops pasta. All dishes were fantastic and everyone was blown away by the taste. This is a delicious, cheap spot. Perfect for out-of-towners, parents, date night, etc. Go here now!!!",0.9514,0.837,0.163,0.0,0.8333333333333333
2013-09-08,1.0,"I'm really bummed to give this place 1 star because the atmosphere is very cute, very friendly. Plus, it's a lot bigger than you think, especially the outside area. Let me say that the appetizers we had (both bruschettas) were very good and so was the Minnestrone soup. However, you don't go to this kind of restaurant just for appetizers. There were 4 of us....and all 4 of us hated our dinners.  The lasagna was enormous and unfortunately, it was all cheese.....and more cheese...did I mention they use lots of cheese? It was like eating a plate full of ricotta and maybe a noodle was tossed in somewhere as a layer. The chicken Marsala was completely tasteless. Which is very hard to do considering what it's marinated in. The ravioli with salmon was down right disgusting. It was like eating frozen fish sticks that had been microwaved and then cooked for too long. So some were rubbery and some tasted like what I imagine a sweat sock might taste like. The strip steak was the best of the 4 meals, but that is not saying much. I get that it's an Italian restaurant so maybe steak wasn't the best call for someone to order, but if its on the menu, it should be at least edible. The prices were reasonable but even that would not bring any of us back. And it's a shame because its a cute looking place. But the food does not deserve a second chance.",0.9073,0.843,0.102,0.055,0.5623713738368912
2013-09-05,5.0,"This is my wife and my FAVORITE place to go, especially on special occasions.  I'm not sure what is better the food or the service! From the front of the house, Brian to Sergio our waiter then to the best chef Larry, the staff is attentive, friendly and generous!  The food is great, the atmosphere is wonderful and we are never disappointed here.   Please get the Tiramisu it is out of this world!",0.9828,0.636,0.324,0.04,0.7588888888888888
2013-08-30,5.0,"Best Italian food I have had in the city. Tues- half off wine Wed and Thurs- Shared App, two salads, two entrées, and shared dessert (bourbon balsamic ice cream is to die for) for $50 Great service too!",0.8588,0.649,0.272,0.079,0.3041666666666667
2013-08-30,3.0,"Apparently Thursday nights are a great deal at Rose Angelis - 2 eat for $50 (app, salads, 2 entries and 1 dessert) and 3 eat for $75 (app, salads, 3 entries and 1 dessert), etc etc.  You get the picture, I hope.  But, with the portion sizes that get served at that restaurant - can actually be enough for several more meals.  Aside from the large portions, like the biggest that I have ever seen in an Italian restaurant, outside of Buco di Beppo - nothing else stood out. (actually, lasagna might have been bigger than at di Beppo's)  The three of us shared the steak bruschetta appetizer - good flavors but lots of dried out meat.  Caesar salads were decent.  3 entries were the lasagna, duck tortellini and the pork chop. Lasagna was one of the best plain lasagna's we've had (that's why this place actually got 3 stars).  Duck tortellini was decent, but nothing to write home about.   Pork chop, stuffed with apples, sounded like a great concept - but the dryness of the chop and the brick (polenta) next to it, couldn't be overcome.  Had tres leches for dessert - it was almost the size of the lasagna and was much heavier than a typical tres leches.  I know, I know - that's what we get for ordering tres leches in an italian restaurant, but nothing else sounded good.  Service - we knew what we wanted to order within 2 minutes...but somehow our meal still took 2.5 hours.   I wouldn't mind this on a Fri/Sat, but it was just too slow for a Thursday.  It took about 15 min for anyone to talk to us and another 10-15 to get our wine.   We ate on the patio and it was beautiful.  Patio and Lasagna pulled this place into 3 stars, but most likely I will not be going back.",0.987,0.89,0.11,0.0,0.4265188834154351
2013-08-16,2.0,"This is a cozy, lovely place.  Eight (5 Italians, 3 USA ) of us, including two teenage boys, found this food inedible.  Several of us only ate two or three three bites.  Some of the issues:   ingredients unidentifiable by taste, way too many ingredients in some dishes, conglomerations of ingredients that did not compliment each other,  too salty, tasteless sauces, loaded with cheese and spinach.  No culinary finesse.  Huge portions,mostly uneaten.   Not one of us took leftovers.",0.3283,0.866,0.075,0.059,0.5175000000000001
2013-08-15,3.0,I didn't like right off the bat how they didn't seat us even though we had 6 out of our 8 party there. The food is delicious and I recommend you split the dish otherwise you'll have a lot of left overs to take home. We had a party of 8 but they didn't include tip like the menu said it would which was a little confusing.,0.1703,0.789,0.118,0.093,0.4871428571428571
2013-08-12,5.0,"YES YES YES AND YES,  II have been here four or five times now and have loved it every time. I usually take the servers recommendations on one of the chef's specials or new dishes.  Last time I had a gorgonzola sauce pasta dish with grapes in it.  I was a little weary of grapes with pasta but it was one of the best pasta dishes I have ever had.  I hope they have it when I go back again.   The service is sometimes slow but I didn't mark them off for it because I think it;s more of a take your time dinner place and they don't want to rush you.  It's more the style of the place than bad service so just be aware when you go there.  That or let them know you are in a hurry if you are trying to make it so a movie or something after.   Great wind selection and the bartender seemed very knowledgeable when talking to us about them before we were seated.   I wish I remembered my servers name, he answered so many questions for the five of us while I know he had other people to take care of as well.  Very patient.   Keep doing what your doing Rose Angelis!",0.9847,0.801,0.166,0.033,0.4368265993265993
2013-08-03,3.0,"I love Italian food, and homemade pasta the most.  Some of the pastas were yummy, and some were bland and not as good as I had imagined in my head.  The linguine was good, but we altered it by adding a spicy marinara sauce.  The special braised short rib ravioli was good, but the sauce was kind of sweet.   We got a pear dessert and it was interesting, but there was a LOT of caramel on it.  The pumpkin ice cream was more of a sorbet and kind of icy instead of nice and creamy.  The tiramisu was strange... fat layer of fudge on the bottom...which I have never seen before....   The server.  He was the most un-humorless odd awkward awkward (2 awkwards necessary) guy ever.  He was telling us the specials, and I was asking my friend something and he stopped talking, almost in a, ""can I continue, you're being rude"" fashion.  He blamed the kitchen for a lot of things when he didn't want to accommodate simple things; ie) getting a couple spicy peppers, not letting us pack a dessert that we wanted to go because the kitchen wouldn't allow it.  WHAT?!?!  Anyways, I don't know if it was on off night, or the server was just a weirdo.  I might try it again with a smaller group (we had 8) and see if there is a difference.",-0.3898,0.762,0.108,0.13,0.5966117216117216
2013-08-02,5.0,"My boyfriend and I came here on a Saturday night spontaneously after noticing it on a walk earlier in the week. We didn't make reservations, it was 7pm on a Saturday night, and I insisted on sitting on the patio, thus we had to wait for a little over an hour. We sat at their little bar and got a bottle of wine so the wait was fine. Once we sat on the patio, the wait was more than fine and DEFINITELY worth it. The atmosphere on their back patio is incredible. It's cozy, romantic, and fun, with strings of lights and flowers - just gorgeous! We ordered a the Insalata di Caprese as our appetizer, and it was very good (the basil was very fresh!). Our server was very quick, very nice, and made us laugh. All around great service. I ordered the special of the night, I'm not entirely sure what it was but it had hand stuffed pasta, figs, peas, and was in a brown sauce. It was AMAZING. I ordered it on a whim and it was one of the best dishes I have ever had at any restaurant, different but delicious. My boyfriend got their salmon filled ravioli dish and was also thrilled with it. We ate so much pasta we couldn't possibly do dessert, but saw a couple of tables near us with several of the desserts and they all looked tempting. We will be back many times.",0.9929,0.804,0.19,0.006,0.5629505135387488
2013-08-02,2.0,"I really thought I would like this place so I was surprised at how much I didn't. I'm wondering if it was an off day. There were 8 of us so we all got to try some of each of the dishes and nothing stood out. The duck tortellini that many have raved about did nothing for us. The best dish that we tried was one of the specials but even that was not anything note-worthy. We also tried two desserts. The special which included a pear pastry and caramel sauce was tasty. However, the tiramisu was not good at all and had a layer of fudge towards the bottom which was just odd. It may have been the worst tiramisu I ever had.  The server was fine for the most part but one of the people in our group wanted to take her dessert to go and the server said no, saying that he couldn't because it had ice cream on it. She then asked if she could just get the pastry part and omit the ice cream and our server still said that was not allowed. He wasn't being mean about it but it was just a weird experience.  This place had so much potential but I don't see myself coming back.",-0.7742,0.872,0.053,0.074,0.5472619047619048
2013-07-22,4.0,"Last night my boyfriend and I went to Rose Angelis for dinner. It is a frequent date spot for us because it's close to home and we are guaranteed to have leftovers for a least a couple of meals. We always order the pizza appetizer which is a MUST! Each time it varies a bit because they use different ingredients but the one thing that is consistent is that it tastes delicious. It has a thin wheat crust that is crispy. It is then covered with fresh veggies and cheese and topped with fresh Parmesan cheese. I ordered the special pasta of the day which was very good and James ordered the special manicotti which was four tubes filled with Italian sausage and peppers. Although we did not save room for dessert, I highly recommend ordering their bread pudding. It is a thick piece of crunchy layered bread with hints of chocolate served in a pool of warm caramel. So delicious!  This is a great date night spot.",0.99,0.771,0.211,0.018,0.5802261904761904
2013-07-06,1.0,I never write reviews but our experience at Rose Angelis warranted one...I wish I could give this place 0.5 stars and that would only be for the service and how good the waiters make the food seem. We went there on a Saturday night for dinner and this was the WORST Italian food we have ever had - that's if you even call this Italian food. This was our wedding anniversary dinner and everything was horrible. We started out with the special pizza for appetizers - sounded amazing with its pesto sauce and sun dried tomatoes and smoked mozzarella.. However it tasted like.. Absolutely nothing.. Cardboard.. My frozen pizza from jewel seemed gourmet compared to this. My husband ordered the chicken Marsala.. And it tasted like once again.. Nothing.. No salt no garlic no pepper no nothing! I ordered some half moon spinach ravioli which was recommended by the waiter and it tasted like.. Yup nothing!! All I tasted was the boiled butter. We ate nothing.. And left with more than 3/4 of the food.. I guess I can justify my one star for the bread we had before this disastrous meal began.. Since the bread did actually taste like bread.,-0.6011,0.753,0.12,0.128,0.5904761904761905
2013-07-02,3.0,"My wife and I were excited to try this place, as we'd heard great things.  We knew we had to save room for the bread pudding, so we didn't bother with any appetizers, soup, or salad. My wife got the duck tortellini.  It was very unique and pretty good but didn't wow us.  I ordered the manicotti that was a daily special.  It featured cheese, spinach, and chicken.  Overall, it was good.  The cheese was a bit too smokey for my liking and the chicken was a little dry, but the sauce and pasta were great. Onto dessert, we had been hearing how amazing the bread pudding is, so that's what we went with.  It had incredible flavors and layering.  The butterscotch sauce was divine.  It was very rich though, and some vanilla ice cream would have been perfect to break up the richness. Our waitress was very friendly, but they didn't seem to have enough servers for how busy they were.  We seemed to always be waiting for her to come to our table.  The atmosphere was very nice and rustic, although it was louder than we anticipated. We would definitely like to go back and try some more of the dishes and hopefully have an even better overall experience.",0.9973,0.695,0.29,0.016,0.6338010204081633
2013-07-01,1.0,"Lovers of quality cuisine beware. Rose Angelis is obviously a charming and beloved local venue. It's dark halls and shaded garden set a friendly and intimate tone. If restaurants were judged solely on ambience, Rose Angelis would never have a problem.  My girlfriend and I dined there last night. It was her second time and my third. My first experience a few years ago was rock solid. My second go-round a year ago, I left wondering whether they were slipping. Last night, unfortunately, was the last time I will ever, EVER eat at Rose Angelis. Why? The food was just God-awful. Veering from poor to downright repellant. Here's a perfect example: we actually left much of the grilled calamari uneaten. Who does that? Nobody. Because grilled calamari is delicious. But when it tastes rubbery, bland and soaked in mystery broth, it really isn't. Not so much grilled as it was boiled and drowned in this watery brown broth with its fellow victim, a pile of mushy, lifeless spinach, the only reason so much of this appetizer ended up in our stomachs was because my girlfriend and I were famished by the time we had arrived and had ran out of bread. And then the salad we ordered to share. Yikes. Basically, it was a Caesar salad sort of encased in an odd assortment of large, unseasoned lettuce leaves, turnip coins and cucumber spears. This tee-pee of vegetables was visually impressive but its taste ranged from ordinary to bland. With no seasoning and no dressing but the Caesar portion inside, the Rose Angelis diner is invited to gnaw on raw vegetables like Tarzan or waste half the salad. But the epic fail of the evening was my girlfriend's Chicken Marsala. The mystery broth was back with a vengeance. It suffused her dish and mine. Chicken Marsala is not soup and everywhere else I've ever had it, it was served on a plate. This was served in a large bowl. The chicken was water-logged and utterly devoid of taste. The vegetables that adjoined it in the bowl were like perfectly-preserved drowning victims washed up on a beach, gently drying in the waning sunlight. My girlfriend basically gave up after about five bites and when I sampled it, I was surprised she had lasted that long. For an encore, my girlfriend became nauseated and just wanted to leave. Thanks for serving my girlfriend crap and making me pay $90 for the privilege, Rose Angelis. I won't forget it. I had ordered the rigatoni and it wasn't much better - redeemed only by the fact that the savory sausage coins it featured  had almost certainly been created offsite and had somehow weathered the storm of this chef's madness. Correct me if I'm wrong, but isn't rigatoni supposed to occur in a creamy to slightly chunky viscous, even cheesy tomato sauce? This was like rigatoni soup. The brown mystery broth had not only taken over my girlfriend's dish but had flooded mine, too. I managed to get through about a third of it before I couldn't take any more. The wine was good - I had three glasses. The staff was warm and welcoming. Our waiter was especially pleasant.  If they had had a different chef, the evening would have turned out splendidly. But the food was just that bad.  So, if you and your date have lost the power of taste, perhaps in an unfortunate accident, I can highly recommend Rose Angelis. If not, take it from me - stay away.",0.8559,0.79,0.114,0.096,0.5321636471636471
2013-06-17,5.0,Awesome Awesome Italian food. Staff is very helpful and friendly. Portion sizes are huge. Well worth the money.,0.9641,0.343,0.657,0.0,0.5428571428571428
2013-06-17,4.0,"This restaurant is destination worthy. We ate outside on a beautiful evening, surrounded by other diners who seemed to be enjoying themselves beneath the romantic stringed lighting as much as our party. We started with a bottle of Montepulciano and the baked eggplant appetizer, which was delicious. My sister and her fiance ordered flavorful pasta dishes, both AMPLE amounts. Although the portions were huge, one has to remember that this is an Italian restaurant! Yay for leftovers:-) I had the Zuppe de Pesce, extremely flavorful and chock full of tender pieces of seafood. Definitely make a stop here. I can only assume that any dish you order will be more than delicious. The menu definitely offers more than enough, but the waiter will fill you in on the ample amount of specials for the day- everything is so fresh!",0.9662,0.808,0.181,0.011,0.6035714285714286
2013-06-01,5.0,"Traditional Italian food with a touch of modern and here's why I loved it: Service: It was six of us, we had no reservations and they sat us fairly quickly. Our waitress was sweet and had a soothing voice. She explained the specials with such details and passion that I was sold when she described the manicotti dish I ended up choosing. She even recommended specific wines based on each person's entree. Also, we never once felt rushed and were able to really enjoy our last meal in Chicago, in fact, they were starting to close by the time we payed the bill, but they never once rushed us. They also have many of their dishes in a gluten free version which was great for my friend who doesn't eat gluten. Food: We ordered the bruscheta and mussels for appetizer and they were amazing! The mussels came in this red spicy sauce that was so good we were dipping the bread in it. I ordered the manicotti special which was stuffed with spinach, ricotta cheese and walnut . This was to die for ! The rest of my friends ordered the steak, rigatoni, the ravioli stuffed with duck and a couple of other dishes I can't quite remember. They were all delicious and the portions were big. Now, were were too stuffed to order dessert but we decided to look at the  menu anyway and ended up caving in and ordering 2 desserts to share. We ordered the bread pudding which was covered in caramel sauce and a pear cake which came with pumpkin ice cream.  The bread pudding was huge and enough to share between 3-5 people. All I can say is that we all experienced multiple food orgasm from these desserts. If you don't eat a lot, you should skip the appetizers just so that you can order dessert. I'm so making this place a must next time I come to Chicago.",0.9944,0.815,0.165,0.02,0.4745590828924162
