date,star,text,compound,neutral,positive,negative,subjectivity
2015-10-26,5.0,"This is the perfect place for my family to eat and we are a tough combo: I'm vegan, my husband is not and my two kids are, well, young.  We went for dinner and Bistro Dre was so kid friendly: wait staff was so kind to my kids, kids eat free (not sure if that is only during certain times) and a vending machine with goldfish and popcorn they just thought was the coolest.  There was only one appetizer and one entrée that were vegan when I went but I got both and would go back for the exact same thing.  My food was delicious.  My husband, who loves French food, had onion soup and steak frit (not sure I am spelling that correctly)   BYOB too.  Both kids and parents had a great meal and so nice my husband and I would go sans kids also. We will be back for sure.",0.9902,0.757,0.236,0.007,0.6398214285714287
2015-10-11,4.0,"Really great place for BYOB and shared plates. No cork fee which is great. We had the Lobster Bisque, Charcuterie, & Flatbread and they were all delicious. The one watch out is to order as you go, everything is really filling so you need to make sure to pace yourself.",0.9431,0.689,0.275,0.035,0.7177777777777778
2015-10-04,4.0,Great Steak with frites!  Enough to share for two.  Good service with attentive staff.  Must go again for the specials.   Tom C,0.8588,0.655,0.345,0.0,0.6875
2015-09-10,5.0,"We were there for the first time last night for the $25, 3 course special.  The fact that it is BYOB is what always attracts us.  Everything about the restaurant was great.  The columbian chicken soup was fabulous, the steak frittes  and apple pie were all excellent.  Service was very attentive and never rushed.  The owners came out and asked about our meal.  They were both delightful people and we will definitely be back again!!",0.9741,0.739,0.261,0.0,0.667142857142857
2015-09-09,3.0,"Came here for brunch. Fantastic service - friendly server offered free refills for coffee AND juice. Cozy European vibe. Food wasn't mind-blowing. Had the Salmon Hash - underwhelming. It was a bit dry, could've used some sauce but still good. Would go back for the vibe and service on a rough Saturday morning though...",0.8555,0.816,0.184,0.0,0.5055555555555556
2015-09-06,5.0,"One of my favorite restaurants in Chicago! Great food, great service, love love love the ambience, very cozy and charming. I've been here a lot of times both for brunch and dinner. Love the Chicken and Waffle, it's  the best fried chicken! Steak and Fries, Ribs, Japanese BBQ Chicken Wings, all soooooo delicious and the best homemade Banana Bread ever! It's chef-driven, family owned, and it's BYOB. It's just awesome, I could eat here everyday!",0.9947,0.552,0.448,0.0,0.7180555555555554
2015-09-04,5.0,"This Bistro Dre is a nice quaint place that has eclectic feel. The food here is delicious. I had the steak and fries and my wife have the Ribs, augratin potatoes with some corn and it is delicious. You definitely want to visit this place.",0.9217,0.728,0.272,0.0,0.875
2015-08-18,1.0,"All that I can say is ...SALTY, SATLY AND SALTY!  Four of us decided to check this place out for brunch on a Saturday morning. There was only one other group in the restaurant so we got quick service in the beginning. It just went down hill from there. We put in our order of drinks and food all at once. The coffee came shortly but what did not come with it, like creamer and sugar, took another 30 min. Wait... that was the amount of time it took our food to come out. Yup.. the server didn't check on us once before he brought out the food. And the food was salty, across the board. My spinach omelet was almost inedible. I eat half and had to suck down my entire water with it. Which meat my glass was empty until he came back to drop off the bill. REALLY?  Don't bother with this place.  Service= BAD, Food=Salty, Ambiance= Not Worth the first two!",-0.7592,0.862,0.053,0.084,0.3817460317460317
2015-08-15,5.0,"I went to Bistro Dre for my 30th birthday on a Wednesday night. When making the reservation they were very accommodating. I was unsure if I was going to have 8 or up to 15 people, which was a total nightmare. The said if I take the last reservation spot it wouldn't be a problem. Really helped take some of the stress of planning.  I arrive with white and red wine, and beer they promptly opened what we needed open and chilled what we needed chilled. There was another party of 12 there as well as 5 or so tables finishing but Dave was very attentive to us.  And very patient because we all came at different times and he explained the menu to every new guest as they arrived.  The food came out on time, I had the lobster bisque, it was delicious. Next was the entree, I had the steak and frites. Also fantastic but I couldn't finish it.  Those portions are huge.  For dessert I had the fudge cake with is paired with a banana chip icecream. I found room for that because it was so good.  I will for sure be back.",0.9734,0.851,0.131,0.018,0.4700056116722784
2015-08-10,5.0,Love this place! Very good food! Love the cozy ambiance.  I wish I lived in the neighborhood so I could come more often.,0.9421,0.518,0.482,0.0,0.646
2015-08-07,2.0,"This place is the twilight zone. My girlfriend and I have walked past it hundreds of times and always talked about how we needed to go there. Friends highly recommended it. So for her birthday I booked us reservations. Since it was BYOB I bought her favorite wine. Our waiter was impolite, and could care less we were there. That's ok. Maybe he was having a bad day. Give him the benefit of the doubt. We were going to have a good time no matter what.  She ordered the steak of the day. I ordered the shrimp scampi. When the food arrived they brought the wrong steak. No big deal. She said she'd eat it, but the waiter insisted he bring her the right steak. The guy was earning points until he brought her the same steak (the cut was exactly the same and it took about five minutes to fix. I'm also a general manager at a restaurant) which they covered in an obviously pre-made gravy and a few handfuls of blue cheese. The shrimp scampi was edible but unmemorable.  The waiter ignored us the rest of the meal until it looked like we were ready for the check. I realize this is BYOB, but I've waited tables for years and I always pour a tables wine. I also asked them if the food is good. He seemed thankful we were leaving.  At the end I went to the bathroom and had to dodge baby chairs, a changing table, and random stuff I won't mention. It was clean, I'll give them that. But there's a difference between homey and someone's home. This place leaned toward the latter. I won't be returning. I can say my curiosity has been satisfied.",0.9652,0.823,0.122,0.055,0.44169772256728773
2015-08-05,2.0,"It pains me to write this review because I've had many great meals at Bistro Dre. However, one horrendous service experience has marred my opinion of this establishment. I live in the neighborhood so have frequented Bistro Dre about ten times. The last visit was for brunch back in June. Our server, Nathan, who also turned out to be the manager was incredibly flippant and unapologetic for the mishaps of our meal.  The trouble started when we were ordering. There was no way to describe Nathan other than rude and disengaged. He honestly acted annoyed with the questions we had about the menu and my husband's request for crispy bacon. I could look past this, but then the first two brunch dishes arrived for our party of 4. These dishes were fine, but what was not fine was the absence of the dishes for my mom and I. After a few inquiries the other two dishes arrived 15 minutes later, after our dining companions are all but finished eating. Also, a table that had come in and ordered ten minutes after us received their food before my mom and I did! What's up with that?  When I asked why our table's food was served so far apart, the answer I received from Nathan was that ""dishes came out as soon as they were ready"", which is totally fine when true. However, this excuse made no sense because both of the late dishes came out cold! My mom's dish was totally inedible as the creamy sauce had gotten gummy and hard since it was not served hot. Everything on the plate was slathered in the sauce so no opportunity to eat around it. This dish (couch potato pancakes) is delicious if served hot so mom was super disappointed. When I asked to speak with a manager I was surprised that our server was apparently the manager too (because he was so dismissive and uncaring about our experience). Typically managers want to make things right! There was no apology or offer to correct the inadequacies. Nathan was actually defensive when I expressed our discontent! He blamed the food taking long and not being served together on a big party (maybe 10-12 girls) that was the ONLY other table in the restaurant when we arrived. Um, if you can't handle three tables during brunch then what do you do during Saturday night dinner rush!? Nathan did give us 10% off of our bill, but this was not a sufficient remedy considering one of the meals was untouched and the amount of time we spent there waiting. Totally disappointed with how Bistro Dre handled our subpar experience. Bistro Dre - Please help yourself out and hire a more professional day manager who actually understands the value of superior customer service!",0.9758,0.809,0.118,0.073,0.4813809523809524
2015-08-02,2.0,"Really lousy brunch experience this weekend. Came around noon on a Sunday and the place was way warm to the point of being uncomfortable.  They only had 2 waiters on duty, so the service was really slow basically non attentive. My chicken and waffles were pretty good, but nothing to write home about. My gf ordered the fried green tomato Benedict but they gave her the crab cake benedict. Good thing was they comped it.  Place could have potential, but not sure if we'll go back.",0.404,0.828,0.101,0.071,0.6956349206349207
2015-07-31,5.0,"Fabulous dinner this evening at Bistro Dre, dining group of 4.  Such a warm atmosphere coupled with delicious food and great service.  Started with three of the starters which were huge portions and quite tasty, followed by two entrees.  Finished with two desserts which were the perfect ending to a great dinner experience.  We loved it and will be back as a couple or with a group.  BYOB made it that much better.  Thank you Bistro Dre for a lovely evening!!",0.989,0.638,0.362,0.0,0.7125
2015-07-20,4.0,"Came here Friday night.  The service was really friendly and the food pretty good.  It was just two of us, we brought our own wine and ordered 4 things.  We had the fried chicken dinner, really really good! the garden flat bread, french onion soup, and the mac and cheese.  The dishes are a little pricey but it's a ton of food.  Everything was really hot and tasty.  I think the only thing I didn't enjoy was the french onion soup, it tasted a little watered down to me, but maybe that's only because I'm a french onion soup enthusiast.  The only downside was that it was boiling hot in the restaurant.  I don't think they have ac?  I'll consider coming back here again on a cooler day, and probably during the week because they have a great Tuesday-Thursday deal, $25 for 3 courses.",0.8884,0.842,0.118,0.04,0.5720899470899471
2015-07-15,1.0,"boy did i get sucked in!!! living nearby, i have been intrigued by the continued popularity and wanting to dine here. finally treated a friend (who, by the way was a restaurant critic ages ago) last night. perhaps i should have been alerted when i saw the ""hiring line cook"" sign in the window. seriously...how dare they!!! we shared 3 items. the highly boasted, bearing the owner's name, Beets Dre. big price tag for not much more than a basic pickled beet with chopped up pieces of beet dumped on top  my dining companion said it was just like his mothers, which wasn't saying much. on to the ""rustic"" mushroom tarts. zero rustic about it. from past dining experiences elsewhere i had envisioned it arriving bubbly hot in a hand-rolled, non-perfect golden brown crust, oozing with mushroom goodness. we were served 2 what tasted like refrigerated puff pastry rectangles that were cold so not particularly edible with a small dollop of fairly dry, sauteed possibly chopped criminis. not one other mushroom type to be seen. the brie fondue sauce was thick, i'll give it that. the waiter suggested we place the tart on a plate and pour the sauce over it. hmmmm. great tip.  and finally, the n.y. strip steak and frites. it did arrive medium rare, as requested, and it was edible. no salt or pepper at the table and although, at first, we had tag team wait staff asking how everything was literally as we tried to eat our first beet bites, they weren't around to ask for salt/pepper when the steak arrived. i'm sorry... i truly wanted to LOVE this place. it's so cute and reviews have been amazing. i don't know what happened last night, but i'm cured. it's over for me. i paid a fairly step bill for very mediocre fare. it's a shame.",0.9015,0.88,0.084,0.036,0.5866111111111111
2015-07-09,5.0,"Such a great experience here. The food was delicious and the service excellent. It has a true neighborhood restaurant feel that's inviting and makes you want to keep coming back. The baked Brie appetizer was nicely presented and tasty as was the 25.00 Tues through Thursday dinner price. I got the stuffed pepper soup, steak frites, and blueberry pie. All delicious.  Can't wait to come back.  Try it out, you will not be disappointed!",0.9784,0.694,0.306,0.0,0.665
2015-07-05,1.0,"Dinner service and food might be different but my experience for brunch was horrible. The servers didn't say hi , they didn't ask how the food was even though we didn't take more then 3 bites... The Mexican skillet was black, everything burnt and tasteless, I wish I would have taken a photo. I told them we didn't like the Skillet and how it was burnt, the server just shrugged his shoulders and said.. ok.. Please takes your business to Sam and George or the Golden apple next door for breakfast/brunch",-0.2299,0.853,0.068,0.078,0.49259259259259264
2015-06-28,3.0,"I thought this restaurant was very cute and they had a big brunch menu. There were six of us at brunch, five of whom ordered meals with poached eggs. Every egg was totally over cooked, totally solid I the center. We didn't feel like asking them to make new ones and I'm sure they would have but what chef can't make a poached egg? It was a little disappointing.",-0.2898,0.847,0.075,0.078,0.5103815937149271
2015-06-20,5.0,"Go here! Delightful, unique, fab food, byo. Love the atmosphere and staff. Amazing use of narrow space. Family owned and run. They appreciate call-in reservations. Open Table has fees, as a young business it gets costly. We had a great time and will be back!",0.9712,0.604,0.372,0.023,0.6166666666666667
2015-06-18,4.0,"Heading to Martyr's for The Moth? Please stop here for dinner.  - Poached pear salad was worth a try, perfect to share - Quinoa Salmon was good, but I would try the Chicken Picatta next time Place was totally quiet on a Thursday night, perfect for dinner for two! Definitely going back for a date night, especially when it cools down and a hearty dinner will hit the spot.  TIP: If you're not in from the area, be sure to pick up a bottle from your favorite place. The location is a bit of a wine desert, the only close option is the bar across the street, which up-charges for carrying the bottle out.",0.9692,0.78,0.206,0.013,0.6186507936507937
2015-06-15,5.0,"We walked up Lincoln to have breakfast at Batter & Berries yesterday, but the line was out the door. So we went up the street and found Bistro Dre. To start, we couldn't decide between 5-6 things each because the menu was so tantalizing. Of those, we only overlapped on two. I ended up getting the Andoille Quiche and my boyfriend got the breakfast poutine. Both were amazing. My quiche was so good I did not want to even share a bite. It was possibly the best thing I've eaten this year - I can't think of anything better. Service was prompt, and it also included free banana bread as a teaser before we'd even ordered - and yes the banana bread was also delicious.  Highly, highly recommend.",0.9913,0.714,0.261,0.025,0.7377777777777778
2015-06-06,5.0,"Delicious! We were seated immediately at 11 on a Saturday for brunch. They accommodated to my vegetarian requests easily, and were very kind, especially the waiter who looks like Jimmy Fallon. We got the blueberry French toast, the egg white omelette, and the potato pancakes, all of which were fantastic.",0.945,0.731,0.269,0.0,0.6761904761904762
2015-06-04,5.0,One of our favorite restaurants in Chicago!!  My wife and I dine here often and love everything about it.  The food is fantastic and the staff is wonderful.  We went last night to see off our favorite waitress Maggie.  Sadly her and some of the other servers are graduating from school and moving on.  We wish them nothing but the best and looking forward to the new staff coming in.  They have some big shoes to fill!! We can't say enough great things about this place!!,-0.4517,0.751,0.141,0.108,0.6189393939393939
2015-05-31,1.0,"Was there 5 minutes. They honored my reservation for brunch so they get a star. We were put at a table in the window. A couple of huge flies were annoying us which we could live with, but when I pointed out to the waiter that there were a few dead flies on the ledge next to me he shrugged and walked away. A simple let me clean that ledge and we would have stayed. Glad you're so busy, but not cleaning dead bugs made us walk out.",-0.631,0.745,0.117,0.138,0.5051948051948053
2015-05-30,2.0,"I feel terrible writing this review because I really wanted to like this restaurant. Unfortunately, the service was absolutely terrible here. Maybe it was just an off day but I came for brunch with 4 of my friends and there were issues with 3 of our meals. Two of us ordered omelettes which were missing the cheese that they were supposed to come with and one of us ordered the chorizo flatbread which did not come out for 15-20 minutes after the rest of our meals. When the flatbread did come out, it was also missing the side of fruit and the pastry it was supposed to be served with. While they did comp us for the flat bread there was little apology for the missing cheese it was just stated that the kitchen was ""glitchy"" today. I understand things can be off once in a while but it is very unenjoyable to go out to a meal and have everyone's meals come out at different times due to issues with the food or issues in the kitchen. Overall, the food was decent but the service really ruined this experience for me",-0.8978,0.87,0.03,0.1,0.40777777777777774
2015-05-26,4.0,BYOB!  I've came here few times & food / service has been always good. Steak here is excellent & brownie desert also is phenomenal! the price is reasonable & decoration is lovely too.,0.8997,0.703,0.297,0.0,0.5916666666666667
2015-05-24,1.0,"We tried this restaurant today for my birthday with my family because they take brunch reservations which can be hard to come by. Unfortunately, the people running the place are complete and total garbage and the food is mediocre at best. When my husband politely sent back his waffles (he didn't care for them) we got incredibly dirty looks from the woman who runs the place. We ignored this and finished our meals and left a nice tip, as the server was kind and doing her best. As we were getting up from the table the horrible, horrible woman running the place came to our table and starting muttering nasty things to us because we sent back the waffles. I was appalled that she would insult her customers like this, and told her so. She then started yelling at me and kicked us out of the restaurant and told us not to come back.  At this point, I had restrained myself long enough and yelled back as I left with my family. If you appreciate good customer service and human decency, I would avoid this restaurant at all costs. On the upside, only 2 of the 4 of us got sick from the food.",-0.8632,0.757,0.097,0.146,0.5388447971781305
2015-04-20,5.0,"Honestly was so delicious. We went for a girls night out, they easily accommodated 6 people. The BYOB is an ultimate plus! All the food came out as prepared- so it was hot (or cold) made to perfection. We ordered the salmon, mac n' cheese, garden flatbread, cheese and meat plate, lobster gnocchi (AMAZING) and ended with the banana bread baked Alaska. The baked Alaska and gnocchi were life changing! Highly recommended for anything from a date night to a girls dinner!",0.9514,0.8,0.2,0.0,0.8779166666666668
2015-03-28,5.0,"Bistro Dre is a cozy, ""neighborhoody"" space with very good food. The kitchen isn't super inventive, but that's okay -- sometimes the tastebuds call for high quality standards (like a caprese salad or steak frites) that are tried and true. Combine that with the ability to bring your own drinks, plus the owner's charisma and humor, and this place is just super cool. The caprese salad (I just heard that somewhere?), pumpkin ravioli and mushroom tart were excellent; the lobster bisque was good. And the banana bread caramel desert was every bit as good as it sounds. It's restaurants like this that give Chicago a ""charm"" in the dining scene. Go here. Seriously, just go here!",0.9788,0.703,0.238,0.059,0.7192857142857142
2015-03-23,4.0,I just love this restaurant! The restaurant itself is so quaint and comfy. The staff are all unbelievably nice and helpful. The owner is always present and interacts with all of the patrons. The food is really good and comforting. It's the perfect place to go on a chilly night to get cozy or a warm night to sit outside. It's the perfect place to go on a date or the perfect outing for a group. It's such a great little neighborhood restaurant and we're so happy that it's taken off!,0.9905,0.655,0.345,0.0,0.6833333333333333
2015-03-16,5.0,"This place is great. It is a small BYOB place with really great food and service. Their menu is ""family style"", which I am normally skeptical about. However, at this place it works great. They serve it almost like a tapas restaurant where dishes come in different waves, but the plates are not small. The menu is extensive and the more people you go with, the more you will be able to try.  The waiters & waitresses are great. The owner is pleasant as well. This place is as good as a 4-5 star restaurant AND is about half the price (BYOB is great). Update: So incredibly sad to see this place closed down. It was one of the best restaurants in the city + BYOB option. Best of luck to the couple that owned the joint. They were so welcoming to such a great spot.",0.9938,0.678,0.286,0.036,0.5469806763285024
2015-03-08,4.0,I'm from out of town so my cousin thought this would be great for brunch before I leave. The food was awesome! And it's byob which makes it cheaper. The only thing lacking was service. We never got checked on. Getting anyone's attention to get some hot sauce was difficult. My cousin said normally it's better. But overall great lunch spot!,0.9335,0.735,0.215,0.05,0.73125
2015-03-01,5.0,"The best brunch in Chicago! So many unique brunch options, it's BYOB and has a great atmosphere. What more could you ask for?",0.8622,0.699,0.301,0.0,0.61
2015-03-01,1.0,"First off, these are not small plates.  We ordered the roasted beet (Just blah.  I expected more interesting flavors for $17), poutine (absolutely disgusting), and the steak.  We did know the steak was entree sized, but assumed we weren't ordering too much since we expected only a few bites from the two other orders.  From the menu it appeared that the concept was small plates, coming out as they were ready, shared by the table.  The beet came out within minutes of placing the order, so we started the meal by feeling we were being rushed.  We were only half way through when the poutine was ready, which would have been fine if both plates were staying on the table.  Apparently, however, we were expected to chow down on the beet, because our plates were removed and replaced with clean ones for the poutine.  The waiter then informed us that the steak was on the way.  Are you kidding?  I hadn't even finished  my first glass of wine and the meal was halfway over?  My husband asked him to slow it down and was given an annoyed look and told, ""it's already cooking.""  The waiter came back a minute later and said they would hold it after all.  What 'hold it' meant, apparently, was to keep cooking it until we were ready, turning our request for 'medium' to decidedly well done.  We had tried to eat the (just really gross) poutine, just because it seemed wasteful otherwise, and so were full by the time the steak arrived.  (Again, if the misnomer 'small plates' were not on the menu we would not have ordered three.)  The waiter didn't ask why we were asking for a doggie bag for steak with two bites eaten, as he clearly didn't care about our experience at all.  We were rushed in and out in 45 minutes, and even that was dragged out at our insistence.   The rest of the restaurant seemed to be having a wonderful time, so I don't know if it was just our waiter, if they wanted our table (the restaurant was full), or a combination of both.  Even if our experience was isolated, it was a terrible dinner all around and we both left in irritated moods. Thank goodness we stumbled across the Belmont Burlesque Review at the Theater Wit, which saved the evening.  Highly recommended!",0.9828,0.838,0.115,0.047,0.450248538011696
