date,star,text,compound,neutral,positive,negative,subjectivity
2016-10-02,1.0,IT'S CLOSED!!  We made online reservations on Saturday morning (10/1) for dinner that evening.  We also received a text confirmation in the afternoon confirming our reservation.  When we showed up the restaurant was closed with the windows papered over and the inside had boxes packed up.,0.0,1.0,0.0,0.0,0.1
2016-10-01,1.0,Had reservations to this place tonight but it seems it's closed down.  Place was dark and no one was there. Tried to call and the number was temporarily unavailable. Would advise people not to go here in the near future. Perhaps someone from the restaurant can explain if they're closed or,-0.3291,0.92,0.027,0.053,0.2356481481481482
2016-10-01,5.0,"One of the few remaining hidden gems in the Lincoln Park/Lakeview area. The food is fantastic, the service is friendly and it's BYOB - can't beat it. My family goes there multiple times a month for dinner and their delicious brunch. Oh and if the wait is too long, go hang at Heritage next door and enjoy a great cup of Jo.",0.9571,0.752,0.248,0.0,0.44833333333333336
2016-10-01,1.0,"Went last night, even made a reservation, but restaurant was closed. A neighbor said it appears to have closed for good. Will be missed, was a great BYOB!",0.8398,0.636,0.283,0.081,0.32333333333333336
2016-09-29,1.0,"Unfortunately, it seems this restaurant has closed. My reservation was reconfirmed ( by Yelp) minutes before but when we arrived, the lights were dark and the door was locked. Too bad, we were looking forward to it.",-0.7543,0.841,0.0,0.159,0.5416666666666666
2016-09-29,1.0,"We made a reservation on Yelp for 6:30 Wednesday 9/28.  Yelp sent an email confirmation and then a text reminder one hour before the reservation.  We walked in the rain to Bistro Dre, it was closed.  We are not happy campers.",-0.4585,0.927,0.0,0.073,0.55
2016-09-22,4.0,Good BYOB brunch spot.  Fast service and good food!,0.7263,0.535,0.465,0.0,0.6000000000000001
2016-09-07,1.0,"I'm giving this one star because they never gave me a chance to actually have dinner here. My wife made a reservation for my birthday because we were excited to try Bistro Dre after talking about it for so long. We even were sent  a confirmation email. Sounds good right? Well, we got to the restaurant with the rest of our party and....they were closed. A sign said they were closed for the next two weekends! They obviously knew they would be closed when they took our reservation and when they confirmed our reservation but left us hanging anyway. I may try again but after this treatment, I'm not sure what to expect from the rest of their service. Very disappointing!!",-0.5688,0.856,0.076,0.068,0.42747165532879816
2016-09-03,2.0,I like the place and decor but the food was pretty bland. Was with a group and i think we all agreed on that. So in my opinion pretty pricey for the quality (poor flavor although presentation was good). Desserts are good though and it is byob which is always a plus for me.,0.9505,0.728,0.272,0.0,0.7722222222222221
2016-08-24,5.0,"We stumbled here after being given the run around at another restaurant just down the street.  SO glad we did!! We had driven from the burbs to meet another couple to go to a BYOB dinner.  We were all dressed up,  had our wine, we even had a reservation (at a different restaurant) and we were ready to EAT and spend money!  Al saw us walking down the street looking kind of lost and asked if we had a reservation.  ""not here"", we all kind of laughed, and told him about the nonsense that Las Tablas had just put us through across the street. He immediately made us feel at home.  He moved around reservations and sat us immediately.  Tahvia, our server, was there instantly with waters and wine openers/glasses. Another server was there with bread (precut and served resting on a layer of olive oil and parm cheese). Tahvia was wonderful at making suggestions, pouring drinks and being delightful the entire evening.  It is a rather small, no, quaint place.  Small would sound like I meant crowded and that it is not.  The portions are generous and the food is delicious! We hada few apps which we all shared.   Mushroom tartlett: variety of mushrooms on a puff pastry with mild cheese sauce on the side Baked Brie with points, two jams, walnuts and grapes Entrees: My friend and i split lamb gnocchi. Served in a terrine and almost stewlike with diced carrots and peas.  Still had some leftover. Mussels in a wonderful broth with shrimp and andouille sausage (again SO much food!) Steak Frites: perfectly cooked new York Strip with just seasoned french fries. I would definitely suggest stopping in to see Al if you're walking down Lincoln.   Ah!  An owner who understands how to run a business dependent on customers! Thanks for saving our evening in the city, Al!",0.9902,0.834,0.139,0.027,0.5430695847362514
2016-08-22,1.0,"I never write negative Yelp reviews. I work in search engine marketing and know how damaging they are to local businesses. That said, our dining experience at Bistro Dre was such a breathtaking fiasco that I have to make an exception. That evening, my girlfriend and I had tickets to an 8 PM show at the Athenaeum theater & decided to eat an early dinner. We chose Bistro Dre. The place was empty at 6 PM, so we got a table right away. 2 hours is more than enough to have a relaxed dinner, right?  (...right?!) 6:00. Bistro Dre is BYOB so the server directed me to a ""liquor store"" a block and a 1/2 south. I left my girlfriend to peruse the menu & ventured into the heat for a bottle of wine. I walked a block and a half. Then walked 2 blocks. Then walked some more. 20 minutes and a bucket of sweat later, no sign of a liquor store.  Hot and flustered, I returned to the restaurant empty-handed. Where was this place, again? ""Oh,"" said the server. ""It's a bar. They sell 'package deals.'"" 'Package deals,' huh? OK. I went out a second time to a dive bar down the street and, sure enough, they sell wine by the bottle to restaurant patrons. I had to wait an eternity for the barkeep to fetch it from the dungeon. 6:15. Before I left the second time, we placed our order & the server upsold us into a grapefruit salad. Why not? Grapefruit sounded good on a hot night.  6:30 In the space of 5 minutes, the place filled up like a tank of piranhas. Our server disappeared into the morass.  6:55. 25 minutes later, our salad arrived. It had two anemic grapefruit slices and was riddled with cubes of tasteless watermelon. No dressing. No sign of our entrees. At that point, we were starving so we horfed the whole thing. 7:15 - 7:30. Guests who arrived 45 minutes after we did finished their meals. My girlfriend and I could tell something was wrong, but still enjoyed ourselves. Until 7:30 came and went, that is. Still no sign of our entrees or our server -- she forgot us or went into hiding. Or both.  Finally we flagged her down. We're on a schedule, we said. She looked like she'd seen a ghost. ""Let me see what I can do,"" she whispered and disappeared. Again. 7:50 PM -- 10 minutes to showtime.  20 more minutes went by. Though we were hungry & half-drunk after sharing a bottle of wine with nothing but an anemic watermelon salad, we canceled our order. I found the server & delivered the news and my credit card. I've never canceled a dinner order at a restaurant in my life.  The second I sat back down -- of course -- an older woman appeared with our dinners. They looked delicious. I politely turned her away. On the lady's heels, like ballet, our server arrived with our bill for the small salad. The bill was for $17.  She rung it up with incredible speed. 7:55 PM. As we prepared to go, an older gentleman appeared at the table -- the owner, Mr. Bistro Dre himself. ""You realize when you have tickets to a show, you need to show up to the restaurant a few minutes early, right?"" he said.  My girlfriend and I blinked. ""We've been here for almost two hours,"" she said.  He appeared confused. ""The waitress said you were here for 24 minutes?"" then went on to throw his server under the bus, accused her of incompetence and of lying to him. She was standing right behind him and heard every word. (It was obvious she had said no such thing.) ""The food looks great,"" I said. ""We're just out of time."" He softened a bit when he saw we weren't that upset. ""OK, here's what I'm gonna do..."" he said with a magnanimous air and offered to comp the salad. ""She already rang up the card?"" said my girlfriend. The implication was clear.  ""Oh,"" Mr Bistro Dre shrugged, missing the cue. ""OK.  Well... we'll see you again!""  He gave a wan smile and lumbered off.  *** Why am I writing all of this? Mostly for a laugh, but also for a few serious reasons: 1. My girlfriend was a chef and I worked in the service industry for years. A manager should NEVER berate staff in front of patrons. At best, it makes you look like a lousy boss. Mostly it makes you look like a schmuck. Did the server cock up our order? Yes. Did she deserve to be humiliated by her boss for that in front of the customers? No -- a thousand times, no.  2. Though our server made some mistakes, she knew how to operate a credit card machine. Mr. Bistro Dre apparently does not. That we were charged $17 for a salad and a nonexistent meal isn't just appalling. It's funny! 3. I'm aware it's wise to eat early before a show -- that's what we attempted to do. Pro tip, Mr. Bistro: don't insult the intelligence of your patrons, esp. patrons that have received bad service & are being good sports about it. It leads to reviews like this. 4. We hope our poor server finds a better job. There are plenty of other places to wait tables in town. Life is too short to work for such a crappy boss.  So no, Mr. Bistro, you won't see us again. Unless it's at a bistro in Hell. You're off to a great start. :)",0.9217,0.788,0.105,0.107,0.47081298331298327
2016-08-22,1.0,"Food on point, service well beyond subpar. We went for brunch on Sunday. I'd made a reservation ahead of time, but there were still some open tables around. Relatively small place overall. BYOB, but CASH ONLY.  We were seated right away, but then we were just in limbo for over 5 minutes. We had empty glasses, 3 bottles of champagne, and contemplated what to do. After 5+ mins, the waitress came around and asked if the other server had come by.. obv not so she said she would be ours. Filled us up with water and then disappeared again for 5+ mins. Came back with ice bucket and champagne glasses. We asked for OJ and she disappeared again for 10 mins. We flagged down the other waiter and asked for a small glass of OJ. FINALLY after 20+ mins of being there we could start drinking! Unfortunately, they bring the OJ in a small glass which makes it IMPOSSIBLE to pour into champagne glasses. Please invest in small carafes Bistro Dre. I'd read about getting free banana bread when you sit down, we waited plenty and got nothing. The table next to us got service and banana bread within 5 minutes. WTF? What's up with the inconsistency? For food, we ordered croissant with nutella and fresh berries and a variety of dishes (Caprese Benedict, Smokes Salmon Benedict, Chicken and Waffles, and Salmon Hash). The Nutella croissant was amazing. Perfect way to start (or end) the meal. My Chicken and waffles was alright. Half a waffle and 2 pieces of chicken. The crispy skin would not stick to the chicken so by the time i was done with half, half the plate was filled with breading. The benedicts got great reviews from the table. The hash was meh. One of the benedicts and the hash both came with WAY overcooked poached eggs. The yolk was completely cooked. We asked for more eggs, which they brought on the side. But common, if you're going to serve brunch at least make your poached eggs correctly.  I had intentionally left my second half for leftovers. Asked our server to pack it. She brought the check and I asked about the leftovers and her response was ""oops"". Again, WTF?  Overall, we were very very disappointed with the service. The service was ridiculously slow (they were NOT that busy), we had to wait 20+ mins just to start drinking our mimosas, we weren't given the complementary banana bread, and they threw away my leftovers that i'd asked to pack. We will not be returning.",0.8114,0.847,0.085,0.069,0.5367813051146384
2016-08-21,4.0,"Best peach pie EVAR. But let's get something out of the way from the start. Don't go to this wonderful, quaint BYOB gem with an attitude or in a hurry. They are NOT your mama! Be smart. Plan ahead. And take a few bottles of decent pinot noir and un-oaked white of some sort because Chef Andre has really come a very long way since their humble beginnings.  See, we've loved this spot for so long... way back when it was the former Las Tablas property. Yeah. Long time ago. And Bistro Dre has really turned this into one of the best casual bistro styled restaurants Chicago's seen. But let's talk about that food! When Bistro Dre first opened we were naturally excited to have anyone try French styles with a BYOB policy.  While we appreciated the fried chicken waffles and mac n cheese dishes back then, it's what Chef is doing these days that strikes an incredible contrast to those earlier menu items. Check out the pics! Peach pie:  Luckily we ordered a few lighter dishes that made it possible to devour not only the best peach pie I've ever masticated, but maybe on of the best pie a la modes had in recent times. Savory, flakey crust. Fresh, exceptional peach slices that are certainly not from that industrial sized can of cling that the local elementary is slinging. is that creamy, slightly vanilla ice cream home made, hand cranked? Damn near wriggled out of my seat from a powerful mouthgasm, virtually hitting the 3ft tall spoon and fork hanging by the front door. Good gawwwdh. :o Asparagus ravioli: Unfortunately we showed up very late in the evening and missed both the lamb gnocchi and fried chicken offerings but maybe we won because this dish would put MANY of Chicago's 9,874 italian-theme restaurants to utter shame. The pasta was super delicate, fresh and the asparagus flavors so beautiful spring like and green. The chopped bits of whole kernel corn in the broth were just the touch. What a wonderful dish and it certainly went well with our pinot noir and unoaked chardonnay. Bacon crusted whitefish with quinoa: People who truly know me understand that I gave up pork back in 1991. However, reality dictates that most French styled restaurants like many Chinese places will definitely be quite heavy on the bacon fat, etc. I eat massive quantities of delicious fish and Chef Andre really knocked this dish out of the park. Grand slam. Everything came together. Super crispy, buttery crust while keeping the white meat tender and flavorful. Chopped fresh green onion really helped express the dish's elegance. Not big and bold but delicate ambrosia, for sure. Spinach and apple salad with baked goat cheese: Honestly, I wanted to slap my friend for coming along with me to a French restaurant and pushing hard order a damn salad. Insulted. But damn he was right on the mark with that call. Bistro Dre trotted out a tub of delicious spinach, bordered by almost Bosc pear like apple sliced lightly drizzled with tasty balsamic and that soft, pillowy puck of goat cheese just scattered a tasty universe of flavor, flanked by candied pecan and cranberry. What a salad! Wanted to lick the bowl. I feel quite ashamed for not leaving the south side as much as I used to after encountering such fantastic meals like this one. :D",0.999,0.716,0.229,0.056,0.5333564045773348
2016-08-16,5.0,"Plate-licking delicious! As we had been snacking at the Cubs game and could only get an early dinner reservation, our party of 4 ordered 3 starters to share.  - Roasted Beet Stuffed Beets, aka ""Beets by Dre"": Whimsical name aside, the flavors of this dish are out of this world. It was umami-intense with the balsamic and pistachio pesto, and the meaty beets were the perfect vehicle for the awesome sauce.  - Mushroom Tart: The tart is a puff-pastry rather than a pastry base with a filling. But the mushrooms were so earthy and nutty from the truffle oil and herbs. The brie fondue was served in a gravy boat so that you can control your cheese intake. - Scottish Potato Pancakes: The pancakes tasted like mom's cooking, with a dense center and crispy exterior. The capers, caviar, and creme fraiche were the perfect layers on top that provided salty and creamy contrasts.  We also shared the key lime pie and the triple chocolate fudge cake, which were SO decadent. Both are served with ice cream (mango sorbet with the key lime pie and chocolate ice cream with the latter) and generous heaping of whipped cream and fudge. Two desserts are plenty for a group of four and were the perfect end to a delicious meal.",0.9892,0.83,0.17,0.0,0.7374999999999999
2016-08-11,4.0,"We dine out a lot and I booked a reservation for a group of our friends to try Bistro Dre because we heard such good things about the food and we were not disappointed.  It was also BYOB so it was an added plus.   Food:  Excellent!  Very fresh ingredients and nice presentation and all entrees came out at the right temperature.  The  fixed prix menu was outstanding with great variety and our first waitress/hostess did a great job explaining our options so we knew what to order for the group.  We ended up having family style portions with were more than enough for the table. *Roasted Beet Stuffed Beets - We were intrigued when we saw it at another table because it looked like a ""huge"" dessert.  We ordered it  and everyone loved how fresh it was not to mention the generous portion.   *Spinach + Apple Salad - was very fresh and had a great light balsamic vinegerette dressing.   *Fig and Prosciutto Flatbread - very generous portion and all ingredients were so fresh.   *Steak and Frites - Very flavorful but the steak was a little tough probably because we ordered it medium plus. *Braised Lamb Pappardelle Pasta - Very flavorful with the most tender meat.  The blend of vegetables and pasta with the sauce made you want to lick the bowl.   *Spa Salmon seared filet  - with asparagus, tomatoes, corn, hearts of palm, lemon garlic vin was so light and flavorful.  It was the best salmon we have had in a long time.  There wasn't a morsel of food left on any of the plates.   We were so full we couldn't handle any dessert although it looked good! Ambiance:  The restaurant is small but very conversant friendly. It is decorated in a country French theme and is very cozy.  We were thrilled that we didn't have to shout to be heard. We found the surroundings were very inviting and appreciate that it was not over the top glitzy as many restaurants tend to lean towards and charge you appropriately for it.  It had a a charming neighborhood feel so we felt relaxed and dined at a leisurely pace even though it was completely filled on a week night. Service:  We started with one waitress/hostess who was very friendly and helpful and then transitioned to another person who waited on the table.  The second person did not appear to be in a good mood and wore a scowl throughout the service and seemed to be annoyed when she learned the first waitress already explained the options.  However, she she did handle her responsibilities but we didn't feel she was very approachable.  This is the only reason I gave the rating a 4 star.   Overall, it was a great dining experience and we would definitely go back. It was a great find!",0.9983,0.79,0.197,0.013,0.5497448979591837
2016-08-03,2.0,"Wasn't super impressed with this place. The Mac n cheese lacked in flavor, needed salt, and the cheese sauce had a grainy/floury texture. It also comes with a $17.50 price tag which is a little crazy for how bad it was. For 17.50 I had high expectations. The steak in the steak frites was over-charred and had a very bitter flavor. The parsley butter on top had an overpowering parsley taste and texture with little salt. I would say overall the dishes are lacking flavor and salt. The rhubarb strawberry pie dessert was delicious, but they left the ice cream out which was a huge bummer. I know I got the dessert to go, but a warning would have been nice to set expectations. Service was slow and inattentive for an non busy weekday.  If you're looking for good upper-scale American/bistro food in a casual setting I'd head down the street to Farm Bar which in my opinion is better not to mention cheaper. Overall a Weak Play.",0.6542,0.762,0.128,0.11,0.5638131313131315
2016-07-25,5.0,"Great food, BYOB. Cute French decor and nice staff. Go for a date, dinner with your mom, or brunch with a group. Always excellent!",0.9312,0.564,0.436,0.0,0.75
2016-07-07,2.0,"I had very mixed feelings about this brunch, on one hand it's BYOB, but on the other hand the food and service were just not there.  We went over a holiday weekend so it's possible that their normal staff was off that day or they were shorter staffed than normal but there was only one waiter and he seemed very confused, he spent most of the meal eating his own food in the back of the restaurant and didn't know how to handle the fact that we kept asking for a little more time to look over the menu as we were catching up and chatting. I ended up ordering the quinoa hash and here's where things started to get strange. I clarified that as I was ordering it gluten free it would not come with the breakfast pastry and the waiter agreed. However when I did get my meal there were clearly cornbread crumbs on one side of the plate as if it had been put on and then removed. Now this is not a huge deal but I was annoyed that I had to basically avoid an entire section of my dish in case there were crumb but I didn't want to send something back at this point. Another weird thing was that one of the poached eggs had been way overcooked and was essentially hard boiled. Again, not the worst thing but not what I was expecting. The worst thing was definitely finding a hair in my food, it was small and curly and 100 percent what you do not want to see in your breakfast. I flagged over the waiter and sent it back and he still seemed confused. At least when I got it back the crumbs and hard boiled egg were gone! Although the yummy roasted potato slices had been replaced by soggy French fries in the second iteration of the dish so not sure what that was about.  Overall I liked that it's BYOB but after a brunch that was more uncomfortable than anything else I don't think I'll be back.",0.9359,0.808,0.107,0.085,0.5335138888888888
2016-06-16,2.0,"Judging from reviews, the food was supposed to be stellar. My fiancee and I chose this place for our 5 year anniversary. I ordered the Steak of the Day and she chose the Steak and Frites. The reviews on yelp all complement the steak very highly and we couldnt pick just one. I terribly regret our decision. We both ordered medium, they both came back well done; virtually no pink meat whatsoever. Both steaks were mostly gristle. Her steak was at least one cut of meat, my steak came in 3 separate parts, and all of them were about 60% inedible. I suspect the restaurant ran out of steaks and gave us the last bits of meat they had left over, hence they were overcooked in an attempt to hide flaws? Thats the best case scenario. In either case, by the time I had finished, I think the majority of the ""steak"" was still on my plate from all the gristle I refused to eat. I would have much rather been told they don't have any good cuts of steak left than be served left over and over cooked cuts. They also have the nerve to charge an upcharge for ordering steak during the prix fixe menu (despite the sign up front saying ANY entree for $25, with the ANY being underlined). I had no problem with this when I was expecting a great cut of meat cooked to order, I think I'd have enjoyed a steak at outback more.  Credit where its due, the wine sauce on the steak of the day was great.  The service was also very good, the woman who served us did a great job answering questions and was very polite. The desserts were also great. Key lime pie and angel food cake were both awesome. They get 2 stars only because there were at least some redeeming qualities, had the main course been good (or even, edible) this would easily been a 4 if not 5 star experience. Maybe we were there on an off day, but I certainly was not getting the same steak as all the other yelp reviews.",0.7641,0.859,0.071,0.07,0.4915224089635855
2016-06-14,3.0,"Food is pretty good,  but this place needs a good cleaning.  Made 10am reservations, so we were the first in the restaurant that morning.  It was difficult to fully enjoy my breakfast at the window seat while seeing 2 dead bugs crusted over on the windowsill and another one eating crumbs that were also on the sill. The floors were pretty gross, too. It's a shame, because the food is pretty good, but multiple bugs next to my brunch plate simply won't do.",0.7642,0.618,0.225,0.157,0.527891156462585
2016-06-14,5.0,"This is my favorite restaurant in Lakeview. On separate occasions, I've taken my grandparents here, my family, a couple of girlfriends, a first date. It's never let me down. I believe it's family owned and operated. All desserts are homemade by the chef's mother. The menu rotates so don't go in there with your heart set on one thing. The waiter's recommendation is usually spot on.",0.4588,0.954,0.046,0.0,0.46805555555555556
