date,star,text,compound,neutral,positive,negative,subjectivity
2015-12-07,1.0,"It took over 1 hour and 20 minutes to receive our order. I even watched while the driver struggled, with what it appeared to be over 15 orders, to find our order. The food was more than cold; it was almost like taken out of the refrigerator. After we spent several minutes warning up our food, the taste was not even good, nor appropriate for a restaurant. If I wanted to have this kind of experience, I would have gone to a supermarket and grab something from the frozen food section. My advise, if you have a choice, dio not even think about ordering delivery from this people. I know, I will never order delivery again from them. Yes, the driver was educated and perhaps the experience at the restaurant may be better; but, delivery is horrible no matter how you look at it. Sad, very sad. I'm glad I don't own this restaurant.",-0.9089,0.803,0.067,0.13,0.7
2015-11-16,4.0,"This was myFirst time trying this place, and i went thru yelp. My first experience was good. I tried the steak tacos & chicken tacos, with steak & chicken flantas. They both were good, but I enjoyed the chicken tacos & chicken flantas, because it had more flavor. There guacamole & chips was a perfect taste as well. They close late & will go again.",0.9437,0.761,0.239,0.0,0.7393939393939394
2015-11-11,4.0,We dropped by here one late night after a recommendation from a friend to fill a mexican craving. This was located in Bridgeport Chicago and parking was pretty easy to find. The Mexican food was delicious and authentic. They were super busy even on a late night and their service was mediocre. They were very busy with just takeout. Would return again!,0.9531,0.755,0.245,0.0,0.595
2015-11-06,2.0,"The rice had Lima beans in it. Kinda odd. Everything else was just alright, nothing special.",-0.3105,0.675,0.104,0.221,0.4107142857142857
2015-10-21,5.0,"So I got take out from this place the other day when I was too lazy to make lunch. I got an order of the nachos and they were out of this world. Steak, Jalapeños, Sour cream. I got it to go and it was good. Do you know how hard it is to get Nachos to go and have them still be good?? I also had a steak taco which was great. I will definitely be going back and dining in",0.8767,0.804,0.151,0.045,0.4962962962962963
2015-10-20,5.0,"Their chips and salsa are to die for!!! I absolutely love their tacos, burritos, and horchata. The only thing that I dislike about this place is that they have a credit/debit minimum, but overall, this is the only place that I go to for Mexican food. Nothing can compare to the way they flavor and season their meat. Open later hours is a plus for times when its midnight and you don't want to cook and your stomach is grumbling.",-0.4044,0.885,0.034,0.081,0.4428571428571429
2015-10-14,1.0,"I ordered for delivery around dinner time. It took forever to arrive( around an hour) and when the food got here it was cold. I ordered several tacos (al pastor and steak) and they were soggy and just not very tasty anyways. In addition, i ordered a tostada de ceviche de camaron and it's supposed to be ceviche. I've ordered this before and it was something totally different. what i got was a gross mass of sour cream, lettuce, and plain shrimp. Also from my experiences prior to this one, i always ordered for pickup at least 15 minutes before. A lot of the times i would get there and I would have to wait another 10 minutes. What's the point of me ordering over the phone then? I will never come here again. There are better places than this.",-0.0516,0.955,0.022,0.023,0.32571428571428573
2015-09-28,3.0,It wasn't good bad we had the tacos. I had the al pastor and chicken taco. I think their fair.,0.4106,0.665,0.228,0.107,0.7791666666666667
2015-09-15,3.0,"I would love to give San Jose five stars... but their service is terrible. Pick-up and delivery definitely take priority (this would probably be the way to go if you want to try their food), but if you choose to dine-in, be prepared to wait way too long for your food. The wait staff is inattentive and sometimes rude, and your order may even be forgotten.  My last visit was surprisingly less accommodating than any other. The madness of deliveries and pick-up orders toward the front of the restaurant was unpleasant and actually distracted my waitress enough to leave my food waiting at the counter for about ten minutes (we had already been waiting 30+ minutes after ordering). My chicken fajita (usually to die for) had burnt onto the sizzling pan because it didn't get to my table in time for me to stir it up a bit. The two previous times I had ordered this dish, the serving size was double the amount, not burnt, and was served with a side of beans, rice, lettuce and some avocado. This time, though, the serving was pretty skimpy, burnt, and only served with the beans and rice (which are consistently amazing). When I asked the waitress about the lettuce and avocado, she just kept saying ""Extra, it's extra,"" as if I was bothering her (probably from taking her away from figuring out what the heck was happening with the deliveries).  Needless to say, I only tipped about 5% this visit. Although the food was abnormally horrible, it's usually fantastic and definitely worth the lack of service this place has to offer. I won't give up on it yet.",-0.926,0.787,0.088,0.124,0.5240384615384616
2015-09-03,3.0,The food was good but I didn't get my tres leche when I ordered and I paid for everything before it was delivered,0.2382,0.907,0.093,0.0,0.6000000000000001
2015-08-12,5.0,Best burritos in Bridgeport! Love the vegetarian burrito and milkshakes.,0.8655,0.479,0.521,0.0,0.44999999999999996
2015-08-04,5.0,"It's pretty much become my go to mexican place, granted i did just move literally 1 block away, but it's good and quick and cheap, i usually just get one (or many) of their $2 tacos, ive had tripe, lengua, chorizo, carne asada and pastor, all good, and perfect for a quick snack, and also the chicken quesadilla is very good, and its BYOB! tho i havent had time to eat there yet, also the horchata wasnt bad either, im sure i will be returning often in the future!",0.9789,0.715,0.266,0.019,0.5787847222222222
2015-07-09,2.0,"I came here and ordered 3 tongue taco dinner. The tongue had no flavor, no taste. It was like I was eating just the tortilla. My friend had the steak tacos which were better. If you come here, stay away from the tongue tacos.",0.6369,0.735,0.176,0.09,0.5
2015-07-02,5.0,"Pizza or Mexican?  That's always the question, isn't it?!?! Well, let me just start with this I LOVE FOOD AND FOOD LOVES ME. I am a constant YELPER when it comes to trying new food. Running around hungry after the NLC-National FBLA conference award ceremony tonight I figured what would be open at 10:30 PM?  I looked on YELP and remembered that I had bookmarked a Mexican Restaurant due to the reviews. When I called and asked if they delivered to the Hyatt Regency McCormick she checked with someone and affirmed that they did. She was very very helpful and knowledgable of the food items. She then made a few suggestions based on my food restrictions (no shellfish or red meat), just cheese and chicken. She quickly accommodated me with one of the cheese filled potato MASA quesadillas and a chicken tostada which were  bomb.com  insanely delicious!  Now you have to understand something...I am from California and I am VERY spoiled with my mother's Argentine cuisine and the local Mexican restaurant where I live. Like I said I know food, so you can understand when I say food is good here I mean it is OUTSTANDING! The pico de gallo and guacamole were like no other Mexican restaurant I have ever been to. CHUNKY AND FRESH!! By the time I got to the lobby the driver was there at the concierge desk--he was quick concise and to the point. It was very nice. I've been to quite a few cities-- London, Buenos Aires, and San Francisco--and I can say that I truly love Chicago for visiting this first time and this restaurant added the cherry on the top!   Take my advice go for the Mexican if you're debating and forget about the pizza! Oh, all of it including tip and the BEST horchata I have ever had was $25.00. Can't speak for the dine in experience but man, this place ROCKS! See you soon, Taquería José!",0.9817,0.872,0.115,0.014,0.43599153297682713
2015-06-14,3.0,"The food at this restaurant is about average.  My family ordered dinner through  grubhub.com . My husband wanted a burrito suizo but we did not get any sauce with his order. I ordered a chocolate shake but the restaurant put cinnamon on top. I wish I would have known prior to ordering the shake, I would have opt-out on the cinnamon. Basically I am saying all of the menu items do not have details. However my steak torta was delicious. It would have been even better if it was not a little soggy around the edges.",0.9109,0.812,0.147,0.041,0.48333333333333334
2015-06-06,4.0,"Late night food fare, tasty and filling just the way I like it. I didn't find it to be greasy as some people reviewed. I was very nervous after reading reviews. It was late and we had already sat down. It was priced pretty decently and I left very full. The waitress was very nice and very attentive. I think the only issue we had was that it was roasting like a fire put in there!! The waitress was roasting too and kept apologizing!",0.795,0.795,0.136,0.068,0.6518686868686868
2015-05-27,4.0,This is my go to Mexican place for home delivery. Their shrimp fajitas are delicious! My dine in experience wasn't so great. It was cinco de mayo and there was a ton of delivery orders it was hard to get the attention of the staff although there were only 2 other tables with customers.,-0.2802,0.837,0.063,0.1,0.611111111111111
2015-05-23,2.0,Super nachos with steak are tasteless. The chicken quesadilla is flavorful. Wish I would have just gotten the quesadilla.,0.765,0.708,0.292,0.0,0.8388888888888889
2015-04-25,1.0,"Worst service ever. They're so unorganized. I called for a pickup order for a couple tacos. I waited 15 minutes to leave my house. When I got there I still had to wait 15 minutes. It takes a half hour to make two tacos?? If it wasn't so late I would've gone somewhere else. And when you get there, they act like they don't know what you're talking about when you say you have a pickup order. Horrible service and their bathroom was disgusting the last time I went there.",-0.8767,0.833,0.028,0.139,0.638888888888889
2015-04-20,2.0,"The food was just ok.  The service was slow and pretty inattentive. Major points off for having a TV on broadcasting garbage talk shows. Isn't there a soccer game on somewhere in the world?  Did I go to San Jose on one of its off days??  Honestly, thought Taqueria Mexicana was so much better in terms of service and ambience--which isn't really saying a lot.",0.9026,0.825,0.175,0.0,0.5499999999999999
2015-04-13,4.0,"Dined here a couple times and ordered the chilequiles with chicken and green sauce at the first visit and steak tacos at the next. The chilequiles weren't the best I've had but they were still very good and very filling. The serving was huge! The steak tacos were very tasty and you could tell that the steak had been marinated very well. I love a Mexican restaurant that has pickled carrots and cauliflower in a big container right beside you. I've also tried one of their juices; I forgot which one it was, but it was very good and fresh. For cheap and delicious Mexican cuisine that's open late night, go to Taqueria San Jose!",0.9843,0.761,0.223,0.016,0.4656689342403628
2015-04-11,1.0,"i've ordered with them 3 times and each time there was some odd shenanigan with the order process. first time I was far outside the delivery zone (was notified after I processed the order) and I would need to give the driver an additional tip, second time same thing but they didnt require the delivery premium, the third time and last time I ever order from them, the order didnt come at all, I called the restaurant an hour and thirty minutes after ordering food to find out that my order was marked as delivered. TSJ reached out to the driver and said the food was delirvered to a woman (not a woman) and that there was nothing that could be done about it. I contacted the web portal I ordered with (eat24) and they refunded me my money because TSJ refused to do anything more that give me the drivers number (wtf?) so I could speak with the driver about who he gave my food to (again, wtf?) I will never, ever order from there and I would recommend no one else either unless you like receiving terrible service.",-0.4956,0.888,0.05,0.062,0.45576923076923076
2015-04-08,2.0,"I ordered through GrubHub two days in a row and I promise it was like night and day!!!! I ordered the Shrimp and Garlic and Guacomole the first day and the shrimp was flavorful and had plenty of sauteed onions, garlic, and peppers. DELICIOUS! The guacomole was creamy and had lots of flavor. However, on the second order of the same entree, there was no sign of onions, garlic, or bell peppers in the shrimp although it was flavored. The real disappointment was the guacamole. There was SOOOO much onion that you would have thought I had ordered onion dip with a side of avocado and there absolutely no flavor. There must be two different chefs so I have to catch the right chef or I won't be ordering again. I really enjoyed my first experience but the second prder really soured my overall experience.",0.6406,0.896,0.067,0.037,0.3876700680272109
2015-02-10,5.0,"I'm giving this place 5 stars for a few reasons. They have your typical run of the mill food, buuuuuuut they also have some unique items. The masa quesadillas are something I've never seen before, simply delicious and inventive. Even better that they are made fresh and you can choose your filling. As a vegetarian, I'm always looking for Mexican restaurants to go beyond the zucchini taco. This place has potatoes, rajas and a few other things. They also have a fantastic juice bar and desserts. Will definitely come back.",0.9485,0.818,0.182,0.0,0.49807692307692303
2015-01-21,4.0,"The food is delicious and very authentic. I have tried the ceviche tostada, the guacamole, the tacos. Their portions are pretty big. They also squeeze fresh juice. I've tried the strawberry one and it was refreshing. The service is very slow though. You'll be waiting for 45 to an hour for your food. Don't be expecting a short lunch break.",0.8481,0.857,0.143,0.0,0.6743750000000001
2014-12-14,4.0,This place is so cheap and has great food. I went here today for a quick bite. They were fast and tasty. I got three pastor tacos and guac and chips. It costed $11.70. So much food. My girlfriend and I split it all and were full for hours. Granted this isnt my favorite mexican place but it is a great pit stop if you are in the Bridgeport area [and looking to save some coin].,0.8875,0.778,0.168,0.054,0.5611111111111111
2014-11-05,2.0,"Pros: Cheap, open late, nice staff, online ordering Cons: Lackluster food. The vegetarian burrito was basically a tortilla filled with bland rice. The interior has an interesting and slightly unpleasant aroma like mildew. Maybe it's due to growing up on the west coast and living in Arizona for a few years but I'd call this mediocre Mexican at best.",0.863,0.78,0.191,0.029,0.5967948717948718
2014-10-18,5.0,I ordered delivery.took a little while cause driver got lost but staff was very sweet. Food was very traditional mexican. Was great and glad I gave them a try.chicken flautas were perfect.beans a little salty but very creamy.u get pickled mexican veggies with each order as well.,0.9523,0.668,0.302,0.03,0.5411111111111111
2014-10-12,5.0,Outstanding authentic food and service. Veronica and the rest of the staff were very gracious to our party of 5. Highly recommend.,0.9244,0.574,0.426,0.0,0.61625
2014-09-19,2.0,Since I've  been on an Al pastor binge I read the reviews and wondered what was up...I read the good and bad reviews and I try to disregard the bad to still try it. Ordered 3 al pastor tacos with cilantro onions lettuce and tomato by far the greasiest Al pastor I've tried so far AND there also was a bug crawling around in my food (like a fruit fly or gnat) the two bites I ate before the bug citing was pretty decent but the bug threw everything off  Prolly won't go back,-0.25,0.892,0.044,0.065,0.7222222222222222
2014-09-13,5.0,"Customer service is the best that's why I gave the stars, my husband loved the steak super nacho, but my chicken taco salad was not good at all. I absolutely hate shredded chicken with bell peppers as an entree, meal just becomes soggy with broth. Yuck! The servers are the best though;)",0.6115,0.665,0.205,0.13,0.7185185185185186
2014-08-03,4.0,"Love It!!! They have great customer service, friendly delivery guys, and all around great Mexican food. There are not many words except, Try it, you'll love it!!",0.9718,0.512,0.488,0.0,0.5285714285714286
2014-07-24,4.0,Cheap eats; huge portions. It will take you a week to finish the super nachos.,0.7351,0.659,0.341,0.0,0.7555555555555555
2014-06-29,2.0,"I do not like the fact that I've had to ask for water and chips and salsa because the server was negligent. I love jalapeños and carrots but unfortunately they serve soft, less fresh ones here. I really dislike the chicken tacos- the meat did not have much flavor. It's always annoying having to wave down the server because my table was my checked on. I gave it 2 stars because I like that they offer fresh juice on the menu, and I also like its 24 hours and BYOB",-0.8675,0.748,0.077,0.176,0.5050505050505051
2014-06-18,4.0,"Went here at 2 am after a few drinks. I ordered just one al pastor taco with cilantro and onion because of the generous offering of chips and dip upon dining in. Don't think the waitress/cashier was too happy about that. Given my tiny order, service wasn't exceptionally prompt. Everything was drenched in oil, especially the tortilla and chips. However, the taco filling was delicious and fresh tasting, though greasy as well. What can you expect for $2... Bottom line: great prices, not so great food, and I won't be returning unless I've had a few.",0.9729,0.783,0.217,0.0,0.6699999999999999
2014-05-24,2.0,This is a good p lace to go if you are drunk and want to get drunker because you can byob here.  Have had much better Mexican Food .  It is always way to hot in there also.,0.5719,0.765,0.175,0.059,0.5900000000000001
2014-05-14,5.0,"The chips served during table service are legit. Fresh, tasty, and the salsa is on point as well. Really loved the tacos, reliably tasty food. And super cheap. No complaints at all.",0.8221,0.599,0.288,0.113,0.6666666666666667
2014-04-14,5.0,"Cheap and yummy. Steak Burrito was a bit greasy from the meat, but tasted great. I also got some tacos..lettuce, onion, cilantro and meat. Just how I like it! About $1.60 each? (I forgot). Friendly staff",0.9493,0.649,0.351,0.0,0.65
2014-04-06,3.0,"I'd say that there are many better places to go for Mexican food, but my stars are for the fresh juice.  Pressed on order, choose one of their combos or make your own.  Very tasty.  Staff is very nice, too.",0.8418,0.804,0.196,0.0,0.5428571428571428
2014-04-06,4.0,"Excellent mexican food, was starving after the White Sox opener went here and ate like a king, I had the steak taco dinner which came with brown rice and beans, my two drinking partners both got steak burritos, which they didn't complain about at all..will be back again...drunk I'm sure leaving a White Sox game.",0.7789,0.778,0.176,0.046,0.326984126984127
2014-03-09,4.0,"Tacos, guacamole and tortilla chips are amazing.  Love the lemonade!  You can not go wrong if your looking for great tacos; chicken and beef",0.9427,0.572,0.428,0.0,0.82
2014-02-24,5.0,Simple Mexican goodness. Steak nachos have been a favorite for years. Al Pastor tacos are my newest addition to an order. Take out is quick & easy and ladies working are awesome & friendly. Now take debit/credit over $15.,0.9451,0.657,0.343,0.0,0.5986394557823129
2014-02-19,3.0,"first of all I cannot go 5 stars. That would be the best Mexican restaurant around.  2nd I can not go 4 because I feel this place can be better. I do love the burritos.  Good size, steak is cooked well.  But when I ask for one with extra veggies they never seem to understand what that means.  Extra lettuce and tomato ect ect...  They seem to always give me extra meat. For some people that's not a complaint.  But not this guy, sorry.",0.9546,0.78,0.22,0.0,0.3194444444444445
2014-02-05,3.0,"This is my go-to for delicious Mexican food. The food is absolutely delicious (and greasy) with massive portions. HOWEVER, I have never had good service here. You practically have to beg for a refill and the waitresses don't even seem to like any of the customers.  Last time I was there I was asked to get up and pay for my meal right after I started eating. I wouldn't normally have a problem with this, but my waitress interrupted our conversation to ask us to pay. 5 star food, 2 star (at best) service. For a really long time I've been assuming that the waitresses are having an off day, but considering I've probably eaten here 15+ times, I just don't think that's the case.",0.1965,0.873,0.067,0.06,0.5552380952380953
2014-02-05,4.0,"My absolute favorite thing here is the al pastor tacos. So good.  The prices are great and the horchata is huge and tasty. My husband and I often (ok, always) order the nachos especiales with carne asada. It is so unhealthy but so tasty. I don't think I have ever had anything here that I didn't like. Ok, maybe not the torta--the bread seems like a very stale jumbo hamburger bun, and I've had it several times. But it's not inedible, I've just had better.  The table service is just ok but I don't normally have high expectations for places where you have to walk to the register to pay. Basically, I love this place. Al Pastor!",0.8777,0.748,0.161,0.091,0.6193333333333333
2014-02-02,2.0,Little pricey I think and did non not have updated menu,0.0,1.0,0.0,0.0,0.5
2014-01-14,5.0,"I highly recommend this restaurant. It's inexpensive but very fresh, clean and friendly. The chips and guacamole are unparalleled. The steak tacos are so delicious it's hard not to order seconds. The staff is really friendly and they can customize everything according to your tastes. Bueno!",0.977,0.587,0.382,0.031,0.633095238095238
2014-01-13,4.0,"Great place for delicious and inexpensive Mexican! They are open late, it's BYOB the staff is very cool and pleasant and always helpful.  With tacos you get a choice of onions and cilantro, or tomatoes and lettuce,  and they come with complimentary carrots and 2 kinds of hot sauces, the verde is my favorite!  The meat that I've had (chicken, steak and pork) has always been tender juicy nicely seasoned and none of the nasty fatty chewy parts that sometime find their way into your 2am tacos at other joints. Maybe I've just been lucky, but then I'm really lucky because I've found myself here a lot in last five years!  Great smoothies too!",0.9802,0.761,0.239,0.0,0.6563157894736843
2014-01-04,5.0,"I love Taqueria San Jose. As a college student, this is definitive as the neighborhood grease spoon that's open late. The four of us go in and share the nachos supreme (I'm not sure if this is the name exactly) and it is a giant plate. Delicious, unhealthy, and basically cheese, beans, carne asada (choose your meat, I recommend the steak though!) on top of their homemade tortilla chips. I love their salsas that they keep in easy squeeze bottles on the table. The horchata is plentiful and vey reasonably priced. I've had the torta, which was only okay.",0.968,0.718,0.236,0.046,0.6837301587301586
2013-12-29,5.0,"LOVE IT! This place is cheap and delicious. The service is great and the portions are GIGANTIC!! If you like inexpensive Mexican cuisine, I cannot recommend this place highly enough.",0.9432,0.568,0.382,0.05,0.5916666666666667
2013-12-12,5.0,I absolutely LOVE this place. It's really close to my home and they are open late which is convenient when I have late night cravings for Mexican food. The staff is always super friendly and the food is ready within 15 min or less. If you haven't tried already what are you waiting for?,0.9416,0.764,0.236,0.0,0.42333333333333323
2013-11-22,3.0,"Random stop the other night while walking bars in the area.  Many of their late night patrons were also at the bars nearby.  It took about twenty minutes waiting on ordered burritos.  Two in hand and they were heavy!  In a drunken state, the burritos were pretty good.  The following day my cousin texts to tell me the burrito was excellent.  I wasn't as sure but you see my cousin (is the type that) doesn't believe there is a such thing as bad pizza.  If I say it's cardboard with cheese, he says it was okay.",0.3206,0.816,0.108,0.076,0.5946581196581197
2013-11-10,4.0,"If you are looking for some cheap Delicious Mexican food than look further. The portions are huge, the food is cooked just right and the staff is quite nice.",0.8439,0.741,0.259,0.0,0.6622448979591837
2013-10-07,5.0,"I wish I could give t his place 10 stars. The mother & the daughter of this place are super sweet. Tacos are bomb! They are quick, cheap & filling.",0.7712,0.616,0.29,0.094,0.6291666666666667
2013-09-20,4.0,"This place is cheap and located very close to my house. The food is good. Service is great and the waitress are friendly. Come here for the burrito and horchata, plus this place is open late!  There large horchata are huge! Great place to get a Rumchata party started!",0.9646,0.676,0.324,0.0,0.602857142857143
