date,star,text,compound,neutral,positive,negative,subjectivity
2017-09-03,3.0,"Ordered a selection of tacos, a burrito, beans and rice and tostadas for delivery. The tacos and burrito were very good. Beans and rice were too spicy for one of us to eat. Delivery, even though it is local, took long past the estimated time given. Yelp had to contact the restaurant after so much time had passed.",0.4927,0.945,0.055,0.0,0.326
2017-08-17,1.0,"Food tastes ok. Better worth driving into Pilsen for better Mexican food. The portion of the Nachos are huge though.   The younger girls at the counter has attitudes. My boyfriend and I waited patiently to get seated and after 10 minutes of chatting to each other, one of the girl told us that we can sit anywhere...with an attitude! I don't mind the chatting but they could have made the effort to tell us to get seated rather than making us wait.  On top of that, I paid for cake to-go at the register when I paid for my dinner. The girl at the counter attended to other customers, while we waited 15 minutes for the cake as we stood there.  Talk about service. (￣^￣)",0.7959,0.912,0.088,0.0,0.375
2017-08-07,5.0,"My boyfriend lives in Brighton Park and I live in the West Loop and this is the only taco place we go to. We've been coming here for about 5 years, either dining in or doing delivery for at least 1-2x/week. Sadly they don't deliver to the west loop anymore. Their tacos are consistently great. I've tried all their different types and there are no wrong choices. Even their tripas are good when you mention you'd like it well done. Service is also great and speedy. Parking is easy to find. Honestly no complaints, except please please please expand your delivery zone again.",0.9501,0.66,0.239,0.101,0.7484848484848484
2017-07-23,4.0,"There are several spots in the neighborhood for tacos but this one is my go-to. Authentic, inexpensive, simply good tacos. There's not much else to say about it. There's no ambience, which is probably why a lot of people I know prefer the place where all the cops go across from Freddie's. But the tacos here are far better. And they make fresh fruit smoothies. I've never had one, but worth mentioning.",0.8807,0.804,0.161,0.035,0.45625
2017-07-05,2.0,"So I came here today with my husband and I used to love this place but now I'm disappointed. I used to love their rice and beans but today I was so disappointed.  I had the taco dinner and since now they cook the beans with chili I cant have that anymore, since u can't take spicy food. So the food came and to my surprise the rice was undercooked. The tacos were good but can use more work.  My husband had the burrito and it was ok no surprise there. I loved their beans but like I said I can't eat spicy and it sucks i can't have those anymore.  The service was good, but the girl in the counter has some attitude problems, like girl chill. The two is for the fries that were decent.",0.9593,0.673,0.219,0.109,0.6060606060606061
2017-06-28,5.0,Great local taco place. The al pastor on corn tacos are incredible. Love the huevos rancheros. Juke box comes on super loud every time I'm there,0.9217,0.653,0.347,0.0,0.6194444444444445
2017-05-24,5.0,"Awesome little Mexican restaurant. I ordered the green chicken enchilada plate and steak tacos for my husband. I ate off of the enchilada plate for 2 days, they give you so much food. My husband's steak tacos were delicious. Very inexpensive, we spent under $20, (thank you GrubHub for my 520% off coupon)",0.8316,0.86,0.14,0.0,0.4833333333333333
2017-05-23,3.0,"This is a good late night joint in Bridgeport b/c they stay open late. The food is pretty good & tastes authentic. Although I tend to order take out, the restaurant is a nice size with ample seating",0.8957,0.718,0.282,0.0,0.70625
2017-05-20,4.0,I ordered delivery on a cold rainy evening. I ordered nachos which came hot crispy and delicious. Because of minimum order I Also ordered a burrito with Mexican sausage which I wasn't exactly sure was. I saved it for the next day. It was really good reheated. This will be my go to place from now on.,0.8142,0.776,0.167,0.056,0.6198412698412697
2017-05-19,4.0,"This is probably one of my favorite to go to spot for tacos around Bridgeport. Not too far from home and its located in a nice neighborhood. The staff is very kind and the service is also very fast! I ordered the taco dinner and the loaded nachos. It was just beyond filling that I even took it home and ate it the next day (it was still good.) You also get free chips and salsa dip as soon as you are seated and they also have seasoned carrots and peppers to eat with your meal. Their horchata is great! It is not too milky, or watery, and the cinnamon isnt overwhelmin either but can still taste the awesome flavorings.  I ordered the taco dinner (chose carne asada) and the plate comes with 3 tacos with everything on it (onions, cilantro, tomatoes) rice and beans. Very filling and definitely worth the $10. I definitely recommend anyone that was to grab a bite or is craving tacos. It is also BYOB and they are open past midnight! Free parking after 10 PM",0.9867,0.825,0.175,0.0,0.6252941176470589
2017-05-09,3.0,"Solid food, the first time I've been back since my college days a few years back. Normally we used to order the supreme nachos with alll the fixings way back when. Today we got the taco dinner (carne asada, al pastor, and lengua for me). Great flavor for the carne asada, al pastor, the lengua was a little bland but just add salt. Ask for the lengua extra crispy fried longer on their griddle. Decent portions, on par with lots of other Mexican food prices in Bridgeport. Came with rice and beans which were not the best but no complaints. Always get a large horchata it's delicious",-0.1783,0.814,0.094,0.092,0.36099439775910364
2017-04-20,5.0,This is one of my favorite spots I've found in the area for tacos. I've ordered delivery 4 times and every time they package everything where it's in a neat order. Food comes hot and always correct. I highly suggest giving them a try. Horchata is really good.,0.8973,0.771,0.229,0.0,0.7475
2017-02-24,5.0,"As a local this is one of my go to places and it's my first choice for Mexican in Bridgeport. It started just because it was open until 4am. But it blossomed into me not wanting anywhere else. Burritos,  tacos,  nachos,  enchiladas all have tasted great with any meat. Their horchata  is standard and tastes great,  and it's BYOB If you feel like having a brewski with your meal. They deliver, serve chips if you dine in, and accept credit cards if you spend over $10. The staff are good, being very standard servers. One time a friend brought a bottle of wine,  and they had to open a never used wine opener for us,  but they didn't mind.  If you're on the South Side,  and want great Mexican food,  look no further than San Jose Taqueria!",0.9441,0.832,0.149,0.019,0.36025641025641025
2017-02-24,5.0,"We ordered take out pretty close to closing, which is always a gamble. The food was fresh and delicious. My flautas were still super crunchy when the food arrived!",0.9245,0.642,0.358,0.0,0.7916666666666666
2017-02-18,5.0,"I've been here a couple of times. It's great how late they're open! I had a steak burrito the last time me, my fiancé, and daughter went and it was THE best burrito I've ever had. Their steak tacos are also amazing! The staff is extremely nice and laid back. Most definitely going back there, that's a given! I've also recommended to many of my family that if they're looking for some good Mexican food to check this place out!",0.9752,0.742,0.258,0.0,0.4440476190476191
2017-02-15,5.0,"I can't say enough good things about this place. Open late, great food, very friendly service, byob. Love it! Always taken care of here. Thank You!",0.9491,0.481,0.458,0.061,0.6
2017-01-28,4.0,"Very greasy but this is not particularly a bad thing. The food is delicious. My favorites are their chicken enchiladas, anything al pastor (greasy but good), their pickled carrots peppers and onions, and that sugar milk from the gods HORCHATA!",0.9342,0.733,0.267,0.0,0.7033333333333334
2017-01-15,5.0,"Our constant go to place for tacos in the area. we usually do pick-up. They always get the order right  and the food is prepared quickly. Sometimes they get busy. They also open late.  The meats are pretty good. I usually get steak torta, shrimp ceviche tostada, taco dinner, horchata. I'm a big fan of the avocado on the shrimp tostada. The torta bread is toasted perfectly :) the rice is tasty. The sauces are good. They don't really disappoint. Good and convenient so we keep coming back.",0.9599,0.751,0.223,0.025,0.492296918767507
2016-12-27,2.0,"Usually pretty standard mexican food. I just got some food from them today. I got the burrito suizo dinner. There was no ranchero sauce on it just melted cheese which is a bummer because if I knew they were gonna jip me I would have gotten a normal burrito which is 10 bucks, suizo is 12. I got al pastor and the meat was burnt and tough, it did not taste like al pastor at all. The rice it came with wasn't cooked all the way it was crunchy. I had to make sure I checked my bag this time because they always forget something, by time I get home I am to tired to go back. This time they forgot my zanahorias en escabeche. I support this place too much to be getting crap quality or missing items. I will most likely never return to this restaurant. Especially since 18th is much closer to me and there are tons of places to choose from.",-0.7789,0.843,0.049,0.108,0.5214814814814814
2016-12-22,1.0,"They are really taking advantage of the gentrification in the area. They charge for every single thing now. It's a late night drunken food type. If you can go to Comales on 18th or Archer ave, go there instead! The carrots are almost always smelling fermented. Like they been prepared a long time ago and have been sitting at the bottom of the container.  Now they charge for them. You never know if they're going to be good until you get home and open them! The girl at the front was young and rude. They food takes forever!",0.7546,0.871,0.1,0.029,0.4392857142857143
2016-12-17,2.0,"This was my 1st time ordering from this place and it was not a very good experience! I did place the order through GrubHub and had it delivered. I had a missing item in my order so I placed a call to the restaurant. First person I spoke with was not very friendly, did not apologize for the mishap and just offered me a credit. I was also placed on hold multiple times as I was trying to explain that I wanted the amount refunded  to my card for the missing item. I was getting upset at this point. I called back to confirm that the item that was missing from my order was refunded to my card. The back round noise was so loud that the 2nd person I spoke with could barely hear me. Not a good 1st impression for a 1st time customer...",-0.9077,0.837,0.031,0.132,0.2306776556776557
2016-12-14,4.0,"I'll agree with other reviewers on two things the service is hit or severely miss and the steak is not bomb.  However, the chicken and ground beef is amazing. The picadillo tacos are my fave. I also like he chips and guacamole. If I'm feeling cheap I'll get the chips and salsa - also bomb. The prices aren't too bad, either.  I always pick up my order since I live so close, so I can't speak for delivery service.",0.9404,0.712,0.237,0.051,0.6819444444444445
2016-12-12,5.0,"My go to Mexican restaurant in Bridgeport (and in general). It's interior is modest and nice for a late night, post drinking meal, but not much more. However, for what they lack in aesthetic, they make up for in food. Whether it's Tacos, fried quesadillas, nachos, tostadas, etc., it's all fantastic. Greasy and flavorful, they don't skimp on portion sizes. This can make some of their meals messy, but it's worth it. To top it all off, they have an excellent horchata to wash it all down.  Prices are cheap to reasonable, depending on what you want, but I almost always have leftovers.  I've introduced many of my friends to this restaurant and all of them have had nothing but good things to say. So if you're in the area stop in stop in for a meal or get delivery. I've never had to wait longer than 45 minutes whether it's just for me or larger group orders.",0.7344,0.799,0.118,0.083,0.5640522875816993
2016-11-16,5.0,Come and support these mom and pops...my new favorite spot for some delicious steak tacos and chicken tostado...love this small joint!!!,0.8827,0.637,0.363,0.0,0.7609090909090909
2016-10-21,1.0,"My boyfriend, roommate, and I have frequently ordered from this place consistently for the past year and a half. We ordered a torta, tostadas, tacos, and horchata from them. The delivery guy gave us our food, but without the horchata so we called the delivery guy, but he didnt pick up. Of course, we called the restaurant directly and told them our situation.  The woman who picked up the phone said that she would speak to the manager and call us back. After 20 minutes of not hearing from them, we called again and the same woman picked up the phone. She said the delivery guy gave us the horchata and did not believe us when we said we didn't get it. They even said they would send another one if we paid for delivery. But we didnt even receive it in the first place. We told them that this was ridiculous and her words were ""yeah this is ridiculous because you got two bags."" Yea, she pretty much told us we were liars. The delivery guy will probably just find the horchata in the car, drink it, and hide it. Never felt so unfair and never ordering here ever ever again!! All i wanted was the horchata that i paid and ordered for. :( Tl;dr, TERRIBLE customer service. Find a different taco place that gives you your horchata!",-0.9736,0.857,0.028,0.115,0.5390625
2016-09-20,1.0,"I would give the food four stars, but the customer service zero or a negative amount if that was an option. I ordered from here a few times until they messed up multiple parts of my order. I ordered their nachos and they have just basic nachos and ones that have more toppings. I also wanted cheese on my vegetarian tacos. I called over the phone and specifically asked the girl working if they came with cheese. She told me yes but then realized she was wrong. I had said many times I will pay extra if necessary but I don't like them without cheese but she insisted since she made the mistake the cheese would be free. Well how nice of her. ...except when I received my food a lot of the toppings were missing, including the cheese on my tacos and every item was wrong. I figured I'd call and they'd simply replace anything they had messed up. Wrong again. I spoke to a manager who proceeded to say he'd bring the toppings only and only if I paid extra for the cheese. What? First of all, the food would get cold by then. Any self-respecting restaurant would replace the wrongly made items. So I ended up on the phone with this guy for a half hour while he told me how replacing my food was not in his power. I got so frustrated I threatened to wheel my butt down there (because I was in a wheelchair at the time) to complain and if I had to I'd call an authority or my bank to have them forced to refund us. He kept insisting his chef would never make so many mistakes, but he definitely did. It was at this point that he finally called the store owner and agreed to replace the food as long as we hadn't eaten it yet. Problem solved, but not without extreme frustration and the decision to never purchase anything from here again and to inform my friends and family to do the same. Oh and I hadn't even noticed the missing guacamole on my nachos till way later but it wasn't worth the oxygen.",-0.9902,0.766,0.071,0.163,0.4851774042950514
2016-08-30,1.0,I waited over an hour for my food and finally gave them a called. The receptionist was very rude and told me to call eat 24. I tried calling Eat24 but they never pick up. Next I called the restaurant back and she hang up on me! Do not come here.,-0.3482,0.95,0.0,0.05,0.445
2016-08-25,3.0,"This place is hit and miss. You might have good service if you go on a night when the more mature gals are working. Some nights the service is questionable (as in, how is this place operating?). As far as ordering through a delivery/pickup service.. There always seems to be some chaos. The food is great but you have to know what to order. Chicken anything is delicious here! The nachos, burritos, enchiladas... I read another review that said it was dry and as many times as we've been here never experienced that. No ""vegan"" choices but you can make almost anything vegetarian. They also serve fresh juice at a great price but only a few folks know how to clean and operate it.",0.9723,0.774,0.189,0.038,0.684375
2016-08-16,4.0,The food was flavorful and tasty and it was a sizable order that's the reason why I always come here they also have real fruit drinks,0.0,1.0,0.0,0.0,0.30000000000000004
2016-08-10,2.0,"Typical taqueria. Our intention was to hit Nana at the corner but it was a Tuesday and they were closed. We had already paid for street parking so let's make it count.  Stepped into San Jose and sat ourselves. It was clean enough, not very busy, and the waitress hooked us up with some fresh chips and a pretty bland red salsa. We put our orders in, steak burrito dinner (no lettuce please) and wifey ordered tacos. Our food arrived a short time later... A couple things about my burrito. 1) DO NOT CUT MY BURRITO IN-HALF. I'm a big boy and should I not be able to handle it, I'll have my wife cut it in-half for me. 2) I'M DINING IN YOUR RESTAURANT - NO NEED TO TIGHTLY WRAP MY BURRITO IN FOIL. I get it... If I were taking my burrito for a walk, this would make perfect sense - However, I'm sitting at a table and it just looks stupid for a burrito to show up wearing foil for a sit-down dinner. Once I undressed the burrito I realized it was oozing refried beans like everywhere. It was a HOT mess. I grabbed my first bite of it's steamy goodness but came up empty for anything remotely textured as steak in mi boca. Tasted fine so I went for the next bite...  Again, no real subsistence or steakiness to it. I finished up and was left feeling robbed of steak. I think it was in there because I tasted it - However, the seem to pulverize the steak to a point where someone with no teeth would be able to suck it down a straw (in combination with the fact that the burrito was tooooo OVER-BEANED). None the less, they do not steak burrito very well here. I would think they're trying to cut corners and save money - I never really saw a piece of steak fall from my burrito, just mushy beans dripping out.  My wife's stated her tacos al pastor were average but nothing to get giddy over.   We probably won't return to San Jose... until I'm 85 and can no longer chew my own steak.  Clean place and friendly service earned them 2 stars.",0.866,0.801,0.111,0.089,0.42981487466781587
2016-07-21,4.0,"I haven't been to the restaurant but we do order from here. Here are the highlights: AMAZING carne asada tacos. They have so much meat in them we really enjoy them The salsas are really delicious The price isn't too bad considering the amount of food you get The delivery has been early each time The not so good: The chips weren't very good, although we did enjoy the salsa The guacamole was very thin and felt like it was more of a liquid sauce than the usual guacamole The pastor tacos were okay, but not great We'll definitely be ordering from here again.",0.9533,0.664,0.224,0.112,0.5964444444444443
2016-05-29,1.0,"Don't waste you time or money! First of all it took 20 mins until me and my 3 friends to get a cup of water, mind you it was not busy at all and we had to ask the waitess for a glass a water. Then they get our order wrong and when my friend told them that she did not want cheese on her torta or beans the lady simply scrapped off the cheese and handed the plate right back to her. The only positive was their Jamaica agua but we will not being coming back.",0.6425,0.883,0.085,0.032,0.39716450216450216
2016-05-28,1.0,"Way to go, Indian waiter who works there illegally and the waitress on duty Saturday night for giggling at me and then offending me by asking my age. You guys should be ashamed of yourself for not having been taught something about customer service. I was uncomfortable throughout sitting there watching them giggle as I was alone, on phone, speaking to a friend about her serious issues. I used to come to this restaurant because Bronzeville is where my journey started in Chicago 3 years ago and this Taqueria was the first restaurant I ever visited. They had a fabulous, dedicated manager back then. Where is she????? I moved elsewhere but I made it a point to stop by whenever I am passing by the area, and no, not for the food because it's become really trashy and hurts your stomach -- I went there for the Tres Leches cake which they order from outside. This was my last time. Shame on you both weirdos.",-0.9486,0.791,0.057,0.152,0.4240740740740741
2016-05-10,3.0,Very good food and they really do give you a lot! I enjoy that unlike most places they give you not only salsa but also an array of spicy pickled vegetables. I also enjoyed the steak burrito. service was good and they are open pretty late too which is nice! But for the third time in a row my order was wrong or something was missing....,0.9543,0.682,0.267,0.051,0.5950000000000001
2016-04-25,5.0,I always come here! Literally always. I don't know why I've never checked in. This place is amazing. The food here is very good especially the tacos. I will definitely be checking in more often ( I should have at least 15 check ins here LOL).,0.8746,0.792,0.208,0.0,0.6828571428571429
2016-04-11,3.0,"I like this place - good steak tacos. But every time I order off grub hub they screw up my order. The first time, they left out one dinner all together, and the second time they actually have my order to someone else. I came in to get my food and they said ""you just came in to get it?"" Obviously my presence there showed that I did not come to get it... So I had to sit and wait for them to remake the whole order . Also, it scares me that they have health code violations..",0.3818,0.904,0.056,0.04,0.2761904761904762
2016-04-07,1.0,"Mediocre, expensive ($5.00 delivery charge??),skimpy with their asada. I've had better, real Mexican food and Horchata.  Disappointed. Never ordering from here again.",-0.1431,0.759,0.11,0.131,0.5900000000000001
2016-03-16,2.0,Food is good but the service is horrible. Placed an order and waited over an hour until I decided to call them and find out that they didn't bother to make the food even when I had already pre paid for it.  Then I get told that it was now too late to deliver.,-0.3063,0.838,0.079,0.083,0.7333333333333334
2016-02-29,1.0,So the one time I decide to order delivery online I had the worst experience. Ordered around 10:20pm and waited past the 45 min-60 min wait time. Attempted to call the restaurant several times only to hear a busy tone on the other end. Contacted Yelp to get a update and they told me to wait another 10 mins. 20 mins later the food Finally arrives. While I finally got my order. It was missing my drink item it was a little upsetting after waiting almost an hour and a half. The food was mediocre. Have had better authentic Mexican at other spots.  Ordered 4 tacos  Intestine was bland Ground beef and pork were the only tacos to taste decent And chicken taco tasted really dry Also ordered a steak burrito with intestines for my girlfriend and she only ate half and said it was mediocre.  Ordered a horchata as well but they forgot that.  Side note: been about 40 mins since I ate the food and my stomach is bubbling now.. Sorry but I will not be ordering here ever again.  I distinctly remember the food being better in the past.,0.2135,0.921,0.039,0.04,0.5701149425287355
2016-01-28,2.0,"I just ordered a taco dinner from here. For a  taco dinner and delivery was $16.00. The food came cold, and they poured hot sauce all over the food when I got it. I do not like hot sauce. The meat was sub par, and didnt have any flavor to it, and came cold. I was not happy with their food and would never order from them again. There delivery charge was 3.50 which i think is very high when most places are $2.00.",-0.6259,0.936,0.0,0.064,0.8431428571428572
2015-12-31,2.0,"Overall, not good.  Homemade chips were good.  Guacamole had too much lime and really no avocado flavor.  Queso fundido was oily as hell to the point where it almost instantly separated.  Tostadas showed potential.  Shells weren't doubled, and the grease saturated the single shell they provided quickly, too gross to even bother with.  I had no choice but to scrape all of the toppings off, tossing the tomato that I specifically requested they not include in the first place.  Asada and pastor had great flavor but the heaping pile I was left to eat them from left little to be desired visually.   The chilies rellanos tacos were a mistake, but for reasons I can't even begin to understand for such a straight forward dish.  Salsa was unmemorable.  Take a pass.",-0.317,0.807,0.074,0.119,0.35912698412698413
2015-12-08,5.0,Food is amazing. The burrito is one of the best I've had. The tacos are pretty good too. I would highly recommend getting the tres leches cake on the side.  Staff is very friendly.,0.9656,0.57,0.43,0.0,0.665
