date,star,text,compound,neutral,positive,negative,subjectivity
2017-08-08,2.0,"I lived in Miami for 2 years so I was excited to try Siboney. As we walked in, the music was loud - it looked like they had a large family party. Too loud for my ears though I so love the music. We waited for someone to acknowledge us for about 5 minutes and when we were, we sat outside. The service took a VERY LONG time. We ordered empanadas to start and ordered our entrees at the same time. We waited a half hour for the apps and I hoped that they weren't bringing everything together because we were starving. I went inside and the waiter was behind the bar chatting away with someone. He saw me and said oh, I'll bring out your food! another 10 minutes pass by - I think he forgot to put the order in. Empanadas were good but had minimal filling. I was excited to have the whole red snapper but it was terrible....overcooked so it was dry and there was zero flavor. Hello salt? pepper? garlic? And if you see the lemon slices in the photo, they look nice but very hard to squeeze. I ate what I could since I was starving. My friend described his pork chop as pedestrian and very fatty.",0.944,0.85,0.114,0.035,0.5323370927318296
2017-08-01,1.0,This place is supposed to be open and it is CLOSED. There is another group here that is just as confused as I am.,-0.3182,0.905,0.0,0.095,0.4333333333333333
2017-07-24,4.0,The soup and Cuban sandwich were very good. The only reason I didn't give 5 stars is because the fries were just okay,0.624,0.789,0.211,0.0,0.7600000000000001
2017-07-09,5.0,"I have passed this place for so long that it was finally time to stop in.  A really great decision.  The service was fantastic and the food was pretty damn delicious.  We ordered the sangria and the waiter nicely suggested that we get a pitcher.  Yikes.  It was delicious, but huge for $25.  Needless to say we were pretty well buzzed when we left.",0.9413,0.669,0.284,0.046,0.8291666666666666
2017-07-06,5.0,"SIBONEY CUBAN CUISINE...2165 N Western. THURSDAY NIGHTS as of July 2017 - went back this week because the cocktails last week were..so good. I am picky, I know how to make a drink, these are Perfectly and Deliciously made....so I went back, sampled a few, I also had the tostones with Shrimp, again Delicious!! and there was good salsa music provided by Frankie J and FreddyFresh LC... a Very nice night all around.  Definately my cocktail place when I want a 'beautiful' drink.",0.9665,0.748,0.252,0.0,0.5305555555555556
2017-07-02,4.0,"I've been here twice for their salsa events. The dance floor is a little small and they could easily remedy that by pushing the tables back. This review is mainly for their food which is delicious and has good vegetarian options. I'm not a fan of their mojitos, which are made with both Sprite and sugar, which makes them a bit sweet for me, but they're strong, so if that's your thing...",0.8741,0.819,0.162,0.019,0.5611111111111112
2017-05-31,5.0,"Great service, food was amazing... i will definitely come back. I'm from out of state..",0.7783,0.638,0.362,0.0,0.5375
2017-03-04,2.0,"Came in on a Sunday and it was pretty empty, about 5 other people in the restaurant. They offered a buffet, but we wanted a la carte. There were two servers and the service was incredibly slow. Everything we wanted they didn't have, I wanted sangria, neither red or white, all the vegetarian dishes they had with soy beef, they didn't have, vegetarian sandwich, nada. So we only ordered drinks....all this took place in an hour for three drinks and for them to tell us they didn't have any of the food we want on three occasions.  I would have to give this place another chance for it's food, but can't say that I want to after that time eating experience for one drink.",0.6249,0.926,0.062,0.012,0.46785714285714286
2017-02-19,3.0,"The service was a little slow. The appetizers were highlight of the meal. The drinks were good and accurately priced. However, the entrees left little to be desired. The vaca frita was over cooked and tasted burnt. The Plato Sorpresa was over cooked as well, including the shrimp.",0.804,0.823,0.177,0.0,0.4388888888888889
2017-02-18,1.0,"I'm so disappointed with this place. The first time I came I had and awesome experience. I understand the that weekends are busier, I used to be a server my self. I'm just so expected a least our server to be more attentive, not only did we wait over 2 hours for our meal. No one came and to notify us of the delay. I understand that the kitchen get backed up... But as a server, I would let my manager talk to the costumers to calmed them down. I'm so embarrassed because I told my friend about this place and they where all upset with me because we waited so long to get our food. You guys really need to work on that. Other than that the food was great. Management at this place was useless.",-0.1114,0.784,0.103,0.113,0.535515873015873
2017-02-11,1.0,"I went to Siboney as part of a group of 7. We arrived at a half full restaurant on a Saturday evening.  Our waiter initially took our drinks order but then proceeded to forget about our table.  We had to wave him down after about 30 minutes because he never came back to take our food order.  After waiting at least an hour for the food someone again flagged the waiter down to ask about the delay.  Rather than apologizing for the wait we were told 'it's very busy' and 'blame the kitchen not me.'  A couple of my friends requested to speak with the manager.  The manager was extremely rude and provided no apologies or explanation.  There was no offer to bring us bread or anything while we waited.  I ordered one of the sandwiches which was supposed to come with beans and fries.  When my food arrived the waiter stated, ""we don't have any fries, these are yucca"" and plopped down my plate - no other comment.   This is not how you treat customers if you ever want them to return.  I would never go back or recommend it to others.",-0.9444,0.832,0.043,0.125,0.27902777777777776
2017-01-31,1.0,"Worst service ever. When we walked into the restaurant, it was busy but by no means full. After ordering and getting our drinks, someone from our table had to get up and ask that someone come and take our food order because we had been waiting for so long. Then the food itself took a long time. About an hour and 20 minutes into this, we asked to speak to a manager about the wait. He was rude and unapologetic. Frustrated, my friend who was doing the talking asked if the food would take another hour, to which he replied, ""I don't know."" He said he'd check with the kitchen on our order and get back to us, but that was the last time he came over. The food, once we had it about an hour and a half after sitting down, was actually pretty good, but by that point we were too annoyed by the service to enjoy it. Throughout the evening, the waiter seemed like he was trying to avoid our table.  The slap to the face at the end of this? Automatic gratuity was added to our bill.",0.4118,0.807,0.1,0.092,0.4581481481481482
2017-01-29,1.0,"We had the worst service I've ever experienced at this restaurant.  It took close to 45 minutes and my friend getting out of her seat to flag the waiter over for our food order to even be taken.  After that, we waited over an hour for our food to arrive.  We asked both the waiter and the manager about the status of our food and were met with an extremely rude response.  During the hour plus we were waiting for our food we had no communication from our waiter.  The manager stated that the large party of about 20 people had priority over us despite the fact that when we arrived the restaurant was not crowded.  We won't be going back here.  If I could give them 0 stars I would.",-0.5709,0.888,0.043,0.069,0.5857142857142856
2017-01-27,5.0,Amazing beautiful place! Love going there to listen to great salsa and a Cuban air! The food is authentic and the owners a delight to be with! We are so lucky to have them in Chicago,0.9785,0.534,0.466,0.0,0.8055555555555555
2017-01-26,5.0,Friendly staff and great service. They really go out of their way to make sure you're satisfied.  The staff really do show that they love what they do.  The food is absolutely fresh and delicious!  Bring the family at night for live music and a great time!,0.9815,0.577,0.423,0.0,0.6262626262626262
2017-01-12,5.0,"By far the best Cuban restaurant in Chicago!  The food is excellent, from their complimentary soup to their delicious flan. I tend to always order the ropa vieja because let's face it, it's to die for. I'll be honest, I don't like yucca and I don't know what type of magic they put in it, but theres never any left on my plate. I always have their Cocojito, a mix between a mojito and a piña colada if I remember correctly. & yes, make sure you leave room for dessert.  Their staff is always so amiable and accommodating. Last time I was there it was after my friends showcasing at Sideshow Gallery (right down the street) Our waitress overheard us talking about my girlfriends birthday celebration, which was the night before. She wished her a Happy Belated Birthday and then brought her flan, how sweet of her. Can't wait to go back!",0.9806,0.776,0.192,0.032,0.6086772486772486
2016-11-28,1.0,"I would have to say the service and food left much to desire - I was recently at the restaurant as part of a party of 12, on a Wednesday evening, the only guests in the restaurant I might add. Our server was great about keeping separate checks but that was about it. When asked his list of whiskeys, he was unknowledgeable and unable to offer a drink menu. I ordered my meal with 3 other people at my table and realizing they were half way through their meals, I asked what the delay was with my order, his response, was ""oops, that is my fault, I forgot"", which I was bothered by but appreciated the honesty. My food was prepared and within minutes served, my guajrtito, yes their take on a jibarito, was drenched in oil and fat. I managed to eat some half of it, as I was hungry, by soaking up the fat with my napkin. I let the server know the food was not only late but also not to par, his response ""people complain the fried plantains are dry so the cook put the lechon juice to make it moist"" OIL does not equal au jus. Overall dissatisfied, server showed no care, since a party of 12 implicates and automatic 20% gratuity, I didn't even have the option to NOT tip after the bad service and less than desirable food. Will not recommend and don't plan to go back.",0.6082,0.783,0.118,0.099,0.3717592592592592
2016-09-20,5.0,"Cubano sandwich, ceviche, chicken noodle soup, and holy crap their empanadas were amazing!",0.3595,0.622,0.231,0.147,0.8833333333333333
2016-09-04,4.0,"To be honest I'm giving their food a 3 but their outstanding service takes a whole star. The staff really goes out their way to make sure you have everything your way!!!  Been here on occasions with girlfriends and they all LOVED their dishes. I have had a few different  dishes from here like the camarones al ajillo, the ropa vieja and the churrasco-liked them but have not been impressed.  However, the ONE dish that I do LOVE from Siboney is the shrimp and fish ceviche off their appetizers list. I ask for extra limes because I like it that way but they do a very fine job preparing it. I like it so much I ask for it as an entree sometimes. I love that the ceviche is served with an order of yuca chips. When you go-order it!  I don't do much drinking but after heavy pressure I  Tried their coconut mojito and it was very good!  There's usually a live music event but beware ask to be sat far away from the speakers or even outside if you want to have a descent conversation  because it can get very loud!  Parking-has not really been an issue for me but may be on busy nights due to permit parking in the area.  I would recommend and thinking of heading there myself right now for some of that ceviche.",0.9942,0.766,0.21,0.024,0.534184126984127
2016-08-18,1.0,"Absolutely terrible. Was told our food would arrive at 8:35pm. Called at 9:10 as it still hadn't arrived. Said it would come in 10 minutes. They accidentally called me after those 10 minutes and hung up. I called right back and asked where my food was and then told me it was just heading out. Ridiculous. Didn't arrive until an hour+ after original time. Didn't give any good customer service at all and no explanation but just a ""sorry"". Will never order from here again. Blacklisted.",-0.6485,0.88,0.019,0.101,0.6979591836734694
2016-08-04,1.0,"Great service, but underwhelming food - even disappointing. The Cuban sandwich was not on Cuban bread, had one slice of ham, pork and cheese.  Most like will not go back. If you can't master the basics...",0.2357,0.752,0.147,0.101,0.4875
2016-07-27,4.0,"With a wedding now in the past, I've been longing to indulge in all of my favorite foods again, which I haven't had in months. One of which is a Cuban sandwich. My now husband (feels weird to write) and I went on a Tuesday night and sat on their patio, which was great on a warm summer evening. We started off with some mariquitas de plátano (plantain chips with garlic sauce). The portion size was generous, and they were warm and delicious. For entrees, I ordered the churrasco de pollo (grilled chicken breast) and my husband ordered the Cuban sandwich (which I planned to, and did, eat about a third of..). Both entrees were good. I would likely order the Cuban instead of my grilled chicken next time, but on the other hand we've had better Cuban sandwiches elsewhere. I've found Cohiba Cuban and Havana to be a bit better. Service was very good and we would have no problem returning, but we would probably rather try out some other Cuban places first.",0.9638,0.794,0.16,0.047,0.6085964912280701
2016-07-07,2.0,"The food was OK, but rather tasteless. I think this place is fairly expensive, especially considering the quality of the food that they serve. I would not recommend.",-0.1775,0.838,0.069,0.093,0.7749999999999999
2016-06-19,3.0,We went there on a Saturday night. It was a nice atmosphere. Live music with a great guitarist. We ordered the Tostone nachos and they were soggy. The empanadas where good and the food was tasty. They forgot to bring us bread with our meal but to their defense it was a very busy night. Not the best Cuban in the area but work coming for good live music and some drinks. We were looking forward to dancing that night but they took long to set up the main band.,0.9501,0.818,0.182,0.0,0.5373333333333334
2016-05-31,2.0,"Ordered the steak sandwich. Not bad, but the meat was not caramelized and the fat was not rendered. I thought it tasted OK but the person ordering could not eat it. Tasted like the cooking method led to it being more steamed than anything else, leaving chunks of soft fat on the meat and contributing to an overall off flavor. The fried pork thing was even more disappointing. Dry chunks of pork that had been deep fried (or fried in some other way, without breading or prior pre-cooking), leading to a dry exterior. It had obviously received a marinade or dry rub, but the overall flavor was that of salt. The interior had some moistness but it wasn't very pleasant to eat. The cassava that came with it was mild and provided a nice balance to the overly salty meat. What really made me upset is that they did not include empanadas, then lied to the delivery service, saying they had been put in the bag. It's one thing to forget something, but it's another to lie and refuse to refund the money. I'll get my empanadas back -- I'm thinking a $0 tip order and a credit card charge back are in order -- but I hope this serves as a warning to anyone dealing with this place. Overall, low-quality Cuban food with a side of bad service.",-0.918,0.807,0.071,0.122,0.419927536231884
2016-03-25,4.0,"I had never been here and when my party of 3 walked in at 7 pm on a Thursday and the place was empty, I did not have a good feeling.  Rarely do you find a good restaurant that isn't at least somewhat busy.  I have to say, however, by the end of the meal I was pleasantly surprised!  We had the cheese croquets and the empanadas for appetizers and I had the Camarones al Ajillo for my entree.  The dishes seem pretty traditional...there's no going out on a culinary limb here, but for good solid Cuban food, Siboney is a fine choice.  The service was excellent and friendly, but then again, it wasn't busy.  I asked the waiter where all the were and he said it's a lot busier on the weekends to the point where you need to make reservations.",0.9098,0.781,0.145,0.073,0.5466666666666667
2016-03-19,2.0,"So i had been wanting to try this place for a while because i always drove by it finally did and was pretty disappointed. My boyfriend and I came in on a Saturday night around 845pm place wasn't busy at the time. The atmosphere was nice, live music was great! Someone came to the table with 5 minutes of being seated to fill our water glasses but didn't say a word to us or introduce himself so i assumed he was just a bus boy or server assistant. The same kid came back 15 minutes later asked what we wanted, my issue with this is 1. It took 15 minutes to take our order  ¥which would of been five if he at least stopped by to check if we had questions or explain any specials) 2. He did not even introduce himself to us or be personable with us in any way. So we order the tostones and i point to the ones that say nachos and a side of yuca frita as apps and vaca frira and bisect a la palomilla for dinner. 5 minutes later they bring out complimentary soup and bread fit dinner, both tasted good. Appetizers come out next and he brings the side of yuca and a side of plain to tostones, i let him know i ordered the nacho version not the side so he takes it back and 10 minutes later brings out the right order no more than 2 minutes later out entrées come out. Not once during dinner did he come  by to see if the food was ok or if we needed something.  (It wasnt even busy!!) Finally we catch his attention for togo boxes. After bringing those out he got sat with a party of 5 and my boyfriend and I sat at out table that was completely empty for almost 25 minutes waiting on the bill. I had to actually walk to the bar and ask for our bill. Our server took the party of 5s drink and food order and was then walking around aimlessly not once walking over to out table l. To make it worse when he finally did drop off the bill he said ""sorry you. Didn't tell me you wanted your bill"" that aggregated me because he never gave us the chance to ask because he disappeared after dropping of togo boxes. Usually when a table asks for boxes you offer desserts and it being a cuban resturant you writings think he would of offered cuban coffee but anyway overall really disappointed. Food was pretty good but being cuban myself ive had better and the service was horrible worth making me not want to come back.",0.9388,0.844,0.092,0.064,0.45943223443223447
2016-03-19,4.0,"Came here on a date. The music, the bar and the food were all good. Had aperitivos criollos followed by ropa vieja. The yuca frita and the music  were a favorite.",0.7096,0.821,0.179,0.0,0.8
2016-03-10,5.0,One of the best restaurants I've been too! Our server was very friendly and he requested dishes for us and they were amazing! I don't remember the name of the dish but it was a chip appetizer with a chunky seafood dip. It was amazing!!!! Def coming back ASAP!,0.8133,0.836,0.164,0.0,0.55
2016-03-07,4.0,"Went for lunch.  Service was prompt.  This place is very beautiful. I was impressed. I enjoyed tasting a caipirinha;  it was refreshing.  I had all appetizers: chicken empanada, plantains, and arroz con gandules.  All were very tasty except for the pieces of meat?  in the arroz.  It reminded me of little worms.  Lastly for dessert, tres leches cake, my favorite and the BEST I have ever tasted!",0.9642,0.749,0.251,0.0,0.6816666666666666
2016-02-21,1.0,"Visited this establishment on Saturday for a friends surprise Birthday dinner. There was about 25 of us. Setting was nice, no complaints. Now the waiter, on the other hand. Took forever, was snappy at the mouth and couldn't even answer questions correctly. And probably because no matter what the tip was automatically included in the bill. (Very smart, 'cause the service was the shittiest and with my $60 bill he got $12) The host of the dinner, ordered pitchers of sangria and mojitos.. The mojito pitcher was terrible and finally I figured out why, the lime they used must've been damn near rotten. Ugh! I found this out when I went to the bar for a shot of patron (with lime) and a mixed drink (sprite & Greg goose) MIND MYSELF , I didn't want to wait another 30 minutes for my waiter to bring my drink, BUT when I get to the bar there's 3 people standing behind and it wasn't busy at all. They completely ignore me and my S.O., one man starts talking to a couple he knows and makes them some drinks, the girl starts washing glasses and after another 5-8 mins the other guy FINALLY asks us if we need something. ""NO IM JUST STANDIMG HERE LOOKING CUTE!!"" lol I'm saying to myself.. So I get a coke and Hennessey, the shot and my drink.. He doesn't even give a napkin or coaster or offer any lime.. I grab one myself cause he just walks away.... and it was so nasty, wasn't even green. The only reason I give them a star is because the Salsa band was a 5!!! And brought a wonderful vibe through out the night.. Too bad, I'll never come here again. Ohhh, I forgot about the food... LOL No flavor at all. The steak wasnt too bad though. Fish, looked like a cat picked at it prior to them deep frying the hell out of it.. Boooo!!! I'm such a fatty too. I was disappointed.",-0.9827,0.776,0.075,0.15,0.643040293040293
2016-02-15,2.0,"My wife and I stopped for Valentine's Day, they were able to accommodate us on the table all the way in the corner, the corner was pretty cold the heater probably was not working but it was freezing cold, the waiter took so long to come to us and asked us about if we wanted to order or I would like to order drinks. After he came apologetic we order our drinks brought the water we were so hungry we were ready to order my wife ordered the churrasco  which was $22 I ordered a red snapper which is that deep fried fish $22 my wife order strawberry margarita frozen and for me a sprite. Food took about 35 minutes to arrive. My wife's dish was so simple for the price we paid a very small piece of meat no flavor whatsoever dry just for a scoop of rice and beans and 3 sad pieces of plantains  $22 I don't think it is worth it. Stay away from it. In regards to my dish that deep fry fish I have never ever paid these kind of money for a much simple fish which was simply fried on salt maybe in a little bit of pepper and that was it. For price a bowl of beans with it $20 complete you not worth it no flavor absolutely nothing we called that the night I would really not recommend to stop by. service is horrible for this tasteless I would say just stay away from it very expensive where you spent almost $70 for the night for these said tasteless food.",-0.625,0.863,0.063,0.074,0.5713492063492064
2016-02-14,5.0,"Great place to enjoy! Travel from the south side to enjoy great food and great music. The papas rellenas are awesome, the surprise dinner plate is to die for. Don't mention the drinks!  The most amazing thing there is the atmosphere! The only bad thing is the live band! The guys take forever to start! They like to arrive late and one by one, but once they start to play they are awesome.  So once you eat and had your drinks. Put on your dancing shoes and get ready to sweat and have a awesome time! We never regret the long drive from the midway area to this spot! Everyone that we have taken to this place love it!",0.9919,0.658,0.312,0.031,0.7009803921568628
2016-02-05,3.0,"I was told that this place had great food and flavor, yes it does, excellent flavor and the service was good. My only issue was for the location, the ambiance and its interior feel....WAY TO EXPENSIVE, plan on spending at least 100.00 for two people if you each want a bar drink, with two appetizers and two steak meals. Cuban food is great I know I'm Cuban myself, but damn players 10.00 for six large sized plantains, the steak was good, but not 22.00 dollars good. Either way if your looking for Good Cuban food, it is good, bit if you want good More economical Cuban food, there are plenty of other places in Chicago, that are the same size and look exactly the same.  Im not cheap, I don't mind spending money on food when it deserves its price, but for Rice, black beans, fried sweet bananas, WAY OVER PRICED...Even for the fresh quality....WAY OVER PRICED, So if you want good Cuban food priced as if you were at Shaw's Crab house, you have found the place.",0.9897,0.763,0.22,0.017,0.5744543650793651
2016-02-04,4.0,"Went here on a Tuesday night for my Fathers Birthday. No one was here, not a soul. But idk why the food was GOOD!!! Everything was so juicy, flavorful abd tasty. Even had some complimentary soup and a lil flan birthday cake for the pops. Love the food will come back.",0.8935,0.74,0.222,0.038,0.42500000000000004
