date,star,text,compound,neutral,positive,negative,subjectivity
2011-09-06,4.0,"I felt like Hunter S. Thompson in the middle of a trip. Headed out for pizza we look to our right and there it is, Lechon, twisting in all its golden glory over hardwood charcoal, right there on the sidewalk. Right next to my car! I cut a bus off and my girl asked a gentleman if that pig was for us, the reply ""no englash.""  Me, "" es puerco para el comida?""  Big smile ""si"".  Fuck those Madison ave. marketing geniuses, a pig on a spit right next to the street brings em in. Great Mojito's $6 Whole red snapper very good, nice sides, not turned to dust like at El Barco, $15 quite a deal. Don't forget to eat those fins, they're like crispy fishy chips! The Lechon (thats the pig we discussed earlier) $13 they give you a nice assortment of cuts, some lean loin, some fatty shoulder, a nice slice of belly and some skin to chew on.  The Yucca stuffed with goat cheese was a nice appetizer, the starters in Caribbean restaurants tend to be really heavy and even though this was a fried starchy thing it was light and well executed. Sitting in the back of the restaurant was a gentleman I recognized as  a chef in the neighborhood, he was eating with his sons and looked quite happy, I nodded and he nodded back.  Service was a tag team effort and was pleasant and efficient. Pricing was fair and all the food was fresh and done very well. Cuban food and Puerto Rican food can be formulaic, heavy, cloying, uninspired, lacking in service, overpriced and downright dismal, Siboney is none of these, although maybe they can move that pig over about ten feet, hand me a knife and when its done just let me cut off those cheeks and belly, then maybe I will release the fifth star.",0.9903,0.785,0.168,0.047,0.4893977591036414
2011-08-30,4.0,"Delicious and authentic Cuban food is served at Siboney.  This white tablecloth restaurant is beautifully decorated with gorgeous artwork adorning the walls.   After I sat down, I was brought a basket of thinly sliced, fried plantains.  These were very tasty and a nice start to the meal.  For appetizers I had the Gambas al Ajillo, which were shrimp sauteed in butter, olive oil, garlic and spices.   These were very good, but a tad on the bland side (I'm someone who really likes spicy food).   For the main entree, I enjoyed the Plato Sorpresa Siboney.  This was a delicious meat platter that had skirt steak, mahi mahi, pork medallions, grilled vegetables, and cassava, all served with rice and chimi-churri sauce.  As a meat-lover, I was very satisfied with the main dish.   My waiter was very courteous and prompt, and the service was great.   I would definitely go to this restaurant again.",0.9926,0.738,0.262,0.0,0.6759444444444445
2011-08-30,4.0,"I thoroughly enjoyed Siboney. I've walked by a couple of times and they were roasting a pig, I've seen lots of stuff in Chicago but this is a first. I'm torn over the roasted pig, it was kinda cool to actually see that in real life, but it looked gross and sad at the same time.  Shortly after seated we were brought a basket of thinly sliced, fried plantains. A nice alternative to bread. I ordered a colorful and wonderful tomatoy, chicken and rice dish. The portion was huge. The chicken was tender, juicy and seasoned to perfection. The prices can vary depending on what you order, but overall everything seemed reasonable.",0.8947,0.746,0.169,0.085,0.5478070175438595
2011-08-10,2.0,"I took advantage of a  restaurant.com  gift certificate I had in order to get a $25 gift certificate for this place as the majority of Yelp reviews seemd positive. I anjoyed tohe location of this place, easy to park and a nice patio on the side, and inside it seemed really nice, a good spot to take your significant other.  The important part of the review, and the highest weighted portion however comes down to the food. I felt the food to be adequate. We ordered the pork tamale and ham croquettes to start off the meal. The tamale was downright nasty, very greasy with about 2-3 small chunks of pork inside.  For our meals we ordered the ropa vieja and the whole fried snapper. The presentation of the plates were great, I just wished the food tasted as good as it looked. It wasn't bad, but there are definately much better places for cuban food in the area.  I may be overly critical, but this place is a great deal if you use a  restaurant.com  gift certificate, however for me I just wasn't a big fan...",0.983,0.779,0.201,0.02,0.6246512746512747
2011-08-04,5.0,"LOVE this place! Because Chicago has so many great restaurants, I tend to not revisit the same place twice unless it's really spectacular (ok, and/or really conveniently located). I keep finding myself back at Siboney, though, because I really love the food. If you go, try the Bolitas de Yucca con Queso (amazing!!). Also, the Ropa Vieja is really good. It is occasionally loud, though, on evenings where they have live bands. So, if you're looking for a quiet evening out, check to see what they have going on there first.",0.9632,0.823,0.177,0.0,0.5094444444444445
2011-07-24,5.0,"Wow I can't believe anyone could write anything bad about this place! Sooo wonderful. The food here has so much flavor! My favorite it the Lechon Asado. It has way more flavor than ANY place I've ever had it from. Everything here is BURSTING with flavor. I even fell in love with their chicken empanadas (and I Hate empanadas!). There is live music every friday and saturday, which is my favorite time to go. They have a great cuban singer that comes in. Very authenic. The atmosphere is warm and inviting and it even carries into the bathroom. No one can say a bad thing about this place if they truely love Cuban cuisine. Even if you aren't used to Cuban food, you won't get sick. Their meats are tender and juicy. I've been here way too many times to know this :-)",0.9735,0.714,0.211,0.075,0.7152882205513784
2011-07-17,4.0,"This is my first choice for Cuban food in Chicago. This is also the only place that I've been too that offers Vaca Frita, which is easily my favorite Cuban dish. Everything here is delicious (with the exception of their Mojito...I'm not a fan of the bitters they add to their drinks here. I think they make them quite bitter although I am a fan of bitter they just don't have the right recipe or something).  They have a rather extensive menu and everything is so flavorful. We always order their Vaca Frita and their Masitas. I love all their rice and bean concoctions and unlike other Cuban places they have a wide variety of different rice and beans. Their Chicken Soup here is also very good.",0.7896,0.797,0.12,0.083,0.5938253968253967
2011-07-05,5.0,"BEST MEAL EVER!! I had driven past the place so many times I am SO glad I finally stopped in, the food was SO IMPRESIVE! I thought Cuban food would be super greasy or salty NOT AT ALL HERE. Seriously, the food here is AMAZING... I really wish they delivered. I had this combo platter we shared it with the table and it knocked our socks off: beef, mahi mahi, shrimp, yucca, rice & beans, pork tenderloins OMG YUM!!",0.9538,0.716,0.233,0.051,0.6092592592592593
2011-05-08,5.0,Had dinner here with a group of friends. By the smell when you walked in the door I knew straight away that this place would be good.  It did not disappoint. Every dish we had was fantastic. I woke up the following morning thinking about that meal and will be back soon.  As a hispanic person thats pretty high praise.,0.9615,0.704,0.296,0.0,0.5057142857142857
2011-04-25,5.0,"Siboney is superb! From the wine list to the entrees, this place was outstanding. With portions large enough to share, beautiful ambiance, and a friendly waitstaff, we had an excellent experience at Siboney. This would be a nice romantic date spot, but my best friend and I ended up here for a late bite on Easter night and ended up having a very enjoyable evening over some cuban wine and the vegetarian platter. Even the music here is awesome! I highly recommend this spot.",0.991,0.61,0.39,0.0,0.715969387755102
2011-04-11,3.0,"Siboney is a fun restaurant - especially when they are playing host to a live samba and/or bossa nova band.  The restaurant can be exciting and fast-paced as well as slow and easy-going.  The restaurant provides a nice selection of Cuban cuisine with some South American influences.  I have enjoyed all the food served to me so far and plan on coming back in the future.   Great appetizers, entrees and drinks to choose from and all for a reasonable price.",0.9618,0.765,0.235,0.0,0.5442307692307692
2011-01-24,2.0,"This place is weird, theres a reason why its always empty. My meal was nothing special. Dried out steak, served with iceberg lettuce salad for $15, Im ok on that, i wont try that place again!",-0.431,0.784,0.058,0.158,0.6342857142857142
2011-01-02,4.0,"We visited early on New Years day, perfect timing as we sat right away. It was nice that valet was available. We're not much on appetizers so we ordered right away.     My bride had the Lechon Asado . She was extremely satisfied with the taste, presentation and the serving size. The Platanos Maduros were cooked to perfection.The Yucca was a little too garlicy for her taste.  She was hoping for Bolce but it wasn't on the menu. The Frijoles Negros were very tasty. My daughter who just dreads any restaurant that doesn't have a drive thru, had the Bistec de Pollo a la Plancha. An extremely large serving that we thought we'd need a doggie bag for. Well she just scarfed up the whole piece because she said it was so good she couldn't stop eating it.     I ordered the Bistec de Palomilla. Before we visited  I checked out their menu on line, and in the description of the Bistec de Palomilla it said that it was served with chopped onions. After El Prado in Maywood stopped serving dinner years ago we've been through a half dozen Cuban restaurants that  just don't make this dish properly.  They nailed it.  I thoroughly enjoyed my meal. Rice was cooked to perfection. The tostones were cooked properly but a little too thin for me, It seems that  I've run into this a lot lately and I'm a little disappointed in that. I know it seems trivial but it would be 5 stars if they were a little thicker.",0.9579,0.855,0.106,0.039,0.517550505050505
2010-12-30,4.0,"I hate long paragraphs, why do people do this? you're not a writer. Will try to keep it short. Wed. night 12/29/2010 dinner @ Siboneys @ 6pm. Place empty (fine by me!) party of 5 adults/3 kids Decor : cozy and charming. Very clean and new  Atmostphere: romantic yet better for group. Bar area really nice Waiter: Nicko. Since we were first ones, treatment was obviously better and attentive. Nicko was great pitchers of sangrias (3 total) : $30 each. Very good. Apps: Bolitas de yuca con queso, veggie tamal, yuca frita, papa rellena. all were good except veggie tamal was eh. Not bad, not impressive. Dinner: Paella ($24), grilled chicken breast($14), chicken cordon bleu($17) and the Siboney Churrasco ($20).  All were very good. Everyone was very happy.  These are most expensive on menu, rest of items range from $11 to $13. Plus sandwiches are $8. Churrasco was big.  Service: Food came in good time. busboys were attentive and helpful, we were checked on frequently. You'll feel: If you are Cuban: Eh, decent and fair (prob bc nothing will taste like home) If you are hispanic but not Cuban: it was good! If you are not hispanic and hardly eat spanish food: Dude! it was awesome! If you are from Chicago and not hispanic: WOAH DUDE!!! like the best restaurant ever!!!!!!!! like.. If you are from NY like me (the mecca of restaurants and never really impressed): For the price, atmosphere, service and quality, I will definitely return. WAY BETTER than THAT STUPID PLACE accross the st. down a block Cafe BOlero. Double the price! service bad! and a joke! read my review on them! they're way overrated by people who are clueless.",0.9749,0.725,0.178,0.097,0.6386318742985411
2010-12-28,3.0,"I think this place is ok. The people working here seem pretty friendly. The main reason for this post is that Siboney is expanding next door. Next door use to be a small coffee shop and it appears they are turning it into a small ""fast"" food place. A cafeteria. it looks pretty interesting. I will keep everyone updated. Good night.",0.9468,0.742,0.258,0.0,0.48611111111111116
2010-10-26,5.0,Great food!! Even though we went in near closing we still had excellent service.  The Churrasco Argentina was soooo tasty.,0.855,0.682,0.318,0.0,0.7166666666666667
2010-10-09,5.0,"Husband and I wandered off the Western Blue Line stop, not quite sure where to go for a Friday night dinner.  Ended up here, as I had driven by recently - always looking to try a new ropa vieja! Wonderful place!  Ambience, decor, service, and oh the food - loved it all.  Good vibe.  There was a gentleman playing a mean guitar - lovely to be serenaded by ""Girl from Ipanema"" in Portuguese :)  He was a wonderful singer, and I'm not usually comfortable with the whole singing at the table kinda thing. Drinks:  cuba libre, a little rummy for me, but that's just me.  I'm a wimp.  Think I gotta mix my own :) Apps:  croqetas (huge portion), shrimp.  They complimented each other well. Entrees:  lechon (only available on weekends), churrasco Dessert:  pastel de tres leches All delicious.  Loved that the waiter was willing to give me a little direction when I was undecided.  Gotta go back and try the ropa vieja! Can't wait to bring a group of friends here...",0.9851,0.73,0.215,0.055,0.652151320901321
2010-09-27,5.0,So good.  This place kicks 90miles ass in every category.  Better service and better food all around good.,0.8265,0.453,0.425,0.122,0.55
2010-08-20,5.0,Ate here even after reading some of the bad reviews because I had a hankering for Cuban and it was close by.  This place is amazing. Three friends and I ate outside on a great June night. This is hands down the best Cuban food I've had outside of Miami.,0.9136,0.687,0.255,0.059,0.4293650793650793
2010-08-13,4.0,"Thankfully Siboney was @ the 1st annual Cuban Festival over the weekend 8/7 & 8/8 which gave me the chance to try their food again & i was very pleased & actually have not stopped thinking of the stuffed yuca..., I highly recommend, & intend on going back for dinner & hope the service has improved,  But do recommend the stuffed yuca (cassava)",0.97,0.653,0.347,0.0,0.41000000000000003
2010-08-10,4.0,I went there for a fiends B-day party and first glance at this place and you think its some real big fancy overpriced restaurant. WRONG it's pretty decent and homey I'm not sure if it was because it was later in the evening. I didn't eat dinner but I had lots of appetizers while having drinks at the bar the empenada's were wonderful and so where the croquet's. I will visit this place again and again I will definitely be going for dinner. The drinks were reasonably priced and the waitstaff was on point when you needed something can't wait to go again.,0.8642,0.847,0.117,0.036,0.6038888888888888
2010-06-24,3.0,"As a neighborhood restaurant this is A-OK.   I just happened to be in the area with my family and we decided to go here for dinner based on other Yelp reviews.  My favorite Cuban dish is the Bistek Palomilla, I think every Cuban restaurant has it -- so that is what I use for comparison.  I have to admit the steak was a little dry, but the rice, beans, and plantains were very good.  My sister ordered a ribeye steak special and that was prepared better than mine.  Surprisingly they have good menu items for kids - my nephew ate chicken tenders and french fries -- I guess that counts as Cuban? LoL In summary if you happen to live or be in the area I would have no problems recommending this place.  But there are better Cuban restaurants worth driving to.",0.9817,0.734,0.226,0.04,0.5450952380952381
2010-05-05,4.0,"For my third birthday, I wanted a puppy. I got a sister instead. Growing up this sharing a birthday caused no end of strife due to shared birthday parties. As adults, however, we have worked out an unspoken agreement. My sister, being younger and more fun, gets to have the weekend birthday gathering; and me being older and, well, more anally exacting, gets the party on our birthday proper. At the most recent party, she told me, however, that this system may have broken down. ""I think you go out more than me now,"" she said, ""I hear about your Foursquare check-ins.""  However, I still think our arrangement holds for a simple reason. Despite how much more I go out, she still chooses better restaurants. After a Mexifail debacle at Fuego on our actual birthday, she chose the wonderful Cuban restaurant Siboney for the weekendy, drunkity, drinky fiesta.  This stretch of Western between Armitage and Fullerton now contains some of the best pan-Latin flavors around. After trying it, Siboney rivals Rosa de Lima in my mind as the best of the bunch. Everything I tried there was spectacular (and it wasn't even assisted by their signature mojitos - I was drinked out).  My appetizer was a veggie tamale Cuban style (which makes it a tamal, but who's counting) and the two soft, tangy, gigantic corn mealy rolls of joy were a meal by themselves (at $3.99).  Thankfully, however, I didn't stop there (much as my wallet would have thanked me). I got the white rice, black bean, and vegetable mix for my main (they are surprisingly vegetarian friendly there). While it lacks a catchy name, it did not lack for flavor at all. Even vegetables I'm normally shy about eating - like red peppers - were delectably prepared and mixed in. Except for the mushrooms, that is, those are still Satan's fungus and I picked them off and poutily threw them to the side like the three year old I was at the birth of my sister!  But what really made this a great place for a birthday celebration was the live music. More muzak really. It was just a guy with a keyboard in the next room. However, he mixed instrumentalized American pop tunes and oldies with Spanish language ""classics"" (I think he played ""Guantanamera"" twice, but it was enjoyable both times) beautifully. His rendition of ""Happy Birthday"" for my sister was a carnival ride's worth of fun. And he had the entire table singing along with ""My Way"" en Espanol (with choruses in English). It may have even been derived from the Sid Vicious version.  It wasn't perfect. They're not really set up to accommodate large parties (another reason my sister gets the weekend is that she knows, and I'm not kidding, *everyone* west of Damen). We were set up in a L shape which wasn't conducive to saying hello to half the table. And not that this mattered anyhow because this place was so noisy on a Friday night that you could only hear the person next to and across from you anyway. Still next year, I want my birthday party to be at Siboney (or just my next celebration in general). Of course, knowing my sister, she'll choose somewhere better still.  Not that I mind though. She sniffs out good restaurants better than any puppy.",0.9984,0.781,0.191,0.029,0.3623635912698412
2010-02-25,1.0,"I was so excited to try a new cuban place when I went...however, I'm sad to report that it was almost a complete dissapointment. It is sad how terrible service can completely ruin the experience for someone. I went a few weeks ago just my boyfriend and I, looking to try a new Cuban spot (we love Cuban food). The waitress did not give us bread, we got it because we asked another waitress after noticing that every other table except us got it as soon as they sat down. Then we ordered some apetizers and apparently the waitress also forgot about those so the other waitress brought them to us after we asked if they were going to take much longer (it had been about 40 minutes at this point).  Eventually we got to order our food (of course, after we called our regular waitress and let her know we were ready) and it finally arrived...Well, she messed up my order and it had shrimp although I told her I did not want them because I was allergic, then she just took them out of the plate and apologized. At this point I was just so hungry I didn't care to argue and I'm not really allergic I just don't like shrimp...The actual food was fine, I ordered the Siboney platter, it includes fish, steak, and pork (and shrimp) along with yuca and rice. Flavor was  nothing exceptional but not bad, and they did not have hot sauce! Very very unlikely that I return here, there's so many other good Cuban spots I love such as Sabor a Cuba, Cafe La Guardia, and Cafe Bolero...I won't waste my time here again, that's for sure.",0.942,0.84,0.098,0.062,0.5236080759518258
2010-02-20,4.0,"We ate here for the first time a few days ago and the food was fantastic and the service very friendly.  I had the Vaca Frita, I don't recall what my partner had, but it was an extremely tasty chicken dish.  We also had fantastic appetizers and a couple mojitos each.  Other reviews say it's byob, but they have a liquor license now and serve up tasty drinks.  The only minor thing that bugged me is the owner/manager did not seem very friendly at all. He never acknowledged us after seating us.  No big deal, we werent there to make friends, and as I said, the waitress was very friendly.  We will definitely be back.",0.9772,0.774,0.204,0.021,0.5577380952380954
2010-02-16,1.0,"Wretched!  I, too, was at a party in the back and they made it a horrible dining experience.  I get that it's hard to serve 20 + people but they had 3-4 servers for our group so technically, it's about 5-6 people per server.  Any server should be able to handle that.  They were mixing up our orders, forgetting parts of the meals, serving the wrong dishes, and serving meals not at one time but at least 10 minutes apart! The 2 best dishes that I tried (from a variety of 6 +) were the snapper and the the bistec en cazuela.  The meat in general was chewier than to be desired and the tamale and beef empanada were disgusting - I refused to eat more than 1 bite of it.  There was probably 2 chunks of meat in the tamale while it was already lacking flavor and the empanada tasted like it was sitting in used cooking oil overnight.   Then they started playing club music at 8:30 PM - it was blaring in the back room and the DJ was not good to begin with.  We asked them to turn it down (we'd prefer OFF) so they did but then 20 min later, the bad DJ was at it again.  Very frustrating. We're very sad that we hated this place b/c we were looking forward to coming here ever since they opened.  It seemed promising...oh well.  Never again!",-0.972,0.787,0.069,0.144,0.5327485380116959
2010-02-08,3.0,"I attended a birthday dinner here with 30 people. We pretty much took over the back room. Here is a general rundown of the evening. The Good: + The best thing about this restaurant is the food. I tried a few appetizers, and the cheesy potato croquette thing was deliciously salty and good. I only ate half of one though as I feared for pore cloggage.  + For dinner, I had the grouper. It was actually REALLY good. I could have passed on the bland vegetables, rice and beans (which made the portion size way too big to consume), but the filet itself was absolutely delicious and prepared perfectly. + I had a bite of their bread pudding. It was surprisingly good. The Bad - A DJ came out and started playing raise the roof type music during our dinner. It was like eating in a nightclub. I turned around and asked my friend, ""Are we at Enclave?"" - I understand it's hard to coordinate a dinner party of 30 people. But my girlfriend was the last person to get her dinner by at least 30 minutes. Major fail. I gave her some of my fish and she loved it too. - They screwed up the bill. - At around 9:30, they put on the disco lights. I'm not kidding. You know, to go with the thumping music.  - I accidentally ate a bite of their pork medallion. I thought it was way too dry.  I'd agree with Vanessa. Our dinner was one hot mess. I will not likely return.",0.9831,0.719,0.192,0.088,0.5689655172413793
2009-12-18,5.0,"I can give this place 5 stars and feel great about it!  Everything I ordered surpassed my expectations.  The service was great, food was delicious, and the music was the cherry on top. Loved it!",0.9595,0.598,0.402,0.0,0.76
2009-11-28,3.0,"Very good service and above average food. My boyfriend and I passed by here and decided to give it a try. We ordered  the ""Croquetas de jamon ó pescado ($4 4 ham or fish filled Croquettes). The garlic sauce that comes with it is absolutely stunning. For entree, we share a combo dish that has selections of Siboney's favorites. The price is really reasonable. It's around $21 for this shared dish. I love the decor here, very detail-oriented. The service is pretty good, too.  But for some reason, I just don't remember too much about this place in general.",0.9733,0.775,0.225,0.0,0.5816666666666667
2009-11-27,5.0,I was born in Cuba and raised in the U.S. I've had the pleasure of enjoying Cuban food my entire life & therefore consider myself an expert. Siboney is excellent. You won't find better in Chicago. Suffice it to say I took my 79 y/o abuelita who is visiting from Cuba and never likes to eat out. She loved the place especially the croquetas. If you're visiting for the first time I recommend the Plato Siboney because it will allow you to sample a variety of foods just make sure you're sharing it! Enjoy.,0.9718,0.706,0.251,0.043,0.6941358024691358
