date,star,text,compound,neutral,positive,negative,subjectivity
2012-03-12,3.0,"Adequate is a word that comes to mind to describe this pub-grub spot.. The server was super nice and the bartender noticed she was busy so came around and took our drink order to help out.. I give the place a little extra star action for that..  The food was what it should be but nothing special. We had paddy melts, fish and chips, and some fried apps.. This food could have came from any number of places in Chicago, its identical to many bars. I get the feeling its all ordered from the same distributor and when fried, of course its gonna be all the same. To make this different they need to add something with a little pizazz.. like more homemade stuff.. Since I do not live in Roscoe V, I likely will not be back and if I do find myself up in the area, I would probably try somewhere else.. I have had 10$ burgers at places that blew me away, this time it was just A-OK.",0.778,0.902,0.081,0.017,0.43655462184873944
2012-03-08,3.0,"Good food, friendly waitstaff.  Their chorizo nachos are fantastic.  The only thing I was not impressed with was their chili.",0.799,0.55,0.356,0.094,0.8
2012-01-13,3.0,"I used to frequent Riverview when I lived in Roscoe Village - it really isn't anything special in regards to ambiance or food, but the service at this neighborhood bar is actually really great. Order whatever, but strike up a conversation with one of the bartenders or waitstaff, and you'll see what I mean. These super friendly guys and gals that remind me of why I love Chicago. I had a nice conversation with a bartender about Star Wars, prompted by the ""Star Wars Trivia Night"" advertisement outside one night. Another night, my friends and I needed a non-cray cray place to watch a Bulls game and ended up here. There weren't many people at the bar, and no one in the side room with the pool tables, but they opened it and turned on the TVs just for us. We were able to enjoy some cheap beers, food, and play pool while taking in a game. That's what I call a good night.",0.9827,0.704,0.212,0.084,0.5323879551820728
2011-11-02,3.0,"The service is hit or miss. There have been times I sit at an empty bar for five minutes before i'm acknowledged, and other times the server remembers what I had the last time I was there. The food is what keeps me coming back. Please, don't ever change the menu!!",-0.1739,0.877,0.045,0.078,0.23541666666666666
2011-10-05,2.0,"The food is really good here.  However, the service is awful!  Been a couple times, and both of those times we had really negligent service.  I'd suggest take-out.",0.1243,0.794,0.111,0.095,0.6
2011-09-19,4.0,"A go to place in the hood, amazing beer selection, the new owners are great, the food has been upgraded, and the staff are fantastic. Love what they did to this place.",0.9493,0.632,0.368,0.0,0.7209090909090909
2011-09-18,2.0,"Absolutely gross - I was served COLD black beans, hard - harddd, crunchy under cooked rice, and the most disgusting chicken taco I've ever had. The meat tasted really spongy and weird - complete with a bone roughly an inch wide, which I had to spit out - all served without hot sauce - which I had to ask for, to shield the food, as I needed to eat, to drink. Their sweet potato tater tots have a good flavor - but were not served crispy...they came out incredibly fast but clearly not fresh, prompting the obvious assumption that they'd been sitting under a heating lamp. So. Gross. The two stars are for a decent $4-5 draft list, with some seasonal brews, but DO NOT EAT HERE. And, as others have noted, the service is slow and inattentive.",-0.6555,0.838,0.058,0.104,0.551984126984127
2011-08-21,1.0,"Let me start off by saying, I use Yelp a lot for their reviews.  I will also say that the service at Riverview Tavern was so terrible, that I actually signed-up and made my own account so I could tell you about it.  We went there for dinner last night around 9:00 pm.  We sat outside and about 1/2 the tables were full so we figured it wouldn't take too long to eat.  We got menus pretty much right away and the waitress asked 1 minute later (when she brought our drinks) if we knew what we wanted, which we didn't, because we weren't familiar with the menu and needed some time to look at it.  BIG MISTAKE.  10 minutes pass, 20 minutes pass, the waitress is going to other tables, the bus boy is looking at us sympathetically, I even throw out a loud ""excuse me"" and she kept on walking.  About 30 minutes later she finally came over and I just handed her my credit card for the drinks and said we would be leaving.  She finally showed some hustle after I signed the receipt (first time IN MY LIFE that I have never left a tip) and she had the nerve to open up the book and see what her tip was while it was still on our table!  WHO DOES THAT??  Needless to say, we won't be going back.",-0.3972,0.936,0.031,0.034,0.45046583850931676
2011-07-30,2.0,"Eh, nope.  There are bigger, better fish in the sea.   2 stars mostly for slow / inattentive service.  *on a slow/empty Friday evening.  - water served in plastic cups - wha?  why?  We weren't even sitting outside.      - one of our draft beers tasted weird, we sent it back. (I've never done that before).  Also, I ordered a 'vodka lemonade' and even though it tasted pretty good, I suspect there was zero booze in the supposed cocktail. - turkey burger was sub-mediocre; however, the sweet potato fries were great, I will give them that.  We live nearby this place so we wanted to give it a try, and although I loved the big mural inside of the old Riverview amusement park, and the nice low booths, there's nothing that makes me want to return here.",0.9681,0.769,0.189,0.042,0.5205882352941177
2011-07-18,4.0,"Riverview has been impressing me lately which is prompting this review.  I am not sure if they obtained a new chef, but I've been pretty impressed with the food lately.  Before (1 yr ago), I would leave disappointed after eating here.  The food just wasn't that good.  However, a good friend recommend their tacos.  Holy goodness....get some of these! They are all good....the fish, steak, and chicken mole. And fresh salsa and chips are always an appreciated side.   Personally, I don't enjoy hanging out inside of this bar.  It has an awkward layout and is a bit dark inside.  However, it's great in the summer.  They have several outdoor tables on an active street in Roscoe Village which lends itself to great people watching.  Also, the servers are attentive and extremely pleasant.",0.9863,0.627,0.265,0.107,0.6623857623857624
2011-07-03,4.0,I went to Riverview Tavern for dinner with friends this past Friday night. I had been there several other times for work events but never just to grab a bite to eat. The menu was very diverse and it had a lot of good choices. I had 'The Comet' a veggie sandwich with a delicious cilantro pesto sauce on it. The sandwich was definitely yummy and the french fries were excellent. I also tried some of my friend's Shrimp Club wrap which I also thought was good.  The service was quick and efficient and I really enjoyed the outdoor seating as well. It was a positive experience and I really want to come back and try their brunch (I heard it's delicious).,0.9936,0.68,0.32,0.0,0.47315340909090914
2011-06-29,5.0,"Great staff, great atmosphere, good food. What a neighborhood bar should be.",0.9022,0.419,0.581,0.0,0.7000000000000001
2011-06-28,4.0,"Low key atmosphere, spacious interior, great servers and decent menu are just a few of the reasons that I love this place. They open at noon and are always ready to go for lunch. The menu is pretty typical pub fare, with good burgers and excellent fish and chips. On the weekends, there is a ""hangover"" menu with a mix of snacks and drinks.  The interior is spacious. A real change from so many crammed-to-the-gills tavern/grille establishments. They can easily accomodate large parties and very kid friendly. In fact, during the day this place is a haven for Roscoe Village parents. My mother loves the decor as they have several pieces of memorabilia from the old Riverview Amusement Park, which she remembers fondly from her childhood. If your parents are native Chicagoans and Baby Boomers, you might consider bringing them here for the nostalgia. The menu is typical pub fare. Burgers, wings, sandwiches. The chilli is good but my favorite is the fish and chips. It's all done well, though. They have a variety of trivia and game nights during the week. They host some great specials during sporting event. This is my default neighborhood place.",0.9845,0.812,0.181,0.007,0.5531428571428572
2011-06-24,4.0,"Mini corn dogs and mini pulled pork sandwiches... mmmmm it's like midget heaven in this joint. Don't worry though, not everything is mini, the mixed drinks were very generous the last time we went, so if you are a little person make sure you aren't driving.  This is our ""go to"" place if we're just hanging out with no plans, it's close to a friends place and the food and drinks are amazing. My mouth is watering just thinking about the mini pulled pork sandwich... but now I can't stop picturing a midget eating one so it appears normal size in my mind, but I assure you it's mini so order a couple of them.  The restaurant/bar itself is pretty big with a good amount of seating and plenty of room to move around. So if you're in the area with nowhere to go I would definitely recommend popping into Riverview for a quick bite and a drink.",0.9804,0.795,0.195,0.009,0.5212962962962963
2011-06-16,4.0,"Stopped by for the first time ever this past weekend to grab something quick to eat.  There was no one in the place(not a big deal).  Ordered the BBQ chicken sandwich w/cheese and a bag of BBQ chips.  The sandwich was really good, the chips were not that great.  I would definitely come back, but I would not order the chips. I plan on trying some pizza next time I go.",-0.0645,0.868,0.057,0.075,0.3983333333333333
2011-06-14,4.0,"There every Tuesday for trivia and will continue to go back. Manny is great and so is the rest of the staff. While sometimes there aren't enough of them, they are always working to get your order. The chipotle black bean bbq burger is great along with the new selection of tacos. Robey's pizza is always a great choice as well.",0.9371,0.795,0.205,0.0,0.5196969696969698
2011-05-28,2.0,"I literally live around the corner from the place and had been very interested to try it.  I ordered a bacon cheeseburger and some hot wings.  I was definitely not impressed.  The quality of the burger just didn't impress me.  It tasted bland and the wings were way overcooked.  I will definitely give it another shot but lets just hope it doesn't dissapoint.  On  another note, my friend left her credit card one night after drinking.  When we went to pick it up they didn't even charge a tip after they had closed the bill as we had expected.  That is amazing and rare.  Needless to say, she received a great tip.",0.979,0.751,0.222,0.027,0.644871794871795
2011-05-02,4.0,"For a Saturday night the atmosphere is pretty great! Everyone was really nice, good food & service. I went with 2 other people & they were just as pleased. We'll be back!!! :)",0.9667,0.516,0.484,0.0,0.715625
2011-04-23,4.0,The entrance is like walking into your own personal pub.  I felt very welcomed here and when I strolled randomly no one was bothered or interrupted so I watched the pool players and some friends and I got into the trivia game while watching the sports highlights over appetizers. Drinks weren't pushed on us and the boothes werent to close for comfort so we come back here a few times a year because the staff are cool and the food is served hot and promptly whether its a crowded day or not.,0.7501,0.796,0.135,0.069,0.4555555555555555
2011-04-12,3.0,"A local staple. Hungry?  Thirsty?  Not really sure what you want?  With a group of indecisive and/or passive people?  Head on over. Riverview is quite spacious - expanding outside when weather permits. There are several booths and - joy of joys - enormous tables for when you are traveling en masse. Odds are, there's space for you and your crew. Drink list? In addition to several on tap (including locals by Goose Island and Metropolitan), there's a longer list of bottles, wine, and mixed drinks. The food, while perhaps a touch predictable, is broad enough to cover many preferences and reliably tasty. Vegetarians shouldn't have a problem. Decent time for all.",0.9171,0.843,0.14,0.018,0.3667735042735043
2011-03-29,3.0,"This is a great place to go if you're looking for a neighborhood corner bar that has ample seating, and even has an outdoor area in the summer. I've been here for a quick dinner with the hubby, to have a leisurely dinner and drinks with an out-of-town friend, and as a place to meet up wtih a big group, and all the times have been great. I can only say good things about 2 of their sides/appetizers - the tater tots and the mini corn dogs. Yum! I've never had a burger or sandwich from this place, because the pizza is so good. Riverview is attached to Robey's, which is next door. I've tried a couple of their pizzas. My favorite is the Robey pizza, which is sausage, mushroom, and onions. The pizza along with the mini corn dogs are plenty for 2 to share. The drink specials are pretty good too. Service can be a bit on the slow side, but I've never been in a rush, so I've never minded.",0.933,0.887,0.113,0.0,0.6083333333333334
2011-03-22,4.0,"PLAN YOUR PARTY HERE. We were looking for a place to have our daughter's first birthday and wanted to stay in our neighborhood (Roscoe Village). We had thrown an engagement party for some friends a few years ago and I had remembered good things but this party went off without a hitch. You can rent the front room for no fee, just a minimum order on food (which is easy to hit). The staff was great, they let us come early to set up and the food came in stages (like I had asked) so everyone was happy. The space was perfect for the weekend of the tourney with 3 big screen TV's on and the bartender Betty kept everyone happy. A very low-key but stress-free party for everyone who came, kids and adults and the food was great.",0.9934,0.696,0.287,0.017,0.5888888888888888
2011-01-18,3.0,"Went here on a Sunday afternoon for snacks and drinks. The service was mediocre.  The spinach and artichoke dip was good but could have come with a lot more pita bread.  If you're getting a mini buffalo chicken sandwich, beware that it will be the size of a chicken nugget.  Shots of Jameson are $4.  Nice place to check out if you are in the neighborhood.",-0.1001,0.847,0.081,0.072,0.8333333333333334
2011-01-02,3.0,The Riverview is a good neighborhood bar given the options currently in Roscoe Village.  It's a consistent place to get pretty good pub food and has a decent beer selection.  I would stick with the sandwiches and burgers here for the most part.  The black bean burger here is a very solid option - actually one of my favorite black bean burgers in the area.  The pizza on the menu is from Robey Pizza around the corner which is pretty good and is a nice option. They have team trivia night on Tuesdays and will occasionally run a Star Wars trivia night which gets insanely crowded.  If you are in the neighborhood it's a consistent place to go.,0.9549,0.793,0.181,0.026,0.5604629629629629
2010-12-21,3.0,"A nice little neighborhood bar that is very clean, has a good beer selection and provides solid food.  The burgers are pretty decent and they have sweet potato fries, which are damn good.  Sandwiches are hit or miss as they can either be really good or really dry.     This place is like an old trusty pair of jeans...it has a nice warm, inviting feel and it will never let you down as you know what to expect.  I just wish the TV's were not so spread out as it makes it difficult to watch more than 1 football game on a weekend afternoon, but I do like that it's rarely overcrowded.",0.9558,0.714,0.245,0.041,0.6376608187134503
2010-12-01,5.0,5 stars for Tuesday trivia night and the most delicious tater tots I've ever had!,0.6468,0.752,0.248,0.0,0.75
2010-11-22,3.0,I'm a local and have been here quite a few times. I'm never disappointed or amazed. It's not bad for a quick bite or a few beers but I wouldn't hang out here all night.,0.2235,0.83,0.114,0.056,0.3527777777777778
2010-11-22,3.0,"Riverview Tavern is one of those places... I've never really had  bad time  --- but I've never really had the most amazing time of my life. It's never busy, the service is always good and the food is above average but not memorable. I'll come back out of convenience.",0.9103,0.8,0.2,0.0,0.44242424242424244
2010-11-04,3.0,Great place in Roscoe Village to relax and have a few beers.  The bar area is really nice and comfortable and the Riverview Theme Park memorabilia on the walls is great.  Lots of history. I have been there a few times for dinner and the food is just average.  Just normal bar food.  The last time I was there I had a turkey burger (which was dry) and tater tots (which were very greasy). The only exception is the mini corn dogs appetizer.  They are delicious!,0.9711,0.773,0.227,0.0,0.5782051282051281
2010-10-27,4.0,"I LOVE this place. This food is great.. the beers and plentiful, and the staff is cool. Id give it 5 stars but.... Its a bar.. and every time I go in there I find myself surrounded by strollers and kids screaming and running around. Seriously people.. get a clue. Take the kids to chuck-e-cheese and stay out of Riverview. I dont need to hear them screaming and see them running around while Im trying to relax at one of my favorite places in Roscoe Village.",0.8038,0.782,0.143,0.075,0.7333333333333333
2010-10-24,4.0,Great place to watch games and grab food anytime. They have a private back room that you can use (with a food minimum) that is great for small to medium sized events. Food is very good for a sports bar and good variety.,0.9391,0.712,0.288,0.0,0.5221428571428571
2010-10-21,4.0,"I walked into this place with my mom and it was very good. It was a Monday night, so I got a couple mini pulled pork and buffalo chicken sandwiches. They were sooooooooo good! Then we had a barbecue chicken pizza and that was really good as well.  We also had a hummus platter for an appetizer, which was great as well. Very good food in a nice, dank atmosphere.",0.9741,0.69,0.31,0.0,0.8012500000000001
2010-10-20,5.0,went here to get some beer and watch the fsu game with my friend. it was perfect. beer specials were reasonable and the service was great.,0.9001,0.676,0.324,0.0,0.6875
2010-08-16,2.0,"This bar/tavern was on my ""get to know my neighborhood"" bar crawl/week long bender. I visited a lot of places around me just to get a feel for it. My group was one of three groups in the entire bar. This was at dinnertime (maybe a smidgen later). There were three servers and it still took about 10 minutes to get a beer. Followed by sitting and waiting for replacements. We ordered food which sounded really good by description, but turned out to be just mediocre (though not bad). Salty and greasy, perfect bar food, but small and low on meat. The tavern fries (which are covered in garlic and Parmesan) had no flavor beyond ""fry"" and still required ketchup to be edible. The tortilla chips were multicolored, and obviously came from separate bags. The regular were crunchy, the blue were soggy and the red was so stale as to be gummy.",0.4012,0.919,0.046,0.035,0.44061355311355305
2010-08-09,3.0,"I've lived around this neighborhood for a long time, and I've been to Riverview plenty of times. In the grand scheme of Chicago dining, I'd give it a solid 3 stars- maybe 3.5 on it's better days taking into account that it's a neighborhood joint.  Service is really hit or miss. Usually the servers and bartenders are attentive, though sometimes you do get an occasional bad apple. Their busboys are a little overattentive. I hate it when they try to take my plate before I am finished and I really really hate it when they reach for my plate without asking when I am finished but my company is not. I think it rushes my company and it drives me crazy. I understand that some people prefer a plate to be cleared as soon as they are finished regardless of whether their company is finished or not, but at least ask me.  I usually go with a beer when I'm here, but I've had mixed drinks as well. Standard Chicago prices with standard Chicago pours, but I never feel like a drink is too weak. They have a million TVs, and it's a relatively good size. It's seat yourself and I enjoy sitting outside on nice days and watching people on the nearby Roscoe and Damen intersection.  On to the food: This is hit or miss as well. I had the Robey pizza here once for a party. Worst. Pizza. Ever. (see separate review). I really like their hummus platter and the artichoke/spinich dip. I am not a fan of their salads. They are huge, but they are 95% lettuce. I've had the fish n chips, which was good and I enjoy their sandwiches. My favorites are the Honeymooner (turkey, swiss, bacon, spicy honey mustard) and Portabello and Pepper sandwich. I think their fries are gross, but their tots are usually perfect. They're worth the upgrade.",0.9421,0.752,0.147,0.101,0.49408602150537634
2010-07-22,3.0,"I just went again to Riverview to spend my Groupon, and have dinner out on the patio.  We went on a warm Wednesday, and there were plenty of outdoor seats available.  Since we had a Groupon, we pretty much went to town.  While everything we ate this time was superior to what we ate last time, it still wasn't enough to boost the rating to four stars.  sooooorry. BUT - I loved the spinach dip because it was incredibly cheesy and hot, and delicious with the toasted pita triangles.  Had a few noms of my boyfriend's turkey reuben, which wasn't bad.  His fries were average, just like last time.  I got the mango-avocado salad which was pretty fresh, I had to say, and better than you'd expect at a bar.  We also got two mini BBQ sliders which were okay, but very sweet and sugary tasting.  Also enjoyed my can of Strongbow!   It's a place that's pretty average across the board - some ups, some downs, and they balance each other out.  It was a nice place to visit, while we lived in the neighborhood!  Very friendly servers too.",0.9889,0.77,0.211,0.019,0.6161538461538462
2010-07-20,3.0,"Food, okay.  Lots of TVs.  Lots of sports.  Pizza from Robey's.  What keeps me from going back (and reminds me when I forget,) is how LOUD I have to talk when I'm there.  BAAAAD acoustics.  I've yet to sample the full selection of beers, but I might take it outside so I don't have to YELL to be heard beyond 2 feet.  (Its not the best indoors place if you want to have a personable conversation with someone.",-0.565,0.903,0.038,0.06,0.3666666666666667
2010-07-09,2.0,"Not an overwhelmingly amazing experience. The service left a lot of be desired. I probably could have downed a few more beers if my glass hadn't sat empty for so long. Karaoke on Thursday nights makes for interesting conversation. The food is average (although, we were impressed with the hummus platter that is very large for $6.95). Overall, there are places to get a better meal with better service, but Riverview will do in a pinch.",0.8315,0.815,0.169,0.016,0.4505494505494505
2010-06-16,2.0,"Used my groupon here, and I'm glad I didn't pay full price for the food, lemme tell ya! The atmosphere was nice and beers were good and plentiful, but the chicken quesadilla and chicken teriyaki sandwich that we ordered were awful! The tater tots were pretty awesome, but how can you mess up tots? I know it's just bar food, but it was less than average.",0.8512,0.693,0.217,0.09,0.7243055555555556
2010-06-14,5.0,"Riverview Tavern IS my favorite place to eat, drink, and socialize in Roscoe Village! The atmosphere is fun and cozy and I love their music selection. If you're not crazy about what they are playing on the speakers, it's no big deal. Just go over to the juke box and change it to your favorite Hall and Oates hit or pop favorite.  Music and coziness aside, the best thing about Riverview is the staff. Everyone who works there is kind, friendly, and they remember all of their repeat customers. I always know I'll have excellent service when we get the waitress in the fedora (you'll know who I mean) as our server! Not only is she friendly but she always makes sure our beer is refilled and our food is ordered. Also, don't forget to say hello to the bartender on Wednesday and Friday nights. He's very charming! I recommend the loaded tater tots (don't worry if they're not on the menu, you can still get them) and the summer tacos with chicken. The pizza at the connecting Robey Pizzeria also never disappoints. Overall, Riverview is a great place to go if you want a quick bite to eat or a casual drink with friends.",0.9947,0.735,0.259,0.007,0.6996843434343435
