date,star,text,compound,neutral,positive,negative,subjectivity
2017-08-03,1.0,"The last time I ate here, the waitress was extremely rude and there was horrible service. They forgot two of our meals, and the waitress argued with us about what we ordered! It also took them 45 minutes just to make a sandwich! I would not recommend the food either. Disgusting.",-0.937,0.736,0.0,0.264,0.6666666666666666
2017-06-02,3.0,"Have been here a couple times. The first was a Balboa pizza and a beer with the gf after a long day of painting. Pizza was not bad...beer was entirely too complicated. They had just had a tap takeover, so drafts were basically unavailable. We both ordered the same bottled beer and they only had one left...too stressful lol. The second time, I dropped in with a buddy for a quick drink just after work hours. Place was deserted except for a couple guys at the bar, but for some reason the bartender seemed annoyed that we were there. Kept pressing for a second round and huffily took the menus away when we said we weren't eating. Strange. It's close by...it's available...and the pizza is solid. I'm sure I'll be back, but it's a shoulder shrug.",0.2705,0.893,0.065,0.042,0.4388888888888889
2017-05-20,2.0,"We'd always been willing to brave the consistently spotty service here because the food was excellent.  Not anymore. They've overhauled their menu, dumbing it down to the barest boring bar food options. Which might be okay if that's what you want. But even in practice, the actual food is barely edible. Won't be back. Sad to see this place go downhill so quickly.",0.8424,0.771,0.177,0.052,0.5407407407407406
2017-05-07,2.0,"A month ago this would have been a 4-star review. That was when, for date night, I could take my lady to our local bar. The food has never been spectacular, but their beer list is nice. Now that there has been new ownership you have been blacklisted. The sandwiches we received were pathetic compared to the food we had been ordering before. The menu's aren't up to date. It's just sloppy. It's a shame, too. The waitstaff/bartenders are great. The music is good, and it's a good atmosphere. The beer list is solid. If all you're doing is drinking then stop by.",0.7876,0.744,0.157,0.099,0.6154545454545455
2017-04-07,2.0,"Sadly, they have overhauled their entire menu...and not in a good way. My beloved jalapeño popper grilled cheese will be missed the most. Check out the new menu before you waste your time heading over like we did only to find nothing looks good.",-0.7015,0.662,0.107,0.232,0.6421717171717172
2017-04-01,4.0,"Quaint corner bar with nice decor and ambience. Had craft beer, poutine and pizza. Everything was great, tasty and fresh. Server was just ok. Kid friendly atmosphere for an early dinner. Plan on going back again while I  am here.",0.9274,0.7,0.3,0.0,0.5071428571428571
2017-03-28,3.0,"Riverview seems to have changed a lot lately, and not for the better.  I don't know if they've had kitchen turnover, or what, but the menu is almost completely overhauled, and most of my faves are gone, including things like the from scratch ketchup.  It's not all bad - they've removed some of the upcharges for things like sweet potato fries, the chicken tenders/sandwiches are as tasty as ever, but on our visit we got a soggy and disappointing pizza that came out 15 minutes after everyone else's entrees arrived.  It was balanced by the excellent beer list and the new bourbon blue bbq chips.  But what happened to the nachos?  The gourmet grilled cheeses?  The avocado tempura tacos?  Riverview used to be our go-to for a casual dinner with out of town guests...it's going to be a while before we go back.  I hope they work out the kinks in the new menu in the meantime.",0.9679,0.815,0.15,0.035,0.5601731601731601
2017-03-27,1.0,"I was here on a Friday afternoon.  There was one server covering the front room and she was clearly overwhelmed.  It took 15 minutes to get menus after being seated.  We were told the credit card machines were down but we could still order while they were fixing it.  We ordered cheese curds for an appetizer however the portion was so small it was not much of an appetizer for the table.  Of the 4 in my group, only one meal came out correctly after finally ordering.  One ordered chicken with fries and received a burger with tots.  One ordered a different make your own burger with tots, but received fries.  When the one who ordered chicken had her meal sent back, she ended up being asked to have her meal delivered with the tots the second person ordered and had her eat off her friends plate for the fries while waiting for her sandwich to be recooked.  The 3rd incorrect order had  the correct side but incorrect bread and topping.  It took 10 minutes to get water refilled.  Getting a refill on any other drink was impossible.  To top it off, when we finally got her attention to get our check, we were told th credit card machines still were down and we could use the ATM and pay the ATM fee or wait for 20 more minutes.  We ended up waiting and were offered nothing to compensate for the miserable two hour experience, including still no refills on even water.  We paid in full for meals and gave up on telling her things were incorrect.  I've been here multiple times but this was a horrendous experience and not worth the return visit.",-0.6368,0.9,0.046,0.054,0.5254830917874397
2017-03-08,1.0,"Don't bother coming to this bar for trivia. It's a joke and winning team had 9 people when the rules stated only 6 people per team. Of course, they said they were two separate teams, but they sat at the same table and conversed amongst each other the whole time. Fair? Not even close. Go elsewhere for your pub trivia, this place is a joke.",0.7825,0.85,0.15,0.0,0.5916666666666667
2017-02-18,2.0,"Went for brunch and got the caesar salad with chicken. Typically salads are huge wherever you go. This one looked like a side salad. There was maybe a tablespoon of dressing on top so I asked for more which never showed up. There were only four tables seated and two servers so it's not like it was busy. Also, can vouch for review of the nachos. The toppings are skimpy.",0.7964,0.874,0.126,0.0,0.6642857142857143
2017-01-15,3.0,Had a great time at the beginning of my boyfriends sisters engagement celebration. We had an awesome guy server with dark hair (didn't catch his name) but towards the end of the night we ended up talking to a really rude bartender who didn't let us close our tabs and kicked some of my friends out for ordering a drink. Not a great way to end the night when they started off so positive. Would go Again but keep an eye out for this rude bartender with short hair and she had a nose ring.,0.9376,0.718,0.204,0.078,0.618181818181818
2016-12-10,1.0,"Tried this place a couple times.  First visit was just ok, but gave it another shot. The next visit my burger came out still mooing because it was so rare (asked for medium).  nope, never again Riverview",0.1531,0.956,0.044,0.0,0.43333333333333335
2016-09-05,5.0,This is our favorite neighborhood spot! They're always so attentive and very welcoming to our pup! :) get the grill cheese... And chicken fingers... And Mac and cheese... And John Daley cocktail!,0.877,0.742,0.258,0.0,0.8299999999999998
2016-07-17,5.0,"I have come here for brunch a couple of times and love it. The bar has ambiance, the staff is friendly and the food is good. I recommend the bloody Marie's!",0.8805,0.59,0.336,0.074,0.65
2016-07-16,4.0,"Nice neighborhood place. Grew up blocks from here, things have really changed for the better.",0.5859,0.612,0.291,0.097,0.5666666666666667
2016-06-16,2.0,"I come to Riverview quite often since it's close, but the service here is quite poor. Today we spent 40 minutes at our table after finishing our food to see our waiter. He walked by multiple times and never checked on us or removed the plates. I had to track him down. This is one of multiple times of poor service. There are too many places to eat around here for this.",-0.8801,0.881,0.0,0.119,0.2984126984126984
2016-05-16,4.0,"This place isn't going to change your life, but we enjoyed our visit here.  We tend to be a bit snobby when it comes to our beer and we were pretty happy with their selection.  Husband ended up ordering a cocktail called Teatime which was boozy, delicious and not crazy expensive.  I tried the two draft porters they had available and settled on the Shipwreck, which was bourbon barrel aged and absolutely delicious.  It came in a snifter, was 12% alcohol and $8.  This is comparable in price and alcohol content  to a glass of wine, but the snifter definitely had more in it.  The service was OK, but we were there only people enjoying their dog friendly patio, so we weren't surprised that they weren't falling over themselves to run outside to check on us.",0.9915,0.701,0.264,0.035,0.6852941176470589
2016-05-12,4.0,"Really good selection at the bar and the food has never disappointed. It's a step above the usual bar food, like the almond-crusted avocado tacos. Those really delivered. Plenty of TVs make the Riverview a good spot to watch the game, and trivia on Wednesdays is a hoot. Definitely worth checking out.",0.933,0.728,0.272,0.0,0.375
2016-05-12,2.0,"Despite the mixed reviews, I had really high hopes for this place. I drive by here all the time, and have been curious about it because it has a nice, comfortable look, and they seem to have rooftop seating, which is a plus. When I finally visited, I was very disappointed. The pros are they have a very friendly, accommodating staff, comfortable atmosphere and decor with just enough kitsch without being tacky. They also have a large selection of beer on tap, but were virtually all ales. If you want a crisp lager or pilsner, you're out of luck - we're in the Midwest, I would think at least one on tap would be in order. I chose this place based on some of the food photos on Yelp. A photo of nachos looked especially delicious, so that's what I ordered. Not three minutes later, when they came out, I immediately thought, ""See here, we're off to a bad start."" Yes, it was during brunch time, but they do offer their entire menu. What I was served was a congealed mess of unmelted, shredded cheese with a cold glop of cheese sauce ladled on top of cold chips with a thimbleful of black bean and corn relish, not the deliciousness featured in the Yelp pic (see my photo). Not to make a scene, I tried to muscle through it because I was hungry, but after 3 chips I had to stop. They took it off the bill without a problem. Though it was a bad food experience, but I might be willing to give it another shot, just not during brunch hours.",0.7886,0.812,0.114,0.074,0.6490376984126984
2016-05-01,3.0,"Wide variety of beer, lots of IPAs.  It was in the middle of the day on Sunday with the Cubs game and playoffs hockey on tv. There were maybe 10 other people in the bar. The food was alright, but nothing to rave about. It's close to my apartment, so I would check it out again for trivia night, but there are bars closer to me, so if I'm going for a drink, I'd probably go to those instead.",0.128,0.981,0.019,0.0,0.29375
2016-04-09,3.0,"I came with about 20 friends to watch the Mets home opener. I think at around 12:30, there were four other people eating there besides our group. They had a pretty decent beer list, though I wasn't very familiar with most of what they had to offer. I had a Half Acre Pony Pilsner, which was pretty good.  I ordered the BBQ ribs appetizer. I got about 8 ribs that looked really charred. I bit into one and I got a nice dose of char and some mostly dry meat. My guess is they were smoked and then finished on the grill, but they were done way too long.They came with brown mustard (who puts straight mustard on ribs?) and two BBQ sauces. I had to use a lot of BBQ sauce to make them edible. I will credit them for a few things. Hand cut fries. Big deal in my book. Also, I appreciate the owner sending all of us Fireball shots, so big props for that. But I wouldn't return unless it was for a group event.",0.9528,0.855,0.13,0.015,0.49722222222222207
2016-04-03,5.0,"My friends and I had the BEST time at Riverview Tavern! The legendary Bloody Mary lived up to its reputation, bottomless mimosas left us feeling very happy, my grilled cheese was superior, our waitress couldn't have been more engaging, and the atmosphere was inviting. I'm going to introduce some other friends to this place soon!",0.9713,0.611,0.349,0.039,0.6305555555555556
2016-02-23,4.0,Love the food! Staff is great! I've tried to get a late drink during the week there and a couple times they were closed early. Which then made me go home and be productive... so still a plus!,0.88,0.782,0.218,0.0,0.47000000000000003
2016-02-14,5.0,"This is our local go to place for lunch or drinks...or both.  They have some really good grilled cheese's, the jalepeno popper is awesome.  The service is always good, the beer selection is consistently great.  The pizza is really good, and so are the burgers.",0.957,0.692,0.308,0.0,0.5916666666666667
2016-02-14,4.0,"The best and the worst. . . I had the BEST pizza of my entire life here yesterday!!! Smokehouse pizza with three different kinds of bbq'ed meat!!!  To Die For!!!   The service was also great (thanks for your attentiveness, Maddie!) everything was great except the waffles in my wife's chicken and waffles.  The chicken was cooked perfectly- hot, plump, fried just right, and flavorful!  The waffle , however, was inedible.  No kidding- it was as hard as the table- as demonstrated when we tapped the table with it. This would have easily been 5+ stars except for the waffle. We'll be back though- for sure!",0.9596,0.688,0.223,0.09,0.6296626984126985
2016-02-11,1.0,"Would give it 0 stars if I could. Slow service, the restaurant wasn't even busy, our server never refilled our drinks. Won't be coming back.",0.0,1.0,0.0,0.0,0.2333333333333333
2016-02-01,2.0,"The food here has gone WAY downhill. I've recommended this place to a few friends and wish I could take it back. Food has habitually come out cold. They revamped the brunch menu a few years ago and have since scaled it back. Disappointing all around. One would think they would capitalize on the overflow from Kitch'n and Orange. Not a good option. Go here for a beer and watch ""the game"", nothing more.",0.743,0.824,0.135,0.041,0.37777777777777777
2016-01-30,4.0,Food is original and beer selection is good! Usually pretty low key so there is room for groups and a good view of tvs. They have darts!,0.8684,0.6,0.34,0.06,0.7083333333333334
2016-01-29,3.0,Service is kind of slow but the food is not bad. Trivia nights are fun and it has a good atmosphere,0.9197,0.585,0.415,0.0,0.5533333333333335
2016-01-08,2.0,"I'm not sure if this was an average experience because of the things that happened or because of the bar itself... We came here after some friends' brunch wedding expecting a bar hop--the group stayed here all night. And it was just a lot of people fighting off the hangover from the brunch booze and trying to keep the drunk rolling. There were multiple fights (mostly girl drama) and some girl (I don't know if she was a regular patron or part of the wedding party) kept picking ""fights"" (and by ""fights"" I mean flirting) with my husband all night. She moved on from him to me when she thought I was moving in on her target...lolz awkward. Anyways, I just don't know if I'd choose to come back here because of the poor associations or just because it wasn't the most exciting place otherwise. Atmosphere seemed lacking and service was gruff.",-0.9002,0.872,0.02,0.108,0.5377759971509971
2015-12-27,2.0,"Was looking forward to pub grub while I watched the Hawks. Thoroughly disappointed. Burnt chicken sandwich, ketchup that didn't taste like ketchup. Out of beers we liked. Btw; when you pour a pint, start what you finish, fill it up. Done here.",-0.4025,0.817,0.062,0.121,0.8333333333333334
2015-12-22,5.0,"this place was cool solely on the fact that I surprised my brother who I haven't seen in a good bit (over a year) for his bachelor party. He was confused, he cried, he punched me, he hugged me and then.. bought me drinks! Every beer that I had was on point - can't list them here for you as I dont remember but it was not disappointing. Also got some grub, a pizza and a wrap of some sort and both of those were good. I'd go back for sure! Cool vibe, has a back bar/ seating area as well as the main dining area - which i did not explore too much.",0.8783,0.765,0.165,0.07,0.5185185185185186
2015-12-09,5.0,"Great bar food. Love the Tatar tots and their burgers. We usually order pick up, and our items are always ready in just a few minutes. Efficient and delicious",0.9538,0.571,0.429,0.0,0.5333333333333333
2015-11-15,3.0,"Came here today for a casual brunch. Restaurant is very average. Our waitress was friendly but the restaurant is understaffed. Service was exceptionally slow. Drinks and meals came out at all different times, and a turkey club meal was forgotten. Meal was brought out after they realized the mistake and was taken off our bill. Enjoyed my Riverview Bloody Mary but my Classic Eggs Benedict was underwhelming and lukewarm.",-0.3291,0.78,0.102,0.119,0.5816666666666668
2015-10-23,4.0,"They have great burgers, plenty of beers and ciders and tap that change regularly with the seasons, and a ton of tv's for games. Their cheese curds are above par and the dipping sauce on the side is solid. My friends and I come back here time and again because it's a sure thing - good appetizers, plenty of seating, and a fun atmosphere!",0.9485,0.751,0.249,0.0,0.33947649572649574
2015-10-07,1.0,took 35 minutes to get meal and it was not what I ordered. 20 minutes later I have no food. wish me luck.,0.5423,0.695,0.22,0.085,0.0
2015-10-05,3.0,"So I decided to stop in here for lunch before going to a later Cubs game. Had the Mac n cheese, salad, blantons, and some beers. My fellow Cubs fan had the grilled cheese.  Food was amazing. Very good. Bartender was greatly helpful, chatty, personable, and seemed to have a great knowledge of what's going on in general.  The only disappointing part... We left, hell bent on coming back after the game for mini corn dogs. The place was closed before midnight, while listing hours until 2.  Loved the place, enjoyed the fresh food (most things, even ketchup are made in house) but wish I could have tried the damn mini corn dogs.",0.8106,0.756,0.163,0.081,0.5164705882352942
2015-10-01,4.0,Thursday Night Bar B Q. Hit the spot for me.  I am a big fan of fall off the bone ribs. Not going to happen here but worth every bit of the fight of these babies.  My daughter Colleen got the pulled pork   Once the food arrived I did not hear a word out of her till she asked for a box   It must have been really good.  Excellent beer and drink menu.,0.8849,0.783,0.174,0.043,0.45
2015-09-19,5.0,"Fair food at best.  We all received our food on a not crowded night but one person.  I finally had to get up, find the server and ask where our friends food was!  It wasn't worth waiting for.  Does not serve domestic beers other than Miller Lite.",0.7713,0.793,0.168,0.039,0.4625000000000001
2015-08-26,3.0,"Stopped here on a Monday night so it wasn't busy at all. We chatted with the waitress about the menu and got her recommendations. Wine bottles were 1/2 off so we went with that. The calamari was good but at the bottom of the bowl was a  pool of oil. The taco pizza sounded amazing but the dough didn't even taste cooked through, it was very floppy. I hate sending food back so I just asked for a takeout box instead. Popped it in the oven for 10 minutes and it was sooo much better! Next time I'll just go next door and get a take out since its the same menu.",0.6569,0.847,0.095,0.058,0.3625
2015-08-07,3.0,"Environment: 3/5. Pub, dart board, outside seating Waitress Hotness: 3/5 very cute waitress Service: 5/5 very nice bartender & quick service  Beer Selection: Ok. Not as great as they made it sound. Overall: it's hard to judge overall since I didn't try the food however I will update my review upon trying more. Beer selection...could be better.",0.9347,0.739,0.24,0.022,0.4765151515151515
2015-07-26,2.0,"Cocktails are nice. Service is spotty. The waitress was not knowledgable on the menu and specials, so I witnessed the bar manager talking down to her when she made mistakes. I would not recommend this place, although the patio seating is awesome!",0.5547,0.753,0.15,0.096,0.762962962962963
2015-06-27,1.0,"This place absolutely sucks but because most of the restaurants in this neighborhood are subpar it gets by. The food has always been mediocre but it's an option to go to out of the 4 edible establishments in the vicinity.  Today we ate on the patio and from the moment we walked in to leaving both food and service were a huge miss. I stood in the entryway as a mousy server passed me multiple times without acknowledging my presence. Finally the bartender asked ""can I help you?"" I told him we needed a table outside then mousy server told us to sit wherever and she'd bring us menus.   We ordered iced tea and pepsi to drink, neither were refilled throughout the meals.  We had to go get our own silverware because we weren't given any.  The sweet potato tots (which are a $2.00 upgrade) were burnt to shit, looked to have exploded in the fryer and were happily served on both plates.  It's alarming the morons in the kitchen found it appropriate to even plate them and send them out.  I'm not a cheapass who looks for freebies but we really should not have even been charged for this crap.  Food sucked and service sucked. Won't be back.",-0.7092,0.801,0.082,0.116,0.6058823529411765
2015-06-15,4.0,"It's old news that there are new owners and it's a different menu, so i am just going to update my review.   They offer a pretty wide beer selection.  Their burgers are quite tasty, especially the mini burgers.  On Wed, the mini burgers are $2 each and I had the black and blue and the Merkle's cheddar burger.  Since then I had the bacon brie burger and it was tasty too!   Their pizzas are so good.  I LOVE THE BALBOA PIZZA. I think it is one of the best thin crust pizzas I have ever had.  The bbq chicken pizza was good and I really liked the buffalo chicken pizza. The hummus is decent but comes with large pieces of red onion.  Do people really dip raw red onion in hummus and eat it?  I would rather more cucumber, tomato or pita bread than red onion.  They don't offer hummus in the ""winter,"" but they still didn't have it when I went in June.  The grilled cheeses are really tasty too, and I think they do a special on Thursday nights. The tempura green beans are tasteless, no salt or any type of seasoning which was disappointing.  I would suggest staying away.  But pretty much everything else is really tasty.  I am rarely disappointed and we come here a lot. The trivia on Wednesday has much improved and we love the trivia host.   Love the outdoor seating as well.",0.9844,0.79,0.165,0.045,0.5087801087801087
2015-06-13,4.0,This is a great neighborhood bar in Roscoe Village to grab a few beers with friends or to get some really good bar food! I've been here several times just for drinks and they have a great beer selection that is always changing. Prices are pretty standard for craft beers in Chicago. The bar tenders are good people and can offer some great suggestions if you ask. The food is really outstanding compared to most bars/taverns. I've only had the pizza but it was really good! Their menu has a nice selection of entrees and appetizers and there definitely is something for everybody. If you're ever in the area and are looking for a place to chill and have some good grub and a couple beers this is the place!,0.9868,0.752,0.248,0.0,0.6015625
2015-05-31,2.0,Not a fan. My beer tasted flat. The place overall seemed dingy. Floor was sticky. Bathroom was disgusting. Bartender aloof and unfriendly.,-0.5574,0.687,0.088,0.225,0.375
2015-05-27,3.0,"I went here for the women of craft beer event on thurs may 21 as part of chicago craft beer week, i loved all the beers i had, and they were all reasonably priced, (tho idk if the festival or the bar priced them) the hawks were playing that night, so it got pretty packed, but i was still able to order at the bar without much trouble, we had seats which was clutch. I dont have any complaints, though i just dont know how much was thanks to the festival or the bar, either way i was satisfied",0.9739,0.752,0.237,0.011,0.578125
2015-05-22,1.0,"Can here last night with a group of about 10 people, knowing it would be slammed because of the Hawks game. Knowing this, we all had our beer orders ready and when the drinks came we were prepared to order our food. Beers came out as expected, a few at a time as they were poured. I was stoked that they had some Three Floyd's selections. Food, on the other hand, came as 1-2 dishes at a time and were delivered as a server screamed out what they were. Two times different runners came out with multiple meals that were supposed to go to another table. My meal was never delivered. Within 45 minutes everyone had either finished or just received their meal. I told our waitress that it hadn't been delivered and that she could just take it off the bill and her response was, ""That's weird. I wonder where it went."" Needless to say we won't be coming back.",0.5574,0.927,0.048,0.025,0.40378787878787875
2015-05-02,2.0,"Waitress came to take our order and then didn't come back for 30 min. Cook and staff were obviously drinking on the job instead of attending patrons. Things were forgotten from our order, and the cook came out and yelled at me for mentioning what was forgotten ""WELL, DO YOU WANT IT OR NOT!"" Not a fan!",0.2771,0.856,0.081,0.063,0.25
