date,star,text,compound,neutral,positive,negative,subjectivity
2010-06-11,5.0,"I went with my husband and kids, and had a fabulous time!  I probably loved it because I went on a Wednesday, when they have $3 appetizers (excludes wings).  You could definitely get full on a few of those, and I just love appetizers.  We got chicken fingers, spinach artichoke dip and mini corn dogs, which was plenty for our toddler boys to fill up on while we still got to snack.  I ordered a patty melt and my husband got a cajun avacado turkey club.  We both really liked our meals, I couldn't finish my sandwich and I barely touched my fries.  I was very pregnant at the time, so, believe me, not finishing a meal is quite uncommon.  We also got a couple of sodas and a cupcake for dessert.  If you go on a Wednesday you can leave stuffed with good food for not too much, and it's a nice, clean, fun atmosphere.  Plenty of close, free parking.  Spent $18 using a  restaurant.com  coupon.",0.9854,0.802,0.191,0.007,0.5916666666666667
2010-05-28,5.0,"Any local place with a patio just count me in. I checked out Riverview and sat outside, service was great he was very attentive although I can't recall his name.  Also, think it was a great idea to have Robey's pizza on their menu - guess it's the same owner. A must is the Tomato Basil pizza.",0.8481,0.857,0.143,0.0,0.4458333333333333
2010-05-22,3.0,"I agree with Jenny R's assessment that this place is  ""miraculously median.""  Went here with a couple of friends to watch the game and was happy that there were places to sit at the bar. The bartender was great and made sure our beer glasses remained topped off, but the food and the atmosphere of the place were really nothing special. To sum up, there wasn't anything spectacular about this place, but there was nothing that was terrible either.",0.8114,0.805,0.157,0.038,0.7137896825396826
2010-03-31,2.0,"I was craving a big ol' salad (a ""Big Salad,"" if you will) and my Dad recommended we go to the Riverview, where he said the salads are ""da bomb.""  (He, uh... he's one of ""those"" dads.  Wiggity-wack-tore-up-from-the-floor-up-do-the-kids-still-say-""Boss"" Dads.  And I love him.) We arrived and were instructed to seat ourselves.  We all ordered water, and I was immediately put off by the fact that they give you plastic cups for water... the cheapy, translucent step-down-from-Solo kind.  Am I at a movie theatre?  This is a bar, is the cost of washing one more glass so high compared to disposable cups that you're willing to let the environment take one for the team? Our waitress was nice enough, but she had a weird habit of pointing at the person she was speaking to, and she seemed to be covering the entire place on her own.  She walked quickly with her head down, and it was therefore nearly impossible to track her down, even when we should have been rightly in her line of vision.   We ordered the hummus plate (on $3 special, bonus), but when it came out, it was spinach dip.  The mistake was corrected, but the spinach dip also managed to sneak its way onto our bill later.  When my salad came out, it had the wrong dressing attached, and it took more than 5 minutes to track someone down to have it fixed (with my Dad eventually solving the problem by waving a hand in the air like he just don't care).  However, I didn't like the dressing I ordered (""avocado ranch"" tasted like slaw dressing) or the one that came with it (salsa vinaigrette was meh), so I ordered some standard ranch and it tasted like it came from a Kraft bottle. The way they do their salads is smart, with a base price per salad and then ""add a protein"" for an additional charge.  But the menu said ""grilled chicken,"" which a reasonable person would expect to mean that when you order, they will grill chicken and slap it up on your salad.  But the chicken was cold and dry as opposed to hot and juicy and had clearly been cooked hours earlier and thrown into a container to be added to salads later.  Honestly, it was pretty gross.  My Mom's salad had shrimp, and it was hot and delicious, which made me a little jealous. All in all, not a super great experience.  Especially considering my salad was $11, most definitely not worth the price.  Maybe I should stick to the deep-fried bar snacks, but considering it's not exactly in the neighborhood, I don't see much incentive to return...",0.9836,0.798,0.133,0.07,0.5903833333333334
2010-03-30,3.0,"When I lived in Roscoe Village back in the day, we thought this place was THE SHIT. Maybe because we were newly out of college and it was one of the first places we went where everyone was actually over 21....or maybe because we liked sitting on the sidewalk drinking beer, or maybe it was just the close proximity to out place. Whatever it was, the feeling is long gone.  What happened Riverview?  We'll examine the service first:  It was the Wednesday before St Patrick's day so it was a little busy but definitely not busy enough for us to have to wait 10min before even getting greeted with menus! We weren't asked for drinks when the menus came just told to hold on. Our waitress who shall be known as ""Snooki"" for the rest of this review, was nice but clearly unable to manage all of her table.  On to the food:  DO NOT order the Potato Skins - burnt to a crisp along the edges. The burnt taste overpowered the taste of the potato and fixins. We didn't even finish the last one and we ALWAYS clear out plates! - they use over-sized potatoes which is weird...maybe they thought it was cool??  I had a turkey wrap. It was grilled....um....gross? It's like they put the whole wrap in the middle of a foreman and then served it up. LOL, no thanks. At least not without my permission.  Snooks was real sweet the whole time though, and once we got the ball rolling the food came pretty quickly and she kept the water glasses full. I guess there's an upside to every experience.  Naw.",0.9905,0.835,0.147,0.018,0.4629599567099567
2010-03-26,3.0,"Your typical bar with typical bar food. When we arrived, I think it may have been understaffed.  We were told to seat ourselves.  The only available booth had the remnants of a previous meal scattered on the table.  We sat down and an employee removed the old cups and plates and wiped the table. Our server was pleasant enough, but she wasn't the one to bring out our food.  Someone else hustled the meal to our table, but he brought an incorrect entree.  He ran back and got the right dish and we were finally ready to roll. I ordered the Midway Burger, essentially a straight-up hamburger with no frills.  It was good.  The fries were also solidly yummy. I had to track down mustard from a nearby table since the guy who brought the food rushed off before I had a chance to ask him for it. So the food was good, the atmosphere was fine, but the service was lacking.  I don't really fault any one person.  It just seemed like when you have that few people patrolling that many tables, some things are bound to fall through the cracks.",0.9778,0.845,0.141,0.014,0.4165154950869236
2010-03-24,2.0,"Somehow, even the Potato Skin appetizer was bland.  Everything was underwhelming and kind of yucky.  I was really hoping for better.  Cute location, might be good for meeting someone for a beer, but you can have a much better dinner in the neighborhood.",0.8511,0.703,0.255,0.042,0.6476190476190476
2010-03-19,3.0,"Positively middle of the road experience and yet another one of the establishments in my neighborhood that somehow fails to wow me.  While the history that Riverview Tavern proudly upholds of what was once (back in 1904) Chicago's only amusement park - and the ""World's Largest"" - is impressive and undeniable, the overall vibe here is pretty basic. Think positively typical neighborhood bar-cum-restaurant in every way... large wood bar, a smattering of booths, rickety tables with wood chairs, somewhat apathetic service, pub-type grub... the formula surely works for grabbing a brew and watching your game of choice via copious flatscreen - as I did this evening - but high expectations for much else should be checked at the ticket booth.  A shining beacon is certainly all the signage nostalgia from the roller coasters, fortune tellers, food vendors and even 'the parachute jump'... a neat flashback to our city's illustrious past, indeed and absolutely fun to dine by. Burgers and sandwiches are in plenty here as well as a few salads and pizza options from the next-door Robey Pizza Co. Stick to Riverview's items done well like juicy hot wings, meaty chili burgers and crunchy tater tots (mmmm....tots!) and you'll do just fine. Try to get fancy with healthier fare and you're left despondently picking at a dry grilled chicken breast and accompaniment of cold, undressed green beans. Barf.  While we're definitely all tall enough to enjoy this version of Riverview's rides, the adrenaline rush you'll find is a lot less Dare Devil Dive and a bit more Sammy's Slow Spinner. Just sayin'.",0.9854,0.808,0.16,0.032,0.4900168350168349
2010-03-15,4.0,"Our waitress was super friendly and cute,so bonus points for that. i thought i wanted a burger but revamped my opnion with the sight of the pulled pork sandwich. It wwas big,and i got tater tots with it! I would have liked coldslaw, but thats just me being picky. So yeah, very very good sandwich, and fun little place to drink and watch sports!",0.9735,0.689,0.311,0.0,0.5744444444444444
2010-03-07,3.0,"Once upon a time Riverview Tavern had two dartboards in the backroom where you could shoot darts and pass the time by quickly. These days they took the cork dartboards away and put a pool table by it. With my primary objective Friday night to be darts, it was best for me and my bud to go in, make an order, and head out to meet our other friends already in dart progress. We went inside and checked out the menu in the back room and went to the front room to make our order. It took awhile for the bartender to come on out but it was understandable given that it's Friday night and the whole place was jammed with Roscoe Village denizens. Plenty of good looking folks and the Blackhawks game was overhead on the TVs so we could get a clear view of them taking out Vancouver in devastating fashion! The bartender brought us our checks but the pens did not work much to my chagrin. Me and my buddy stood at the bar for about 20 minutes until our food finally arrived and we bounced out of there quickly to get to dart practice. Opening up the food, I found the Silver Platter burger worth every cent and it was a giant rollercoaster of bacon, cheese, mushrooms, caramelized onion and juiciness. It really was a MONSTER. The fries were cut thin with skins on and tasted superb with the proper crisp needed. Great place for eats, drinks and to watch the game. However if you are looking for darts - they don't have them anymore!!!",0.8994,0.861,0.09,0.049,0.48645833333333327
2010-03-03,3.0,"Come to Riverview Tavern on a Tuesday night be prepared for one thing, and one thing only:  a severe and utter trivia beat down by Answers In Your Pantswers...or not, we've only won once, but it's a heck of a lot of fun nonetheless. Even though Riverview Tavern is only a block away from me, it's not a place I frequent, save for Trivia Tuesdays (when I'm not in grad school).  The trivia is free, the degree of difficulty ranging from fairly simple to an occasional headscratcher, and the prizes, well, it can range on tickets to see YES one week, to a simple $25 gift certificate the next, so you never really know. The service is generally friendly and attentive, although you can become a bit lost for service if you sit in the back area instead of up front.  And while my drinks always seem to be swapped (A whiskey diet becomes a whiskey ginger and vice versa) I won't complain too much because in general they come with a pretty decent pour.   The food is what really makes Riverview stand out.  Their turkey burger is one of the best that I've had in the city and you can't go wrong with any of their chicken sandwiches, just be sure to get a side of their chipotle mayo for your fries or tots!",0.9882,0.744,0.19,0.066,0.5453492063492063
2010-03-03,2.0,"My roommate and I went to Rivewview for dinner since it's only a couple blocks from our apt and we were looking for a place to watch the Hawks.  All in all, it's a decent place but I think I'll try somewhere else in the area next time. The decor and theme of the restaurant is very cool.  It has all sorts of pictures and memorabilia from the old Riverview Park.  I wasn't alive when it was around, but I've heard countless stories from my dad about Riverview and it was fun to see pictures of the rides.  Some of the menu items are named after the rides, which I thought was cool. The service was so-so.  The waiter was good in the beginning, but once we got our food, he was nowhere to be found.  Not sure if it's the waiter or bartender, but the drinks came out slow as well.  Notably, it wasn't very busy there so I'm not sure what the deal was. I had the patty melt which looked pretty good.  I ordered it medium well, it came out barely medium.  I don't send food back, so I ate it anyway and it was just okay.  The chips and salsa were nothing to write home about.  Both my roommate and I ordered a beer from the menu, but they actually didn't have them on tap (I've been craving a Summit Heffe for a while), so we had something else.",0.9867,0.84,0.144,0.017,0.5195202020202021
2010-02-20,3.0,"Neat decor, beer, and beer.  Also, beer.  The food, though?  Eh.  Not so great.  I don't expect a 4 star meal at a pub, but this isn't even good for pub food in most cases.  We come back because it's near work, they serve beer before 5pm (so we can play hookey and grab a drink after long weeks), and there's always available seating.  Not bad, but not great.",0.8282,0.712,0.191,0.096,0.4962962962962963
2010-02-19,3.0,"I've only been for their well-advertised brunch and it was ok.  They were short-staffed, which made it tough to love it.  The menu was a little weak and the mimosas were a tad overpriced.  The food was really good though and the place has a really cool feel.  We are going to try it again...just maybe not for brunch.",0.8434,0.754,0.184,0.062,0.6635416666666667
2010-02-11,2.0,"What river? What view?  Misnomer aside, I was pretty disappointed with this place. I'd been by so many times in the summer months and spied what looked like very tasty dishes on people's outdoor tables. I finally had the chance to go in and give it a try on a snowy February night.  The service was horrible. There were only three or four other tables with customers at the time. I'm not sure what the hold up was or why we were ignored, but the waiter continuously just kept walking by, avoiding eye contact.  The food was mediocre at best. Having seen what I thought were delectable salads, I ordered the Santa Fe salad. It was bland with few ingredients other than lettuce. The salsa dressing was also pretty tasteless. My companion had a turkey burger that was completely ""meh.""  I wanted to like you Riverview Tavern. But you fell short.",0.9507,0.789,0.147,0.063,0.6679012345679013
2010-01-16,3.0,"Decent food, below average service usually, above average TV/sports coverage, decent atmosphere, decent prices.  Nothing sucks about this place, but really nothing is interesting about this place (except maybe the USA vs.Russia domed hockey arcade game in the back).",-0.6165,0.88,0.0,0.12,0.3909090909090909
2010-01-15,3.0,"I can walk here from my house.  The food is decent, though I was here on a Saturday afternoon once during March Madness and couldn't get over the clientale.  Yeah, I'm one of few who refuse to pay for cable... So have to goto bars for games... yeah, that's my story..   Anyway... Strollers everywhere.  But I guess that comes with the Roscoe Village neighborhood.  I didn't dare to cuss that my team was about to be eliminated....  so I just sat there, drank my Blue Moons in silence so I didn't wake the babies.....",-0.2732,0.883,0.047,0.07,0.28888888888888886
2010-01-04,4.0,"I met a friend from school here to borrow a book....the location was a good midway point for us. The service was great.  The beer was a little high, but the service more than makes up for it.  It's exactly what I would expect from the outside, though more children than I would expect...that's the 'hood though.  (This doesn't bother me, but I thought others would like to know.)   I'll come again.",0.8861,0.826,0.174,0.0,0.46125
2009-12-05,3.0,"Decent place. Not many people in there so it's easy to find a place to sit. Riverview has a good beer selection and some martinis as well which I'm all about but have yet to try any of tem. Their food is pretty good. My favorite item is the shrimp wrap. It has bacon, avocado and chipotle mayo. Fatty, but delicious. Not a fan of their grilled cheese but their nachos are also good. This place is nothing extraordinary but a good place to eat and get some drinks if you live in the neighborhood.",0.9866,0.708,0.292,0.0,0.7153846153846154
2009-10-17,2.0,"Tried it a few times, not a top pick. The wait staff is pretty bad, except for one waitress. They don't do hardly anything but ask if your food is okay. The people bringing the food and refills are the bar backs, and I always want to tip them and not the waitress. The food is decent, but overpriced for what it is, which is run-of-the-mill bar burgers. The menu is also pretty small, which makes it hard to be a repeat customer. My girlfriend does like the Vegetarian options and they have a lot of seating and TVs to watch the game, so that's nice. I'd give them more stars if I could get reliable service and a better price.",0.9514,0.787,0.164,0.049,0.594047619047619
2009-10-13,3.0,"Look, like the pal before me said - this place is nothing special. But for a neighborhood bar & grill, it's absolutely A-OK.  The best things about it, to me, are: you can always get a seat, the service is great (based on three visits, but mostly inspired from my most recent visit!), the turkey burger is spot-on (and at $8, priced just right), and there is always street parking.  What this place isn't: it's not an over-packed sports bar. It's not a pub with an impressive beer menu. I've never seen any gentleman eye candy. It's just not that awesome.  But for a nonsense outing in the neighborhood, it's definitely worth a visit. And I hope you get the lovely server we had!",0.9709,0.718,0.216,0.066,0.5964285714285714
2009-09-29,4.0,"Definitely a solid place to grab a bite to eat or watch a game.  Great menu, I really like the Quattro Stagioni pizza.  Prices are very reasonable and I have never left feeling annoyed or ripped off :)",0.9326,0.594,0.374,0.031,0.50375
2009-09-23,2.0,"Bah, bah I say!!!  All this place has going for it is the location.  Our Tuesday night softball league is sponsored by these clowns, and 2 games into the season our whole team wishes we never made the switch from McGees (although they had issues too, more to come later).  The food is average at best.  The chicken sandwich is dry and comes with nothing on it, and the chicken quesadillas were so bad I didn't even eat 1/2 the plate!  And I was buzzed and starving!  They do offer tator tots as a sub instead of fries, but seriously, who screws up tator tots.  Being a Tuesday night, the place is rather empty which is fine.  But they have trivia night on Tuesday nights and the MC 'hollas' over the mic as if he is in a banquet hall full of senior citizens.  Terribly annoying if you're not one of the 6 people playing.  We had about 10 people in our group, and since it was empty and they DO sponsor us, we figured we'd get half decent service.  NOPE!  Not only did they not give us a free round of water-downed shots for our victory, they rarely if ever came to our table.  Huh?  Do people not want to make money?  When a couple people approached the manager about the whole scenario, all that was said was ""maybe you should find another bar then.""  We will you prick, we will.  Cram your tators tots where the sun doesn't shine!",-0.9728,0.85,0.031,0.119,0.578030303030303
2009-09-20,4.0,"Riverview has a great menu selection. I love the tuna melt or reuben sandwich. And they have tater tots! They also have ample seating (outdoor seating in the summer) and a decent beer selection. They just started serving ""brunch"", but that menu looks limited (full menu is also available).",0.4753,0.847,0.107,0.046,0.5182539682539683
2009-09-02,3.0,"This place is nothing special.  I'd say it is on the lower end of 3 stars.  possibly even 2 stars but I'm feeling pretty generous.  It is usually not crowded, I like room but I want some people around damnit. The beers were kind of more expensive than I would have guessed.  They were more expensive than the Hop Leaf for some of their 'better' beers I still remember one time I went there with my wife and a friend of mine from work.  Some guys tried hitting on my friend.  They bought her a shot and she goes up to them to talk.  Then they all got scared to talk and when she asked who got her the shot they responded it was more of a group effort.  I thought it was pretty funny that a group had to each pich in like $0.50 to buy a hot for a girl they don't know.",0.9286,0.735,0.166,0.098,0.7122448979591837
2009-08-25,3.0,"I've been here a couple of times but just because of conveniance.  I can't ever seem to find anything on the menu that I really want to try so always end up going with the grilled cheese (classic standby). I do like the mini corn dogs as an appetizer though. Along with what's said in other reviews, Riverview has mediocre service. Even when not that busy, servers don't seem to come around much...",0.6297,0.929,0.071,0.0,0.3736111111111111
2009-07-31,2.0,"I've ate here a number of times basically because it is within a 5 minute walk  from my house. While the food is okay, the service is always extremely slow. Being a server myself I understand if someone is attending to 10 tables at once, it is difficult. However, managers and owners know peak times for their business, they should be prepared with adequate staffing.  Overall, it's alright, sometimes a wee bit too loud and you have to shout to speak to the server or whoever is with you at your table.  I'll probably keep going back because their hummus is pretty good, but I get it to go most of the time.",0.6486,0.884,0.1,0.016,0.5133333333333333
2009-07-23,3.0,"This was a great bar to go to after a softball game.  The sweet potato fries were excellent, and I really liked the avocado dipping sauce.  I also liked that you could order warm pretzels for an appetizer!  Unique touch!  We also had great service with our big group.  Well done, Riverview!",0.9775,0.606,0.394,0.0,0.6849999999999998
2009-07-20,3.0,"We ate at Riverview this past Sunday for lunch. We both had cheeseburgers and fries. The burgers were most likely a pre-made frozen patty. It just had that uniformity when I bit in -- no crumbling of delicious ground beef. It was also ridiculously greasy. Delicious, but oozing grease. It took me at least 6 napkins to eat this thing. The fries were handcut and really crispy. Yum! The bar seemed like a cool spot, and I'd like to go back with a group and sit at one of those big tables in the middle.",0.903,0.824,0.143,0.033,0.5083333333333334
2009-07-06,2.0,"It's apparently impossible to get a patty melt with Swiss cheese cooked medium.  Chicago being such a foodie capital, home of so much good food the transition of moving to the Midwest has been relatively painless.  But I digress, the rye bread was wonderfully toasted, and the french fries, muah!  Once again showing Horizon Cafe how it's done!  Even though the burger was overdone and the service spotty (One person cannot take care of a busy bar and floor) it's clean, and the beer is cold.",0.9222,0.804,0.168,0.028,0.5666666666666667
2009-06-16,3.0,"We go to Riverview every Tuesday night for Trivia, and I must say, I'm not very impressed. There isn't anything very exciting about the place, and the food isn't anything to write home about. I have tried the grilled cheese (average), burgers (they have a good variety, but nothing stood out to me), and appetizers (ordinary). All of the salads are pretty overpriced, any time you add chicken or steak, it's automatically over $10.  I give them a star for their monthly beer specials, like 312 and Shocktop, but I think better bar food is found elsewhere. However, their pizza menu is fantastic. They make the pizza next door (forgot the name of the business) and it's phenomenal. Order the BBQ Chicken and you won't be disappointed.",0.9627,0.817,0.156,0.028,0.6784023668639053
2009-05-22,2.0,Very average Chicago bar/tavern. Nothing special at all. The chicken fingers were actually good. The menu selection was very low. I love outdoor dining but it's just TOO loud.  I really enjoy all the new updated bars with fun menus and great drinks. This just isn't my type of place but if you like the good ole taverns give it a try!,0.9819,0.621,0.358,0.021,0.5779978354978356
