date,star,text,compound,neutral,positive,negative,subjectivity
2009-01-03,5.0,"Started my new year's resolution to visit more local taquerias  last night, beginning with Huaraches Dona Chio.  That may have been a mistake, as I may not get to the others based on my delicious meal.  We ordered a tikka huarache and a 2-ingredient (they do this half and half) asada and pastor huarache.  In order, I probably preferred the tikka, pastor, then the asada.  The masa/bean dough based huarache itself was the star though.  It's especially fresh and delicious, and I loved the corn/beanyness of the tortilla.   They were a little overwhelmed when we got there, there are only 4 tables and a counter top, so it would probably be a great place for carry-out or slightly off hours. There was the stamp of approval ""filled with Mexican families"" authenticity barometer, as well as the ""Uh oh I hope this place doesn't get TOO popular"" barometer, as it filled up with people by the time we left.   Overall if I want quick and delicious tacos or delectable huaraches, I'll be back.",0.9848,0.773,0.196,0.031,0.5113005050505051
2008-11-12,5.0,You Should: Make The Trip Sizzle: You have been eating crap Juice: Masa handmade by grandmas for tacos and namesake huaraches (a mexican pizza) that will blow your freaking mind Check Please: $,-0.4767,0.79,0.063,0.147,0.4
2008-11-02,4.0,"$6 for a huarache that will last at least 2 meals.  made from scratch in front of you, and just delicious!",0.6114,0.818,0.182,0.0,0.48888888888888893
2008-09-03,4.0,"I was a bit scared of this place when it opened because it's in a weird location on a residential street and looked kind of dive-y. But after the reviews on Yelp and in Time Out Chicago I decided to give it a go...and I am soooo glad that I did. Service is good here but not super fast, so don't start to freak out if they're not rushing around, the atmosphere is laid back. They only have a few very small tables - don't come here with a group or a fussy date, get your food to take out.  The tacos are an amazing deal with delicious fresh masa tortillas. Personal favorites are pastor and picadillo. The chicken tinga isn't bad, it's just not deliciously good like the pastor. However, it does seem to be all white meat - a big plus for me! I took a chance ordering picadillo (because I don't like it with raisins) but it turned out to be ground beef and potatoes in a nice rich sauce. I will definitely be back to try the huaraches (which looked awesome on other people's plates).  I really liked the handmade tortillas, and the tacos were a steal at $2.50 each! I'll definitely be back again.",0.9917,0.675,0.242,0.083,0.589551282051282
2008-08-03,5.0,"This is seriously the BEST Mexican food in the City.  Like the other review states it looks like a normal taqueria, but man were we wrong!  The actual tortillas are made fresh and the tinga (aka Chicken with Chipotle spices) are phenomenal!!!  If you are in the area check it out!!!!!",0.623,0.732,0.176,0.092,0.49416666666666664
2008-02-21,5.0,"This tiny little place just opened close by.  Don't let the street view fool you. It's your basic taqueria atmosphere inside, but the food is far from basic. This is a great little family operation with killer food.  Everything is home made.  Even the tortillas for the huaraches and quesadillas are made as you order them.  The food takes a couple of minutes more, but the extra wait is worth it.    They deliver as well.",0.4118,0.786,0.123,0.091,0.41999999999999993
