date,star,text,compound,neutral,positive,negative,subjectivity
2010-11-02,3.0,"I've been duped!! I was totally expecting this place to be ""underground"" you know like this cool little Authentic Mexican joint that no one knows about. Then I see it has 33 reviews. I must find out a way to take out these 33 people so that only I know (insert evil laugh here)!! Then again, they also duped me into thinking I was going to have the meal of my life. It was good but I was a little disappointed. Those little shops are the only way to have authentic, hand-made, fresh Mexican food. The smaller the shop the better the food (j/k). To be honest, I've had much better. It's not that it wasn't authentic, hand-made, or fresh. It just lacked flavor. How is this possible?!? I started to think that there was something wrong with me, maybe I lost the taste buds in my tongue, so I went to my spice rack and dumped an assortment of spices in my mouth. Nope, it wasn't me. Everything was working properly as I chewed and chewed thinking that there had to have been a better way to test my theory. Maybe it was an ""off"" day, it is good enough and right down the street from me, so I think it deserves another chance (which I don't give too often). *** They just had their windows busted, so they are boarded up. They are still open so please don't pass them by. It's not their fault that there are shitty people in this world. *** Cash only",0.9552,0.762,0.149,0.089,0.5913938492063492
2010-10-05,4.0,"There's not too much parking on Elmdale.  You might have to park on Clark or Thorndale.  It's a couple of stores in from Clark on Elmdale and you have to take a few steps down into the restaurant.  There are only about 5 tables so there were some people ordering to go.   The main attraction are the huaraches.  The waitress spoke perfect English so it was easy to ask questions and choose which condiments and sides you wanted.  We had the huaraches al pastor and chorizo con papas.  Since I wanted everything on it, they filled the huarache with beans and then put it on the griddle.  The fillings were cooked on the side and combined with the cilantro, onions, and topped with cheese.  The portion is quite huge and it's $6 for one topping, $7 for 2, and $7.50 to put 3 toppings in one.  The al pastor was not as flavorful as I had expected.  The chorizo con papas was good, but for a Sunday, I felt like it could have used some eggs.  They have coke in a bottle and other soft drinks.  I would definitely come back to try the sopes and other fillings for the huaraches.  Because the place was a little small, it would probably be a place where I would go back for carryout.",0.9322,0.922,0.078,0.0,0.45277777777777783
2010-08-23,5.0,"I usually don't like basing my reviews on if a certain cuisine is 'authentic' or not. However, I'm going to make an exception in this case.  Huaraches Dona Chio is the text book example of authentic Mexican comfort food. Even down to the decor. The whole menu is in Spanish and the lady behind the counter speaks no English! But don't let this deter you, since good food is universal! I had the Huaraches Pollo. Made with very seasoned chicken, cilantro, onions and a delicious smokey sauce. I was in heaven! I would also suggest going there on the weekdays because it gets mighty packed on weekends with hungry patrons watching soccer...er um...I meant football! :)  Oh! The cherry on the sundae is the fact that they have REAL coca cola..ya know, the stuff made with SUGAR and not corn syrup. Yum! Stop on by, you wont regret it.",0.9381,0.829,0.131,0.041,0.48807319223985896
2010-08-11,5.0,"Now this is soul soothing Mexican Food! Around the corner on Clark Street is the new culinary showoff GaztroWagon, and it's tasty... if the GW is proving too lengthy of a wait, may I suggest Dona Chio?!?! It's just, really good. Big-Foot sized sandals of fresh masa griddled with your choice of preparations (Huilacoche (corn mushrooms)? Pastor? Heavenly...) Not overly spiced salsas and it's all just very tasty. BOTTLES of Mexican Coke (real sugar baby!) and you can get out of here for about $10 a person, no problem.",0.7202,0.845,0.104,0.051,0.26931818181818185
2010-06-22,3.0,"C and I came across this place, rather unexpectedly, while biking and returned last Monday night.  As unexpected as the discovery is the location.  It's on a side street and a few steps down from the sidewalk.  This adds to its charm.  It's a hole in the wall, but we like holes in the wall. Food:  1 star.  We really didn't know what to expect and never heard of huaraches before (sort of like a pizza; sort of . . . on a tortilla).  C had a plain one and I had one that was half tintga (chicken) and half pastor (pork).  Both huaraches were just delicious.  At so many Mexican restaurants I have been served port that has a great deal of fat; this had none. Atmosphere:  1/2 star:  Autentico. Service:  1/2 star:  For what it is, the service is perfectly okay.  The waitress had to hunt around for a wine opener, but eventually she did find one. BYOB:  1 star.  Yes, which we like. We're going back tonight.",0.9882,0.808,0.192,0.0,0.4403769841269841
2010-05-20,2.0,"After reading reviews I had high hopes for this place. Yes, the huaraches are huge. But I like my huaraches fried and crispy. These are just put on a hot griddle and served, more like an oversized tortilla filled with beans. It is filling, however you can tell that the quality of the meat is not very good. Originally it was a 3-star review but since the meat was such low quality in my opinion, -1 star. Probably won't be coming back here as there are many mexican joints I prefer.",0.3482,0.855,0.096,0.048,0.5167948717948717
2010-01-06,1.0,"I agree with the one reviewer who distinguishes between home-made and food that's done well. Yes, it is home made but I have made 2 different runs at this place about one year apart. Each time the food, huaraches or the tacos, sat in my stomach like a rock. The huarache was worse. At about 2 am, I thought I was gonna die. It wasn't good. The tacos de tinga were better but I still felt kinda' yucky afterwards. I eat at Xoco and Frontera with some regularity and although I wanted to like this place, I don't want to be tasting yesterday's lunch at 2 am. I won't return.",-0.5722,0.725,0.131,0.145,0.575
2009-12-17,4.0,"I'll repeat Morgan C - this place is a real gem.  Tiny neighborhood restaurant, you would miss it if you weren't looking for it (maybe even if you were?).  Has about 5 tables, when I picked up my carry-out it was packed with an after church crowd. The atmosphere is great for a hole-in-the-wall, and the food is amazing. Get the Huaraches of course!  I like the pork pastor.",0.8777,0.825,0.152,0.023,0.6125
2009-09-27,5.0,"The hubs went to pick up food from here...and we LOVED it. Everything was flavored amazingly. Seriously, the chicken is ridiculously delicious.  Here, you will get a nice taste of different Mexican flavors that you probably won't find at your local Mexican restaurant.  If you want to expose your taste buds to something different, try this place and you won't be disappointed.",0.8748,0.716,0.203,0.081,0.5787878787878787
2009-08-27,4.0,"Hello, neighborhood gem! Tucked away in a walk-down basement of an apartment building with seating for about 12, I would always see this place busy... and what's more, busy with Mexicans. Any time an ethnic restaurant is full of members of its ethnicity, it's always a good sign. Hurraches are made from scratch, or at least scooped and squished right in front of you. And they're delicious. Definitely more on the ""guilty pleasure"" end of the spectrum than ""sensible eating,"" but hey... Burritos are huge and full of tasty fillings, not just lukewarm rice and lettuce like some places, even ""authentic"" Mexican places.  Prices are reasonable, though I wouldn't call them ""cheap."" But I'd rather spend the same amount of money I'd spend at someplace like Chipotle here.  The only thing I wasn't impressed with was the chips. Just your run of the mill, out-of-the-bag corn chips. Oh well, skip them and leave more room for burrito or a hurrache.",0.9221,0.838,0.122,0.039,0.5905357142857143
2009-07-25,5.0,"The type of meal where the whole time I was like ""omfg"" My first time there, went based on the other yelp reviews. I just had a gordita (it was simple and great), random time of day that I was hungry there was no one else but me and the owner sitting and eating and watching Univision. I'm not picky about the strict authenticity or ..Mexicanness.. or whatever people have been whining about, all I know is that the food was damn good and I have no complaints. I have yet to explore the other Mexican places in the area, I saw that there are tons in Rogers Park a few blocks up, so I'm sure some others are comparable, but whatever Also, because of its location I would never have found this, so thanks yelp.",-0.0311,0.793,0.096,0.111,0.40661375661375665
2009-05-18,4.0,"I have been huarachefied! The place is unassuming, as is the service. I had the pastor, which was tasty and tender with the sweet tang of barbecue. I had a bite of the tinga, too, and it tasted fresh from the bird. The hurache's masa base was warm and fluffy, hand made by an abuela in the back. Topped off with an ice cold Mexican coke (made with sugar instead of corn syrup) and good company, it was a lovely meal.",0.9468,0.801,0.199,0.0,0.55
2009-05-12,3.0,"I liked.  I didn't love.   Is it completely cliche that we ended up getting takeout from here on Cinco de Mayo?   We ordered a taco, a sope, a gordita and a tostada.  The meats were wrong on three out of the four.  Yes, we ordered the sesos, but on the gordita, not my tostada.  And the picadillo wasn't great, either. The saving grace was the huge and tasty taco.  I quite liked the carne asada and the red & green salsas were good, too.",0.851,0.716,0.192,0.093,0.6049999999999999
2009-05-11,4.0,"Easily, the cheapest place I've eaten in 2009.  Defines ""Hole-in-the-wall.""  If you are looking for a wholly (hole-y?) satisfying meal for under $15 (for 2 people), you've hit a winner with this one.  My date (ok, my mom) and I split the Huaraches with Mexican sausage and potato...which EASILY feeds 2 people. Actually, it could stuff them. Like others have said, it's a form of ""Mexican pizza,"" with cheese, sausage, potato, red sauce, salsa, cilantro, onion, etc. You can order it with whatever you'd like, and it comes on a sope like (but more crispy) ""crust."" FILLING. HOT. Awesome. $4.75. I kid you not.  All made in house, too.  Order an horchata for $1.25, and a Diet Coke for a buck...and wow. We even ordered a chicken sope (too dry for me) for good measure, and still the bill was $12.93. All together. With tax. Crazy! The service is uninspired, but that can be expected. If I was working for tips on stuff that was priced at $4, I'd be pretty unenthused too. However, our food all arrived, and she was adequate, just young...and ya know, not interested. The ambience is typical taqueria, but I recommend ordering ""to go"" and eating at the park next door... Credit cards ARE accepted.  You'd likely never find it unless you lived in this neighborhood, so here's a tip: Driving north on Clark past Ridge, turn RIGHT on Elmdale. It's a street where westbound is Peterson, and eastbound is a side street called...Elmdale. It's on that first block, on the right. (Elmdaleis a one way street going East). Parking on Clark may be easier (meters), but Elmdale has some street parking, no permits.  Bus: 22 Clark.  Or, ride your bike or walk. It's nice out. Then you can consume more huaraches. For cheap. YAY!",0.9879,0.81,0.155,0.035,0.5888632872503841
2009-04-07,3.0,"When I heard about this place, I got excited because it's in the hood and I'm always on the look out for new unique places!  We followed the suggestions of fellow yelpers and got two orders of Huraches. My husband got the Tinga (spicy chicken) and I got Rajas ( grilled poblano peppers with onion).  We also order a ""milkshake"" to split. Now perhaps there is a difference between what we think is a milkshake and what Mexico thinks is a milkshake. With that said, it was not a milkshake by our standards. What we got was chocolate milk. Which was tasty, but not exactly what we were expecting.  The huaraches were ginormous as promised and it was really nice to see everything being made right in front of you. When you put your order in they ask you what sauce you want and I asked for the least spicy of the bunch. That apparently is the green sauce. Which to me, a spicy light weight, was NOT mild nor medium. That bugger is HOT. And my husband got the red which is supposed to be hotter than the green. But he can handle that sort of thing better than I can. But he too said it was super hot. But he did finish his whole meal (within two days, it's impossible to eat one whole huarache in a sitting I think!) The toppings were plentiful and well spread out (which can be annoyingly absent on pizza, which this dish resembles.) and everything seemed fresh.  However, it was just too spicy for me. I couldn't taste much else besides the heat. So I don't know if there were other flavors at work or not.  While there seems to be lots of choices on their menu and some certainly unique, I just don't know if it's for me. I really want to like this place too! Maybe one more trip some time, the price is pretty cheap!",0.9895,0.885,0.115,0.0,0.5843975468975469
2009-03-25,3.0,"Found it amusing that this place was listed as ""hot"" among Yelp reviewers. Huh. The pizza analogies below (above?) are probably apt: the masas are gut-busting knife-and-forkers that will not freak out those familiar with the deep dish milieu. I'd start with the Tinga and work your way from there. There's a certain novelty to the huaraches the first time you come here, a novelty that sustains a 4-star review; yet I've been struck by the law of diminishing returns upon subsequent visits--it turns out they're just okay. Satisfying, sure, but only in a collective grease pit sort of way; nothing about the ingredients, their combination, the cooking method stands out. In no way is this place a substitute for Asadero or Carneceria Leon, my two pillars of Mexican street food.",0.4316,0.891,0.077,0.032,0.5852607709750567
2009-03-10,2.0,Maybe I was there on a bad night but I was not impressed. Sure the place is quirky and everything is hand made but after eating my food I felt like I had a large rock in my stomach.,0.1346,0.643,0.173,0.184,0.7968253968253968
2009-03-06,1.0,"I am Mexican.  Was born in Mexico.  Most of my family is still in Mexico. Have eaten D.F. style food before as half of my family lives there--This is NOT it. There are places in this city that do serve it so it is not, in fact, unrealistic to expect authentic Mexican food from el DF. I read the reviews last night.  I got sooooo excited.  I live in andersonville and so far Mexican restaurant after  Mexican restaurant around here has been a disappointment.  So really the bar wasn't set so high for this place to begin with.  But since I was in the mood for handmade huaraches and tortillas, my boyfriend and I decided to give it a try.  So we walked up clark to elmdale to try it out.  I really wanted to like this place because I grew up on the southside of Chicago and so far the majority of  Mexican food on the northside pales in comparison to some of my favorite places on the southside.   That said, I'm not sure what most of these reviews are talking about but my conclusion is this: yelpers are confusing handmade food with quality food.  Yes, the tortillas and masa are hand made.  But no, the food is not good.  My boyfriend ordered a huarache al pastor and I ordered a sope with picadillo and a taco de carne asada.  He ordered an agua de jamaica and I ordered an agua de tamarindo.  Here is my assessment of the food.  The masa is not great, it's not bad but it's not very good.  You can go to a Mexican store and buy some premade masa that is much better than the stuff they make here.   Why I didn't just go do that and save myself the stomach ache after going to this place is beyond me. The quality of their meat is terrible.  They use meat with too much fat which they then proceed to over cook until it's so dry that the only thing keeping it semi-moist is the grease it was cooked in. And the quality of the meat in general is really bad.  I know this is a taqueria but there are taquerias in this city that would never serve that kind of meat. The picadillo on my sope was not picadillo--it's basically ground up beef that was cooked.  FYI--picadillo is ground beef that is marinated and cooked in a very yummy sauce made from tomatoes, onions, sometimes nuts, olives, etc.  This was just ground beef that was overcooked as far as I could tell. They ask you if you want your choice of meat accompanied with red or green salsa, except if the picadillo had been made properly it wouldn't have needed a salsa. (that was the first red flag) The carne asada in my taco was so overcooked that only the grease was saving it from being completely dry.   The huarache al pastor that my boyfriend ate didn't taste like al pastor--in part because it was smothered in the red salsa that they recommend you order.  Again, if the al pastor had been made properly, there would have been no need for that crappy salsa. Moving on to the salsa. The red salsa  that they encourage you to order on everything  is so spicy that you can't possibly taste any of the other flavors (maybe bad, maybe good--who knows!) underneath it all.  I like spicy salsa's but this one had no flavor other than spicy.  Good salsa's are not just spicy but they are supposed to be layered with flavors.   The aguas were nothing to write home about either but they were probably the best thing I had in that meal.  The only other redeeming quality in this meal (in my case not so redeeming) is that they give you a lot of food.  I did my best to eat this food because i don't like wasting food  but it made me sick and it made my boyfriend, who has an iron stomach, sick as well.  I feel bad for writing my paisanos a bad review but it infuriates me when yelpers write good reviews about food they clearly know nothing about.",0.9869,0.807,0.116,0.077,0.4916100999694752
2009-03-02,4.0,"Never knew this place even existed until I read Keshia C.'s review.  This place sounded so good that I decided to visit the next day.  Fiance and I dined in and decided on the steak and chorizo huarches (they ran out of chicken!).  We couldn't wait to eat because we were starving....but we waited and waited........and waited as we were getting lightheaded.  There was only this one lady preparing it behind the counter.  She was fulfilling a carry-out order and also had another table to cook for.  The huaraches are made from scratch and they were delicious.  I was surprised to find frijoles inside of the tortilla....not on top, but inside!  On top was a layer of green salsa, steak, cilantro, and onions.  The steak was juicy and well-marinated. One star off for the lonnnnng wait.  I don't think I'll dine in anymore, just do take-out!  Next time, I would love to try the spicy chicken.",0.9376,0.896,0.104,0.0,0.6153846153846154
2009-02-27,4.0,"What the f?! Why didn't anyone tell me where this place was before? Too bad its on a side street behind Senn H.S. where no one can see it from Clark St. Otherwise, I'm sure people will be lining up to go here. I've never had huaraches before, but I'm so glad I tried it. I ordered one with half Tinga (hella delicious spicy chicken) and half Carne Asada (since they ran out of tinga to make a whole one). Yummy! It's definitely best described as a Mexican pizza. It's made on a giant, handmade masa tortilla filled with re-fried beans, then topped with meat, cheese, onions, cilantro and your choice of sauce. (I had the red sauce, yum! No onions for me though, yuck!). It was SO good. (Personally, I preferred the tinga over the carne asada.) I was starving but only managed to eat half. The rest made great leftovers.  Stop in! The place is really cute, but gets kinda hot when the food is cooking. Expect a wait too because there's only one person cooking. If your in the hood and starving for a big meal on the cheap, go here. It's great.",0.9904,0.722,0.206,0.072,0.6142222222222222
2009-02-24,5.0,"Huge masas filled with refried beans and then topped with whatever Mexican meat/veggie combination you choose?  Yea, that's pretty much a huarache.  Something I had never even heard of before, and I'm glad we made the trip out here. Huarache Dona Chio is the definition of a hole in the wall on a totally unsuspecting little strip just north of Andersonville. We ordered our huaraches (for two toppings, i think $6.50 each - and easily two meals in one huarache) and waited as the owner prepared each one fresh, with telenovelas playing on a tv in the dining area. I ordered a huarache topped with tinga (marinated chicken) and rajas (sauteed poblanos and onions) and my date got one with asado (steak) and hongas (mushrooms). That is then topped with Mexican cheese and cilantro, onions, red and green salsas if you want. The tinga was deliciously marinated - not dry at all - but all white meat (amazing).  The peppers and onions were delicious and a nice compliment.   Food + atmosphere + price = amazing.",0.982,0.816,0.184,0.0,0.6301587301587301
2009-02-24,5.0,"In the spectrum of traditional Mexican cuisine outside of Pilsen, Chicago falls quite short. However Huaraches Dona Chio is an amazing pearl in the oyster of the banality of Edgewater cuisine. Each Huaracha is made fresh in front of you behind the counter. For those not familiar a Huaracha is a corn tortilla stuffed with refried beans. It is then topped with your choice of meat and vegetable, cheese, cilantro and onion. The food is fresh. The ambiance is original and the pricing is perfect for this ""Great Recession."" This was the most authentic Mexican cuisine experience I have had in Chicago. For a Texas boy that is saying something.  Cash only, so bring your wallet and an empty stomach. You won't be disappointed.",0.9599,0.831,0.156,0.013,0.5666666666666667
2009-02-16,5.0,Simply the best Mexican food I've ever had in Chicago. It's amazing. Even the rice and beans and sour cream are fresh and memorable.  Haven't tried the huaraches yet but I'll get those on my next visit. I can't believe I walked by this place without entering for a year!,0.7133,0.864,0.136,0.0,0.3946428571428572
2009-01-30,4.0,"Imagine pizza. Now Mexify it. And voila, now you have huaraches--delicious masa tortillas topped with fresh beans, delicious meats, queso fresca, cilantro, onion and the salsa of your choosing. Before visitng Huaraches Dona Chio, I'd never tried the dish before. So for my first visit, I ordered up the tinga and my dinner partner ordered the asado. The tinga was everything I look for in a chicken--all white meat, not too dry, and absolutely slathered in tasty, spicy chipotle sauce. Amazing! I ordered it with a green salsa, but I think in the future I'd hold off on it. It was almost too much sauce and the flavor of the green salsa conflicted with the tinga a bit. The asada was a bit fatty/chewy and just not what I imagine asada to be, so I may try one of their other offerings next time. The chorizo and the cactus both intrigued me, as did the huitlacoche, which is essentially corn mushroom. (Or if you want to get overly technical and perhaps kill your appetite, it's a fungus/disease that infects corn, but mm, mm tasty! apparently. Look it up at your own discretion.) As others said, the service may be kind of slow. (Kind of reminded me of Europe where you have to make it clear that you're done and want your check.) And don't be wary of this spot's basement storefront location. I'm looking forward to the summer when I can grab some tacos ($2.50 each!), huaraches and horchata (delicious!) and lounge about the nearby park and bask in sunshine and Mexican goodness.",0.9121,0.894,0.082,0.024,0.48194444444444434
2009-01-03,4.0,"We went for our first time last night.  Wow, that was a fun meal.  That was the first time I ever tried a huarache.  The red sauce was nice and spicy, which was a good thing. I can't imagine how spicy the green is.   You can't beat the price at this place, that's for sure.  They give a lot for the buck here.  My wife has a leftover meal coming up.  The bill for two huaraches and two drinks came out to about $15.  They were very helpful in explaining to me what a huarache is, and I was able to omit what I wanted (for me, that meant no beans or onions).   Also of note is that they have some pretty adventurous ingredients for the huarache, if one so chooses.  My wife added huitlacoche.  More daring ingredients include tongue and brains (not for me, but some do like this stuff).  I tried a little of the huitlacoche, and I think I will put it on mine the next time we go.  My wife remembered seeing Bobby Flay using it on Iron Chef once.  It's also called Mexican truffles or corn smut.",0.9376,0.881,0.111,0.008,0.4748456790123456
