date,star,text,compound,neutral,positive,negative,subjectivity
2017-08-06,5.0,"My first huarache was a definite success. Think Mexican flatbread, with a fresh masa crust and salsa as the sauce. Yes, it's delicious. After consulting the internet, I opted for tinga (spicy chicken, which was absolutely divine) and nopales (cactus - trust me, it's delicious). Both were fantastic - flavorful and a great contrast with the crispiness of the crust. One huarache will feed even the hungriest person, and could easily be split as an entree for lighter eaters. I saw some quesadillas and other entrees come out, all looked delicious. A bonus if you come for lunch: they have an adorable sidewalk patio with a view of the park next door!",0.9896,0.702,0.298,0.0,0.6276041666666667
2017-07-30,5.0,"Wow. This is another little Mexican gem in Chicago. We stumbled upon this place some months ago after we moved to Andersonville and it is our go-to place when we want some quick Mexico City-style street food. Tacos, huaraches and sopes. Nothing fancy, but very savory and very well prepared. The secret is in the salsas. The food is great, but soak your huarache in green or red salsa (or both!) and you've got yourself a winner! Small hole-in-the-wall type of place, very clean with very attentive personnel. Try the pastor or chorizo. Steak is also great. You will never regret going here!",0.988,0.734,0.266,0.0,0.5292857142857142
2017-06-26,4.0,"Their gorditas are HUGE, on size and flavor, great stuff! We tried their steak quesadillas, they were so yummy. Their gorditas were delicious, the place is a bit slow but that's because they make their gorditas, tortillas and sopes fresh to order",0.8966,0.737,0.263,0.0,0.71
2017-06-15,5.0,"Who doesn't like a huge bean stuffed, steak topped quesamasatacorito? You might not find this off Clark spot. Seek it out. Decent vegetarian topping options too. They ask Red or green? I say Christmas!",-0.5753,0.864,0.0,0.136,0.4666666666666667
2017-06-02,5.0,"I am so glad I found this place! I had been looking for flor de calabaza since my last trip to Mexico, and today I finally had a quesadilla with flor de calabaza and rajas. Not quite the same, but pretty damn close. Hubby ordered a gordita and a huarache, and we were both pleased with the fresh yumminess, handmade masa, and the flavorful sauces-- and that we got a box to bring leftovers home. The choice of aguas was great (and tasty!) and the prices are great, too.  If you are used to flour tortillas and endless baskets of chips, this might not be the place for you. But if you want to try something authentic, fresh, and delicious, visit this little dive!",0.9865,0.734,0.241,0.025,0.6922619047619047
2017-05-29,4.0,"Love the idea that the matriarchs are cooking behind the counter, no stacks of packaged tortillas here... had a Huaraches and it was great, fresh off the griddle with shrooms, pollo and poblano, very tasty, especially with their green sauce... There are only 5 tables, they do a lot of takeout, but service was great, too, with a smile. Will come back for more...",0.9337,0.757,0.22,0.022,0.5416666666666666
2017-04-26,1.0,"Everytime I come to this place its a big disappointment. The el pastore is horrible, everything takes forever to get your order and today I went at 11:15 which is 15 minutes past the time they open and no one would let me in. Although they had the blinds pulled down I could see someone cooking at the flat top and they wouldn't come to open the door, last time I ever go there.",-0.802,0.858,0.024,0.119,0.3730555555555556
2017-03-30,5.0,"Quality handmade quesadillas!  Love my half chicken tinga & half flor de calabaza quesadillas!  They're so big I always have leftovers, YUM!  Their salsas are also amazing.  If you dine in be prepared to wait in a tiny location but again food is worth it and the prices even better!",0.9156,0.752,0.248,0.0,0.4425925925925926
2017-02-15,5.0,"Love this place, a must when you are up north.Great food at a good price. Very friendly",0.8908,0.531,0.469,0.0,0.6166666666666667
2017-01-28,5.0,"they have great steak here, I like the burritos. They always give so many salsas too which is really nice",0.8655,0.623,0.377,0.0,0.75
2017-01-04,5.0,I live in the area and it is so hard to go anywhere else for traditional Mexican food.  It's legit! Love it!,0.6017,0.741,0.187,0.073,0.47833333333333333
2016-12-03,5.0,"Delicious, incredible, hand made Mexican food. Very glad this is in walking distance!  If they served margaritas it would be even better. :) love the huaraches, but anything on the menu is amazing. Plus the price is extremely reasonable!",0.9511,0.628,0.372,0.0,0.7222222222222222
2016-11-20,5.0,"so good , I mean everything is made fresh , form a scratch. I get hungry after work , and when I nearby I get lost of  food.  Its very fresh,",0.6697,0.653,0.268,0.079,0.609375
2016-11-04,2.0,This place is very small so count on either needing to wait or getting carry out. The restrooms had no toilet paper and I had to walk through the alley (outside) and into a side kitchen door to get to it. I was charged for a side of rice that I never got but unfortunately didn't realize it until after I'd paid. The food was good but they charged us for hot sauce (aka salsa). While we were eating many different people came into the restaurant and walked behind the counter and we're just hanging out...probably why I found a hair in my food.,0.4946,0.888,0.062,0.05,0.5355555555555556
2016-07-23,5.0,Stumbled upon this place and so glad I did! It's a hidden gem. Never had a huarache before but I will want more in the future. Super affordable also.,0.8599,0.698,0.302,0.0,0.525
2016-07-18,5.0,Tasty and you get  lot of food for the money!  Loved the huaraches.  They have a new loyal customer:),0.807,0.687,0.313,0.0,0.771969696969697
2016-06-23,5.0,"Stumbled upon this place, what a find.  Authentic Mexican cuisine, delicious.  Ordered the Huaraches without knowing what was coming, a real treat. Just the right heat for this aging Gringo, fresh made corn tortilla, chicken, Queso cheese , cilantro and ????    I'll be back!",0.8736,0.792,0.208,0.0,0.5044642857142857
2016-06-11,5.0,"Nick is hilariously right about a few things for this place - all the way from 2010. It's not as underground as you'd expect, if you care about that. However, they are one of the few early places in Chicago to start making Huaraches, something that is far more common in Mexico than it is here. That also means that this is pretty authentic, and it shows. You won't see that many places that have done the fermented mushroom stuff either.  Food is fantastic, spices are excellent, but you'll definitely get a kick from a lot of the food. It's also a really small establishment, so there are only maybe 5 or 6 tables. As of from when this review was written to now, there are a number of places in the surrounding area that also make huaraches and this general style of central mexican cuisine. Just like how there are only a few places that make yucatan cuisine  It's an awesome place, even if you're stopping in once to get a huarache.  They do take card now unlike 2010.",0.9631,0.867,0.123,0.01,0.5683673469387754
2016-05-26,5.0,"The food is amazing, something I didn't expect at all. The guys over at Father and Son barbershop recommended this place. So glad I checked it out. Great service, cute outdoor area. Super satisfied. Will be back!",0.9719,0.549,0.451,0.0,0.7595238095238095
2016-05-24,5.0,My friend introduced me o this place and i love it every single time. Quesadillas with corn mushroom and hot sauce.,0.8126,0.697,0.303,0.0,0.5547619047619048
2016-04-03,4.0,"I hyped myself all week for this place and let me tell you, I was not disappointed the second I left the establishment. Those huaraches will satisfy any being and whether you're a meat lover or a vegetarian, there's a certain style for you. Steak, spicy pork, chorizo + potatoes, nopales, mushrooms, chicken...this place knew your soft spot. I went for the mushroom huarache, with some salsa verde spread all over it, and was taken to Flavortown (shout out to Guy Fieri).   I've never been to this part of Chicago in my life, but thanks to the television show Chicago's Best (on WGN-Channel 9) they expose me to neat little gems such as Huaraches Doña Chio that satisfies my Mexican food cravings for when I'm in a mood that is beyond the usual taco, torta, or burrito deal. Come here for an amazing Huarache that is not only amazing, but is served by great rapid hard workers at an extremely reasonable price.",0.991,0.758,0.223,0.019,0.4772408963585435
2016-03-29,1.0,"Ok. This place really sucked. First off  it took 5 minutes for us to get a menu.  Then, Eduardo had gone for chilaquiles, but they only serve those until 1pm. Whatever. We order our huaraches,  they are big. Mine had Carne asada and chicarron, which turned out to be shredded pork meat, eduardo had Carne asada and papas con corizo. Didn't really have much flavor. All you could taste was the oil they used to make the food. The waitress brought us rice and beans that belonged to the other table. Now mind you, there are only 6 tables, how the hell can you screw that up!  To top it all off, eduardo ended up throwing up on the way home. I don't know how this place can have an almost 5 star review from everyone else, but I would definitely give it half a star at the very most. Needless to say, the waitress didn't even deserve the $1.25 I left her for tip. VERY DISAPPOINTED! !",-0.9255,0.858,0.041,0.101,0.4800000000000001
2016-03-26,4.0,Great Mexican food! I especially like that you can customize your huarache!,0.8165,0.546,0.454,0.0,0.5833333333333334
2016-03-18,5.0,Huaraches are amazing as is the chilaquiles. This place may be small but I never walk away disappointed.,0.6938,0.724,0.276,0.0,0.6833333333333332
2016-03-12,5.0,Chicken tinga tacos made with lots of love. Excellent food at a great price.,0.9186,0.455,0.545,0.0,0.825
2016-02-13,4.0,"This was an unexpected find, and the food was amazing. We got it to go, and the food traveled home well and was so delicious! I recommend the Horchata especially!",0.9325,0.641,0.359,0.0,0.975
2016-01-07,5.0,All I can is wow. Had a chicken huarache and wow talk about fresh. This taste homemade and delicious. Am def coming back.,0.9274,0.556,0.444,0.0,0.7416666666666667
2016-01-03,5.0,"This is the second time I ordered from this place... I must tell the food is pretty good. I did try so far Pozole soup, Menudo soup ... Those are soooo goood. The huaraches are huge and the gorditas also... Highly recommend!!!!",0.8614,0.79,0.21,0.0,0.6733333333333333
2015-12-09,5.0,love their thinga huaraches. The restaurant itself is small but the food is so worth it. Would definitely recommend  this place :),0.9488,0.505,0.495,0.0,0.52
2015-09-27,5.0,"We (2 random gringos who were hungry and in the neighbourhood) wandered in here mostly because of the Yelp reviews. You Yelp reviewers did not mislead us. Not sure if it was Doña Chio herself who served us up 2 delicious slabs of the fresh, tasty, delicious, and shockingly inexpensive mexi-gasm known as Huarache, but mother of god I wanted to hug that sweet old lady and hand her the key to the city or something. It was like the entire nation of Mexico was high fiving my tastebuds. Recommendations: The Huaraches are HUGE. If you're average-portion eaters, like me and the fella, SPLIT ONE. Also, don't be a scroogy stingy penny pincher, woman up and get all three toppings. Chorizo was magnificent, rajas were even better than L'Patron (IF ANY L'PATRON EMPLOYEES ARE READING THIS, I STILL LOVE YOU) and the al pastor was probably the best I've had in the city-- perfectly simmered, perfectly seasoned prime pieces o' pork, not the third-rate gristly dumpster-meat you sometimes get. Man, I wish I lived closer. Anyway, keep making magic, Doña Chio.",0.9974,0.674,0.32,0.006,0.6976944444444445
2015-08-19,5.0,"OMG..... fresh Huaraches made from masa!!!!  Fresh masa tacos!!!!!!!  It just doesn't get any better than this if you like FRESH tortillas made right in front of you.  This place is TINY.  they only have 4 very small tables in a space that would do better with 2.  The food is super fresh.  It is sort of a dump........OK, it really is a dump in a basement, but the food is outrageous.  BYOB.",-0.3284,0.728,0.155,0.117,0.570952380952381
2015-07-15,2.0,"Ordered steak enchiladas with the green sauce. Got my order, took it home, opened it (I should've checked it before I left). There was no sauce on the enchiladas, the steak was on top, they didn't look like enchiladas, just 3 tortillas rolled with cheese on top and burnt steak on top of the tortillas....I've never had enchiladas that look like that. Maybe thats another way of making them, but I'm highly disappointed. I prefer my meat inside my enchiladas. Also, I got no salsa on the side. I'm not happy. Will not order from here again.",-0.9169,0.805,0.04,0.154,0.5071428571428571
2015-03-31,4.0,"I've always seen this little place as I have walked around the neighborhood, but it wasn't until my husband heard about it from our barber that we decided to give it a whirl. We called in the order, and 15 minutes later I was walking up the block to get our food.  Yeah, it looks a little divey from the outside, but it's a homey mom and pop place inside: two women who looked about my mom's age were at the helm when I got there.  They make their corn tortillas on site, as I saw the mixture in the corner by the grill, which explains why they ask for at least 15 minutes. And they are completely worth the wait. I did chorizo and potato tacos, and two left me content and satiated. I love the onion /cilantro mix, but my husband does not, so his steak tacos only had cheese. The tomatillo verde sauce was a nice amount of heat when added on top.  A quick lunch for two, under $15 and a 5 minute walk from home. And they can even take credit cards. Win!",0.973,0.848,0.133,0.02,0.42692307692307696
2015-03-25,5.0,Good food here. Always consistent and always on point. The only thing that stinks sometimes is finding parking. This is place always has freshly made Huaraches!,0.2942,0.822,0.109,0.069,0.5700000000000001
2015-03-15,5.0,"This place is legit and super delicioso. I came here with family and left feeling totally at home with how the staff was. It's a total mom and pop restaurant with fresh and authentic cuisine. I got to check a food item to try off my bucket list: Huitlacoche. It was flavorful with a silky outside finish and creamy inside. I ordered that with my Huarache and also got their chicken tinga along with a horchata. Best horchata I've ever had, tasted milky and not overkill on the cinnamon. For dessert I tried the flan and that was a rather large slice (ended up splitting it with the sister) and it was pretty yummy, not amazing, but still very good. Can't wait to come back again!",0.9152,0.852,0.132,0.016,0.5589455782312925
2015-01-09,5.0,"Ay Mi Huaraches Doña Chio ----- Los extraño mucho!!!! Can't wait to get back home to Chicago.... This will be our first meal when we get home for sure. Whether it's Chilaquiles for breakfast, un taco for lunch, or un huarache for dinner....We love everything. Yes, sometimes you have a wait a tad longer than you would expect, but the place is small, everything is handmade, and fresh. Has the same feel as some of our favorite taquerias back in Mexico. Just an absolute fave of ours! :)",0.9685,0.782,0.218,0.0,0.5224747474747474
2014-11-25,5.0,"Keeping it simple:  Great homemade mexican food that is actually authentic and tastes homemade.  The best part, portions are more than enough and incredibly affordable.",0.8519,0.735,0.265,0.0,0.5071428571428571
2014-11-20,1.0,"They are selective when providing quality food to certain group of people. They can not like you and under serve you. Got great food when I was there with group of Latin friends, when I went by my self it was like going to place where I am not welcomed. Definitely NOT GOING BACK!!!!!!!",0.6065,0.699,0.166,0.135,0.45535714285714285
2014-10-11,4.0,"I heard about this place because the bf's hair stylist, a transplant from Mexico City, said Huaraches Dona Chio was his favorite Mexican place in Chicago. Neither of us had ever heard of a huarache, so we paid this hole-in-the-wall a visit. Turns out a huarache is basically a Mexican pizza, with a corn tortilla for the base, refried beans for the ""sauce,"" and your choice of meat or vegetables, onions, cilantro, cheese, and red/green sauce as the toppings. We tried the pastor, (chicken) tinga, and chorizo. The pastor was bland, the chorizo was very flavorful, and the tinga was fine. The red sauce was spicier than green sauce. The huarache should be eaten relatively quickly because the tortilla gets soggy from the refried beans and or sauce and then falls apart. The prices are very cheap considering the amount of food you get.  We waited about 30 minutes for our food, and there were 3 orders in front of us. This restaurant is very small, maybe 10 seats, and doesn't have the greatest eat-in atmosphere, but it's a clean hole-in-the-wall establishment. In the future I would order take-out.",0.5812,0.95,0.038,0.012,0.5398958333333334
2014-07-06,5.0,"Go to Huaraches Dona Chio for some serious business. For under $8, you will receive a delicious gigantic huarache which literally folds over an entire dinner plate. My favorite is the huarache with two toppings, flor de cabaza (zucchini flowers) and al pastor (marinated pork). Now, the al pastor is a little different here and is more like a cross between tinga and al pastor, which results in a more stewy version. However, the sauce perfectly soaks into the masa. If you are not in the mood for a huarache, their tacos are also excellent in part because Dona Chio makes all of their tortillas by hand. And, who in their right mind does not love a hand made tortilla?",0.9644,0.787,0.178,0.035,0.655952380952381
2014-06-18,5.0,I ordered the salsa verde chicken enchiladas and I must say they were the best enchiladas I've had in a while definitely going back! lil hesitant in walkin in but went for it and glad I did. It is very small but very clean. Best random spot I've hit up by far.,0.9609,0.673,0.303,0.024,0.598
2014-06-04,5.0,Best Mexican food! Hands down! The staff and cooks are really nice. Highly recommend this place if you like tacos.,0.9251,0.544,0.456,0.0,0.4257777777777778
2014-01-29,5.0,"This place is sort of in a creepy part of the neighborhood.. Or at least, it was at night as the sister and I walked from the Raven Theater. Disappointed they close relatively early, but they were nice enough to let my sister and I order and eat in (when I placed the order, I assumed they'd wrap it up in takeaway since we were kind of close to closing time, but they brought it out and all). The food though. Hooo my god. Is amazing. Granted, we were starved and the food was scarfed down pretty quickly (just because they were nice and brought the food out didn't mean we were going to lounge around after they'd closed). The tortilla part of the huaraches tasted so /fresh/ and homemade and it was simply glorious. I just wish it wasn't so far away. Or maybe that's a blessing in disguise. Because I'd be frequenting this place like my grandmother owned it.",0.9855,0.744,0.206,0.05,0.6677207341269841
2013-12-23,5.0,The best thing since sliced bread.  Not for groups larger than 4 and even then you are taking your chances.  I just reviewed Carnitas and Cookies in the same neighborhood...if you're deciding on Mexican food in Edgewater THIS is a no-brainer.,0.7184,0.857,0.143,0.0,0.23125
2013-12-18,5.0,"I'm fairly new to Chicago, and huaraches was not an item where I'm from, so I am a complete huaraches noob. This place is near me and has terrific reviews, so I thought it would be a good place to start. It's a hole in the wall type place, Spanish recommended, and the small staff was very friendly. It's cash only, be advised (a girl ordered to go while I was there - she had no cash, but they gave her the food anyways and she promised to come back later with cash). I ordered a 2 topping huaraches - paster and poblano peppers. The pastor was as flavorful and delicious as anything I've found at my favorite taquerias, and the poblanos were extremely tasty. The masa corn tortilla is homemade (of course) and the poblanos roasted in house (the smell was amazing). The sauces were so good, and everything about my huaraches was delightful - I loved every bite. This being my first experience with the dish, I could very well be a victim of ignorance, but I am excited to go back and to check some other places, as well. The only negative I have is that the horchata was not great.",0.978,0.73,0.19,0.08,0.56158810325477
2013-12-17,5.0,"I was at the park next to huraches doña chio when I smelled heaven. I had to find out what it was. I walked over and discovered there was a little hole in the wall Mexican restaurant nestled in a building on this unassuming side street. I wouldn't normally do this, but I had to order food then and there. I ended up going with the chicken enchilada verde as I didn't do much research and that's an old fave. I was not disappointed. The verde sauce was one of the best I've ever had. After talking with a worker there and searching reviews, I've since tried the huraches, which are their specialty. I tried the tinga and mushroom. Fantastic. It's super cheap as well and a lot of bang for your buck. Inside is not much to look at and there are only 4-5 small tables. But if you aren't looking for a high end dining experience, just excellent, inexpensive and authentic Mexican food, look no further.",0.9864,0.801,0.184,0.016,0.5103333333333333
2013-11-24,5.0,They make their own tortillas The tacos are $3-$3.50 and SO worth it. I have not found weird stuff in my chicken. The huaraches are GIGANTIC.,0.5337,0.838,0.162,0.0,0.7625
2013-11-23,4.0,"I dunno why the heck I don't go here more often, since it's only a half mile away from where I live. But the tinga is really darn good here on the huarache! It's hidden off of Clark and on Elmdale, slightly east of the Clark/Peterson(Elmdale east of that intersection) intersection. Tiny storefront, but it's the last one you see before the alley, and directly west of a park. If you drive here, I'd recommend parking on one of the residential blocks slightly north of here, and walking back. The diagonal spaces just east of here and by the park are often totally filled up, for whatever reason.",0.5075,0.926,0.052,0.022,0.39285714285714296
2013-10-26,3.0,"Came here for lunch, the huracha was monstrous. The salsas and the tinga were ok, the cactus and the poblano were very good. The prices are very reasonable. It's a good place to go for a quick meal, but not necessarily worth going out of your way for.",0.4203,0.844,0.116,0.04,0.5433333333333334
2013-10-21,5.0,"We are pretty serious regulars here - we stop by most weekends and get an absolute feast, usually for under $25 including tip. We can usually find a seat, but there are only 4 or 5 small tables. The house-made mesa tortillas are amazing. Favorites are the huaraches (green or red chipotle sauce - again, house made and the red is usually a bit spicier), tacos, tostadas (I think these are on a more standard tortilla - not sure if they're made in-house; but they do usually come with lettuce, sour cream and avocado which is a nice thing to mix up with) and a rajas (roasted poblano pepper - again, they roast in-house). Favorite fillings are tinga (YUM), pastor, picadillo and asada. Burritos are okay, but nothing special - go for the huraches, tacos or quesadilla if you're looking for something special.",0.9199,0.789,0.138,0.072,0.5129744651483782
2013-09-28,5.0,"Had the pork tinga huaraches, which were spicy and obviously made with love. Highly recommended!",0.7639,0.664,0.336,0.0,0.5466666666666667
2013-09-14,5.0,"This is a little-known gem with delicious food at VERY reasonable prices. I would go again and again. I'd be there every day if it was closer to me. I had their tacos and tostadas, and both were fabulous. The dining area was no-frills, but the food there makes it worthwhile, and you don't have to wait long for your meal.",0.7684,0.878,0.122,0.0,0.736
2013-08-05,3.0,"As soon as I walked into this place, I felt like I was taken south of the border. The horchatas, hibiscus drank, and other concoctions all seemed authentic enough to keep a solid base of people coming back and I thought that this place must be pretty amazing since it kinda is off the beaten path but it has a ton of reviews. I didn't know what a Huaracha was until coming here either, and they were interesting, but I am not sure they are worth all the rave.  That being said, its an authentic spot with some really great vibes and some unique options you probably won't find anywhere else.",0.9348,0.796,0.167,0.037,0.6152777777777778
2013-06-20,3.0,"This is totally a rinky-dink, no frills sorta restaurant but the food is solid. With a tasty half beef/half chicken huarache for less than $5, you can't go wrong. The restaurant seemed clean and the guy behind the counter was nice.",0.8943,0.705,0.259,0.036,0.5925925925925926
2013-05-28,5.0,"By far the best tacos I've had in Chicago! This is definitely not a trendy place, but the food will not disappoint. It's very small with only a few tables, and hard to find, but worth the effort. The staff are very friendly and you can tell a lot of love goes into the food.A real gem.",0.9634,0.68,0.297,0.023,0.5465151515151515
2013-05-27,4.0,"This review is going to be simple and direct. The huaraches are home made. The tortillas are made from scratch, and the chili sauce used is motherf$%^# great. Do yourself a favor and try it out.",0.7783,0.829,0.171,0.0,0.5023809523809524
