date,star,text,compound,neutral,positive,negative,subjectivity
2013-05-17,4.0,"This was my first time ""Huaraches"" experience.  The place was so small but packed, food is fresh and made from scratch.  Vegetarian Huaraches was good (both taste and portion size).  I would like to try other menu sometime in near future!",0.8845,0.782,0.218,0.0,0.3904761904761905
2013-03-03,3.0,"This was pretty good! I happened to get the veggie options this day. I was taking a little break from meat. My man got the steak. His tasted way better. Once you go meat, I guess you can't go back to being a vegetarian. I'll try the meat one next time. Overall, though, the service was great. It was a cute like ""take out"" type taco place with a few tables. Overall, good experience; we were happy.",0.9764,0.709,0.291,0.0,0.4653846153846153
2013-02-28,4.0,"Run...don't walk for your Huraches is what I was yelling while running to Huraches Dona Chio (I had to run there, literally, because they earlier the most other Mexican restaurants).  We had a Carne Asada Hurache.... What is a hurache you might ask? Well, let me tell you. That masa that apparently doesn't sit so well in my stomach, well, that's the tortilla and then a whole buncha other ingredients on top of it. It's like a HUGE Mexican pizza. The carne asada is delicious! The cheese is melty. The salsas are delicious. Honestly, it's a huge mess of Mexican deliciousnesses exploding in your mouth.  The  horchata  is DELICIOUS! Not too sweet...not too whatever else...just perfect!  I wish they stayed open later...or maybe I should start eating earlier. Either way, Huraches Dona Chio is great, the staff is SO nice, the food is pretty damn good, and the horchata is the 'ish.",0.9932,0.681,0.291,0.028,0.5793478260869566
2013-01-12,3.0,"A coworker of mine recommended this spot after learning that I live in The neighborhood. On a cold Saturday night after finding nothing in my fridge but white Zinfandel and milk, I decided to give doña chio a call. My plan was to order for pick up but hoping to save myself the 5 minute drive in Albany park traffic, I asked if they delivered. To my surprise they did. Yay!!! Probably less than 15 minute later the delivery man showed up(sounded like the man who answered my call). Very pleasant man he pointed out how chilly it had gotten and its not until this very moment that I realize that he must have walked to my apartment...I'm glad I tipped well :) So we ordered a ""huarache de carne asada"", ""enchiladas de pollo con salsa verde"" and ""un liquido de chocolate"". The huarache was HUGE, the steak was fatty and the flavor was just okay. What made the huarache decent was the mixture of the chipolte and green sauce. However, the steak was too fatty for us to attempt to finish. Now the enchiladas were a lot better; the green sauce once again the star of the dish. It was served with yellow rice and refried beans, the beans were well beans and the rice was better than average. The milkshake as my husband put it was ""weak"" and it ""taste like nestle quick."" Overall, I give doña chio 3 stars, the service a 5 and the food a 2. I'm tempted to try them again for I want to find a local gem, however, I think I should keep yelping for this isn't the one.",0.9955,0.806,0.194,0.0,0.4703333333333334
2012-11-15,5.0,5 stars! Here's what you need to know: It's tiny.  It's easy to miss if you don't know what you're looking for. There are about 5 tables inside. It's cash only. It's FAN-FREAKING-TASTIC authentic Mexican food. And las senoras hand-make the tortillas. I just ate and now I'm hungry again talking about it. It's a hidden gem and you need to go now.,0.3802,0.922,0.052,0.026,0.5694444444444445
2012-09-18,2.0,"Not so impressed.  I had eaten from here once before and I thought it was better then.  My main issue is that they got my carry out order wrong.  They were not busy. there were two tables in use and they already had their food.  So it was just my order being prepped.  I knew I wanted nopales on my huarache, and I asked the waitress if there was something she suggested to go with the nopales. She said steak (in very clear English.)  I said great.  She then asked if I wanted everything on it.  I said sure.  So I get it home and it is the plain huarache with the beans (?), a very little bit of cheese, onions, and cilantro.  Of course I paid for the loaded one.  Oh well.  It tasted ok, after I added the salsa verde they put in the bag.  Nothing special.  I have other places down Clark street that deserve a look.",0.9551,0.842,0.139,0.019,0.5275343915343915
2012-07-28,5.0,"I just ate a carne asada taco on a freshly-made huarache and was heavenly! The place is small and they take their time, but the product is just amazing! A hidden gem on the north side of Chicago. Highly recommended!",0.9045,0.746,0.254,0.0,0.5433333333333333
2012-07-23,5.0,The best mexican food in the City. Very consistent and cheap.,0.6369,0.704,0.296,0.0,0.33125
2012-06-12,4.0,"If you believe that Taco Bell is Mexican food you will hate this place, but if you want some hearty, homestyle Mexican food this is a hidden gem.  I love the huaraches and the quesadillas (which are made with fried masa patty from the huaraches instead of a tortilla). Service is slooooow. They make everything to order, so the slowness is understandable. Just be prepared to wait. If you plan on doing take out it's best to call ahead. There are a few tables if you want to eat there.",0.9382,0.806,0.17,0.024,0.3190476190476191
2012-06-08,4.0,"Recently, I was able to try this place, after a fail on another Friday night when they decided to close at 8pm (their sign and posting say that they are open until 9pm).  So yes, call ahead to confirm they're still open. The huarache I had was freshly prepared, and homemade yumminess.  I had half tinga and half peppers and cheese.  Both sides were delicious, though I think next time I would get chorizo and tinga.  That tinga was mmm mmm good.   I think the sauces could have been a little hotter, and I'm no spice fiend.  I asked the waitress which sauce was hotter and said, ""Today?  I think the red one.""  :)  I love it that the table sauces are freshly made!  But I'd say that they could go ahead and kick that heat level up one notch.  I'm surprised because I see that there are many reviews that talk about how hot the food is, and I had someone I know tell me that the food she had here was ""face-melting hot"".  Hmm.  So apparently the heat level of the sauces varies quite a bit day to day.",0.9347,0.863,0.108,0.029,0.5075396825396824
2012-05-04,5.0,If you like authentic Mexican food you will love this place. Every thing is made by hand. If you ever been to Mexico and have experience a Fonda this is basically what it is. Every thing is made fresh every day. You can actually see them cooking every thing from behind the counter. Awesome it reminds me of home!!,0.9508,0.758,0.242,0.0,0.5214285714285715
2012-04-16,4.0,"I stopped by for lunch on Sunday.  The dining area was hot and tiny, with about six tables crammed into a small space.  There is a park nearby.  It looked like it had some benches, but I didn't see any picnic tables.  Still, if you're visiting any time near peak meal times, I'd recommend ordering your food to go. Most of the signs and the guests' conversations were in Spanish, which speaks to the cuisine's authenticity.  The waitress spoke perfect English, sparing me from needing to exercise my rusty Spanish skills. I ordered the Huitaloche (corn smut) Huarache.  I aim to eat vegetarian when I can, and the ingredients as presented seemed pretty close.  I can't vouch for the huarache masa itself, but it didn't taste particularly lardy.   The portion was large enough that I felt a bit over-full after eating it, so I'd recommend splitting it unless you're really hungry.  The ingredients tasted fresh and worked very well together.  I'm not fond of cilantro (it tastes a bit soapy to me), but it actually worked quite well in this dish.  I got the green salsa and was very pleased with my choice.  There were both red and green salsa bottles on the table, and I definitely preferred the green.",0.9849,0.825,0.154,0.02,0.4092132505175984
2012-03-28,5.0,"This is my favorite Mexican joint in the city, maybe anywhere. The homemade huaraches are just heavenly. Everything tastes fresh and healthy and isn't bogged down with a lot of unnecessary oil. I am a stickler for delicious food that's also good for my body, and I love that I can eat a massive huarache stuffed with all sorts of yummy ingredients and feel satisfied but not stuffed or food-comatose. I always get the same thing, because it just makes me so happy - the quesadillas! Made with huarache (instead of flour tortilla - this is great), meat, cheese, and I always add lettuce, tomato, mushrooms and onion. Their salsas are great, as well. The wait staff is super friendly, and on a few occasions I've seen family members and friends of the employees at their own tables, giving this location a feel-good neighborhood vibe. I do believe this place is family-owned and run, and it shows! Lots of heart goes into the making and serving of this amazing food, and I always feel comfortable and welcome there.  There are 5 tables, I believe, so be prepared for a small space. Great for a date!",0.9974,0.676,0.324,0.0,0.6452222222222223
2012-03-24,5.0,"This is probably the best, freshest mexican food I have eaten outside Mexico, and better than most I have eaten IN Mexico. Seriously. Fresh, made to order (from fresh-ground corn masa) tortillas, huaraches, sopes, etc. Fillings to die for, particularly the Barbacoa (goat stew), Asada, Tinga (spicy chicken), Flor de Calabeza (Sunflowers!). It's all good. All made by grandmothers. And all at terrific prices. Only a few tables, so nearly always crowded. Now stay away. I still want to be able to eat here.",0.8858,0.761,0.18,0.059,0.4898809523809525
2012-03-09,4.0,"Before coming in here, I had no idea what huaraches were. I just knew that it was a new (to me) ethnic food that looked delicious and that I needed to get in my belly. The name was promising as well. I like restaurants that imply they have a legion of old ladies in the back working it out and making food that's old school, crazy delicious, comforting, and that will stick to your ribs. I was the teensiest bit scurred, however, because my latest run-ins with donas in the Chicago area had not ended well. At all. I shouldn't have been worried because this dona, likely, chased the other donas out of town. Delicious. This is delicious food without pretense or markup. Come here because you're hungry and appreciate home-cooked food for days. Don't come here to be seen or pontificate on foolishness. This is real. Come here to be real. As others have mentioned, this looks like a refurb'ed garden apartment, complete with steps that go down and low(er) ceilings. There are only, about, 5 tables in the joint and the majority are two tops. This isn't a spot that's good for large groups. It is, however, good for folks who like to eat. And, because the food is so affordable, you can eat a lot. Not knowing what huaraches were prior to coming, I thought it a good idea to order two kinds. Luckily, my dining Girl Friday was up to the challenge. Purpley agua frescas in hand, we settled in for al pastor and chicken huaraches, one with red sauce and the other with green. Do this. Try both sauces but be aware that they also come in bottles if you need more than what comes with the dish. As for huaraches... do you like gigantic pizza shaped orders of masa loaded down with meat, veggies, spice, sauce, and cheese? Do you like knowing there's a real live dona in the house going to town on your food (rather than having one in name only)? Do you like varieties of agua served in Big Gulp-sized jugs? Do you like being able to eat like a king on a pauper's budget? Do you like supporting true mom & pop establishments? Do you like exploring your city? If the answer to any of these questions is si, get your booty to Edgewater and get ready to do it to it.",0.9941,0.82,0.156,0.024,0.5373481051112631
2012-03-05,4.0,"This is the second location (I believe) of the much loved huaraches spot that started in Edgewater. Their huaraches are stuffed with a thin layer of beans and griddle fried before being topped. There are two ""sauces"" you can choose from: red (tangy chipotle) or green (jalapeno tomatillo). The word huaraches means sandals, but these babies are much larger than any non-NBA player size foot.  I'm giving it four stars because of the diversity of vegetarian toppings choices (you can get two or three toppings on your huarache for ~$7). But Mr. W did not think the al pastor and tinga was as good as the versions he orders at another local taqueria (he gave it three stars but I'm the one with the Yelp account). I alos think it's a great value. I took half of mine home but Mr. W. managed to polish his off (and then slipped into a food coma an hour later). It's a cozy, bright and friendly spot along Lawrence. I'm not sure how it compares to the other huaraches place a few doors down, but it's worth a stop if you are nearby or looking for a good deal.",0.9822,0.823,0.153,0.025,0.3985449735449735
2012-02-14,5.0,"Hurray for Huaraches. Great food, freshly cooked. I love it and would recommend to everyone. Warning, small seating area.  Owners need to realize, you can't continue like this! Your food is too good and you will be overrun with customers soon.",0.9347,0.598,0.32,0.082,0.5700000000000001
2011-12-07,5.0,Amazing is all I can say. Their hauraches are as authentic as you can get and they do them Mexico City style. I have also had their menudo  and it was out standing. It reminded me very much of the small stands in Mexico city that I used to go to. Also old Mexican ladies that remind me of my grandmother make the food.  In my opinion this is better than a lot of the over priced high end Mexican restaurants I have been too.,0.7717,0.921,0.079,0.0,0.3944444444444445
2011-09-28,4.0,"The huaraches are bigger than your head and the fillings smarter than what you got going on up there.  Don't be intimidated by the basement location and homemade signs en espanol.  You are welcome here!   The different prices on the menu represent different sizes of the huaraches.  The large size can fill up two people easily, and you can even split the pie if you want to try different fillings.  Try the tinga, it's delicious with salsa.",0.9337,0.815,0.185,0.0,0.6827380952380953
2011-09-14,5.0,"This is the kind of place that you would never find if you weren't just wandering around. It is the very definition of hole-in-the-wall. It says a lot about their food that people even manage to find it, and then go out of their way to come back. It's not near anything else to make it easily accessible. It. Is. Delicious. The food is ridiculously good, ridiculously cheap, and ridiculously large. All other Mexican food places bow before it.",0.4215,0.816,0.102,0.082,0.46168831168831176
2011-08-25,5.0,"Best kind of hole in the wall where you see tables overfilled with food and people just chowing down on all sorts of corn wrapped dishes and piping hot soup.  I had their huarache with chorizo.  The filling was as expected - good, but the kind of stuff you can get at any Mexican place.  But it was the corn masa, which was made from scratch right there that made it special.  They are huge and they're generous with the fillings.  For $6, it's a great value.   Parking is tricky in the neighborhood.  It might be easier to find something on Clark.",0.98,0.751,0.233,0.016,0.5830026455026455
2011-08-24,5.0,"This was probably a basement apartment at one point - you have to step down a few stairs to get to it and it's in an otherwise residential building on an otherwise residential street.  You'll turn down the street not thinking you're going the right way, but you are, so don't worry! This is impossibly tasty food in impossibly huge portions for a fraction of what it should probably cost. Had we ordered one huarache al pastor (for two people), that would have been more than sufficient.  A masa cake that takes up a whole widescreen oval plate, covered in spicy pork, cheese, crema, onions, cilantro, and green sauce, it seems to swell the more of it you eat.  Just spicy enough to make your nose run without making your lips and tongue burn, it settles at a medium sizzle. But we knew not the massiveness of the portions before we ordered, so we also ordered the chilaquiles, which, despite my general dislike for steak, got me all filled up with tasty blackened but tender steak pieces, beans, soft tortilla chips, and that same spicy green sauce. As if that weren't enough, we had horchata and agua de mango to drink.  This is one of the only not-too-sweet horchatas in the area and I think they used champagne mangos in the agua! Bring a friend, feed the both of you for $5. (Quick tip for the small-bladder-havers like me: the sign says there is 'no baño publico' but if you ask, they'll let you use it.)",0.9544,0.913,0.077,0.011,0.4993943191311613
2011-06-06,5.0,"Fantastic little divey Mexican place in an off-beat location. Some of the best Mexican I have had anywhere - including Mexico... and if I understood it correctly, they get their mole sauce right from Mexico directly from some mole guru (probably some old lady in a tired little village who just knows exactly what mole is all about!) So great. Go here soon if you haven't already.",0.8906,0.793,0.168,0.039,0.41964285714285715
2011-05-30,4.0,"When I was around 9 or 10, I was enamoured with huaraches, a type of woven Mexican sandal that was hip in the late '60's/early 70's. My parents got me a pair in response to my pleadings, and they ripped up my tender girl feet. After that, I did not think or speak of huaraches until yesterday, when my love affair began anew. My brother and SIL found this little joint. Yesterday afternoon, feeling peckish from lack of food, the Greens picked up a six of Schlitz (taste the cheapness, 'cos it's BYOB!) and we all headed here. OMG. This is a palace for my cheap, broke ass. The food is unbelievably inexpensive and delicious. I had only $5 in my wallet, and that was enough for what I ate - or maybe I stuck my brother with the rest of the bill. Anyway . . . They serve huaraches here, which I had never thought about eating until this day. They look like a Mexican pizza, served on a giant corn tortilla. I am partial to flour tortillas myself, but these were delicious, so I happily consumed. I got the al Pastor - spicy pork, yum - with everything, and green sauce. YUM. This is the delicious Mexican food that I left behind in LA. Take that, overpriced Topolowhatever! A giant, pizza-looking affair that I was only able to finish about 1/3 of. As I write this, I'm noshing on same for breakfast, and I still haven't finished it all. That's 'cos I'm a damn petite flower, but still . . . it's a lot of food, for what . . . $6? The meat was delicious, juicy, well seasoned. Green sauce, cheese - and I smeared a little of our guac over the whole creation, between swigs of Schlitz. Mmmm! That's eatin'.  We were the only gringoes in the joint on this day, the rest of the people were families with kids. An adorable feisty little girl ran squealing with joy around the restaurant. Cuuuuuuuuute! We had a cute, friendly waitress, quick service in a spotlessly clean little storefront, tucked in a residential area of Edgewater. My broke ass will be back, living large on my frugal fashionista budget. Yum! That's how I like it!",0.9934,0.793,0.158,0.049,0.5827838827838827
2011-04-29,4.0,"Homemade corn tortillas like I haven't had since I left California.  Ask for the homemade cheese, which is very tasty.   Not much atmosphere, but we took our tacos to go and ate in the park next door.   Cash only.",0.1901,0.954,0.046,0.0,0.3
2011-04-09,5.0,"Go, GO, GOOO!!!!  Stop at the ATM and head over to 1547 West Elmdale now!  Parking can be easily found on Clark. I don't understand why there are not lines out the door.  What an incredible little restaurant.  If my next visit is as good as this one, Huaraches Dona Chio will be my new and favorite Mexican go-to!  This five-table restaurant will blow you away.  There is nothing canned about this place. All homemade food - you can see and taste the love and care that goes into each dish. HDC offers the best in home-made Mexican.  All the tortillas are hand-made to order.  And, don't order too much - the portions will astound you.  I am a hearty eater, but it was all I could do to eat 1 gordita and 1 taco.  They use high-quality meat - we found no fat - and homemade sauces that will rock your world.  The tortillas are THICK - about 1/4 inch - and flavorful and could be an enjoyable meal on their own.",0.9249,0.862,0.113,0.025,0.4664299242424242
2011-04-08,4.0,"Huaraches = pronounced ""wah-ra-ches"" but you have to say it fast like it's all one syllable.  Got made fun of by the bf for over enunciating lol. We got the Huaraches de Tinga:  a huge homemade, thicker-than-normal tortilla with shredded pork in a chipotle sauce topped with onions, cilantro, cheese and green salsa.  I already had high expectations but it still blew me away by how good it was.   The super fresh tortilla was the star of the dish....it tasted like a mexican grandma had just spent the whole day making it just for you.  And lo and behold it was!  you can literally see the old woman behind the counter hard at work putting elbow grease into churning them out.  all of the toppings were great as well - the tinga was tender and juicy and the chipotle sauce/green salsa went perfectly with the rest of the dish.  i think they let you split toppings too so ill definitely have to ask for that next time and try some of their other meats.   My boyfriend and i split one huarache and we didnt even come close to finishing it so if you're looking for leftovers this is definitely the right dish to get.  All this along with a steak taco (super flavorful) and an horchata for around $11 (plus a nice tip for the old lady for working so goddarn hard even though we didn't eat in).   cheap, delicious and only two blocks from the house....ill definitely be back here soon !",0.9959,0.746,0.219,0.035,0.5505431547619047
2011-03-21,4.0,"Food+price was 5 stars, atmosphere was 1 star. Hardest thing is that there aren't enough tables and have to wait.  Is there any other Mexican restaurants make as good food as here with better atmosphere?! I am dying to know if exist..",0.7263,0.859,0.141,0.0,0.395
2011-03-09,4.0,"Went to this place last week, Saturday afternoon for lunch. This place is pretty friggin' great. The food is definitely fantastically made, with low prices and large portions. I ordered the lengua huarches (as per the namesake of the restaurant) which was so big I couldn't even finish. Between two people the meal was about 15 dollars, including a cup of decent joe. The only problem I have with this place is the noise level--it's rather small, therefore very noisy when there are a lot of people--and the other patrons. While our waitress was a delight and very friendly, everyone else in the place was staring at us. Definitely awkward.",0.9324,0.766,0.166,0.068,0.5383503401360544
2011-02-25,3.0,"The huaraches are great, huge and delicious. I've been there a couple of times, the  service.is   ok.it  could be better if the restaurant was bigger, and the food took less time to be served.",0.9186,0.69,0.31,0.0,0.6194444444444445
2011-01-28,4.0,"Sum it like dis: byo, $11 for 2 to get stuffed and for me and my fiancé to iron out our wedding venue plans. Huarache carne asada and torta tinga tasty. We will be back.",0.3612,0.93,0.07,0.0,0.0
2011-01-05,5.0,"Terrific! Far north side finally has some Mex worth bragging about! Been twice now and food was very consistent! Huaraches, sopes, gorditas, fresh ingredients, great salsa. The cocinera pounds out a fresh home made corn tortilla with each order (doesn't get any better). ~John C.",0.927,0.728,0.272,0.0,0.6305555555555556
2010-11-18,4.0,"Pretty solid place. As someone else mentioned, the huaraches here were different than the ones I'd tried before. The ones here are still really good too. We tried a few things here. I think the highlights were the huarache with chorizo and potatoes and the quesadilla with squash blossoms. Definitely worth a try if you are tired of the endless places selling only tacos and burritos.",0.8268,0.786,0.174,0.04,0.55
