date,star,text,compound,neutral,positive,negative,subjectivity
2009-10-25,2.0,"So, the staff and chef are simply sublime.  Wonderful, funny, and welcoming.  I ordered the whole fish special.  Tasty but overdone.  The presentation was over the top with sauce filling every empty space of the platter. The man had the lamb patty and loved it.   HB is not an intimate restaurant though the facade makes it appear to be as such.  The noise level is just terrible.  You'll literally find yourself shouting to you dinner partner and unable to carry on a decent conversation.  Sadly, though we had early reservations, we were given the worst table.  You guessed it.  Directly across from the entrance to the kitchen.  UGH!  The wait staff have no choice but to knock into tables and chairs since the seating is extremely cramped. Kafka wine store is directly across the street.  Bonus for a BYOB restaurant. Perhaps if we had had more to drink, HB would have been easier to take.",-0.3594,0.743,0.131,0.125,0.6497619047619048
2009-10-22,5.0,"So HB, you and I both already know how much I absolutely adore you.  But last night, that love was taken even a step further.  I went with 2 friends for the Wednesday night Prix fixe.  We were silly to think 1 bottle of wine would be enough for the 3 of us after a stressful day at work.  We'd pretty much finished off the bottle after the first course.  Lo and behold, the chef comes out to chat it up with some customers, notices our empty bottle and volunteers to run across the street for us and pick up another bottle!!!! IF THAT'S NOT GREAT CUSTOMER SERVICE, I don't know what is!!!!!!!!! That's absolutely realizing your customers needs, and going 10 steps beyond what's regularly expected.   HB-you've once again proven why you're my favorite restaurant.   also p.s. the whole fish-FABULOUS!!!! Love any restaurant that's willing to serve whole fish WITH the head!",0.9766,0.799,0.171,0.03,0.5930555555555556
2009-10-18,5.0,"Five MOTHER F'ING STARS for HB. Personally, I think it is the best food in the neighborhood. Amazing and delicious. Food, service, atmosphere. All just makes me scream YES YES YES. I came here specifically for the lamb burger. No matter what the special was or what was recommended, this is what I wanted. I was with my boyfriend (and another couple) and we started with the bacon-wrapped dates and beet salad. I thought the dates were average, and possibly better in some tapas restaurants. They didn't come with any sauce and I think it needed it.  The beet salad was wonderful. I honestly don't even know what a beet is. We ordered the salad for the feta cheese, which was as delicious as expected. The beets had a nice smooth flavor that complemented the salad well. The salad was big enough to share for an appetizer.  I ordered the lamb burger and it did not disappoint. AMAZING. OMG. This was by far one of the greatest things I have ever eaten IN MY LIFE. The burger was GIGANTIC and so rich and juicy. I could not stop licking my fingers. The fries were borderline orgasmic and would be included in my last meal on earth. They give a mayo dipping sauce, which would normally be a turn off, but it works. And works so well! My boy got the chicken wrapped in phyllo and he LOVED it. I had a bite and all I could think of was ""Boy this really does taste Moroccan."" I don't really know what that means, but if you try it, you will understand. As for the other couple, they started with the heirloom tomatoes which were salty. They also ordered the mussels and the lamb burger. Burger was a great, but the mussels were average. Here are some tips: Make a reservation! Bring your own wine (I splurged for the Trader Joes Charles Shaw. Classy). Dont get there too early because there is not to much room to wait. Please go ASAP and invite me for some truffle fries.",0.9929,0.819,0.165,0.016,0.6191592261904761
2009-10-14,5.0,"Five stars...not just for food, which is at a nice price point and absolutely delicious but, for service. These guys bend over backwards to make sure you're happy. I have been there more than a handful of times and I guarantee that I will be back time and time again. My absolute fave is the bread pudding dessert. I literally get teared up when I eat it...so amazing. Thanks guys, you have a wonderful place! I love it and I let everyone hear about it too!",0.9913,0.627,0.373,0.0,0.7262626262626264
2009-10-07,4.0,"I have been coming to HB since it first opened as Hearty Boys.  The food has always been good, not phenomenal.  I ate here a couple of weeks ago and the food was PHENOMENAL.  The service has always been reliable--and it certainly was this most recent time.  This is one of the few good restaurants in Lakeview.  Nice job!",0.8832,0.822,0.178,0.0,0.4954761904761905
2009-10-05,4.0,"The food was really a 3.5, but feels good rounding up considering everything together.  We had an 8:30 reservation, but thankfully we called in advance as our table wasn't ready until 9:15 (which in this case was fine because we were running late...but if we there at 8:30, a 45 minute wait, with no waiting area/bar, would have been aggravating).  Once we were seated, service was very accommodating and quick. As they are a BYO, expect to bring your own booze (which everyone seemed prepared with -- including individual cocktail shakers at the next table). In our case they were nice enough to offer to run across the street to 7-Eleven to get mixers for the booze we carried along.  For apps, we tried the artichoke/cheese fritters, which were heavy and dense, but excellent. We also tried the baked crab app, which most everyone liked. Both were generous and fresh -- neither the most healthy.  For dinner, beef stew was had by two, and Moroccan style chicken in phylo by another (and the crab again by one). Both dishes were excellently flavored, but for the chicken, definitely be prepared for serious Middle Eastern seasonings.  The beef on both plates seemed like it could have spent some more time cooking as there was some toughness.  Otherwise, again, the quantity was generous, and the ingredients super fresh. As the truffle fries came highly recommended, we tried those, and they do NOT disappoint.  Nobody could get enough, and we had ask the server to remove them from the table as we would have kept going on the seemingly bottomless basket. One shortfall might be seen in the offerings for vegetarians, or for those that enjoy fish, as both seemed somewhat short in supply, but otherwise, this is a great neighborhood bistro, run by ownership that is eager to provide a gracious meal in a welcoming setting.  Then, getting out the door for $122 (for a party of four), got everyone to agree they would gladly go back to try some different things on the menu.",0.998,0.732,0.232,0.036,0.5378095238095238
2009-10-05,5.0,"If you want a great local place to make your new stand by restaurant this is the place.  The space is fairly small (20-30 tables) and has a great relaxing comfortable vibe.  The owners and wait staff are knowledgeable and attentive.  Their menu has enough variety without offering too many choices and it changes every 3 weeks based on the best seasonal ingredients.   Dishes I would recommend include their whitefish with Moroccan spices, braised pork shoulder and any dish with their creamy rich au gratin potatoes.  Also, the bread pudding was very well done, moist and sweet, a great finishing touch to the meal.   If you go don't forget to bring your own wine, Kafka Wine Co one block south on Halsted has a good affordable selection.",0.989,0.704,0.277,0.019,0.5877840909090909
2009-10-02,5.0,"How does it feel to come to a quaint, comfortable, byob bistro, where the chef himself comes to your table to present your meal.  It's awesome!  Some friends and I came here a few Wednesdays ago,  the portions are generous and the food was delicious.  A couple of us ordered the pri-fixe and our third member ordered off the menu. For starters, we tried the fried cheese and date appetizers.  The strawberry jam on the cheese sounds odd in theory, but the sweetness compliments the saltiness of the cheese.  The dates...how can you go wrong with bacon, very tasty.  For entrees,  I had the 'whole fish', which is exactly what it sounds like.  A roasted whitefish with vegetables in broth.  I also sampled my dining companions entrees, the mussels and chicken in phylo.  I liked the chicken in phylo better than the mussels, but I'm not really a mussels eater in the first place.  The chicken was wrapped up in phylo and served with couscous and a tangy sauce. (side note: all of the staff were very friendly and it was obvious that they take pride in their work.) The finale was shared carmel apple bread pudding and a chocolate ho-ho dessert.  The table argued about which was better, either way it's a win-win.  This place rocks.",0.9881,0.777,0.186,0.037,0.5396825396825398
2009-10-01,5.0,"OH MY GOD!!!! This restaurant is amazing. We went last night for the $30 prix fixe menu. We arrived a little late, but the owner, Johncarl, was there to great us and let us sit while we waited for another member of our party. An hour later, we were still sitting there waiting for our friend, but our waiter was gracious and continued to poor us our BYO wine.  We had the almond stuffed dates wrapped in bacon, edamame fritters and fried cheese to start. The dates were out of this world fantastic and far superior to the dates at Avec (which I love). The fritters were pretty amazing too. Next I had the beet salad. The flavor combinations were perfect and I could eat that beet salad everyday for the rest of my life and never be tired of it. For our main courses we had the mussels, the beef stew and the amish chicken. Everything was cooked to perfection and super fresh.  The food was great, the service perfect and I have absolutely no complaints. If you cant tell, I love this place! GO!",0.9964,0.642,0.294,0.064,0.6686666666666666
2009-10-01,5.0,"Amazing food, amazing service.  The lamb burger, haddock and beet salad are to die for.  Make reservations at this cozy, tiny place because it fills up quick!  BYOB makes for an affordable, nice night out.  Can't say enough wonderful things!  I'll be back again and again.",0.6232,0.696,0.187,0.117,0.6722222222222222
2009-10-01,4.0,"Had a lovely experience at HB last night.   Was with a big group for a friend's birthday so we had a long table in a semi private area.  The service was gracious and fun and tolerated our muscial chairs and somewhat rambunctious group with aplomb.   Wednesday night is $29 prix fixe,  but one of our servers recommended we do family style for the first two courses because if we each did all 3 courses it would be too much food.  It was a good suggestion and they brought out a nice array of appetizers and salads to share.  I highly recommend the roasted beet and walnut salad --it's dressed with a very delicate truffle oil dressing which did not overwhelm the beets or the baby greens at all; it was perfection.   Edam and artichoke fritter was delish and hearty, as was the fried halumi.  The gouda tasting had some fine quality goudas (so good-ah!)  escargot were tender and chewy, and the sweet and savory bacon wrapped dates were enjoyable.   I had mussels for the entree -- they're served in a nice anise beer broth -- fresh and abundant and totally enjoyable.  Had a bite of my friend's lamb burger  -- it was delish and had an almost creamy texture.  the pretzel roll is a good bun for it.   BYOB is a plus!!   Also they play great music (SPOON!) and it's piped outside so if you go out for a little break during dinner you can DANCE (on the sidewalk) between courses!  awesome.   desserts were nice too.   Two cons to note:  the herb bread served with balsamic at the beginning isn't  so tasty, and those who had the chicken dish and the pork dish said they were a bit dry.",0.9971,0.775,0.225,0.0,0.5857407407407407
2009-09-29,4.0,"The Food:  Fantastic.  I had the rosemary crusted Amish chicken breast and it was some of, if not the best, chicken I've ever had. The Prices:  Prices ran a lil' higher than I expected.  Most plates are in the $15-20 range. The Atmosphere:  The place is very cozy and, while it looks like a nice place for a conversation from the outside (dimly lit, candles on the tables), the patrons were all absurdly loud.  Obviously I wasn't here for a date, but it's certainly not the kind of atmosphere I'd expected.  That's the main reason for the star deduction. Bottom line:  Definitely a great place to go to for great tasting food, though I wouldn't recommend it if you're looking for a quiet date spot.",0.964,0.787,0.177,0.036,0.6181547619047619
2009-09-27,5.0,"This is a great restaurant! I recommend it to all my friends, and they can't get enough. If you're someone who appreciates food, you'll appreciate this place. The kitchen uses local farmers as suppliers, which means the menu is seasonal and delicious (when I was there they were getting everything from a local, organic farmer). On average their menu changes about every 3-4 weeks, and the specials go through more frequent changes. Reservations are necessary for peak weekend times, as the secret is out on this place. Whether you're going out with a few good friends or looking to go on a romantic date, this place is perfect. So, grab your favorite bottle of wine, some of your favorite people and head out to Home Bistro for wonderful ambiance and fantastic food! I cannot say enough positive things about this place.",0.9919,0.708,0.275,0.017,0.6147727272727272
2009-09-23,5.0,"Hands down, my favorite BYOB place in Chicago.  Unpretentious, down to earth cooking.  The food is always outstanding, and service impecable.  Prices are reasonable too.  I love this place and can't recommend it enough.  Bring a bottle of wine, try a special...I've never been dissapointed.  Plus, my wife and I can get out of there for under $100.  These guys do it well.  Perfect for a laid back night out.",0.9422,0.755,0.218,0.027,0.572530864197531
2009-09-21,5.0,"Amazing food, fabulous service and BYOB!!! What more could a girl ask for?! I've been here twice and both times the food has been amazing. It seems like their menu, although not very extensive, changes often and everything looks so good it's hard to choose! Great atmosphere for date night, a double date, or even a fun girls' night out!! And if you end up drinking the one bottle per person you didn't think you'd get through, you can stumble to Roscoe's afterwards for some fun dancing and a pitcher of pink vodka lemonade!",0.9825,0.725,0.26,0.015,0.4806213017751479
2009-09-16,4.0,"My friends and I were seated right in front of the restaurant by the window.  I heard so much about their truffle fries, so I ordered a side order of them and just thought they were okay. . .  nothing special.  As an appetizer, we ordered the bacon-wrapped dates, which never disappoint.  As for the entree, I ordered the salmon which could have been more flavorful.",0.6124,0.853,0.112,0.035,0.4614285714285714
2009-09-15,5.0,"For the price it doesn't get any better in this city. Delicious food, great atmosphere, and a very friendly and accommodating staff make this place the perfect place for a nice dinner out. It is quite small though so be prepared to dine in close quarters, but then again I would sit in a neighbor's lap for just one of their famous truffle fries!",0.8616,0.78,0.195,0.025,0.7875000000000001
2009-09-14,4.0,"Yuuuum. Truffle fries truffle fries truffle fries! Each nice crunch oily bite was a tiny explosion of truffle flavor. I'm not faddish with food and had read a while back that truffle was no longer in fashion but who cares, if you like truffle and you like fries, HB does it well. And their focaccia with balsamic roasted garlic vinaigrette is amazing. Not the best place if you're on any diet of some sort because they really do serve some might hearty fare! Came here last night for two others on a nice Sunday evening. The restaurant was busy but not too loud or claustrophobic. The service from beginning to end was nothing but friendly and happy and general niceness. Prices may be on the higher side but portions are HUUUUGE.  We shared the beet salad--thinly sliced roasted beets with TRUFFLE vinaigrette over greens. Yuuum. I got the braised chicken in phyllo with yogurt sauce over couscous. Yum. It was a nice big baked present with generous portions of tender dark meat and some melted cheese (which unfortunately I did not catch the name of but it on the lighter side). My friend's lamb burger was juicy, topped with melted brie all on a big bad pretzel roll.  Unfortunately no free desserts here for bday. They charged us for the dessert a la candle on top (and we didn't even get to choose...boo). Their chocolate hoho wasn't overly sweet so I appreciated it. It was basically soft and fluffy chocolate cake with lots of fluffy whipped cream and some hardened chocolate over it.",0.9919,0.726,0.197,0.076,0.5244444444444444
2009-09-10,5.0,"Wow. By far the best restaurant I've BYOB'd ever. I came in town for a wedding as with some others. My friend and I decided to come here for a little classy dinner style. We somehow got a table with 11 on a Friday night and had a fantastically drunk and tasty 2 hours. The waiter was patient, helpful and energetic. The prices were reasonable and the food--awesome. With at least 4 other people, I got the quail, which was one of the best meals I've had at a restaurant... ever. With ratatouille, to add. We were the last people in the restaurant and drunkenly walked out for an even drunker late evening.",0.9694,0.783,0.197,0.02,0.5801282051282051
2009-09-08,5.0,Love love love this place!  Not only is the food interesting and delicious but the owner and staff are wonderful and FUN!  Thanks Joncarl for the digestif....delicious!!,0.9811,0.408,0.592,0.0,0.6333333333333333
2009-09-06,4.0,"After hearing about HB from a few friends, we decided it was time to try it for ourselves. I love love loved it and enjoyed the food, experience, Joncarl (owner), service and pretty much everything else about the place. We decided to share 3 appetizers (fritters, escargot and bacon wrapped almond dates) and the special entree (bouillon base loaded with seafood: flaky whitefish, shrimp, mussels and clams). Everything was fantastic and we had a great time getting to know Joncarl and his inspiration for the restaurant. It's a place to go with friends, family or on a romantic date. The artwork is amazing and is on display throughout the entire place. Joncarl and I shared a sip of champagne and he was kind enough to share a Polish after dinner drink with us. I can't wait to go back for round II and recommend HB without reservation.",0.9956,0.662,0.338,0.0,0.6136904761904762
2009-09-03,5.0,"I just completely fell in love with this place!  We went for the $29 pre-fixe deal on Wednesday, and it was such a great deal.  Three courses for $29 and BYOB with no corkage fee?  Awesome!  Granted I am usually a little biased when it comes to BYOBs.  We started with the artichoke and Edam fritters...  SINFUL, positively sinful.  If you don't like fried food, don't order these puppies...  but who doesn't like fried food???  We also got the almond stuffed dates wrapped in bacon, very good, I felt a little like I could get them somewhere else, next time I'll try something different, but they were very good regardless.  My beau got the steak'n'eggs, advertised on the menu as skirt steak, but it was steak'n'eggs, they weren't fooling anyone, but it was tasty, a little on the salty side.  I had the lamb burger...  oh my...  in a word, wonderful.  I would go back for that alone.  And finally we concluded with dessert, a pear galette and a Ho-Ho...  Yeah a Ho-Ho, like the Little Debbie snacks, but WAY more refined and made with real ingredients, this thing didn't come out of a little foil packet.  I just couldn't help but chuckle thinking I was eating an adult Ho-Ho...  too funny.   All in all a great meal, ALTHOUGH, and this isn't worth knocking them a star because the food was so good, the presentation was a little lacking.  All the flavors of the food totally made up for it, however, I was a little shocked at all of the dishes when they came out, they smelled wonderful, tasted fantastic, but really just lacked visual appeal on the plate.  Its OK though, none of the food stayed on the plate for very long...  :o)",0.9913,0.721,0.189,0.09,0.5743181818181817
2009-09-01,3.0,"I went here with great anticipation last week, with a college friend in tow. I have to say I was underwhelmed, given all the lavish reviews on here. Are restaurants just getting more mediocre, or is my palate getting more refined? Or am I just getting to be an ol' picky beeyatch? It's BYOB, which we love. Our waiter was cute and charming . . . which we love. However, in the HB neighborhood, ""cute and charming"" is in great supply, nay, a girl trips over ""cute and charming"" all the way up and down Halsted. The food. I was so excited to try this place and I have to say it was a bit disappointing. My college friend's SO ordered the trout. That was probably the best entree, and his exclamation ""this is the moist-est fish I've ever eaten!"" was accurate. Or maybe I just like saying the word ""moist"". Mmmmmoist. However, I thought there should have been an offer to filet the fish at the table - if for nothing else but to admire the server's arms. Hey! No! Because of the many tiny bones that made it a bit hard to eat. Mine and 7star companion's food was just kind of meh. Overcooked. Sort of mushy. I had the catfish over gumbo and he had the pork special - which *sounded* delicious at least. But . . . meh. Just . . . unimpressive. And I don't like a giant bill for ""unimpressive"". I'd probably give this place another chance, maybe for their weekday special. It was also REALLY CROWDED and a bit claustrophobic and LOUD.",0.99,0.757,0.195,0.047,0.6830133128520225
2009-08-31,4.0,"i rarely travel out of my home zone, especially on a sunday night, but given the stellar reviews i gladly made the trip to hb yesterday.  while we found the food pretty good on balance (not mind-blowing as the reviews suggest), the warm and inviting atmosphere of this restaurant make it a great choice.   clearly a lot of love and thought was put into making this restaurant feel charming and homey.  i loved the terra cotta colored walls, the wax covered wine bottles used as candlestick holders and the witty food-inspired quotes circling the top of the walls.  walking in i was immediately made to feel welcome by the front of the house staff, and quickly seated at a cozy window table.  my wine was opened and poured immediately.  a perfect way to start a pleasant meal.   although everything on the menu sounded delicious, our group of four chose  - appetizers: the house-cured olives with apricot preserves, bacon-wrapped almond-stuffed dates and escargot.  the first two were delicious, the escargot was innovative but a little odd.  not the traditional butter and garlic preparation.  the snails were shelled and the sauce was more sweet than savory.  interesting but not really my thing. - salad: buttery croutons and super creamy dressing made the hb caesar almost too rich. - entrees: the pork belly and white beans was flavorful and rich.  the catfish with gumbo, however, was served on a very bland pool of what tasted like tomato sauce and was not at all what one would expect (spice! punchy southern flavors!) from the description.  (the other two of our foursome had the salmon with creamed corn and tomatoes, and the chicken confit.  i didn't hear any complaints.) -desserts: hoho was, well, a hoho.  too sweet for my taste.  the pear galette, however, was warm, delicate and oh so yummy. pretty good (3.5 stars) food  + charming atmosphere + attentive service + byob with no corkage = patrons guaranteed to return.",0.9991,0.672,0.315,0.013,0.6961111111111111
2009-08-29,5.0,My friend and I went into HB on Wednesday and had one of the best experiences I've had in a long time. I have been meaning to try out this spot for months and glad that I did. The food was spectacular and the service even better. We had the artichoke fritters and bacon wrapped dates and were in love. The chef's specialty - mussels - are a great share item. They were steamed perfectly and the broth was fantastic.  The staff is friendly and the whole experience feels like you are going over to a good friend's house for a dinner party. HIGHLY recommend.,0.9929,0.638,0.362,0.0,0.6453846153846154
2009-08-28,5.0,I loved every minute of dinning at HB. If I could give 6 stars for the people that work there I most certainly would. They were  terrific and so nice.  The food was perfect and sooo scrumptious. The group of us could not resist all getting the lamb burger and it was massive but just delicious - I'm literally counting down the minutes until I can have my leftovers.  I plan on coming back very soon and very often !,0.9445,0.782,0.218,0.0,0.6466931216931217
2009-08-28,3.0,"Wow I must have missed something when I had dinner there last night. I definitely loved the $29 pick 3 deal which including a appetizer, main course, and a dessert but I didn't think that it was anything spectacular. The bacon wrapped dates were just that bacon wrapped around a date and put under a broiler. The crabcakes were good but I have definitely had better. The dessert which was a adult version of a ho-ho was the best thing I ate all night. It is byob which was nice and our waitress was great but I would definitely go elsewhere before I went back.",0.9891,0.674,0.313,0.014,0.5392857142857143
