date,star,text,compound,neutral,positive,negative,subjectivity
2017-08-26,1.0,"I went to Home Bistro tonight looking for a good dining experience and was instead met with an incapable server and an egotistical owner. After waiting five minutes to be acknowledged the server came over to the table and said ""are you ready?"" and things went downhill from there. Asa solo diner i was uncertain if i wanted an appetizer salad and entree or just an app and entree. I wanted to be able to gauge how hungry i was before placing the rest of my order. i understood that this could mean a delay in my order and i expressed that understanding. The server refused to take only part of my order and after considering how rude this was i asked for the owner who also refused to meet my needs as the customer. I ended up leaving without eating a thing. It seems to me that if you arent interested in taking care of your customers and you run a restaurant then you are in the wrong business. Its no wonder the place is nearly empty everytime i walk by.",-0.9399,0.83,0.033,0.138,0.6569444444444446
2017-08-20,5.0,"We're foodies and like to try new restaurants.  This is our favorite.  We go there often, especially after we've had a bad meal elsewhere and want to restore our faith in what a great dining experience should be.  The staff is always attentive--but not intrusive.  The dishes are creative, well-presented and delicious.  And if you get a table by the window, the people watching is never dull.",0.9599,0.656,0.301,0.043,0.7964015151515151
2017-08-09,1.0,"They sponsored a five course tasting menu for a special event on Monday 8/7/17, and this was the most disappointed I have been in a restaurant in the past 5 years. Reservations are required for this event, so you would think they could manage the crowd, the food, and the service. I've been to HB before and had mediocre meals, but the BYOB keeps me coming back. This bad experience has ensured I will never return to HB. It seems like when things go bad, they go really bad...and there is no attempt to correct the problem or keep customers happy.   The service was inattentive, cold, and not at all concerned with our experience. We were sitting there for 15 minutes with no attention from our server, so I flagged him down so that we could place our orders. I get that they are busy for a special event, but you would think they could staff it appropriately and plan in advance. The server had minimal communication with the table for the entire night.   The first course was an antipasto with whipped salted cod, olive oil, on a piece of bread. It was basically a salty piece of bruschetta, and the whipped cod is not particularly appetizing. Our server dropped a plate of four pieces at the table, made no mention of what the dish was, and immediately raced off. We had to flag him down, ask for four small plates so that we could share the appetizer. The waiter's response: ""sure, if we have any."" Is it too much to expect a restaurant to have clean dishes to use as sharing plates? We got another copy of the tasting menu because we realized that not every dish would be announced.   Second course was much better. Sausage dish was enjoyed by our friends. I ordered the swordfish crudo, with lemon, pistachio, and Calabrian chili. The flavor profile was nice, and the swordfish was fresh and delicious. This was the bright spot of our night.   Third course was awful. I ordered the tripe alla romana, with pancetta, garlic, san marzano tomatoes, and mint. I had never ordered tripe before, so this was partially my own fault for not asking more questions. Tripe is part of the cow's stomach, so buyer beware. My friend is from London, and told me that tripe is usually served tender and can be quite delicious. However HB's tripe was tough, chewy, and tasted as if it was straight out of a fear factor gross-eating competition. It also smelled like it was cow stomach. Ok, so maybe tripe is not my thing.   I flagged down the waiter, told him that I didn't enjoy the dish and asked if it could be swapped out for another salad instead. His response: ""we're running out of food, so there's nothing we can do."" A restaurant running out of food...hmmm. When you run out of a special dish or two, they get removed from the menu. When you run out of food, you close the doors for the night. Any other restaurant would have offered you something else, taken it off the bill, whatever. Some sort of gesture to show that they care about your dining experience. Instead the waiter immediately cleared the tripe dish away without asking me if I was finished with it. If I'm stuck with paying for the dish, I would have at least let my friend pick at the pancetta bits.   Fourth course was the entrée, and this was mediocre. I ordered the orecchiette with wild board pancetta, rapini, chili flakes, pecorino. This dish had some much potential, but...my portion came out with 12 noodles, three pieces of broccoli rapini, and 6 pieces of pancetta. The flavor was decent; the portion was miniscule. It was so obviously under-portioned on such a large dinner plate! I didn't even bother complaining at this point, because I know I would get some absurd line about how a restaurant with pre-planned reservations was ""running out of food"". Resistance is futile, and I think our waiter may have been the manager also. On the way out we saw someone served a plate with at least double the amount of orecchiette.   For the ending, we were served goats milk cheese with honey and figs. And also some cannoli's. They were decent, but small, and at that point we are just looking to get out of here. I was so hungry that we had to stop for fast food on the way home; this was also a first.   Overall, the five course menu was extremely underwhelming. For $50, your money goes much further at other restaurants. You could tell HB was trying to be fancy with their menu, but a lot of the dishes were bland and boring. Perhaps the exotic ingredients were contributing to the cost, but the flavor did nothing to justify the price. Horrible service destroys the experience, regardless of the food. We will not be going back.",0.9789,0.833,0.098,0.069,0.548686563827409
2017-07-22,1.0,"Zagat writes: ""delicious"" and ""you can't go wrong.""  The person who wrote that didn't order the steak frite.  Just left the place having been served the worst steak I've ever been served. You'd have to like chewing gum to like this piece of garbage.  The potatoes and asparagus were excellent. When i complained to the waiter he said to me and my companion, ""Get out of here!""",0.2942,0.794,0.117,0.089,0.6833333333333332
2017-07-20,5.0,Delicious BYOB in a hidden storefront in Boystown. Home Bistro has a great menu of American food with a modern twist. I would recommend the Wednesday pri-fixed deals as well as making a reservation.  Need to come try for brunch!,0.9134,0.71,0.29,0.0,0.47666666666666657
2017-06-28,1.0,"We were so excited to try a restaurant in Boystown with such high reviews (hard to find GOOD food in Boystown).  We did not have reservations but the hostess said she could seat us, as there were no reservations until 7:30pm (this was at 6:10pm and there were only 3 tables occupied).  Immediately after we were seated, I ran across the street to get wine and asked the others at our table to order appetizers.  I returned to find that they did not place the appetizer order, as they didn't allow them to.  The server said that we had to order everything at one time.. very odd, but okay.  We ordered and food came out fairly promptly.  The meal was solid and we were, overall, happy with our food.  Now comes the issue.. It's now 7:23 and we ask for a dessert menu.  The server says (while still walking) that we could not order dessert because they needed the table at 7:30.  I was sure I didn't hear him correctly, but (as stated) he said this while walking away so I asked him to come back over.  I asked again about dessert and he said we could not have dessert as they needed the table for a 7:30 reservation.  Now, I completely understand honoring reservations. However, we ordered with plenty of time to be served AND there were 3 other open tables at the time!  I asked for the hostess, who told me the same thing and handed me our check.  UNBELIEVABLE!!  No matter what, they were focused on having that particular table open at 7:30.  Now, there were 3 other tables open at the time.  Plus, what are the chances that all 4 reservations will show up at exactly 7:30.  And how many times do you check in at a restaurant for your reservation and they tell you it will be just a few minutes before your table is ready.. it happens all the time!  I just cannot understand why (I don't want to say it was race, but I saw no other people of color in there, unlike our mixed party).  We left, leaving VERY upset.   Naturally, I walked back past this place at 7:40.. 15 minutes after we were kicked out.  Guess what.. still 2 tables open!!  Needless to say, they won't take any more money from me.",0.9193,0.869,0.082,0.05,0.4507807807807809
2017-06-04,5.0,We came here with a big group and had family style dinner.  Wow.  We had the opportunity to try different dishes. Every one of them were  delicious like a fix menu in a really expensive restaurant. plus is BYOB so we were able to bring our favorite wines.  Must visit.,0.9413,0.727,0.273,0.0,0.7178571428571429
2017-05-26,5.0,Wow. This place is amazing. Be prepared to eat a lot but to enjoy everything. Highly recommend!!,0.9303,0.426,0.574,0.0,0.735
2017-05-21,5.0,"My boyfriend and I came here for dinner on a Friday night, we made the reservation that afternoon and they were able to squeeze us in at 6:30. By 7pm, the place was crowded.  We took advantage of the BYOB (with no corking fee!) and our waitress immediately offered to open our bottle, then proceeded to recommend a few dishes on the menu.  The had a ""specials"" menu where we ordered a fried soft shell crab for our appetizer, as well as the homemade pappardelle pasta for my main course (with chicken pesto). My boyfriend ordered the pork cheek of the normal menu and said it was one of the best dishes he'd ever had. All in all, we had a great time at Home Bistro and will definitely be back!",0.9431,0.853,0.131,0.016,0.45583333333333337
2017-05-19,3.0,"Decided to eat here the other night after reading the reviews.  Cute little place where you bring in your own alcohol/beverage to have with your meal, as I assume they don't have a license.  The menu looked promising with the edgy menu.   It was just okay.  It's hard to rate a place when some things are great and others not so my ratings are as follows.    Service - 5 stars Price - 4 Stars Food - 3 Stars.  Some of the more eclectic foods deserve 4 stars, but some of the less complicated choices were just average, especially the pasta and Caesar Salad - they were not good at all! Homemade Fettuccini and pancetta sounded so good, but the pasta was extremely pasty and very very Al dente! Very little flavor even with the pancetta.  How can a chef blow pasta?   Caesar about par to the Olive Garden. Dandelion salad was good.  Flap steak and spaetzle was also good.  With that said 3 stars overall isn't too bad if you are careful about what you order.",-0.4009,0.846,0.075,0.079,0.6245833333333333
2017-05-15,5.0,"I had brunch here with friends on Sunday. I wasn't sure what to think of the limited Mother's Day brunch menu, but I was blown away by the soft shell crab sandwich with pimento cheese. Sounds different, but it was so good!! I look forward to my next visit & what surprise they may have in store for me. (Bonus-it's BYOB)",0.8578,0.793,0.162,0.046,0.43029100529100534
2017-05-12,4.0,"Food was great, service was just ok. Our server was slow to pick up our plates, never offered us the dessert menu, and after 30 minutes of waiting we eventually had to ask for our check. Perhaps if they had three waiters instead of two tending to the small dining room our poor service could have been avoided.",0.2023,0.821,0.096,0.084,0.53
2017-05-11,2.0,"Parties of eight or more be forewarned:  You will be charged a minimum of $45 each (that's $60 total after the required tip and tax), even if you are not very hungry and do not require 3 courses.  A party of 8 can only order 4 appetizers, 4 main courses, and 4 desserts (served family style -- i.e. double portions), so if only one of you wants, say, the chicken, tough luck.  They do forewarn the person making the reservation of this policy, so it is up to that person to notify all the others.  When I inquired as to the reason for this policy, I was honestly told that it is because large parties tend to linger and they cannot turn over the table quickly enough to make a profit (understandable on a busy night).  When I replied that we were there Sunday evening when there were only 4 other people there all evening -- no reply.  The meal was OK but a terrible value under their ""policy"".  Parties of 8 or more should seek more welcoming dining options.",0.9105,0.823,0.123,0.055,0.5885119047619047
2017-05-07,3.0,"My friend told me about Home Bistro two years ago, he said it was one his favorite places. Maybe things have changed- it was whatever, I don't plan to go back. Sure, BYOB, which is nice, but with so many choices in Chicago why go somewhere just ok? Kind of pricy too, for a restaurant with paper over each table cloth, that jams parties of 2 against a wall at a super small table.  APPETIZERS: dandelion salad (basic, lacking flavor, basically a bowl of green with a few slices of apple,) artichoke and Edam fritters (the garlic aioli was good but not great,) the assorted bread (why it's called ""assorted"" I don't know - it's ONE piece of toast, cut up into 4 pieces with some spread and slice apple). ENTREES: paneer (not bad, but not amazing, I do eat Indian food a lot so maybe it was a mistake to order an Indian dish at a non-Indian restaurant. Furthermore, there were 3 pieces of panner cheese...3. Then about 7 pieces of squash cut in the shape of paneer. I was hungry when I left); boyfriend ordered the special which was a burger (pretty good, but the truffle fries lacked seasoning and were cold when we got them.) STAFF: our server was nice, but the hostess was aloof, kind of cold. As the restaurant filled up and the staff was stretched and we waited and waited and waited for our check.",0.9436,0.8,0.133,0.067,0.6257173382173382
2017-05-02,5.0,We stumbled onto this restaurant and what a surprise! The dessert (chocolate cracker thing) was fantastic!,0.7418,0.674,0.326,0.0,0.9
2017-04-29,5.0,We made reservations for a Friday evening and we had a group of six people. The atmosphere and staff was very friendly. HB is a BYOB restaurant. We brought some wine and beer. The waitress opened our wine for us. Our grouped order a variety of dinners from the main menu and a couple of specials of the evening. All the food was amazing!! The chicken sausage and wild rice was to die for. The Mint Creek Pork Burger  was one of the best burgers I have tasted and the spring chicken was melt in your mouth. The desserts are just as good. The Bread Pudding was the best I have had in a long time. I would recommend HB to anyone! Must visit when you are in town!,0.9605,0.812,0.16,0.028,0.5783333333333333
2017-04-26,5.0,"We were looking for a place to eat before heading to the Tina and Tony's Wedding show. Since Home Bistro was within walking distance, we decided to check it out!  After reading some yelp reviews, I was a little concerned we wouldn't be able to get reservations because the place was small.  However, there were plenty of seats for brunch at 1230pm on a Sunday. We were even able to snag a table by the window with a view. The brunch menu was small but I didn't mind. I prefer a small menu with lots of perfected and flavorful dishes than a large menu of mediocre dishes. Home Bistro did not disappoint. I ordered the Korean hash which was a bowl of marinated bulgogi, egg, potatoes, apples, in a sweet sauce. It was delicious! The meat was nice and tender and the potato hash was crisp on the outside and soft on the inside (just the way I like them)! Service was so friendly and fantastic. I must have had my coffee refilled three times. Its definitely bottomless and they make sure your cup is full here. I can't wait to come back and try the other items on their menu.",0.9929,0.805,0.195,0.0,0.5504346182917612
2017-04-24,4.0,"We went for a quick bite after shopping in the area for a small amount of time, it's awesome that it's byob! Me and my boyfriend each ordered a different entree, he ordered the bulgogi and also the gnocchi, we also started with the daily bread..The food was delicious, but the gnocchi was just overly salty from the use of the blue cheese, and also on top of that the actual salt...The service was nothing memorable but our glasses at least were kept full of water...for the price point I was expecting a bit more of a portion size as both of our portions were rather small and we both left feeling hungry still...The flavors were there so that's why I give it a four stars...I wouldn't come back but I wouldn't also stop any of my friends from coming as well.",0.9457,0.873,0.127,0.0,0.440625
2017-04-17,5.0,"Love this BYOB place in Lakeview. Food is delicious, staff is so nice and efficient. Looking forward to dining here again April 29!!",0.9448,0.556,0.444,0.0,0.8666666666666667
2017-04-16,5.0,Today I had Easter brunch there. I can honestly say EVERY meal our table ordered was top notch ..6-stars not 5. Loved the B.O.Y.B. as our table shared two bottles of wine. I would love to eat brunch there again. Parking was still good even with a Cubs game going on.  Service was excellent. Yes some of the time it got a little loud in there with the other tables but our group was having fun and blocked it out. I am posting pictures as the presentation  was beautiful.,0.9511,0.717,0.236,0.047,0.6395833333333334
2017-04-15,5.0,"Yelp lead us here after a Cubs game. It was still early and we had our choice of seats. Sat by the window and people watched while we ordered our food. This is a BYOB, and luckily we had two bottles that we brought with. We started with shishito peppers which were perfectly blistered and tasty, then bulogi/spatzel, this combination was killer!, I could've eaten another serving. There were four of us and we tried five courses and share them all. Also on the menu we tried the gnocchi, Prince Edward musssels, and finally doughnut holes with caramel sauce. Everything was so tasty, I want to go back and try more items on the menu. Staff is very helpful we had no issues, only a great time.",0.9482,0.846,0.138,0.016,0.6083333333333333
2017-03-30,5.0,"I love Home Bistro. The food is always delicious, I love that it is BYOB, which makes it much more affordable, and the waitstaff is top notch.",0.9313,0.602,0.398,0.0,0.64
2017-03-23,4.0,"A small group of us had dinner here.  My first impression was very positive - quaint little restaurant with a very friendly greeter/server.  We had a terrific table at the front window, so we had a nice view into the neighborhood. The food was very enjoyable.  As a group, we decided to go with the prix fixe menu - sharing appetizers, salads, and desserts.  This was a great way to experiment.  And, my main course (butternut squash risotto) was very nice. My only (minor) complaint - the service was a bit slow.  The restaurant got busy, and we were talking a lot, so I suspect that contributed. Overall, I enjoyed my experience.  Recommended!",0.9816,0.69,0.27,0.04,0.5697643097643097
2017-03-12,5.0,The food is so good I jizz every time I eat here.  I can't help it.  And it's embarrassing leaving with a jizz stain.  But it's still worth it.  Thanks HB.,0.5695,0.621,0.241,0.137,0.30000000000000004
2017-03-01,5.0,Hands down my favorite restaurant in Lakeview. I've never ordered anything I haven't loved in over 5 years. Extremely friendly staff. Great for BYOB nights out. Every changing menu keeps things fresh. Love this place!,0.9382,0.565,0.369,0.066,0.6341269841269842
2017-02-19,4.0,Very hom-ey. Very friendly staff who were able to get me something tasty and vegetarian. This place is BYOB which is awesome. It is definitely pricey though.,0.8899,0.695,0.305,0.0,0.615
2017-02-17,4.0,"Stopped in for a pre-concert dinner and it was terrific.  Two of us shared a shrimp appetizer that was terrific and the mussels which we asked for without chorizo which was not a problem.  A large serving accompanied by truffle fries.  The fries were fresh, perfectly cooked and plentiful.  Brought a nice bottle of wine and gave the waiter the final glass.  Bill for food and tax was extremely reasonable.  All in all, a winner. Atmosphere and service were both excellent.",0.977,0.687,0.292,0.02,0.8365079365079365
2017-02-12,4.0,"It's obvious the chef knows how to cook and is passionate about what he does. These are the types of restaurants I love to go to. That being said, my  entrée, the rainbow trout, had too much going on. I order fish because I a actually like to taste the subtle flavor. All I could taste was the horseradish, egg, pickled cabbage, and a ton of salt. Each component was good on it's own, but I was not a fan of the overall combo. I also had several bones in my fish. But, the quail appetizer was excellent, couldn't get enough of the blue cheese sauce. The salad we had was excellent and unique. The potatas bravas  was just okay.. but maybe because I love the tapas version so much and had a hard time not comparing. The bread pudding was phenomenal! My date had the pork belly special and I had to stop him from licking plate... He said how great is dinner was about 10 times after.",0.9835,0.781,0.182,0.037,0.5278679653679652
2017-02-03,3.0,"This is 2 1/2 stars.....check it Party of 4, first time visit with reservations on a later dinner Friday night.  Great waitress, super nice, informative and attentive.   Let's begin:  Ordered 3 ok appetizers to share; beets, escargot and fritters. We were underwhelmed with each dish. The beet salad had good quality ingredients intended to compliment each other; baby softly pickled beets, fennel and peanut butter crumble (I think). Good effort yet disappointing in flavor.  Escargot had a rich sauce with stewed m tomatoes.  It was good, snails were cooked great and not chewy.  Cauliflower and cheese fritters were little and fried and served with mayo (aioli). They had inedible strings in the batter. So onto 4 entrees to share between my critics; salmon, chicken sandwich, mussels and oxtail goulash. Initially flavors stimulated taste buds but after digging in and consuming our entrees, taste buds ended up being consumed by sodium.  Prolly course salt or sea salt, but too much salt nonetheless.  Portion control of the servings didn't even hold up against the toss of salt.  Flakey salmon steak was a little great cut cooked through exceptionally, but had a heavy over seasoned crust.  Served atop of fresh black beans, blanched sweet potatoes? (Maybe) and green sofrito.  Chicken sandwich was the bomb served in between pretzel buns with a honey mustard and peanut sauce. Truffle fries accompanied with mayo (aioli) and we couldn't tell they were truffled.  Beer mussels were an epic disappointment lacking sauce and sop.  Loving the richness of oxtail goulash mixed with some kind of little pastas and a dollop of sour cream. There were minimal amounts of oxtail meat which defeated our expectations.  Thank god its byob cuz holy check please. Don't even ask me about dessert. Later.",0.992,0.765,0.191,0.044,0.5383771929824561
2017-02-03,5.0,"I'm so happy to have found this (somewhat small) restaurant. We stopped by with some friends for dinner, and the atmosphere was cozy and romantic and the server was very friendly and knowledgeable. No corkage fee for the BYOB, which is always a plus! I tried the gnocchi and it was perfectly done, as chewy as I like it and the date puree balanced the richness of the sauce. My boyfriend tried the salmon, and although I can't say that it was the best salmon I've had, it was definitely above average. This is the perfect place if you're looking for somewhere cozy for an intimate dinner.",0.9848,0.704,0.264,0.032,0.6208333333333332
2017-02-02,4.0,"Nice local place. BYOB is a plus. Food is creative and very good. Not fancy, but has a cozy character to it.",0.6055,0.741,0.259,0.0,0.7060000000000001
2017-02-01,5.0,"Had our first date, several dates in between, and our wedding rehearsal dinner at HB.  Can't say enough about how great the service is and the people working there.  The food is always great, the atmosphere is really cozy.  For our wedding rehearsal we had so many options to choose and it was essentially like a 10 course meal.  Everyone raved about it.  BYOB without cork fees is awesome, too.  It will continue to be our special night out spot.",0.9552,0.809,0.191,0.0,0.5454761904761904
2016-12-22,1.0,"Absolute disaster. I ordered the ricotta gnocchi, which had ingredients listed as part of their special. The dish came and I thought it was dipped in brown sugar because it was so sweet. When I inquired what was making it so sweet, the waiter, a tall blonde bearded man, told me that it was the raisins. Firstly, I hate raisins. Had I known there were raisins, I would have NEVER considered the dish. Secondly, when he saw that I hadn't touched my dish, he didn't ask why I haven't indulged in my seemingly sugar coated entree. Not only this, when I voiced my concerns over not knowing that the raisins were the main component of the dish, giving it its overpowering and overwhelming taste, he said, ""Oh that makes sense,"" and walked away.  Horrible experience. I left the dish as it came and he didn't even offer to accommodate me.",0.1362,0.845,0.082,0.072,0.5837301587301587
