date,star,text,compound,neutral,positive,negative,subjectivity
2013-04-09,5.0,"I hosted a private party at HB several weeks ago. From the moment that I first contacted Victor regarding the possibility of renting the restaurant until the last dessert, the entire experience was exceptional. The service was outstanding; the food exquisite; and the environment cozy. I would strongly recommend HB for private parties as well as daily dining to anyone who asks.",0.9337,0.764,0.236,0.0,0.5111111111111112
2013-04-06,1.0,"HB use to be my favorite go-to restaurant in Boystown and I have recommended it to friends for years...not anymore.  Our meals last night were VERY disappointing.  The cheese board use to be one of my favorite appetizers to share.   There was barely enough for one person for $17. The Caesar salad a baby beets salad were very good, but pricey.  The bouillabaisse special was basically only mussels (3 shrimp 2 clams) and for $28 we felt ripped off, because the mussels on the dinner menu were only $19.  My Lamb breast was meager and the side that came with it was not good.  The chicken special was just a small chicken breast and nothing special for $24. The service is still impeccable,  but come on, please go back to what you use to be, a great food experience.  After leaving a good tip for the service and not having any dessert we paid $55 each for a BYOB restaurant.",0.9876,0.77,0.216,0.014,0.698547619047619
2013-04-03,4.0,"I've passed this place for years and been curious but overall didn't think much from the outside.  I was mistaken.  This place was great.  A nice variety (not huge but all delicious) and the best gnocchi I have EVER had.  Also a BYOB which is always nice.  Great service.  The only thing that leaves a star off is a) I didn't love either of the desserts and b) while everything was ok, some things lacked that extra little umphf that would give it a 5.  Still a great place to try!",0.9862,0.612,0.322,0.066,0.611764705882353
2013-03-31,5.0,Yes! Evening with fam. Byob. We loved everything. A gobacker!,0.8011,0.494,0.506,0.0,0.8
2013-03-30,5.0,"I went here  with my boyfriend on a Wednesday for the fixed price deal (it's a great deal). He's been begging me for months and I was skeptical! I am soooo glad that I went! I'd go back for the appetizers alone! Try the bacon wrapped dates AND the artichoke fritters. You won't even need to go further! These were two of the best appetizers I've EVER had.    Bring in your own bottle of wine, this is a warm environment that's great for a date or a heart to heart with a friend! Definitely worth trying!",0.9718,0.713,0.246,0.04,0.5181818181818181
2013-03-26,5.0,"My favorite restaurant in Chicago, hands down.  We've been here close to a dozen times now, and only one time have we ever not been truly satisfied with our meal.  When the waitstaff came by later and noticed my date's plate was mostly uneaten, she asked if something was wrong.  The chef then came out and apologized, and they wound up comping the entree of our bill. With that one exception aside, the food is always above average and usually excellent, and the waitstaff really make the place great.  BYOB is also a great plus. Now that the executive chef has changed, it will be interesting to see how HB fares.  The menu has changed and not necessarily for the better (where is the duck breast!?!) but hopefully it will go through some more refinement.",0.9121,0.833,0.13,0.037,0.6111111111111112
2013-03-15,1.0,"I am a food snob. So I might come across as very harsh. But so was the food. I am surprised at why this place gets such high reviews across the board. May be because it gets high footfall and it is in the middle of everything. Everything we had was bland, too mealy, spiceless.  The lamb sweatbread was only lamb fat and no lamb. Artichoke fritters had no artichoke but flour. Pork belly was too thick and way too salty. The accompanied squash was inedible - coz it was sprinkled wth salt after being doused in soy sauce. The hanger steak was ok but by that time we were about to walk out. The gnochhi was ok. Bread pudding was warm but came with warm cream n not ice cream. Ugh In all, I would not recommend at all.",0.0481,0.805,0.098,0.097,0.6075641025641025
2013-03-11,5.0,"I've been here a few times, and it's always great food and service.  They're BYOB so remember to bring a nice bottle of wine or beer.  The almond stuffed dates are delicious for an appetizer.  Make sure to save room for their bread pudding too.",0.9442,0.702,0.298,0.0,0.7477777777777778
2013-03-11,4.0,"This place looks and feels like you're inside a very rich person's living room.  The floors are hardwood, the walls are lined with carefully curated artwork, and there were goddamn chandeliers hanging from the ceiling.  It's a small restaurant with virtually no standing room, so be prepared to stand awkwardly in the middle of everybody's way while waiting for a table. Fried oysters, crispy pork belly, rainbow trout, the special of the night, which was a kind of duck pasta, and bread pudding.  Everything was perfectly cooked and seasoned.  The pork belly tasted like spun gold.  With a lot of foodie bullshit floating around, it's nice to eat at a restaurant that nails the basics and doesn't try to incorporate flavored air into every dish. Oh, and it's BYOB.  Get the fuck out of here, man",0.7485,0.759,0.144,0.097,0.6996753246753247
2013-02-17,5.0,"I loved HB- have been wanting to try it for awhile and am glad we did. The atmosphere is ""homey' and warm, with exposed brick and low lighting. They play a lot of old rock songs in the background which were fun. We stayed for a few hours as it was a birthday dinner and were never asked to leave even though I think we may have stayed longer than they expected us to. Major plus that it's BYOB.  My friend and i split the mussels and trout, both of which were excellent. The sauce for the truffle fries was amazing too. It's great they change their menu seasonally and I'd like to go back in the spring.",0.9827,0.731,0.243,0.025,0.5192307692307693
2013-02-16,5.0,"SO happy with my meal at HB.  Started with the fritters-- my friend called them heart attack comfort food at it's best.  They don't jump at you, just warm and cozy with a bit of crunch.  Delicious.   I had the salmon and it was so delicate and flavorful and light I couldn't stop eating it.  YUM!  My friend had the veggie dish with big cous cous (can't recall their name for it) and it was more savory and acidic--- perfectly balanced and flavorful. Also incredibly delicious and a great complement to the salmon.  We shared everything.  We'd brought a great wine to share and it went with our meal perfectly.  Too full for the bread pudding but eager to go back to try next time. May go on a Wednesday for their prix fix but HB is already so reasonable and regardless of price, so delicious.  One of the best meals either of us had in a long time.",0.9913,0.72,0.268,0.011,0.6285714285714287
2013-02-14,5.0,"HB Restaurant is great, I started a dinner club for some friends to tour Chicago with me based on the best food reviews.  HB was our first stop.  They have a $30 prix fixe menu that we enjoyed on a Wed.  It's BYOB, and there is a great little wine shop down the street that I was able to stop and buy a great bottle from.   They only allow a max of six guests per party on prix fixe nights, which was a bummer, but turned to be perfect.  The staff was very friendly and patient, as we were all running late, the food was amazing and the atmosphere is really nice.  I highly recommend coming to HB Restaurant.  I cannot wait to come back.",0.9891,0.681,0.285,0.035,0.6286601307189542
2013-02-03,5.0,One word OUTSTANDING ..   the staff and food are a benchmark for dining experience in Chicago...  a must go..,0.694,0.772,0.228,0.0,0.875
2013-02-02,5.0,"Awesome food, service and atmosphere....and it's BYOB! Took my girlfriend here and she loved it!",0.8619,0.602,0.398,0.0,0.9
2013-01-26,5.0,"So so so so GOOD! HB is just so wonderful and delicious! The service was phenomenal, and the food was just wonderful. Literally one of my favorites in Chicago! It is BYOB, so even though it is a little pricier, it's still very inexpensive all things considered. If you have not been you must go! It's the best in Boystown!",0.9833,0.663,0.337,0.0,0.6499999999999999
2013-01-25,2.0,"i had HB on my ""to do"" list for at least two years now & finally went for my birthday, only to be sorely disappointed.  the meal went something like this (party of two on a thursday night): - waitress ignored us for the first 10 minutes - raved-about almond stuffed dates were... mediocre. small. barely warm. ""meh, i've experienced better"" is right - i ordered the lamb meatballs. taste was good, but dish was lukewarm to cold; waitress did not check on us for at least 15 minutes after we had received meal - asked to have the meatballs warmed up. waitress does not ask why i asked to heat it up; does not apologize at any point in the meal; does not even ask how we are doing or if we like our food - mussels & fries were good - the waitress & bus boy fight over the thermostat the entire meal. one would turn it up. 30 seconds later the other would turn it down. this went back & forth at least 15 times. we were seated next to a vent, which kept blowing cold drafts on us every time someone changed the thermostat food tasted good, but the cold dish, awkward experience & bad service has moved HB to my ""miss this"" list.",0.5361,0.832,0.091,0.076,0.5916519694297472
2013-01-21,4.0,"I was going to give it 5 stars, but it was quite the trek from downtown (although worth it!)... other than that, the service was awesome, as was the food.  The mussels were phenomenal!",0.8619,0.778,0.222,0.0,0.49375
2013-01-20,5.0,"I was going to give it 4 stars but I find myself still thinking about the great meal I had here. It was absolutely delicious!  What we had: Almond Stuffed Dates - Yes! Get them. They tasted like Christmas... get them and you'll know what I mean. Coriander Crusted Salmon - probably the best cooked Salmon I've ever had. And this is a healthier option. I'd recommend trying the Rushing Waters Rainbow Trout, we didn't have it but the table next to us did and they said it was amazing. The Lamb meatballs were good, but not the most memorable dish of the night.  There's no wine/alcohol, but the waiter suggested we go to 7/11 across the street to get something as it's BYOB. We got wine and were perfectly content in saving money.",0.9926,0.719,0.263,0.017,0.67375
2013-01-20,5.0,"You can't go wrong at HB. Solid food, and great service. BYOB is an added benefit.",0.8821,0.516,0.484,0.0,0.5833333333333334
2013-01-17,3.0,"I'm so torn, this place is one of my friend's all time favorite eats in Boystown and he was excited to take me there. I really wanted to be able to come home and write a stellar review... Let's start with the good (and the good was indeed good). It's BYOB, to some a positive; I'm a Californian and I still haven't quite grasped the concept of BYOB (it seems weird), but I will try to get on board with the Chicagoan excitement of it. They were offering a prix fixe deal (appetizer, soup/salad, and entree) that was an awesome bargain. Between the two of us we got to eat a lot of food! I like that. I had the artichoke edam fritters with roasted garlic aioli, the Belgium endive salad, and the mussels and truffle fries. My friend had the almond stuffed dates, the Caesar salad and the special of the night - sausage over something (I can't remember the description). Our bill for both was $70 (pretty good deal for the amount of food you get).  Let's break it down: artichoke fritters - ok, but very bland. I don't like my food salty, but I seriously wanted to add some salt to these. They were big and kinda fun to break apart with your fingers.  almond stuffed dates - they were good, better than the fritters, but average at best.  endive salad was exceptional! It included pears, goat cheese, pork jowl lardons, and a creamy walnut dressing. I would have been happy to end the meal here. Ok maybe the salad and a sample of their bread pudding! The salad was the best part of the meal and I would go back to try the other great salad combinations.  mussels - oh man, they were the worst I have ever had. They were piled high in a small bowl so most of them weren't submerged in the yummy beer broth, they got cold fast, many were still closed and more than half of the ones opened did not look friendly. I only ate about a 1/4 of the bowl before I pushed them aside. One of my favorite things about mussels is the big ass bowl, the delicious broth to dip a hunk of bread into and steaming mussels that go down smooth. I got none of that here.  truffle fries - omg, so addictive and good! Crispy, thin, tasteful.  The staff is amazeballs and attentive and funny and kind. The place is cozy, candlelit and in a great location to start an evening out in Boystown. I would like to go back and try some other items because the menu is creative and well thought out. Everyone has an off night and I am more than willing to give HB another go at it.",0.9988,0.74,0.227,0.033,0.6031638398031841
2013-01-13,5.0,"Great date night.  Every single course we had was excellent. We started with the bacon wrapped dates stuffed with almonds and the escargot.  We wanted to order more, but we knew we had more coming. For dinner, the salmon was very light and healthy and had great flavors.  My husband ordered the special, which was like a rabbit pot pie.  It was very tasting - perfect for the season.   You HAVE to try the bread pudding for dessert.  It was sooo good.  I was so full and didn't even want to order dessert, but the second I tried a bite, I was so glad we did.  Amazing flavors. This place is perfect for a date night!  Great service, great food, great ambience!  The best is that it's BYOB so we could bring a wine we know we love and the bill was less than $100 for 2.  Perfect! Another tip: we had an a la card, which gave us $10 off (as long as we spent $25).  Will definitely return! 13/365",0.9983,0.624,0.37,0.006,0.6023104056437389
2013-01-10,5.0,Love love love! Great service and I have dreams about the dish with catfish and okra. Enough said.,0.967,0.379,0.621,0.0,0.61
2013-01-10,4.0,"Went here on a recent date night with the future hubby and it was lovely. BYOB is great, but its hard to match such a diverse menu! Our food was very good. Not blow you away, I'll be back as soon as I can afford it good but very good. Considering it was only a week ago and I can't remember a single dish we had specifically, nothing really stood out. Thankfully they have their menu online to refresh my memory. Almond stuffed dates wrapped in bacon. I didn't get the fuss over these. Has no one else tried stuffed dates before? Because these are exactly the same as everywhere else you've ever had a stuffed date. Are they good? Yes. Are they yelp worthy? I don't think so. We had a special salad with a horseradish dressing and trout that was SOCLOSE to being incredible but just lacked a little bit. It was like they toned it down for the older clientele instead of fully unleashing the flavors. The smoked trout was a wonderful compliment to the dressing though. I had the mussels and they were, well, mussels. I've had better and I've had worse but the truffle fries were quite good.  The special rabbit cassoulet my partner had was like a very rich rabbit pot pie without the crust. It was a perfect winter dish - filling, rich, warm and decadent. I think it was the highlight of the meal, even if it was a bit one-note. As others have mentioned, the service is great. I wasn't as big of a fan of the dining room as it is very small. The chairs are also fairly uncomfortable which was a detraction for me from the meal. And finally, they don't have any way to block the wind so every time someone enters or exits the restaurant expect a blast of cold air.  All in all, I won't be rushing back because I look for something more unique in a restaurant meal.",0.998,0.71,0.249,0.041,0.5881507936507938
2013-01-08,5.0,"Had an amazing and memorable date night here. I didn't want to deal with a super trendy place, just wanted great food in a cozy and intimate atmosphere. If that's what you're looking for, HB has it. We brought a couple bottles of wine and settled in to our table. To begin, they served us chunks of bread with the most sensational balsamic I've ever had. So. Good.  We started with the Belgian endive salad, which was definitely nontraditional, but very tasty. The sweetness of the pears balanced the goat cheese and hog jowl lardons very well. We also had the homemade Italian sausage and clams. Nom. The broth and Italian sausage were so flavorful, I literally did not want this dish to end. The boyfriend and I split the trout and the duck for our entrees. Neither of these are dishes we would typically order, but we trusted our waiter's opinion and were right to do so. Both were unreal, with so many elements and layers of flavor included in each dish. The proteins were cooked perfectly and the maple-orange-chilli pan sauce on the duck was really superb. We finished our dinner with the apple bread pudding that was on special, moist, not too sweet, perfect way to end the meal.  Two notable pluses about HB are that you do not feel rushed to get through your meal and leave, and that the BYOB element makes it very affordable. Truly recommend this spot!",0.9905,0.792,0.169,0.039,0.5996190476190477
2013-01-07,4.0,"Great food,reasonable prices, intimately small place for a date. Food:4/5 atmosphere:4.5/5 decor:4/5 service:4/5 Here's what my bf and I ordered: ALMOND STUFFED DATES as an appetizer DUCK and CORIANDER CRUSTED SALMON the stuffed dates were ok but not as much as I expected since lots of yelpers raved about them. It was too sweet for an appetizer ( and I have sweet tooth) I didn't taste the duck but bf said it was good but not the best. I think he said that because he thought he ordered the lamb but for some reason the duck slipped out of his mouth when ordering and didn't notice until he got what he thought he had ordered. The salmon was really good. There was no fishy smell as I always get when i have the salmon. It was a perfect harmony with the quinoa tabouleh that came with the dish. Overall: Great small place with a intimate atmosphere. I would go HB again with my bf for sure and we don't usually go somewhere we've already been but this deserves our second visit.",0.9844,0.78,0.184,0.037,0.5140522875816993
2013-01-06,5.0,This place is amazing.  It's my new favorite restaurant in Chicago.  And it's BYOB.  The Wednesday prix fixe meal is such a great deal and you get to try so much more.  Service and staff were so nice and accommodating.  Restaurant was nice and cozy.  The food was delicious. I had the mussels and ceased salad and almond stuffed dates.  Everything was delicious.  One of the best Caesar salads I've had.  Some friends ordered the pork shank and the gnocchi.  All delicious!  Would go there again in a heartbeat.,0.9897,0.674,0.326,0.0,0.7811188811188813
2013-01-03,2.0,"I would love to give them 3 stars but they basically ignored me and my party of 9 the entire night.  They promised us the table behind the host station and instead put us in the middle of the room with 8 settings.  It was my birthday and they didn't put a candle in the desert and didn't even acknowledge me (the person who made the reservations) the whole night.  They didn't ever come back to ask how we were doing with our food despite our accommodating their request to have the ""family style"" meal.  WE accommodated THEM.  I would also give them higher marks except the food was so close....but not there.  It's really too bad because they have a very warm environment and a lovely sounding menu.  If they had just not been so ""snarky"" about the menu..and not alienated me and my friends, I would cut them some slack on the food.  Just because you offer BYOB doesn't give you the right to act like you're doing us a favor.  Maybe they had a bad night.",0.9082,0.779,0.142,0.08,0.49415750915750917
2013-01-02,3.0,Meh ! It's nothing to compare with spots like avec!,0.4184,0.615,0.271,0.114,0.0
2012-12-30,4.0,I don't remember what my friend and I ordered for our appetizers/entrees but they were tasty. What I DO remember ordering is HB's amazing bread pudding. I brought the rest of my leftovers home for the husband and told him that he could have the rest of my entree but he wasn't allowed to touch my dessert! The space is a little tight but the delicious food and friendly service made up for it!,0.9597,0.79,0.21,0.0,0.6371428571428571
2012-12-27,3.0,"I wanted so badly to love this place but unfortunately, it didn't merit a 4 or 5 in my opinion. Service - was efficient yet courteous. We were seated on-time for our reservation and water/bread etc. were promptly served.  Ambiance - cozy yet sophisticated.  Cost - fair, for the portions Food - Loved my appetizer (clams) and dessert (bread pudding). Was so disappointed with my pork dish (no flavor at all, although the meat was tender) and my partner was also rated the skate wing as 'ok'. I'd love to give this place another try. Maybe I will.",0.9612,0.639,0.248,0.113,0.7899999999999999
2012-12-25,5.0,"I just had one of the best meals of this year here.  We had a far inferior meal at a big Michelin star place recently for far more money.  The whole staff is kind and genuine, and the people are clearly passionate about the food.  It blows my mind that this place doesn't have wider recognition, or a line out the door. It's hard to find fine dining that's BYOB, especially as a vegetarian.  They had proper glassware, decanted a bottle for me, and the food was truly spectacular. We will be back soon, and I have gone out of my way to tell my foodie pals about this hidden gem.",0.936,0.81,0.155,0.035,0.5397058823529413
2012-12-21,4.0,"We had plans to meet Yvonne and M here which was the good part, the bad part was that I had looked the restaurant up on Yelp and read that there was no Valet parking.  Luckily, we were able to find a metered spot about two blocks away.  You can only pay the meter for two hours which had expired by the time we got back to our car.  The parking gods were in our favor, however, as we did not have a ticket.  I mention this because if you can arrive via cab or public transportation, it might make your night a little easier.  Coming from the southwest suburbs, this was not an option for us. The restaurant is small, almost but not quite too small.  I appreciated not having a table placed immediately next to mine but navigating getting to and from the table was not the easiest.  We all had to make a trip to the ""library"" so this was a small issue. Our server was friendly and quick, good about explaining things and very helpful with the bottles of champagne our table companions had brought.  This was really a big plus because at a BYOB, these beverages did not increase the bill or tip.  Take that into consideration when you tip, you got a service which isn't reflected in the bill. I had the pork shank which was fall off the bone tender. It came with really delicious German potato salad.  I also got to eat one of my wife's meatballs so I was very happy with the food.  For appetizers we had the eggs and the anchovies.  Again, I liked these the best so I got a lion's share.  I am not even a big fan of anchovies but the really spicy pickled part made the dish for me.   Only fair then that when dessert arrived, I didn't really care for the crisp that much so I only had a few tries and left it for my wife.   The food here is easily a five, the overall rating of four is based on the size of the restaurant, the noisiness which made conversation a bit challenging and the lack of valet parking.  If I lived nearby and lost about a foot of height, this would be a five for sure.  We'll call it a four point five.",0.9921,0.794,0.149,0.057,0.4792042042042043
