date,star,text,compound,neutral,positive,negative,subjectivity
2010-12-12,5.0,"A place that feels like, well, HOME.  What I would really like to note about HB is the incredibly warm atmosphere created by chef/owner Joncarl and his staff.  Absolute sweethearts.  I can't express how welcome and valued you are made to feel from the moment you make a reservation until the moment you complete your meal, absolutely satisfied.   It is clear to see that Joncarl has tremendous pride in his food and in his establishment - and justly so.   There isn't much else I can add that 400 others haven't - everything we ordered was delicious and the portions are very generous.   HB - you're at the top of my list.  I wish it didn't take me so long to try you, but now I look forward to returning again and again.",0.9463,0.794,0.193,0.013,0.5987179487179487
2010-12-02,4.0,"Our narcoleptic at the table hit a wall, so the staff naturally helped reposition her in order to more comfortably snooze. Another one of us violently shattered a glass, and they just smiled. Nope, nothing fazes Home Bistro. It's the lovely antithesis of an asshole and the world can use more of those.  Remixed comfort food is done right by the mussels w damn good truffle fries,  tender-as-the-night lamb shoulder with cornbread and melty short rib. The fluke tastes much more appetizing then it smells and even the tricky sautéed escargot comes off without a hitch. And when the curiously reasonable check arrives, you almost feel like you've gotten away with vehicular birdslaughter or some other third degree crime. Dining at HB is sort of like eating in a hip womb with an enviable playlist. From the minute you walk in to when you leave, it's your cozy and uplifting sanctuary from overzealous antique dealers, flat pop, war crimes, inexplicable moisture and anything else that puts a damper on your day.",0.1119,0.79,0.106,0.104,0.5242063492063491
2010-12-02,4.0,"Made a reservation for 8:30 pm that night and man was it packed! The bf and I got there at 8pm, they asked if we could come back at like 8:15 pm to seat us.  Not bad.  Like all the reviews, the place is really small but it's nice and cozy when you finally get your table. The ambiance is great, I love the writing on the wall and the lighting is nice and romantic.  The place is BYOB and I think we were the only people that brought beer. Everyone else had wine at their table haha. The restaurant is nice and classy.  We ordered the bacon wrapped dates. I was a bit hesitant b/c I've never tried dates before but it was exquisite. I'm glad we were a little adventurous with that one. I didn't really like the menu. It has a lot of different entrees but I feel like it doesn't have ton of variety. The bf got the braised beef short rib and i ordered the cornmeal crusted catfish. Both were delicious. Our waiter wasn't overbearing, he gave us a lot of time (borderline too much time but it was a relaxing evening) and was really great about refilling our drinks. We also ordered this chocolate cake for dessert and it was delicious. i wish i had milk! :) Other than the beef short rib and catfish, I don't really know what else I'd like to try so I'm not sure if I'd go back there real soon. I do want to go back at some point though b/c the service is excellent and they're really great about making sure you have a table on time.",0.9982,0.691,0.278,0.031,0.639429012345679
2010-11-25,5.0,"I was here almost two months ago, and the meal is still ingrained into my memory! We had a reservation, so the wait wasn't bad. The staff was extremely friendly, and the co-owner even stopped by to make friendly banter throughout our meal.  I had the pork knuckle pappardelle, and it was delicious. It was a little over-salted, but ended up pairing really well with a nice BYOB wine. The portion seemed a little small at first, but I was able to try out the seafood and mussels from my friends, and they seemed like the better dishes to order.  I really liked the atmosphere that they've created here, including the artwork and restroom decor. I'll definitely be back soon to see how the restaurant is doing.",0.9884,0.73,0.26,0.01,0.5375
2010-11-23,5.0,"Honestly, BYOB has never been better. We went there for our anniversary with some friends. Opened El Nido, Graff Cab, Groom Shiraz  and Delille Cellars that evening. The food stood up wonderfully to these incredible big wines. The fried oysters were out of this word. The pork shoulder was so simple but even the bed of corn bread was perfect. Kudos to HB! The only knock on them is that they did not like our slower pace and subtly made it known. The food and friends made me not worry about the slight lack of tact. Overall, thrilled. Will be back again and again!",0.9697,0.727,0.216,0.057,0.547985347985348
2010-11-18,2.0,"Whoa. Went here last night and while the food was good. The service was pretty terrible. Our server, while apparent that she was trying to be kind, was super awkward. Anyway. After waiting 30 min to place our order we waited over 45 minutes for our food. Unacceptable. We didn't even get a 'sorry for the wait' --- When our server delivered our food we get 'omg which one goes to who, it's been so long that i forgot!' --- Really? REALLLLYYYY??? I'll let this incident slide and give it another shot, the reviews on here are just too awesome to not give it another try. But seriously, what happened last night, HB!?! REALLY?!!?!?",0.9253,0.771,0.158,0.071,0.6077777777777776
2010-11-10,5.0,"This place is great. For some reason I haven't been back (perhaps a little pricier than my usual fare). Food was delicious. My boyfriend and I went here for an anniversary. We brought our wine. The appetizers we got were really tasty and both of use really enjoyed our main courses. The service here was also great! The chef came out and asked us if we liked our food and sat and chit chatted for a couple minutes. Our waiter was really on top of things and was very friendly. My only criticism is that its very close quarters and their happened to be a rowdy party there that night which was slightly disruptive. Otherwise, the atmosphere would have been perfect. Im going to have go back soon...",0.9791,0.76,0.207,0.033,0.523529411764706
2010-11-09,2.0,"Man oh man. Somewhat overrated. I'm gonna try to sound smart for the next 20 seconds.  (but that's all I can muster... oh.. and I said, ""try"") *Ahem*  In statistics and in medicine we have this concept of ""Pretest Probability"" - which is the likelihood of having a disease even before you perform a confirmatory test.  For example, if I see someone with say...oh I dunno... A SWORD THROUGH THEIR ABDOMEN.... I have a fairly high pretest probability that they injured something, probably severely, inside their abdomen even before I get a confirmatory CT scan.  Apply this concept to Home Bistro restaurant and I had a HIGH pretest probability that everything would be great even before I did my confirmatory test of... the food hitting my stomach.  This was based on: 1) Unique Menu 2) Dutch chef 3) BYOB 4) infamous MUSSELS 5) raved about on YELP  I'll hit the high points first.  The restaurant is cozy and small, very warm and great ambiance.  Very HOMEY and BISTRO-Y, if that hasn't been used yet :) We got by without reservations on a friday by showing up to eat at 5:30 which is a good tip, otherwise no free tables until 9:45 pm Last great thing is BYOB, as advertised HEAVILY.  I'll get into this later. We ordered a lot and honestly I was just disappointed by the taste of the food.  There seemed to be a trend towards heavy, rich and salty in the menu so be aware of that.  1. artichoke fritters - dense, thick, salty, with a side of equally salty garlic aioli (which reminded me of the garlic sauces in LA, see my Zankou Chicken review) 2. Almond stuffed dates -  tasty, yes, but small.  Served in a small tray there were 8 peanut sized bacon wrapped brown sugar dates on toothpicks.  overpriced, which was a trend 3. Crispy Veal Sweetbreads - sooooo dissappointing, this was the first time I was let down by thyroid and/or pancreatic tissue!! Ok, well maybe I've had a string of good luck up to this (see Schwa review).  But first off I claim false advertising because they weren't crispy.  Fried, yes - but soggy and fried.  The sweetbreads were very chewy and the accompanying sauces and hummus were rich and salty and did not enhance anything 4. Mussels - oh the let downs would not end in this meal!  I have heard great things about the HB Mussels + truffle fries.  I was surprised they weren't an appetizer but I wanted them so I ordered them anyways.  At nearly 20 dollars very pricey for any mussels I've had anywhere.  Can't be the truffle fries because I can get those at Big and Littles for $3.50.  Flavor just didn't do it for me.  The anise was very strong, and overwhelming, and most offensive was the salt attack again which was pretty heavy handed and (I'm bragging a bit here)  I have a pretty high tolerance for salt.  The BROTH which if anyone who's had mussels knows that a good mussel dish will have you sopping up the broth with any bread you can find in the restaurant or have you drinking it straight up - not so much here.. 5. Trout, Short Ribs, Pork Knuckle Pappardelle - All Rich and Salty 6.  Bread pudding - VERY GOOD actually 7. Apple crisp - NOT very good Looking back, I realize that French food (maybe Dutch food too, though I wouldn't know) tends to be rich and salty.  BE SURE TO BRING PLENTY OF WINE BECAUSE YOU WILL NEED IT.  Rating based on so many disappointments among the many we tried, obviously there is much more to the menu. Honestly, I think this place is so successful because it is BYOB, and I think the menu pricing factors that convenience into account because everything seems to be 25% more that I think it should be.  The $30 wed pre fixe which seems more reasonable. Oh, and my stomach confirmed this all. But clearly a lot of yelpers still like this place so it's worth another shot.",0.9986,0.806,0.166,0.028,0.5493139400282256
2010-11-09,4.0,"Came here for another birthday dinner. Excellent food and great variety. $30 prix fixe was great, and we got 4 appetizers and 3 entrees (double on the salmon) among our table. Excellent food. BYOB is a huge plus. Intimate in size but tables are not cramped together. Service was friendly, but I have to mention that the waitress spilled wine on my mother's pants while pouring - now I get it that you're no sommelier or anything, but it's just serving 101 to shield your patrons from stains...I'll write off the long follow up time to the possibility that she may not have been able to find seltzer water, and give her half a point back for being apologetic and friendly. Mishaps aside, this is a standout place that executes its food and ambiance strongly, and each dish I tasted was worthy of ordering again. Get at it.",0.9711,0.815,0.168,0.018,0.5950000000000001
2010-11-08,4.0,"This place was great...and popular so be sure you can get a table.  Had the lamb shoulder stew, mussels, salmon salad and homemade ho-ho for dessert.  Everything was exceptional in my book.",0.6573,0.844,0.156,0.0,0.9296296296296296
2010-11-07,5.0,"GREAT FOOD! (Everything looked good on the Menu) GREAT SERVICE! (Friendly, fun, cool) TOP NOTCH!!!",0.9664,0.338,0.662,0.0,0.5642857142857143
2010-11-02,5.0,"OMG, this place is freaking good!  I had a crab salad (can't remember exactly) and it was delish.  The best part was the service.  The servers are so incredibly nice and make you feel like you're eating in their home.  Loved that it's BYOB!  We brought champagne and they brought out ice to chill it in.  Highly recommended!",0.9598,0.659,0.303,0.038,0.5816666666666667
2010-11-01,4.0,"I swear to God, every time I come to this restaurant, I think to myself, ""Wow, this would be an amazing place to take a significant other.""  Let's just say that if Phantom of the Opera ever melded with the kitchen from Beauty & the Beast, the result would be HB.  The food is really good, especially for the prix fixe.  The BYOB aspect is certainly a plus as well.  The only thing I was disappointed with was the pate, which was the appetizer I got the last time around.",0.9312,0.757,0.199,0.045,0.7138095238095238
2010-10-24,5.0,"Home Bistro if absolutely outstanding. The appetizers, main course and desserts are incredible. This place is a byob, the wait staff is great and the prices are very fair. Reservations are not required but definitely help.",0.7688,0.691,0.243,0.066,0.7263888888888889
2010-10-24,5.0,"Ah-mazing!  We went on the recommendation from a friend, and made a very last minute reservation.  The host was wonderful and got us in on a very busy night.  The food was tasty, interesting, but not too pretentious.  We liked the French influence in both the menu and the ambiance-- it's an intimate, but friendly vibe.  But don't forget to pick up a bottle of wine on your way in-- it's only BYOB.  Our server was FANTASTIC.  PERIOD.  She had a great personality, checked up on us often without being intrusive, and made sure we were enjoying the meal.  My husband's a hard one to please, but by the end of the meal, he was asking about returning the following weekend.   The host said that they also have a new restaurant in Andersonville, Vincent, that we should definitely try too.",0.9916,0.732,0.258,0.01,0.5728759820426487
2010-10-23,4.0,Great interesting food. Good service. Window seats are prime seating for Halsted people watching.,0.8658,0.531,0.469,0.0,0.6166666666666667
2010-10-23,5.0,"This place was absolutely wonderful!  We went with a large group, so we could try everything.  I ordered the short ribs with pumpkin seeds and some sort of puree that escapes me now, but I assure you that it was one of the most tender cuts of meat I have ever enjoyed in a restaurant.  The girlfriend ordered the Vegetable Cous Cous, which was out of this world.  Perfectly cooked with the perfect amount of spice.  Also at the table were the pork pappardelle and a homemade bacon sandwich that were devine. Desserts were unbelievable.  Bread pudding with blackberry topping, homemade Ho-Ho's (yes, you read that right), Baklavah, and a plum cobbler.  Of these, I would say that the bread pudding was by far the best. Plus, its BYOB, which is always a plus.   Overall, I would highly recommend this restaurant, and I am sure that I will be back.",0.9881,0.759,0.222,0.019,0.6128783068783068
2010-10-20,4.0,"What a lovely restaurant.  Went for the pre fixe Wednesday dinner. I had a hard time choosing between menu items... Everything sounded so amazing.  Went with the HB Ham and Apples - good but no wow factor. Pork pappardelle  - perfectly cooked meat, absolutely amazing. Words cannot describe my dessert - some bread pudding with berries that was fabulous.  And to top it all of its BYOB! Will be back, many times.",0.9851,0.608,0.349,0.043,0.6992424242424242
2010-10-14,4.0,"HB is such a lovely romantic little place. The menu is original, though I couldn't quite figure out if the theme was Dutch, Kentuckian, or just eclectic. I had a salmon filet in a chantarelle sauce which had a particularly tasty, crispy skin, with plenty of pepper that gave it some kick. It came with a cauliflower puree, which I thought was an interesting idea (though cauliflowers aren't the world's most interesting tasting food). But the real reason I am writing this review is the desert. I had a caramel and strawberry brioche bread pudding and it was the single best thing I have tasted in months. It was soft and creamy with the perfect level of sweetness. It's been three weeks and I'm still dreaming about this desert. At HB deserts change daily, but if their other creations come close to this work of art, you'll be fine to order whatever they're serving.",0.9306,0.869,0.131,0.0,0.4630952380952381
2010-10-11,4.0,"It IS worth the wait.  The place is teeny, as in, my 1100 sq foot apartment is bigger than this restaurant.  Needless to say, make a reservation.  But even with a reservation be prepared to possibly wait. My girlfriends and I went to dinner on Saturday night.  We had reservations at 8pm and arrived  promptly before our reservation in fear that we would lose it.  Unfortunately, the ""large"" table was still being occupied by the people who had the reservation before us and they were in no rush.  Unfortunately the restaurant doesn't have a bar and there's barely any kind of waiting room so the bottles of wine we brought to drink couldn't even be opened while we waited.  Sadly we waited about 15 minutes before we were seated, but from that time on everything was impeccable.   We shared the artichoke fritters, fresh mozzarella and bacon wrapped dates to start - both were so delicious, but the entrees are where it's at.  Me and 2 of my friends split 3 dishes - The fluke, mussels and the pork knuckle parpadelle.  All three were so amazing.  The broth in the mussels was so delicious and the fries were extra crispy.  The fluke was maybe my favorite thing it was nice and crisp but so creamy and smooth.  The parpadelle was so fresh and the pork was extremely tender.  We ended the night with the Baklava and bread pudding.  I don't know that those are consistent items on the menu but if they're offering the bread pudding when you're there than I recommend you order that.  It was so good. Overall everything was marvelous and the service was great - despite the bumpy start.  Definitely make a reservation and bring a bottle of wine (or 2)!",0.9965,0.769,0.199,0.032,0.6712585034013605
2010-10-11,4.0,"Without a doubt, the best mussels I have ever eaten were at HB - I actually dreamed about them for three days after dining in the restaurant, they were that good. Not only were the mussels cooked to absolute perfection, but the beer broth was absolutely divine. But HB didn't earn five stars on mussels alone - the entire experience was wonderful. My date started with the veal sweetbread, which he finished in about five minutes, while I had the cheese tasting. All three Goudas were excellent choices. And the truffle fries that accompanied my mussels were delicious. The waitstaff was very polite and pleasant, and the atmosphere was quiet and cozy. And of course, HB is BYOB, which is very appreciated. It's equally perfect for date night or an evening out with the girls. I can't wait to return - I might even go out on a limb and say that HB could be a contender for my favorite restaurant in Chicago. It deserves every one of those five stars. Be sure to make a reservation though - HB can get booked pretty quickly!",0.9952,0.723,0.257,0.02,0.7146944444444445
2010-10-10,5.0,"I'm going to go with a 5 on this one based solely on the food. The space was set up awkwardly, felt a bit cramped with uncomfortable chairs and tables that are too small, and was too dimly lit even for my taste. The candle on our table went out three times and had to be replaced and re-lit, which was kind of annoying. I would like to see what I'm eating and not have our dinner interrupted three times.  Service was professional, not overly friendly, but just right. The food was the star of this show. Artichoke and edam fritters for starters, unique and tasty. My dining companion had the braised beef short rib which I had a taste of and I wish I had ordered because it was the best short rib I've ever tasted. It was so tender it just came apart, you could eat it with a fork. I had a white fish of some kind (I don't remember and since they have a seasonal menu, I couldn't look it up online) served over hummus with a cucumber salad. It was perfectly cooked and flavorful and the hummus was a nice twist. I honestly don't remember what we had for dessert (I get fuzzy after a bottle of wine), but I remember not being all that impressed by it, might have been a bad pick on our part because they were out of their other desserts.   A meal here can be quite affordable since it's BYOB. Don't even think about showing up without a reservation because this place is really small and there are only a few tables and people tend to linger. The space, ambiance, and service were all ok, but what really matters is the food and HB delivered big time in that department.",0.9736,0.849,0.107,0.044,0.5880511463844796
2010-10-06,5.0,"HB is by far one of the best culinary experiences of my eating career.  Joncarl Lachman, chef extraordinaire, knows what he's doing in the kitchen.  The highlight of my food was just that, the food.  It was the kind of food you don't forget.  I've actually had dreams about it. The atmosphere of HB has is equally as amazing.  Low light, great music (thanks Bob) and fabulous design.  It's a perfect spot for any occasion.   There aren't enough stars on Yelp to give this wonderful gem an accurate rating.   Thank you HB for the love you put into my belly on that magical night at your table.",0.9882,0.706,0.278,0.016,0.6401960784313725
2010-09-30,5.0,"This place lives up to the big expectations that might arise from so many good reviews!! and that's not always the case, so good job. The place is intimate and romantic but with no ostentation, it has a familiar and friendly atmososphere, and the music is not cheesy.  I went there tonight with my boyfriend to celebrate our new car, and all the food ranged from good to delicious. As a start, they brought us a few pieces of bread (actually focaccia) with some balsamic vinegar and seasoning, which I appreciated. We shared artichoke&edam fritters as a starter, and their soft and creamy heart had already won us over. Then I had the mussels and he had the salmon, and both were really tasty and fresh (special mention goes to the broth that came with my mussels!!). Portions were not huge so we went for desserts, and that was a glorious ending!! We had the ""ho-ho"" (very refreshing, chocolaty roll) and the most wonderful dessert ever, the bread pudding with strawberry conserve. I'm usually not a big fan of dessert, but I totally LOVED it!! Warm and soft, sweet but not too much, it really blew me off!! The service was also excellent, fast and nice. Price is mid-range, but it is good for what you get.  The only downside is the view of the SevenEleven on the other side of the street.. some curtains wouldn't hurt.  Overall, it was a very pleasing experience, and HB jumps on the list of my favourite places in town!!",0.998,0.69,0.278,0.032,0.5365128115128116
2010-09-27,5.0,"Let me start off by saying that my parents are huge BYOB fans. They come up to visit and take us all out to dinner quite often ,and always want to try out BYOB places. We have frequented tons of places in the city which are all very good, but I am not sure if I would go there again if it weren't for the BYOB aspect. This is not the case here, I LOVED this place regardless of the alcohol.  We arrived to a pretty small and dimly lit restaurant. With the added touch of exposed brick, the atmosphere was wonderful. They had a large table they were setting up for the 6 of us when we walked in. The hostess immediately took one of our wine bottles and opened it, making sure we had drinks as soon as we sat down. They started us off with some bread and what tasted like a balsamic reduction sauce. The menu isn't large, but each of us had multiple dishes we were deciding from. They also had multiple specials which included appetizers and entrees. We decided to go with the crisp fried oysters and the Gouda tasting to start with. The oysters were amazing. They were accompanied by cream spinach and a lemon fennel oil. I am a huge oyster fan, both raw and cooked, and I loved them. My sister, who is not a fan, loved them as well. The Gouda tasting came out with about 5 different cheeses along with some crackers and a jelly. Of course the cheese plate was delicious! Like I said, for entrees we were all torn between a few dishes. I ended up with the Mussels and truffle fries. It was a HUGE portion, I had no chance of finishing it. The flavor of the mussels were delicious and very fresh. The truffle fries were great as well, with the truffle being just subtle enough not to overwhelm. It came with what looked and tasted like a garlic aioli, but I didn't use it as it looked like mostly mayonnaise. The only other dish I tasted was my fiance's. He got the special which was a veal osso bucco a-top creamed corn and topped with bacon and a sauce. AMAZING! I hope they make it a menu staple! Other dishes ordered were the seafood boulibase (which was another special) and the fried catfish. Everyone loved their meals. For dessert we all split 2. We had bread pudding and what they described as a home-made ""Ho Ho."" Both were delicious. All in all, it was a great experience. We brought 4 bottles of wine and each bottle was opened before or as soon as a bottle was finished. They service was great, as the waiter and hostess were both very attentive. I would say this would be a great place for family, friends, or couples to get together!",0.9992,0.734,0.245,0.021,0.6648778998778999
