date,star,text,compound,neutral,positive,negative,subjectivity
2014-03-05,5.0,"OK WOW, Glenn's is my new favorite restaurant. I came here a few weeks ago with a big group (make a reservation) on a Saturday and had the most fantastic experience.  1. Great service - our waiter was attentive, friendly and very helpful. And no one rushed us, we had just the right amount of interaction and enjoyed a long and relaxing meal.  2. AMAZING FOOD -- the chalkboard menus on the walls are a little overwhelming at first, especially when you have never heard of half of the fish on the menu. That being said, our waiter was happy to help and answer questions and the dish I ended up with was absolutely amazing. We ordered a bunch of appetizers as well and were especially impressed with the crab cakes (all crab!), shrimp dip and mussels. Everything seemed reasonably priced given the nature of high-quality seafood, but you're probably looking at about $25 - $35 per person, which leads me to my next point... 3. BYOB -- I mean honestly, as if I could love this place anymore. Who cares if you're spending a bit more on your meal if you can BYO bottle of $5 wine??  Overall, this is my new go-to spot for dinner. Definitely worth a visit!",0.9933,0.758,0.234,0.008,0.5843122786304605
2014-03-05,5.0,"Why did I wait an entire year to come here?! After passing Glenn's Diner on a semi-daily basis for almost a year, we finally came out for a romantic dinner.  Based on the signs in the window, I had no idea what the atmosphere would be like (I'll admit, the restaurant concept is a little confusing).  We found the inside to be warm, cozy, and romantic. There were SO many things on the menu we wanted to try.  Everything we had was delicious, but the real star was the scallops!  The scallops were the best scallops, and possibly best sea food dish in general, that I have ever feasted on.  I immediately made plans to come back to order the scallops again, they were so good. I also thought the waiter was very friendly and knowledgable, with some tidbits as to what to ask when ordering scallops at a restaurant to ensure freshness. I loved Glenn's and can't wait to come back.",0.9911,0.762,0.229,0.009,0.5171052631578948
2014-03-03,5.0,"Stopped by on a Friday night for a bite with a friend, they were obviously swamped so we opted to sit at the bar instead of wait for a table, probably the best decision we made all night.   It was our first time coming here so we weren't really sure what to expect but we were pleasantly surprised by the wide variety of menu options.  So many incredible menu options I can't wait to come back and try more. Our server was a blast! He was super helpful in navigating the massive menu.  Also very friendly and made great conversation.   After a fairly lengthy debate my friend got the Cinnamon raisin french toast and I got the soup of the day and the mussels appetizer.  Both were beyond delicious!  The ""appetizer"" portion was massive and came with the yummiest garlic texas toast on top.  My friend's french toast was incredible as well!",0.9926,0.732,0.251,0.017,0.5994708994708995
2014-02-17,4.0,Good quality seafoods.  I have never had a bad meal here.  The price may be a tiny bit higher than other places but the quality of the seafoods is outstanding.,0.8546,0.719,0.281,0.0,0.5861111111111111
2014-02-17,4.0,"Glenn's diner is a great part of the Ravenswood neighborhood. It's a perfect destination for a date as well as for a group of people. Went on valentines day, brought our own bottle of wine (only $5 cork fee) and had a great dinner. Server I believer was Kyle was very knowledgeable and answered all questions I had. Great food, service and all made for a wonderful evening at Glenn's. the only complaint was the menu was too large and delicious to make a selection easily, going to have to make more than one trip!",0.9798,0.717,0.263,0.02,0.7508503401360545
2014-02-16,4.0,"Finally checked out this place after living in the area for years and it was worth the wait! Went for brunch and had an enjoyable experience. Staff was friendly and efficient, got seated right away at 11:00 on a Sunday (there was a small wait right after that but the table turnover was quick). Try the cheese grits, they were delish & I am a snob when it comes to grits! I guess the only complaint that I have is the place is on the tiny side and tables are very close together. Will definitely go back for dinner!",0.4635,0.82,0.114,0.066,0.4747252747252747
2014-02-05,3.0,"The food is good but this place is ridiculously small and it fills up fast. The staff sometimes awkwardly stands around but you only notice because the dining area is so tiny. They have cereals which is cute, but get an egg sandwich! Yumm!",-0.1739,0.761,0.113,0.126,0.7285714285714285
2014-01-22,5.0,Whoa!!!!!!!!! Best crab legs ever!!!! And all you can eat on Tuesdays???? I ate my weight in crab last night. Mussels were good. And the smoked salmon dip?? Oh my gosh.... I couldn't get enough. I am struggling with a food hangover as we speak but it was all worth it.  Staff took care of our 5 person party perfectly. Our waiter was seriously amazing (and of course I can't remember his name thanks to La Fin Du Monde and bottles of wine). Glenn's killed it. My boyfriend has been wanting to take me here for a year now and we finally got it and now we won't stop going back!!! 5 stars all around!!,0.9773,0.682,0.245,0.073,0.42424242424242425
2014-01-19,1.0,"You can't make up for a BAD restaurant with great service.  The food was expensive and boring, but the service was good.  Watch out!  You've been warned.",0.1963,0.607,0.185,0.208,0.7433333333333333
2013-12-31,3.0,We've gone here for lunch a few times and I always leave with sticker shock. Once paid 90 bucks for lunch for 3 of us. But the seafood selection is great and fresh and can't be beat. Place is casual and I love all of the Cereal on the wall for breakfast. I plan on hitting Glenns for breakfast one day.,0.8625,0.755,0.187,0.057,0.5633333333333334
2013-12-29,5.0,"This is definitely a great place to check out. The food, service and atmosphere are very enjoyable. I ordered the New Orleans scramble for brunch, and was very impressed. The flavor was delicious and the portions were quite large, definitely worth the 13 dollars!",0.9692,0.611,0.389,0.0,0.6447309833024119
2013-12-13,4.0,"I was craving fish and thought of Glenn's diner. I took myself and two new diners who hadn't previously been. Now, my sister's first thought was wow- good selection of dinner items on the blackboard, but rather expensive for a montrose avenue neighborhood place. So, I was hoping that the food would live up to the price.  All the dishes but one were still available. I had the cioppino, my sister the catfish and dad the grouper. All of these are fully loaded, generous portions of fish and the sides are very large as well - almost half a head of broccoli steamed and drenched in butter!  The side that was just OK was the shrimp stuffing on top of which the (perfectly fried) catfish laid on top of.  The shrimp was cooked well but the cornbread stuffing- Eh- just crusty and greasy.   A mash potato option underneath would have been just as well. These large dishes are calorie bombs- do not thing you are coming here to eat steamed fish with a side of air. NO- most of the fish dishes are made with rich ingredients and the portions plentiful.  We had no issue with service.  So as far as the price per plate goes, the servings and sides are generous, so at $18-25 Per plate, you pretty much get what you pay for.   Not a cheap meal - but a once in a while type treat.    My cioppino was insanely spicy- that should be made clear by all servers. Never had such a spicy cioppino, which is usually a dish with some kick. I don't have an issue with spicy, but the diners with me almost choked. Be warned!  All in all, I would say we had a great meal, a caloric one, but great. I would *almost* go so far as to say - no need to go to bob chinn's if you are looking for a fresh catch. Go here. Bob Chinn's has a more exhaustive menu so the comparison isn't totally fair - but fish to fish, dish to dish, I'd go here instead of trekking out to the suburbs to Bob Chinn's.",0.9938,0.777,0.168,0.056,0.5964599916212818
2013-12-11,4.0,"Holy cow, their side of broccoli is MASSIVE! And perfectly cooked. Delicious fish entrees, and the chowder was pretty good. Small, so reservations are probably a good idea. And anytime someone enters our exits, the outside air enters. Which in the winter means BRRRRR.  They have great desserts, sharing portions, though, especially since they are generous with entree and side portions.",0.9806,0.655,0.345,0.0,0.687878787878788
2013-12-11,1.0,"Today's lunch is the last straw in the rapid decline of Glenn's Diner. The prices have increased dramatically while the quality and preparation of the food has nose dived. The Manhattan clam chowder is still good. I should have ordered the larger bowl portion as my entree. My  selection was the spinach salad with a topping of shrimp. The shrimp was not fresh but a mealy concoction of Cajun spice. I barely touched the salad which was not appetizing  buried a very heavy dose of bacon bits, onions and stale mushy tomatoes. No more Glenn's Diner for me. It appears that I am not the only one because the place was empty during today.",-0.4554,0.912,0.031,0.057,0.5015151515151515
2013-12-08,4.0,"An interesting place, breakfast served all day, tons of fresh seafood, and killer half pound burger under ten bucks. My wife and I were drawn in from the street, it looked cozy and inviting and the fresh seafood features were scrawled on big chalk board looking side walls and on the front of the place so that you can't miss them. The other feature that catches the eye is the wall of cereal brand boxes behind the bar - kooky touch.  We were seated immediately although the hostess at first didn't seem sure whether we should be allowed to without a reservation.  The space is tight but like I said, it's a cozy place so you will be tight with your neighbors when it starts filling in. The beer and wine selection knew what it was doing and there were many good brands and styles to choose from, for example Breckinridge and Left hand milk stout.  We started with the coconut shrimp app and it was good. I noticed they had removed the tails for you.  We followed with half pound burgers with blue cheese crumbles. A SUPER messy and yummy burger that bodes well for a date burger so you can watch your date struggle to not look like a pig ;-) Instead of killing you with fries they give you a choice of potato pancakes, fresh fruit or coleslaw - nice touch.  The service was prompt and friendly and they kept the water glasses full and the table cleared of empty dishes.  We need to come back for both breakfast and to dig deeper into the seafood dishes.  Within a stones throw of the Montrose CTA stop/brown line.",0.9888,0.762,0.18,0.058,0.45581554460864804
2013-12-04,1.0,"Went for dinner last night and was completely dissatisfied.  My boyfriend, who routinely makes ribs, ordered what the menu described as a ""Full Slab of Ribs.""  We were charged $23.99 for 8 ribs, garlic bread, one corn on the cob and a little bowl of mushy coleslaw.  The waiter was pretty useless since he never came back to check on us after someone from the kitchen delivered our food.  When the waiter finally came to present us with the bill, we asked about the ribs and he explained that was a full slab of baby back ribs. 8 ribs is a full slab?Not even close.  We disagreed with him and he said that he would go get the manager.  A full 7 minutes later the waiter, not the manager, came back and said all they could do was prepare us another half slab of ribs.  If the waiter would have just once checked on us while we were eating we would have asked about it earlier.  This place is a rip off and should be embarrassed by the poor service and the misrepresentations they make on their menu.  Judging by other people's reviews, we are not the only people who were disappointed.  Although I have been there a few times in the past, unfortunately last night was my last.",-0.9402,0.892,0.014,0.094,0.3696666666666666
2013-12-03,4.0,"Overall everything was pretty good, decent portions, price was good considering that all seafood off a coast is pretty expensive.  Only reason they lose a star is because the waiter did not seem interested in our table. thankfully the busser was picking up the slack, wish we had him as our waiter",0.9143,0.65,0.274,0.077,0.674074074074074
2013-11-27,2.0,"Overpriced for what you get! The burger was pretty good but that's hard to mess up I think. I was expecting it to be much better and it was definitely a let down. $9.99 for 1 small crab cake...really? The pasta dish I got was $20 for some shrimp, scallops, and vodka sauce. The pasta was clumped together, like it had been sitting out and drying for a while...it was bland and only had 4 shrimp in it. For $20 a dish I could have gotten a much better dinner somewhere else. I guess this place used to be better when the old owner was still in control.",0.9574,0.762,0.196,0.042,0.5414529914529914
2013-11-22,5.0,Umm where do I begin.... FAN-Bleep'n- TASTIC!!!!  All I need in my life is the clam chowder and a bottle (barrel) of wine (red) and I will be set!  Also the shrimp and grits are the tits!,-0.471,0.913,0.0,0.087,0.0
2013-11-21,5.0,"This cute little gem is stuffed into a little storefront near the Montrose brown line. Remarkable seafood! The clam chowder is chunky with little bits of bacon. I had the Arctic Char, a thick but flaky, light ocean fish topped with 4 medium shrimp in a spicy diablo sauce, accompanied by delicious buttery new potatoes and a generous serving of broccoli. She had the Bacon Wrapped Sea Scallops, tender and tasty with the same sides. It was SOOOOO good. I have also had the Jambalaya which was incredible. They were crowded on a Wednesday for dinner. Get there before the rush.",0.958,0.831,0.169,0.0,0.608041958041958
2013-11-18,1.0,"Glenn's has gone way downhill since 'Glenn' left.  The other day I went for lunch and we ordered a burger, and asked if we could get a side of fruit instead of potatoes.  The waiter asked if we wanted to upcharge a bit to the big fruit side to share, and we said sure! The large side of fruit was $4.99 on the menu.  Seeing that we were subbing this for fries we would assume that the cost would be less than $4.99. Our bill comes and we were charged $6.99 for the fruit. WTF?  I asked about this and got a half-assed response, ""Uhhhhh I guess the price changed and they didn't update the menu... I think?"" If it was full price, it's full price (although for a sub it SHOULD be less). But to flat-out overcharge from the menu price? Not Cool. I asked them to fix it, and get this... no one there (including the manager) knew how to give me a refund on my card.  Couldn't just hand me the $2-3 dollars or whatever either. They said that they would fix it and give me a refund on my card when the guy came in who knew how to do it.  Big Surprise.... never happened. Goodbye, Glenn's.",-0.7346,0.911,0.032,0.057,0.3979828042328042
2013-11-17,5.0,"Went here on a stormy Sundag with my beautiful wife. She ordered the Crab Benedict, I pulled a New orleans scramble. The food was absolutly scrumptious. The crab was so tender amd succulent it felt like a souffle of ejaculate in my mouth. The potato pankake was the best ive ever had and thats comming from a jew (im Jewish). We know our latkes. The bloody mary was amazing and I hate bloody marys especially since my wifes name is mary and I deal w enough bloody marys ad it is...if u know what I mean!",0.75,0.718,0.166,0.116,0.703503787878788
2013-11-14,3.0,"I love that they have such a huge offering of fresh seafood, nearly all of which is wild-caught.  I am sad that the two times I've been here, the meals have been somewhat on the bland side, and the fish was overcooked.   Last night I had a Corvina with a poblano pepper sauce, which had zero kick!  I know they can't always control the spiciness of the peppers they get, but they could have adjusted this with onions and garlic and perhaps even another type of pepper.  Not to mention that my filet had a tough bottom side that my knife could barely cut through! I understand the prices they have set for the sustainability aspect, but they need put more care into the cooking and presentation to support the somewhat high prices. I did find it weird that when I walked into a COMPLETELY empty restaurant and said I needed a table for 3, as I was meeting my parents, the hostess asked me if they were there, (no, duh!) and asked me how long before they arrived.  I think she was this close to having me wait on the side if they were going to be longer than 5 minutes! Fortunately, our server and the busboys made up for that awkwardness by being very sweet, patient, and attentive with my indecisive parents.",0.7541,0.843,0.086,0.071,0.6167543859649123
2013-11-13,1.0,"I was really excited to dine at Glenns last night. Three of us went at 8:30 last night, and sat at a table that faced the chalkboard with the long detailed list of ""fresh"" fish. The waiter kept going on and on how everything is so amazing, so hard to make a decision etc.  We thought we might get the crab, because Tuesday is all you can eat crab; however, it cost $54. Umh excuse me? For all you can eat crab? No thanks. We started with the calamari which looked like mozzarella sticks and tasted nothing like calamari. Like please dont insult my intelligence, I know that's not calamari. We tried the chowder with bacon, and it was mediocre at best, and Im being generous. On to the main event. We order lobster fettuccine, perch and scallops. The lobster fettuccine was terrible. Lobster was rubbery, sauce was awful, definitely not homemade. The perch was worse, tasted somewhat fishy, and was served with broccoli which was not cooked nearly enough, and potatoes which looked like they had been sitting at Glenns for awhile. Scallops were eh.  It was one of the worst meals I have ever had. I guess since the new owners they have not put in any effort in the food, claimed its fresh when it's not and jacked up the prices. Beware of Glenns and Stay far far away. You're better off getting fish stix from the freezer section.",0.949,0.774,0.145,0.081,0.5797032828282828
2013-11-13,5.0,"Went there for the first time around 6:30pm on a Friday and had a great experience.  We were seated right away and the beer list is great.  I had the whitefish with creamy dill sauce--it came with potatoes and broccoli, and everything was delicious!!  My boyfriend isn't a huge seafood fan, but there were plenty of other options for him on the menu.  He went with a chicken sandwich on Texas toast and really enjoyed it.  We will definitely be back!",0.9413,0.778,0.189,0.033,0.6294047619047619
2013-11-12,4.0,"I've been here a couple times recently and I love the Lobster fettuccine. It's rich and creamy with big chunks of lobster mixed in.  It's a little pricey, but I guess that comes with not living near either ocean and going to a Seafood place.   They keep two large chalkboards on either side of the restaurant up to date with their fresh menu items.",0.6757,0.895,0.105,0.0,0.41984126984126985
2013-11-11,5.0,Absolutely excellent food and service. Not very many seafood places that are this good! I love that Glenn's diner is small intimate yet casual. I always feel like I'm on the coast eating this delicious food! Can't say enough good things about Glenn's diner. I had the lobster salad it was absolutely to die for!!,0.9666,0.603,0.34,0.057,0.6773892773892775
2013-11-10,5.0,OMG do I love this place! I'm so lucky to be in an area with so many great places to chow down! This one is one of the best. Serving breakfast all day long. The staff is amazing. I have never met so many happy employees- it's such a pleasure to dine there. I've ordered everything basically- but I must say.. THE BLT is god's gift to this planet. In fact I've awakened in the middle of the night thinking of it! If you are in the area... do yourself a favor. Check them out.,0.9742,0.759,0.241,0.0,0.5476851851851852
2013-11-09,1.0,"My husband and I heard about this restaurant from a colleague. My husband is a Medical Doctor and am a CPA. We love to try new restaurants and are always willing to make a trip for a great restaurant. That being said, it took us about an hour to get there due to rush hour traffic and construction. We made it just in time for our reservation.  They have a large fish menu which made us both happy so we decided to order 4 or 5 dishes for take out after dinner...sounded like a great idea we thought...  We ordered the All You Can Eat Crab Legs. WELL WHAT A BIG SCAM!!!!!! Get this everyone...you do not get a crab cracker you get a small fork.  They continually push the sides and want you to keep eating them.  The plate finally comes and has the sides and TWO....THAT'S RIGHT 2...CRAB LEGS. We were ok with that except that when you ask for more THEY GIVE YOU ONE...1...LEG AT A TIME AND THEN YOU HAVE TO WAIT FOR SOME GUY TO BRING IT WHO IS NOT YOUR WAITER. HE JUST WALKS AROUND GIVING ONE CRAB LEG AT A TIME. Anyway, the wait between getting another crab leg was an average of 15 minutes. So here is what happened, once we were served our FIFTH...5th....CRAB LEG WHICH BY THEN WE HAD DECIDED WAS OUR LAST, AN OLDER MAN CAME OVER TO OUR TABLE.  I DO NOT KNOW IF HE IS THE OWNER OR THE MANAGER. HE HAD THE NERVE TO TELL US TO ""MOVE ALONG"" IN THOSE EXACT WORDS. IT WAS CLEAR THAT HE DID NOT WANT US TO EAT ANYMORE.  ""MOVE ALONG""...ARE YOU KIDDING ME.  WE WERE NOT NOISY DURING THE EVENING AND ONLY HAD SOFT DRINKS AS WE BOTH HAD TO WORK THE NEXT DAY. HOW INSULTING IS THAT???  I have been to so many upscale restaurants not only in Chicago (as we live here) but in New York and Miami (where we have a condo). We inquired if there was a problem. He stated that we have been there an hour and a half (because it talks 15 minutes each time you want another crab leg) and that a lot of people are waiting for tables.  When he walked away we looked around. There were three empty tables and NO ONE WAS WAITING.  I have made it a point to tell all of my friends and colleagues about this place.  DO NOT GO HERE. THEY DO NOT DESERVE OR APPRECIATE YOUR BUSINESS. THERE ARE SO MANY RESTAURANTS IN CHICAGO THAT KNOW HOW TO TREAT PEOPLE.  I DO NOT WANT ANY OF YOU OR ANYONE THAT I KNOW TO EXPERIENCE THIS. Too Bad Glenn's. I am sure that our Take Out order alone would have totaled over $200. You have lost our business, all of the Medical Doctors(husband on staff ay 9 hospitals), Lawyers (at least 75), CPA's (innumerable) and any other people that we know.  Thousands and thousands and thousands of dollars of business LOST FOREVER...and that is what you deserve for treating hardworking people so horribly as I am sure that we are not the only one's that have experienced this RUDE, IGNORANT BEHAVIOR.  WHAT A SCAM. SHAME ON YOU GLENN'S!",-0.9682,0.822,0.081,0.098,0.5316955266955267
2013-11-09,2.0,"For some reason this place has a full menu of cereal. In retrospect that's what I should have ordered. My lobster roll was soggy and the potato pancake was so heavy that I could not even eat it. What I enjoyed most was the pickle on the side.  This place earned is second star because the clam chowder I ordered was pretty decent.  All in all, you are better off buying yourself a box of fruit loops and staying home and watching tv.",0.8555,0.887,0.113,0.0,0.5520833333333333
2013-10-27,5.0,"There is absolutely no hesitation in writing this:  this is THE best restaurant food I have ever eaten in my entire life.  And this chick has traveled the world and eaten some pretty damn amazing things.  Sunday brunch here is where it's at...the Mimosa is served with a small bit of Triple Sec in the bottom of the glass with a mini bottle of Korbel and a glass of fresh OJ.  You are your own bartender... The Crab cake Benedict called my name...fresh lump crabmeat, English muffin, perfectly poached egg, rich hollandaise, and a chive potato pancake on the side.  I don't know how many times I muttered, ""This is so stupidly good.""  Rich, rich, rich food.  My girlfriend ordered the Salmon Scramble...yep, 4 eggs, fresh salmon, Boursin cheese, caramelized onions, fresh dill.  f'in great.  Of course we were complete pigs at the trough and got a sidecar of Smoked Mac and cheese.  Yummo.  Service here is a bit on the ""eat and get out"" side which kinda bugs.  The blackboards showcase the menu which is heavily seafood.  Seriously, you cannot go wrong here.  And enjoy the nostalgia of the cereal boxes and cereal bar.",0.9879,0.735,0.207,0.058,0.6416666666666666
