date,star,text,compound,neutral,positive,negative,subjectivity
2009-12-03,4.0,"Glenn, Glenn, Glenn. I bookmarked you a year ago and didn't make it there until today? Maybe I was waiting for the Triple-D love to wear off. Glenn's Diner made me sad that I only have one stomach. It's a big one, but only one. And there were at least three things I wanted to try, without even opening the menu. And that's not counting the Bananas Foster French Toast, which is only available on weekends. Jambalaya? Sure! Lobster roll? Why not? Fried catfish with French onion soup? Sounds good to me! Somehow, I ended up with the Russian Rueben, which comes with Russian dressing and coleslaw in place of the Thousand Island and sauerkraut. An odd choice in a place famous for its fish, perhaps, but a hearty and satisfying sandwich. The only disappointment is that it came with only one of their sour cream laden potato pancakes. I need at least three of those to stop my heart. Our server was sweet as hell, and did a great job of talking us through our choices. My friend and I ate ""light"" -- she had the chicken salad melt -- in order to save room for the warm chocolate brownie pie with vanilla ice cream. It's exactly what it sounds like. Only maybe better. Glenn's is a funky little neighborhood spot that just happens to serve a surprisingly upscale menu. I'm kind of glad I don't live in the neighborhood, because I would have gone broke here long ago. But it's right off the Brown Line, which is a straight shot down from work, so I foresee quite a few lunches here in my future.",0.9825,0.758,0.165,0.077,0.5558168795973673
2009-12-02,4.0,"Awesome!! I have only eaten here for brunch, had the trout hash. I will definitely be back for dinner.  If all goes well, i'll bump it up to a 5.",0.8585,0.717,0.283,0.0,0.6666666666666666
2009-12-02,5.0,"Went her for dinner again with the fam...and it was just as delicious as I remember. Some of the party didn't get the AYCE and ordered off the menu. The Hubs has the sturgeon and he said it was awesome and cooked perfectly. My Mom had the shrimp po boy with and said it was a little too dry. I am thinking next time I go I have to order off the menu too...that just means I have to go any day but Tuesday.  Oh, also, they gave my niece some Cheerios, and Brian is the best server. I love this place.",0.962,0.791,0.188,0.021,0.6249999999999999
2009-11-30,4.0,"The second-best fish I've ever had!  If you're feeling fishy, definitely make your reservation here. The only thing that's not to like about this place is they don't support sustainable fishing.",-0.1179,0.753,0.117,0.13,0.75
2009-11-28,5.0,"I really liked this place. Yes, it's a little pricey for the seafood... But it's seafood. And well cooked. I had the scottish salmon and it was lovely. The veggies and potato pancake that came with it were also amazing. I really liked the feel of the restaurant and the staff was incredibly friendly. I'll be back!",0.9697,0.673,0.327,0.0,0.6071428571428571
2009-11-25,1.0,"Horrific Experience.  First time there but we were with a couple who are regulars to this place.  There were nine of us.  Three of us ordered the all you can eat crab legs.  When we were finished I had two legs left on my plate, I asked to take them home and they said NO!  OK., I guess some people might take advantage of the all you can eat...  Rather than have them go to waste, I spent 10 minutes getting the meat out of these legs.  When I was done I passed the plate to one of my friends to try.  OMG, the female (waitress, manager, Hitler)  RAN over to my friend and grabbed the plate away from him and said ""NO SHARING"".  It was so humiliating.   All nine people at the table had ordered and eaten an entree.  We weren't trying to get away with anything.  They would rather toss an entire plate of crab meat than let someone else at the table eat it.  I WILL NEVER STEP FOOT IN GLENN'S DINER AGAIN.   This was the rudest behavior I've ever experienced at a restaurant.  Come on Lady, apply a little common sense.  Because of your rudeness, you lost customers and they have nothing nice to say about their experience.  That's just bad business.  Probably the same lady that Jenny z. is talking about.",-0.9799,0.809,0.044,0.147,0.45833333333333337
2009-11-20,5.0,Crab legs are really good (Tues all you can eat).  Hopefully will get a chance to sample the fish and brunch soon!,0.8012,0.687,0.313,0.0,0.6000000000000001
2009-11-12,5.0,"Glenn's is phenomenal. The staff is friendly and knowledgeable.  The food is incredible.  I would highly recommend the shrimp cocktail, french onion soup, scallop appetizer, scallop entree, apple jacks tilapia and fried perch.  I don't think you can go wrong with anything here.  It is an original concept with incredible execution.  The only thing is that is gets VERY busy, so call ahead and make a reservation.",0.6361,0.84,0.116,0.043,0.638
2009-11-09,5.0,"DEEE-LICIOUS!  Went for Brunch on Sunday and was afraid there would be a line - so I showed up by 9:20 (they open at 9am) and there was NO WAIT!   Excellent and unique tasting Bloody Mary - more sweet than savory and with a giant skewer of cocktail shrimp!   LOVED LOVED LOVED my Louisana Omelette - would you like some eggs with your shrimp?  My whole plate was full of succulent spicy shrimp!  My next visit will entail trying out their crab cake eggs benedict.  From a distance, I could see that the crab cake was the size of a hockey puck!  My mouth is watering just thinking about it. Too bad this place isn't closer to me. I'd be there for breakfast lunch and dinner. Worth the trek to Montrose/Damen!",0.9591,0.758,0.179,0.063,0.6604166666666668
2009-11-03,5.0,"He calls it a ""diner"" but it seems to me more like a cute little kitschy restaurant.  The fish dishes are to die for and prices are so reasonable!  Highly recommended!!!",0.7882,0.586,0.289,0.125,0.628
2009-10-21,5.0,"We returned last night with another couple for their all you can eat Alaskan King Crab Legs (for $33.95 per person).   I was slightly worried that we'd be getting some imitation crab meat or some tiny skinny foul smelling crab legs for a deal this good to be true.   And for the first time in my food lovin life I was wrong! They start you off with 1.5 pounds of legs. Along with coleslaw and parmasean corn on the cobb. Oh, and don't forget the butter!!!  And boiled potatoes by request!!!  They def don't stiff you on the portions here!  My advice- wear yer stretchy pants and leave any confining clothing (such as belts) at home.  My table had a crab eatin throw down. The guys thought they could out-eat the girls. How wrong they were! Not only did the girls match the guys leg for leg, but us gals also indulged in dessert.  The crab legs were huge and succulant.  Well worth the 5 battle wounds I now sport on my fingers due to the mechanics of getting that tender meat out of the shell.  Ah well, it builds character! They just keep the legs a comin.  Need extra butter?  Just ask!  Want some more corn on the cobb?  Right up! We ate so much that we actually got sick of crab! The boys ate so much that their bellys hurt! You MUST come on in for all you can eat night!  This place is never ever a miss.  It's a homerun every time! If you haven't been, you are truely doing  yourself a disservice! TIP: Call a week in advance for reservations for this All You Can Eat night.  The reservations book up quickly (as we found out 2 weeks ago when we called day of and couldn't snag a table).  They are BYOB so hit up the liquor store next door and save a few bucks!",0.4517,0.87,0.073,0.058,0.426793062904174
2009-10-21,5.0,"Coming from the northwest, I have been slightly disappointed with the seafood in Chicago.  A friend of mine turned me on to Glens.  We happened to be there for all you can eat king crab legs.  They do all you can eat one day a week.  The food was fantastic as well as the service.  I ate crab until my stomach hurt and I hope to do it again.  I took my mother there when she visited Chicago and she said the crab was some of the best she has ever eaten.  I had trout on my second return and it was so good!!",0.9339,0.77,0.176,0.054,0.51
2009-10-12,3.0,"This place was a little gem we just found recently... what a great and cozy place.  We went for a late dinner on a weeknight and it was great.  The service was spot on -- the waiter made recommendations, told us about special dishes, etc.  And, the food was really good for being called ""glenn's diner""... we weren't expecting all of the seafood.   the crab cakes were great, mac and cheese was really rich, but tasty.  I'm a little torn on the potato pancakes... just a bit too rich in my opinion.  But, all in all, great food at pretty reasonable prices.  We'll be back!",0.981,0.737,0.245,0.017,0.6169642857142857
2009-10-03,5.0,"Glenn's has to be one of the best restaurants for seafood in the city of Chicago in my opinion. Located right next to the Brownline, Glenn is a favorite of mine when getting off work on Monday nights. They have this fantastic special where most of their sea food and fish dishes are only $14.00.  I think I'm addicted to their creamy potato pancakes-yum yum.  The restaurant itself has both outdoor and indoor seating. Tables are in the square, so seat a party of four very comfortably. While you're waiting for your food, take a peek near the wall in the back for the day's triva question. Answer correctly and you can get a free bowl soup. Of course, I've never answered correctly.   I also am impressed with the neighborhood flavor of this casual restaurant. A lot of the visitors are Ravenswood and Lakeview locals, who enjoy the casual and laid back experience of dining at Glenns. Truth be told, I'm also facinated by the umpteen number of cereal boxes from yester year on the shelf near the kitchen.   Anyhow, if you are looking for some really great sea food at an affordable price, I think this is your best bet.",0.9923,0.795,0.205,0.0,0.5852607709750568
2009-10-02,4.0,Ever since they were on TV...this place is IMPOSSIBLE to get a table.  So I get takeout now... Awesome variety of fish dishes...and crab cakes are awesome.  They have an outdoor area during the warmer months...but get there early. Oh...and don't forget the black and blue sirloin steak...WOW!,0.9073,0.773,0.227,0.0,0.638888888888889
2009-10-01,4.0,"My boyfriend and I were going out on a date and chose Glenn's because a seafood lover in my office recommended it.  Our reservations were for 7:30, it was about 7:20 and we were still at my house as I finally decided on what I should wear...typical.  We walked as fast as we could without losing our breath to the el and got on the brown line north to the Montrose stop.  My date was freaking out because A. he hates being late and B. Glenn's told him they would give away our table if we were more than 15 minutes late.  It was now 7:35, five minutes late already and still at least a 10 minute ride left on the el.  Then my boyfriend's phone rang.  It was Glenn's calling to make sure we were still coming to dinner.  The first generous guesture of the night to make me feel like Glenn's is a nop notch place. We arrived at the restaurant at 7:45 and a nice table for two was waiting for us.  The ambiance of the restaurant was friendly, homey and casual - exactly the kind of place I like.  The waiter immediately brought over a carafe full of ice for our 2 bottles and started our night off right.  We ordered the mussels for an appetizer, since I'm pretty sure one of my boyfriend's favorite things to eat is bread soaked in the mussel juice.  The mussels were great and there were more than enough for the two of us.  For the main course, we asked the waiter for his recommendations and he gave three: the sturgeon, the sea bass, and the halibut.  I ordered the sea bass and he ordered the sturgeon.  The sea bass was cooked perfectly and the sturgeon was in a really rich sweet tasting glaze, which I really enjoyed but my boyfriend could have done without.  For dessert we had the maple pecan pie which was really sweet and delicious, hats off to the local bakery who made it. When the check came I was pleasantly surprised that the corking fee was only $5 for the two bottles of two buck chuck we brought with us.  However, I noticed that my sea bass cost was higher on the bill than what was on the chalk board.  Honestly, most people would've let it go because if I tell you the price difference you would smack me for being the cheapest person alive, but after about a bottle of wine, I wanted justice.  I asked the waiter about the mix up in the nicest, most innocent manner possible and without a missing beat, he took the bill away, had it corrected and brought it back with his most sincerest apology. So, all in all, Glenn's has the food of a fine dining restaurant, the prices of an upper scale chain, and the atomosphere of your mom's kitchen - all three in one make a fine restaurant.  I'll definitely be back.",0.997,0.828,0.162,0.01,0.5779365079365079
2009-09-30,4.0,"This place is a great bizarro world.   They seem to serve a great breakfast and brunch and really focus on homey diner food.   On the other hand they serve the quality and preparation of fish and seafood that you would find in a swanky place.    We had the catfish, clam chowder, potato pancake and salads.   All were really good and incredibly reasonable.    I loved the cereal bar but even with the 25 cereals they had, I would have liked some wow.....Boo Berry, Quisp, Count Chocula, something different.    These were all very run of the mill and at 4.50 a bowl....hmmmm, I will stay home for cereal but I will be back for the fish",0.9272,0.865,0.135,0.0,0.5249999999999999
2009-09-29,3.0,"Last Friday my date and I were running fifteen minutes late for our reservation.  This made me nervous because when I originally arranged the table they told me it would be given away if we were more than fifteen minutes tardy for our party.  The host called and I told him we were on the ""L"" and wouldn't be long.  The place is right next to the Montrose brown line stop.  When we arrived we were seated right away in the stage left corner one row away from the window.  Seating was small and cramped, but that's what I expected so I wasn't bummed. The waiter pounced on our table right away and opened our wine for us.  We brought a couple bottles of white in anticipation of fish.  I was impressed they allow byob for a $5 corking fee considering they also serve a full bar. We ordered the mussel appetizer.  It came with Texas toast to sop up the white wine buttery bottom of the bowl goodness.  The mussels were covered in melted parmesan.  They tasted pretty good, but I noticed about ten of them were still sealed shut.  There were probably 35 in the bowl, but still not an awesome ratio.  I think the Paramount Room's mussels were better than these. For my entree I went with Sturgeon in a cream mushroom sherry sauce.  I was psyched for the sturgeon because I'd never had it and my little brother and dad had both caught six foot long monsters on a sturgeon fishing trip on the Snake River they didn't invite me to; motherfuckers.  My lady friend went with Sea Bass in a garlic butter sauce.  I definitely planned on some bites of that. The sturgeon came on a plate with asparagus and redskin potatoes.  The cream sherry sauce was a bit heavy, but so were all the sauce options on the blackboard menu.  The sturgeon wasn't as fluffy and perfect as ladyfriend's sea bass so that slightly bummed me out.   For dessert we split the maple pecan pie with a scoop of ice cream.  The pie company that made it did a great job, however it doesn't touch my Mom's sweet potato pecan pie with kahlua whipped cream. I can't see giving pretty good more than three stars.  The main dish was $22.  It was east coast American old school seafood, pretty good but I like that Asian fusion shit that isn't going to nail me to my chair for the rest of the night.  I'll be back to test out a lobster roll for lunch.",0.9954,0.814,0.15,0.036,0.471483942414175
2009-09-28,1.0,"We have gone to Glen's quite a few times for brunch, and have really liked it.  However, due to the experience we had on Sunday morning, I will absolutely never go again.  We got to the diner a few minutes early, as we were meeting 2 friends.  There were 4 available tables outside, and about 9 available tables inside.  The Host, asked how long our party would be, and we said a few minutes, as we knew they were on their way.  He then informed us that it is their policy to not sit tables until all the guests had arrived.  I understand this policy in a packed restaurant, but literally, the restaurant was not even at half compactly.  So, I asked the Host, why we could not sit, considering their were open tables everywhere, and 4 waiters standing around with nothing to do.  He said that is the policy, because they have had instances where people sit waiting for friends for far too long.  So, we stood in the doorway, (mind you there is no space in this place), and the snippy host did not suggest us waiting outside or anywhere else, so we stood right in the doorway and waited.  After 10 minutes of being completely in the way, I said to him.  ""Is it really a problem if we just sit down? We are in the way here, and we would be happy to even order now, and not wait for our friends.""  He's reply was so rude, saying ""this is our policy, you have already been waiting for your friends for 10 minutes!"", his voice raised.   My husband actually walked out, because he was so upset that someone was speaking to us like that.  (also again I remind you the restaurant was SLOW at this point..the host was not under pressure) However, I am not one to give up easily.  So, I pressed on, asking how us sitting and ordering would be detrimental to the restaurant at all.  I also asked if it was his restaurant, because it that was my restaurant and I heard an employee speaking to my customers in that way I would take a hard look at the types of people I was employing.  Between my speaking with the host and my husband walking out, one of the waiters who I have seen their before, asked what was going on.  He said, he was sorry, we will get sat right away, but that the host was following policy.  I get policies like that, but sometimes common  sense needs to come into play.  Or common courtesy.  Also, if there really was no bending the policy, would it has been that difficult to say, ""I can't sit you at a table, but you can wait at the counter?""  This place is a joke.  Aside from the waiter who actually let common sense prevail, everyone in the place acts like an idiot.  I would think it would not take a genius to understand, you want to fill your restaurant, not have people walk out.  I have never been treated so rudely at a restaurant, especially one where breakfast averages at $14 per person.  Needless to say I will never go back and advise anyone who will listen to never go back!  Overrated and full of rude employees!",-0.5649,0.854,0.076,0.071,0.4634182355112589
2009-09-26,4.0,"After an 11 mile run, there is nothing so welcome as the friendly waitstaff at Glenn's, who made sure we were seated immediately (runners always appreciate that because we're HUNGRY!). Coffee was promptly served and we were never made to wait for a cup. I've been here once before and they have delish French toast. However, I needed a protein boost and opted for Classic Eggs Benedict, which come with Canadian bacon and a potato pancake. They were lovely - not as good as Bongo Room's but very nice. The potato pancake was cheesy, which I didn't expect but good.  Aside from really good food, I really like the great service I've received both times and the atmosphere,which is very inviting - love the cereal boxes on the wall and the HUGE chalkboard with all the specials and the coffee canisters on the table, which they use for salt, pepper, hot sauce, creamer, etc.   Cool spot, very good food, great service.",0.9887,0.693,0.24,0.067,0.6392777777777777
2009-09-23,5.0,"Glenn's has three things that are music to my ears:  1. excellent brunch (served all day!) 2. fresh fish 3. BYO option I LOVE Glenn's hash browns!  The potatoes are crispy and there is a delicious tangy creaminess going on.  The pecan pancakes are from heaven.  Omelets and corned beef hash/eggs... yum! yum! You can tell that Glenn's background is in seafood.  The fish selections are always really fresh and prepared in a flavorful, but simple way.  I have yet to have anything that I did not enjoy. I also appreciate that they have a good wine and beer list, yet still allow you to bring your own with a minimal corkage fee.  Sometimes, you are just in the mood for something specific. The real reason I am giving Glenn's the fifth star though is the service.  No matter how busy it gets, you get attention and a smile.  Glenn will often walk around to check on you himself.  Quick story... Every year, my friend and I share our birthday party.  This year, I had just moved to Minneapolis and came back last-minute.  We could not miss our traditional Hoosier Mama pie though!  I called HM directly, but that was delivery day and they were closed for sales.  So, I called Glenn's.  They not only sold me a whole pie, they trusted me with one of their own pie pans.  It is things like that which make a place really stand out with me.   Yes, there can be a wait for brunch, but you can kind of figure out the traffic patterns if you go a few times.  They are also pretty good at estimating wait times if you call ahead to ask.",0.9935,0.775,0.196,0.029,0.5345238095238094
2009-09-20,4.0,"I love Glenn's. I've been coming here the past year and a half because of their selection of food and mostly because of the all you can eat king crab legs! It really is a nice, casual and cozy place near the brownline Montrose stop and parking isn't ever really an issue. I usually come on Tuesdays for the all you can eat crab legs. They are usually quick with filling you your plate once you are almost done and it comes with corn, coleslaw and potatoes. Come hungry! The crab legs are sweet and meaty. I have tried their porkchops which was really tasty, however I just discovered today that they took it off the menu. I also have tried the ribs which are tender and good. I have also tried the new york strip sandwich and one of the fish dishes which I enjoyed. The only reason why I'm giving them 4 stars is because it is a small place and tends to get crowded. Sometimes they take reservations, sometimes they don't. The service is always really good too! They really should think of opening another location or expanding.",0.9702,0.864,0.125,0.011,0.5143939393939394
2009-09-18,4.0,"I've been here 3 times now and I've enjoyed myself every time.  One of my favorite dishes is the Arctic Char in Diablo sauce.  The sauce is spicy and has chucks of shrimp in it, really really good.  I've gotten the Jerk Marlin and that in itself was good but the pina colada sauce was a bit too sweet for my taste.  It was good every other bite but the fish was quite enjoyable on it's own.  I always leave stuffed but yet I still make room for Margie's across the street.  Service here is okay, not over the top but could be a little more attentive, but whatev.",0.9642,0.763,0.197,0.04,0.6446428571428572
2009-09-16,2.0,"Service- We had conflicting info on whether we could make reservations or not. Before we couldn't now we can... maybe? Four to our party 2 arrived at 6PM  were not allowed to be seated unless everyone in party is present fine if its busy, but more than half the restaurant had open seating. No hostess yet, just waiter who said we will reserve your table until next 2 arrive. When the two arrived at 6:03PM, hostess was clueless, and seemed frazzled like was her first day and had masses of people coming at her. She said all tables are reserved, how about the bar? Some open, but even bar reserved. WHO RESERVES BAR SPACE!!? Luckily we talked to same waiter as earlier and he straightened every thing out. Our server was good Food- Ordered  1.pretzeled walleye 5 stars (Great) 2. Mushroom soup 2 stars 3. Clam chowder 4 stars (nice smokey flavor 4. Mussels 2 stars (had better sauce) 5.Shrimp po boy (heaven on seven does better) 6. Shrimp Ceasar salad (shrimp good, but not enough) 3 stars Conclusion 2 Stars for now because did not live up to hype of other reviews for food, it was just ok. Would go back because of other good reviews for second chance, but would try 11- 6PM specials, for more inexpensive dinners and just order their fresh catch fish dinners only. Also only decent seafood I know in this area.",0.9744,0.809,0.143,0.049,0.475
