date,star,text,compound,neutral,positive,negative,subjectivity
2011-08-31,2.0,"My review pertains to the Tuesday night special for all you can eat Alaskan King Crab legs. I feel bad in a way giving it just 2 stars but I felt a more accurate review of this long standing special should reflect the quality of the food - and I'd say ""Meh - I've Experienced Better"" is accurate.   Market price for the crab dinner that night was around $47 and the quality was just so so. I threw away a few pieces of meat because they were like rubber.  I could buy crab like this at CostCo and steam it up myself at home for far less and it would taste better I think. Or, I could go to the Half Shell and get a pound for like $35 or so - and I've never had a bad meal there. (Their service is another story). Granted, we ate about 1.33 lbs apiece, so we got more for our money..... but not by much. On the flip side, they do reservations and we were sat promptly for ours. The service was friendly. The place has a nice neighborhood feel. The beer list was good and I had a nice glass of wine.  But if you're looking for a great crab dinner at a decent price, try the Half Shell. Or save up for Shaw's.",0.9928,0.752,0.214,0.034,0.5524801587301587
2011-08-25,5.0,"This place is a gem. I would like to think that it's a hidden gem, but with all of these reviews there is no way that this is hidden. The fish is where it's at with this place. Lobster rolls, seafood salad, various filet's of top quality fish! They have everything and it's all at a somewhat reasonable price. The two times I have been here the service was above average and they were kept my iced tea full. My only complaint was that the lobster roll was different than I expected, but it was still amazing (just different).",0.5916,0.854,0.092,0.054,0.5011904761904762
2011-08-24,5.0,"I am sad to say that we have left Chicago for Atlanta and that Glenn's Diner will be my most missed restaurant in Chicago.  My wife and I visited it twice, both times leaving extremely full and pleasantly happy.   Our first visit was for lunch. I ordered the Catfish Poboy.  Great bread, perfect amount of batter and the fish was fresh.  My wife ordered the Reuben sandwich and said it was very good.  We met the owner and the waiting staff was extremely attentive. Our second and last visit was for dinner and it was, in my opinion, the best seafood that we had in Chicago.  I had the Crustacean Pot Pie.  It was a pot pie with lumps of Blue Crab, shrimp, scallops and veggies.  Trust me when I say, these were huge lumps of everything. You could differentiate between each seafood in the pot pit.  I topped the pot pie off with a Dog Fish Head beer.  My wife had the scallop dish.  There were 12 scallops on her plate.  Perfectly pan seared, with carmelization on the outside but could cut through it with a plastic spoon.   Almost forgot, I ordered their clam chowder for an appetizer.  I would recommend it to anyone.   It is a little pricey but what do you expect?  The food portions were huge, fresh and perfectly cooked.  When I visit Chicago, it will be at the top of my list of restaurants to go back to.   Make reservations if going for dinner.",0.9832,0.826,0.149,0.024,0.5470833333333334
2011-08-22,5.0,"I feel in love with this place tonight.  I'm from California and visiting a bud here in Chi., and we choose this spot based on the fresh healthy fish offering mixed with a bit of Louisiana flair. (Warning!  I came hungry!) The Food Is Excellent!  We started  with the clam chowder, I believe the best I have ever had.  Then we got a healthy scoop of smoked trout dip for our crackers;  adding a little hot sauce to that, and BAM! you are in a smoked trout pudding Heaven.  Then came my Jambalaya , with incredible fresh shrimp, crawdads, and tasty succulent spicy sausage in a sweat and spicy sauce covering delicious skillet fried cornbread, did I mention CORNBREAD.                By this point I have entered a world where restaurants CAN take care you with incredible food, flavors and sizable portions.  As I wipe tears of joy away from my face I have to maneuver quickly to shovel more of those sweet & spicy jumbo shrimps in my mouth.  Mmmmm. The night was not over and I had to have a piece of Key Lime Pie.  Of course, IT WAS REAL,  and really awesome!",0.9926,0.767,0.224,0.009,0.6225
2011-08-18,4.0,"At this writing, Glenn's Diner has 538 reviews. Glenn probably doesn't need to hear my opinion, especially since I'm now one of many, many fans. This review is for breakfast items only. A friend wanted to meet for lunch here. Initially, I was reluctant, because I know Glenn specializes in seafood, and I think all fish, crustaceans, mollusks and the other assorted sea creatures are just as gross and disgusting dead as they are alive. HOWEVER . . . thanks to the wonders of the internet, I looked at the menu and saw that, even I, someone who is totally adverse to the denizens of the sea (this means you, too, seaweed snacks. EEeewwww!!), saw that I could easily find nourishment at this watery restaurant on Montrose Avenue. Friend and I visited on a weekday at almost exactly noontime. Friend, who is more weird than I care to admit, did NOT want to sit outside on that beautiful, sunny, pleasant day. (I need some new friends. . . ) I found her indoors. She told me she had recommended Glenn's because the eggs are so good. She ordered three eggs, and added blue cheese. I went with the 3 eggs with parmesan and green onion. Both come with a potato pancake, and your choice of bread. I chose raisin toast. I tasted her food in the process of inhaling mine. The eggs were delicious, and perfectly cooked. The potato pancake, I thought, was a nice touch; somebody in the kitchen must have gotten bored with the standard hash browns and searched out this acceptable substitute. The potato pancake had a creamy consistency; said friend told me that it was made with sour cream.  A young man (hey, you all are looking young to me these days) was our server, and he was efficient, prompt, and welcoming. He asked us both if we wanted butter on our bread; that was very good customer service.  I liked the atmosphere at Glenn's, too. I particularly admired some tapestries on the west wall, and asked about them. The server went to some trouble to get me information on them. All in all, I very much enjoyed my visit to Glenn's. I can think of nothing to criticize, except possibly my choice of dining companions. That woman really is a pill. (meaning - she's hard to swallow.) I sure wouldn't say that about anything at Glenn's.",0.9956,0.755,0.19,0.054,0.5630858585858586
2011-08-16,1.0,"I used to be a regular at Glenn's.  Every weekend, my girlfriend and I would go there for brunch.  The last several visits have been a big disappointment though.  After the reconfiguration, the seating became tight and uncomfortable.  Secondly the service went from being friendly to surly.  Finally the quality of the food and service has taken a huge nose dive! Three times I had made advanced reservations, for a moderate-sized group (six people) and two out of three times a table wasn't ready for us, in fact, we had to wait more than a half hour for our table!  On one such occasion, when we had an advanced reservation, there was an open table reserved for a same sized group behind us, yet they didn't make any adjustments to sit us and give the group behind us the table.  We were forced to wait for a full hour,  while those who had reservations behind us got seated ahead of us!  Then another time my girlfriend and I went there, and the service was so poor, the waitress never checked if we needed more coffee or water, or to see if the food was OK. We only got one cup of coffee, no extra water and the order was incomplete!  We decided not to go back for a while.  When we did, they had Mrs. Butterworth's on the table.  I asked the waitress if Glenn's had Maple Syrup, even for an additional charge (which I gladly would have paid).  She pointed at the bottle and said ""'dat's all we got.""  Well, DAT'S DA LAST TIME I EVAH GO DEAH! For the prices they charge, I could do better cooking for myself at home. Yeah I make it better too!",0.7845,0.855,0.087,0.058,0.45404815772462825
2011-08-15,4.0,"oh man, i LOVE this place.  blue star crab cake benedict, TO DIE FOR! gotta save up my money to go again, haha. but worth it!",0.7339,0.609,0.305,0.086,0.275
2011-08-15,3.0,"Glenn's Diner has a very large seafood selection. The prices do run a bit high, so I would recommend going for lunch. I would never be able to justify paying dinner prices for the food we got. Everything tasted good and I could live with paying a $60 tab for lunch for two but I wouldn't be able to justify what they charge for their dinner rate..... It's good but kind of a diner's version of seafood. I've had better but I have also had worse. The service was average. The wait for a seat was about 30 minutes. I can only see myself going back for their Tuesday all you can eat crab legs, other than that, probably not.",0.7498,0.869,0.096,0.035,0.5587244897959184
2011-08-14,1.0,"So... Seated after it took more than twice as long as we were told, which is awesome with two kids. Oh yeah, they said 15 minutes and instead of offering us a cup of coffee instead told us we could go two doors down to Starbucks top buy some. Now another 15 minutes before a waitress came over to offer coffee or anything. Told us she'd be right with us (she had to rush over to the table next to ours to snap a picture for them). Only reason we didn't leave is after committing so much time to waiting, the prospect of another wait (even a reasonable one) with our kids someplace else wasn't in the cards. My expectation is the food will be fine. Been here before but never again. (Don't get the corned beef hash.)",0.6979,0.922,0.078,0.0,0.5022366522366523
2011-08-13,5.0,"Saw this place on Check Please, so put it on my long list of places to try. The boyfriend loves seafood and checked it out solo and raved so we went a week later. I must say I was overwhelmed in a good way. There were too many fresh fish types to count, so I wimped out and got what I knew, stuffed catfish with shrimp stuffing. I devoured, $22 well spent. I barely got a bit of the bf's tuna (because he ate it without looking up within about 5 minutes) but what I had was good, perfectly cooked medium as he requested.  Can't comment on the atmosphere since we ate outside. Took a little longer that necessary for our waiter to come over, but after he did the first time he continued to check in regularly. If you have room, I'd say totter across the street to Margie's candies, that was incredible as well.",0.9615,0.857,0.143,0.0,0.444017094017094
2011-08-12,4.0,"Glenn's has been on my radar for the better part of 4 years now, and after much procrastination, I finally made the trip. The first impression I got from the place was ""uh oh, this looks like a douchy hipster place"". Wow, a seafood restaurant with cereal boxes on the wall, that's crazy! ... IS IT! Decor aside, I was astounded by the sheer volume of daily specials. There are huge chalkboards on either side of the restaurants that literally fill the walls. The server was delightful, if not a bit scarce.   My party ordered the fried calamari. and I have to say nobody was a huge fan. They make a stylistic choice to make Calamari fries,cut in long strips the squid was too big for my taste personally. The crab cakes on the other hand were absolutely THE best I've ever had. The clam chowder was yet another home run, the best I've tasted. For my entree, I tried the lobster roll, it was good, not great. This might be yet another stylistic choice, I prefer the hot buttered lobster roll to Glenn's traditional mayo, celery roll.   Out of my party of 4 , two of us really liked Glenn's, 1 was fine with it and 1 didn't really like it. Since I am writing the review, I would recommend Glenn's, but keep in mind there are some choices the chef makes that may or may not agree with you.",0.9684,0.82,0.153,0.027,0.5843333333333335
2011-08-09,3.0,"Geez, 71 bucks for ""diner"" dinner sure leaves a bit of sticker shock.  I understand that it's not cheap to supply the midpoint of the continent with fresh seafood daily, but yikes.  It doesn't help that they don't list the prices on the menu board.  $10 for calamari, $20 for crustacean pot pie, and $24 for ahi steak.  The tuna was delicious, but the other two items didn't live up to their price tags.  The calamari was salty and floury, and the pot pie was full of good seafood but otherwise bland. The house-made key lime pie was fantastic though.  I wonder if they had the limes shipped from Florida.",0.9248,0.821,0.14,0.038,0.6539351851851852
2011-08-07,4.0,"Glenn's has won me over.   Many a friend has read my review for Glenn's and begged me to try it again.  Seriously, the soft shell crab po boy that I had had previously was really THAT BAD, I was hella reluctant.  But, it's blocks from us and I wanted some seafood so in we went. For starters, the host gets 5 stars from me.  We walked in on a Sunday at 5:00 thinking we'd be able to get in since it was early.  We were told it would be a 45 minute wait.  With a baby, that's tough and we went back outside to reevaluate the situation.  That's when the host came out and said that if we promised to be done in an hour, we could have a table that was reserved.  No problem!  We're lucky if we can get the kid to sit still for an hour, easily done.   Thanks, host guy!   I had the Cajun BBQ shrimp.  It was pretty amazing.  I would definitely order it again.  My dude had, well, I don't recall because I was that involved with my shrimp.   We were in and out in a hour, as we had promised the host.  It was an altogether great experience and we'll definitely be back.",0.9627,0.746,0.167,0.087,0.49342105263157887
2011-08-03,4.0,There's not much to add that other's haven't already covered.  This is the kind of restaurant that makes a neighborhood.  I only wish it were more affordable so I could go more often.,0.4019,0.915,0.085,0.0,0.5791666666666667
2011-08-02,4.0,"As if this place needs another favorable review.  Solid seafood and brunch restaurant.  Consistently good people, service, food, drinks and casual atmosphere.  Go here to enjoy your food.  Really, really good calamari.   Don't think they take reservations, maybe though.  Worth the 20 minute wait.",0.9371,0.68,0.32,0.0,0.4611111111111112
2011-07-31,5.0,"Excellent choice for the whole family!  For breakfast, I indulged in the crab cakes eggs bene - fantastic new crab cake recipe and hollandaise perfection!  My husband tried to eat the sausage gravy and biscuits but our 4 year old got a taste of this bit of divine perfection and rejected his own breakfast.  Both kids got the cereal - sort of killed me to pay $5 for cereal but my 6 year old had a ball deciding to mix 3 types of sugary stuff we never have at home and exercising the free refill option for a 2nd bowl. For dinner (yes, we went back the same day) the kids spit the rainbow trout and loved the sweet pecans and asparagus.  My tuna (sushi grade, ordered rare) had a slightly spicy hollandaise, my husband had the creamy, delicious seafood pot pie.  On a previous visit we had the catfish and sturgeon entrees which I most highly recommend. We capped off our high calorie and omega 3s day with brownie pie.  Out of this world!!!! Great place for the family!  Just keep in mind it is a small and popular restaurant.  Be on time for your reservation and leave your gigantic stroller at home or outside!",0.9908,0.733,0.209,0.058,0.49771515151515155
2011-07-31,4.0,"Set, bump - the clam chowder and ""The Last Seafood Salad You'll Ever Eat"" are a 1 - 2 combo that has knock out potential. Very, Very good.",0.5379,0.864,0.136,0.0,0.6155555555555555
2011-07-28,4.0,"It wasn't bad, wasn't bad at all. Aside from a little girl giving me a death glare (she was probably just jealous of my red lipstick, yo) the entire time, the food wasn't horrible. It wasn't anything to write home about, but it wasn't bad. I had the french toast, which was okay, but if you want good french toast, you've gotta use the right bread. This bread was...meh. It seems like something you just buy in the grocery store aisle. Challah bread is much better, but what the hell does this spoiled french toast bitch know? The service was great, though, which is why they get four stars.",0.9093,0.657,0.227,0.116,0.46738095238095234
2011-07-27,5.0,"We went to Glenn's for dinner last night for the first time.  We've been there for breakfast (best traditional style pancakes anywhere) several times, but never for dinner.  We dined al fresco on what, to my mind was the most beautiful evening of the year.  We shared the Sturgeon with mushroom-bacon cream sauce (not low-cal, but Atkins friendly if you're going that way).  It was like a dream...truly the best non-crustacean seafood dish I have ever eaten.  It came with oven-browned red-skinned potatoes and fresh, slightly al dente asparagus--both perfect.  It was a great meal in spite of my initial buyer's remorse as it was ""all-you-can-eat"" King Crab night (every Tuesday) for $42.95.  We knew before we got there that we had a late lunch and as such, we wanted to share an entree (no sharing all-you-can-eat fare).  When I saw the crab being served to the next table, I came ""this close"" to tackling the waiter to get him to switch my order.  In retrospect, I am so glad I didn't.  The Sturgeon was absolutely awesome!  On a Tuesday sometime in the near future, I'll skip lunch and go for the crab!",0.9946,0.734,0.235,0.031,0.4662698412698412
2011-07-25,4.0,"Where can you go for delicious fish with a laid back ambiance? This is the place for you! With a wall full of fish entrees (really - you walk in, the wall is like a chalkboard and filled with delicious fish options).  My husband and I love coming here and always meet the best people! This experience was no different. Glenn's you must have a reservation (ok, strongly encouraged).  To start, my husband had their clam chowder soup (yes, on a 95 degree day, he still wanted the best clam chowder!!!), I had the mussels - good but not great. I had their Red snapper, this was incredible and he had the artic char - spicy yet so flavorful!!! We brought a bottle of wine with us but guess they just got their liquor license. Still, feel free to BYOB. Tuesdays seem to be the day where you can get half off or a fixed price on Crab legs!!!! Parking is available on the street/meter....",0.9363,0.827,0.137,0.035,0.525
2011-07-24,4.0,"it's only been in the last couple of years that i've begun to eat fish.  still not into seafood.  i don't remember the fish i had, the waitress recommended it.  but it was very tasty!  just what i like.  if you love to eat fish, i don't think you can go wrong here. i do recommend making reservations.",0.8702,0.726,0.212,0.063,0.5733333333333334
2011-07-23,4.0,"We really liked this Diner, hidden in a strip of stores on Montrose, near the el stop.  Primarily sea food and cereal, it has a true ""diner' flavor with excellent service.  The pan fried halibut was fantastic, as were the oysters.  There are daily specials, Wednesday - most recently - was all you can eat ribs and Thursday was all you can peel and eat shrimp.  Great selection of wines, too.",0.9441,0.758,0.215,0.027,0.553030303030303
2011-07-18,5.0,"Loved Glenn's Diner.  It has such a traditional diner feel and the food is wonderful.  We had the crab cakes for an appetizer which were filled with lumpy crab meat and absolutely delicious.  For lunch, my boyfriend and I both got the Po'Boys.  I had the shrimp, which my boyfriend said ""was the most amount of shrimp he's ever seen on a Po'Boy"" and he had the catfish.  Both were cooked well and not served with fries which was surprising, but something I liked about the place (sides include fruit, asparagus, potato pancakes, coleslaw, etc).  Most special about Glenn's is that it did not feel like Chicago - it felt seaside, like a Maine diner.  I will definitely be coming back here for the large Bloody Mary's, hotcakes and dinner.  Did I mention it's also BYOB?",0.8874,0.79,0.147,0.063,0.6433333333333332
2011-07-17,4.0,"Even though it's primarly a seafood joint, there are vegetarian options(just watch out for the Bloody Mary which has clam juice and the roasted red pepper&tomato soup which is chicken broth based. ) I had the veggie burger which was housemade and soooo good! My non-veggie friend said that the crabcakes were awesome! But beware, service isn't the greatest...",0.8353,0.792,0.164,0.044,0.7416666666666667
2011-07-12,5.0,"This place is just around the corner from my house and I love it.  The food is excellent (both dinner and breakfast) and there is something in all price ranges.  It has some of the beast seafood in the city.  Everything is really fresh and you can tell because sometime they run out of things.  But that is the price you pay for good seafood.  I'd much rather go someplace that runs out of selections than someplace that has had the same thing sitting in the freezer for a week. The only real downside is that because everything is good and the restaurant is small, reservations are basically required.  IYou must try the maple pecan pie a la mode.",0.9312,0.847,0.127,0.026,0.5325000000000001
2011-07-09,5.0,"I'll say it again, this restaurant is easily comparable to any downtown seafood place without all the pomp and circumstance. Took the man here for his birthday this week and once again had a fantastic meal! Oysters Rockefeller for starters, absolutely delicious! They were large oysters served with spinach, cheese and I think bacon? Totally satisfying. Then I had, on the recommendation of our waitress, Atlantic Char, a fish similar to salmon. It was served on red potatoes and asparagus. De-vine! The man had breaded pork chops which were served with a warm apple compote and potatoes. The pork chop to me was a little dry but still very tasty. We finished up with fresh strawberry pie Ala mode. I'm not a dessert person but I ate the whole thing! My only ""complaint"" is the seating is quite crowded so you'll definitely hear your neighbors, perhaps Glenn can buy out one of the neighboring property one day and expand! I believe they have more than enough happy customers! Definitely go to Glenns, you will not be disappointed! BYOB makes things more reasonable.",0.9837,0.834,0.166,0.0,0.5874741200828157
2011-07-01,4.0,"Wow, from the moment that I saw Glenn's Diner on Check Please...many, many years ago, I've been determined to come here.  Obviously, I'm a bit of a slacker/procrastinator, since my visit finally occurred.  Was it worth it?  I would say so.  My companion (by now a seasoned veteran of Glenn's, courtesy of a few telecom lunches) and I both took advantage of the fresh catch special.  This involved a starter course of an ample salad and soup (French Onion for me, $1 something upgrade).  This paired along with our Blood Marys could have easily made for a filling and satisfying lunch.  But of course it didn't stop there.  Our entrees came with a side of asparagus and a potato pancake.  He got the trout and I got catfish.  The catfish was mild in flavor, meaty and well cooked.  I'm excited to step outside of my typical fish eating options and try the other varieties they have to offer.  Regardless of the Fresh Catch special deal the check was still a bit on the pricey side, but I think we really got a great meal out of it.",0.9693,0.838,0.162,0.0,0.4795995670995671
2011-06-30,1.0,"I was excited to try the place because their menu gave me hope.  And then I was disappointed.  I ordered a veggie burger and specifically said I wanted NO pickles because they make me gag.  I really can't stand them!  The waitress assured me that I wouldn't get them.  My food came and BAM a handful of pickles and pickle juice were running down the plate, onto the burger and potato pancake.  Grreeeat, already off to a bad start. The burger was bland and could use way more seasoning.  I didn't even eat one half of the sandwich.  The refills for my water came slow.  The service wasn't great, nothing special, just a little slow.  I was charged for a large orange juice but I only ordered a small.  The waitress took the OJ off the tab completely.  Cool but I would not go back again.",-0.1075,0.844,0.073,0.083,0.5141975308641976
2011-06-29,5.0,"I've been a regular here since it opened.  This is a perfect place for any meal. Although the specialty is the fish for dinner, I have come to be more a Glenn's fan for the breakfast.  Fantastic and underappreciated brunch spot. There is everything from specialty dishes to never ending bowls of cereal and huge breakfast sandwiches.",0.9038,0.801,0.199,0.0,0.6753846153846154
