date,star,text,compound,neutral,positive,negative,subjectivity
2017-09-03,5.0,"Guy Fieri's not wrong about this one. Awesome fish selection prepared by people who are good at what they do. Always fun to try fish you've not had before, and never disappointed. Staff is excellent - lots of fun!",0.9738,0.549,0.451,0.0,0.6642857142857144
2017-08-21,5.0,"This is one of my favorite places in the city. Service is always great, everything I've tried has been wonderful, and I love the sauv blanc on the menu. They've also been really awesome about making gluten free grilled calamari for me instead of the breaded stuff, which a lot of places won't do. so points for that. Super casual, but extra tasty, and I'm a fan of the sidewalk seating when the weather's nice. Love it.",0.9811,0.673,0.327,0.0,0.7621212121212121
2017-08-20,5.0,"I've eaten at Glenn's several times. I went for the fresh seafood, though I'm sure it's nice for breakfast / brunch too. I thought the seafood was very good. Nothing exotic, but honestly prepared, quality seafood with savory flavors. The portions are good sized, and the seafood came with some nice fingerling potatoes and some tender asparagus the night I went recently. The presentation was attractive but not pretentious.  I suggest a reservation, but often you can get a table without one. A selection of beer and wine that should suit most, as well as some good soft drinks. I went with friends and we lingered, talking and having coffee after the meal. It was very comfortable. The key is:  GOOD SEAFOOD AT MODEST PRICES.  You don't find many good seafood places on the north side here, and this could well become your go-to place for fish. They also have some tasty looking meat dishes, but the standout is the FISH.  MMMMM  FISH.",0.9946,0.721,0.279,0.0,0.6985185185185184
2017-08-20,4.0,"Glenn's food is to die for, but service could be better. I think they know you'll keep coming back 'cause it's so delish, so the servers are a little haughty and have no problem being sassy. Whatev!  Brunch at Glenn's is amazing (their Bloody Mary comes with shrimp--need I say more?) and if you feel like splurging, dinner is even better. I highly recommend their seafood alfredo or cioppino. Also, be sure to come by on a Thursday night for the $19.99 all-you-can-eat shrimp deal. They also have a cereal wall if you're into that, though I don't know why you would be once you've tried anything else they have to offer!",0.914,0.725,0.178,0.097,0.5809876543209876
2017-08-19,1.0,"I got food poisoning from this restaurant and the way they handled the issue was unsatisfactory which was to do nothing. Just because everything came in fresh doesn't mean there wasn't accidental contamination. Before taking to social media, I call a restaurant to let them know if something was not okay and in the past, it was handled with seriousness. The person I spoke to did not seem to actually care except to say ""Sorry, I don't see anything here that was unfresh."" This restaurant is so expensive and I vomited up my entire $50 meal and was violently ill for hours after.  Perhaps you won't get sick after eating here, but if you do expect zero accountability.",-0.3444,0.867,0.056,0.077,0.5714826839826839
2017-08-13,5.0,"We have been here many times as it one of our ""celebration places"".  The seafood is super fresh.  My faves are the mussels, scallops, trout dip...the list goes on and on.  The service is great.  It's a comfortable, neighborhood place, but I would definitely recommend reservations.",0.9274,0.709,0.291,0.0,0.6194444444444445
2017-08-03,4.0,"The $65 all you can eat crab legs were too rich for my blood, but my cousin enjoyed them! They didn't have the tools that crack open the shells so she struggled with them. They need to consider investing in those. I got the shrimp cargo, seafood pie and cereal for dessert. It was SO good, kind of more tomatoes and mushrooms than shrimp/scallops but still very good. I hope the invest in non-dairy milk for cereal, and expand the BYOB to include Tuesdays.",0.9691,0.733,0.232,0.034,0.6757142857142856
2017-07-28,4.0,Delicious and great customer service! I got the Jambalaya and it was spicy just the way I like it. We got there about 2pm on a Sunday and I was looking for more seafood dishes but they were pushing brunch per their menu leaving me a little disappointed. Next time I'll definitely go for dinner hours. The mac and cheese was a little disappointing but their use of Cavatappi pasta rounded out the texture of the side. In addition the Mac and cheese counter balanced the spicy level of the Jambalaya. The cornbread in the center was sublime!,0.2989,0.824,0.103,0.073,0.53
2017-07-28,5.0,"I have only ever been here for brunch and enjoyed it both times. It is BYOB which is AMAZING. It was nearing the end of brunch so we were able to get seated immediately which was great. I had the softshell crab breakfast sandwich. It was good, but kinda pricey. The hashbrown patty on the side was great though! My friend got chicken and waffles and raved about them. The server was so friendly and attentive which made the experience that much better. This is definitely a place I suggest to friends looking for a brunch spot. Cant wait to go back!",0.99,0.701,0.299,0.0,0.6673076923076924
2017-07-14,4.0,Glenn's diner was a great dining experience.  I enjoyed eating in a neighborhood establishment with a flair for gourmet food.  I enjoyed my Scottish salmon and appreciated the Spectre of watching someone enjoy one of the many varieties of breakfast cereals pulled off the larger than life wall display of cereals in the restaurant which add to the unique atmosphere.,0.9531,0.744,0.256,0.0,0.59375
2017-07-09,4.0,"If you're craving seafood, check out Glenns Diner. Located in Ravenswood, a stone throw's away from the Montrose Brown Line stop, Glenns Diner has a decent little sidewalk outdoor patio consisting of several tables. Inside, the dining area is rather spacious and open. I got the Seafood Cioppino, which had a delicious broth, and consisted of sturgeon, walleye, strip Bass, and shrimp. Served with several pieces of delicious texas toast-style garlic bread, the lunch portion of this bad boy filled me out quite well.  The service was great, the waiter was very attentive and informative. Overall, a great experience and meal. I feel, anecdotally, its hard to find good decent seafood regularly in Chicago, especially in local neighborhoods like Ravenswood. Definitely check out Glenns Diner if you're craving some good, fresh seafood, at a decent price.",0.9737,0.748,0.202,0.05,0.5384894091415829
2017-07-08,3.0,Great selection of fish and always fun and lively atmosphere. Nice outdoor seating!  The only thing I didn't care for was the fact that the fish was prepared with lots of butter. Overpowered the flavor of the fish and calamari.,0.9129,0.648,0.3,0.052,0.6900000000000001
2017-07-03,5.0,"My sister and I went there on a Pride parade Sunday around 3ish. The restaurant was pretty quiet. The atmosphere was good. Our server was okay. The food came out relatively on a slower side considering it wasn't a busy hour. We only ordered 2 dishes, calamari and mussels. My sister loves the calamari. The cut it differently than the other places. Big juicy piece. Yumm. I love the mussels dish. The smell of garlic & cheese were hard to resist. It's absolutely one of the best mussels I ever had. Very fresh mussels & load of garlic. The dishes were large enough to filled the two of us. Strongly recommend mussels. I'll definitely go back when I'm in town.",0.9816,0.732,0.242,0.026,0.5045351473922902
2017-06-20,5.0,Great place for seafood. Coconut shrimp was delicious.  Staff is friendly and professional. Went for Father's Day. We will go again.,0.9001,0.621,0.379,0.0,0.5875
2017-06-18,5.0,"This place has ruined many a Funday Sunday for me by knocking me on my ass after eating there.  There are so many great options on the brunch menu so it is difficult for me to just get one entree and I blame Glenn's.  I am hooked on their Brown Sugar Maple Pecan pancakes, which I need if I am going to order breakfast/brunch.  But I don't consider pancakes as an entree...it is a side.  And therein lies the problem, I always get those damn pancakes and something else AND I eat it all, washing it down with champagne.  Then I need to get in bed and rub my belly until I fall asleep...buh bye Funday Sunday. The food is amazing and the portions are a little on the large size.  I have not ever had a bad meal here.  Preparation has been consistent all the time.  Not much on the menu I wouldn't eat except the cereal.  No idea why anyone would go to a restaurant to eat cereal, but they must do so.  I personally can't see paying almost $7 for cereal, but to each his own.  I know some folks freak out about paying for the cereal and the milk separate, but no one is forcing you to buy it.   Most of my orders from here are take out because I prefer to eat on my balcony and have my own drinks as the dining space is small and somewhat tight, which would knock this review down to 4 stars.  But because they take reservations, that moves them back up to 5 stars. My recommendations for breakfast/brunch would be:  Brown Sugar Maple Pecan/Fresh Blueberry pancakes, Rushing Waters Smoked Trout Hash and Eggs, Corned Beef Yukon Gold Potato Hash and Eggs, Grilled Salmon Salmon and the Steak/Eggs. For dinner: Spaghetti & Meatballs, Lobster Fettuccine Alfredo, the Three Napkin Meatloaf sandwich, Catfish Po'Boy, the Salmon spread appetizer and the grilled calamari.",-0.8784,0.904,0.027,0.069,0.5136173767752716
2017-06-18,4.0,"So this happens to be one of the best places to eat in Chicago. I assure you, you can't go wrong no matter what u order. We used to be regulars here, until the service became horrible.  The last time we were here they spilled cioppino all over me. They of course apologized. However it was bit insulting when all they offered us was to take the appetizer off the bill. For those that have been to Glenn's you know it's an expensive place. We were a party of four that spent over $250 so it wasn't about the money it was the insincere gesture. When this happened we swore off Glenn's. My wife was furious.  I've been asking to come back, since we really do enjoy their food my wife has been saying no. I managed to convince her to give it another try. Once again the food was great just as remembered the service sucked, again. Our food got to the table before we even got our water. Not happy seeing that it was a warm day out and I certainly didn't think a 25 minute wait for water was acceptable. Not sure if I'll be able to convince her to come back",0.9683,0.748,0.184,0.069,0.5626240079365079
2017-06-13,5.0,"Amazing, amazing dinner! One of my favorite restaurants in the city. If you love seafood, it's a must! Also love that it isn't so trendy or pretentious as other places downtown. Just good food and good service!",0.9792,0.53,0.47,0.0,0.7175
2017-06-10,5.0,"Fresh and extremely large portions of seafood. Any and all fish available. Mussels and broth are fantastic. No disappointing dishes, it's all top notch. Some believe it to be a bit pricey, but it is worth every penny and BYOB. I'll be back to try the all you can eat shrimp or crab during the week.",0.4588,0.811,0.127,0.061,0.4410714285714286
2017-06-10,3.0,"I want to love this place. The service is great but the food options for a casual lunch are limited and kind of expensive. If you are going for seafood than it works great. If you are just going for a nice lunch, it's just ok.",0.9538,0.603,0.356,0.041,0.68994708994709
2017-06-07,5.0,"Great service, food outstanding, ambiance relaxing and fun. Highly recommend when your fixin' for some fishing!",0.9564,0.383,0.617,0.0,0.5912499999999999
2017-05-30,5.0,Our party of 6 was brewery hopping in the area and by chance and luck found this diner and seafood house.   Their fish and seafood specials are listed on the chalkboard.  The choices were overwhelming.   Waiter recommended the ruby red trout in a lemon butter sauce with rice and asparagus.  The dish was perfection.  Everyone loved their dishes.  Several of the dishes came with a potato pancake.  They were an amazing combo of potato and onion.   We actually ordered a side dish of them instead of dessert.  Decent beer selection also.  Highly recommend this place.,0.9709,0.778,0.222,0.0,0.5008333333333334
2017-05-23,3.0,"Tried Glenn's Diner for the first time this afternoon.   The waiter was great - ordered the Scottish Salmon - which was fantastic.    However, I wasn't impressed with the dude/host (blond hair).   He didn't give me the table that I requested  . . . which on one hand makes sense, after all, it's better to have a party of one sit at a table for two than a table for four . . . but, on the other hand . . . it wasn't busy.  Only two tables were occupied when I arrived and while I was there . . . one party finished and left.  And then,  before I left, a party of about four showed up . . . so the blond haired dude started prepping their table . . . which was right next to my table.  While prepping the table, he then passed between the table he was prepping and my table (a narrow passage) with his butt towards my face, invading my personal space!   It would have been better for him to walk around the table the other way!  It's never a good idea to invade a diner's space like he did.  When I got up to leave . . . I was smart enough to walk around the newly seated dinners and not between my table and theirs.    And then, I noticed that the table on the other side of the newly seated diners was empty and only one other table still occupied.  I could understand such a situation had the place been crowded at the time . . . but it was't crowded at all.   It's  too bad the host was so careless.    Otherwise, a decent restaurant.",0.9422,0.814,0.122,0.064,0.5139423794596208
2017-05-22,5.0,Finally a restaurant that delivers food properly. Meal was just as presentable as it would be dining in. Thanks for respecting your customers. 90% of places don't.,0.7269,0.797,0.203,0.0,0.43333333333333335
2017-05-21,4.0,"We had Sunday brunch reserved for six.  Immediate seating.  Attentive and quick service.  The Bloody Marys are spicy treats--could qualify as meals.  The biscuits & gravy & crab benedict special were the table faves.  The seafood salad, although adorned with various tasty fish,  was overwhelmed by greens.  Go in with an appetite as portions are large.  Love the cereal display and want to go back to try the impressive seafood dinner offerings.",0.8625,0.784,0.18,0.036,0.6
2017-05-19,1.0,"Came here on all you can eat crab legs day with my mom who didn't order the crabs and was being watched by some guy standing at the door with his arms folded. Was he security? The owner? Don't know and don't care. Then, because my mother reached over to my side of the table, he rushed over to inform us that there was no crab leg sharing. After we told him she was getting a napkin, he repeated NO SHARING. Ironically, we were the only blacks in the restaurant. No worries: this ain't the 60s and I will gladly not come back and allow your restaurant to be all white and great again.",0.7296,0.76,0.144,0.097,0.55
2017-05-19,4.0,"this place is so good, but i most often come for breakfast because i find the dinner menu to be just a hair expensive for the overall experience (which is why 4 stars). i do have to shout out the crustacean junction pot pie though, so, so so, yummy. breakfast is much more reasonably priced and they offer like 20 different kinds of cereal. i recommend the pancakes with the banana fosters sauce.",0.9512,0.798,0.202,0.0,0.5
2017-05-13,5.0,I never would have expected to find fresh seafood in the midwest but Glenns Diner has proved me wrong. This place is AWESOME when it comes to seafood. They have so much seafood here they have 5-6 blackboards full of seafood dishes IN ADDITION to their regular diner menu. Impressive!! We ordered the mussel dish as an appetizer to share. So many mussels at a great price! The flavors were also so delicious. Garlicky goodness with garlic bread. My mouth is watering just thinking about it again. I ordered the sturgeon fish. I've never had it before but it was perfectly seared on the outside and nice and flaky on the inside. The sauce was also very good. Service here is top notch. They were very quick and attentive. The place is small so seating is snug but it adds to the dining experience in a positive way. I can't wait to come back here again!,0.9952,0.702,0.277,0.021,0.604875124875125
2017-05-12,5.0,"Fun! Fabulous food and great portions.  Try the crustacean pot pie, you will not be sorry.  Breakfast is awesome here too!",0.9494,0.489,0.511,0.0,0.79
2017-05-08,5.0,"This is a cute and unique restaurant with excellent food and service. Don't let the ""diner"" part of the name fool you. It's a small place. There are specials and things on a giant chalkboard. There's tons of options on the menu. And there's a daily special each day of the week, including all-you-can-eat Alaskan king crab on Tuesdays. They have many wonderful seafood dishes. They're also a great place for brunch. The service is absolutely wonderful. Attentive, knowledgeable, and friendly. And the seafood is legit fresh!",0.9744,0.712,0.26,0.028,0.7229591836734695
2017-05-05,4.0,"Selection of seafood : 5 stars Service : 4 stars Food : 4 stars. Some dishes are executed better than others.  Overall, it is low key, good for meeting friends, and close to Margie's candies ice cream shop for dessert. We came here with reservation of 12 people with high chairs, but then we dropped to a party of 10. They accommodated us well. Service was knowledgeable. We ordered some calamari and garlic bread with parm. The best app was their mussels appetizer with the garlic bread which was rather abundant in portion and flavor. We asked for more garlic bread to soak up the yummy broth. The app order of bread with parmesan cheese was not great and not enough in portion.  I tried the sturgeon with the mushroom sauce. It was slightly burnt in some parts. The waiter never asked what what sides I wanted. Had I known I would have opted for the potato pancake or the garlic spinach vs the bland fingerling potatoes. I gladly got to try my husband's grouper which was more flavorful with the better sides.",0.9736,0.818,0.151,0.031,0.5587500000000001
2017-04-30,5.0,"Delicious seafood, casual atmosphere.  They also have a full diner menu but the seafood is superb.",0.8555,0.561,0.439,0.0,0.8541666666666667
2017-04-30,4.0,My ex and I fell in love because of our shared hatred of this place. In the end things got stale and we got salty and bitter in the end. These are traits I associate with Glenn's dinner. 4/5 because she was HOT.,-0.1027,0.731,0.13,0.138,0.6125
2017-04-19,5.0,I love this restaurant. The food is amazing although for the price they could at least give 1 or 2 more potato pancakes to go with the sandwiches. The servers are friendly also,0.9042,0.707,0.293,0.0,0.58
2017-04-18,4.0,"First visit and enjoyed it - we both had different types of salmon and they were delicious.  We sat at the bar because it was so busy (I suggest reservations) - even though there were empty tables, that I""m assuming were reserved.  It's a really small place and I'm not interested in sitting outside next to the street.The seafood is pricey, for sure - go glad it was tasty.  Limited bar choices and you can do BYOB with a cork charge of $8.",0.8096,0.795,0.138,0.067,0.4934676434676435
2017-04-17,3.0,Overrated! Also a major turn off that the staff couldn't even crack a smile when you're trying to talk with them and keep things loose.,-0.5722,0.817,0.0,0.183,0.28974358974358977
2017-04-14,4.0,"It's been a grip since I've been to Glenn's, but we stopped in the other day and it was just as good as I remembered! If you've never been, Glenn's is a very eclectic (one might say disjointed) casual joint that does seafood as well as any white table cloth place around (note: their prices reflect that as well, which is a good thing for seafood; take my word on it;)  We stopped in right around lunch time, got rockstar parking *and* practically got to sit wherever we wanted. Unheard of! Our server was great. But let's get back to what we reeeally care about. The FOOD! We ordered: a cup o' chowdah, the seafood salad, and the pan seared rainbow trout with pecans & garlic butter on the side.  Their chowder is fan-friggin-tastic. Perfectly seasoned, not skimpy on clams, and not too inundated with veggies. Just perfect. I want some now just typing about it. Both entrees were *huge* (totally sufficient for splitsies if you're dining on the cheap or not a fan of leftover fish). All of the seafood was excellent and the produce was fresh.  My only complaints would be 1.) their bathroom could use some serious upgrades re: a toilet that flushes properly and 2.) their potato pancake (a signature side they serve in lieu of french fries) is not very tasty. And man, I LOVE a potato pancake in all varieties. But this one, despite the great texture, was overwhelmed by onion *and* scallion and made me sad:'(  All in all though, there are many more positives than negatives here and I give them two thumbs way up. Cheers!",0.9964,0.746,0.216,0.038,0.5704844006568144
2017-04-09,5.0,I forgot how good this place really is. It's been over a year since I have been here and I can't remember why I stopped. The food is amazing and the weekend brunch is even better. The atmosphere has a very neighborhoody... (if that's a word) feel mixed with array of specials on the chalkboards on the walls... mainly seafood. I should also mention that I do don't eat seafood but when I am entertaining guests who do like seafood this is the place I think off. And today I am shocked and amazed that I do not frequent this place as often as I should. Weather it's a bowl of your favor cereal at the counter or fresh from the sea seafood. This is the place for you!!! Please consider this place for entertaining friends or family on weekend mornings!,0.9869,0.736,0.245,0.019,0.5069444444444444
2017-04-06,5.0,"Excellent food and service for breakfast, lunch or dinner. Creative and extensive menu. A gem.",0.765,0.645,0.355,0.0,0.7777777777777778
2017-03-29,4.0,"I wondered why the hash was $16 - until it came out. It was ENORMOUS. And delicious! White fish with potatoes, scrambled eggs, red and green peppers. Tasteful seasoning and Texas toast. BAM. Down the hatch. The mimosas are fun; triple sec and a pour-your-own ratio with a tiny bottle of Korbel. The bloody came with four shrimp, but I'm not sure it was worth its buck. Service was pretty attentive, the coffee was delicious, I really wanted cereal, and, yeah. Check it out.",0.9423,0.75,0.204,0.046,0.548611111111111
2017-03-24,5.0,"The New Orleans Scramble is my go to, and it is one of the best plates in the city.  I could eat it every weekend!  Love the potato pancakes, and I always add an extra one.  A+",0.8655,0.792,0.208,0.0,0.36363636363636365
2017-03-09,1.0,"I haven't eaten here yet, but we went here last Sunday night with every intention to. They just didn't have anything we wanted to eat. Like raw oysters (but they sell rockerfeller style) and no soft shell crab sandwich. That was a huge deal breaker for me and was the only reason I wanted to go. So we left after. The staff and waiter was kind and knowledgeable though. I'll hit them up when they have the crab back .",0.8402,0.841,0.126,0.033,0.459775641025641
2017-03-07,5.0,"This place is outstanding starting from the service and of course the food. I went on Tuesday and had the all you can eat King crab legs. They were juicy,meaty and very flavorful. My girlfriend had the lobster pasta and it was enough for three ppl to share. The customer service was beyond great.  Come and fall in love with this place",0.9382,0.797,0.203,0.0,0.5208333333333334
2017-03-02,4.0,"Its really nothing to say.  If you've been here then you know why it's so good.  If not? Then you diffelnty need to get here,  the food is great sea food off the chain.  Bucket list!",0.8455,0.807,0.193,0.0,0.5166666666666667
2017-02-25,5.0,"Just had the New Orleans scramble. My God was that good. Can you put any more food on a plate? Delicious food, incredible service.",0.8271,0.697,0.303,0.0,0.6909090909090909
2017-02-15,4.0,Celebrating my daughter bday We had  Crabcake apetizer Gonzo blody mary Lobster fetching And cream bule Great atmosphere,0.8316,0.672,0.328,0.0,0.75
