date,star,text,compound,neutral,positive,negative,subjectivity
2013-01-21,3.0,"Came to Taxim for a Sunday night dinner. Except for a large birthday party the place was practically empty. Good to know it's a good place you can take a large group. The service was absolutely fantastic. Our waiter was great at making wine suggestions, perfect in terms of proposing how much food to order, and thoughtful in assessing dietary restrictions. He was patient with our billion questions and coursed out a meal assembled of lots of small plates fairly well. Taxim isn't really a small plates place, although they definitely have a lot of that on the menu. My party just happened to be one that puts a high premium on variety so we ended up constructing a meal out of their smaller offerings. Although in general people seemed drawn to different dishes the clear winner was the revitha kas which must be Greek for hummus. It was smooth and delicious and we were practically licking the plate clean to fight over the last few tastes of tahini goodness. I favored the Kolokithokeftedes as well, a great mix of a house made yogurt, cabbage slaw, and butternut and acorn squash fritters. The food was solid and pleasing to a lot of different palates. The ambiance was cute and I loved the huge exposed brick walls. All in all I found Taxim to be a very solid and safe choice, if Yelp allowed it I'd give 'em a 3.5 especially given that the service was so good.",0.9971,0.7,0.28,0.02,0.5632539682539682
2013-01-07,4.0,"OOooOoOooo!   Consider me satisfied and delighted!!  I wasn't exactly thrilled at the thought of having Greek.  Not gonna lie.  BUT every dish we tried was super, not to mention, plated beautifully.   **GET THE BEETS.  Our party of 4 threw down two portions easily.  The walnut-y pesto is the bomb.  It has become my latest cooking obsession to recreate that sauce. --pureed chickpeas--basically hummus w/ light, fluffy pita. --octopus.  Hell yes. --squash fritters--I could not stop eating the yogurt and cabbage. --duck gyro --pork shoulder --roasted chix--lemon-y, juicy, damn good chicken.   The wine list is obnoxious.  Luckily, our server hooked me up with something tasty based upon what I wine I normally like.   I also highly recommend the drink w/ St Germain.   Tastes like sex.",0.9826,0.568,0.298,0.134,0.6726388888888889
2013-01-01,5.0,"Every time I go here, I am amazed at the quality of the food.  Every single dish has been outstanding, without exception.  The wine list is intimidating, cuz it's all Greek, but the staff has always recommended something that I liked.  And they'll give you a sample, too.  The owner is great, the staff attentive.  And new year's eve last night was fabulous.  The live music was phenomenal.  I am never disappointed.",0.9724,0.694,0.283,0.023,0.5675414862914863
2012-12-29,4.0,"Contemporary Mediterranean food  with a special greek touch. The service was outstanding and we even got a free beet salad to try as it was our first time there. They have an amazing choice of Greek wines and food is delicious. The only thing I did not like was the pita they served with one of the appetizers. In my opinion, it was too thick and tasted like one of those pre made frozen pita breads instead of home made in the oven. It just seemed to be wrong compared to the rest of the food on our plates which was delicious. Other than that it's a place to go.",0.8434,0.729,0.163,0.108,0.5997448979591837
2012-12-29,5.0,"Beautiful decor, friendly and attentive waitstaff, delicious greek food, free shots of Ouzo provided by the lovely waiter ;) .. I mean, what more could one ask for? Try it, you'll love it.",0.975,0.51,0.49,0.0,0.7034090909090909
2012-12-08,5.0,"I love Taxim! The small plates hot and cold are great! Especially the beets! Their lamb is fantastic! The owner has great recipes! Warm atmosphere with Greek music playing in background. They have good selection of Greek wine and servers are knowledgeable. They make homemade yogurt and serve with honey and nuts, it's absolutely delicious!! We come here several times a month! They just need a more visible sign, but over all Great place! :)",0.9763,0.672,0.31,0.018,0.6294117647058823
2012-12-01,5.0,"First, the decor and atmosphere is great. Noise level on a Friday night was reasonable. Service was friendly and knowledgeable about the menu. And we arrived at 8, but were seeing a 9pm show at Gorilla Tango. Our server managed to expedite our order so we could make our show. My only quibble is that there are only a few wines served by the glass. They were really nice wines, but a wider selection would be nice. We had the lamb sausage, braised kale and lamb kabob for appetizers. All excellent. The lamb was very tender, and not at all dry, which can be a problem. The herbs and yogurt with both dishes were well selected and very fresh.  I had the braised pork shoulder entre, and it was excellent. Not too salty, which I've found to be a problem elsewhere. And the barley the dish was served with was an excellent compliment to the shoulder.  My only regret was that I was too full for dessert! I highly recommend this restaurant.",0.9853,0.741,0.205,0.054,0.717962962962963
2012-11-18,4.0,NIce atmosphere outside...great waiter! This was the first time I tried octopus it was pretty tasty. The dishes we ate here were all pretty tasty from the salad on down.,0.8588,0.733,0.267,0.0,0.7244444444444443
2012-11-15,1.0,"We chose this location for a special occasion BUT the experience was horrible! We were one of only two tables that evening BUT our food took ONE AND A HALF hours to get to us. The cup of soup and cup of rice we ordered for our child took an hour to arrive. ON TOP OF THAT everything we ordered was EXTREMELY SALTY, (except for the lamb - that was the only glimmer of hope that evening). I will definitely not go back nor will I recommend this to my friends and family. ZAGAT should re-rate this place to show its real sub par rating!",0.8711,0.79,0.147,0.063,0.6153439153439152
2012-11-12,3.0,"Maybe this place was just having an off night.  No food came for 25 minutes, then three things came at once. Soup took 45 minutes, we canceled it as we were out of water, wine, and patience.  Pacing was rushed.   Our waiter, a very handsome cool guy, was much too hip to give us good service.  Some things were excellent - the grilled octopus, although there were more grilled onions than octopus and $15 seems a little expensive for a few bites but still those bites were delicious.  The flatbread was excellent!  Hot, chewy, really tasty cheese and homemade dough. The fish gyro was disgusting, should have been called a fish eggroll - it was deep fried (not mentioned on the menu)  All that beautiful fish turned into a greasy mess.  The cabbage slaw served with the fish, however was AMAZING.  Again, maybe an off night, but overall a not-so-special-quite-expensive dinner - with everyone's not so favorite of too many tables crammed together and we got to hear the conversations on each side of us!",0.9726,0.759,0.173,0.068,0.6321428571428571
2012-11-12,3.0,Solid Greek food in Wicker Park.  We ordered the hummus plate and lamb sausage which were excellent as appetizers.  For our main courses we split the sea bass and lamb chops.  Both were great and service was pretty quick.  Nice atmosphere and not too pricey.,0.9371,0.722,0.278,0.0,0.575925925925926
2012-10-11,3.0,"the octopus and the beets were very tasty. the hummus was aight, lamb crusted shrimp was interesting, but not for me...just is a bit weird conflict of flavors. my girl liked the lentils. server's head was more concerned about what was goin on with her iphone than asking what next round of small plates we wanted, when we were clearly finished up with round one (and the only table there). nice enough gal, but if there is one table in the restaurant, they shouldn't be crinkin their nexts to grab your attention. i would only go back for the octopus and the beets.",0.8316,0.842,0.113,0.044,0.5455555555555556
2012-09-26,4.0,"Taxim is a treat, especially if your idea of ""Greek food"" is Greeksploitation: flaming cheese and waiters yelling, Opa!. The octopus is justifiably famous and the lamb chop is excellent. Definitely headed back in the future.",0.8858,0.731,0.269,0.0,0.5178571428571429
2012-09-13,4.0,"Know for its beautiful ambiance & gourmet regional Greek cuisine, Taxim does not disappoint! Inside the palace like dinning room, chef David Schneider puts together a great menu with local fresh ingredients along with attentive friendly service and some amazing cocktails from the bar.",0.9696,0.61,0.39,0.0,0.56875
2012-09-10,5.0,"Ok, now this place is EASY to miss. Or at least I think so since I have missed it for 2 years. Hubs and I are walking down the street to find somewhere new for dinner. Greek food...sounds good. We go in and are blown away. Beautiful area! Perfect for a date or any occasion. We are greeted by a understated and polite hostess who seats us by the window (where we asked to eat). We ordered 4 items. 1) Grilled Octopus: PERFECTLY cooked! I am a grilled octopus freak. I order it every where. This is BY FAR the best I have had anywhere (including fisherman's warf in San Fran, San Diego, NY...) You could just pull it apart with your fingers. It was divine. 2) Hubs ordered the Duck Gyro: delicious fries, great meat, great sauce. No disappointments. 3) I ordered the beat salad: WOWSER! delicious in every way. Cheese on it was fantastic, great dressing and such. 4) I also ordered the lamb encrusted shrimp. More like a meatball over a shrimp and it was HEAVENLY! My husband and I locked eyes as we ate a bite and just went ""wow."" Order it. Then we had the Greek coffee, which was great. Wine with dinner was good too.  Love the fact they have small plates as well as normal size entrees. The staff is fantastic. If I looked at the waitress she immediately came over to see what I needed. Checked on us, but not overly friendly and didn't pester. Sadly we are moving to Texas, and we just discovered this place. Don't make our mistake. Go there and you'll love it. Great experience.",0.9942,0.732,0.223,0.045,0.6648989898989899
2012-09-08,3.0,"From what I understand this is a Mediterranean restaurant except I've never had food here.  Many of my visits through this place have been limited to random visits on weekends after the restaurant portion has closed and it's opened as a lounge.   The lighting is darkened, the music is thumpin' and its vibin'.  There is a scent in here that is reminiscent to me.  The shadows the candle light reflects off the walls, that incense burning, it reminds me of late night clubs in India.  A heart warming feeling usually overcomes me.  On occasion I've heard some Arabic or Ethnic sounding trance like sounds and then other times I've come across reggae beats. For the late night they should get a decent bartender than can mix a few special crafted cocktails.  They have a decent beer and drink menu but pricing is a little too high.  Check out Carol K.'s review for a more in depth feeling of the layout of the interior.",0.5346,0.94,0.051,0.009,0.4595658263305322
2012-09-07,5.0,"DAMN.  The meal I had here last night was one of the best I've had in months. I had two cold plates (the roasted beets and the pureed eggplant) and one hot (the lentils with feta), and all three were exceptional. The interplay of flavors was balanced and delicious, and the presentation was lovely.  The restaurant itself is beautiful too, and the service was attentive and informative - AND the waiter was very handsome, which is always nice. :) I'd recommend this place unreservedly, to vegetarians (like myself) and presumably meat-eaters (though I can't speak to those dishes directly) as well.",0.9778,0.725,0.246,0.029,0.7897435897435898
2012-09-05,3.0,"The food here was decent but the ambiance and the service were lacking.  Our server was not friendly and seemed annoyed to be waiting on us.  All of our party of four commented on her odd behavior throughout the meal, including pushing us to buy the only $150 bottle of wine on a wine list with an average price of $40.  We did really enjoy the arugula salad, the lentils, and the eggplant.",-0.1287,0.787,0.097,0.115,0.5880952380952381
2012-08-13,3.0,"our second visit did not live up to the first. everything we had was overly oily, lamb sausages were dry, fish gryo were deep fried. the heirloom eggplant dish was good though. service is great.",0.7906,0.825,0.175,0.0,0.45476190476190476
2012-08-11,3.0,"I have to say that I was thoroughly impressed with this restaurant, the food was amazing. I had the Aegean Sea Bass, and my only regret was that it was so big that I could not finish it. But is was probably the best fish I have ever had in my entire life. But the main reason why I came to this restaurant was to watch my favorite artist, Monica Da Silva perform here last night. Firstly, I made the reservation a week in advance for myself and a few friends to which I was told that I did not have to purchase tickets but that I agreed to purchase food that would amount to $30 or more per table. I agreed, not seeing a problem with this.  To my horror, after my friends and I had been there the entire night, we were told that there was an actual cover to watch the band perform. The cover was really not anything to cry about but I felt as though I had been duped by the hostess who had told me that there would be no cover at all. This dishonestly really put a dent for this restaurant as I was really going to give it 5/5 stars. Okay, now that my rant is over, let me tell you more about the restaurant. The decor was really minimalistic as compared to the pictures in the actual site that had flowing curtains and Mediterranean carpets and made you feel as though you were in Greece or Persia. When you walk into the restaurant it is like any other bar/restaurant in that area, but a little more spacious.  Our waiter was like the invisible man, we saw him when he took our order, and when he gave us our bill. He tried to seem friendly, but it was obvious that he would rather have been elsewhere doing other things. The food as I said is really good but incredibly pricy for a restaurant in wicker park. I would not personally choose to come back to this restaurant and I really went there to support a really great performer Monica Da Silva.",0.9886,0.816,0.141,0.043,0.43774509803921563
2012-08-08,4.0,Really unique interesting food and drink with knowledgeable staff.  The ambiance is wonderful.  Beautiful hanging lights and cushioned seats with pillows.  It was easy to get a table without a reservation on this Wednesday evening.,0.9257,0.683,0.317,0.0,0.8666666666666666
2012-08-04,5.0,"Yes, this as about as good as it gets.  I'm a vegetarian, and ""mainstream"" restaurants don't often get 5 stars from me - usually due to lack of choice and/or lack of flavor in that one token vegetarian dish the chef thought to toss on the menu to appease us.  So not true at Taxim.  I had plenty of choices and everything we had was delicious. We started with the roasted eggplant with peppers dish and the beets.  Both were yummy, but the beets were outstanding.  The best part of the beet dish was the garnish of garlicky, herby greens.  I could have eaten a giant bowl of those greens alone and been happy-happy-happy. The next round was the lamb sausage (for my friend, which got a decent review) and the lentils for me.  Excellent flavor, albeit a bit overcooked for my taste.  I would have preferred them to be a bit al dente, but they were soft and a little mushy - but never mind the texture, they tasted great. We had good service, just attentive enough, neither pushy nor absentee.  and never pushy.  The waiter was friendly and offered suggestions, left us alone to eat in peace, but came back just in time to make sure we were taken care of. For a hot summer evening, we wanted a rose wine (a real rose, none of the white zin junk).  With two on the menu, one that was by the glass - the more expensive one and one that was available in bottle, a bit less expensive.  He recommended the less expensive one saying it was actually better than the pricer rose.  I like knowing that a waiter doesn't push something just to drive up the final bill. He was right.  Nice, dry, refreshing wine and just what we wanted. After sharing 4 small plates, we were stuffed.  I really wanted to try the artichokes, the Chicagopita and so much more, but there was no more room in this inn.  I'll be back.  I gotta love a place that I can return to wanting to try more dishes on the menu. Now, I'm off to buy beets (mostly for the greens) and see if I can recreate that dish at home.  And if I can't get close enough, I'm calling ahead next time to see if Taxim will make me an entire place of just the greens.  Those two tablespoons of goodness are worth the visit alone.",0.9975,0.767,0.195,0.038,0.5450902583255524
2012-06-05,4.0,"Went on a Friday night around 9pm. Moderate crowd. Nice amount of chatter in main room. Seated quickly. Our server COREY was amazing. He had a great command of the menu and was great with wine. I chose a rose that was a delicious , beet salad, shrimp wrapped in lamb , duck gyros, lambchops, and a few other things. The walnut purée stands out on the beet salad. There was also a pomegranate reduction that was amazing. All in all the food was terrific. I thought a little pricey, but COREY made up for that in service. Skipped dessert and tried some cordials. Nice dinner. Give it a whirl",0.9509,0.819,0.181,0.0,0.7172222222222222
2012-06-03,4.0,"I went here with the boyfriend.  We could not agree on an entree to split, so we split 1 cold plate and 3 hot plates which was enough for 2 hungry adults. Our server was encouraging us to order more food, but we were both completely stuffed after we finished our last plate.  Overall, our server took good care of us. We were looking to have a long relaxing leisurely meal and that is exactly what happened. There are definitely some gems on the menu, and they are worth trying. The absolute best thing we ordered was the grilled octopus. It was smoky and succulent. The second best thing was the Chicagopita, it was a little Spinach pie in phyllo dough, which apparently they make the dough there. We both agreed we would just come back to eat the octopus, the Chicagopita, and finally try the duck gyros.  As for things that were not outstanding -- our other two dishes -- the arugula salad and the lamb sausage were okay. The lamb sausage had the texture of breakfast sausage which is definitely not my favorite sausage.  The sausage is spicy too but they give you a healthy helping of yogurt to save you. This was the perfect place to have a nice leisurely romantical dinner.  Definitely make reservations on the weekends, it was packed when we arrived for our 9 pm reservations.",0.9952,0.739,0.227,0.033,0.5095238095238095
2012-05-25,5.0,"One of my fave restaurants in Chicago! The food is outrageously delicious, especially the baba and the beet salad.  The service is exemplary and the waiters are really cute. I can't recommend it enough.",0.7657,0.655,0.238,0.107,0.875
2012-05-25,5.0,"An exquisite meal, delicious, creative, and wholesome! Every time I come into town I make a point to come in--for Mediterranean this is as good as it gets.",0.8687,0.692,0.308,0.0,0.9
2012-05-23,1.0,"After 10 days in Turkey eating wonderful food, we went to Taxim hoping to recapture some of the flair of Mediterranean food. What a disappointment!  I had a chicken dish that smelled delicious. My first bite and all I tasted was way too much salt! I peeled off the skin to just eat the meat...and the meat had virtually no flavor. My girlfriend had the skewered pork and that, too, was overly salty. Olive oil soaked the food instead of being drizzled for flavor making the fries with her meal completely soggy. And it cost 3x a similar meal in Turkey.  We will never eat there again. I don't understand how anyone can say the food here is tasty. It's as if our US taste buds have been dumbed down so far as to accept substandard food and that we think Salt, lots of Salt, is the only spice in existence.",0.7568,0.866,0.085,0.05,0.6338383838383839
2012-05-05,3.0,"The decor and ambiance get a 4, but I couldn't give anything close to that for the food or sevice. While our waitress was very attentive and sweet, when we asked for a recommendation on a wine bottle, she suggested the most expensive ones on the list. The food was so-so. I went there with two friends and we shared 6 small dishes and an entree. One major sanitary concern I had was that none of the dishes came with serving utensils. I guess they expected us to use our already used, germy forks for splitting up portions. After an extensive wait trying to find someone to help us, we finally got the attention of a server to bring us a large fork. I would have expected each dish to come with one after this first request, but unfortunately the staff wasn't that intuitive. The chickpeas and beet cold plates were good. All the hot plates were on the oily side, but the tasted fairly good. The lamb was a liitle gamey and grisly...not exactly they best quality. All the dishes were very garlicky, so if you aren't a garlic lover, I wouldn't suggest eating here.  Not sure I'd go here again.",0.9786,0.821,0.146,0.033,0.5921012849584278
2012-04-29,2.0,"The ghost of Souk lives on. LOVE the Turkish lamps hanging from the ceiling, but as a nightclub, this place is a bit of a fail. The room is too long and skinny, and gets clogged. Hm. I'd try again, maybe, if in the area.",-0.532,0.806,0.061,0.132,0.4333333333333333
2012-04-01,4.0,"Love Taxim. Been here numerous times and I've never had a bad dish, bad wine or bad service. They have the best baba I've ever had.  Go here. You won't regret it.",0.96,0.565,0.435,0.0,0.5666666666666665
2012-03-11,4.0,"The 4 star rating is actually, for once, going mostly for service and atmosphere. The food was also pretty good, but nothing jaw-dropping. I wish I could give a 5 for service and 3 for food. The restaurant was pretty packed at 8:30 on a Saturday night but had thinned out by the time we left around 10:30. The ambiance is great and the decorations are awesome. I envy some of the art on the walls! Our server was great and had some good suggestions.  We split the ""pureed chickpeas"" cold starter (i.e. hummus), which was so delicious that we ordered a second one! The lamb sausage starter (which were pretty much gyros) was also quite good, but I remembered that I don't really like the taste of lamb, which was too bad. We both had the duck gyros as a main dish, which was delicious and unique. The duck fat fries on the side were bomb. My only complaint with the dish was that parts of the duck were a little gamey, which made eating the wrap hard at times. I found this restaurant based on SeriousEats.com's reviews of most romantic restaurants in Chicago, and I definitely will agree with that! The atmosphere was really great and cozy, but still had the trendy feel of hipster Wicker Park.",0.9948,0.67,0.25,0.081,0.6271505376344085
2012-03-07,3.0,"I'd really like to give 2.5 stars, but I'll round up to 3 because it definitely wasn't a 2 star experience.  We went on a Friday night with two other couples. Everyone ordered drinks and we also ordered a bunch of small plates, both hot and cold, to start us off. The server did a good job mixing my drinks -- I ordered a Tom Collins (which he served in the wrong glass, but it still tasted good) and then a Sidecar later. Also all of our small plates were very good and came out in a timely fashion. We got the eggplant, octopus, okra, squash rissoles, and the pork loin. The squash and the okra were my two favorites of the bunch. Very delicious, fresh, and well made. And the pita was addicting! Unfortunately, our entrees took a VERY long time to come out of the kitchen, and then everyone agreed that they weren't great. As a matter of fact, the consensus at the table was that the chicken was the best dish. *The chicken.* When is the chicken ever a restaurant's best dish? Everyone else ordered either the duck gyro, the fish gyro, or the lamb shank. They make their gyros with phyllo dough instead of pita. I'm sorry, but phyllo dough does not a gyro make. That was more like a Greek taco. While the duck was very good, I did not enjoy the wrapper; I took the phyllo off. I wish they had put that on the menu, because I wouldn't have ordered it. None of us ordered dessert. They automatically include 18% gratuity to parties of 6 or more. I didn't feel badly about that, however, because our service was really very good. And it was definitely bustling in there. All the tables were full and it was loud. The decor is nice (pretty standard/authentic Mediterranean), but they definitely need something to help soak up some of the reverberations.",0.9952,0.72,0.209,0.071,0.629774774774775
2012-02-05,1.0,Just stay home. Went last night had to wait over an hour for our food to be served. When it finally arrived it was so salty i could barely eat any duck.,0.0,1.0,0.0,0.0,0.3888888888888889
