date,star,text,compound,neutral,positive,negative,subjectivity
2014-11-14,3.0,"Sad to say, it seems things have gone downhill.  From the chipped plates to the nonchalant-bordering-rude service to the over-cooked and flavorless sea bass, there seemed to be many shortcuts taken during our visit.  Such a shame...we loved everything about Taxim for years.",0.2023,0.851,0.083,0.066,0.6599999999999999
2014-10-28,4.0,"Second time here, like the place. Had the Politiki Eggplant salad which wasn't anything special (it's just a puree type salad with pita), a small plate of fried squash with yogurt sauce which was very good but small and split the pork skewer entree - ended up being the perfect amount of food for two people and not overly expensive (only because we split the entree between two, if you try to fill up on small plates I can see it adding up.)  A good wine list and being able to easily get a reservation on a Friday night are a plus.",0.9399,0.831,0.154,0.015,0.6091468253968254
2014-10-10,5.0,"This is by far one of my favorite restaurants in Chicago.  However, it is hard to find, the sign is ridiculous and barely legible...make sure you have the exact address with you so you can find it.  They have a fantastic wine list and I have never ever had anything here that I did not think was delicious.   I always come with multiple people and we share a bunch of small plates.   My absolute favorites are the following: (this is their common names, not the names on the menu) Lentils Arugula salad Beets with feta, yes the beets are that good Fried cauliflowers....now I'm starting to look like a weirdo vegetarian, I am not Octopus - grilled to absolute perfection, you won't like it anywhere else Pork Belly Lamb chops (main dish) I don't think I have had anything on the bottom of the menu other than the lamb chops, which were phenomenal, because I like to share a bunch of the small plates instead.  I hate to have to choose only one dish!  It is perfect for ambiance for a date night or a small group of friends wanting to have some wine and share delicious food.  Ask for Cory if you there on a weekend.  He is great and can help with wine choices if needed.",0.9839,0.733,0.2,0.067,0.6371031746031746
2014-09-29,3.0,Must try the fried cauliflower. Absolutely delish! However the quail not so much. Ours seemed to have been reheated from a prior day. Might return with friends who are interested in dining.,0.7263,0.826,0.174,0.0,0.4
2014-09-21,3.0,"There are a lot of things I like about Taxim -- the location, the menu, the fun Greek wine list, the fact that they take reservations, and those reservations are not impossible to come by even at peak times.  Unfortunately, one of those things is not really the food.  The food is perfectly fine -- grilled octopus, lamb sausage, shrimp wrapped in grape leaves, etc. are all done competently, but none of them make you go ""oooh.""  And Chicago is a place sufficiently full of restaurants that make you go ""oooh"" that that is a problem.   On the other hand, a lot of those places either don't take reservations or they're too hard to come by . . . . which is why I sometimes come here.  Think of it as an emergency workhorse, not a destination to impress.",-0.2867,0.822,0.085,0.093,0.5033333333333334
2014-09-01,5.0,"Place is outstanding, I had been here once years ago and been meaning to return. I highly recommend the grilled octopus and squash fritters. This is a great place for a family dinner. Its in the shadiest area of the Damen/North/Milwaukee exchange as the Double Door is right next to it, but that shouldn't keep you away. Get: grilled octopus, its a must, like nothing else you will ever have. This place is a true gem in wicker, I hope it stays around for many more years. Ambiance, service and food are all A+, bravo.",0.9354,0.835,0.165,0.0,0.48341269841269846
2014-08-22,5.0,"Chicago favorite after the first visit. Octopus is great (4 of us ate 3 orders). Everything else we had, I would readily order again as well. Only downside: plates are too small for anything more than a taste. Still definitely worth it.",0.8957,0.676,0.283,0.041,0.5729166666666665
2014-08-18,3.0,"Reading the reviews I was anticipating small portions with the tapas.  We ordered 5 plates from the right column and that was more than enough for 2 people.  In fact, we had to take home more than half of 2 of the plates (smoked pork belly and the wood grilled octopus) because we were full.  In terms of the actual plate portions, there was a decent amount of food in each plate to share and sample for a table up to 4 people.  The prassopita was my favorite followed by the pork bellly.  The grape leaf wrapped shrimp was also delicious.  The octopus would have been great if it wasn't so salty. Outdoor seating is available, but can be cramped and distracting with the people walking by on Milwaukee.  We opted to sit indoors along the front windows so we were still able to people watch in the comfort of A/C and a more quiet setting.  Service was great - I was able to sample some of the wine before making a decision.  Our server made great recs especially since I wasn't as familiar with Greek wines. Was a little disappointed they didn't have traditional baklava for dessert.  The closest thing is the Saraglí me stáka Krítis, but by that point I wasn't interested anymore.",0.9281,0.855,0.103,0.042,0.5635531135531135
2014-07-20,5.0,"Overwhelmingly great service. Thoroughly knowledgable and guided me and my guests through a wonderful meal.  Highlights include grilled octopus, tomato salad, grilled lamb and lentils.  Also, excellent selection of hard to find Greek white wines.",0.891,0.668,0.265,0.067,0.548611111111111
2014-07-04,2.0,"While the appetizers were good, they were tiny. It felt very stingy. We ordered fish for our main meal. It was seasoned well, but it was not clean on the inside. My boyfriend is from Turkey and he eats whole fish all the time. He immediately knew that the fish was improperly cleaned such that there was dried blood all over the inside that made the fish bitter. While we were displeased with the cleanliness of the fish, we were more displeased with the way the waitress handled the situation. When we told her about the fish, she asked us if she should consult the owner. After consulting the owner, she asked us if we wanted a new fish, but since we had somewhere else to be soon, we said no, but my boyfriend wanted to show the waitress what dirty fish looks like as a favor to the restaurant, so they make sure the fish is clean in the future, and as he was opening up the fish to show her, she literally just walked away. I was stunned.... it seemed like she really did not care about the customer. I was sure they were going to compensate us somehow since we did not eat half of our fish and we did not take them up on their offer to get a new one. Disappointingly, they charged us for everything, including the coffee and dessert. Overall, the restaurant felt very stingy. This is not how a professional business should deal with their mistake. Honestly, if the waitress had given us something for free as a apologetic gesture, we probably would have come back. If you are looking for an authentic Greek/ Mediterranean dinner, just go to Greek town. You will spend half the money and get equally good and definitely cleaner fish, and better service.",-0.1547,0.763,0.117,0.119,0.45995561677379854
2014-06-27,5.0,Mediterranean tapas with some of the finest indigenous wines ! Staff was super knowledgeable and food was unreal! Not your typical Greek food. The homemade Tzatziki was crazy good. Everything was fresh.  Thanks David and the rest of the staff for an amazing experience.,0.9323,0.663,0.294,0.043,0.5333333333333333
2014-06-20,3.0,"Good food, but WAY TOO SALTY! Too bad, as we would have come back. Oh, and avoid the cocktails.",-0.784,0.62,0.076,0.304,0.4222222222222222
2014-06-16,5.0,"Just finished another great dinner here. We came back especially for the whole grilled sea bass and it did not disappoint. This is a fantastic Greek restaurant and not at all like the saganaki palaces you will find on Halsted. Sure you'll pay a bit more, but you'll get flavors that will satisfy your senses and not dry protein that will only fill your oversized belly. We took each of our parents here and as picky as they are, they were able to recognize that the ingredients were fresh, the recipes authentic and the kitchen's ability genuine. I'll be coming back more. Especially for half-off bottles on Mondays. Thanks Taxim!",0.9525,0.806,0.172,0.023,0.5586257309941519
2014-05-25,3.0,"Overall: great place to share (great for larger parties) a bunch of different Mediterranean plates without feeling overly stuffed! Likes: - small plates are delicious, especially lamb, octopus, and hummus - Amish chicken main entree was cooked perfectly and really flavorful - reasonably priced bottles of wine Gripes: - portions are small, but food is relatively quick if you need to replenish small plates",0.8445,0.809,0.172,0.018,0.5864583333333334
2014-05-25,2.0,"I wish that I would have gotten to try this place.  I checked their hours on yelp, as my cousin and I were in Wicker Park.  The yelp hours said they were open until 9:30, and we got there at 9:10pm,  I live in Logan Square and typically am not in the hood.  Spring/summer always springs my interest in Mediterranean food, as it is typically light and refreshing.  We saw one open patio table, and we walked inside to a nearly empty dining room. Bi said hello, and asked the gentleman at the counter if we could possibly take the patio table.  He said, ""I'm sorry, but we close at 10, and are not taking anymore guests.  I was shocked by 2 things, the first that they did not want guests that were dining for a quick late dinner 50 minutes before he said they closed.  The second that their hours online and on yelp said that they closed at 9:30.  I have been in the restaurant business for 15 years, and shocked that I was not offered a solution to either sit inside, or to order food to go.  I was very disappointed, none the less.  Hospitality and service are supposed to be the base of our industry.  I guess that is dead in this part of the city.",-0.9579,0.88,0.017,0.102,0.5654761904761905
2014-05-19,2.0,"When the menu says small plates, it means small plates. I spent $35-40 here and felt like I hadn't eaten anything. I think this place is way, way overpriced for what you get. The food wasn't bad, but nothing was great - and the whole time you're thinking, ""Where's the rest of it?"" I went to a place in Greektown a few months ago, spent a fraction of what I spent at Taxim, got a giant plate of delicious lamb (not to mention some veggies and two giant slices of warm pita bread) and left feeling completely satisfied.  I'm a quality-over-quantity guy, but both the portion sizes and the prices here are just pretentious. I'm guessing Taxim gets away with it because there's really no Greek competition in the area. That said, I probably won't be back.",0.3987,0.799,0.117,0.085,0.462037037037037
2014-05-18,4.0,"Love the interior decor! Seems authentic to somewhere beyond US boarders. The food was excellent, especially the roasted beet salad. We didn't have to wait for a table, for service, or very long for our great food.",0.923,0.729,0.271,0.0,0.77
2014-05-07,4.0,"Went here on a mini date with the bf and we were really happy. The place itself is really pretty, but it's VERY loud, so beware. The food came out quickly and was well paced. We split about four small plates, had a couple glasses of wine, and had room to split a dessert and left feeling pretty content! I will definitely be back.",0.9495,0.753,0.247,0.0,0.6125
2014-04-20,5.0,This was a last minute brunch idea on our last day visiting the Bucktown/Wicker Park neighborhood of Chicago and it turned out to be a wonderful surprise and  an amazing dining experience. Both the Food and service was beyond our expectations and would love to return. Every single  dish we were served had character and flavor we have not experienced before. We were told the owners were from Cyprus.,0.93,0.82,0.18,0.0,0.535374149659864
2014-04-20,3.0,"Stopped by here for dinner last night after hearing that the place had great food. We were seated right away and our waitress was really sweet.  For drinks, we had wine and beer. I was really looking forward to a cocktail. I hope they add it to their menu again! We started off with the arugula salad and the pork belly. The pork belly was delicious ! The arugula salad, though, was almost inedible because of the amount of salt on the salad! On the description it sounded kind of like the Middle Eastern fattoush. It was obviously their twist on it, just WAY TOO MUCH salt ! We got the lamb chops and chicken. The lamb chops were delicious. The chicken had a great crunch to it and the potatoes were great. But again. A super heavy hand with the salt. I ended up drinking more water than the wine I ordered because of how salty all my items were. Boo. I was looking forward to a nice buzz with my meal! For dessert we had the loukemades and chocolate dish. YUM! Both came out amazing and hot.  Overall, the location is great, the space is beautiful and service was solid. I wish that half of our food wasn't tainted by the overkill of salt and that their were cocktails on the menu !",0.9949,0.773,0.219,0.008,0.6013736263736263
2014-04-08,4.0,"The food was excellent and the service was awesome.  Great greek wine list, lamb chops and lamb shank were excellent as was the whole fish. Octopus app was outstanding, very tender.  Great flavors in the greens as well.  Will be back!",0.98,0.566,0.434,0.0,0.6075
2014-03-22,4.0,Ok...the food was awesome. That said it was....in my opinion very slow. It seemed like we were there forever and we were basically the only people in the place. It was also more expensive than I would have guessed.,0.765,0.845,0.155,0.0,0.744
2014-03-10,2.0,"The servers don't seem to care. If you're going in the winter be sure to tell them you don't want to sit next to the huge front windows adjacent to the door because, surprise, it's unpleasantly cold. I was on a date and had to wear my coat the entire time. I also made my reservation 2 weeks in advance, so it's not like I was a walk in and that was the only table left, they assigned the unfortunate table.  Additionally, while the rest of the restaurant had wonderful lighting with a romantic ambiance, we sat under a glaring spotlight of fluorescent. Although the appetizers were delicious, I would not recommend the experience to anyone.",0.7555,0.773,0.135,0.091,0.7194444444444444
2014-03-04,3.0,"Delicious lentils, octopus, chard, baba ganoush -- food was a 4, but overall a 3 experience.  The place has a pretty weird vibe despite some cool elements. Poor design. Though euro-style seating (ok), had an empty/cold feel, perhaps created by odd entry situation. Service was friendly, but forgot a bunch of items and rang up bill incorrectly 3 times. Was encouraged to ""apply the overcharge"" to more wine? Drink away the difference? Just my money back please...",0.7556,0.684,0.188,0.128,0.5454545454545454
2014-03-03,5.0,"Place has very good food, great service (although it was near empty when we went) and the prices were acceptable.  All in all, good experience.  For that 5 stars from me.",0.9052,0.627,0.327,0.045,0.6060000000000001
2014-02-17,4.0,"Taxim has quickly become one of our favorite places to visit.  We have come here with a party of 2 and with a party of 12.  We have been dressed up and we have been wearing hoodies.  The overall decor is nice and the light fixtures are stunning.   Every time we visit, we have experienced very good service.  We are unfamiliar with Greek wine, but our servers always offer samples to assure we are happy with the wine we order (much appreciated).  My favorite dish from the ""Salads and Vegetables"" section of the menu is the Fakés Kas. Fróssos - lentils with house made feta and a balsamic reduction.  The acidity of the vinegar balances the lentils perfectly, and the feta is unbelievable.   In the small plates section, you must try the fried cauliflower with capers and the wood grilled octopus with fennel.  The octopus is charred nicely and I love the crispy ends.  If you're being adventurous, get the ouzo (an anis flavored apertif) that is paired with the octopus.   For entrees, you cannot go wrong with either of the lamb dishes**.  The duck gyro is also delicious, but it is a bit underwhelming in comparison to the ridiculously good lamb dishes.   Overall, if you're looking to have a wonderful and authentic Greek/Mediterranean experience, Taxim is your place.  If you've been on the fence about visiting Taxim or simply haven't gotten around to it yet, Taxim should shoot to the top of your list. **I was watching TV the other day and my Tivo changed the channel to record an old episode of Iron Chef.  The Chef of Taxim, David Schneider, was the challenger at kitchen stadium!  I know, I know, it's old news, but I thought it was cool.  The secret ingredient was lamb, and the judges went nuts over his main entree.  This chef knows lamb.",0.9956,0.779,0.195,0.026,0.6389211309523809
2014-02-15,4.0,"BF and I went there for Vday prefixed 4 course menu that was offered.  Do not take the seat by the window. I was expecting a romantic and dim lit setting, when I walked in I was slightly disappointed. It was quite loud in there and a huge crowd of people was standing right in front waiting to be seated. We were sat by the window as that was the only table available. I asked for another table but was told there'd be a wait and if anything becomes available they'd let us know. It was freezing, the windows were all steaming and wet that I kept hitting with my elbow and everyone waiting was looking right at us...uncomfortable. I was disappointed and my bf was mortified as he tried to take me to a romantic place...as advertised.  Our server Cory was very nice and pleasant. I asked him again to keep an eye for an available table and one did become available after we had our salad (30 mins into our meal). Appz came out pretty amazing and delicious. We had the octopus, the beet salad and for main dishes lamb and fish gyro. Lamb was perfectly cooked and fell off the bone, very flavorful. Unfortunately the fish gyro was extremely over salted. I had let the server know and he said I couldn't get another main dish unless it's the vegetarian one or I can get 2-3 small plates. We ordered another 3 small plates - pork, another octopus and and shrimp in grape leaves. Absolutely delish! Overall I wouldn't come back there for a date but I'd go with a group and order mass of appz to share. FOR THE STAFF: offer coat check when people walk in please.",0.9879,0.828,0.137,0.035,0.6227342549923194
2014-02-12,5.0,"Exceptionally well done full flavored menu of small and large Greek and Mediterranean dishes. Vegetarian, vegan, gluten-free, and pescetarian diets easily accommodated. Beautiful clean understated ambience with very good, attentive service. Oak wood grilled proteins, fresh fish, pork, lamb, vegetable, and dairy all found on the menu. In house made pastries, bread, sausage, yogurt and more.  Most of the menu is unavailable elsewhere. Bring your appetite, sense of adventure, good company, and be prepared to pay commensurate with the quality of food and presentation, as well as service.  Decidedly in the special occasion category price point. I look forward to returning, when we want to splurge! Miranda provided excellent menu guidance, displayed patience, and gave attentive, unobtrusive service with a smile. Try Taxim, you'll like it.",0.9878,0.723,0.267,0.009,0.6257407407407407
2014-02-12,1.0,"Having worked in the industry... WOW! What a bunch of pretentious, lying d-bags.. Seriously.  The food was NOT worth the prices they were charging and the customer service is worse than calling ComEd. If you're looking for expressionless faces, rude service, bland food, and wee-tiny plates of inauthentic Greek food: this is the place. Beware! Stay away from this place (or drop $200 on a sub-par meal with the worst service I've seen in ages).",-0.8898,0.727,0.072,0.201,0.6111111111111112
2014-02-08,5.0,This place was DOPE. Very well thought out menu and carefully planned out flavor profiles.  Try the Lentils. Wow.,0.7713,0.675,0.325,0.0,0.7666666666666666
2014-01-28,2.0,"Went here on a Saturday night and it was very busy! So that being said the service wasn't the best.   We ordered three appetizers/small plates. The octopus which was recommended to us was over cooked and tasteless. The prassopita was decent and the hummus we ordered was forgotten about by our server; he apologized and brought it out later.  As for the main dishes the half roasted chicken was very good, but the lamb shank was almost impossible to eat. The orzo it was served with so either so undercooked or burnt you couldn't chew it! The server brought us new orzo but by the time that happened we were finished eating.  Overall not worth it. There are better authentic Greek restaurants out there!",0.6416,0.882,0.075,0.043,0.4557007575757575
2014-01-25,3.0,"Went with a friend and shared the small plates.  Food was ok and would rather go to Greek town than go back.   To start we got the fried cauliflower and capers.  Both of us thought this would be flavorful and tasty.  What came to the table looked like heavily breaded popcorn shrimp!  The cauliflower was drowned in coating. Second dish was the beet salad.  Tasty, but nothing over the top.  Came with walnuts, greens and feta.  Flavors worked well. Third dish and the most flavorful was the lamb shoulder with house made yogurt and grilled tomatoes.  Yum!  If I did go back, this would be a dish worth getting again.   Also, as mentioned in other reviews, the tables are much too close and you end up hearing the other tables conversations.   All in all, glad I satisfied my curiosity, but would not make the trip back.",0.9185,0.848,0.124,0.028,0.30833333333333335
2014-01-21,5.0,"With all the restaurants opening and closing, it's hard to visit restaurants that have been around for a while. Taxim needs no hype, it is fantastic all around.  Every dish ordered was great, the decor simple, tasteful, and creates the perfect holy Greek ambiance.  Favorites include goat-stuffed quince, grilled octopus, lamb shoulder appetizer, and the absolute standout: seafood soup with sunchokes - do not order the small size, you will want every last drop.  For our anniversary, they brought a complimentary bottle of sparkling wine and  dessert (fried dumplings with wildflower honey, rose cream, and cinnamon)- it doesn't beat that!!  I love the regional focus of the dishes and wines. Loading up on appetizers is a great way to go here, but next time we must try more entrees!",0.8777,0.806,0.138,0.056,0.5476984126984127
2014-01-05,4.0,"Deliciously prepared Greek / Mediterranean food can be found here.  Everything I had was well crafted and thought out - favorites being the wood grilled octopus, the savory duck gyro, the goat and bulgur stuffed quince.  On a couple of dishes they combined savory with sweet (utilizing pomegranate sauces/seeds) and it turned out well.  The service was good and I also enjoyed the environment - simple and comfortable with copper topped tables, lots of pillows and pretty lanterns.  Taxim is added to my short list!",0.9771,0.713,0.287,0.0,0.6007936507936509
2013-12-31,3.0,"As others have noted Taxim has been Yelped enough to give anyone the idea of what they are about.  We tried them out with two long time Chicago friends, with whom we have dined on numerous occasions.  Liked the atmosphere and decor of Taxim.  Wife was extremely impressed with the overall atmosphere, which we considered evocative of a European (Greek?) establishment.  We liked the idea of Greek and small plate offerings.  Tried out the appetizers and found them generally good.   After negotiating over the wines and a bit of tasting, as the waitress's nomenclature and our understanding were not too close, we finally found something to our liking.  The main courses, on the other hand turned out to be problematic.  Our friends had lamb chops (looked great and they approved), but we have an entire lamb in our freezer at home, so I ordered the Greek Chicken and wife another appetizer, with the intention of sharing some of my chicken.  Unfortunately, said chicken came out seriously pink in the middle, as in very undercooked.  Sent it back.  New chicken delivered, well cooked but about 20 minutes later, so that sort of threw a wrench into the overall flow of things.  Drink more wine and forget it.  I should add that the second chicken was excellent, and the quantity as advertised.  We started at about 6 PM, fashionably early, but by 8:30 when we left, the place was pretty noisy.  It seems like the dining scene is done at high volume just about everywhere in Chicago.",0.9702,0.826,0.131,0.043,0.4796810207336522
