date,star,text,compound,neutral,positive,negative,subjectivity
2017-08-28,5.0,"Had a fantastically delicious Greek meal here with a bottle of Grecian rose wine, sitting at the sidewalk tables on a warm summer evening. The restaurant was capable of catering to my friend's pretty complex dietary restrictions with grace and deliciousness, as my other friend and I enjoyed the classics straight off the menu. Only wrinkle was momentary harassment by homeless person walking by, and that was not long lived. They also have a roof top dining area, which would have been perfect, but was already fully booked.",0.9136,0.754,0.222,0.024,0.6232142857142858
2017-08-28,5.0,I LOVE this place. Don't be intimidated by the unique and foreign menu. There's a lot of Greek but the food is familiar and not too adventurous. The lamb kebabs are always a group hit. I like their wine selection and I really enjoyed the shrimp grape leaves (just be warned they're a little spicy!) My brother in law wanted an Irish coffee and instructed them how to make it and they were troopers! It wasn't even on the menu!,0.8584,0.783,0.157,0.06,0.48055555555555557
2017-08-24,2.0,"Yikes, the service was so so bad. The food was quite good once it finally arrived, but it was like pulling teeth to get it, or even get anyone to come to our table. It was empty when we went for brunch on a Sunday morning around 11am, which should have indicated something. We did sit on the rooftop terrace, which was beautiful. We ordered a variety of brunch dishes, including a side of fruit. I saw the table next to us with a beautiful plate of fresh figs, so I asked the waitress if we could get the same thing as an appetizer. She didn't know what all was on the fruit plate listed on the menu (despite carrying it out minutes earlier for the other table), so I pointed and she confirmed it was the same dish, that we could get it as an appetizer. I ordered the Kayiannas, a veggie scramble. I got it with the potatoes. Fast forward to 30 minutes later and the fruit shows up. 30 minutes to cut up a small plate of fruit? Eventually, yes, our food did show up. It felt like an hour, but it was probably closer to 45 minutes. The food tasted amazing. I did ask for ketchup, then hot sauce, both of which they didn't have. The food runner also said they didn't have ""any sauces,"" so I asked for the red pepper sauce that was on my friend's plate. He brought some, about 10 minutes later. We were eventually able to get the check (another 10-15 minute wait) and get out of there, but not without an active search for the waitress.",0.9811,0.859,0.114,0.027,0.5166666666666666
2017-08-22,1.0,The worst service. We sat for 30 minutes without drinks got some mediocre appetizers and finally decided to leave. Oh and they informed us the oven was broken quite limiting the menu.,-0.8126,0.775,0.0,0.225,0.85
2017-08-19,3.0,"Ate here last week when I was visiting family. Definitely a great place to bring a big group since a lot of the dishes are shareable. I wasn't too crazy about their hummus, and a lot of the food was really salty causing some heartburn later. I ordered the duck gyro, and it came out deep fried. Was not expecting that all, creative and tasty, but if you're wanting a real gyro do not order this item.  The desserts are to die for! We all shared their donuts which literally melt in your mouth.  I would totally come back here again, and ask to cut down on the salt",-0.0834,0.828,0.1,0.071,0.3962962962962963
2017-08-19,1.0,"Can't say enough about the views, great rooftop, but the service was so beyond terrible it pretty much ruins the dining experience.  Food was ok. First, one of my biggest issues with restaurants is when they force you to place your entire order all at once telling you they will portion it out.  It's usually a way for them to rush you through the meal to turn tables faster.  However, we had even a worse case when our group of 6 all had our entrees come out 5-10 minutes apart.  Nothing like going to dinner with other couples only to eat separately or cold food. We told our waitress and she didn't care. Second issue is the terrible service and then automatically having a generous tip included for you.   Third is when we mentioned the experience and issue we had with service to manager upon leaving he just said yeah they are short staffed and nothing beyond that.  THATS NOT A GOOD EXCUSE when running a restaurant.   Won't ever be back - poor service kills restaurants, don't put up or support it",-0.0716,0.724,0.142,0.134,0.5087301587301587
2017-08-12,5.0,"Visit Taxim on a Friday night (8-11-17) at 8:30 with my wife and son. Arrived to a nice main floor dining room that was empty, but were seated to a packed rooftop dining area with a good vibe.  This is a fantastic, fair priced restaurant that had attentive service, a great selection of Greek wines, and food that didn't disappoint. We ordered a really interesting bottle of red wine that was chilled and really complimented the food. We ordered three tapas, the heirloom tomatoes with red peppers and feta, the fried cauliflower and the ground lamb with grilled tomatoes. All were delicious and we ordered a second plate of the heirloom tomatoes.  We added two entrees, the lamb shank with orzo and yogurt and the oven roasted eggplant.  All were delicious and perfectly prepared. With one desert, our total bill for 3 was $165.  With the ambiance and perfect weather on a Chicago night, it was well worth every penny.",0.9958,0.694,0.299,0.007,0.5716666666666667
2017-08-09,1.0,Poor service.It took them 1 1/2 hour to bring some of the food we ordered on the table. We had to cancel some of the dishes because they were so late. When we complained the waitresses were rolling their eyes. Also they charged a small salad (side size)for $10.00. When we asked to talk at the manager he was not present. Never going back.,-0.8225,0.858,0.0,0.142,0.3
2017-07-30,5.0,They take exceptional care of their customers!!  I dropped my wedding band through the roof deck boards while eating dinner last night and this morning the owner went above and beyond to find my ring.  They gave me coffee and were so kind while I anxiously waited. Dinner the night before was excellent!!  Can't say enough about their wonderful service!!!,0.943,0.743,0.226,0.03,0.6958333333333333
2017-07-29,4.0,"Pricey, but the food and ambiance are 2nd to none. I would recommend waiting for a rooftop table, where there is also a full bar. Great for a Chicago summer.  The kabob yogurtlu was delicious and I'd recommend their veggie dishes as well. The cocktail was repulsive, but I guess I am not really into bitter olive juice mixes.",0.9235,0.681,0.241,0.077,0.5
2017-07-28,5.0,"I'm not even into Greek food but I could've eaten here twice in the same night. All of the food was phenomenal (especially the shrimp wrapped in grape leaves, the roasted peppers, and the lentils), the service was excellent, and the rooftop patio was perfect. Definitely coming back.",0.9398,0.763,0.237,0.0,0.515625
2017-07-23,4.0,Excellent food. Excellent ambience. The veggie and seafood options are great and the lamb is outstanding. Booze is expensive but the excellent ambiance and rooftop makes it a great spot for a celebration of special occasion.,0.975,0.529,0.471,0.0,0.8308035714285714
2017-07-23,5.0,"We ate here last night, and were able to sit on the rooftop, which had a great ambiance. After first beginning with cocktails, they were strong and tasty.  For food, we had some small plates, appetizers, a lamb entree, and two desserts with coffee. Everything was great! Seriously, it was one of the best meals I've had in a long time and the prices were reasonable. I will definitely recommend to friends",0.9738,0.698,0.282,0.02,0.5104166666666666
2017-07-09,3.0,Three stars because the rooftop is adorable. But the service and food was not good. Overpriced and just mediocre. Wouldn't come here again. Luckily insomnia cookies was across he street!,0.6582,0.746,0.188,0.066,0.8583333333333334
2017-07-07,1.0,Giving only one star because of two things! 1. The service was terrible. We were table of 9 people and it happened that i ordered greek salad and octopus appetizer. After i got both orders I didn't receive silverware for 40min. And i asked twice for it! The appetizer got cold and I returned it. 2. One of my friends ordered dinner meal and he never got it!!! It was so weird because he ordered first and I thought maybe if he was second or last the waiter may have forgotten him. On top of that they served my friend only a little tiny appetizer to apology.  When we got our checks 20% gratuity was already added. I don't think that's fair.,0.5668,0.825,0.102,0.073,0.6
2017-07-04,4.0,"After hearing a positive review from my girlfriend, I was excited to experience Taxim and Greek food in Wicker park! I would say a 4 Star Rating is perfect for this restaurant as you are getting some of the better Greek food in Chicago but not the best. I enjoyed some lamb dishes and hummus on a family dinner that we enjoyed at Taxim. I believe it was BYOB correct me if I am wrong which is always a huge plus. I would likely go back but I most enjoy Green Islands and the other Greek restaurants close to me in the west loop aka greektown. However, Taxim is definitely a quality option if you live in Wicker Park and are craving Greek food!",-0.2852,0.743,0.14,0.117,0.47478354978354986
2017-07-03,5.0,"Came in for dinner this weekend and I was definitely very impressed.  We were able to sit on the rooftop which was perfect for the beautiful summer evening. Service was very accommodating and was able to identify which menu items were and were not gluten free. The food was amazing! I enjoyed the octopus, lamb kebabs, heirloom tomato salad, and tzatziki immensely. Our waitress was also very helpful in picking out a bottle of Greek wine and was able to let us taste between two bottles so we could be sure we liked what we ordered.",0.9789,0.722,0.255,0.023,0.7042592592592594
2017-06-04,4.0,"If you're craving high quality Greek food, Taxim has that.  They have so many appetizers/small dishes to choose from, and everything we ordered was great.  I really loved my dish- the braised lamb shank.  It was tender, tasty, and juicy.  The presentation was also very neat!  Next time, I might try the duck gyros!",0.9212,0.801,0.199,0.0,0.4128571428571428
2017-05-31,1.0,"The food here is pretty good--it's not great, but I enjoyed it.  The rooftop is very nice, and was a big part of our decision to trek out here from downtown on our vacation.  The service, however, pretty much ruined the experience.  The restaurant was not busy, and it seemed overstaffed if anything, but for some reason the service was slow and awful.  They were out of the ""wild yeast bread and goat butter,"" so instead we were given some dried up chunks of grocery store bread (for which we were charged!).  The food took forever to come out, and it did so in a trickle.  We didn't have any napkins or silverware at first, and it took forever for these to come out as well.  As a result, we ended up eating a lot of things lukewarm, and when the last dish arrived (we assumed it had been forgotten), we were ready to be done eating.  Our water glasses spent most of the evening empty, and we had to flag someone down for the one refill we did receive.  At about $100 for a glass of wine and just a light dinner (no main courses) for two people, I wouldn't say this is remotely worth it.",0.2338,0.847,0.081,0.072,0.49419191919191924
2017-05-21,5.0,"Wow...walking down Milwaukee, I saw that my favorite Greek spot TAXIM started a ROOFTOP BRUNCH.. So good!   Baklava pancakes, tsoureki french toast, a Greek yogurt bar, chicken gyro benedict, cappuccino fredos, frappe, apricot mimosas and raki bloody marys.  What else could you want on a beautiful sunny Sunday morning.",0.8906,0.692,0.257,0.051,0.5265432098765432
2017-05-18,5.0,im updating my review because ive been back at least 20 times and still have not once had even an average experience. always exceptional. I dont know how they do it. The new rooftop is awesome. I feel like im on vacation. it is my favorite place in the city to go and i have been to a lot of the new trendy restos.,0.8625,0.856,0.144,0.0,0.6232323232323231
2017-05-17,1.0,Tried going here for date night last weekend- but they apparently weren't interested! I called in earlier in the day to see if I could make reservations for 2. They said no- it's first come first serve- cool. Showed up at 8 and they asked me if I had reservations. I said no. They looked for a couple minutes at the table map and said they couldn't accommodate us for awhile. We said that's fine. They didn't say anything- so we said- would you like to take down our information? They wrote down our number. Not surprised to say they never called us. Went on OpenTable- sure enough they DO take reservations. Not sure what their problem is or where they get off being so stuck up and standoffish to their customers- but I won't be back.,0.2336,0.777,0.121,0.102,0.4659259259259259
2017-04-28,5.0,"Fantastic!!! The most delicious food in bucktown! Everything is flavorful and perfect. We got the octopus, half chicken, okra, and artichokes. Every single dish was incredible and I have no doubt the rest of the dishes are too. I'm shocked this place isn't jam packed.",0.8157,0.661,0.217,0.122,0.7145502645502646
2017-04-04,4.0,"You're not going to get your typical Greek food here.  This is Greek food, but with more eloquence and better presentation.  It also has some American fusion with the dish, not much, but enough to be different.   I ordered the beet salad and duck gyros. Before you think anything, it wasn't what you think.  First, the beet salad was thinly sliced (hoping for a bigger portion) with a garlic sauce around it.  The garlic flavor wasn't strong, and almost had a hummus texture.  It was excellent.  The duck gyros was unlike what I have ever had.  They season the duck gyros similar to a regular gyros without ruining its texture.  They then wrap it in a phyllo dough, so it kind of looks like a greek egg roll (and almost feels like it, too).  They have a great Greek wine selection and it was very enjoyable. I had a Sauvignon Blanc from Greece and it was a clean and crisp wine. The servers were helpful and attentive.   I recommend this place to anyone coming for any occaision.  What a great place to try something new and out of the box for Greek food.",0.992,0.778,0.205,0.017,0.45721488388155057
2017-03-22,4.0,"A group of about 20 people from my workplace had dinner here on March 13.  Dave worked with me to preorder a few Small Plate options and Taxim allowed me to sample a few wines as soon as we got checked in. They have a wide selection of wines and I selected a couple which turned out to be a hit with my coworkers. Their small plate dishes were the Best I've tasted. The shrimp wrapped in grape leaves, ground pork & lamb just delicious to name a couple. Our servers were very attentive as well. There were at least 3 people who complained about their main dish: 2 veggie dishes prepared with too much olive oil and fish that smelled too ""fishy"" ....indicating what? I had the sea bream gyros and it was totally new to me. It wasn't that It was not a good dish, it was that I envisioned something like a fish taco. I couldn't keep my eyes off Rudy's lamb chops though. I would definitely return and try a different main dish. I want to give Taxim 4.5 stars. Thank you Dave and Whitney for a great evening.",0.9593,0.842,0.131,0.027,0.44840067340067336
2017-03-19,4.0,"I won't even attempt to call things by their menu names.  It was our first time here so we opted for small plates so we could try a variety of things.  Hummus - nothing bad to say, nothing good though. We arrived early and they had just opened not long prior so I suspect it was still cool from the fridge to showcase any acid flavor.  Baba ghanoush - just as cold as the hummus but damned flavorful. I could taste balsamic vinegar I think - probably from the roasting of the eggplant. I would get this again without pause.  Fried cauliflower- we like cauliflower but the other yelp pics and mentions made us know we had to try it. It's very good. But you do need to eat it with the accoutrements in a single bite to get the full perspective.  Leek pastry - the dill is prominent in this, so if you don't like dill, not for you. But we thought it was delicious! Mushroom flatbread- wow! This was the hit. Lots of flavor. The egg yolk was a lovely addition.  If you're not familiar with the hood, it's very young. Lots of restaurants and bars. But a little filthy and sketchy character laden.",0.9679,0.822,0.132,0.046,0.597108843537415
2017-03-04,5.0,Great service and excellent food. They did a great job of making us feel comfortable with menu and giving recommendations. The kebab and hummus were excellent. Really enjoyed it and will be returning.,0.9774,0.501,0.499,0.0,0.8333333333333334
2017-02-20,4.0,Highly recommend this unique Greek restaurant.  Shared this place with family.  We ordered the lamb shank and Quail.  The Quail was amazing.  Expect to wait on food.  Great Ambiance and service.,0.92,0.673,0.327,0.0,0.638
2017-02-11,5.0,"Taxim is the first place in my neighborhood that I vowed to come back in the future. The wine is incredible!! The food is very good and the portions are large. The ambiance is really nice too, even as the restaurant became crowded. It really reminded me of being in Europe. Honestly, I recommend this place to friends all the time.",0.9379,0.777,0.223,0.0,0.5185449735449735
2017-01-24,5.0,"I can't pronounce anything on the menu, but who doesn't like Cretan pastry with fresh fennel, spring onions, sesame and Greek yogurt?  I also tried the orange-braised pork, stuffed cabbage barley and chestnut pilaf with fresh cumin.  Taxim offers meat and vegetarian recipes from the mountains, island and villages of Greece.  This was one of the best meals I had all year and I was still thinking about it the next day.",0.876,0.817,0.149,0.034,0.21666666666666667
2017-01-23,5.0,"As a Greek with a Greek wife that is an amazing chef, I have to say this is the best Greek Restaurant I have ever been to.   From the very unique and cool decor to the amazing menu this was my by far my favorite restaurant in Bucktown/Wicker Park area.    I have since moved to the burbs but will always go out of my way for Taxim!   The shrimp wrapped in grape leaves, the Lamb Kebar, and the Beets are among my favorites.   The Halva is also a great desert.",0.9629,0.787,0.213,0.0,0.5909090909090909
2017-01-21,4.0,"Attentive service, nice ambience (although a little loud). The spinach pie and artichoke/ potato dishes were incredible. I would give the fries cauliflower and babaganoosh (eggplant dip) a pass. Great place if you're craving Mediterranean food but don't want anything too heavy, since most dishes are tapas.",0.4796,0.876,0.095,0.028,0.7312500000000001
2017-01-06,5.0,"The grilled octopus may be one of the best dishes in the city and that's not an exaggeration. With plate sizes from small to larger, this place eats almost like a tapas restaurant with everything executed well. The vibe is very comfortable and unique with a killer rooftop in the summer time. After being jaded by eating out quite often this place was the first place in a while to really leave me saying that was something special.",0.7512,0.743,0.164,0.093,0.5380952380952382
2016-12-12,5.0,"After walking by here numerous times, I'm SO happy we finally stopped in. Based on all the reviews, the rooftop is very popular, but don't discount the interior of the restaurant: it is very cozy and nicely decorated.  The food was all OUTSTANDING. I was most excited to try the octopus, and sadly that was my least favorite dish of the evening. It was still very tasty and nicely grilled, but seemed overly salted which took away from some of the grilled flavor. My favorite dishes of the evening were the mushroom flatbread (fantastic flavor and the egg was a nice touch), spiced ground lamb shoulder (grilled to perfection, perfect flavor), beet salad. They had a very nice wine list and the waitress did a great job helping us decipher what we would like based on our tastes. I am sad that I waited so long to come here, but really looking forward to a return visit later this winter!",0.9914,0.663,0.26,0.077,0.7729166666666667
2016-12-04,5.0,"Awesome fresh food and cool atmosphere. Thought the atmosphere was just enough ""cool"" without trying too hard. The food was really fresh and authentic. Definitely was surprised by how good the fried cauliflower was...Very tasty! Also recommend the octopus!",0.9632,0.567,0.433,0.0,0.6446969696969697
2016-11-30,5.0,Food was outstanding. Service on point. The ambiance is very nice (great for a romantic date night or just a food outing with friends). The lamb shank was spectacular (meat that melted off the bone atop a bed of rice pilaf). The calamari was grilled to perfection (charred but still tender). I would absolutely recommend this restaurant to anyone looking for great Mediterranean food in Chicago.,0.9523,0.756,0.244,0.0,0.8107142857142858
2016-11-18,4.0,"This review is for the rooftop (To Hayati).  The ambiance up there is pretty awesome, especially when they have a DJ.  The first time I went was with some friends visiting from Italy and we all agreed that it didn't feel like we were necessarily in America anymore. Honestly, being up there reminded me a little bit of my favorite city in the world - Istanbul. The smells definitely reminded me of it, which has never happened anywhere else in the states. They have small plates up there and both alcoholic and non-alcoholic drinks. They get huge points for serving sage tea, which I fell in love with in Turkey (it's awesome, try it) and haven't seen much of it in the US at any restaurants. Their cocktails have some thought put into them and are executed pretty well. For anyone looking for a good rooftop when it's nice out, I'd definitely recommend this. No it's not downtown and doesn't even have a view of the skyline, but it's one of the most unique rooftops in the entire city in a great neighborhood.",0.9808,0.793,0.191,0.016,0.7307971014492753
2016-11-18,4.0,"I live in the neighborhood and have been wanting to try this place . Overall it was very good and i would go back . Some things We ordered: - tzatziki  - my favorite! One of the bests I've had . Comes with toasted pita. Highly recommend . Could've eaten a whole second round  - pureed chickpea dip-aka hummus. Was very good, the olive oil thats drizzled on it is really good  - a arugula salad with a great cheese on it, toasted pita and sumac dressing. I liked this alot and it complimented the other things nicely  - baby okra - good , nothing to really fave about but good. Didn't love: -fried cauliflower , i was slightly disappointed. Other yelpers raved. Our had that almost burnt  fryer taste to it. And it needed more seasoning. I probably wouldn't order it again  Overall i enjoyed it , lots of small stuff to share which was perfect for what we were looking for",0.9638,0.701,0.215,0.083,0.5249999999999999
2016-11-13,4.0,"Taxim doesn't look like much when you walk past it on a sunny day, but on a weekend evening, it comes alive.  You can take two routes through Taxim's menu - tapas (and these are really NOT small plates, they are fairly substantial), or the sizeable (and slightly pricey) main courses. We chose the former and had the chance to sample a fair number of Taxim's offerings -- my two favorites were the black lentils and the okra -- the flatbreads are tasty though a bit salty and very heavy.  The shrimp and hot peppers pack some serious heat.  And the beet salad is a good stand-by to have something healthy, crunchy, and clean tasting. Our meal for 2 - 6 tapas plus one bear - came to $60. I will warn Taxim isn't the most intimate setting - the room gets loud, so if you're hoping for quiet conversation, a weekday evening might be better.",0.9851,0.766,0.207,0.027,0.5087301587301589
2016-10-06,5.0,"I just want to start by saying that the ambiance of this place isn't really my thing.  It was a little too ""cool"" for me, I was probably a little out of place. Oh well, everything else was totally perfect.  The rooftop is awesome.  Even though the train goes by, you can hardly hear it or the street traffic on the other side.   As for the food, it was some of the best ""Greek"" food I have ever had.  The menu seems less typical than the food actually is, so don't be scared off because it doesn't sound like every Greek restaurant on Halsted.  We got the artichoke small plate, lamb kabop, prassopita, grape leave wrapped shrimp, and the octopus.  Oh man was the octopus good.  I've had great octopus at other restaurants and make it myself but I've never had it this good.  The prices aren't bad for the quality of the food and the service was good. Will be back.",0.9735,0.824,0.161,0.015,0.4402173913043477
2016-10-04,5.0,We went here on Saturday for a birthday dinner. The service was fast and friendly and the food was all delicious. I highly recommend the fish gyro and fried cauliflower.,0.8655,0.721,0.279,0.0,0.66
