date,star,text,compound,neutral,positive,negative,subjectivity
2017-09-02,5.0,The sandwiches here are really good and the couple who owns it are some of the sweetest people you will ever meet. If you want an awesome sandwich while also supporting a local business then I suggest coming here!,0.8953,0.737,0.263,0.0,0.4625
2017-08-25,3.0,"This sandwich shop is next to DePaul and has a very retro feel to it. Students come here all the time.  The decor and the staff are the stars of this restaurants. I didn't think I'd find something like this in Chicago. The atmosphere was so friendly and calming. The staff was by far the friendliest restaurant waitress I've met and she was really nice and polite to everyone.  We went in around 6pm for dinner, no wait. We ordered a Italian beef sandwich and a Italian beef and sausage combo sandwich. The Italian beef tasted old, like it was cooked in the morning old. It was also overly watery such that it soaked up the bread and caused it to fall apart. The Italian beef with sausage was significantly better, according to my brother, as he thoroughly enjoyed his meal.  The staff and decor are good, but the food quality is not worth a 4.5 star on yelp.",0.8997,0.866,0.113,0.022,0.35
2017-08-09,5.0,"I could wax poetic about the food at this place. The grilled chicken gyro is one of the best sandwiches I've ever had, and it's a staple in my diet now. But, as other reviewers have mentioned, the woman who runs the place is the star of the show and makes Branko's what it is - which is truly awesome all around. 10 years ago, I stopped in for a sandy and didn't realize it was cash only. With a kind smile, she said she knew I was good for it, and to get her next time. A few days later, I popped in and paid my tab. I moved away shortly after and just recently moved back right next door to Branko's. My family now eats there weekly. Never mind the guy who said everything is fried - their grilled chicken is to die for and incredibly healthy. Branko's is a very rare gem. I can't recommend it enough.",0.944,0.816,0.137,0.047,0.4814625850340135
2017-07-31,5.0,"I'm in love with this place and this family. As great as the food was, the wonderful woman who runs it stole the show. She couldn't have been friendlier and I'm from the South which is famous for hospitality. I can't wait to come back here. Best service around and the food was exactly what we were looking for. We had a chili dog and fries. Simple and delicious.",0.9608,0.732,0.239,0.03,0.5841269841269842
2017-06-29,5.0,"Place is awesome. Retro in a way that makes me think of being a kid in a sand which shop. Got a Italian, was super huge. Lady working super nice also. Will be back for more",0.9517,0.614,0.386,0.0,0.5916666666666666
2017-06-16,2.0,"I ordered and Italian sandwich, char polish and cheese fries. The quality of the food is poor and taste is horrible.",-0.765,0.732,0.0,0.268,0.5333333333333333
2017-05-27,5.0,"This is not a health food store.  I try not to come here unless I'm hungover.  It's all fried.  And it's not really high on atmosphere.  Ok that said, the woman who runs this place is the nicest, most awesome person in the world.  Her awesomeness and sincere niceness makes me feel less guilty about eating grease.  Great place for a quick greasy fix.  And hey, they make their own veggie burgers from scratch!  Yum.",0.9515,0.747,0.224,0.029,0.6356666666666667
2017-05-17,5.0,"I was in the mood for a brat and a co-worker suggested this shop.  I wasn't sure what to expect since sometimes I gauge a place by how busy it looks but I'll definitely  The food is not what makes this shop a 5 star, though there is nothing wrong with it. In fact it is tasty, reasonably priced and good portions,  What makes this place special is most definitely the service and the personality of the owners.  Such a kind lady, was smiling throughout and seems very content.  She is very attentive and really wants you to enjoy the food she makes for you.  I was even instructed on which way was up on my to go bag so that it wouldn't get all over me when I opened it but so that it would look good because ""you also eat with your eyes"".  So funny, I've been in upscale eateries thought to have ""good service"" that didn't put as much into their whole body as this woman does on her own.  If you've read other, reviews you'll see that their service is ALWAYS mentioned, and make sure to bring cash.",0.9917,0.783,0.199,0.018,0.5967046238785368
2017-03-20,5.0,"I went here today after graduating from DePaul many years ago. I have many fond memories of this place from those days. The same sweet lady is there serving all the customers, it still has the same solid Chicago style food, and I still enjoyed it after all this time. Branko's is a family owned and operated joint - the same family since it opened back in the day. The food hits the spot and it's not expensive. I had a great chat with the lady. I wish her and her family all the best!",0.9287,0.79,0.178,0.033,0.38125000000000003
2017-02-08,4.0,"When I walk into Branko's, it feels like I've walked back in time - it's a very old school sandwich shop.  The food is pretty basic, and I don't feel that it's exceptional in terms of taste, fairly typical hot dogs, cheeseburgers, gyros, chicken sandwiches, etc.  The real stand-out is the people who run it.  I genuinely feel appreciated as a customer, and I think because they care about their business, they take great pride into putting together the food.  They make a very tasty grilled chicken sandwich that's probably one of the healthier things on the menu.  The patty is thin, but you get an oversized piece of meat served in a soft kaiser bun.  It is simply dressed with lettuce, tomato and mayo, but the nice charred flavor really makes it.  Being cash only can be a little convenient, but I noticed that you can now order online with a credit card.",0.9473,0.873,0.127,0.0,0.5639115646258502
2017-01-04,5.0,"Can't say anything but good things. Every visits here great! If you're a student at DePaul this is great to stop by for lunch. You must try it! The service by itself is beyond good. I am always greeted upon entrance and helped with the menu if needed. Id definitely recommend the gyros, chicken sandwich and mozzarella sticks. Just bring cash ! You won't regret it.",0.9855,0.606,0.363,0.031,0.6916666666666668
2016-11-24,5.0,"Amazing service, be sure you will be called ""honey"" or sweetheart"". Feels like home at Branko's.",0.8225,0.602,0.398,0.0,0.8944444444444444
2016-11-05,5.0,I haven't been here since the 80s but it is still as wonderful as it was back then. Great family owned business that has great food and service. Best Italian Beef in town.,0.978,0.558,0.442,0.0,0.4666666666666666
2016-10-19,5.0,"Branko's is out of a dream. It is cash only, which I didn't realize until I ordered. Mama (the woman taking my order) offered to cover me until I came back next time. Then someone sitting down eating a sandwich paid for our sandwiches. It was also one of the best sandwiches I've ever had. THE best customer service.  The decor is very 50's mom and pop restaurant and it works really well with the feel of the place.  Highly recommend Branko's",0.9391,0.822,0.178,0.0,0.32543209876543217
2016-09-24,5.0,This place is outstanding and reliable.  Mama makes the sandwiches and she always makes sure your order is exactly how you want it.  I've been living here for almost a year and whenever I need a quick sandwich I take the walk over and have a great experience.  Try the turkey sandwich on toasted wheat bread.,0.8934,0.801,0.199,0.0,0.6527777777777778
2016-09-24,5.0,"BEST VEGGIE BURGER IN LINCOLN PARK! It's a housemade patty without any fillers and tastes perfect. The chef has crafted a really unique and delicious recipe, that you have to try to fully appreciate. If that wasn't enough, because it is a sandwich shop, they can customize it with any toppings you want (even those not typically found on a burger). Family owned, and the owner is one of the kindest people you will meet. Order is always ready quickly, and so many options if you want to bring your friends.  This place is the definition of a great, and one of the best sandwich shops in Chicago.",0.9854,0.742,0.258,0.0,0.6227272727272727
2016-09-13,5.0,"I cannot say enough good things about this place. The service is incredible, due to the wonderful staff. It is family owned and operated and they are (especially the woman behind the counter!) literally the nicest people you will ever meet. This is a great ""hole in the wall"" kind of place, a little hidden Lincoln Park gem.      I come here with my sister all the time, and we have NEVER had a bad experience. I mean this incredibly genuinely. If there is a problem with anything, you can always talk to the lady at the counter and she will work it out for you. She remembers little things about everyone's order (for example, they always remember that my sister loves her side of hot peppers) Literally the most spot on costumer service you can ask for. I would give them 6 stars just for the way they treat their costumers.        It's good to keep in mind that it is cash only (there is, however, an ATM at the car wash right next door- note that there is a fee, for those  planning on using). Another note is that some things tend to get pricey (not extremely, but perhaps a good thing to keep in mind for students) so just mind the menu and add ons. But there are plenty of affordable options and combos!    Some good menu items to try are the cheeseburger (great w everything), Chicago style hotdog, chili cheese fries or the grilled chicken sandwich. They also make AMAZING gyros! Today I had a Greek Salad with Gyros which was loaded pretty nicely with meat cooked to perfection.      Hands down, one of the best places to eat in the area. If you're looking for diner style food that's made with high quality and care, look no further. I think you will find it quite difficult to not completely fall in love with this little sandwich shop!",0.9872,0.806,0.137,0.057,0.6401869256474518
2016-09-06,5.0,"DePaul is privileged to have such an amazing place on-campus. The food is great, the atmosphere is perfect, and the family that runs it is to die for.  Just bring cash!",0.8977,0.582,0.331,0.087,0.7875
2016-08-19,5.0,Too nice for words! Great Gyro! If your in the DePaul area don't miss out:) you won't be sorry!!,0.8669,0.583,0.417,0.0,0.9375
2016-08-09,3.0,"The woman who served us was very nice. Food seemed a bit expensive for the place, and we're still not really sure how it added up. $32 for 3 people, none of us even got drinks. A nice shop if you want to get in and out with a sandwich.",0.6494,0.813,0.145,0.042,0.8972222222222221
2016-07-30,5.0,Probably the BEST tuna salad sandwich I've ever had. They were the nicest and quick with my order.,0.8455,0.663,0.337,0.0,0.4
2016-07-19,5.0,The gyro and burger are always great! The family that runs the place are the best.  Always make you feel at home. Great family owned joint. Can't say enough good things about this place.,0.9059,0.665,0.281,0.053,0.58
2016-07-08,5.0,"Great, authentic sub stop. The Italian sub is loaded with meat - be careful their hot giardinera is really hot!! The Italian beef sandwich is very good.  Grab & go!",0.821,0.667,0.272,0.061,0.6225
2016-06-28,5.0,"I've passed this place 100 times as a DePaul student without ever stopping in, probably because I never have cash on me (Tip: There's an atm next door at the gas station). I'm happy I finally made it in because the food is so good.  The owner was possibly the nicest lady in the world.  Low key, I'm happy I did wait to come in here because it could easily become my go-to spot and make that freshman 15 even worse.",0.9183,0.747,0.197,0.056,0.7333333333333333
2016-05-22,4.0,"To off the review I'll let your know that looks on the outside of this place are so decieving. While the outside is a standard look for a resturant the food and service here is top notch. The sweet woman taking your order and making the food opens up her compassion and it shows in everything she does.  I went here to get some lunch on my hour downtime between classes and had decided to try multiple different items to get a real feel for this place. This place is a greasy spoon resturant that has plenty of different options. I ordered a Italian Sausage, Bacon Grilled Cheese and Grilled Chicken Sandwich. All of them were really good. I would definately recommend giving this place a try.",0.9312,0.876,0.124,0.0,0.3583333333333334
2016-05-12,5.0,"IF YOU GO TO DEPAUL EAT HERE INSTEAD OF FRIGGIN WHOLE FOODS. This place is amazing and the woman who owns it has been in Lincoln Park forever. I had a gyro, I basically fell into it because it was so large and delicious and garlicky and perfect. I get it whole foods had salad so you can feel better about yourself but lets be honest, we're all getting two slices for $6 so just do yourself a favour and get something better for yourself and for the neighbourhood $6 at Branko's.",0.9654,0.789,0.211,0.0,0.6698412698412699
2016-05-05,5.0,"Branko's is wonderful!! We happened In here and will definitely be back! Not only was the food delicious, but the lady behind the counter was the most friendliest, nicest, most helpful person.  She happily offered to make anything on the menu any way we wanted it. Got us an extra chair from the back room, and said if we needed anything at all just let her know. It's really fantastic to go to a place and feel appreciated as a customer. Keep up the great work Branko's!!!",0.9929,0.64,0.36,0.0,0.5807692307692307
2016-04-07,5.0,"When we asked the woman behind the counter, ""what's better, the gyro or the hot dog?"" she replied, ""It's all good or I don't put it on the menu!"" The gyro was excellent. Grits and chicken soup flavorful. This is a Formica table order at the counter kinda place. Lunch for two was $15 and super quick.",0.9286,0.788,0.212,0.0,0.7208333333333333
2016-03-31,5.0,"I LOVE BRANKOS, the owners are so nice and part of the fabric in this neighborhood.  I always leave with a little more food than i thought. And even though she didnt have cash once, she let me come back to pay her the next day.  Seriously some of the nicest people around.",0.8872,0.728,0.199,0.073,0.4666666666666667
2016-02-15,5.0,"Absolutely one of Chicago's best kept secrets! Brankos was my go to for a delicious breakfast, lunch, or dinner during my years as a student at DePaul, and continues to be my favorite spot for a great lunch, as I now work at DePaul. Andja is absolutely fantastic and not only cares for her customers like her own family, but is one heck of a great chef! You literally can't go wrong with anything on the menu, and it's all freshly made right there in the restaurant. Speaking of Family, you'll still see Branko (the restaurant namesake) and his wife working the counter from time to time, in addition to other members of the family. I would give more than 5 stars if I could!",0.9675,0.81,0.177,0.013,0.7436224489795918
2016-02-06,5.0,Came in here for a quick sandwich and a little free wifi. The gyro was delicious and the service was impeccable. As close as you can get to a meal at home with your mom asking what else she can get for you. Come for the food. Stay for the hospitality.,0.7722,0.873,0.127,0.0,0.71
2016-01-10,4.0,One of the most homely places I have ever been. The owner gave me a soup to take home because I wasn't feeling too well. And it's so easy to customize my order according to how I like it. The food is decent and reasonably priced too. A nice neighbourhood joint!,0.7992,0.766,0.174,0.059,0.72
2015-12-07,5.0,"The food is excellent, all fresh and homemade  Had honestly the best gyro I have ever eaten. Highly recommend that choice. The chicken tenders are also a great choice. Freshly made and delicious. But even more, it is a family run restaurant that makes you feel like you are part of the family. Andja, the manager, is the warmest, kindest mother who treats all her customers like family. They only accept cash, but their policy is no one leaves hungry. A truly kind and trusting policy that is emblematic of the establishment's essence. I highly recommend this restaurant.",0.9845,0.642,0.334,0.024,0.7215384615384615
2015-12-04,5.0,"Simple, comforting, and amazing menu.  Got the sausage, egg, and cheese breakfast sandwich on a roll for only $5, and it's one of the best I've ever had!!! The sausage is fresh, REAL sausage, and the egg is freshly made too. So impressed!",0.9556,0.678,0.322,0.0,0.6071428571428571
2015-11-14,5.0,"Branko's has delicious sandwiches, and the owners of the place are lovely. I was craving grilled cheese, so I went in and was treated like family. Will definitely go back next time I'm in the neighborhood.",0.9136,0.703,0.297,0.0,0.4375
2015-11-04,3.0,"Branko's is a greasy spoon sandwich shop. A family-owned, been-there-for-40-years greasy spoon sandwich shop that doesn't look like they've changed a bit since it opened. They won't dazzle you with trendy ingredients, aesthetics, or even a credit card swiper, but it'll give you a full belly for a fair price.  I had a Ruben which wasn't bad, but definitely pales in comparison to any place that specializes in corned beef. It was so no frills that they served it with a bottle of thousand island dressing that I'm pretty sure was Aldi brand. Upset I was not cause altogether it was under ten bucks.  The best part is they have a really nice family feel since the owner is behind the counter slinging the sandwiches herself. For this reason I can rally behind Branko's, but I wouldn't call it my favorite for the food.",0.9642,0.742,0.185,0.073,0.7004273504273504
2015-10-19,5.0,"The boss was so nice, I do not know it is cash only after I took the order. She was so nice and said I can pay her back whenever I have cash! Her words warmed my heart! And it made my day!",0.8692,0.751,0.219,0.03,0.75
2015-10-17,5.0,Terrific Italian beef sandwich today ..... And Ms Branko provided great service.  Super friendly and welcoming.  We will be back.,0.9531,0.466,0.534,0.0,0.4861111111111111
2015-10-03,5.0,"Great place to grab really fresh food. Also, it has the best customer service I have ever experienced anywhere! I always get the cold cut sandwich and it fills me up",0.8775,0.653,0.292,0.055,0.6900000000000001
2015-09-27,5.0,"Great, cheap food and you also get great service. I was short a few dollars and the owner told me to come back whenever I could to pay her back. It's a great place to eat.",0.9169,0.671,0.295,0.034,0.41875
2015-09-26,3.0,"Came here while visiting Depaul. The place doesn't do much for me aesthetically, but who cares! My daughter and I both ordered a burger and we got cheese fries. I don't suggest you get the cheese fries. I think they just put regular cheese on the fries and put them in the microwave.... not sure. The burger was good though. The lady that works here is about the sweetest thing I have ever seen. She is so nice. Her son was working with her too. I wish she was my mom. Just saying. She was friggin adorbs and nice. I'd come back just to support her family business. Keep up the good work!",0.9831,0.758,0.224,0.019,0.5457264957264958
2015-09-17,4.0,"Stopped by for some lunch with my dad expecting some average burger joint fare only to be pleasantly surprised. The staff were very kind and genuine and the food, an Italian beef with giardiniera, peppers, and a side of fries, was one of the best I've ever had. If you get the fries, toss some seasoned salt on it. It's stellar.",0.8999,0.788,0.185,0.027,0.5111111111111111
2015-09-04,5.0,The woman who works here is so nice - and the food is so good and cheap perfect for college students especially depual students because its right across the street from the quad,0.9013,0.724,0.276,0.0,0.8059523809523809
2015-09-02,5.0,"I've been eating at Branko's for the past two years and can't even think of what to write to properly praise it. Angela is an angel and will treat you like family. She works every single day 8 am-8 pm besides Sundays, only takes one holiday per year (I think it's Christmas) and runs the shop almost completely alone. It's a family run business and you will frequently see her adorable mother and father taking orders, watching TV, or cleaning up the restaurant. Nowhere in Chicago feels more like home to me -- I am so thankful for Branko's! Try the double cheeseburger with grilled onions. Amazing.",0.9751,0.772,0.212,0.016,0.46642857142857147
2015-04-14,4.0,"The family, especially the lady at the front of the register is the nicest woman I've ever met. I walked in once and didn't realize they were cash only, when I realized that I started to leave. The woman said she'd never allowed a child to leave her restaurant hungry. Since that day, I have and will continue to go to her restaurant. The food is your typical fast food. However she has some extraordinary dishes. Hers soups and chili is delicious and her chicken sandwich is grilled to perfection. She doesn't put salt on her fries, but leaves all kinds of seasonings out for those who would. It's hard to find someone who not only gives a shit about their restaurant but also about their customers and community. I will forever have a special place in my heart for them.",0.9088,0.874,0.1,0.027,0.8148268398268399
2015-02-24,5.0,"If you want to talk about excellent customer service. I ordered my food and as I handed the lady my card, she told me no credit cards cash only. Well I have just spent my last bit of cash. Before I could even ask where the closest ATM is she says "" I make it you pay me later"".    She knows I'm a student and decided to let me order WITH OUT PAYING! She asked if I would be back soon and to pay her when I'm back.  Because of this I will always come back.",0.7177,0.842,0.105,0.053,0.27083333333333337
2015-02-23,5.0,"The absolute best people that are left in this world. The service is beyond amazing, it's something that just isn't around. It will be an absolute positive in you day if you decide to stop in.",0.886,0.699,0.253,0.048,0.5909090909090909
2015-02-08,5.0,"Warm service, great food, great selection, well priced.  Lovely experience!",0.9459,0.235,0.765,0.0,0.7125
2015-01-12,3.0,I really wanted to love this place. The woman at the counter was very sweet and she threw in two free mozzarella sticks with my fries. Service was quick and easy. Unfortunately the food was just so so. The hot dog was good (can't really go wrong if you use Vienna beef) but had too many pickles (in addition to relish...). The fries and mozzarella sticks had zero salt and thus were tasteless.  FYI- Cash only!,0.9136,0.787,0.193,0.02,0.732948717948718
2015-01-10,5.0,Very kind people. Very respectful. Clean place with bathroom services. Cute little place with an old styl3 decor. I highly recommend this place to anyone. Food was really good as well. Coffee was good as well. A must go to in Lincoln Park!,0.978,0.541,0.459,0.0,0.672222222222222
2014-12-05,5.0,What do you say to awesome people serving you? Their main concern is to please....they know some guest food request by heart. She lives on a code of honor. She is forever grateful for her location.  Cash only! I came with credit card and she said no problem when all of a sudden a young man stepped forward and paid. I was brought to tears. I'm walked feeling blessed and hopeful there will be peace in humanity.,0.9617,0.655,0.272,0.073,0.6466666666666666
2014-11-19,5.0,"Ah! These people fed me for my four years of undergrad at DePaul. Branko's daughter, the lady at the counter which most students call ""Mom,"" was literally like a second mother to me. I swear, she is what is keeping that place alive. Every time you go in there, not only does she spread positive energy, but she feeds you awesome food.  3 Things to try there: the homemade soups, chili and italian beef.  The place has a very homey feel to it and it has a lot to do with the love that's put into making the food and the hospitality Mom offers!  Also I read something about someone not liking the fries. They very good! Branko says they are the best in the state, although it could be the Southern European in him bragging. Oh those Macedonians... :)",0.9859,0.765,0.21,0.025,0.42836363636363634
2014-11-06,5.0,"The grilled chicken sandwich is amazing! This place has ruined all other chicken sandwiches that I eat from now on, it's that good lol definitely go try it out if you haven't already.   And the family that runs the shop are very friendly.",0.9167,0.654,0.29,0.056,0.703125
2014-10-28,5.0,"If I could give this place ten stars, I would. Best Italian beef I've ever eaten. Hands down. And I have experience eating Italian beef sandwiches. The service is exceptionally good. My date and I rolled in about 15 minutes before close, not knowing they were closing, but we were treated very, very well. In fact, no one even brought up they were closing, they just politely let us finish our meal. Classy people. Kind, family people.",0.9307,0.775,0.193,0.032,0.3754320987654321
2014-10-24,4.0,I love going here for lunch. The atmosphere makes you feel like you're at home. Very delicious veggie burgers and falafel pita. Also the owner is really really nice. It's a nice humble place to eat.,0.9329,0.573,0.357,0.07,0.8
