date,star,text,compound,neutral,positive,negative,subjectivity
2014-09-19,4.0,"This spot is exactly the type of place Yelp keeps helping me find when I'm 1) Hungry and 2) In a big city and hungry. After procuring an Elvis wig and glasses next door, I was in the mood for something to tide me over until a late dinner. I sauntered on it and was greeted with a spacious room that reminded me of a mix between my grandparents house and a cafeteria. Plenty of nostalgia with room to spread out.  Pretty classic sandwich offerings from delightful subs to gyros and melts. I had a short turkey sub with provolone, fixins and oregano. A sheer treat for $3!  Well worth checking out if you're passing by or live in the area.",0.9459,0.85,0.15,0.0,0.43333333333333324
2014-09-17,5.0,The food is great and its a good spot for lunch in between classes. Its family-run and the family will remember you the next time you come. I felt like I was eating at my mom's house. That's how cozy it was.,0.8591,0.791,0.209,0.0,0.525
2014-08-06,3.0,"I was a regular many years ago. The place obviously has to be good to survive for over 30 years near De Paul/Lincoln Park. The last time I was there I was low on cash and very disappointed to see credit cards were not being accepted. On the other hand, I will stop in next time I am in the area and have some cash in my wallet.",0.0498,0.751,0.119,0.13,0.37935897435897437
2014-06-27,5.0,By far the best sandwich shop I have been to. It is also the only thing I miss about living in lincoln park. The owners are really nice and friendly and the food is prepared fresh. I love their gyro and gyro salad! Definitely made a few trips to that neighborhood just for this place.,0.9663,0.644,0.332,0.024,0.611111111111111
2014-06-23,5.0,This place made me look forward to grad class nights at DePaul. Their grilled chicken sandwiches are out of this world! The staff here is so very friendly and always asked me if they could refill my pop when I was getting ready to leave. Everything is reasonably priced and served with a smile!,0.8464,0.82,0.16,0.02,0.56
2014-06-13,4.0,This is an awesome sandwich shop. The students at Depaul certainly have it good here! I truly enjoyed the ginormous grilled chicken sandwich served on a kaiser roll that was made to order. I have never seen such a high quality grilled chicken sandwich. Very nice family owned shop. Would love to come back again to try their other items like the chicago dog and italian beef.,0.9768,0.682,0.318,0.0,0.598956043956044
2014-05-06,4.0,"What a delightful step into 1970s interior decor.  Warm service is not the hallmark of divey places such as Branko's, but warm service is what you get here. Actual conversation I overheard while snarfing down a charred Polish: Customer: ...and, do you have iced tea? Cashier: No. But I'll make hot tea and put ice in it! Atta girl! My Polish was perfect. Charred off and splitting just a bit. The bun had that really cool semi-soggy feeling that buns get when they are blasted with steam. Loved that , too. Then, there's the menu board. A masterpiece. Right down to the upside down ""W"" substituting for the ""M"" in  GRIL HAMN CHEESE Beautiful wood paneling that matches the the walls of my grandpa's basement. Magnifico!",0.989,0.729,0.252,0.019,0.626825396825397
2014-04-04,4.0,"Yay! I'am a fan but it is not as good as it gets.   I would give the service here a 10 out of 5 stars.   Yet I would give the food a 4 out of 5.  The food is good cannot ignore the fact it is good.  The subs are my favourite and is all I have ever really had at Branko's.  The service is great and the people who work their are very welcoming.   While I was attending DePaul I went to Branko's for lunch.   I ordered my food and realized I did not have enough cash for my meal(they only accept cash).   The cashier who happens to be  one of the owners and is the nicest owner you will ever meet in your life told me to come back tomorrow with the money.   She put trust in me to return the next day with the money I owed her for my sandwich.   I have never heard of a eatery in Chicago doing such a thing, most places would turn you away.  It is a family type atmosphere where you almost feel as though you are related to these people and they trust you to do what is right. I did return the next day and payed for my meal from the day before.    It is a great place if you like good food, great service, and 1970s decor.",0.9902,0.764,0.188,0.049,0.47698412698412707
2014-03-19,5.0,"This place is phenomenal! I get the Italian beef most of the time, but the cheeseburger is good too.",0.63,0.804,0.196,0.0,0.4
2014-03-19,5.0,"If you think this food and service is anything less than 5 stars, the problem most likely has more to do with you and your undeserved sense of entitlement: Food is excellent and the service is exemplary. *CASH ONLY*",0.25,0.849,0.087,0.064,0.6238095238095237
2013-10-30,4.0,"Sorry Demon Dogs, but I've got to give Branko's a better rating. Friendly staff, consistently good food, generous portions, and reasonable prices make this one of the best place to grab some quick grub in the DePaul/Lincoln Park area. Outstanding hot dogs!",0.9847,0.538,0.444,0.018,0.6361111111111111
2013-10-02,4.0,"Gosh, I feel horrible giving four stars and not five. I mean the lady here is so nice and welcoming, that part alone is worth just five stars. She even gave me extra, saying she doesn't like to waste food. I'm a healthy guy, I could handle extra. lol!  I got the gyros sandwich, and that's we're my issue was. It was absolutely delicious; extremely greasy though my whole bag and some of my clothing got messed up because I didn't realize the stuff was dripping all over me. Other than that I'll be back. Specially when I start class at Depaul.",0.9215,0.714,0.2,0.086,0.5022619047619048
2013-08-24,5.0,"My girlfriend and I went so I could try hot Italian beef for the first time, and my experience was so great I'll probably crave it forever. Andja, the lady behind the counter, was wonderful and treated both of us like family. The food was hot, fresh, delicious, and very reasonably priced. Come hungry and enjoy!",0.968,0.696,0.304,0.0,0.6603030303030303
2013-08-18,2.0,"Ate here a few days ago and although the food has always been good, the hygiene wasn't! I watched as the cashier, who handles all the money, added all the toppings onto my hot dog. No gloves=gross!!",0.3769,0.847,0.097,0.056,0.5166666666666667
2013-06-13,5.0,"I cannot say enough good things about Brankos. The food is what it is for a greasy polish, burger, or gyros fix. The owners, however, are amazing, kind people. They treat everyone so wonderfully and truly encapsulate the best of what comes with a great mom and pop shop. For the love of god, go here instead of McDonalds up the road!",0.9845,0.586,0.385,0.029,0.69375
2013-06-03,5.0,"Extremely nice Macedonian staff!  The food is very tasty and most of the food is homemade. Try the soups, I know that the owner makes them from scratch!  Don't think twice about visiting this sandwich shop. I mean it's only been around for over 20 years!!",0.6441,0.91,0.09,0.0,0.6975
2013-05-04,5.0,"great place to visit and relax between classes, or just for lunch. Lady at the front is warm and very kind. Pricing is pretty good. but can get expensive for some items. definitely a favorite.",0.9509,0.566,0.434,0.0,0.8071428571428572
2013-04-30,5.0,"I was sitting here eating one of their grilled chicken sandwiches thinking ""this is the best grilled chicken sandwich I have ever had in my life.""  I eat at Branko's frequently and finally got to write a review.  The customer service is the VERY BEST.  ""Momma"" is the sweetest lady and truly interested in her customers and their satisfaction.  Remember:  cash only....but if you forget she ""knows you are good for it, so catch her next time.""  If I could give this place 6 stars I would.  LOVE BRANKO'S!!",0.9802,0.719,0.263,0.018,0.5589999999999999
2013-04-25,4.0,The service is spectacular in this friendly neighborhood hot dog/gyros place.  I always feel like I've had a hug from the woman who runs the place because of her kind concern.  The hot dogs and gyros aren't anything special and their prices aren't either (which is why the 4 stars rather than 5).,0.8883,0.75,0.212,0.038,0.7619047619047619
2013-02-25,5.0,"Great little ""hole in the wall"" place with good food. My Italian beef was above average and the fries were good but the two ladies who work there are amazing. They are very kind hearted and pleasant. Good prices as well. Look forward to frequenting this establishment.",0.9811,0.585,0.415,0.0,0.5833333333333333
2013-01-23,4.0,"More of a 3.5 First time went, I loved this mom & pop joint. Sweetest and best service from the 2 ladies. The gravy bread was delicious. Italian beef and burgers were also good. However, recently went and had chili and a tamale. The tamale was prepacked and frozen, in which they just microwaved it up for me...never seen that before (maybe at a convenience store). The chili looked good but tasted straight up like tomato paste and ketchup. Fast service, but you can tell the food is not fresh, especially if it is not busy. Stick with the sandwiches, but can't beat the service. Cash only, but if you don't have, you can pay them back later! They also have a large variety of food including falafel.",0.9032,0.841,0.129,0.03,0.465406162464986
2013-01-05,5.0,"Was visiting from Boston and wanted a good Chicago Hot Dog and it was right around the corner from where I was staying.  Went in and got a couple jumbo dogs and the food was excellent.   Most impressed with the atmosphere and service.  A true mom and pop shop with the nicest mom around.  I didn't have any cash on me and she said to just come back the next day and pay her because she wouldn't let anyone go hungry.  Such a sweet lady, wish I was staying longer to try the rest of the menu items.  Will be going back in here next time I'm in Chicago.",0.9652,0.803,0.185,0.012,0.4835164835164836
2012-10-17,5.0,"This place is great! I absolutely love it every time I go there! Gyros Fries are my favorite. The nicest lady, mommy, works the counter there and will make any special request you can think of! Give it a shot!",0.9621,0.632,0.368,0.0,0.7303571428571429
2012-10-17,5.0,I eat here all the time. Great family owned place with a huge menu. Mommy will really take care of you.,0.8714,0.618,0.382,0.0,0.6166666666666666
2012-09-24,5.0,"SUPER NICE. It's cash only and she saw me pull out my card and told me to pay next time. Gave me the stub and says "" it happens to everyone, i dont want you to have an atm charge for nothing"" THEY ARE AWESOME.",0.573,0.722,0.155,0.123,0.7333333333333333
2012-07-31,5.0,"This is a great mom and pop type restaurant in LP. Food is always fresh... and everything is very affordable. Not to mention, the woman who is ALWAYS working (the restaurant was passed down to her by her folks) is a real sweetheart. Her personality really adds to the overall experience. She always indicates that she loves being called ""mom"" by the younger crowd the frequents this place.  Get the Italian Beef with hot peppers. It's incredible. The best Italian beef sandwich I've ever tried.",0.9538,0.829,0.171,0.0,0.33760683760683763
2012-06-26,5.0,"This family establishment earns its glowing 5-stars for the following reason: The mom that usually works here offers the kindest, and sweetest service you could ask for. You should check this place out a couple times (say 3 or 4 times) and you'll know what I mean. And then you have my favorite things to order, in order of most favorite: 1. Pizza Puff (this takes a while, 15 minutes, but completely worth it; caution, it will be burning hot too) 2. Sloppy Joe w/ grilled onions 3. Italian Beef (dipped, with hot/sweet peppers) 4. Vienna Beef Hot Dogs 5. Cold Cut Combo of course you get fries with all of the last 4, but she'll probably give you fries with the pizza puff too. I also love their gyros and sandwiches, specifically the grilled cheese sandwich :) If you live anywhere near this establishment, or go by it on your daily commute, I would highly recommend you stopping in and checking it out. *CASH ONLY* (but if you look like an innocent wee DePaul freshman who hasn't had anything to eat ALL day, she'll probably feed you and tell you to bring $$ back tomorrow)",0.9708,0.85,0.126,0.023,0.5171376811594203
2012-05-03,5.0,"One thing I love about my hometown is that it is so easy to find a restaurant that serves Vienna brand beef products. One such place, Branko's Submarines, has been around forever and is a great place to get lunch.  I grew up in Lincoln Park and used to come here all the time as a kid. Since moving back to Chicago, when I come to the DePaul area, I will sometimes drop in. I am always happy to see that the same nice family owns the place, and that their food is just as good as ever. They make great subs, but I will often come here just for a Polish with everything, extra sport peppers, or a burger, or sometimes a corned beef sandwich. Their Italian beef sandwiches are excellent, too. Great food and a friendly environment. What more could you want?",0.9843,0.774,0.216,0.01,0.5630208333333333
2012-04-20,4.0,This is a mom-and-pop sandwich shop with great sandwiches. The lady who is the owner of the place is extremely nice and friendly. They go out if their way to make their customers happy. I would highly recommend this joint anyone in Lincoln Park. Oh yeah and it's fairly cheap as well!,0.9672,0.664,0.336,0.0,0.7483333333333334
2012-04-15,5.0,"One of the top 5 authentic 'Ma and Pop' hot dog joints left in Chicago. Great steamed (not boiled) hot dog, good char burgers and chicken sandwiches. Fries with everything. Nicest owners/proprietors I've ever met. If you're looking for 'real' Chicago food you'd be hard pressed to find anywhere even close to as good within a 20 minute radius.",0.926,0.758,0.221,0.021,0.6083333333333335
2012-03-30,4.0,"Since it is by Depaul, the pricing at this place is very reasonable. The chicken sandwich is my favorite since it is always consistently great (juicy and huge). The fries can be better but the lady there is always so nice and always has a huge smile on her face.",0.9487,0.709,0.291,0.0,0.7644444444444445
2012-03-10,3.0,"The people here are nice, even if they don't smile much.  The hot dog I ordered was huge, a real plumper, and the fries were done just right.  My only problem with Branko's is that their prices were exorbitantly high.  There are hot dog stands all over the city, and the market seems to be set at about $4 for a hot dog and fries.  Branko's is a couple dollars more, maybe it has to do with their prime real estate next to the DePaul campus and taxes in the upscale Lincoln Park neighborhood.  I'm sure this place is a solid resource for students on study breaks from the university's flagship library across the street.",0.5559,0.871,0.088,0.041,0.5571626984126984
2012-03-01,4.0,"This is exactly what you need next to a university. Family owned, good food, cheap prices, and great service. In fact, I'm almost certain that the friendliness of the woman behind the counter is unlike anywhere else I've seen. This is one of the reasons I keep coming back. There's absolutely no way to leave Branko's without feeling good.  I do wish they took credit cards, but it's not the end of the world.",0.8162,0.777,0.172,0.051,0.5071428571428571
2012-01-21,4.0,"I went to this place for a much needed study break.  Not only did I receive a great meal, but I was also treated so kindly.  I tried to pay with credit card, but they don't accept them there.  The cashier insisted that I eat my meal before going to the ATM to get the cash needed to pay.  I was blown away by this.  After eating, I promptly went next door, got my cash, came back to pay and left them a tip.  Talk about excellent customer service! As for the meal, I got an Italian Beef with small fries and a RC Cola.  The italian beef was very good and everything seemed as fresh as possible.  I'm sure that I'll be back.  Cash in hand of course.",0.9815,0.729,0.218,0.053,0.46368055555555554
2011-12-12,2.0,"Nicest old lady works behind the counter. Hamburgers and hot dogs are good, nothing spectacular. Low quality italian sandwiches.",0.7854,0.669,0.331,0.0,0.5071428571428571
2011-11-23,3.0,"Mom and pop restaurant in lincoln part. The people are really nice and the food is decent college food (hot dogs, hamburgers, gyro's). I would come back here if I am a in the area but I would not drive across town just to venture this spot. Only down fall they don't take credit cards :(. I still cant believe people don't take that in this day and age :) oh well :)",0.8726,0.803,0.162,0.035,0.7561728395061729
2011-11-07,4.0,did that really just happen?  so i was ordering my hot dog and i asked the owner if she takes credit and she told me not to worry about it just pay next time your in the area. this was great! then i asked her if she had any honey mustard and she said no but insisted on mixing honey with mustard and it was really good she went a step further to help a non paying customer she was so happy to help me not like other hot dog joints in the city the hot dogs weren't the best I've had but the customer service will have me going back there very soon!,0.9487,0.739,0.186,0.076,0.5057692307692307
2011-08-10,2.0,"lady is really nice, but they've stopped giving free fries with their food, and I think the prices went up. $5 for a jumbo hot dog? GET REAL.  Amongst many other ""are you serious??"" prices. $3 for pizza puff? quality does not match the prices...charlie trotters is right down the street, you'll probably get just as full on the same amount of $$.",0.8484,0.815,0.151,0.034,0.5446608946608946
2011-06-26,2.0,"Low quality - Italian sandwich came with ""cold cuts"" that were really from some Oscar Mayer package, and didn't taste even ok. Patty melt bread was undercooked and meat was previously frozen. Overpriced - $20 for 2 people? Really? $2 for a soda cup filled with ice? Really? We're talking about burgers and fries here. Too high a cost for the quality you get (see above). Save your money and head to Mr. Subs.",-0.4493,0.863,0.042,0.095,0.3733333333333333
2011-04-03,2.0,2.5* Chili Cheese Dog 3* Italian Sausage 2.5* Italian Beef 2* Bread 1.5* Fries,0.0,1.0,0.0,0.0,0.0
2011-03-25,4.0,"I have a slight obsession with Vienna Beef hotdogs (See:  yelp.com/biz/chicago-ita… ).  So on a recent trip back to Chicago, I knew that I had to hit up my favorite neighborhood hot dog stand. I took 35 high school juniors here after touring DePaul's campus and I'm pretty sure this pit stop sold them on the school. You're Welcome DePaul.  The owners were so gracious and helpful with my students, that as Houstonians, were a little confused on what to order on the menu. My incoherant blabberings about vienna beef...jumbo...hot peppers...fries and the fact that I shoved my way to the front of the line was extremely unhelpful to my abandoned chicago-style newbies.  As has been stated in almost every post, the owners are amazing. They are so kind to customers and to each other. A line of 35 is pretty overwhelming for any restaurant, but they handled it with such grace. The daughter owner told her mom, ""you are working so hard, thank you so much mama"" *tear-sniff-tear* I love you Branko's and I will visit whenever I come back to town.",0.9746,0.786,0.168,0.046,0.6278282828282827
2011-02-15,4.0,"While the food is not the best ever, the environment is reminiscent of a small town restaurant 50 years ago. The friendly staff always have a kind word and helpful suggestion for any who wish to ask. Dealing with loud obnoxious college students hasn't deterred their service in the least. Every time I go it seems like they know at least one or two regulars by first name that come in.  Make sure to bring cash, no credit cards accepted.",0.9008,0.686,0.225,0.089,0.5422222222222223
2011-01-03,5.0,"Used to come here with friends during college all the time. At the time I was a vegetarian and totally anti-grease (read: like, everything here) so I rarely ate. My friends all loved it though. This review though is really for the owners...I mean, you're not supposed to find people this nice in the city. At the time (maybe still?) they accepted cash only. We didn't know that, but they didn't want my friend to go hungry (yeah, right) so they gave him his food anyways and told him to come back later with the money.   SERIOUSLY?!?! Who the eff trusts a couple of college kids to come back later with money for their free food?! (we did pay them by the way....and then patronized the crap out of this place for the next 4 years)  These guys are the reason why I support local businesses.",0.9212,0.764,0.158,0.078,0.4788165266106443
2010-11-17,4.0,Love brankos....went there in college all the time.  Understand the rating system idiots I obviously know it isn't as good as a five star sit down it is based on expectations and reality. Great cheap place with good food great family business and get in get out and get on with your day,0.8621,0.728,0.196,0.076,0.6209876543209876
2010-07-11,5.0,"This was one of my favorite places to go during the 12 years I attended DePaul University.  A friend and I would often head over here during the break in the evening classes, pick up burgers and fries and bring 'em back to eat during the last half of the class.  Classic Chicago deli/grill fare, burgers, hot dogs, sandwiches, Vienna Beef products.  The fries are the good kind of greasy that soaks into the paper bag. Haven't found a place like it since.",0.79,0.87,0.106,0.024,0.46875
2010-07-02,4.0,"Years after my last visit, I still crave Branko's food.  It's good, it's cheap, it's fast, it's convenient, just make sure you bring cash.  However, the real shining spot of this burger joint are the owners/operators.  Not only are they friendly, but they are built to deal with the college crowd.  That means a sympathetic ear for those seeking comfort food and stern words for the drunk and rowdy.  Although DePaul students tend to look alike, the good people of Branko's will not just remember your face, but treat you like an honored guest.  Branko's exemplifies the way service ought to be.",0.978,0.736,0.239,0.025,0.6595959595959596
2010-04-28,5.0,"Okay so after sometime of visiting this establishment at least once a week... it only gets better. Angie (woman who lovingly takes your order) is like the mother you never had. She is just so nice, again I want to put her in my pocket. I don't know why this place isn't on the meal plan for DePaul students. That was recently brought to my attention. Someone change that already. They deserve it.",0.9401,0.793,0.207,0.0,0.6571428571428571
2010-03-23,4.0,"A great small place to grab a sandwich right by depaul's lincoln park campus. A good crowd was in there already at 11 in the morning and its spring break for depaul.  I got a hot roast beef sandwich and a drink, and got my food really fast. The roast beef was really good and juicy and the fries were nice and crisp. There was a lot of flavor  in the roast beef and the owners were more then happy to chat me up for a couple of minutes before I got my food. A  real good neighborhood and friendly atmosphere with lots of classic sandwich options",0.9712,0.798,0.202,0.0,0.6299319727891156
2010-03-06,3.0,"Normally I would give this place a 2.5 stars but this is a family owned joint AND the woman serving me was really friendly. This place has all of your regulars like fries, burgers, sandwiches, and gyros. Most items were  normally to a little highly priced for what they are. I got fries and a grilled cheese. The grilled cheese was good, the fries, eh. I got my order to go and they did not give me nearly enough ketchup for how dry the food ended up being.",0.9159,0.868,0.132,0.0,0.54875
2010-01-07,5.0,"With out a doubt a DePaul staple Branko's is the cheers of quick and easy college students. Come in and be treated like your part of the family. The owners LOVER their costumers and you can see it.  GREAT food and customizable. I have always loved their grilled chicken sandwich, but recently I have been requesting special orders and they not only make it perfectly without a complaint, its tastes great! If this place didn't exist many Bio students like myself would go hungry between classes and labs.   Come in and become part of the family!",0.9865,0.682,0.303,0.015,0.6753968253968253
2009-11-08,3.0,"A quaint little family-owned hot dog joint that's conveniently located across the street from the DePaul library.  The people who work there are always very nice and make you feel welcome.  Everything comes with ""free"" fries, and their food is pretty cheap.  I wouldn't go out of my way to come here, but if you're studying for finals at the Richardson library and need a quick bite then this is it.",0.6306,0.914,0.086,0.0,0.78125
2009-09-28,4.0,"The lady working the counter was very kind and I was impressed with their vast menu,  food was good but not something to travel for",0.6538,0.768,0.232,0.0,0.9
2009-07-14,3.0,"I came here to eat at the suggestion of my best friend's boyfriend and it was ok, but they should have picked up popularity since Demon Dogs had gone out of buisness. They had a lot of the same things that Demon Dogs had, but it was good. Like one Yelper said that you can't live on hot dogs because of the weight gain and that's typical for the freshman 15. Yet I've had better hot dogs than this place to be honest with anyone who reads this.",0.9824,0.733,0.267,0.0,0.5625000000000001
