date,star,text,compound,neutral,positive,negative,subjectivity
2013-12-20,2.0,Great mom and pop environment. The food was blah. Ordered the skillet ... Had no flavor and was undercooked.   Ordered a side of biscuit. It was chewy! Clearly had been out in a microwave or something.  I returned it and they were very sweet about replacing my side.  Coffee is like tea. Tasteless and very weak.  Great service. Everyone was so nice.  However food wise. It's very average and nothing to rave about.,0.9578,0.663,0.262,0.075,0.7623148148148149
2013-11-25,5.0,"Took my daughter to breakfast here on one of the many CPS days off of school; we both got panckaes, and bacon, and they treated us extremely well, were very attentive and sweet to my daughter. Just a solid place with good people and an owner who seems to care a great deal about his patrons.",0.9473,0.733,0.267,0.0,0.6571428571428571
2013-11-18,5.0,"I've been to S&G so often over the years that I guess I've overlooked it, time to correct it!  S&G is the epitome of your neighborhood diner, in the best way possible. I love coming here because you never have to wait for a table and the service and the food are always great.  The menu is positively giant but I always find myself coming back to their egg casseroles (otherwise known as skillets) and I'd have to say that Porky's Cousin may be the best hangover cure I've ever found outside of a McDonald's. It's a ton of food that is always perfectly prepared and you never have to wait too long. Need I say more?  Maybe I'll come back one day and try something other than an egg casserole but I somehow doubt that. Try S&G, you will love, love, love it.",0.9914,0.73,0.245,0.025,0.5046875
2013-11-13,4.0,"This was the first place I went to for breakfast when I moved to the area this summer. One woman (maybe the manager) introduced herself to my friends and me and always recognizes us. Food is good diner food, especially the French toast, just don't expect gourmet brunch. It's cheap and quick. Again, it's good diner food.",0.836,0.854,0.146,0.0,0.5333333333333333
2013-11-07,1.0,"I wish I could give Sam and George's zero stars. I have never been treated so poorly at a restaraunt in my life. The owner of this place is the rudest individual. My girlfriends and I ate here for breakfast last Saturday and when we went to pay, he asked us what we wanted like we were disturbing him. Um sir, we are here to pay YOU. Then when trying to scramble to pay, he told us he did not have time for this and that one of us needed to pony up for the $50 tab. He rushed one of us into paying on a card and after we comented on how rude he was being he told us he will chalk this up as a terrible experience for the two of us. We were a group of 5 women and two children. Never in my life have I been spoken to like this...we are upset we even paid the man. He made such a scene it was unreal. Never visit this place, the food was not worth it.",-0.8926,0.844,0.041,0.115,0.5083333333333333
2013-11-01,3.0,"After reading other Yelp reviews, I had high hopes for this place. It was just OK, in my opinion. The wait staff was courteous and the owner(?) at the cash register was super sweet, but the food wasn't what I expected. The split pea soup was pretty good, but I didn't care for the croutons that came with it. They were greasy and didn't really do much to complement the flavor of the soup. I also ordered the chicken Philly which was a real disappointment. The chicken was rubbery and didn't have much flavor, the melted cheese had the same consistency as the chicken, and even the grilled onions and mushrooms lacked flavor. The French bread was OK, but I didn't really care since the rest of the sandwich was so bland. I got a side of tater tots, which I guess was the best part of the meal.  Normally I would give a place like this 2 stars instead of 3, but I'll give it another try someday and order something else. It's really the kind of place I want to love, so I don't mind going again to see if it's better.",0.9839,0.752,0.196,0.052,0.5534615384615384
2013-10-20,5.0,"My group came from St. Louis and specifically wanted to eat at S&G's restaurant because of the name. Sam is the name of my 6 year old cousin who recently lost his grandpa George. He misses him a lot so we thought this would be a great place to take him. We walked in and asked if they sold t-shirts in kids sizes and they went above and beyond to find one. While we were eating they threw Sam his shirt. And there was no charge despite offering. You just don't see that much these days. Great people... Now onto the food...it was AMAZING. The toast and english muffins are addictive. Their omelet was the perfect balance of cheese, meat and egg. The mickey mouse pancake face is a hit with the kids. This is one of those hidden gems that make the drive to Chicago worthwhile. Thanks again to the owners...like I said...they need more business owners like them! Much love from St. Louis!",0.9773,0.807,0.159,0.035,0.47888888888888886
2013-10-19,3.0,"I've lived about a block away from this place for about four years, and at one point I was going there twice a week for breakfast.  I really like the food, but I don't think I want to go there anymore.  There's only so many times you can watch the owner(the guy, not the woman, who is really nice) berate his employees from across the room.  He really does yell across the diner in front of dozens of people about perceived mistakes.  It's kind of weird to just sit there at eat while its going on. Worth it, if you don't mind watching employee drama",-0.5826,0.875,0.04,0.085,0.6125
2013-10-08,3.0,"Short answer: food is good, service is just okay.  If you're a regular, it seems, they're all over you.  If you haven't been there enough to be a regular (read: once), service isn't nearly as good. I went there for lunch today.  Beautiful day, wanted to sit outside. The sign outside said go inside to get seated out there.  So I did that.  The cashier (an older man, maybe an owner?) was chatting with the two customers at the register. I'm guessing that more than a minute passed before finally a woman came out (maybe another owner -- not dressed like waitstaff, probably my age) and said I could choose a table out there.  There were two occupied tables outside and I didn't see anyone seated inside unless they were in the back.  Still, it took a little while to get service.  Owner lady was leaving with her daughter and mentioned that my waitress was on her way. She seemed like the only one for whom customer service was a concern. Once the waitress did take my drink order, it was quick with both a carafe of water and tea from her and the busboy.  I had several minutes to peruse the lengthy menu and made my choice.  *twiddling thumbs...actually, looking a phone* Menu closed.  The other waitress asked if my waitress had been by.  Yes, to get my drink order. So she finally comes out and takes my order.  Asked if I wanted toast with my skillet. Yes, please. She also took the time to chat with table next to me -- clearly regulars based on their conversation.  Order comes out pretty quickly minus the toast.  The Gypsy Skillet was good and it was hot.  Didn't exactly miss the toast but did order it. Again it took a while before the waitress came back with the check.  She asked if I wanted a to go box.  Yes, please. She then went to the new table seated on the patio and chatted with those gentlemen for several minutes. Wonder if she has short term memory issues --- no toast, no box for the to go.  The busboy came by to ask if I was done. I told him that I wanted the to go box that he brought quickly.   When I went inside to pay, there were 4 tables occupied so busier than before. Still, there were at least two waitresses and not that many tables. The owner man wasn't rude but not exactly friendly.   I'll probably return at some point because the skillet was so darn good but as close as I live to the restaurant, I don't see myself becoming a regular.",0.9441,0.893,0.076,0.031,0.418499555999556
2013-10-07,5.0,"i went here for a Saturday brunch and had such a lovely experience!  A friend joined me and we were able to not only BYOB (lovely bottle of moscato) but sit outside with our dogs!  The service was so friendly and even offered us a bowl of water for the pups.  The food was amazing, but be careful their skillets are large enough to share (but we each ate our whole skillet as it was so yummy!).  Overall a great local diner and an incredible experiece :)",0.9861,0.702,0.298,0.0,0.5913865546218487
2013-10-07,5.0,"I came to S&Gs for a patio brunch with my girlfriend and our DOGS. Neither of us had been before, but BOTH of us will be back :)  The staff was very friendly, and we were seated promptly on the patio.  We brought our own bottle of wine and were provided with glasses.  We also got a pitcher of water for continued hydration. Yippee.  Our fur-children were received warmly, and were not the only ones. Now for the food. We got 2 skillets and shared both. Variety is the spice of life! Kevin L's Special skillet, with gyros and feta and jalapenos, because my friend was craving spicy. Amaaaazing. La Bamba skillet, with chorizo and cheese and 2 eggs on top. Again, AMAZING. Both skillets were very flavorful. It's very possible to ruin a skillet by putting too much faith in the potato, but S&G goes big with the flavor.  I'm not sure if we were just enjoying ourselves so much surrounded by the flower boxes, sitting right next to the lovely St Alfonsus church, or if the food really did come out that quickly, but we were starving and happy that the food seemed to arrive very quickly.  The price is also fantastic considering how full you'll be when you finish that skillet.  I loved this place and I will go back. It was worth the 30 minute trek to Lakeview.",0.9952,0.733,0.225,0.042,0.5534297052154196
2013-09-05,5.0,"Aside from having a huge menu with delicious food, you can't beat the hospitality at this place! Any restaurant with a staff that goes above and beyond and gives a little girl a shawl because she's cold, a little pouting boy some cars to make him smile, or a personal escort for an elderly handicapped man in a wheelchair from his car to his table is one that deserves more than just 5 stars!! These 3 incidences happened all in the 1 hour my husband and I enjoyed our breakfast last Saturday. It was so refreshing to see how much they care about making their customers happy.  We have lived in Lakeview and have been going to this restaurant now for about 8 years. We have brought many friends and family members here as well. This is by far the best breakfast place in Chicago, not only because of the delicious food but because the service here is genuine and unbeatable. Its your typical family owned restaurant where everyone cares about your experience and hopes that you walk out full and satisfied.  I would recommend this place to anyone and everyone I know. My husband and I will continue to enjoy this amazing neighborhood, family restaurant for as long as we live in the city :)  Go Check it out!! I assure you, you won't be disappointed!!",0.995,0.769,0.231,0.0,0.6298850574712644
2013-09-01,4.0,"Good food, good hospitality.",0.7003,0.256,0.744,0.0,0.6000000000000001
2013-08-26,5.0,"this is the diners of diners. most diners are just about the exact same yet this place is on another level. i go with the egg casserole (skillet) just about every time. they are always delicious and i've yet had a complaint on the main course (breakfast/brunch). now where S&G separates themselves from all other dinners are the small things. first their toast, it sure as balls isn't wonder bread, but much more of a tasty bakers bread. while the bread is good, their english muffins are on a completely different level. they are the airiest tastiest english muffins that i have even tasted (my girlfriend wants to ask who their vendor is every time since she's in catering, but i won't allow us to be ""those people"", but i kind of want to know my self too). also, for the longest time they only used the ""fancy"" jam, which has seeds and great flavor--though the marmalade never has good flavor--but on our last visit there was some smuckers mixed in with the good stuff. not a big enough deal, this place is still the absolute best diner around!!",0.9798,0.842,0.141,0.018,0.45082304526748973
2013-07-26,2.0,"My first time I went for lunch so I could sit outside, love the outdoor seating they have. The service really was the worst part. My ham and swiss sandwich was good, the croissant it was on was great, I really wanted mayo but never saw my server again to ask her for it. They had a large menu and some good reviews but I don't think I will be returning.",0.8057,0.815,0.149,0.036,0.4761904761904763
2013-06-23,4.0,"I have lived in the area for over a year but have never gone in. Finally when my dad and brother were in town we stopped in for breakfast! They have awesome breakfast. It was cheap, good, and fast. My dad was not a fan of the BBQ chicken sandwich he got... but they are known for breakfast and not BBQ sandwiches' ! This will definitely become a tradition for me!",0.9029,0.765,0.175,0.06,0.7642857142857143
2013-06-14,5.0,"Go there!! There are so many reasons why this is the best breakfast place. The casseroles kill it and the Fage yogurt, berries and granola plate is absolutely gorgeous. The manager came around twice to personally ask us how we were doing - love that. He is one of the reasons my cousin (visiting from St. Louis) and I (from SF) are now obsessed with Chicago! There's an outdoor seating area, and it is just up the street from Atlas brewery. This is the nicest establishment I've been to in a long time - the service is phenomenal.",0.9075,0.792,0.151,0.058,0.5625
2013-06-05,3.0,"S & G is a bit of a greasy spoon, but it's not dirty.   Just about everything on the menu is served with what seems like 2 potatoes-worth of shredded hash browns, but it's not too bad.   The egg skillets are the way to go.   Nothing fancy, just good ol' greasy American breakfast on the cheap.",0.9323,0.767,0.233,0.0,0.5533333333333333
2013-05-29,4.0,"Service is a bit slow, but wow it is worth the wait. I am a hash brown junkie, and this place DELIVERS.  Shredded potato goodness and lots of it.   The chicken fried steak is also pretty tasty and clearly freshly breaded, not frozen prepackaged crap.  For a twist, instead of plain gravy, it is served with sausage gravy (mmm...pig on pig).   My friend advertised it as a greasy spoon, and while the food definitely looks and tastes like diner food (yes, that's a compliment), the restaurant is clean and well managed.",0.9909,0.652,0.348,0.0,0.6307142857142857
2013-05-16,5.0,"I cannot RAVE about this place enough. Truly a gem that I hope never ever closes. The morning we went it was SUPER busy (as we were warned) but, by some stroke of luck, we got a spot at the counter. And that's where you want to sit. That's where all the action is, where the regulars sit, and where you get to interact with the owner, someone who could easily have been Rhoda Morgenstern's Greek auntie. What a treat it was to be on the front line. Despite the absolute mayhem that is Sunday Morning Brunch in Chicago, it was still a delight. The food came out on time and delicious, hot. Our coffees were never empty more than 3.2 minutes. It was, overall, a treat. I don't rave too many times, but this one deserves much.",0.9869,0.774,0.226,0.0,0.4892857142857143
2013-05-14,4.0,"YUM YUM YUM.  This is my go-to breakfast spot. S&Gs knows how to handle a crowd on weekends and though it is always hoppin', I never have to wait for a table, which is awesome considering the 30+ waits breakfast places in this area typically have. The food is no fuss too, hearty breakfasts without the inflated prices and unnecessary fru fru offered by many other brunch spots. The skillets are amazing -- and certainly converted this former hashbrown/eggs hater. Great food, excellent service, all at a reasonable price. It really can't be beat.",0.9337,0.782,0.171,0.047,0.6080357142857142
2013-05-07,3.0,"Yelp milestone: review #300!  Usually I trust the reviews and order the menu item that everyone says to order. I went in with the plan to order the skillet, and goshdarnit - I shoulda stuck with it. I saw a corned beef omelet on the menu and it reminded me of this creation that I had in Vegas with a giant thing of corned beef smothered in swiss cheese with eggs on the side. It was by far the most earth shattering breakfast I ever consumed and actually was far too rich to consume something like that upon waking up from a hangover, but come on, it's Vegas! I got that vision in my head and wanted to re-live it all over again. Sadly, this was nothing like that. When I walked in, I was convinced that I wasn't in the right restaurant. For such a successful restaurant, I would think they would have remodeled at least once since the 70's but I guess they want to stick with the original charm. The owner was a bit brusk with us due to the fact it was so overwhelmingly busy, but he wasn't brusk in a mean way - just in a hurried way. We were seated and immediately poured a couple glasses of water, while we looked over the menu. It took a few minutes for the waitress to come over to us, but we were both able to decide what we wanted. My mom opted for the eggs benedict and I went with the freshly squeezed OJ, Greek toast (upon Yelp recommendations) and the corned beef and swiss omelet. Our food was out rather quickly, so we were pleasantly surprised.  The OJ was fabulous in the way that the freshly squeezed sort always is, albeit a little sweet. I devoured it rather quickly and found myself wishing I would have savored it. The greek toast was also really good. I normally find myself not eating the bread, but I ate all of theirs. I liked the hashbrowns a lot, as they were half crispy and half soft. My mother on the otherhand hated them as she prefers hers ""extra crispy."" The omelet was way overcooked and almost that rubbery texture that eggs can get. While corned beef normally adds an over-saltyness that I'm quite fond of, this variety didn't add much salt to it. Supposedly there was swiss on it, but I couldn't taste any. For our breakfasts, it was only $23 plus tip. I thought this was a great value for two huge breakfasts that filled me up till dinner. Next time I will return and get one of those skillets. The people next to us ordered them and they looked wonderful!",0.996,0.811,0.158,0.031,0.5512566137566138
2013-04-20,5.0,"You can call this my little diner obssession! Its the best of the best anywhere! S&G is my go to when ppl come to visit.  The best part, aside from the egg casserole, is that they serve breakfast ALL DAY! The girl there that serve are awesoem and always more then friendly.  To see them in real action, go on a Saturday or Sunday mroning before 1ish and you'll feel like you're in a food network show!  They are the heart and soul of this place and always a pleasure!  There's also always plenty of parking at this gem for you other car drivers!   Back to the egg casseroles, I thought ppl who came here and ordered anything elses were crazy, but my mom and dad came with me on their recent visit and they ordered bluberry pancakes and a ruben and guess what folks? always super good!  Don't think you can leave here without a tummy that is stuffed, they give you plenty of food!  I even ask the girls not to bring me the sides of toast bc I can never finish my casserole much less toast. Make sure to try and bring cash for the tip, I usually leave a 5 at home when we go out bc I  know I'll need it first thign for S&G breakfast!!  And don't worry about running out of your much needed coffee ot diet coke, they keep it coming!  I'm so obssessed with this place, you would think I'm there regional sales manager...I literally have business cards in my purse! My advice to order: The Gypsy add jalopenos :) They're biscuits and gravy are also amazing, and that's cmoing from a true southerner so you know they're legit! MUST GO!!!!",0.9911,0.846,0.14,0.014,0.4585978835978836
2013-04-08,2.0,Not my favorite. Cons: I saw the waitress touching the strawberries to spread them out onto my toast. Not very enjoyable either way though. It was edible... but maybe that way bc I was starving.  Pros: The orange juice was fresh squeezed and delicious. Also the owner was adorable.  Bottom line: would I come back? No.,0.8719,0.668,0.238,0.094,0.6373626373626374
2013-03-09,5.0,"By far a neighborhood diner... It's a cozy, comfy little diner with a heck of a menu.  Had the S&G burger and was amazed.  They seem to make everything and you can tell the difference. I loved it and definitely will be going back soon.    The owner, ""i think"",  was hilarious was very loud(she's Greek-Francis).  She was cracking jokes with the staff and the customers, which she knew personally.  She took the time to ask us how everything was and chatted with us for a bit.  Nice to know that business owners still value customers feedback and your business is appreciated.  Outside-it doesn't look very inviting but it's got alot of character inside.  Definitely worth going in to eat-you won't be disappointed.",0.9534,0.804,0.184,0.012,0.5285714285714285
2013-02-24,4.0,"We came here as a group of 7 on Sunday morning and - amazingly - were able to be seated immediately. And it was exactly what you would expect out of a typical diner - huge selection on the menu, bottomless coffee and bustling, great service. We'll definitely be back for more skillets!",0.8553,0.824,0.176,0.0,0.553125
2013-02-16,2.0,"Went here on a busy Saturday morning for brunch. The wait wasn't too long and the service was pretty fast and the employees were pleasant. What sucked was the food. The coffee was weak, the skillet I had lacked flavor and had no seasoning and the pancakes were dry and flavorless. $35 for two breakfasts and I've had cafeteria food that was better. Golden Apple down the street is better and I'm not even a big fan of Golden Apple. The service was good, so two stars for the service.",0.7301,0.755,0.147,0.097,0.5343253968253967
2013-02-02,5.0,"I have eaten breakfast, lunch and dinner at S&G and every meal has been fantastic.  The food is good and plentiful and the staff is great.  Not only do they know how to get the food on the table, but they are friendly and usually keep the drinks full.  It is definitely more enjoyable to eat at a restaurant where the staff works hard to ensure that you get a great meal quickly than where the staff thinks that they are doing you a favor by allowing you to eat.  The restaurant is not fancy, but I would take good food and service over decor any day of the week.",0.988,0.718,0.27,0.012,0.6185897435897435
2013-01-20,4.0,"This place is where breakfast dreams come true. Huge skillets, good coffee, and unique service. It's exactly what I think of when I think of a diner. I'm super full.",0.9274,0.601,0.399,0.0,0.6595238095238096
2013-01-19,4.0,"From the outside, it does not look to be best appetizing place. Once you walk in, sit down and get served your meal you will be in ""awe."" I absolutely love the service---they are constantly coming back to fill the water and coffee. It seemed like that they have 10 min intervals where they would come back around and make sure every customer was happy.  Now let's talk about the food! I got the ""Panhandler"" and it was an awesome skillet. It had so much flavor and it was so filling. Bite after bite, I was so pleased with how great the whole meal was complimented with the toast. .  There really wasn't any line and I really liked the atmosphere inside. It had that nice ""diner"" appeal and it brought back memories of being back home in central Wisconsin and it felt like it'd be a great place to stop in at while partaking in a road trip...",0.992,0.746,0.242,0.012,0.47323232323232334
2012-12-07,4.0,"Plenty of great breakfast options, hardly ever a wait and friendly, efficient service.  No, it's not a hip Southport Ave brunch spot - but that's also one of the best things about it!",0.901,0.637,0.322,0.041,0.5229166666666666
2012-12-05,5.0,"Sitting in S&G and having lunch, eating one of the best Greek Salads ever.  One of the daily specials. Service is top notch as always. THIS is one of my favorite restaurants!",0.8516,0.757,0.243,0.0,0.36
2012-11-25,5.0,"This is one of my favorite little spots to eat. Fast service, everyone is nice, and the egg casseroles are delicious. They give you a ton of food and make everything fresh!",0.902,0.691,0.309,0.0,0.7666666666666666
2012-11-24,5.0,"This place is great. It's very busy on Sunday mornings but it's worth a bit of a wait. I went after a bike ride and was ready to indulge. It was a glorious day in the summer so I chose a seat outside. The experience was exactly what I wanted. The staff was ""diner sweet"" as like to say. They came buy to refill my coffee (which was adequate) frequently and my water. I order one of the egg casseroles which come loaded with food on these massive skillets. What's great is they come out fast. VERY fast. Even better it's delicious. A huge amount of lovely comforting food. I can't say enough how great the staff is and how fun a place this is.",0.9963,0.627,0.373,0.0,0.5526666666666666
2012-11-19,5.0,"Great selection and quick service. We're had the skillets before and they never disappoint - just be sure you bring cash to tip your server, they don't like when you try to include it on your card.",0.7613,0.748,0.202,0.049,0.7129629629629629
