date,star,text,compound,neutral,positive,negative,subjectivity
2010-10-13,5.0,"I recently got up one particularly groggy Saturday morning to make steak and eggs using my stove and charcoal grill. I charred the steak beyond recognition by leaving it on the grill too long. The steak was then thrown out in pieces after trying to cut it up into some sort of useful, somewhat tasty meat, as this hapless effort failed miserably. Thankfully, S&G was right down the street, and what a delicious breakfast/brunch gem of an establishment this place is. Extremely fast service, great servers (the place is owned by three families and it always appears that everyone is related to one another), great coffee, countless menu options, and everything served fresh with every possible spread you could imagine for toast, your entree, etc. To top it all off, every single table in the place contains two bottles of random hot sauce. (Being a huge hot sauce fan, this is a major plus). You know how when you walk out of a mediocre breakfast place and upon exiting you turn to your friend/significant other/spouse/partner and say something to the effect of, ""you know, that kinda sucked, we shouldn't go back there - I can't put my finger on what was wrong, but it was just, blah."" Well, upon exiting S&G, you will feel a) full of delicious food, and b) counting down the 24 hours left before it's breakfast/brunch time again. Do not miss the Athenian Egg Casserole. Feta+gyro meat+eggs+hash browns+onions+peppers = pure breakfast bliss. Turning back to the steak debacle, upon returning from S&G that fateful Saturday morning, we discovered that the dog got into the trash, devoured what was left of the charred meat and ended up with explosive diarrhea for two days. It's a good thing we had S&G there to keep us good and stuffed with non-explosive deliciousness. Damn dog.",0.9809,0.823,0.132,0.046,0.5378086419753086
2010-10-09,3.0,"I really appreciated the friendliness of the employees, but the food was just okay. The green beans were completely flavorless; I know big batches of green beans at a diner aren't gonna be amazing, but it was like eating chewy green paper. My chicken sandwich and fries were very salty. Maybe if they'd used a little of the fry salt in the beans... The location's convenient, the staff is cool, but I don't think I'll be going back. I took half my sandwich and the fries home for later. The waitress said ""no beans?"" Nope, no beans.",0.3117,0.785,0.123,0.092,0.36444444444444446
2010-10-07,2.0,"The staff is nice, the place is clean but the food is just not anything outstanding. Nothing I couldnt cook myself :/ and its all pretty heavy. Sorry S&G.",0.5892,0.573,0.276,0.151,0.8678571428571429
2010-08-31,5.0,"My favorite diner? And maybe my bestie's too given it's called ""sam and george's"" -- but jokes apart, this place was awesome! In an area with plenty of parking, spacious un-cramped diner, chirpy servers, warm welcome, fresh food, awesome menu selection, huge portions, right price, what's there to improve here!?  We really enjoyed our egg casseroles and they even had greek toast!",0.9899,0.584,0.416,0.0,0.7135714285714286
2010-08-22,5.0,"Sam & George's is one of my favorite spots for breakfast/lunch/brunch in the city. Now I'm a man of simple tastes, and Sam & George's satisfies all of them.  From the awesome owner who welcomes everyone in the door like you were coming into his home...to the selection of casseroles/skillets...to the bottomless cup of coffee..to the expansive menu that I haven't put a dent in after 2 years...to grandma ringing you up as you leave, everything is just the way I like it. I knew I had found my place when the very first time my GF and I went.   I enjoyed my bowl of homemade soup so much (did I mention the delicious soups?) the owner came over and gave me another bowl on the house.  That was before I got my perfectly executed patty melt and she got her turkey melt packed with real off-the-bone turkey that tasted like Thanksgiving. My GF looked at me and said ""I don't think I've ever seen you so happy"".  We've been return customers ever since and have seldom been disappointed.",0.9857,0.815,0.179,0.006,0.7036796536796537
2010-08-02,5.0,"I am rating S&G a five star not because of the food but the memory. Since before I was born my grandmother would start her morning at the golden apple then move over by johnny once they opened. I would visit her on weekends and then wake up at 8am and walk next door and eat. My family would come and all get together and eat.  Okay now to the food, yes its a diner but the food is great, and the size is better. Everything is really fresh and cooked to order. I would remember my younger years walking home from the bar 3am and would see Johnny's father inside squeezing oranges for the Orange juice.  Eat here and keep local places alive!!",0.9744,0.831,0.169,0.0,0.35
2010-08-01,5.0,Come here hungry and don't expect to eat an entire skillet if you don't have the correct mindset and complete willpower over your body.,0.0,1.0,0.0,0.0,0.5125
2010-07-28,2.0,"Three of us woke up on Sunday morning with a serious need for ""diner breakfast"".  After a quick Yelp search, we were on our way to Sam & George's.  There was a line, but it moved quickly and the owner was constantly there to take care of anyone who was waiting. Did we want coffee, water or pop? If so, it was brought in less than 30 seconds.  They turn tables pretty fast here and the bus boys are seriously some of the quickest and most talented I've seen. After 10 minutes or so, we were seated in a booth in the front of the restaurant.  The menu is a little overwhelming. Just because you have 200 ways to combine your ingredients, doesn't mean you should list them all.  My two companions each got one of the famed skillet melt things while I ordered a bowl of soup. I know. Weird. BUT while waiting in line, I had seen at least 6 people order the soup with a little basket of rolls and thought they must know something I didn't.  Our server was young and probably inexperienced. She didn't remember who ordered what or that I'd asked for the rolls with my soup (the rolls cost extra). My soup actually didn't come out until about 5 minutes after everyone else's food cause it was forgotten.  The ""homemade"" chicken with rice soup tasted... okay. I didn't have a single piece of chicken in the whole bowl, and it didn't taste too terribly different than Progresso, so I'm not sure what the big deal was. After my rolls were forgotten, I asked for a side of hash browns instead. These were also forgotten in the window for some time, but when they finally did come out, they were good. You can tell a LOT of butter went into the making of those potatoes.  Both the skillets were pretty gross. Both guys I was with are pretty big eaters and they both left more than half their meals on the table. The quality of ingredients just wasn't there, and at a pretty high price for diner breakfast food, I expected more than undercooked bacon and what tasted like canned mushrooms thrown on top of hashbrowns and covered with globs of cheddar cheese and scrambled eggs. Yuck.  Sorry Sam & Georges. The owner seems like an awesome guy and the bus boys work their tails off, but the service and the food were enough to turn me off for good.",0.9914,0.828,0.126,0.047,0.5658842305037958
2010-07-20,4.0,"I don't know if I can say anything more than all the other reviews haven't.  Friendly people, good for kids, acceptable portions for the price...in short, its one of the better (and better kept) establishments in the area.  My only complaint is that it can get so crowded during the weekend mornings!  =P",0.6359,0.702,0.182,0.115,0.4972222222222223
2010-06-28,5.0,"I have yet to be disappointed with this place.  I strive to one day be a hash brown connoisseur...with that in mind I always order hash browns when I go out for breakfast and this place...Sam and George's, is my golden standard for what good hash browns are. I have not found a place to top these guys...and I don't know if I ever will.",0.1531,0.872,0.077,0.051,0.47000000000000003
2010-06-01,5.0,"My boyfriend grew up in the neighborhood and talked about this place, but we didn't visit together until last weekend.  I'm sure we will be back.  When I'm in the mood for a good breakfast I don't want to have to wait in a long line for a table and then forever to get my food.  This place was quick, clean and tasty...not too fancy.  You can show up after church or just throw on a pair of jeans.  No need to get all decked out for a fancy brunch.   They have great options for skillets, omelets, pancakes etc. and don't get in a tizzy if you ask to change something up a little bit.  Breakfast is such a simple meal yet so many places can't get it right.  S&G definitely can!  I would recommend this place to anyone looking for a good breakfast standby.",0.9772,0.801,0.173,0.026,0.49322751322751324
2010-05-23,4.0,"I used to live in lakeview back in the day and that is how i first found this place.  In fact, it was my second meal after I moved here over 6 years ago.  I live in a totally different neighborhood..probably only a few miles away but in the land of food...there are just too many options inbetween.  Well, today I woke up super hungover and the only thing that could put that to rest was s & g.  I don't think we have been in this place for two years and the owner took one look at us and says, ""Heeeyyy!  How have you been?""  I love that.  But, the awesome thing about it....he is like that to all customers.   So lets talk food.  The menu is gigantic.  I have had their egg skillets before but it's been a while.  I had a sandwich with tater tots.  It also came with soup.  We ordered a half cut up watermelon too that was just soo tasty.  I'm sure it's probably pretty standard diner food options but when the food and service is good...this is how this place has around for 50 years.",0.9843,0.835,0.151,0.013,0.5209150326797386
2010-05-23,5.0,I have been coming to S&G since I was a little girl for family breakfast. and when I say family I mean my grandpa and a bunch of aunts my mom everyone kids. They are always so accommodating making room for all of us quickly and bringing out every ones food together and hot. Its all just good breakfast food and they have tons of yummy skillets to pick from. It is definitely a neighbor hood place which I hope will be around for me to bring my grand kids for breakfast.,0.9313,0.841,0.159,0.0,0.6625
2010-05-06,5.0,"We've been going to S & G for breakfast at least a couple of times a month for several years and I have to say that it's one of the most consistently great breakfast experiences I've had in Chicago.  An old-fashioned diner with no gimmicks, no ""scene""- just fantastic breakfast. The service is above par- the super-friendly, efficient waitstaff means customers feel welcome and your coffee cups stay full. The food always arrives VERY quickly and exactly as you ordered it. The menu is enormous (and accounts for nearly every sandwich or lunch/dinner dish you can image) but we've really only tried breakfast.  Personal favorite: Hobo Banquet with broccoli (hash browns, egg, cheese, broccoli).  mmmmmmm! We LOVE that they always have huge amounts of fresh fruit available, as well.",0.9754,0.786,0.192,0.022,0.5789473684210528
2010-04-25,3.0,"Oh Sam and George's...you left me wanting so much more especially for how much you charged!! My room mate and I came for brunch. The menu is  as advertised here and there are plenty of options to choose from. We each went with a skillet. The food was nothing noteworthy. It is standard diner food, which if you are looking for a hangover cure might be right up your alley.  The impeccable customer service bumps my review up a rating. The owner takes real pride in his restaurant.",0.2924,0.945,0.034,0.021,0.4107142857142857
2010-04-05,4.0,"Oh, I really enjoyed this place.  I had breakfast at the counter with a friend on a busy Sunday afternoon.  It was packed, of course, but I loved being able to sit at the counter and watch the owner and his family work together.  His mother still works the cash register and greets customers as they enter.   This is standard Greek diner food and it's amazing!",0.9527,0.766,0.234,0.0,0.475
2010-03-21,1.0,"Went once, will never go back.  The Guy at the front is not friendly and has gone off on customers and his own staff.   It's not cute or funny.  His staff is terrified of him and they'll whisper that to you as they're pouring the dishwater-flavored coffee. Make sure to review your check.  They do nickle and dime you for every request (charge for an extra butter, seriously!).   God forbid you ask the Guy about the charges for the extras - you'll get bounced out so fast your head will spin. If you want a good diner experience, there are dozens of other places within a few minutes. Your choice.  If decide to go, I hope you have a pleasant experience rather the extremely unpleasant experience that I and my party had when we went.   Who needs that?!",-0.5253,0.759,0.113,0.128,0.6248015873015873
2010-03-20,5.0,"I had to do a review to off set that ""gastronome"" douche! I'm here once a week if not more. I absolutely love this diner! I love the owner and wait staff and i love the service and attention to detail from all of the employee's. I go here cause it feels good to be here. They treat everyone well and want you to enjoy your meal. I am always happy with my food. And they are awesome about making sure your coffee doesn't get low. Joe H's special (skillet) or the Denver omelette with a side of corned beef hash. I'm gettin hungry thinkin about it.",0.8892,0.671,0.219,0.111,0.6509379509379509
2010-03-16,2.0,I thought that this was the friendliest dinner that I have ever been to. I can totally imagine myself living next to this and becoming a regular. We ordered the tex mex skillet & the Joe's special. They were both just average.,0.743,0.847,0.153,0.0,0.4413919413919414
2010-03-07,1.0,"This place is horrid. A fellow gastronome and myself headed here this morning with high hopes, based on the Yelp rating.  One of our favorite places, Bakin and Eggs, is just a few doors down, but we decided to pass in favor of a new adventure.  Boy, were we disappointed. The food was sub-par, something you might expect at a Denny's or Ram's horn.  I don't understand what all of the buzz is about.  The only thing that was exciting was the kitschy decor - local teams plaques hung on the wall and random art scattered about. So, we agreed it was ok, and would probably settle on rating this eatery a 2 or 3 on Yelp.  Until we went to the front to pay.  Yikes. Well, the itemized bill said .50 next to potatoes well done and I asked what the extra charge was for.  They told me it was probably for the sourdough bread I ordered (is there really a valid reason for an upcharge on 2 slices of sourdough over two slices of white or rye?  REALLY?)  My friend said, okay, well you should tell people that when they order.  The owner came over and snarled that it was written on the menu.  We explained that we read it pretty thoroughly and did not notice and suggested waitresses might mention that there is an upcharge whenever someone orders something that requires one - just a friendly piece of advice; feedback from a customer. Well, that didn't go over so well.  The owner started yelling us and telling us we should eat somewhere else then, including some obscenities.  He also went on a tangent saying that we had four dollar drinks from Starbucks in our hands, so we could probably handle paying the fifty cents and that fifty cents is not a lot of money.  Thank god he didn't notice her Louis Vuitton bag.  My friend responded that we might next time, but that it wasn't about the money, it was just the principle and that we couldn't understand why he was so upset about our suggestion.  He then screamed, ""Please don't come here ever again"".  Whoa - what an idiot.  Oh, and by the way, it cost just as much money to eat at this dump as it would have to go to Bakin and Eggs or Bongo Room or somewhere else delicious.",0.9911,0.794,0.152,0.054,0.45362758014931925
2010-03-06,4.0,"This place is just the diner I've been looking for not too far from my apartment. With all the chic places that have poped up that serve breakfast, sometimes I just want a no frills diner. Upon walking in the owner showed us our options for seats. Throughout the lunch he was walking around not only hosting but serving, cleaning tables, and being actively involved in all that was going on in the place. The menu at this place is massive but has a lot to offer. The soups are pretty on point and I love that they come with the assorted basket of odd rolls. For the amount of food, the price is right on. I also loved that Yia-Yia was running the cash register.",0.9555,0.815,0.152,0.033,0.7539682539682538
2010-02-27,4.0,"I'm here now and it's great! The food is made with fresh ingredients, the staff are polite and friendly and it's amazingly clean. It's refresing to experience this combo at a local restaurant. (from Melody C., Scott L's fiancée)",0.9167,0.725,0.275,0.0,0.49000000000000005
2010-02-26,4.0,"Talk about a classic diner in our classic city. This place has it all; an extensive menu with an entire page devoted to skillets, pushy yet warm waitresses, and one of those spinning dessert trays on the counter.  My brother introduced me to this place because he is addicted to the 'Wayne's skillet."" I'm not completely sure what is in it, but it looked like a hybrid Denver Omelet skillet with spicy sausage added. What do I like to eat there? It is a personal policy of mine to order the same sando at every diner I go to, just because I know it will be good. No diner can mess up a grilled cheese with bacon and tomato, side of fries, chocolate milkshake. So bomb. Check this place out anytime.",-0.0718,0.805,0.096,0.098,0.41641414141414135
2010-02-25,5.0,"One of my favorite places for breakfast in Chicago.  Back when I lived in the neighborhood not a weekend went by that I did not have a breakfast at the good old S&G.  So much better than the Golden Crapple across the street.   Sometimes I struggle between breakfast and lunch items as I love the soups here.  I am not a fan of cream soups, but the Cream of Chicken Rice on Sunday is great.  Saturday Lentil is tasty as well.",0.9301,0.764,0.199,0.037,0.5666666666666667
2010-02-22,5.0,best place around.food is and always great.good for families.treat u like familyLove this place,0.7717,0.621,0.379,0.0,0.3
2010-02-17,4.0,"S&G S&G S&G!!! Yayyy I've finally found it!  After having been horrrrribly misguided to places such as Stella's Diner and Wishbone, I'm happy to discover that a very good breakfast restaurant DOES exist in Lakeview!! VERY large menu-which I guess can be viewed as a good thing or a bad thing. I choose good. 26 skillets to chose from. Don't waste your time with the other stuff, you want a skillet.  I had the Dudley Dooright-Hash Browns, Sautéed Onions, Tomatoes, Diced Canadian Bacon, Swiss Cheese with Two over easy Eggs.  I added Jalepenos bc they make everything THAT much better! yummmmm The little things count: English muffin was enormous and perfectly toasted.  The coffee was fantastic.  OJ (FRESH SQEEZED) - the best!!! The staff-omg-couldn't say a bad thing about them-Truly exceptional customer service! Thanks for a great breaskast, I'll be back soon!",0.9881,0.699,0.258,0.042,0.5887003968253969
2010-01-25,4.0,"What a nice find!  Open until 4, which worked for us....a little late start to our Sunday Funday.   If everyone who had mediocre hashbrowns allowed a tot substitution, I would eat more tots.  I love tots.  I especially loved these tots.  Golden, perfect, tottasticness.   I had scrambled eggs (meh), wheat toast (YUM!!), bacon (YUM YUM!!!), and the aforementioned tots.  My friend's was identical except for over easy (yum) and a croissant (HOLY YUM YUM!!!)",0.9649,0.763,0.237,0.0,0.6694444444444444
2010-01-21,5.0,"There isn't a single bad thing to say about S&G's.  The owner guy is always up front chatting with everyone. My friend thinks he's too friendly- but my friend is also a grouch.  The reason you go to S&Gs is for the skillets. Many hangovers have been cured by their skillets. There are 20 of them- go for the popeye or the porky pig (ham, bacon and sasuage).  I love that any waitress will refill your coffee when walking by- in so many places the waitresses don't work together.  If there is a wait at S&G's, don't head across the street to the Golden Apple. I have no issues with the apple, but the reason that S&G's has a wait is because its better.",0.9182,0.802,0.146,0.052,0.4976190476190476
2010-01-06,5.0,"Everytime my parents come in town, we get breakfast/brunch at this restaurant.  The service is outstanding.  There is always a line on the weekends, but they are so fast at getting you seated and getting your order out, that you never have to wait too long.   If you're wondering what to get, you must try one of the skillets.  I always read them all and debate whether to try something new, but I always go back for the avocado.  Hashbrowns on the bottom, then a layer of avocado, melted cheese and eggs on top...it's hard to go wrong. You even get toast/jelly on the side!  Thinking about it makes me want to go there for breakfast this weekend!!!",-0.6083,0.91,0.033,0.057,0.5387445887445887
2010-01-05,5.0,"Clean, great food, great service Let me preface this review by saying I've been living in Chicago since July and have yet to find a breakfast joint that I really liked.  I think this is that place.  I stopped in here after reading the reviews on yelp and I loved the place.  I had a  combination omelet (basically a western omelette w/ tomatoes and mushrooms) and a coffee.  The omelette was exactly how I like it, with the cheese melted on the inside (I find it strange that a lot of the other places put cheese on top but not on the inside) and it was huge.  The hash browns were a bit undercooked but I didn't mind.  The wheat toast that came with it was mutli-grain and tasty, it came unbuttered and uncut (this is another oddity I have seen in a number of places) I assume they do this for those who prefer jelly.  The plus side is that they gave me a bowl with cups of fresh whipped butter rather than margarine.  The coffee was fresh and stronger than most diner coffee.   The service was great.  The place was pretty empty since it was 10:30 AM on a Tuesday, at various times my server, the busser, and the manager (owner?) came by to fill my coffee and ask me how everything was.  I'm used to family-owned Greek diners like this (they have them all over Detroit, where I grew up) and they always seem to offer up quality food with great service.  At one point an older Greek woman came in and the manager (who I assume is an owner) said ""oh mom, what are you doing here?""  I got a kick out of the conversation, apparently she was waiting to go meet with the priest at the church across the street. Overall, great place for breakfast.  The menu was huge and I will definitely go back to try the lunch/dinner menu.",0.995,0.812,0.173,0.015,0.5038690476190476
2010-01-02,5.0,"FIVE STARS FOR SERVICE. The coffee gets refilled like the beers at an indian casino.  Our coffee must have been attended to by four separate waitresses.  The customer truly seems to come first at Sam & George's. The skillets are what to look for.  They have about 30 of them, each with an interesting name, which makes me think they're smart restaurateurs.  Also smart were the carafes of water on every table, which is a huge plus. Our waitress was witty, friendly and attentive.  The gentlemen who appeared to be in charge personally greeted every person that walked in the door and thanked each and every person who walked out.  I am telling you, the service at this breakfast joint was impressive.  There are a lot of $25-entrée places downtown that could learn a thing or two from Sam & George.",0.9758,0.821,0.179,0.0,0.6719047619047619
2009-12-26,4.0,"This is definitely a breakfast place.  I've been here a lot, and we almost always get skillets - ok, today I got a burger - not the best choice.  I've had better burgers, but when it comes to skillets, like a hobo skillet or a la bamba skillet, well, this place gives any other breakfast joint a run for it's money.  Just remember, if you go here and are driving, try to find a spot on wellington (east of lincoln) since it's free from permits or meters.  the waitstaff here is fun and friendly - I've never had a bad experience at this place.  Highly recommend for an afternoon brunch.",0.9831,0.718,0.264,0.018,0.4881666666666667
2009-12-24,4.0,"The quintessential Greek cafe; exactly what I was looking for. Big breakfast menu, good food, pleasant help. What more can you ask for? The owner seemed to be on a first name basis with almost everyone who came through the door, which is always a good sign.  I'll definitely be going back, I love diners for breakfast.",0.9565,0.715,0.285,0.0,0.40454545454545454
2009-12-14,5.0,"Yeah, I did just rate Sam & George's above a Rick Bayless restaurant.  What of it?   Does Rick Bayless have an omlet called ""The Hobo""?  No, he doresn't.  Point: Sam & George.  Bayless: zilch.  These guys are an old school diner, where the owner asks you how you're doing on the way in.  For breakfast, they make omlet dishes mixed with various ingredients: from italian sausage, to peppers, to Chorizo to mutliple kinds of cheeses.  And of course, they've all got funky names.  For lunch, they have the standard diner fare, and it is all good. Sam & George both rock.   ""You haven't seen the last of me, Sam & George"" - quote from Rick Bayless",0.4329,0.921,0.048,0.032,0.21458333333333335
