date,star,text,compound,neutral,positive,negative,subjectivity
2010-06-25,5.0,"My favorite thing about Ian's is how I never know exactly what's going to be served when I go in.  Is it going to be mac & cheese?  Or steak and fries?  Or barbecue chicken?  I never know.  And the beauty of Ian's is that I know they are all going to be delicious. I love going here when Cubs games are not going, because it's very laid back and good.  But even if you're looking for something right before or after a game, I would recommend it, if for no other reason than the novelty of eating some type of pizza that you have never had before.",0.9609,0.803,0.178,0.019,0.5464285714285716
2010-06-20,5.0,"Okay so I see that I'm a little late in discovering the drunken blessing that is Ian's - but mac n cheese pizza??? I mean, MAC N CHEESE PIZZA??!?!!!! My two favorite ooey gooey cheesey fat kid foods combined?! ::sigh:: foodgasm! Although my tongue is angry that I've only just discovered this amazingness (that's been right in front of my face in my own neighborhood no less), my hips are grateful I'm sure. My friends chose Steak & Fries pizza for their 2am fix, but who cares. Mac n Cheese pizza, guys! The Pesto/Spinach/Feta slices looked really good too. $3.50ish for slices as big as the plate itself is a bonus! Can't wait to go back and indulge in a ridiculous way",0.9759,0.693,0.234,0.073,0.6319179894179893
2010-06-16,4.0,"I was ecstatic to discover Ian's in Chicago! The Madison standby has all of my faves, like Mac N Cheese and peppers & mushroom. Ian's giant, floppy slices are a welcome break from the carb-tacular deep dish mainstream. And not only do you get the Madison flavors, but the crazy drunks as well. To wit, we got to witness a shouting match between rowdy University of Michigan fans that ended up with the table being knocked over. Did they get kicked out? Hell no! This is Ian's. That shit comes standard.",-0.9222,0.748,0.082,0.17,0.7142857142857143
2010-06-15,5.0,"How many different ways can you say ""yum""? If I could use every one of them to describe Ian's Pizza I would! Macaroni Pizza? soo good!  Love this place!",0.8532,0.75,0.25,0.0,0.5750000000000001
2010-06-15,5.0,"If you are looking for pizza that is really good and totally different from anything you have ever tried Ian's is the place to go.  I love this place because it is open late, has amazing pizza, and great service.  I have tried their nacho pizza as well as many others.  Every slice I have tried has been good.  How can you go wrong putting comfort foods like macaroni and cheese on pizza?",0.9701,0.68,0.285,0.035,0.655
2010-06-07,4.0,"Ian's Pizza, located on a busy stretch of Clark St. in Wrigleyville, has some great options for vegans. They generally sell pizza by the slice, but since vegan pizza is a specialty item, you have to order a whole pizza. No big deal, because for $14 you can get a small pizza (looks more medium to me) with whatever toppings you'd like, that includes the vegan meats. They use Chicago Soydairy's Teese cheese, which apparently has been reformulated to melt and stretch similar to Daiya's vegan cheese. Although Teese has been upgraded, I felt it wasn't very flavorful and feel that Ian's can benefit by switching to Daiya, but that's my opinon. Overall my pizza was good. I will surely be back when I'm in the area.  3.5 Stars",0.9403,0.852,0.127,0.02,0.3538461538461538
2010-06-07,5.0,"Sometimes, I feel like a creature of habit. And. I guess so. If I am along this strip of Clark when I am in Wrigleyville, I will come here. Especially if I am hungry. And, I was HUNGRY this past Friday night. So off we went to Ian's. We walked there and there was a line out the door. No sweat. I wanted pizza and I wanted it now so I stood in it. I am updating the review for this fact. They get an extra star from before. ""Why?"" you ask. Well I'll tell you why: this line was the most efficient that I have stood in in a very, very, very long time. I was impressed. I was shocked. I was...full, because it only took about 10 minutes maximum to get through the line, where I tried the breakfast burrito pizza (to die for) and my go to favorite, Mac and Cheese pizza.  All in all, Ian's can color me impressed because I am.",0.8173,0.844,0.104,0.052,0.717
2010-05-29,4.0,"I came here specifically to have the mac and cheese pizza.  It was not as weird-tasting as I expected it would be, and ended up getting it the second time I went as well.  I also tried their buffalo chicken pizza which was more ""normal"" but quite good.  There are several other concoctions I'd like to try. While I prefer either thin crust or deep dish to the more New York-style crust used on most pizzas here, it's definitely a great place to grab a quick, economical meal.",0.9601,0.806,0.194,0.0,0.5205965909090909
2010-05-28,3.0,"The Wrigleyville branch definitely has its own feel, while also staying true to the Ian's name. For example, the restaurant is painted in traditional bright Red, with the lovable Ian's Pizza pie logo. But, they pay homage to their proximity to the Cubs and include a baseball in the logo. One not-so-pleasant difference between this location and the Madison one is the music. They prefer to play loud, weird stuff. Not the best when you're trying to yell your order to a worker with lots of people around. They have some cool regional varieties of pizza that Madison doesn't have, my favorite being S'mores pizza. When I went with my friend Felicia, we both got two slices, which we agreed was more than filling. I grabbed a slice of a chicken parmesan and a piece of S'mores pizza to add a dessert. The chicken parmesan featured rigatoni noodles with chicken and delicious cheese. It was cooked to perfection and tasted awesome. They made the S'mores pizza while I waited (it only took about 14 minutes), so I got it when it was nice and fresh. With toasted marshmallow, bits of graham cracker, chunks of hershey chocolate bars and a nice drizzle of chocolate syrup, it was amazing. The end of the crust was a little overcooked, but that was a small worry, as the rest of the pizza was freckin' sweet. Overall, I am pleased that there is an Ian's branch to serve my homesickness when it gets really bad. Nothing is the same as the one in downtown Madison, but this is a nice alternative! The Price Rating: The Journalist- Kids who are doing alright- this is the middle of the road. They are good with money, but aren't going to get rich in an industry of dying newspapers",0.9861,0.779,0.17,0.052,0.6879901960784313
2010-05-23,5.0,I moved to Wrigleyville in July 2008.  One of the first places I stumbled upon to eat was this new Pizza joint just 1 block south of Wrigley.  I can say I have eaten there about 50 times and love the BBQ Chicken Pizza. These guys get Pizza and know how to deliver a great product.  Keep up the great work and try Ian's,0.8885,0.779,0.179,0.042,0.6396464646464647
2010-05-22,5.0,"Stopped by Ian's today, and learned that they're now delivering year-round, except on the days there are Cubs home games (understandably, as the cars can't go through there at all...). I am so excited! Also, their ready-to-eat slices are tasty. XD",0.793,0.79,0.17,0.041,0.75
2010-05-20,5.0,"My crazy cravings and I. It's pass 11pm and I'm craving thin crust pizza. Log on yelp, check off places that are still open with highest ratings. Boom, Ian's Pizza shows up. Skim through some reviews of mac n cheese pizza? Myself thinking... hmm, I never been here.. wtf is this place. Picked up some friends and punched in my GPS. After cruising on 94W.. where the crap am i going. When i finally pulled into Belmont and Clark... ohhhh... this is Wriglyville. Ha, I've been in this neighborhood before. I could have took LSD! I'm an idiot and my GPS is an idiot.  As we venture in, so many delicious looking thin crust pizza, along with the popular mac n cheese pizza. I didn't feel like standard toppings and they were out of the special (Pancetta). Buffalo chicken and mac n cheese is what I got. They got, some ranch chicken, philly cheese steak, and the spinach mushroom. Wow, this pizza is excellent. It taste just like how its titled. Crispy bottom, and soft on top; this is amazing. With their hours of operation and their delicious variations of toppings and taste, I have a place to goto when I'm craving thin crust pizza.",0.9666,0.775,0.155,0.069,0.7813664596273291
2010-05-20,4.0,Ian's has great variety and quick service.  Don't hate yourself for getting the brownie either...,0.7963,0.647,0.353,0.0,0.7166666666666667
2010-05-19,5.0,Just went before a Cubs game with two friends who were from out of town.  They both loved it.  One girl who is my friends sister from Ohio has never really been out of her small town and fell in love with the pizza a penne with mushroom and white sauce.  She had to go back for seconds.,0.936,0.784,0.216,0.0,0.3428571428571429
2010-05-17,5.0,"OMG - I love pizza, I mean I am a NY'er and what NY'er doesn't love pizza...especially the stuff you can fold and eat...none of that deep dish for this NY'er, I want to fold my pizza and eat it! I discovered Ian's after a night at the Wild Hare (review to come later).  The line was very long, but a friend said we had to stay and try the pizza, so we did. It was more than worth it! I haven't had pizza this good since living in NY. I had the chicken parmesan and the mac and cheese pizza. So good! I will be back!",0.9753,0.785,0.215,0.0,0.4582692307692309
2010-05-15,5.0,"While in Madison a few months ago a friend took us to Ian's after a night out.  Slight problem... I've been obsessed ever since.  The good news is that the Ian's on Clark is just the same!  Macaroni and Cheese has been my favorite meal since I was a kid, so I'm pretty much a one trick pony when it comes to Ian's.  Yes, it 's something to get used to but it's so creamy and cheesy!  Yumm!  I have also tried a few others with meat and different toppings and they were just as good. Looking for a fabulous thin crust?  Head to Ian's!",0.9539,0.797,0.181,0.022,0.5958333333333332
2010-05-14,4.0,"Its creative all right.  Its super fun and exciting.  Its open late... BUT its in Wrigleyville! Its not that I don't like Wrigleyville - well, I don't, but I have no issue with it as I am never in the area, but now that I ate at Ian's, I am torn.  The ideal time for me getting a slice of pizza is later in the evening when I am coming home and need a bite to eat.  BUT its the same time that the place is filled with drunk obnoxious people, people that I want to avoid as much as possible and which I ignore after gazing upon Ian's pizzas. Oh, the sights.  So many versions to try... so little time.  I've had the mac and cheese slice.  YUM.  I will have it again, but I don't think its as good as everyone says.  Its good, but I had my expectations up really high after I heard so much about it. Just yesterday, I had the black bean and guacamole version.  Now that is what I call a pizza slice.  The black beans gave it a unique taste and the guacamole left my mouth feeling smooth, as if soft cream coated my tongue.   Come here earlier, before people get drunk.  Its a fun place.  If you must go late and have little tolerance for drunk people, send your friend to grab a takeout and enjoy the pizza in a calmer environment.",0.9705,0.735,0.177,0.088,0.571376488095238
2010-05-14,5.0,"WOW! just moved to Wrigleyville and this is literally right across the street from me.  Went there the other night and had a slice with asparagus and goat cheese (sounds weird but OMG)  it was amazing! one of the best slices of pizza i ever had.  I also tried the mac and cheese, and buffalo chicken and I can't wait to try all the rest! highly reccomended.  the girls were insanely friendly too and you get a card they stamp so you get a free slice after you get 10 punches, awesome",0.9862,0.72,0.268,0.012,0.7182467532467532
2010-05-14,5.0,"Ohhh man, Ian's Pizza is LEGIT.  The guacamole burrito pizza is so freakin amazing, I've never had anything like it in my life!  The crust is perfectly chewy and has that delightful crunch on the bottom that comes from warming it in the oven after ordering. mmm mmm MMM!!!  Also tried the cheese (yummy) and macaroni & cheese.  I really wasn't blown away by the mac n cheese...it was kinda bland...but I think I'll douse it in hot sauce next time which should do the trick. But you MUST try the guacamole burrito--it's like eating 7 layer dip on top of pizza. Amazing.",0.9519,0.775,0.178,0.047,0.6687500000000001
2010-05-08,4.0,"I like the original pizza flavors here. If you like mac n' cheese, and I do, then the Mac n' Cheese slice will hit the spot. Our favorite was the tangy BBQ Chicken and Ranch.  The Philly Cheesesteak was also tasty.",0.8519,0.773,0.227,0.0,0.9
2010-05-06,5.0,One of the best thin crust pizzas in Chicago. Mac n cheese pizza is surprisingly amazing. Great place to bring some beers (byob) and grab some  pizza before or after a cubbies game. The florentine pizza is really good as well.,0.9631,0.624,0.376,0.0,0.6333333333333334
2010-04-30,4.0,"Having come from Madison, WI I was really excited to find out Ian's was coming to Chicago. They did not disappoint. In fact, they exceeded my expectations by expanding on their already awesome menu.",0.8422,0.768,0.232,0.0,0.875
2010-04-28,5.0,"I am an Ian's Pizza official Pizza Slut. I have the t-shirt. I'm going to grad school in Madison next year. I cheer for the Badgers in my sleep. I plan to continue to fill punch card after punch card for my free slices come August... and for now, I can keep biking a few scary blocks down Clark into the heart of Wrigleyville to get my fix. You cannot go wrong with anything with pasta on it and/or their weekly specials. That being said, I've never had a slice I didn't love, and if you are truly rendered indecisive by the sheer amazingness of options, ask the cool people behind the counter because they speak utter truth (I'm looking at you, hot Ian's employee man with the piercing... watch me get you more tips!) And, the weirder it sounds, the better it probably tastes. Oh goddamn I just love it here. I only wish they had Sprecher's soda like their big siblings in WI. Also, some drunk douchebag frat boys stole an empty bag out of the back of my bike locked out front once while I watched... hope they had fun with that. Thankfully inside Ian's is generally a bastion of sanity.",0.5588,0.724,0.146,0.13,0.5699494949494949
2010-04-25,4.0,"When in Wrigleyville, Ian's is a great place to grab some quick, cheap and tasty grub.  They have an array of interesting flavors (mac and cheese, chicken Parmesan, Chicago dog), and all of the available of slices for that day are displayed so you won't have buyer's regret.  The slices are large, with one being enough for an average female, and the prices are around $3/slice. An interesting twist is that Ian's is also a BYOB, and we all know beer and pizza go great together!!  I subtracted one star for lack of a system:  After ordering a slice of pizza displayed under heating lamps, the workers toss the pizzas into giant ovens.  Unfortunately, the slices seem to occasionally get forgotten about in the ovens, and on a few occasions I have gotten my pizza while companions on the same order are waiting or vice versa.  But, I guess the delicious pizza is worth the wait.",0.9501,0.829,0.133,0.038,0.5260651629072681
2010-04-24,4.0,"Yay! It's good. Thin, crispy crust, unique concoctions that sound only moderately appealing but turn out to be delicious. Friendly staff.  Kinda gets a little clustered when it's busy, but worth it. Mac and Cheese is better than it looks and sounds. And the Spinach Florentine is good to boot. Also, cheap food makes me smile.",0.98,0.634,0.366,0.0,0.5766666666666665
2010-04-22,4.0,"Ian's Pizza is my Chicago version of Champaign's Antonio's Pizza. They are almost identical. Both serve up good, interesting and cheap pizza-by-the-slice. Unlike Antonio's, however, this Ian's location is very small. They also insist upon playing unusually loud music that can be a little off-putting if you aren't a drunk Wrigleyviller. For $3 though, you can't really go wrong. Get a meal-sized slice, some free water and you're good to go.  One quick anecdote: the first time my friend and I visited Ian's, someone threw a rock through one of the restaurant's front windows, shattering it completely. It was February. Things got chilly, fast. Gives you a little insight into the area though. Drunk assholes everywhere - be prepared. Luckily, a good Samaritan chased the rock-thrower down though and the police got him. A douche bag arrested and great slice of pizza... perfect night?",0.9741,0.705,0.224,0.071,0.6567724867724868
2010-04-12,5.0,"Now that its baseball season in Chicago, its time to keep the Ian's tradition strong. You are doing yourself a favor if you get the Chicago Hot Dog or Guacamole Burrito pizza. Philly cheese steak is a close runner up. You can't go too wrong and the staff is awesome and can help you out. Call in advance if you want your pizza to be waiting for you! You can always spot the tourists - they order mac and cheese. Thanks Ians and crew for all that you do! If I ever leave Chicago, I know it will be a tearful goodbye with Ian.",0.958,0.808,0.181,0.011,0.7366666666666667
2010-04-11,4.0,"This place has awesome pizza by the slice, and you can't beat the fact that it's BYOB. I went here before a concert at the metro, and it was great. Nice guys work behind the counter and the place always has lots of comfortable tables and booths to sit in. The one thing that I will caveat this with is that I went on a saturday night around 830PM, and there were already drunken guys throwing up on themselves by 9....eh Wrigleyville. Just ignore it. :)",0.9413,0.791,0.182,0.026,0.875
2010-04-11,4.0,"Creative, inspired and delicious-- 'tis you, Ian. Ian's and I go way back, though I'm just now writing about our prolific love affair. You see, Ian's is who I go and see when I'm having a bad day. Conversely, I also find myself jonesin' for Ian on a day I'm smiling. Rain or shine, sleet or snow, that trek to Ian's is well worth bumping elbows with Wrigleyville's finest frat boys. My favorite slice is the signature mac 'n' cheese though I've also got love for BBQ chicken pineapple, spicy chicken quesadilla, and the burrito as well as the s'mores dessert slice. Yes, I'm still talking about pizza here! The only drawback is that these slices will run you almost $4 a pop. But, it's some of the best fat food ever!",0.9828,0.752,0.225,0.023,0.6805555555555557
2010-04-07,5.0,"It was my first visit to Chicago and I tried Ian's Pizza on my last night.  Though Ian's Pizza is much more like New York style pizza, it was my favorite restaurant from my whole trip... and I ate at a lot of places too! I was sad that the first attempt to go to Ian's was on a Monday night and they were CLOSED!  *cry* But the second attempt they were open, and thank goodness they're open late!  Too bad they didn't have all the types of pizza other yelpers had recommended -- I really wanted to try their guacamole burrito pizza!  Their menu says you can try and request for a pizza if you don't see it, but I'm pretty modest and I'd feel sheepish asking for a pizza, especially late night.   I wanted to try the mac n cheese pizza, but since it has so many mixed reviews, I went for what the server had recommended.  I got the pizza with pureed kalamata olives, roasted red peppers, and mozzarella.  SooOOo good!   My boyfriend got the cordin bleu which had bleu cheese, chicken, and ham on it and he was a big fan of his pizza too.  If only my bf and I weren't so full from eating out all around the city, we would've loved to have eaten and tried out more pizza slices from Ian's!   I have to be brutally honest and say that after living in New York City for a while, I am a food snob and Chicago food just didn't hit the spot for me.  BUT... Ian's Pizza.  Ian's Pizza hit the spot.",0.9553,0.834,0.117,0.049,0.533357771260997
2010-04-04,5.0,"This pizza is off-the-charts. You can order it by the slice or get a whole pie. The salads are made fresh and when you order- best part is that they aren't your average ""pizza joint"" salads. They have good, fresh, and delicious vegetables in them.  I first went there on a whim when my mother was in town visiting me. We were jonseing for pizza and I've heard of Ian's. Man, what a great choice it was. Mom got the mac'n'cheese pizza and I got the portobello mushroom, spinach, and tomato pizza. Amazing. Mouth-watering. A must go and must return. I know have them saved in my phone, a spot only reserved for my personal favorite food joints in Chicago.",0.9819,0.78,0.22,0.0,0.6380952380952382
2010-03-25,5.0,"You really can't go wrong with Ian's, even though they give themselves plenty of opportunities to fail.  Mac&cheese.... on a pizza? Steak and fries? Spinach and portabella? CHICKEN AND MASHED POTATOES? WITH BACON?!  These are entrees, not pizza toppings!  But with your first bite into that perfectly leaven crust with that perfect thickness and consistency, any hesitation will be overcome by one sensation and one sensation only.....MUST EAT MORE.  We came on one of those cold windy nasty March evenings that Chicago is so famous for, and yet the weather did nothing but accentuate how fantastically awesome this place is.  Coupled with some super-cool dudes behind the counter who were extremely knowledgeable (perhaps overly so?) about their pizza, BYOB, a casual atmosphere, and no bullshit pricing, this is just a great place for some great pizza.  Pure and simple...even though they make it as complicated as their imaginations can take them.",0.9473,0.76,0.161,0.079,0.8083333333333333
2010-03-13,5.0,"I love Ian's. My favorite pizza in the city. Just be adventurous and actually try some of the creative pizzas they have, it annoys me when I bring people here and they just get a slice of cheese and pepperoni after I hype it up so much. You won't be disappointed.",0.9053,0.697,0.256,0.048,0.6500000000000001
2010-03-11,4.0,"Believe the hype people!  Sorry deep dish fans, but Ian's belong in the conversation for best pizza in Chicago.  A 4  1/2 star yelp rating is pretty impressive and deserved.               Be warned the Mac & Cheese Pizza is extremely addictive, once you have had you will never be able to pass Ian's again without ordering it.  It never ceases to amaze me how restaurants can make an unhealthy dish even worse for you, why not add Mac and Cheese on a foot long slice of Pizza?  They have several other (somewhat bizarre) flavors of Pizza. I'm still waiting for the slice that features a cream filled donut on top (hey it could happen people).               Ian's is your waist lines worst enemy, but possibly your taste buds best friend.",0.3436,0.671,0.166,0.163,0.6444444444444445
2010-03-09,5.0,"I had the pleasure of experiencing Ian's Pizza tonight. Whenever I come to a place I know will receive a disproportionate size of my weekly paycheck and contribute to my growing waistline, I find the experience bittersweet.  After salivating over a dozen eclectic pizzas that ranged from mac n' cheese and taco to tortellini, I settled on the steak and fries variety. It was probably one of the best slices of pizza I've had since moving to Chicago. Cheese, steak, french fries, barbecue sauce on a thin crust...  I'm sad the slices are so big because I wanted to try them all. However, I remain confident I will accomplish such a task in the next month or so... The second best part behind the actually pizza is that a gigantic slice and can of soda is only five dollars with tax. This place is unbeatable.",0.9468,0.836,0.135,0.03,0.4371794871794872
2010-03-08,4.0,"I've had the Buffalo Chicken, Philly, and Smoky. I need to start trying different ones but I'm good for now. A must eat after a night of drinking in the area.",0.5927,0.875,0.125,0.0,0.7166666666666667
2010-03-08,5.0,"I have had chicken taco, and tortellini. That was great choice- delicious!! I can not wait to come back and try something else.",0.855,0.694,0.306,0.0,0.675
2010-03-06,5.0,So obviously this place doesn't need my review. I have to say how happy I am that I strolled in today after seeing a couple eating the most delicious looking piece of pizza I had ever seen.  It turns out it was a lasagna pizza.  This slice is now my current favorite over Pie hole's pizza selections.  SO GOOD!!!!!  All of the pizza in this place looked amazing so I feel pretty confidant giving it five stars.,0.9703,0.748,0.252,0.0,0.7666666666666667
2010-03-02,5.0,"Yuuuuuummmmmm! Split slices of pizza so I tried three - mac n cheese, chicken taco, and tortellini. All were pretty awesome but tortellini was my favorite. Let's just say I'll be craving this pizza till I get back there - and excited to try some more! Yuuuuummmmmm again! AND recently went back - tried the carne asada.  yum yum yum.  I just think you cannot go wrong here!  I tried little nibbles of all of my friend's pizza when we were here too - probably 4 more kinds - all awesome!  Always look forward to being in the Ian's vicinity!",0.9716,0.791,0.209,0.0,0.6423076923076925
2010-02-25,4.0,This place is perfect for grabbing a quick no frills slice.  I had 2 vegetarian slices - the mac and cheese - and then another one with spinach and portabella mushroom.  both sooo good and filling. cost was somehting like 7.50 total.,0.7845,0.745,0.205,0.05,0.7125
