date,star,text,compound,neutral,positive,negative,subjectivity
2017-08-27,1.0,I ordered pizza for a gathering.  The wait was 40 minutes. At two hours they called and said 25 more minutes. 3 hours later it never showed. Screw these clowns.,0.0762,0.953,0.047,0.0,0.25
2017-08-21,2.0,"I was looking forward to trying this place out after watching a video on social media on their chicken and waffle pizza. My boyfriend and I went here before the Backstreet Boys/Florida Georgia Line concert at Wrigley so we wanted to check out the pizza while we were in the area. We went here on a Friday afternoon and it was crowded. There's limited seating so keep an eye out for a seat or take it to-go. There's like window seating, one giant table in the middle where you sit with other people and like two booths. Luckily, my boyfriend snagged us a booth otherwise we would've been sitting on the floor. I ordered the Mac and Cheese and Chicken Parmesan Pizza (breaded chicken, penne, mozzarella, parmesan, asiago, and parsley). My boyfriend ordered the Breakfast of Champions (scrambled eggs, chorizo, green onions, and spicy mayo) and the Margherita. For $4.50 a slice, the pizza better be good. The Chicken Parmesan Pizza was the best one out of all the pizzas that we ordered but the overall the pizza just fell flat. Literally. The crust was so thin that the toppings fell off and it was messy. Overall, the pizza was average and way too overhyped. I wouldn't go out of my way to come here again when there's so many great pizza places in Chicago.",0.9289,0.891,0.088,0.02,0.4974025974025974
2017-08-19,4.0,All they need to do here is use spatulas for the pizza and wear hair nets other than that's is a great atmosphere! The music is ok depending on what night it is. It tonight the cashier was awesome with her glasses and big hair. I also receive a free slice card Bc I got the wrong slice so I ended up satisfied. Other Thant that this spot has become my new place of fun.,0.9535,0.729,0.235,0.036,0.5867768595041323
2017-08-13,1.0,After waiting in line for an hour for a mac n cheese pizza I was told they ran out of macaroni. I understand management isn't always able to predict events .. such as market days and a huge concert at Wrigley that have been scheduled for months. What I get upset about is I called 2 hours earlier to put in a to go order. When a mac n cheese pizza was taken out of the oven I was told it was a to go order. Weird I tried to do this two hours earlier?? As a former citizen of Chicago and someone who was in from California I am disgusted at whoever is managing this pizzeria now. In addition to all of this the employees try to pick a fight. Wow great customer service. I will no longer recommend this place to all my customers who frequent Chicago. Congratulations you just lost thousands and thousands of dollars.,0.6322,0.802,0.105,0.092,0.6431818181818182
2017-08-09,3.0,"Came here late night after visiting a few bars so eating greasy food was the objection.  There was three of us and we decided to get the large chicken n' waffles pizza. This pizza has fried chicken, melted butter, mozzarella, mini waffle bites, and a creme fraiche base topper with honey. So, while I would never order this pizza at 12:00pm or 7pm... at 2am it was rather delicious.  Overall this place fine for late nite food; however, it is crowded with drunk people (nothing wrong with that, just loud), and the place could be a bit cleaner.",0.1779,0.875,0.071,0.054,0.6791208791208792
2017-08-05,1.0,Ok so i had the Mexican Corn pizza! It was awesome BUT the service was poor ! The lady who gets the pizza got mad at me for asking what kind of pizza was being served and then the cashier attitude was NASTY ! I asked her which was which and she rolled her eyes and ignored me ! I will not be going back due to the service and i really did like the food and i'm from out of town so first impression is everything. They also allowed a lady put her feet on the table with shoes on which is very unsanitary.,-0.8997,0.753,0.09,0.157,0.517361111111111
2017-08-03,5.0,"Visiting from the bay and I gotta say!...this is a hella of a good pizza! I loved the Buffalo pizza and especially the mac and cheese pizza, that pizza was lit!",0.8383,0.759,0.241,0.0,0.8000000000000002
2017-08-03,3.0,"This location is a bit rougher than the choice Wicker location, but Dimo's is always pretty decent across the board for a quick greasy slice type of pizza joint, and I've never had a huge problem here outside of the cramped location and often rowdy local clientele.",0.695,0.81,0.142,0.048,0.5194444444444444
2017-07-25,1.0,This place is terrible. They overcharged my credit card. It was only by $2 so I'm not going to contest it but just super lame...,0.7269,0.705,0.229,0.066,0.8541666666666666
2017-07-24,5.0,"I'm not sure if it's all the beer I've had before I go to this place but this pizza is seriously the bomb. The slices are pretty big so 2 pieces should do you well. What I love the most about Dimos is the insane pizza creations they come up with. The Mac N' Cheese pizza is probably my favorite but I've had pizza with BBQ chicken and bacon on it, French fries on another. I'm pretty sure I even had some form of a chicken and waffle pizza as well. I will say this place interior wise is nothing beautiful. But for the drunk, stoned and hungry patrons of Wrigleyville this place gets the job done and doesn't hurt your wallet.  Also don't forget your punch card! After so many visits/pizza slices you get a slice of pizza on the house! Which is of course awesome because who doesn't love free pizza?!?!?!",0.9913,0.624,0.275,0.101,0.7672222222222222
2017-07-23,5.0,"First stop when I got into Chicago Friday night . Got 2 slices of their Mac N cheese and margherita pizza . Place was  full but we luckily found a seat and got our slices quickly.  Good vibe ,nice people , and most of all good pizza and nice selection of beer. Definitely recommend stopping by especially if interested in Vegan and veggie pizzas.",0.9846,0.583,0.381,0.036,0.6916666666666667
2017-07-23,5.0,One of the closest places to New York style pizza that I can find in the city filled with deep dish. I've been here for regular dinner and also late night drunken nights after the bars. All great experiences and delicious pizza! They have slices so you can just walk in and try it on your way to wrigley. Highly recommend!,0.9038,0.836,0.164,0.0,0.5901835664335664
2017-07-23,3.0,"Price is the best thing about this joint other than location.  2 very large slices of pepperoni pizza and a Mexican coke for around 10 bucks.  Food quality lacking.  Beyond greasy, won't be coming back.   To each their own.",0.6369,0.896,0.104,0.0,0.37202380952380953
2017-07-13,4.0,"Came here on a late night for Father's day. Service was great, mac and cheese pizza was very good. They're byob and it was great",0.908,0.648,0.352,0.0,0.7200000000000001
2017-07-04,1.0,So i placed an order tonight at 7 pm. for delivery of 1 pizza. i get an email at 726 saying it will be here by 805. I called the store at 836 and it was just leaving the store for delivery. Its now 901....no pizza. So over 2 hours for the delivery?? Inexcusable when they said it was going to be here an hour ago. I will never order delivery from here again.  To just call the store at 915 to ask why 45 minutes after I was told it was out for delivery....the guy at the store tells me the driver called when delivering and there was no answer. There was no phone call from the driver....and why wouldn't he walk up to my house like a normal delivery driver??! What kind of people deliver for them? If I could give 0 stars I would. The guy at the store told me I could go pick it up too. Gee great idea I should have done the tin the first place so I could have had dinner. NEVER ORDERING FROM HERE AGAIN.,0.6654,0.931,0.044,0.025,0.6583333333333333
2017-07-04,4.0,"A friend of a friend recommended this place and after a night of drinking and debauchery, we needed some fat and grease. It wasn't too shabby. It was crowded (a good indication, right?) and after about 20 minutes I was sitting down to a mac 'n cheese pizza. Pretty good for my first time trying something like that.  It's an unassuming place but I see why it's popular. I'd go back.",0.9194,0.77,0.23,0.0,0.5322420634920636
2017-07-03,4.0,Their delivery isn't the fastest compared to other places near by but the pizza was good!,0.63,0.784,0.216,0.0,0.4583333333333333
2017-07-02,2.0,"This place has good pizza, but is chronically lax about the accuracy of the product you'll receive. More often than not, the pizza received is either missing an ingredient, had an ingredient changed, or is just plain wrong. This happens way too often for me to fully recommend them.  Bottom line, you'll get a delicious product, but there's about a 50/50 chance that it won't be what you actually ordered.",0.7383,0.755,0.161,0.085,0.5010204081632653
2017-07-01,5.0,"Disclaimer: first time at dimos and first time there attempting to eat vegan, and long time Hungry Howie's cheesy bread fan. I recently watched What The Health, which has freaked me out into at least attempting to eat more plant based. Enter the first week of my attempt and I'm jonesing for some pizza. After some quick googling, I learn dimos, whose wrigleyville location is not more than 10 minutes walk from me, carries a vegan cheesy bread in addition to several vegan pizzas. I placed an online pickup order and their organized email updates made it easy to see when it was ready (it was ready earlier than they expected, which was also awesome). Picking up was easy- I ended up adding 2 slices to go for my boyfriend and the guy who helped me was very nice- he even suggested the (free) vegan ranch to compliment! But the real reason behind this 5 star rating is the sheer quality of the meal. And this is coming from someone who is a cheese lover- thank you dimos for making this attempt to be better to the earth and myself easier! While I understand this isn't health food, it's also nice not to feel like crap when you've gobbled down 4 pieces :) will definitely be back, vegan or not vegan!",0.9862,0.802,0.169,0.029,0.5751851851851852
2017-06-11,5.0,"Some fine NY style pizza. Came in here for a slice, and left with 3. Staff was friendly, wait time was good, and pizza was exceptional. Will come back again.",0.7845,0.767,0.233,0.0,0.43333333333333335
2017-06-07,5.0,BEST PIZZA PLACE EVER! my boyfriend and I come here every time after a game! they always have a hookup! Also great late night grub. Open until 3 am. Their pizza is also very creative. I love the fact that I come back and there's something new all the time!,0.9632,0.691,0.309,0.0,0.5116161616161615
2017-06-05,4.0,"Environment: very crowded with intoxicated people always. not the cleanest spot either. Not much space to sit. Line goes quick though. Food: the BEST of late night pizza. Huge slices bigger than my face, and all with the greatest ingredients.  Mac and cheese pizza: Carbs * 1000? Sign me up. Twas delicious. Try it- you know you want to. Buffalo chicken pizza: Tastes just like it sounds and nothing bad about it. The buffalo sauce adds a nice kick to the hearty pizza. Honestly makes a good combo with the mac and cheese pizza (see above). Mouth is watering from thinking about how great this pizza was. Stomach is hurting though thinking of how much pain I was in the next morning...worth it!",0.9815,0.722,0.237,0.041,0.5814814814814814
2017-05-30,5.0,"Whether it's a victory slice after a cubs W or a depression slice after an L, Dimos is my favorite slice after a trip to Wrigley Field. Fairly inexpensive but great quality. My favorites include their mac and cheese pizza, buffalo chicken pizza, and chicken and waffles pizza. Next time you're in Wrigleyville make sure you complete the trip with a stop at Dino's!",0.8871,0.725,0.203,0.072,0.7298611111111111
2017-05-29,3.0,"Stopped in and got a pepperoni slice. It was much better than my previous visit. I highly recommend going with the classics if they are fresh. Otherwise, order one of the crazy recipes without thinking of it as ""pizza"".",0.5709,0.722,0.18,0.097,0.5213333333333333
2017-05-27,2.0,Loved the idea of unique pizzas. Did not expect them to be charred. Would love the place if the pizza wasn't so overcooked.,0.8442,0.722,0.278,0.0,0.7999999999999999
2017-05-21,2.0,"Vegan pizza buyers beware: this is Daiya cheese central. If you don't like that gross creamy veggie-based cheese then you will NOT handle well with their unique offerings like ""ranch"" and ""mac n cheeze"". Next time I would compromise my values and dietary restrictions to never experience that amount of awful fake cheese again.  For vegan pizza trying to emulate real pizza, go crust and veggies...or buy Soya Kaas cheese and make your own at home!",-0.5037,0.789,0.087,0.125,0.56875
2017-05-21,5.0,"This place is literally the best by the slice place I have ever been!! Teddy and Jason are the most amazing people I have ever dealt with in the restaurant industry. I feel privileged to be served by these amazing humans, took care of all my pizza needs!!!!",0.9668,0.671,0.329,0.0,0.65
2017-05-19,1.0,"I ordered a pizza at 6:31pm. The expectation was set that the pizza would be delivered within an hour and fifteen minutes. It is currently 9:05pm, and the gentleman answering the phone at Dimo's stated the restaurant is ""busy."" Okay, that's fine. But you set the expectation that would deliver on your promise, and I am still sitting here with company at my apartment hungry as ever. This is completely unacceptable, and I will ensure to share this horrific experience with every individual I know. Do better Dimo's.",0.2862,0.771,0.141,0.088,0.5
2017-05-14,5.0,"Great cheap food. I ordered three 20"" pizzas and they were ready in 40 min. The employees were very nice and even gave me a handful of paper plates to take back with me when I kindly asked for some. The pizzas are a good deal - the 20"" can feed about 4 pretty hungry people. My favorite pizza was the make-your-own with mushrooms and roasted red peppers. Can't really disappoint a large hungry crowd with this.",0.9734,0.717,0.283,0.0,0.5898809523809524
2017-05-13,3.0,Nice spot if you're looking for a quick slice. Big fan of the BBQ chicken pizza. Would love to see some more selection and specials.,0.8519,0.693,0.307,0.0,0.6083333333333333
2017-05-05,5.0,"The chicken and waffles pizza was amazing. It's a small place with a few booths. Perfect for a quick bite before or after the game. By the slice, quick and cheap!",0.8313,0.769,0.231,0.0,0.6055555555555556
2017-05-04,3.0,Meh. Ok at best. Sauce too sweet as is typical in Chicagoland. Crust a bit too soft and too thick,0.8442,0.584,0.366,0.051,0.4625000000000001
2017-04-24,5.0,"It's not Chicago deep dish, but the pizza here is damn good. Dimo's is one of my favorites for the variety of fun and obscure flavor combos. The buffalo chicken is my go-to, but everything I've had here from mac and cheese to chicken and waffles hits the spot. They always have specials and even have vegan options which is great.  The price is right at just $4.50 for a large slice, and the staff here is always really cool and friendly. The environment is young and hip and the staff is too! They're always friendly and smiling when taking your order, and last time around when the restaurant was a bit slow, we saw staff dancing around behind the counter while making the pizzas! Highly recommend.",0.99,0.731,0.246,0.023,0.5356845238095238
2017-04-19,5.0,"Following an amazing night at the Full Shilling down the street, me and my friends wanted late night drunk pizza.  We googled the closest pizza place and Dimo's PIzza was it.  We walked in and there was no line. We ordered several slices of different toppings, including pepperoni, macaroni and cheese, buffalo chicken, and regular cheese.  It was absolutely DELICIOUS and CHEAP. It was such a perfect late night snack that we wished we went back for lunch the next day for something different.  Highly recommended for visitors and locals.",0.9303,0.788,0.167,0.044,0.526621682411156
2017-04-19,5.0,Hands down the best vegan pizza I've ever had. Dimos never disappoints! Service is always on point as well.,0.8306,0.646,0.354,0.0,0.29444444444444445
2017-04-17,5.0,"Stopped in for a slice after the Cubs game. La-Za-gna pizza of the day was delicious. Quick service, huge slice ($4-something). Would have been 4 stars, but staff earned the extra one for dealing with a particular episode of childishness I witnessed: Cashier: (addressing drunk Milennial white bruh with his head down on the counter) Are you ok, sir? Bruh: (looks up)....Is my pizza ready? Cashier: Just a moment. That will be $4.50.  Bruh: 450 what? Cashier: 4 dollars and 50 cents.  Bruh: .... Cashier: ..... $4.50. You have to pay for your pizza.  Bruh: I don't have to do anything.  Cashier: You have to pay for your pizza or get out of my line.  Bruh: ..... (Cashier ignores bruh and turns and helps the next couple in line.) Bruh: OH YEAH HELP HER BECAUSE SHE'S MORE IMPORTANT! I kid you not. Straight white men in your 20's, stop being like this, entitlement is not a good look bro. Every table around me asked wtf that guy's problem was as he finally realized he wasn't going to get any attention or pizza and slinked out of the restaurant to a chorus of ""BYE DOUCHEBAG"" from other patrons. So, if you like your pizza hot with a side of no-f***s given, Dimo's is the spot.",0.3637,0.729,0.133,0.138,0.5759661835748792
2017-04-17,5.0,"A little bit of a dive but if you're in a bind for pizza at any waking hour of the day (and let's be real... who isn't?), look no further than Dimo's. The macaroni and cheese pizza will change your life. Yes, they made macaroni and cheese a pizza topping, and I am all about it. They have other great flavor options, but I am loyal to the M & C! This place is perfect after a night of Clark Street fun.",0.9808,0.725,0.275,0.0,0.5572916666666666
2017-04-08,5.0,"In town visiting for the weekend and wanted a great late night snack!! We certainly got it! This pizza was unique, delicious, and very affordable! We'll definitely be back again when we come to town! Try their version of the Hawaiian pizza and BBQ chicken cheddar ranch pizza!",0.9364,0.75,0.25,0.0,0.6464285714285715
2017-04-06,1.0,This place is ONLY good if you are drunk and there's no other option. It's dirty (the public bathroom is connected to the kitchen so ANYONE can go back there.) The employees are friendly but the boss seems very rude. I took my time eating my pizza one day and I just got weird stares from a man (who I presumed to be the boss) sitting on his computer across the room. The place was empty and it wasn't even close to closing. Nonetheless I felt uncomfortable like I was not wanted. I won't be back anytime soon- you couldn't PAY me to eat at Dimo's.,-0.7254,0.771,0.084,0.146,0.5862820512820514
2017-04-02,4.0,"On an everlasting search for a ""New York slice"" in Chicago, this NY-er (born and raised) continues the search. Dimos gets close to that taste of home - the za is definitely displayed on the counter (at least it's not cooked to order deep dish). Friendly staff and quick service makes this a go-to while I continue my quest.",0.7096,0.9,0.1,0.0,0.45909090909090905
2017-03-19,5.0,"Just ate there tonight for the first time and it was amazing!! There was a long line but it went by quickly, very efficient. I had the chicken and waffles pizza and I could eat that every single day for the rest of my life SO GOOD",0.9394,0.751,0.249,0.0,0.5282312925170068
2017-03-13,3.0,"I mean, it's Dimo's. They specialize in weird pizza for a good price. They have vegan options. That automatically gives them an extra star! The Mac n' cheese pizza is way better than it sounds. Get it. You won't regret the cheesy goodness.  It's dive-y and a good place to go when you're drunk. Ask them to heat your pizza until it's well done, or it'll be hard to eat. It isn't the cleanest, but that isn't expected. My best advice? Go in with no expectations and an open mind. It'll be a drunken-evening go-to!",-0.4802,0.775,0.107,0.118,0.6024305555555557
2017-03-09,1.0,"NOT IMPRESSED. After a long night of partying, I stopped into Dimo's looking for some after-hours pizza and ordered a pepperoni pizza and some other flavor, I forgot.  This pizza is an abomination and a poor representation of Chicago pizza.  The crust was burnt, the pizza had little cheese, little sauce and little flavor.  I just wanted some delicious after hours pizza! So disappointed, I feel like their late night crew doesn't give a shit and that's not okay.",0.7937,0.703,0.183,0.114,0.6270833333333333
2017-03-04,4.0,"Dimo's Pizza is thin sliced, not your regular deep dished Chicago pizza, but nevertheless it was delicious. Great for a quick bite while bar hopping in the area, especially since a lot of places close their kitchens early or at least that's how it felt since I'm from Miami.",0.9136,0.808,0.192,0.0,0.5863247863247864
2017-03-03,4.0,"Dimo's is that divey pizza joint that you go to after a few drinks, but it's also worth checking out when sober! They serve thin crust pizza by the slice, but you can also order a whole pie. Pizza is close to NY style, but Dimo's is in the oven longer giving their pizza more of a crunch and toasty flavor. The folks here are super nice and patient. I had a hard time figuring out what kind of pizza I wanted, and they said that they could make me something off the menu. How cool is that? How accommodating! I ordered a half pepperoni and sausage pie, and it came out in 15-20 minutes. Dimo's is located very conveniently close to Wrigley Field, and has street parking. It's a small joint, but the decor is pretty funny and somewhat grungy hipster. It's definitely worth giving Dimo's a shot. I love the variety they offer on their menu. There's always something new to try!",0.9916,0.767,0.224,0.009,0.5226076555023924
2017-02-22,5.0,Love this place. The best pizza in lake view! So many different flavors! Definitely recommend for late hour pizza cravings!,0.938,0.525,0.475,0.0,0.5166666666666667
2017-01-24,4.0,"Pizzas are really tasty but hygiene is not good: they take slices of pizzas with hands before to heat in the oven, no gloves, dirty clothes... I won't come back because of the lack hygiene.",-0.9137,0.702,0.0,0.298,0.4
2017-01-17,4.0,Good pizza! Hipster twist on NYC slices. Friendly and very clean place to hang out and order pizza dining in or taking out. I think we paid $9.50 for a 12 inch pizza with half cheese and half pepperoni not a bad deal. I would like to go back and try their other pizzas in the near future.,0.9292,0.769,0.231,0.0,0.39099999999999996
2017-01-14,4.0,"I have never been to this location, to eat in.  Everything I have had from here has been ordered out. I do love Dimo's.  Let's face it, Chicago is a great pizza town.  Probably the best in the country.  Suck it, New York.  Chicago has it all - deep dish (of course), thin crust, classic toppings, weird shit, gourmet, and everything in between.  Sure, I've had better thin crust in Santa Cruz, CA and my favorite deep dish is in Tucson, AZ.  But overall, Chicago is the pizza capital of the universe, and I'll fight anyone who says differently! So that brings us to Dimo's.  Do you like Hawaiian?  You will die for theirs - pulled pork and fresh pineapple.  Amazing.  But they really shine with some of the more unique gourmet pizzas.  Seafood, duck, mac 'n cheese and a bunch of others.  Dino's has some great stuff. Order early, as they run out of some stuff.  And that should tell you something.  Their pizzas are great and a lot of people order them.  They do deliver to a wide area of Lakeview and Wrigleyville.  And if they are longer than expected in delivering, they will give you a coupon for a free slice.  Not the 'screw you' attitude of some places. Dino's has both deep dish and thin crust pizzas, classic and new.  The crust is delicious, chewy and well cooked.  The toppings are fresh and carried, and in a good quantity.  I'd like more cheese and more sauce on the pizzas, but both are well flavored.  In a city that has amazing pizzas, you could do a lot worse than Dimo's.",0.9738,0.798,0.15,0.052,0.592929292929293
2017-01-07,4.0,"Big joint with seating in the front/ kitchen in the back with ovens & huge pizza's behind the glasss...hipsters everywhere!  They usually have like 7 different pies available for slices, some of the basics and some of the specialty za's.  Extensive menu with all kinds of different specialty pizzas or you can create your own.. they're known for their Mac & Cheese Pizza!  I went with the BBQ Chicken 'Za and it was outstanding.. you can tell they are using high quality ingredients & homemade sauces, etc.  Prices are a bit above average but the slices are HUGE and like I said earlier.. high Q ingredients!  Definitely a great spot for a quick bite in Bucktown/ Wicker Park area.... get dat did",0.9695,0.825,0.175,0.0,0.5469166666666666
2016-12-28,5.0,This place used to be under another name when I ate here years ago. I am happy that it's still around. I moved out of state a couple years ago and have been craving their pizza for a long time. I finally went back during the World Series games and was hanging out in Wrigleyville. I convinced a couple friends that they HAD to have their pizza.  I thought one slice would make me full but I definitely needed two. I had the mac and cheese pizza. I was sad that they didn't have the smores pizza at the time. Remember before coming here that it's a small place and it might be hard to find a table or seat. If their is line...the wait is worth it! Oh and also they have honey on the side to eat with the crust which sounds weird but tastes good.,0.8172,0.838,0.109,0.052,0.5909722222222222
