date,star,text,compound,neutral,positive,negative,subjectivity
2011-08-13,5.0,"I'm the kind of guy who will frequent a restaurant for a particular item and continue getting the same thing over and over, ala if it ain't broke don't fix it.  However at the Southport Grocery and Cafe, I am a repeat customer and find myself trying different items every visit and enjoying them as much as all the others.  For me this is rare.   For whats it worth, this place for breakfast is the best in the city.  I have yet to find it's rival.  While Over Easy on Damen between Lawrence and Foster is good, SG & C is second to none.  Their Bread Pudding Pancake is the only repeater item that I get, thank goodness you can get a solo pancake and order something else for your main course.   The service is good and their coffee is outstanding, which is a priority for a breakfast place that serves this kind of quality.  You'll need the coffee to ward off the food coma as it easy to overload on the quality eats. I highly recommend this place for locals and visitors alike.  It's easy access to public transportation (Brown Line, Southport stop)  makes this place a must for those in from out of town.   I will caution you to get there before 10 AM as they fill up fast on the weekends and the waits there can be quite lengthy.   Bon appetit...",0.9874,0.834,0.156,0.01,0.5155555555555555
2011-08-12,4.0,"Over the past year Southport Grocery and Cafe has become one of my favorite spots in the city. The food is always delicious, and the staff always makes for a great dining experience. They used to have the most delicious buttermilk biscuit on the face of the planet. But now they have changed their recipe and decided to serve a ""smoked biscuit"". The new biscuit is thick and dense and doesn't have any of the delicious flakiness that made the buttermilk recipe so wonderful. In my opinion leave the smoking to salmon and bring back the buttermilk!",0.9751,0.783,0.207,0.011,0.6754132231404958
2011-08-03,5.0,"By far, my favorite breakfast spot in the city! The Bruschetta, the hash, the bread pudding pancake, the brisket and gravy, the red potato mash, the grilled brie, you cant go wrong! There tends to be a wait on the weekends....give them your number, shop around Southport, it will be worth the wait!",0.8239,0.833,0.167,0.0,0.6
2011-07-18,3.0,"i've been here twice now - and have enjoyed my meals both times.  brushetta was a really unique/tasty dish, i would probably get it again if there weren't so many other things to try.  also had a turkey sandwich here - very good as well.  i love that they are open at 7 five days a week so i can come here after work when i work nights.  and i love that i can get a drink then also if i so please.   drawbacks, i had a strange server the first time i came here - overly attentive and hovering.  tables are also too close - i understand wanting to seat more ppl but it was hard to concentrate on our own conversation with loud people seated next to us.  i got a rice krispie treat to go - very disappointing.  tasted stale and kinda weird.  and there were pieces of tin foil stuck to the bottom that didn't want to come off!  makes me hesitant to try other baked goods in the future. overall, not my favorite place in the world, but good for interesting tasty meals from time to time.",0.8075,0.778,0.127,0.095,0.5396
2011-07-16,3.0,"Alas, my after marathon training brunch crew decided to try a new place for breakfast this time. Gasp! The change was well worth it, however, as we collectively decided on Southport Grocer. Today was only a 7-miler, so we were done and seated at brunch by 8:30. At this hour, the inside was pretty packed solid, but there were a few spots outside that were just the right size for our group of 4. Our waitress was so strange, but I found it intriguing and entertaining. I think she was just a bit of a hippy, but she was so happy to be at work, friendly and responsive, that I loved her. And I hope she is always our waitress whenever we come back. I ordered the ""red meat"" omelette. For those of you who know me, this might seem odd, as I don't eat red meat. But, I DO eat Spanish chorizo. Yum! Anyway, it was chorizo, arugula and goat cheese (which I also love). The omelette was good but too runny! I'll have to agree with Coleen C. on that one. Way way way too runny. If I wanted a runny egg, I would order one. I want a cooked egg omelette. I also wished the pieces of chorizo were a bit larger. They were too small and too few. Boo. The red mash potatoes were AMAZING. There is definitely some sour cream in there and wow, I loved them. I could have eaten a huge plate of those suckers. The toast was hard = fail.  I would definitely come back here, because all of the food actually looked really good. I would skip the omelette, or maybe ask them to make sure it is cooked all the way through. Or, I would just order my usual scrambled eggs, bacon, potatoes and toast. I hope to be back soon, because in my heart of hearts, I believe they deserve more than 3 stars, but I just can't give them the fourth which such a runny omelette :( Sadness.",0.9954,0.723,0.209,0.068,0.44610468034381084
2011-07-14,4.0,"Southport Grocery is my go to whenever I want to have an extended mid-morning/early afternoon dining experience, especially when I can't decide if I'm in a breakfast or lunch mood. Their menu is stellar with lots of local ingredients - highlights are the steak and eggs, sweet and savory french toast, omelets, and sandwiches. Also, if it's your first or millionth time visiting a side order of bread pudding pancake is a must.",0.5106,0.938,0.062,0.0,0.37222222222222223
2011-07-11,4.0,"I love all places breakfast/brunch that have flavorful twists on classics. This place in Southport was a total hit: bruschetta scramble was fresh and yummy, and they let you order solo pancakes (we had the bread pudding which was oh so rich but held up to taking home for leftovers and reheating). On another visit, we tried the Grownup Poptart...which, is exactly what it sounds like. So if  you like poptarts, this blows em out of the water, and if you're lukewarm on them like me...stick to the bread pudding pancake. Really keen on trying the sweet and savory french toast next time I visit.",0.9769,0.777,0.223,0.0,0.41111111111111115
2011-07-06,4.0,Go here all the time and love it!  Their mashed potatoes are my favorite and as for lunch and sandwiches I almost always get the Club.  Can't beat it!,0.8309,0.77,0.23,0.0,0.8
2011-07-03,4.0,"Favorite breakfast place, hands down. We were a bit disappointed that they stopped serving Intelligentsia (and stopped leaving the carafe of coffee on the table, what gives SPG???) but glad to see them still supporting a small, local coffee roaster. Sometimes service is a bit slow, but overall would recommend this place. The server with the Minnesota accent is so nice!",0.9562,0.657,0.276,0.066,0.4808080808080808
2011-06-27,4.0,"I'm not the biggest fan of brunch because I find it's the easiest food and meal to replicate in your own kitchen.  Southport Grocery is the exception.  I've only been there a few times, but I've been impressed each time.  Their flavor combinations are creative- rhubarb and mascarpone?  Awesome.  I recommend the stuffed french toast and the brisket  gravy.   They don't take reservations and they're always hoppin'. Get there early if you're on a schedule.",0.9602,0.762,0.22,0.017,0.6749999999999999
2011-06-23,5.0,"I had the Brisket and Gravy. It's extremely rich, but oh so tasty.  I added some of their Co-op hot sauce which made it even better. I also had a solo cupcake batter pancake and a beermosa. Bell's Oberon and OJ in a mason jar is how I like to start my day. My wife had the granola which made me mock her. But she said it was very good as well.  Two more times of foursquare check ins and I get a free beermosa! So yipee. I'll be bringing my friends.",0.9722,0.718,0.247,0.035,0.6966666666666668
2011-06-18,4.0,"Not that this place needs any more reviews, but it is amazing. A must check. One time   they forgot our order and our entire brunch ended up on the house. A nice detail after such a bad screw up. You should definitely give it a try.",0.7964,0.663,0.223,0.114,0.6702380952380952
2011-06-18,5.0,"My friends and I went to the southport grocery for a quick lunch and were surprised by the diverse and delicious menu and general coolness of the place. Plenty of veg options available,  also. I had the veggie sandwich, which was light and delicious with fresh mixed greens and gold beets, which were a nice surprise. My friends went with the club sandwich and ate every delicious morsel. My sandwich and huge heaping of salad with an iced tea was around $11, pretty cheap for a sit down lunch. The best was yet to come, though. When we got to the counter to pay, the cashier (wearing a ""sausage king of Chicago"" hat [Ferris Bueller's Day Off reference]) gave all five of us cupcakes, completely gratis. Not sure if it was just our feminine wiles or what, but it was a fantastic gesture nevertheless. I will definitely come back to the southport grocery for a quick and fresh lunch, and maybe some more free baked goods.",0.9884,0.756,0.238,0.007,0.6371111111111112
2011-06-12,5.0,"Amazing Roadside Service!!! I was in my car with my baby sleeping and i needed to pick up 8 of their wonderful cupcakes for our road trip. I called and was lucky enough to have Jay answer the phone.  I asked him if there is anyway they could run the cupcakes out to my car because my baby is napping. He says sure no problem! I was tying to find a spot to pull up - he sees me, waves, runs across the street and hands me the cupcakes perfectly packaged. It's Saturday at 12:30 and southport grocery is slammed and yet he finds it in his heart to go the extra mile and offer above and beyond cupcake karma service. I will love them and him forever! Now that's great service. Drive up style.",0.9731,0.79,0.177,0.033,0.667222222222222
2011-06-06,5.0,"This is my new favorite within walking distance brunch spot.  Following a 5k the other day, a girlfriend and I wanted brunch and despite knowing there would be crowds, decided to come here, a new spot for both of us. And it was awesome! Yes, the estimated wait was looooooooooooong-- about 50 minutes at 11 on a Saturday.  But they took our phone number and we went to browse at Anthropologie next door. About 25 minutes later, they called to say our table was ready! super fast! When we got back, there was a little hitch-- they had given away our table and said it was going to be about another 5 minutes. Our hostess was so friendly and efficient about it we totally didn't mind, but her offer of a free cupcake to make it up to us certainly didn't hurt! True to her word, we were seated within about 5 minutes in a lovely window table. Since we had the cupcake for dessert, we decided to go with two savory dishes and share! (we love sharing. having friends who will split entrees with me is like a main requirement of friendship). ANYWAY, we got the bruschetta and the southern omelette (as an atlantan, I have an obsession with pimento cheese) and they were the best savory dishes I've ever had. Seriously. I could live on that southern omelet alone (if they let me switch the reg sausage for chicken especially).  Now I'm getting hungry again just thinking about it. OH! Our cupcake! I almost forgot a report on that. IT WAS DELICIOUS and lighter than air but ALSO dense and moist! It is really dangerous to have discovered this, because before that the closest super-delicious cupcakes were all the way at sweet mandy b's.  ALSO: A lot of people say don't go on a weekend, bc of the long wait, but I say it's PERFECT bc a, it's not really that long, and b, it's a perfect excuse to go shopping on southport.",0.9969,0.747,0.213,0.04,0.5303293553293553
2011-06-05,4.0,"This place is pretty delicious, however, be prepared to wait.   I have never had a meal here I didn't thoroughly enjoy.  I won't event get started on the cupcakes because there aren't words and just FYI the Book Cellar in Lincoln Square sells them as well.  They are not as fresh but in a jam they'll do.   I would have given S G&C 5 stars but the service is never real good, however, the food makes up for it and in the end you let the service thing go because of your Happy food coma.   If you are going to try this place go later in the afternoon on the weekends but not too late, I think they close at 5 or go during the week.",0.7753,0.837,0.112,0.051,0.5555555555555556
2011-05-31,5.0,"Excellent place IF you don't go on a weekend.  Friends and I arrived here early before work on a Friday, as soon as the place opened and were seated immediately. We've tried coming here on a Saturday, Sunday and holidays when we have more time for breakfast but every darn time, it's AT LEAST an hour wait! Now that we've dined here, I can understand why. Food was amazing. They do their own spin on ""normal"" breakfast foods. They do a phenomenal pop tart and an out of this world oatmeal. I also had a chance to try their bruschetta omelette and it was perfect. Simply perfect. If all else fails, try a cupcake pancake. They offer their pancakes in a ""solo"" order (1 pancake) so I was able to have that without being too full from over ordering. The service was excellent, always ready with more hot coffee and very helpful with menu items.  Again, 5 stars only because it's not a weekend.",0.9873,0.776,0.204,0.021,0.6776315789473685
2011-05-30,4.0,Great food- they have a good variety of sweet and savory brunch options depending on what you're in the mood for. The wait was a little long but they took down our phone number which allowed us to check out all of the great shops in the neighborhood. I highly recommend grabbing a cupcake to go following the meal- they are excellent.,0.9696,0.695,0.305,0.0,0.5578888888888888
2011-05-29,5.0,Went for the sweet and savory french toast.  It did not disappoint.  Great combination!  Have been many times since and everything has been very good so far.  Very good cupcakes as well.,0.8671,0.6,0.324,0.076,0.6371428571428571
2011-05-25,2.0,"Ate here 5/25 afternoon. No wait. Only a few tables occupied, so I was annoyed and curious as to why it took so long for our waiter to address us. And so the poor service continued for the rest of the meal. We ran out of water as soon as our food (finally) arrived, and never did see our waiter to ask for more. Well we SAW him, but he ignored us and kept fooling around talking with other waitstaff in clear view. I thought about getting up from my table to walk the 10 feet to where he was standing and avoiding my eye contact but then I almost made a game of ""no, I'm the client here, he needs to come find ME."" Never happened. I could go on about his aloofness and how he was the laziest waiter I've encountered maybe EVER but I'm getting mad all over again. I hope he enjoyed the tip I should never have left him. Loved my food, and my adult sons liked theirs as well. OK I can't stop thinking about how rude and lazy our waiter was. It occurred to me that perhaps he just graduated from college and doesn't have a job yet and someone at Southport said just work here till something comes up. So maybe his waiter job is beneath him and that's his reason for ""I could care less if you eat here and I could care even LESSER if you like what you ordered."" Okay now I'm feeling very used. What is wrong with me that I left this guy a tip? I'll eat here again, but if this guy is my waiter I'll ask for someone else or leave. Come on Southport, someone in charge HAS to have noticed that this guy is a crap waiter.",0.8462,0.744,0.14,0.116,0.5675925925925926
2011-05-21,2.0,"Food is worthy of 4 stars -- the brisket and gravy, and the cupcake pancake were outstanding.   Staff is worth 1 star.  The hostess was pleasant enough, but everyone else fails.  We sat for 10 minutes until our server finally greeted us.  And that was the only time we saw him -- he never checked and asked how our food was, and never asked if we needed anything else.  (I had to tell the cashier what we ordered since the waiter never turned in the ticket.)  You're welcome for the generous 15% tip.   While the waiter was a waste, the bus boy clearly had an attitude problem  I've never seen before in the ""service industry"".  After we ordered, CroMag dropped -- literally dropped -- the silverware in the middle of the table without saying anything, or setting the table for us.  Look, I understand this isn't fine dining, but it's rude to drop silverware onto a metal table and walk away without acknowledging someone.  This was also done at two other tables around us.   Bottom line: great food; terrible service.",0.5736,0.754,0.134,0.112,0.6029411764705882
2011-05-16,2.0,"Good food, bad service. The wait is always over an hour, and the staff lack attentiveness.",-0.4404,0.599,0.134,0.267,0.6333333333333333
2011-05-13,5.0,"One of best lunches I have had in the city! I highly recommend this spot, fabulous!",0.8996,0.501,0.499,0.0,0.6133333333333333
2011-04-21,5.0,"Absolute best spot for brunch in the city!  The bread pudding pancakes are delish and perfect for sharing...the grilled coffee cake or adult pop-tart are next in line for table starters. Always a very long wait, not quite as long as they usually say it is.  The perfect opportunity to do some window shopping on Southport while you wait!",0.9431,0.783,0.217,0.0,0.5188888888888888
2011-04-20,5.0,"AMAZING  -  that is all that I can say about Southport Grocery.  I have lived in Chicago, in various neighborhoods for the past 5 years and Southport Grocery has the best breakfast food by far.  I will find any excuse to go here for breakfast.  If you go at peak times (Saturday or Sunday at about 10am) you should be prepared to wait but it is worth it.  The bread pudding pancakes are to die for!!!",0.4296,0.797,0.137,0.066,0.4428571428571429
2011-04-20,5.0,Best breakfast place in the city by far...everything they serve is just amazing.  You MUST order a side of the bread pudding pancakes.  I am absolutely addicted to the sweet and savory french toast.  This place is soooo much better than the over-hyped places like Orange or Toast. On the weekends though there is a very long wait for a table.,0.9468,0.76,0.24,0.0,0.49571428571428566
2011-04-17,2.0,I have spent my money here many times but I do think that they now feel a good review gives them reason to compromise on the quality of food.  I ordered Bruschetta and eggs - basically scrambled eggs with bruschetta type tomatoes balsamic vinegar topping a crustini type bread.  The tomato mixture was entirely too acidic and the bread was brick hard.  When  I commented to my server about the bread his response was to explain to me what bruschetta was and how it was like crostini.  Never saw him again.  I will take a break from this all too popular restaurant it is too big for it's britches.,0.8807,0.886,0.1,0.015,0.48095238095238096
2011-04-11,3.0,"On a Saturday afternoon, we had a 70 minute wait  (yes, 70 minutes) and then an additional half hour wait for our food. 20 minutes after we finally sat down, our waiter told us ""Don't worry, there are only three tickets ahead of you.""  I know they have a small kitchen, but isn't there a better way to manage this? That being said, the food is good (though a few rungs below places of a similar style, like m henry or hot chocolate ). The ""Hash"" item is a comfy, tasty take on has browns and eggs, though one wishes there was more than a teaspoon of the sour cream on top. I also like that they use Metropolis coffee and brew it strong. A note on the cupcakes: The cake is very light, not too sweet, and they have a homemade-style frosting that's heavy on the powdered sugar (I think). I also think they use an almond flavoring in the vanilla version. Very delicious, in my opinion, but if you're expecting a firm cake with a bakery-style buttercream, you might be disappointed. I would stop in again to pick up some cupcakes, but I'm probably not going to deal with that wait again for weekend brunch.",0.9264,0.812,0.128,0.061,0.5674444444444444
2011-04-08,4.0,"The food here is to die for. Everything is homemade using the quality stuff you find in the store part of the restaurant. Both their Breakfast menu and and Lunch Menu are equally good! Although, it does fill up quick so try and avoid like 12 because its hard to get seated, but when you do it's well worth the wait. The waitstaff can be a bit slow at times and parking is a major hassle in the area, but when all said and done these facts are trivial to the great quality of the food. Also grab a cupcake on the way out, one of the best in Chicago!!!",0.9571,0.777,0.171,0.052,0.4614583333333333
2011-04-04,2.0,"Based on the looks of this place (and the location and website) I really had high expectations. It looked like a great brunch spot, but it also had a bakery counter. After waiting and almost excessively long time, not so excessive that we had to leave, but at least 10 minutes (there was no one in line ahead of us, the people working there were just screwing around), I ordered a vanilla cupcake and milk. They guy who took my order was quite rude, asking the rest of the people with me, ""Is that all the rest of you are getting too?"" (What does it matter?!) The service really was less than hospitable. We headed out of there for a bench across the street. It just wasn't a good cupcake. The cake itself was a little dry, and I didn't care for the frosting. I ate it, but that combined with the attitude and service I wouldn't recommend this place.  It's possible from the reviews that their actual sit down food is better, but I can't say I'll be back to find out.",-0.9119,0.848,0.043,0.109,0.45562091503267965
2011-03-28,3.0,"Went here on a sunday morning with 6 people and was quoted 90 mins, to be expected for sunday brunch with a group that large. It was no problem since there is ample shopping in the area and it was a nice day. Once we got seated our server was great and attentive. The food was good, but we overheard the chef complaining about our order because we had a few modifications. I for one really don't like mushrooms so I asked for my hash with none and instead of scrambled eggs a fried egg. Nothing too extreme. One other person ordered the brisket and gravy with egg whites. This was the one the chef seemed most mad about. When it came out the egg whites weren't done and just looked unappetizing. Not a huge problem though because the rest of it was delicious.  When we went to pay we asked the cashier to split the check three ways and he wouldn't. Again a bit odd because on the menu it says they will split the check a max of 3 ways. I'm not sure if he didn't know how to or just didn't want to. Usually this wouldn't be an issue but the other people were from out of town so its not like one person could pick up the check this time and someone else another time.  All said and done it was a little rough. I'll be back but I wouldn't go back with a large group and I will definitely just bring cash with me next time.",-0.4745,0.833,0.074,0.093,0.5286935286935287
2011-03-17,5.0,"I really enjoyed this place! It's small, cozy, sweet and friendly! Really great! Came here for brunch with a group of girls and everyone enjoyed their meal. My breakfast was a heart attack on a plate, brisket and gravy. so unhealthy I'm sure, but it was delish! Love the packaged food aisle also of their homemade products.",0.9372,0.639,0.292,0.069,0.663888888888889
2011-03-13,5.0,"If you do what I did, I think you'll be happy*. First, put your name down and go do something else until the hostess calls you. Second, try one of the samples before you head out to do that something else. I enjoyed the flavored balsamic vinegars and olive oils. Third, order your meal, gank some of your friends', and split one of the pancake dishes. In my case, the roast beef melt sans mayo with a side of mustard and the butternut squash quinoa salad was ideal. I also loved my friend's chorizo, arugula, and goat cheese omelet and the Co-Op Hot Sauce on my wife's red potato mash. The ingredients made the meal, but it was a 4-star brunch until the bread pudding pancakes. With the first bite, I sat back and just let the serotonin seep in. Gratified, I thought I would let the rest of the pancakes sit. Perhaps I blacked out, but before we left, I had downed the rest of the perfectly undercooked bread pudding mixture doused in vanilla custard sauce. I was truly happy. *As two of my friends wanted their pancakes to be more cooked, which I felt would have compromised their gooey heavenliness, I cannot guarantee happiness. As my grandpa always said, ""De gustibus non est disputandum.""",0.9836,0.826,0.148,0.026,0.4709150326797385
2011-03-10,5.0,"Best cupcakes ever!  I was tasked with getting the cake for a work baby shower, thought cupcakes would be better.  They delivered to my downtown office for a minimal fee, too.  Everyone was blown away.  Perfect ratio of frosting to cake, the chocolate was amazing.  Although I live in the suburbs, I am planning on a trip for brunch because I can't wait to try the rest of their menu-and bring home more cupcakes!",0.9449,0.806,0.194,0.0,0.6142857142857142
