date,star,text,compound,neutral,positive,negative,subjectivity
2009-09-26,4.0,"This place was busy, but not busy where we had to stand forever for a table.  For 16 of us, they were able to accomodate us quite well.  Some of us had ordered our food to go because we thought we wouldnt be able to sit down and eat. But the staff was so willing to help us out that we ended up eating our take out food at a table. We felt bad for taking up their table but again, the staff were really nice about it and didnt give us a hard time.  High quality customer service is what boosted my rating to a four.  I only tried their famous vanilla cupcake and it didnt meet my expectation.  The frosting was so overwhelmingly sweet that I could only eat half and had to take the rest home. I thought maybe it was too sweet because I had eaten 3 other cupcakes before this.   But I went home, had something salty, had something spicy, and then ate this cupcake for dessert and it was still REALLY REALLY sweet.  The cupcake (other than the frosting) was definitely delicious though. Next time I come here I'm going to try something savory for brunch. The menu looked really tasty!  They have outdoor seating here and it was really relaxing and comfortable. Too bad summer is over!!!",0.9902,0.766,0.188,0.046,0.5748222222222222
2009-09-25,4.0,"I have to say the brunch here is in my top 5. Came here for the first time after the Ready for 20 mile run and I wanted nothing more that to stuff my face. I'd already heard about the pancakes and knew I was getting that for sure. I need both my sweet and savory so along with the bread pudding pancake, I got the chorizo, arugula and goat cheese omelet. OMG, it was amazing. The chorizo isn't your typical smushy sausage, it is actually little tiny cubes, still greasy though but I did not care the least that day. The smashed red potatoes it comes with have a great flavor. But nothing compared to the pancake. I actually think I would put this about any pancake at Bong Room. I finished everything in both my plates. Yes, even the ladies next to us gave me looks for having eaten more than my husband. Whatever, I was the one who ran for over 3 hours while he was sleeping the entire time. The portions are just right, but had there been more, I would have definitely eaten it. I can't believe it took so long for me to come here but it will definitely be part of the regular rotation.",0.9676,0.863,0.121,0.016,0.46347215586346024
2009-09-22,4.0,Food was delicious. Waitstaff was very knowledgable and accommodating.  The wait was not unreasonable for a sunday morning. I saw some reviews griping about the prices but I thought they were fair for the quality of food we received. (Full disclosure- I'm from NYC so I may be accustomed to a higher price point)   All the ingredients were fresh and delicious. I will definitely eat here again and have already recommended it to friends. The only reason I left one star off is because it is a tight space.,0.9726,0.761,0.239,0.0,0.5941558441558441
2009-09-21,4.0,"Wow!  just got back from a fabulous breakfast!!!  I was craving french toast and bacon and decided to give Southport Grocery & Cafe another try.  I ordered the sweet and savory french toasts...sooooooooooo good.  Its a huge helping of salty ham, gooey cheese, french toast and topped with a sweet mustard syrup...oh.my.god. I love when im in the mood for something and i what i get hits the spot perfectly. SG&C definitely deserved this upgrade.",0.986,0.63,0.37,0.0,0.5307692307692308
2009-09-17,4.0,"If you have a sweet tooth, this place is for you! Excellent french toast, pancakes, and more, and the options seem to change regularly. We've not had to wait long for tables on typical visits, and have enjoyed the outdoor patio when the weather is good. I recommend it!",0.9431,0.724,0.276,0.0,0.4918803418803418
2009-09-15,5.0,"I love going to Southport Grocery for Sunday brunch. It is a small place, cozy, unless you don't like hearing others conversations. The food is great and the prices are good.  I have never tried anything I do not like. My favorites include the bread pudding pancake and the bruschetta.   It is family friendly and that is always a plus.   However, you can wait upto 2 hours for a table on Saturday or  Sunday during brunch hours; especially, when it is nice out.",0.9127,0.741,0.187,0.071,0.7
2009-09-06,4.0,"I love coming to Southport Grocery for brunch.  It's cozy and tasty, and the prices are pretty good.  My favorites are the Lolla Rosa beet salad, the hummus, and the roasted vegetable sandwich.  Also note that you can swap the sides on the sandwiches.  I always get the quinoa sweet potato salad. My complaints are that the place is crowded and often fairly slow, and that a few dishes I've gotten have been really greasy (the grilled brie sandwich and the hash).  Overall though, definitely an enjoyable place.",0.9584,0.759,0.214,0.027,0.48999999999999994
2009-08-31,5.0,"I have been here twice now, once for brunch and once for lunch. Both times I have LOVED it.  My first trip was in March with my sister, who was visiting me from out of state. We split the hummus plate and it was very good and fresh. I ordered the grilled brie sandwich and she had the grilled turkey. Not only were both sandwiches delicious but they came with amazing sides. The toasted almond quinoa butternut squash salad is SO GOOD. My second trip was Sunday brunch with friend. I love that they take your  phone number down and let you walk around the neighborhood and shop so that you don't have to wait outside in a line. Restaurants that do that get extra points in my book. The wait was 45 minutes for two people and they were right on time with that. I ordered the ham, gruyere, mushroom and leek omelet and my friend had the sausage, mozzarella and pesto omelet, minus the sausage. Both were very good and our orders came out rather quickly.  I recommend this for brunch and lunch or if you just want to stop in and get one of their yummy cupcakes. They have a patio in the summer which is also nice.",0.9946,0.767,0.221,0.011,0.5482186948853616
2009-08-26,5.0,"The food is consistently stellar & the staff is always friendly, sweet, & tremendously helpful when you have/bring kids.",0.8516,0.601,0.399,0.0,0.6
2009-08-18,5.0,"several years ago my love for southport grocery started with a cupcake. it was vanilla and frosted to perfection.  time to time i would come across one of these beauties and fall in love all over again.  despite the cupcakes' fame, i'd only heard amazing things about the food itself.  so for (seemingly) months, we tried to brunch or lunch on the weekends, but hunger pains naturally outweighed the typical long wait. but recently i FINALLY had a chance to have a proper meal. what's the key to avoiding those crowds?  go on a weekday!   we started with hummus. its smooth, creamy and comes with the most amazing pita bread i've ever tasted - crispy on the outside, but still soft when you bite into it.  not sure what their secret is...but i would LOVE to recreate in my own kitchen. (chef feel free to speak up ;) next on the menu was their BLT. as suggested, we made it a club and added turkey. its dressed up with applewood smoked bacon, lettuce, tomato, pulped avocado, apricot compote & mayo on grilled challah and comes with broccoli - peanut - sunflower seed salad. its has an incredible unexpected variety of flavors with every bite.  probably one of the most unique sandwiches i've tasted  in quite some time... as for the staff - can i give them more than 5 stars?!  they were helpful, accommodating, friendly and just seemed happy to be there - AT THEIR JOB!  and really, in the middle of the day at a crowded restaurant, that is quite refreshing.",0.9853,0.773,0.164,0.063,0.6178451178451179
2009-08-13,4.0,"This is my go-to spot for brunch and a must when people are in town to visit. I dream about two things every time I go here and cannot get myself to try anything else: 1) the bruschetta eggs and 2) the bread pudding pancakes. It's the perfect combination of sweet and salty and the fact that you can do a pancake taste is the best idea ever! The vanilla dipping sauce on the pancakes is the perfect complement rather than standard syrup. I heard that they may be selling the ingredients to make the pancakes at home but unless they sell the vanilla dipping sauce, it just wouldn't be the same. My husband is a huge fan of their club sandwich and raves it's one of the best he's ever had but I can't help but order breakfast every time we go there. The wait can sometimes be pretty hefty since it is such a tiny place and they don't take reservations but it's a great area to walk around and do some shopping and they'll call your cell when your table's ready.",0.9862,0.807,0.178,0.014,0.5788461538461539
2009-08-11,1.0,"I've had random things from here; all of them passable but way too overpriced, but that's not the reason for a 1 star review. That's totally because of the staff.  Arrogant asses who are too busy to be bothered to do their job. I just went in for takeout & asked a staffer who was standing around doing nothing if I could see a menu. He vaguely gestured to the stand; ""they're over there"". Really? You won't walk the 5 feet and hand it to me? You know, act like you're happy to help a customer?  I've gone in at breakfast time and gotten similar treatment. I was the only one there & I'm standing at the register while 4 employees gossip about their night before. I didn't get any service until I opened my mouth to ask if maybe someone wanted to take my order. Sorry it was a measly pastry thing and that's not important enough for you. Oh, and the pastry was dry. I'm never going back; which is just as well because the food isn't that great. I'd be wonderful at half the price. But it's not, so it's just not worth it.  When options of places to eat in the neighborhood come up I'll veto SG straight away, and proceed to retell these stories to my friends. Hey Southport Grocery owners; if you read this, why don't you take the time to encourage your staff to be friendly, helpful, and actually perform their job tasks? Or do you not care as long as you keep getting people to pay for your $15 omelets? Ugh. Why couldn't you go out of business instead of Winston's?",0.968,0.772,0.139,0.088,0.546969696969697
2009-08-04,5.0,"The first time I went there, I went for ""The Cupcake."" Although I wasn't that impressed with it - given the fact that it was apparently hailed as ""the best cupcake in Chicago"" - I went back several more times for actual lunches or breakfast.  I have to say...everything else I've had has been pretty damn good. I appreciate their unique takes on breakfast items. The Sweet & Savory French Toast, for example, was out of this world. It's basically a french toast, ham and cheese combo...Who thought of this? Amazing.  I took a risk and tried The Cupcake Pancakes another morning, and they were good, but sooooo rich and sweet I could only have a few bites. It really is like eating a cupcake with syrup on it. But I'm glad I tried it. It's interesting, like most of their menu.  When I go there for lunch, I usually get the chop salad. Yes, it's just a salad, but a very good one. I recommend it.  I'm glad this place is close by! I think you can always find something unique or just plain good, or both.",0.995,0.69,0.286,0.025,0.534015873015873
2009-07-31,5.0,"Man I love this place.  Great food - creative use of ingredients - dynamic menu.  Atmosphere plus, especially love sitting outside.  Bit of a line but they'll take your cell number and call you - walk down Southport to work up an appetite!",0.8818,0.707,0.293,0.0,0.5507936507936507
2009-07-29,4.0,"Oh simple cupcake...how do I love thee? Let me count the ways.... I am all about a simple vanilla on vanilla cupcake. I don't need my cupcake overloaded with crazy toppings and flavor. Vanilla on Vanilla is what I love. Southport definitely has mastered the art of the simple cupcake. They only sell vanilla/vaniila and chocolate/vanilla...and thats fine with me. The buttercream is PERFECT and the cake is moist and tasty. I would come here just for the cupcake. However....today I met some lovely ladies for lunch at Southport (this was not a cupcake only trip). We were 4 ladies with 3 babies and Southport accommodated us with a smile. We had a nice large table big enough for a couple strollers and a few highchairs.  I noticed a few people have complained about the service or the wait for food. We did not experience any of that. Our server was fast and always around to refill out coffee (which was fabulous) or water.  The menu is definitely drool worthy (umm...hello....stuffed french toast, bread pudding pancakes...etc etc). Knowing that I was going to get some cupcakes later on I decided on the savory end of the menu and ordered up a chorizo omelet with spinach and goat cheese. It was definetly tasty (but REALLY greasy - which I guess you get when you order something with chorizo). My fellow diners ordered up the hash (yum) and some salads. Overall the food was very good (I am going to have to return for some of those sweet menu items).  All in all it was a lovely dining experience...super clean...babies accepted...service with a smile...good coffee...I will be back!",0.9893,0.834,0.148,0.018,0.49781249999999994
2009-07-29,4.0,"Southport Grocery & Cafe was the first spot on our Cupcake Crawl.... Maybe it is the recency effect, but these cupcakes are awesome!  I really can't attest to anything else but the cupcakes.  The cupcakes here are dense, huge, and delicious (that's what she said ;-).  But really, they're great.  They don't have as many flavors as, say, Molly's, but the vanilla cupcake was enough for me.  Pure and delicious. We came here on a Saturday and it was BUSY.  So they must be doing something right....certainly they have their cupcakes perfected.",0.9873,0.734,0.266,0.0,0.6294871794871795
2009-07-23,5.0,"SO good!! Cute, clean atmosphere.  I love every thing that I have tried here - especially the tuna sandwich -- to die for! Good customer service. The ONLY bad thing I can say about it is, it is only open til like 6 or 7 so it is not that convenient for dinner.",0.9393,0.57,0.322,0.108,0.7666666666666667
2009-07-21,5.0,"Visited friends in Chicago back in 2005. They took me to the Southport Grocery as it was one of their favorite spots at the time. I was only in Chicago for a total of 5 days but we managed to go there TWICE 'cuz it's THAT good! And now, 4 years later, here I am STILL thinking about that place!  Try the bread pudding pancakes (my god!) And the pop-tart breakfast thing (way good).  The bread pudding pancakes from Southport and cheese deep dish pizza from The Art of Pizza is enough to make any girl want to hop on a plane and visit the windy city.",0.8491,0.905,0.095,0.0,0.538888888888889
2009-07-15,4.0,"The name is deceiving. for years i just thought it was just a grocery store with some cafe food. i finally went and realized oh how wrong i was. it's a WONDERFUL restaurant with a little grocery store. my other problem is i can never decide what to eat. should i for their amazing brunch food (pancakes, stuffed french toast), their yummy sandwiches, or should i spoil my meal and eat just their amazing cupcakes. the answer is usually brunch or lunch AND a cupcake. I can't eat here without getting a cupcake to go. they're usually just open during the day/afternoon so parking isn't so bad on the weekdays. just bring some quarters.",0.9156,0.775,0.157,0.068,0.6034722222222223
2009-07-10,5.0,"Try to work at least one of these two into your order - Bread Pudding Pancakes or Cupcake Pancakes - The first time I tried the BP pancakes, someone else ordered them at our table and I ended up finishing the plate for them - it was like they had an addictive substance in there and I couldn't stop myself - either that or its because I am a tubby boy. Recently I tried the Cupcake Pancakes and was thrilled at how simple one of life's pleasure could be transformed. A cupcake, but for breakfast - Its like the next best thing since sliced bread...",0.9387,0.84,0.16,0.0,0.40505952380952376
2009-06-29,4.0,Excellent yellowfin  tuna sandwich.   Good portions. Attentive and friendly staff.   Bottomless Intelligentsia Tea for $2.50. Coke in glass bottles.  Eclectic grocery items. I am pleased...,0.9062,0.619,0.381,0.0,0.7000000000000001
2009-06-28,3.0,"Southport, what is going on with your food?  Everything is being downsized and the  bread pudding pancakes which have always been my favorite are just not the same anymore.  The staff, as always if wonderful, but the food seems to be sliding.",0.5187,0.902,0.098,0.0,0.7083333333333334
2009-06-17,4.0,"Absolutely the ONLY negative aspect of this place was the slow service. For being a small-ish place, and for not being busy, there was no reason for our food to take that long. But... It was totally worth the wait! I had the chicken salad with red grapes and flat bread... it was the best I've ever had! My husband had this crazy special of banana and strawberry STUFFED french toast. They also have some great Vermont products-to-go (which I'm a sucker for because I'm a Vermonter) including SUMMER SAUSAGE and chocolate peanut butter cookie dough you can take home and throw in your oven. This place is great. Hope to sit outside next time AND have faster service.",0.8578,0.76,0.15,0.089,0.45770676691729323
2009-06-11,4.0,"It is so difficult for me to come here and not order the bread pudding pancakes because they are just that good--bread pudding in a pancake smothered in a creamy vanilla custard sauce and cinnamon butter, how can you resist! I even purchased the mix and made a version of the pancakes at home because I love them. But the fact of the matter is the entire menu is quite delectable and should not be ignored...a few of my favorites include the burger, (something about how they pan grill it, gives it so much more flavor than your average burger) the tuna melt is unbelievable, and the grilled brie is lovely. It is great for brunch, lunch, or late afternoon snack, but be prepared to wait as it is usually bustling with people at all hours.",0.8647,0.859,0.115,0.025,0.5977272727272727
2009-06-08,4.0,"Cupcakes of doom! I got lured here by a tweet--a friend shared news of their free cupcake a week ago. Since I'm a whore for cupcakes, I had no choice but to heed the call.  These aren't the puffed-up Willy Wonka technicolor treats you'll find at most bakeries. The top is flat, not rounded, and the frosting is simply spread on top, even with the top edge of the cupcake wrapper. However, don't let the plain-Jane appearance throw you off--these babies are just as craveworthy as any other pretty-princess cupcake. The next time I need a cupcake fix, I think I might stop here--their 'cakes rank among the best in the land.",0.8985,0.762,0.164,0.074,0.44155844155844154
2009-06-07,4.0,"First time for breakfast here.  I was seated while waiting for my friend to arrive which is a bonus esp. on a Sunday morning but I was ignored until she arrived although I would have loved to have been sipping a cup of coffee while I waited.  Arugula, goat cheese, apple omelet was ok - as described just nothing to rave about.  Friend's hash was best bang for your buck but could have used a side of chicken sausage to amp the flavor (and ask for extra chive sour cream.)  Tasting pancake of bread pudding pancake was the highlight. I'd definitely go back and lunch menu looks great too.",0.9829,0.731,0.246,0.024,0.42592592592592593
2009-06-02,4.0,"Went for the free cupcake will go back for the full meal experience. Great selection, I took the baked brie sandwich home. It by far exceeded my expectations. Yummy! It was a bit difficult to order take out, but next time I am absolutely grabbing a seat. They have gluten free products for sale that I thought was a great option. I was BB Messengering my lunch buddy that this needs to be our next lunch stop. Limited tables available, outside seating looks nice when weather permits.",0.9441,0.718,0.212,0.07,0.5428571428571428
2009-06-02,4.0,"Bread pudding pancakes are insanely delicious! The tasting portions were a great way to sample things on the menu. Like any good neighborhood brunch place, there was a wait Sunday morning.  I appreciated that they took our cell number so we could wander around the cute stores on Southport while we waited. The breakfast bruchetta, at our server's recommendation, was fresh and tasty. I'm glad we tried Southport Grocery and highly recommend their Sunday Brunch ! I'll be back for sure.",0.9831,0.675,0.325,0.0,0.637888888888889
2009-05-19,4.0,"I decided to treat myself to lunch here today with a friend after we had a disastrous experience at an over-crowded, poorly organized job fair at Roosevelt University that was thrown by  idealist.org .   So after not finding jobs, it seemed like a good idea to take my unemployed ass to lunch at Southport Grocery.  I had been meaning to try this place for a while and it didn't disappoint.  I immediately ordered a glass of wine and ended up having the melted brie sandwich.  Both were great.  Service was a little lacking--the waiter didn't check on us or anything and I really needed a water refill that I had to flag someone down for after quite a while, but these wouldn't be reasons to keep me from coming back.   When I went to the counter to pay I added 2 of their cupcakes to my tab (one chocolate, one vanilla) and those were absolutely delicious.  The buttercream frosting tastes just like the very simple yet tasty recipe my mom uses (and has passed on to me) and the cake was very moist.",0.9315,0.844,0.122,0.035,0.5335978835978836
2009-05-19,5.0,"southport grocery seems to get everything right. i haven't tried anything that isn't interesting, fresh, and most importantly, delicious. i had the grown-up pop tart and it was everything i wanted it to be! i also tried my friend's chicken salad and that was equally good. if you can handle the wait, it's worth it. also, the cupcakes are like no other cupcakes you've had. so incredible! i've heard they have dinner now, so i can't wait to go back.",0.8416,0.762,0.164,0.073,0.5418831168831169
2009-05-18,4.0,"Excellent omelet, probably the best in the city. Pesto, fresh mozzerellla, and tomato, flawless. Interesting and delicious salads.  Get there early, it fills up fast on weekends.",0.9633,0.513,0.487,0.0,0.6499999999999999
2009-05-16,4.0,"Excellent brunch location. I had the Club sandwich, which was very nice. My friend gave up her red potato mash, which made me happy as it was delicious. The iced tea was also great, but unfortunately we were not granted any refills (didn't get the chance to ask). Inside they seemed to have some good gourmet finds. We didn't have to wait at all!",0.8658,0.677,0.23,0.093,0.79375
2009-05-05,3.0,"Cons of Jet-Lag: Nodding off at 8:00 pm, and being wide awake at 6:30 am. Pros of Jet-Lag: Finally being awake early enough to enjoy some of Chicago's busiest brunch spots BEFORE the crowd! I decided to take advantage of my confused body clock by checking out a new brunch spot.  Usually I don't speak before 10 am on weekends, much less wait in line for eggs!  I heard that the wait at SoPoGro (ooh, I just made that up, I like it!) can be almost an hour during peak brunch time.  I met Mr. Man at around 9:15 on Sunday, and was surprised to see many diners there already!  This place is definitely popular with the kiddies, I saw many tables with little ones in tow.   Coffee was good, nice big mugs, plus a carafe on the table.  Also extra points for actual sugar cubes!  I ordered the grown-up pop tart that I'd heard so much about.  You really have to be in the mood for sweets when you order this!  I thought there would be more mascarpone in it, but there really wasn't any savory flavor at all.  I did like the texture combination of the pillowy wrap with the crunchy walnuts and jelly.  I bet the chocolate banana version is great too!  I ordered a side of sausage patty, just to give myself a little bit of savory flavor.  The house-made sausage was good, but not amazing.  I was hoping for a bit more of a kick!  While the patty was bigger than your average sausage patty (almost mini-burger sized) I still think $3.50 is a little steep for 1 piece of sausage!   Mr. Man ordered the steak n' eggs.  He asked for it with a fried egg instead of scrambled, and they were more than happy to accommodate him!  There were nice big chunks of steak and onions, and lots of queso fresco.  His only complaint is that the beans were pretty salty.   No complaints about the service, which was friendly and prompt enough for a leisurely Sunday brunch.   The space seems a little bit cramped, due to trying to fit enough seating and a grocery section into one space.  It did make for some friendly conversations with our neighboring tables!  At first glance, I wasn't too impressed with the grocery selection.  From my table, I saw a variety of pastas, Barefoot Contessa products and Stonewall Kitchen jams, which I can get at my normal grocery store.  After brunch, I took a closer look and saw some interesting selections, such as gourmet honeys and a variety of oils, vinegars and salts (woo, black lava salt!) Brunch was good.  Pleasant.  Would I drag myself out of bed early on a weekend just for SoPoGro?  Probably not.",0.9923,0.812,0.139,0.049,0.5190977961432506
