date,star,text,compound,neutral,positive,negative,subjectivity
2013-10-28,3.0,"Went here with my fiancee the other night for dinner since we're both such big fans of the brunch. Unfortunately...it wasn't quite what we expected. The food, while delicious, was definitely a little overpriced. We started with an apple salad (yum!) as well as some potatoes, which we both enjoyed. My fiancee ordered the short rib, which tasted phenomenal...the problem was there just wasn't that much of it for the $30 we paid. I got the lobster pasta based off the server's recommendation and did really enjoy it...but again it was on the small side. Drinks, on the other hand, were super reasonably priced (even the wines the sell by the bottle seem like good deals). The service itself was great, if not a little bit talky for my tastes. The waiter greeted us almost immediately upon sitting down and explained the layout of their menu, which admittedly was a little confusing upon first look. After bringing us our drinks (a couple of delicious pear-flavored cocktails) the server asked us if we had any dietary restrictions or preference before detailing some of his favorite dishes for us. He was quite friendly and helpful in answering our questions, and once we had ordered continued to be attentive to our needs throughout the evening (maybe even a little too much so). All in all service was a little overbearing at times, especially with a second man I assume was the manager checking in on us as well, though I'm sure they were just doing their jobs. I personally just like a little space to breathe when I go out to eat...I don't need a whole song and dance. Definitely different then their brunch, when it can be difficult to wave a server down, much less get a table.  Overall, we had a positive experience. The bill definitely ran a little higher than either of us would have liked and I wasn't stuffed, but I can't deny that it all tasted good. It's certainly worth a trip in if you live in the area and like good food that's a little different from whats out there...just be prepared for those prices and to be engaged in some lengthy conversations with the staff before you get to eat.",0.9944,0.814,0.173,0.012,0.5075757575757577
2013-10-20,1.0,Have been trying to go here for a month.. Got there at 3:32 on a Sunday and they refused to serve us because the kitchen was closed yet online and on the door it says they are open. Really disappointed in the hospitality and can't believe you would turn away a customer over 2 minutes.,-0.6801,0.898,0.0,0.102,0.45
2013-10-16,3.0,"I was disappointed by southport. My Reuben was only eh, meat lacked flavor ad the dressing was only ok. The hash was unimaginative and lacked flavor. The saving grace is the bread pudding pancake, which is rich and flavorful. I'm glad I shared the solo because otherwise it would be richness overload",0.891,0.648,0.265,0.086,0.8333333333333334
2013-10-13,4.0,"Bored with the standard brunch? Southport has a nice variety of creative, tasty and satisfying dishes that you most definitely will NOT find elsewhere. The atmosphere is cute - and although it's usually fairly busy, you can shop in the little market while you wait (grab a cupcake , ready-to-bake peanut butter M&M cookie dough, or gourmet goodies to take home) or shop in one of the stores nearby (Anthropologie and Lululemon, ladies) and the hosts will text message you when your table is ready. The service is a bit slow, as others have mentioned - but if you're there relaxing with friends and enjoying a cup of coffee, what's the rush?  Highlights:  The 'grown up' poptart - not something I would have offered (as I loathe poptarts) but this is NOTHING like a poptart in any way. It's more like a crispy-on-the-outside, warm and soft on the inside, grilled pancake with vanilla anglaise and fresh fruit filling. DO IT, preferably as a breakfast appetizer. Big enough to be shared by 4 or so people. The bread pudding pancakes - incredible. One of the best pancakes I've ever had and the cinnamon butter on top is like heaven. You might only need the 'single' since it's pretty filling, or you can order it as a side.  Bruschetta scramble - both people who got this raved about it. Seemed like a good tangy, slightly healthier option. The other things we got - the spinach omelette, cupcake pancake, chicken sausage etc. were all good, just not as mind blowing as the other dishes. If you're debating a pancake, DEFINITELY go for the bread pudding one. Even cupcake enthusiasts, trust me on this.",0.9975,0.723,0.259,0.018,0.572842261904762
2013-10-11,3.0,"The cupcake pancakes were good, not great - just slightly undercooked for my liking, but that's just a personal preference.  I ordered a side of fruit, which was also good but not the freshest.  I would definitely come back again, though it wouldn't be my first choice. Service was attentive and accommodating.  Very kid-friendly.",0.8423,0.767,0.195,0.037,0.445
2013-10-10,5.0,"I ate breakfast at Southport Grocery yesterday, and I'm already thinking of when I can go back. They have a unique menu, with items such as cupcake pancakes and a grown up pop tart. As tempting as the pop tart was, I decided to get the egg sandwich. It was filling and flavorful. I definitely recommend this restaurant.",0.6369,0.906,0.094,0.0,0.5
2013-10-07,3.0,"As an out-of-towner visiting Chicago, I thought this was a pretty solid breakfast spot. I went with a group of 5 on Sunday morning - prime brunching time for pretty much the whole city. We waited about 40 minutes and I liked that we could keep track on our phones about our place in line. We got a seat on the patio, which was nice but not super comfortable. Gorgeous weather though and a bit quieter than inside so no complaints.  I started with an Americano (~$3). Pretty good. The jolt I needed for sure. The table ordered a grown up pop tart ($6) to split, which was really tasty but could have used more jam filling. The pastry was delicious though. Bf & I decided to split the Hash with Brisket ($12) and the Sweet & Savory French Toast ($10). The French Toast was above & beyond the best dish ordered at the whole table. The ham & swiss were amazing on top of the bread and the sugary mustard syrup was the perfect complement. If this dish came with a side of fruit or a simple salad it would be the perfect meal. The hash left a bit to be desired, but was okay.  We ordered over easy instead of the menu-stated scrambled eggs, which was definitely a good choice since it was a tad dry. The cheese ended up clumping into a big ball in the middle of the hash and overall it was just a bit bland and undercooked for my taste. The bisket was drier than I had hoped and also a tad bland. Hot sauce perked it up a bit, but be careful! It's habanero hot! Overall I enjoyed breakfast and thought prices were comparable to what I'm used to elsewhere. The sweet & savory French toast could get 5 stars on its own... I'd be curious to try their lunch (and new dinner) offerings.",0.9962,0.715,0.231,0.054,0.5758988056860397
2013-10-04,3.0,My friends and I went here and we're very disappointed. It was expensive for what we got and we waited over an hour for two burgers and one lobster pasta. The burgers weren't cooked correctly and my pasta was more of an appetizer instead of an entree. Won't be going back.,-0.0754,0.881,0.057,0.062,0.54375
2013-09-28,3.0,"their coffee and biscotti were great as were the eggs. what really got to me was the 1hr wait early in the morning but only because they were seating only half the tables being understaffed. i'm sorry, it's sunday brunch and you don't have enough people staffed? and hence you'll make everyone wait when they can see half your tables are open. the hostess was also just rude about this. payment system takes forever cuz you stand in line with those at the grocery store portion too.",-0.4404,0.913,0.028,0.059,0.562121212121212
2013-09-28,4.0,Bread Pudding Pancakes...soooo good.  Split that one and a Brisket and Gravy with my girlfriend.  Both plates were absolutely excellent and we had enough attention paid to us that we were never really wanting for anything. The coffee was a little rough and probably the only thing hold this from a full 5 stars from me.,0.7841,0.879,0.121,0.0,0.59375
2013-09-17,4.0,"Yes, you will wait for a table here.  You'll also wait forever to pay at the cashier.  Really inefficient process, especially when splitting the bill. Other than that, the food really is as good as the rest of Yelp says it is.",0.6666,0.84,0.13,0.031,0.54375
2013-09-06,3.0,"The service is really slow. We were completely ignored. My bottomless coffee had only 1 refill. The food was very good, but not worth the wait.",-0.1776,0.789,0.075,0.136,0.536
2013-09-04,3.0,"Great offering across the menu, crowded and long waits that are worth it for a great brunch. Biggest let down was the cupcakes that are heavily advertised... these were not only overstated they were a complete disappointment. The cake was flavorless and frosting mediocre at best, you can easily do better at Jewel next door.",0.9571,0.639,0.314,0.047,0.4914529914529915
2013-09-03,5.0,"This is my absolute favorite breakfast place in Chicago. The atmosphere is lively, the wait staff is friendly with a sense of humor, and of course the breakfast food is hands down the best I have had so far in Chicago.  The chorizo and eggs is where it is at. You must order this when you go here! Also even if you are not a huge pancake fan just order 1 bread pudding pancake. You will not regret it. It will change your mind about pancakes forever.",0.9337,0.774,0.186,0.04,0.6736111111111112
2013-09-02,4.0,"Southport Grocery has slowly grown to be one of my favorite brunch places, and definitely my favorite brunch place in the Lakeview/Southport Corridor area. It's a small restaurant, and in the warmer months the seating practically doubles with the outdoor patio. Make sure to arrive early, or be prepared to shop at some of the great boutiques and stores along the street while you wait. The staff is always friendly and everyone seems to have a great attitude, each person helping the other out. We probably had three different servers help us during our last visit, a Wednesday morning on the outdoor patio. Since everything's small, you'll be pretty close to the people next to you, but that's not the worst thing ever. Between the two of us, we ordered the southern screwdriver, beermosa, grown-up pop tart, ham and swiss french toast, and stuffed french toast. I don't normally have a sweet tooth, but it was in full force that day. I would recommend the stuffed french toast, which was served with a blueberry sauce and a lemon cream cheese - so YUMMY!  The price is fair for what you're getting, and never disappoints. I would highly recommend making a trip up to this area even if it's not in your backyard.",0.9905,0.776,0.211,0.014,0.5088222222222223
2013-08-28,5.0,"Only the best brunch place in Chicago. There is not a weak link on the entire menu, and when you're done, there are so many goodies to peruse and take home!",0.7844,0.802,0.198,0.0,0.61
2013-08-25,4.0,"Great breakfast, I'm certain that all their food is fabulous. Service is also good, the whole decor is also airy, light, clean and wonderful. The only drawback is it takes a ridiculous amount of time to pay! They give you a numbered card to take to the register.  Your bill SHOULD be already in the system when your number is entered. It's not. The result is the cashier has to enter everything. On a busy day, the wait is unreasonable. Would have been 5 stars if not for this glitch. Love the food here!",0.9686,0.735,0.229,0.036,0.718452380952381
2013-08-17,5.0,"This place is great! Went for the first time for brunch with a friend. We had the southern omelette and the bruschetta and loved both. The green tea mint soda is also very refreshing. We had good service, got to sit outside on a beautiful day, and didnt have to wait long for a table. During our check-out it came up that it was our first time at Southport Grocery and Cafe and the woman ringing us up gave us a free cupcake to split :) I will definitely be coming back.",0.9804,0.743,0.257,0.0,0.5244444444444444
2013-08-09,5.0,"My wife and I went here on a whim as we were walking home from food shopping and didn't know what to expect. We are new to Chicago so we are in the ""try every place"" phase of our time here. I'm sure glad we did. We sat outside and were greeted by our friendly waiter who told us about the menu, how it works and every suggestion he made was spot on.  We shared a watermelon salad with homemade cream cheese ad green corn relish and for dinner my wife had a Duck Breast Reuben and I had the Pork Shoulder Steak and both were excellent. Apparently 90% of the food served was made on premise (including the greens which were grown on the roof and the house made sausages) and it really came through. Bursting with layers of subtle flavors (but not too heavy handed with the sauces) you could tell each dish was crafted and not simply prepared. We also enjoyed some wine and cocktails which were both excellent. The Rickshaw 2011 Pinot Noir was smoky and complex while my ""Day and Night"" cocktail consisting of a smokey Bourbon (gotta get the name of it - it was gooood!) along with house made ginger beer made for a spicy, smokey treat.  We finished the night off with monkey bread with a chocolate peanut butter dipping sauce and a bread pudding pancake. Are you kidding me? These things were so good I'm skipping the meal next time and just getting the pancakes. I even bought a bag of the mix to make them at home.  I hope I can duplicate the magic... Expect to drop at least $100 for dinner for two with drinks, a shared app, 2 entrees and 2 desserts. Sadly (or gladly) there wasn't anything I'd say skip so it looks like you're going to be in for spending a Benjamin. But it is well worth it.",0.9876,0.85,0.131,0.02,0.5136626000262363
2013-07-31,5.0,"This restaurant has been on my list to try for quite some time and I finally had an opportunity this week while on vacation.  We went in around lunch but actually chose breakfast food (served all day).  My husband had bread pudding pancakes and I tried the adult poptart and hot chocolate.  Both items were fabulous and neither of us could finish due to the very large serving sizes.  The hostess was a little surly, but the server was very pleasant.  My only complaint was the a/c.  It was actually a nice temp outside, but inside we were both freezing!  There is a cute little seating area outside, but at the time they were full.  We will definitely be back and will try to eat outside next time.",0.9663,0.808,0.161,0.031,0.504107142857143
2013-07-27,5.0,"Had been on my review list for a veryyyyyy long time. Have been here dunno how many times now. & they never fail to impress If you had to order only one thing off the menu, without a doubt, go for the 'Bread Pudding pancake' If you wanna taste the shareables, be there early (before 12pm on a weekend), I have never been able to taste them, they are always out of stock. That just says how awesome they must be.  Will keep coming back.",0.7687,0.869,0.104,0.028,0.515625
2013-07-26,5.0,"I'd been wanting to come by Southport Grocery for a while, but was always intimidated by the long waits. Summer is definitely the time to go, the outdoor patio literally doubles their seating. Came with a couple girlfriends, put our name in, went to Anthro and lululemon and then our table was ready! Even though the breakfast menu isn't huge we all still had a difficult time deciding what to order. Two of my dining companions ordered the bruschetta egg dish which looked and smelled so amazing. I might have to try this next time I come by, they both loved it. Another friend ordered the southern omelet and was happy as well. I settled on the chorizo omelet and it was so delicious! The chorizo itself was incredibly flavorful, it complemented the goat cheese and arugula very well. Their omelets come with a side of mashed red potatoes that are awesome. I don't usually go crazy over mashed potatoes, this dish is worth it. I ordered a biscuit on the side because I was told this was a ""must have."" It is. Do it. Fresh, homemade biscuit with a phenomenal jam, this will probably put you over-the-edge full, but it's worth it. You bring your number up to the counter to pay, and they were more than helpful splitting the checks which was awesome. Overall, I cannot wait to return and will definitely be trying their lunch options.",0.9965,0.711,0.25,0.039,0.554
2013-07-25,2.0,Wow so underwhelming!!!!! Food mediocre so many wonderful places to adventure to ......why bother here even the brownies are just average.,0.8704,0.555,0.367,0.078,0.78
2013-07-23,5.0,Place is absolutely outstanding.  From the burger to the oatmeal you cant go wrong with a single menu item.  I have been going here with my family and friends for awhile now and love the atmosphere and food.  Be sure to get in early or you will be waiting a good hour to be seated.  The Chai Latte is also fantastic and can be purchased at the store for home creation.,0.9751,0.705,0.295,0.0,0.6597718253968254
2013-07-23,3.0,"I'm always a little underwhelmed.  Wish the omelets came with a side of fruit...wish my hot sandwiches would've come out hotter...wish there were a few more tables inside to alleviate the wait on a cold day... That said, I'll keep coming back because out of town guests simply swoon over this place.  The little grocery section really does contain some wonderful treats that are not easy to find elsewhere and I have to say, the in-house strawberry rhubarb preserves are the best.  Like eat-it-with-a-spoon-from-the-jar awesome.",0.9384,0.793,0.181,0.026,0.5492673992673992
2013-07-21,5.0,"This place totally screams ME - I am self-centered, I admit it, let's keep going so I can tell you a little more. It's a decent size cafe that is simple, serving very fresh ingredients and well-done food. Unassuming atmosphere and friendly services with a local feel to it - I totally fell for all that shit! I live for this kind of place, and truth is I've been meaning to come here for brunch for a while. Genius friends of mine suggested this place for dinner - WIN! According to our server, they have been around for a while (this I know), but only started serving dinner about a month ago (this I did not know). Came here one night with 3 other people, and I was impressed by the food and the concept.  First, my friend shares a rooftop with this cafe, and he told me about the little ""garden"" they have up there. I didn't believe it, so I went to check it out myself. Yup, there were plenty of little pots up there. Now I doubt if they use that for the meals they serve, but it still added an immediate star on my review.  We walked in around 8pn on a Friday night and it wasn't crowded, so we got seated right away. They offered water and the 2 boys got some drinks. My roommate and I both don't usually eat meat, so we shared the kale, tomato salad, mashed potatoes, and mac & cheese. The boys got a burger, tomato salad, some greens, and scallop pancake - they recommended 2 dishes per person, so we got 8. I was happy, but I bet the 2 boys could have had more.  Their menu was a little disorganized i thought, but then the server explained to me that it was i the order of light to heavy dishes, and then it made sense. I actually like it - it make our decision much easier. Most of the food were made to share, and the portion is right with the price. The tomato salad (with feta cheese, arugula, and pesto sauce) was absolutely delicious and refreshing. I'd recommend that to start out the meal. Mac and cheese was very good as well - the touch of morel was aromatic and refine. It sure does leave you wanting more. Everything else was very very very good - we were all satisfied with our food.  For desserts, we had the red velvet cupcake and the pancake (which was more fitting for brunch but still amazing nonetheless). The red velvet came with goat-creamcheese frosting and it was sooooo good! I can probably eat that thing daily! The cake wasn't as moist as I usually like it. But still overall good.  Services were alright. Our server was friendly. They brought us bottles of water so she didn't have to refill our water. You pay at the counter in the end, which I think is smart, because they have tons of little packages of goodies that I wanted to pick up as we were paying. Bill can range anywhere from 20-50 per person depends on food and drinks, but I think you'd leave happy with 20-30/person. Also, they sell bottles of wines for 20-25? I guess I'm so used to wine bottles anywhere from 40-150 (or more) that this shocked me! This place rocks!",0.9982,0.798,0.173,0.029,0.5574588200059899
2013-07-17,5.0,"I came on a recommendation from friends, one of whom used to live in Chicago. They are food lovers, so I knew it would be good.  I had no idea how good.  Got the hash and a solo bread pudding pancake and I basically could have died on the spot and been happy. Everything on the menu is so simple, but the execution is spot on. The flavors are perfect, and you can tell the ingredients are really fresh.  I love their motto of Modern, Simple, and Fun as this is exactly how I would describe the food I like to eat. They truly live up to their motto.  I want to come back next time I'm in Chicago and try everything on the menu. Based on my experience though, you can't go wrong.",0.9896,0.706,0.269,0.025,0.4790178571428571
2013-07-11,5.0,"Super cute decor.  DELICIOUS brunch!  Had THE Breakfast Sandwich with a side of the cupcake pancake (you can order one for $3).  The pancake was interesting--really airy.  The sandwich was delicious, as well as the mashed potatoes that came with it.  Great service.   About a 40 minute wait at 10:30 on a Sunday.  Not awful.  I need to go back to try the cupcakes!",0.9629,0.681,0.28,0.039,0.7738095238095237
2013-07-07,5.0,"Where to begin!!!!  If you need a great brunch locale this is it. The food is always incredible.  I would recommend the Bread Pudding pancakes, the baked oatmeal and the burger. My last visit I enjoyed the burger with goat cheese.  The burger is cooked perfectly, crispy on the edges and juicy on the inside.  I had the red mashed potatoes on the side, and while I wouldn't normally rave about something as simple as mashed potaotes, man were those good too! Downside here:  The market area unfortunately eliminates many potential tables, leading to wait times upwards of 60-90 min.  Take out the market and let more people in to eat this food!!!",0.941,0.817,0.147,0.036,0.6172161172161172
2013-07-05,5.0,"Southport Grocery is my absolute FAVORITE restaurant in the city! If you don't mind a long wait, this place is well-worth it. The food is fresh and everything I've tried is incredible. The Bread Pudding Pancakes are an ABSOLUTE MUST! The vanilla dipping glaze they serve it with really makes the dish. ALSO, if you have the opportunity to check out one of the ""secret suppers"" you must do so! They offer a secret prix fixe 3 course menu one a month that is superb.  Love the quirky staff and all their food.",0.9584,0.823,0.177,0.0,0.7333333333333334
2013-06-21,5.0,"Literally no complaints whatsoever. All the food was so delicious and well-presented. The staff was so happy to be alive it was infectious. Everything we had was amazing and highly recommended: -Grown up poptart -Bread pudding pancake (the one everyone raves about) - I think it's the vanilla anglaise that really puts this one over the edge. -Chorizo & Eggs (basically chilaquiles) - Very very very good. My friend had an omelette that was also delish. Even their plain iced coffee lacked the bitter aftertaste and was adorably presented in a little mason jar. Maybe it's because I came from NY, but I was very pleasantly surprised at how everything came out to less than $50 for all of that food plus a couple of bevvies.",0.9592,0.773,0.188,0.039,0.6264468864468864
2013-06-16,5.0,"great service, top shelf food and solid local retail products.  Pancakes, potato mash and brisket gravy are amazing.   The only down side is their popularity which creates long waits.  That said, you can shoot my David's Tea and sit on their patio.",0.9201,0.649,0.306,0.045,0.4923611111111111
2013-06-16,5.0,Where do I even start... Southport grocery is my go to place for brunch. Brunch is my favorite meal and I would go here every day if I could. The bread pudding pancakes are the best pancakes you will ever have. I also really like the hash and the southern omelet. The wait is long but it is definitely worth it. Plus you are on Southport so you can just go to all of the cute stores while you are waiting.  They also opened up for dinner two weekends ago and I just went for the first time Friday night. It was a great experience. The pickled vegetables flight was tasty but more of a lunch light side than dinner I would say. I had the grilled squid which was different but delicious! Highly recommended. The old fashioned was unique and of course tasty as well. We got a complementary strawberry shortcake for dessert that was out of this world!  In summary: Gogogo!!!!,0.9867,0.81,0.19,0.0,0.5389583333333334
2013-06-15,1.0,"awful charcuterie plate the worst i have ever ordered. Mortadella that was an awful red color, some awful spread that was described as spreadable salami, and so so chicken liver.  salty bread and sauerkraut as a side? ok old fashioned and good glass of wine. I notice that many other reviews are for breakfast items and maybe they are good at that.",-0.7269,0.711,0.109,0.179,0.6437499999999999
