date,star,text,compound,neutral,positive,negative,subjectivity
2015-10-06,5.0,"BREAKFAST review Showed u when they opened, on a game day without reservations, and had no trouble getting a table for two. Service was 5 star and the food was great. CLASSIC breakfast far.  Nothing too elevated, but everything tasted great.  I had the French Toast and my brother, a Raiders fan from Tennessee has the bacon and eggs dish, not sure what it was called. The food was great and the PORTIONS were large, no one leaves hungry. Loved it.",0.9549,0.682,0.229,0.09,0.5576479076479076
2015-09-25,5.0,"A group of us came for breakfast on a Saturday morning. We had a reservation but they didn't seem to be very busy. I would imagine dinner is their busy time. Our server Chris was fantastic.  Very knowledgeable about the dishes. Very friendly & entertaining. The food was phenomenal. My scrambled eggs were cooked to perfection. The only thing I found off putting is that the bathroom is up a flight of stairs, through the bar and down a hallway. On the plus side, there are a lot of very cool pictures to look at on the long walk. A bit pricy for breakfast but considering where it is located, it's worth it.",0.9792,0.797,0.203,0.0,0.5311574074074074
2015-09-24,2.0,"This place is so meh.  I had the crab cakes which were admittedly very full of crab but for 2 on the small side, a table spoon of very less than spectacular rice, and some shitty kfc-esq cole slaw for 30 bucks no thanks... This place might be cool if you were a Bears/Ditka fan. Otherwise it's boring and overpriced. There's a lot better restaurants in Chicago for the price and cheaper to be honest.  Bye Felicia.",0.8089,0.675,0.197,0.129,0.5946296296296297
2015-09-22,5.0,Food & Service is outstanding! This place is a must. First time in Chicago and my friends recommend this place and I am glad I listened,0.9168,0.583,0.417,0.0,0.736111111111111
2015-09-13,5.0,"We've lived in the River North area of Chicago for 3.5 years. Have been to Ditkas at least 20 times. We love it. Have never had any bad food, drink, wine or service. This is our goto place whenever we have guest from our home in Mississippi or we are entertaining for my husband's work. Always consistently great.",0.9331,0.794,0.206,0.0,0.6233333333333333
2015-09-08,5.0,This place was wonderful.   It's exactly as I expect it to be. The food was great and the service was even better.,0.8934,0.627,0.373,0.0,0.625
2015-09-07,5.0,"I rarely eat steak, but I will admit that eating the 12oz. prime rib at Ditka's made me wonder why I do not do so more often. I asked for it rare, and it came as requested. Extremely tender. The accompanying mushrooms were tasty. And just as importantly, the waiter was knowledgeable and amazingly pleasant. I would recommend the place to anyone.",0.9285,0.795,0.205,0.0,0.8777777777777778
2015-09-06,1.0,"Terrible customer service. The host barely looked up from her podium. Don't bother going here. There are plenty of places in Chicago with outstanding food along with first class service. You'd think with the name, Ditka, the place would have a bit of class to it.  Bottom line is that if you want to be insulted with lousy customer service, come to Ditka's.",-0.552,0.765,0.1,0.135,0.5616666666666668
2015-09-06,1.0,"If you come to Chicago to enjoy good food, great customer service, and awesome ambiance, there are many 4-star and 5-star restaurants to enjoy. Unfortunately, Ditka's is not in this range.  After visiting many steak houses all over the state, this restaurant has the worst customer service!!! We made a reservation, and we had arrived a little bit early. So the hostess sent us upstairs for the bar area. By the time, we walked upstairs. First of all, we noticed right away that there was no available sitting area. Then, the host did not even lift his head up to look at us. He asked us how he could help us when his eyes were staring at the monitor. What other job task could he possibly have at that time that was so important?! I told him that we had a reservation for dinner tonight. Then he simply pointed the bar area and told us to find a seat. Really??? Seriously!!! Ladies ~ please tell your men not to check out this place!!! The way the host treated us made us feel that we were discriminated!",0.9451,0.826,0.122,0.052,0.6219924812030075
2015-09-03,4.0,"I have been coming to this place through out the summer and have enjoyed each and every time, the good is very good, the service is on par and I have no complaints. One of the very few places that I trust their food for being just what they say it is.",0.8176,0.713,0.206,0.081,0.5525
2015-08-29,4.0,"Came in with my boyfriend. We were in dire need of a cocktail. I ordered a kettle martini, it tasted like too much vermouth was used, but hey, I was fine with it. We started with the filet sliders which we had ordered medium rare and came out well done. We asked them to re-fire them, they came out quickly prepared as we had specified. They had great flavor, nothing fancy. I ordered for my entree the crab cake salad, the crab cake was delicious, and a great portion. The salad was good, not great, It had way way too many onions that were overpowering any other flavors that wanted to shine, and the dressing, in my opinion needs some revision. Honey Dijon is a good pair, but just not that one. My boyfriend ordered the meatloaf which was a generous portion and he seemed to very much enjoy that. I would come back a dine here again. Staff is friendly and I enjoyed the ambiance. The food was good, not all of it perfect, but we enjoyed our meals.",0.9972,0.677,0.314,0.009,0.601315789473684
2015-08-26,5.0,"I confess... I love Mike Ditka, and the Chicago BEARS so this may be a slightly biased review on my part. However, I've been to a LOT of great steak houses from LA to Seattle to Miami and New York. Ditka's KNOWS their steak!!    Juicy, succulent, and melt in your mouth goodness. Of course, all of the original BEARS paraphernalia hanging around the place made the experience all the more memorable for me. Nice job... :)",0.9594,0.749,0.23,0.021,0.6912457912457912
2015-08-20,5.0,"We loved this place so much so we decided to go back there the very next day.  Their crab bisque soup was the best I have ever tasted.  Salty, creamy, with a hint of sherry.  The waiter (Kyle) was an excellent server.  He was so personable and fun.  He really made our dinner an enjoyable experience.  All the food items we ordered tasted great and was done right.  I will definitely come back to this place when I visit Chicago.",0.9778,0.734,0.266,0.0,0.39120879120879126
2015-08-16,5.0,Have never tasted a better banana cream pie. Seriously. Don't believe me? Well then I guess you'd better not waste any time and just go and see for yourself.,-0.6116,0.674,0.071,0.255,0.41666666666666663
2015-08-10,4.0,"You yelpers are terrible. You only complain. I had an awesome experience, and although I only ordered the Pot roast nachos, they fit what I was out for. On a scale of 1-5 Diktas, I would give them a 3, but they gained an extra point when my bartender Kristin subconsciously was whispering to herself ""da bears"". She made me feel very welcome.  Definitely be back.",0.9233,0.727,0.221,0.052,0.6722222222222222
2015-08-09,4.0,"What a great place, especially if you are staying at the Tremont.  Good vibe, very busy, good food and great service.  The bar tenders are very attentive.",0.9421,0.569,0.431,0.0,0.7271428571428571
2015-08-09,2.0,"I don't think we should have come here. I felt like from the moment we came in to the time we left there was no god service and it felt like the bus boys were nicer than our waiter. I ordered the steak salad - don't order this, its not tasty at all, and the hubby ordered a burger which was okay. This place is just a name not anything that I'd ever come here intentionally.",0.8271,0.819,0.152,0.028,0.25
2015-08-09,5.0,"Oh man!! That was the best meal I've had in a looooong time. Had the fillet two ways and the three sides: burgundy mushrooms, mashed sweet potatoes, and smashed redskin potatoes.  Finished with the flourless chocolate cake. Everything was delicious. Our server, Joe, was wonderful. There when we needed him, but not hovering. The decor is great with a classy display of sports memorabilia and not just about Ditka or football, but also baseball, hockey, golf, and basketball. I was afraid that this place just relied on its famous name as or was a tourist trap, but I'd go here again in a heartbeat.",0.9471,0.805,0.17,0.026,0.8125000000000001
2015-08-09,5.0,"We stopped in here on Thursday night, dressed very casually (shorts and t-shirts) after walking all over the city all day, and without a reservation. They were able to seat four of us immediately in the upstairs bar area, at a high top table. We planned to eat a late dinner elsewhere so we had appetizers and drinks, and this was the perfect place! The drinks were expertly crafted and there's a lovely wine list, the vibe was perfect for our needs, the appetizers were absolutely delicious, and the service was impeccable.  For food we shared the pot roast nachos and the guacamole. The pot roast was delicious and tender, and the other nacho toppings were amply spread across all of the chips, which is a major plus in our book. As for the guacamole...without a doubt the best I've had out anywhere, period. They sprinkle a little cotija cheese and pomegranate over the top, which makes it really zing, but for me it didn't even need those things. It was fresh, perfectly seasoned, great texture, and just so freaking good that I suggest everyone try it!  Shortly after we arrived the entertainment started, in the form of one man singing a variety of well-loved songs, including hits from Louis Armstrong and Sinatra. His voice was amazing and he does a great Louis impression. Surprising and enjoyable. As the evening went on people were loosening up, singing and clapping along, and it was a really fun time. The service really was great. Our water glasses literally never got more than 1/2 empty and we were checked on regularly by our waitress, while not being too much. The steaks being ordered at other tables looked and smelled delicious and I would definitely get a full meal next time.",0.9973,0.732,0.237,0.031,0.5563663967611336
2015-08-03,5.0,"BEST PORK CHOP EVER!  Greeted as soon as I walked in the door and we were seated in a dimmed light lounge area. Very comfortable seating and scenery. I went to the restroom upstairs and it seemed like it was a museum up there with lots of pictures of athletes, celebrities, signed jerseys and lots of cool memorabilia.  I was very surprised at the pricing! It was very fair, the pork chop is the most well known dish at only $18. The waiter was fantastic - was very polite and made sure our drinks were always filled. Offered advice on food and told us Coach's favorite dishes. Someone always made sure our water glasses were full, our drinks were refilled any time we were half way finished - did not have to ask. Incredible service.  I got the famous pork chop, my brother got the Kobe burger, mother got the fridge burger, my dad got the meatloaf. They all tasted fantastic - very rich in flavor and the food was so good it just melted in your mouth. I cleaned my plate! Might be among one of the best meals I've had yet in Chicago.",0.9936,0.771,0.229,0.0,0.746338383838384
2015-07-30,5.0,"This place is great. Fundamentally, it's high quality comfort food. There's something both familiar and upscale about it that makes this place tough to beat. The atmosphere is laid back, the service is great, and the location is awesome. If you want to be taken care of in a friendly, genuine way, ask for Kyle. He'll treat you right!  Favorites: Pork chop, prime rib (great rub), The Fridge Burger, meat loaf, broasted chicken, 16 oz. strip steak, Mike's salad, pot roast nachos, shrimp cocktail, filet sliders, Kick-Ass Paddle Steak (ribeye), twice-baked potato, and banana cream pie.",0.9794,0.74,0.246,0.013,0.6340873015873015
2015-07-30,5.0,"Perfect Medium Rare Tomahawk Steak and Da Coach!  Excellent service, great steaks and seafood.  Terrific downtown location.",0.9422,0.466,0.534,0.0,0.93
2015-07-29,5.0,"Wow, excellent service, drinks and a perfectly cooked steak. Much better experience that I expected. If in Chicago again, I will definitely go back again. Reasonable prices as well.",0.9607,0.508,0.492,0.0,0.6428571428571429
2015-07-29,4.0,"When I come downtown, I really enjoy coming here for breakfast. The food is very good as well as the service. The portions are always more than adequate. This is one of the few places that I have been coming to for the past ten years that I know I can have a meal and a drink without any surprises,  They are consistently very good.  Thank you.",0.9386,0.737,0.239,0.023,0.40541666666666676
2015-07-29,5.0,"AMAZING BURGERS, FRIES, and everything else, DITKAS is the place to go. The onion rings are always cooked to perfection. Any appetizer you get is guaranteed to please. The fridge burger is out of this world and if in Chicago and wanting a good burger, this is the place to go",0.9251,0.774,0.226,0.0,0.75
2015-07-23,5.0,"Lived in Chicago many years ago and can't believe I never went here, we love great steakhouses and this was right up there with the best. I would 100% come back here again one day, our waiter was amazing and the food was delicious! Finished off our night with the banana cream pie which was to die for, so so good. Definitely come check out Ditkas if you're ever in Chicago.",0.9769,0.659,0.299,0.042,0.5685714285714285
2015-07-19,5.0,"We had a private room for a larger group last night and everything was so amazing. The food was obviously really good, I was not shocked about that.. But the service was incredible! Anna and her server assistants were so on top of everything and so unbelievably nice. They really went above and beyond! If the GM is reading this - please know that Anna and her SA's rocked!!",0.9599,0.754,0.246,0.0,0.5401515151515152
2015-07-13,5.0,"We unexpectedly fell upon Ditka's. The tomahawk steak was perfect! Coach's pork roast nachos were delicious. Go for the large nachos if more than 2 people are dining. For our sides, we ordered the creamed spinach, lobster mac and cheese, and the sweet potatoes. The lobster mac and cheese was the BEST! My strawberry mojito was on point and our waiter was great as well. No complaints here!",0.9613,0.684,0.26,0.057,0.7035714285714285
2015-07-11,3.0,Service was exceptional and food mediocre. Had a combo at lunch and the soup was supposed to have crab but didn't see any. Just tasted like normal can vegetable soup. Club sandwich was tasty but the smallest club I've ever seen. Friend had pizza which was pretty tasty and decent size for one person. The atmosphere is great and maybe we just ordered wrong.,0.9366,0.728,0.22,0.052,0.8523809523809524
2015-07-11,5.0,It's Ditka's !!!! Say no more !!! Great food !!! Love this history and straight up executive feel...not romantic but iron mike doesn't seem like a romantic anyway,0.8419,0.532,0.354,0.114,0.5416666666666666
2015-07-08,1.0,"I met some friends here for dinner after work a few months back. We ordered oysters on the half shell to start and I ordered a steak for dinner. I ate 2 of the oysters and by the time the steak even came out, I had already RAN through the restaurant to vomit. After the steak came, I took one bite of it and had to run back to the restroom again. I tried to at least continue to sit through dinner because my friends had come in from out of town, but I couldn't. For the rest of the night I continued to puke to the point that I ended up in the E.R. with severe dehydration and a confirmed case of food poisoning from oysters. The next day before my friend left town, she stopped by the restaurant to tell them that I had spent the night in the E.R. She demanded a refund for dinner because of the fact that I ended up in the hospital, and because our dinner was cut short due to them serving toxic oysters. They did end up refunding her for dinner and told her they would like to take care of my medical bills. Unfortunately, a few days later when I called, the manager she had spoken with was no longer employed there. Since then, I have been waiting for weeks at a time to get return phone calls from management and the restaurants insurance company. Both have now told me that this is the fault of the company that supplies them with the seafood even though they were the ones that served it to me. Two oysters and a bite of steak ended up costing me 72 hours of misery and nearly $2000. With so many great restaurants in the area, avoid this one at all costs!",-0.9444,0.817,0.067,0.116,0.24656862745098038
2015-07-06,5.0,We happen to stumble upon this place and I will be back again when I visit Chicago. The waiter was great and quick service. They were my busy when we arrived around noon but people piled in shortly after. It was hard to decide what to eat because it all sounds so good. Loved all the history and memorabilia in this restaurant. Price was fair for lunch. I seriously can't say enough good about this place. Sadly this was our last day when we found Ditka's or we would have been back to test the other items on the menu!,0.9548,0.753,0.184,0.062,0.47058823529411764
2015-07-05,5.0,"I'm just going to throw in a quick one. We've been going to SW Florida for over thirty years.  I've been vacationing in Bonita Springs for the past five weeks.  SW Florida is supposed to be the land of key lime pie. How come the best key lime pie is at Ditka's in Chicago?  (It's not as good at the Oak Brook location.) They always cook my steaks very blue as I demand.  My wife, who is at the opposite (and wrong) end of the spectrum gets her meat well done. Her well done burgers are still juicy. The service is always excellent. I should have reviewed Ditka's prior to now.  It's sad that it took key lime pie to trigger some action.",0.7032,0.854,0.091,0.055,0.5557142857142857
2015-06-28,5.0,"Wow. We are from Boston and big sports fans so we figured lets look into Mike Ditka's restaurant. Well the reviews were very good. The YouTube videos looked good as well. So we went there. It was fantastic. From the crab cake app and kale/caesar salad, warm rolls to the main meal of Da pork chop and the two 6 ounce filet mignon bone in filets we were overwhelmed. To top it off we ended with coffee and the most amazing banana cream pie we've ever had. The waiter said it was amazing and he was right.    Our waiter Mark was a seasoned veteran who is perfect for the job. Intelligent, great personality, attentive but not overbearing or pushy at all and helpful. He was assisted by Amanda, a waitress in training who was also good at what she did and explained the rigorous top to bottom training program. You can tell that Ditka pays attention to the details as it shows in his staff.",0.9829,0.769,0.217,0.014,0.627452380952381
2015-06-24,4.0,I love this place. Very classy. Great food. Cigar lounge. Dress up. Not a place for casual clothes.,0.927,0.469,0.531,0.0,0.8041666666666667
2015-06-22,5.0,Had a great time. Excellent food. I ordered the pork chop special and it was the best I've tasted. The waiter even accommodated my 5 year old cousin by getting a high chair for her doll. Great staff.,0.9628,0.607,0.393,0.0,0.5873469387755101
2015-06-17,5.0,"Service is excellent!   My waitress, Chelsea, was really on top of her  game. Food was hot and delicious. Great atmosphere. Definitely will come back!",0.9506,0.53,0.47,0.0,0.625
2015-06-17,4.0,"Ditka's is actually my favorite restaurant in Chicago. It has great food and a  great atmosphere all in a wonderful location just off the Magnificent Mile. The wait staff is helpful although always somewhat hurried as I always seem to be there at a busy time. But even then, the wait time is not all that bad. Will go again on my next visit to Chicago!",0.977,0.69,0.31,0.0,0.6833333333333333
2015-06-14,5.0,"We had a private party and private room with a brunch buffet and omelet chef. The food was amazing!  I typically am not a big waffle person and the waffles were amazing!  The mashed potatoes were among the best I have ever eaten anywhere.  The omelet chef was fabulous. The drinks were a perfect finishing touch to a fabulous meal.  If you like a fancy Bloody Mary, definitely order one here.  If not, get the Bellini! To make it even better, their service was top notch. If you are planning a private brunch in the area, this is the place to have it.  Looking forward to eating here the next time I am in Chicago!",0.9863,0.705,0.273,0.022,0.5816666666666667
2015-06-04,1.0,Prob one of the worst places I've ever been.  Host staff are dude as can be and aren't doing anything.  Food is atrocious and I have had intestinal problems ever since meal last night - plus it's overpriced.  They live off the Ditka name to get people in - its a joke.   Avoid - better establishments out there. 2 days after I've eaten at Ditkas and I'm having sever stomach pains and the chess I've diarrhea - hate to be so graphic but just stating a fact.  They need to look into what they are serving their customers - fing disgraceful!!!,-0.7633,0.853,0.036,0.112,0.6238095238095239
2015-05-23,5.0,"We all chose the classic meals and they were superb.  You can go to Ditkas and spend a fortune or get the classics and eat a perfect meal, with plenty of leftovers and not break your bank.     We will definitely make it back here.    Best Meat Loaf ever. Once we ordered, the food came out very fast.",0.9403,0.776,0.224,0.0,0.5352380952380953
2015-05-20,5.0,"Wasn't sure what to expect walking in. Ditka's is like a classic steakhouse meets a sport bar. Great setting with plenty of TVs to watch the games. The ribeye steak with onions, tomatoes, and garlic butter was delicious and was cooked perfectly to request. Sides, apps, and desserts were great as well. Service was polite and attentive.",0.9625,0.679,0.293,0.028,0.7793650793650794
2015-05-19,5.0,"Visit Friday May 15,2015 Having become acquainted to some locals I inquired about a really good, stick to your ribs  meal for hungry tourists that would offer a place to get off our feet and have cocktails  Ditka's was suggested. I made a note of it. When we literally turned a corner and it was there when we were exhausted, we plopped down for lunch, ragged. No problem said the hostess. It was a nice day and she suggested sidewalk seating. Never a big fan of that I was impressed as to how they were able to make you feel as if you were inside with the wonderful setups, nice tables, flowerboxes and an awning.Unlike some places the outside dining was not an afterthought. It was a nice as inside. Waitstaff did not run in and out and wait tables inside. They had the outside assignment and took it seriously- From the man who filled the waters without asking. To our wonderful server  ( forgot his name but hope when Mgmt reads this they know who it was).  Our server was in a word-awesome, We told him we'd like to start with a cocktail and savor it. Then we would order an App and then we would order out entrees. No Problem! He did not rush us one bit and he was great at explaining the menu when we had questions. The 2 cocktails we had, both different were exceptional.  Our app of Oyster Shooters with tabasco vinaigrette was like nothing I had ever had. Happy to have a new food experience! My Millennial daughter who likes nothing loved her cocktail and is still talking about the best salad she ever had. It was big so she had leftovers for breakfast. She had : MIKE'S SALAD greens, pecans, apples,cranberries, goat cheese, balsamic vinaigrette   AND I had The Chicken Sandwich special of the day which was very juicy broasted chicken. Great experience.",0.9914,0.791,0.16,0.049,0.6588458476389513
2015-05-17,5.0,"I have dined here several times over years, and most recently on two occasions with large groups. As of course a fan of the Chicago Bears and Mike Ditka this is my go to place for a great meal while I am in Chicago with Family, Friends, or Business.  This recent visit I had to change reservations at the last minute and they were able to take care of our last minute larger party with no problem.  The restaurant itself is a shrine to old time Chicago Bears Football and Chicago Sports as well as many of the teams Da Coach has played with and worked with over the years all done tastefully in the style of a high end restaurant. Full Size Bar area is right inside the door along with a small gift shop counter. The Second floor area is mostly for larger parties and or private group dining. The Main level restaurant sits just to the left as you enter and the also on those perfect Chicago days have limited outdoor seating. The service and food... WOW it's what you would expect and by that I mean TOP QUALITY SERVICE, TOP QUALITY FOOD Second to none, and beyond what you expect. I have never had a bad meal or service here each time its always the best.  My most recent  visit we had several of the apps including the Nachos, and Calamari, and I also had the Lobster Bisque which was all again TOP NOTCH for the main course I had the Prime Filet Steak which was cooked perfect and cut like hot butter. We also had a good round of all the desserts and the Ditka sized Banana Creme Pie. Da Coach has surrounded himself with people and management that I say must live by his philosophy as far as I am concerned because no corners seem to be cut here ever. The food is by far the highest, freshest quality I think I have eaten. I live in Florida and Calamari is a beach side staple for me and I think the Calamari here at Ditka's was even fresher than I get there. Again it's the GO TO PLACE when I am in CHICAGO and it always will be with the standards that they have.",0.9924,0.824,0.143,0.033,0.4568479437229438
