date,star,text,compound,neutral,positive,negative,subjectivity
2014-02-06,4.0,"This is a really cool place. My husband and I being big sports fans had to check out Ditka's on our trip to Chicago. We had a great time. The place was packed when we went. I don't believe we had reservations that night, so there was a good wait. We had a beer at the bar though and enjoyed the atmosphere. We thought the food was pretty good. My husband loves meatloaf and enjoyed it. We left full and happy.",0.9837,0.686,0.314,0.0,0.6045454545454546
2014-02-05,5.0,"Oh my gosh - our server Todd tolerated the heck out of me and I give him major props. I had reservations for this past Friday evening and I'm thankful we did! It was bustling and tables turned like cogs in a machine. Our table didn't turn as quickly as the ones around us because, well. I was being goofy with my kid brother and also insisting on conquering my ENTIRE slab of BBQ ribs. And then I obliterated my banana cream pie. Yup. I did. And I am STILL distended. The atmosphere in Mike Ditka's is lively. There's a large bar and multiple rooms. We were seated in a cute room with only three or four tables, more pictures of Mike than chairs, and a TV showing a basketball game. My brother and I still had easy conversation despite the cacophony surrounding us. We loved our food and our drinks. I don't think that I would say it's the best I've ever had in my entire life but I'd say I was treated to a satisfying dinner and had a great time. The sauce on my ribs was tangy with a little heat and fruit notes. I was inspired to clean all of the bones which took FOREVER. I'm sure my server friend Todd was relieved that I asked for my sides of coleslaw and fries to be wrapped up. Seriously - the man was a champ. He was perfectly friendly and indulgent the whole time.",0.9947,0.768,0.217,0.015,0.6111441798941799
2014-02-02,5.0,"Excellent place to have a nice dinner and watch the Super Bowl.  Great food, service, and a comfortable ambiance.",0.9571,0.403,0.597,0.0,0.8433333333333334
2014-02-01,3.0,"Walking home on a windy cold evening we decided to eat at the bar and grab a glass of wine and a burger. We were taken immediately, the service was great, loved the bar layout with tables separated enough to allow a nice meal. The burgers were good. The fries were very good. The wine was ok for the price. The quality of the meat was excellent and they cooked it perfectly while the price for the burger and fries was very reasonable for the price. We enjoyed the meal. May not be the first place we go for a burger, but we might go back.",0.9428,0.813,0.187,0.0,0.695952380952381
2014-02-01,2.0,"I went for Restaurant week yesterday.  The food was mediocre at best.  Even with the Restaurant week pricing I would not go back.  I just think you can find better food in Chicago.   The staff was pleasant, although the hostess had a shirt that bared her whole chest cavity and dipped down to almost her stomach.  I'm socked they didn't send her home.  It was club attire at best.  Very inappropriate since children were also in this restaurant.  It just kind classed down the place.",0.9584,0.809,0.191,0.0,0.4767676767676768
2014-01-30,3.0,"I typically shy away from these "" tourist"" type restaurants, but we decided to try Ditka's for restaurant week with my in-laws who typically don't venture into the city.   Could have been a four star based on the food alone.  Good portions, large selection, and the food is filling, hearty, and tasty.  The steak was well cooked and my husband's tuna far exceeded my expectations.  Service was mediocre at best...we were sat in the loud and crowded bar area 45 minutes AFTER our reservation. While they did comp an appetizer, I still expected more of an effort to make up for the lack of accommodations.",0.1406,0.877,0.059,0.063,0.6365079365079365
2014-01-30,5.0,"Being a Canadian Chicago bears fan since I could vaguely remember watching the NFL, Mike Ditka and Walter Payton have always been the people I remember most. I've been to Chicago twice, 2006 and 2009 and it wasn't until 2009 that I went to Ditka's. I will have to say that it was the best pork chop I ever ate! There was a cherry reduction sauce that it was immersed which was to die for and the pork was a nice thick cut that was grilled to perfection. I knew that I would try to replicate it when I got back home in Toronto but I haven't been able to yet nor find a place that comes close. My lasting souvenir is the bottles of pork chop sauce I bought as I left the restaurant.  Definitely need to go back soon!",0.8241,0.877,0.093,0.029,0.35454545454545455
2014-01-30,5.0,"It was my first ""football"" trip to Chicago with my friend. Food was great. He got a meatloaf and I got a pork chops. Everything was perfect including peanut butter cream desert and banana tart. Portions were huge and delicious. Decor: too many football trophies and cool ""pieces of art"", signed football balls, helmets and posters. I really enjoyed this time in Ditka's. Unfortunately, we did not meat the coach because he was on vacation but we will absolutely come back to sign our ball. Recommend(!!!)",0.9026,0.809,0.173,0.019,0.703030303030303
2014-01-28,5.0,"One of my first meals in Chicago that I enjoyed so much I went back for a second time. Thanks Coach! 2 stars, great service, they were quick and friendly 2 stars, great food, sooooo delicious, the fish tacos are great and pot roast nachos in particular were delish 1 star, decor, it's roomy, comfortable, and lots of cool Ditka things to look at as you make your journey to the can. Definitely come here!",0.9875,0.632,0.368,0.0,0.4979166666666667
2014-01-25,4.0,Great pork-chop!  Get the pot roast nachos for appetizer!  Like the dark woods ambiance feel.  Decent bar area.  Bathroom upstairs is a negative.  You shouldn't have to walk a flight down or up to take care of business.  A little touristy but Great food.,0.8829,0.706,0.248,0.046,0.5365079365079365
2014-01-21,4.0,"Food quality was top-notch.  Prices are fairly high but probably in accord with what you'd expect to pay for a nice dinner in downtown Chicago.  I liked the atmosphere - I'm not even remotely a sports fan and the only thing I know about Ditka is that he coached the Chicago Cubs and was in the movie ""Kicking and Screaming"" (wherein he played himself, and quite well at that.)  A coworker and I were in town for a conference and we needed someplace to go and eat and we chose Ditka's because we'd had enough of the pizza places.  It was a good decision!  I'd definitely return.",0.9649,0.753,0.205,0.042,0.6822222222222223
2014-01-09,5.0,Went to celebrate the holidays with my buddies and as usual Ditka's did not disappoint.  We had Iron Mike Beers and calamari to start our night.  Two of us ordered Lamb Chops and the other the Tomahawk Steak special and we had a nice bottle of Cabernet to wash down the wonderful meal.  All I can say was that the meals were superb and the banana pudding was delicious.,0.9765,0.698,0.302,0.0,0.6856646825396825
2014-01-08,4.0,"I do love this spot.  I've been a couple of times on different trips to Chicago (I'm from the Nashville area). My first time to visit was on a trip with my wife.  We sit at the bar and order a beer while waiting on a table.  My goodness, I start to down my beer and get a look at the bottom of the glass.  My wife's glass has it too.  There are etchings there--they're little footballs! We get a table and I order the meatloaf.  I love meatloaf anyway, but Ditka's does a great job.  It was awesome.  The side dishes were great and I was about to blow by the end of the meal.  So much food!  This is Chicago's version of a meat-n-3. Ditka's is a cool spot.  There is some neat stuff to see in there and it is a must visit for any football fan making his or her way through the Chicago area.",0.9888,0.796,0.204,0.0,0.5702020202020203
2014-01-06,4.0,"FOOOOOOOODDDDD. Thank the lord for the American heartland. We made reservations on a Sunday evening, and when we arrived, we were directed to a small bar table right next to the top of the stairs. Unacceptable. This was a date night and we made advance reservations. We asked to be moved to a different table, and the hostess graciously found us another table - it was a pretty busy night, so we appreciated the attentiveness even though the hostess was clearly a bit harried. While debating whether to order an appetizer, our waiter advised us not to - that the entrees would be more than enough. We followed his advice and munched on warm raisin bread and dinner rolls with butter while waiting for the food to come.  I had the 'Refrigerator Burger' (a classic burger with lettuce, tomato, beef patty, toasted bun, etc. with a heaping helping of french fries) while my beau had the most amazing and terrifying tower of food I have ever seen at a restaurant.  The meatloaf tower - which was actually comprised of one thick slice of sweet cornbread, two slabs of meatloaf, mashed potatoes, gravy, crispy fried onions, tomato, green onion, and hot sauce drizzled on top - was at once sweet, savory, crunchy and soft. I ate and ate until I couldn't eat any more. I had ZERO room for drinks or dessert.  I think I walked out of Ditka's in a contented daze.  Side note: it was not as expensive as I thought it would be.",0.9698,0.823,0.135,0.042,0.46645408163265306
2014-01-06,5.0,"Obviously go for the pork chops, but while you're there, try the less-talked about pot roast nachos. They are not your standard nachos; the pot roast is amazing.",0.7351,0.839,0.161,0.0,0.4666666666666666
2013-12-30,5.0,"Amazing. I want to live at this place. It's all leather, whiskey, steak, and Frank Sinatra. I grew a full beard within 15 minutes of sitting down. We started with beer, whiskey, and the outstanding BBQ beef brisket quesadilla. On a recommendation of a friend I did ""Da Pork Chop"" for diner. It was one of the greatest things I've ever eaten in my life. We went full Ditka and did two bottles of Mike Ditka's ""Hall of Famer"" Pinot noir with dinner; not surprisingly, it was effing amazing. Do not miss this place if you are in Chicago.",0.9645,0.78,0.202,0.017,0.6763888888888889
2013-12-30,1.0,"Never in my life have I had a bartender pull a check out from under my hand after he has charged my card and presented the bill. But that is what happened here.  I ordered an appetizer and then a steak with two glasses of wine. My check arrived, I put a card down and it was charged, as I was signing the bartender walked up and grabbed the check out of my hand and said he forgot to add a glass of wine. I showed him the original check and he said ""right"" and walked off. No apology or anything. When I spoke with a manager, he tried to smooth things over which I appreciate but I will not be returning.",0.5267,0.883,0.078,0.039,0.5186507936507937
2013-12-25,5.0,My family and I went here almost a year ago and I still consider it the best meal I've ever had. I ate the chef's choice cut beef prime rib. It was ~$65 and came with mushrooms and horse radish. Next time I'm in Chicago I'm definitely going back.,0.7003,0.824,0.135,0.041,0.2
2013-12-20,5.0,"I've been to Chicago more times than I can count yet I have never been to Ditka's.  We finally decided that we needed to check it off our list and boy was I glad we did!  The first thing that happened was we noticed that Iron Mike was siting just a few feet away from us and was graciously in granted us a photo op!  How can you top that?  Well....  I had the ""Bone-In"" filet mignon and that capped off our already incredible experience.  The service was outstanding, there was plenty of ""breathing room"" upstairs, and we had amazing food at what I believe to be a fair price.  I will always remember my visit there.  Thank you Mike and thank you staff!!!",0.976,0.801,0.199,0.0,0.7008333333333334
2013-12-18,5.0,"I had 1 of the best dinners and times I have had in a while at this restaurant.  There were 6 of us and it was a fabulous place to have a special meal with some special company.  Most of us had the bone in filet.  It is perhaps the best steak I have ever eatten, and I am a big steak fan so I know my steak! :) The cocktails were fantastic too. The waiter was highly knowledgeable and confident in his dicussions on the menu items, and wine. and the service level was off the charts great.   The restaurant was a very warm/cozy restaurant and was very crowded and made for great atmosphere for a fun time.  I will definitely visit this location again next time I visit the Windy City!",0.9925,0.703,0.297,0.0,0.5231216931216931
2013-12-12,2.0,"We had been bar and restaurant hopping most of the day and damn near every place we stopped at was super crowded except Ditka's. I guess the recession is really over. Anyway we actually got a table and ordered up some nachos, chili and soup because it was damn cold outside and we needed some hot nosh. This is where the fun stopped. The famous pot roast nachos were awful, the chili was cold and the soup was very salty. I'm not sure why there are so many good comments on the nachos. The portion was small, luke warm, expensive and the cheese was stiff. I guess because it wasn't hot. The chili was good once they reheated it and eating the soup was better then the bar feeding us salted pretzels to keep the thirst going.  On the plus side the service was very good and a couple sitting next to us loved their steaks but they were from out of town and possibly had never been to any of the finer steakhouses that Chicago does offer.",0.6943,0.847,0.089,0.064,0.5920576131687242
2013-12-09,5.0,"Ditka's is an amazing restaurant. Going in, I thought it would be one of those restaurants where they rely on a famous name in order to serve average food to tourists. This was definitely not the case. Ditka's serves high quality food in an amazing ambiance. You walk in there and it feels high class yet not pretentious. The food satisfies both the ""average man carnivore "" and the ""refined, hipster glasses wearing, yuppie that you'd be embarassed to introduce to your parents""  I would bring a date here, I bring a business partner here, I'd take an 80 year old woman here, it fits everyone. Everything i've had here is delicious, but I'm a big fan of the pork chop. You'd be hard-pressed to find a better quality hunk of pig. The chop is juicier than a political sex scandal or a Spanish clementine.  Also a big fan of the desserts. they're huge. They're Ron Jeremy sized.",0.9497,0.832,0.144,0.024,0.5164705882352941
2013-11-20,4.0,Mike Dikta came and and took pics with patrons. Very cool.  Very cool place where the food is above average the memorabilia on the walls is cool. Upstairs has a live singer who was actually pretty good and entertaining.,0.9411,0.656,0.344,0.0,0.6266666666666666
2013-11-15,4.0,"Waiter was awesome, food was good ajd drinks were great.  Fun place!",0.9402,0.353,0.647,0.0,0.6375000000000001
2013-10-31,4.0,"Definitely different than the Oakbrook location. The dish I usually get has $6 difference in price. so ridiculous.  however, overall good restaurant",0.331,0.671,0.209,0.121,0.49000000000000005
2013-10-20,5.0,"Went to Ditkas to celebrate our 10th anniversary.  Da Coach was there celebrating his birthday with his family at a table in the bar.  He was very gracious taking pictures and shaking hands with guest after guest.  We got there a little early for our reservation and had a couple drinks at the bar, the bartenders were very friendly and handled the large crowd at the bar well.  We were seated at a table just off the bar area, which was good for me as I could still see the TV over the bar to root against the hated Cardinals.  Our waiter was a real pro, he knew the menu and was not shy about offering his suggestions, but was a really nice guy and not at all snooty. What I liked about the menu at Ditkas was they had a wide array of selections, hey have you covered from upscale steak house to classic comfort food.  And they cover a lot of price points, so if you want a $60 tomahawk steak like I ordered, they have you covered with a steak as good as you will find at any steakhouse in the city.  My wife had the meatloaf, and it was delicious.  We split an order of lobster mac and cheese, and I could have just made a meal out of that. I left absolutely stuffed, but happy.  We both really enjoyed our first trip to Ditkas and will be sure to return soon.",0.9935,0.789,0.197,0.015,0.5746409674981103
2013-10-19,4.0,"I loved the ambience here.  The food was absolutely delicious. Prime filet cooked medium was incredible. The New York was perfection.  My plain version of the pot roast nachos-----yummola!!!  (Please don't get mad I ordered them plain--I have spice issues:).  Service was good (not perfect), but good. Thanks Mike Ditka for a great meal and fun night.",0.983,0.602,0.398,0.0,0.6816683316683316
2013-10-17,3.0,"A bit touristy, but a friend wanted to go there.  We enjoyed our steaks, but they were just about what you could get elsewhere.  The appetizers were too - an average spot, in a tourist location, with decent steak-house food.  The beef is prime, so you know the quality is there.",0.8674,0.837,0.163,0.0,0.5888888888888889
2013-10-08,4.0,"I had the nacho appetizer and the bone-in filet. It was very delicious. The only reason why I'm not giving 5 stars is because with the price I paid, I could have gotten a delicious meal anywhere else. I am definitely a fan and will be back, if I find something unique to this restaurant that is mind-blowing, I'll be happy to give it the fifth star. Also, maybe if I run into Coach D then I'll give it the 5th!",0.9427,0.774,0.202,0.024,0.7857142857142857
2013-10-04,3.0,"This one is tough. The food was fantastic and so was the service. The seating was comfy and it didnt hurt to have thursday night football playing on the screens.  However, it was so loud in there, my wife and i could not communicate at all. Loudest restaurant i have ever been in. Maybe it was the acoustics or maybe just a really loud night, but if you plan on coming here to enjoy a nice dibber date...think twice.",0.9069,0.823,0.162,0.015,0.8055555555555555
2013-09-27,5.0,My favorite place in Chicago highly recommend the fridge burger and get ready to be in football heaven it's just like being at a football museum plus coach is there often to talk and sign autographs and always makes time for his friends and customers.I will always go back.Five stars it is...,0.945,0.724,0.276,0.0,0.68
2013-09-23,5.0,"Came here after my graduation from DePaul not knowing what to expect.  This place delivered more than I could have asked for.  The service is impeccable, they did not miss a beat- I even spilled a drink and they brought me another one for free.  I ordered their bone-in ribeye with mashed potatoes and it was phenomenal.  Come here- you won't be disappointed.",0.7429,0.883,0.117,0.0,0.6599999999999999
2013-09-14,5.0,"Da Coach knows a good burger. The Fridge Burger at Ditka's Steakhouse is a Monster of the Midway of burger love. Featuring a perfectly cooked beef patty, cheddar, mustard, mayonnaise, onions, pickles, lettuce, tomato, and a side of ketchup to add-on if you wish. The burger is super juicy and packs a great combination of flavor from the cheese, beef, pickles, and other toppings. The bun is amongst the best I've ever had with a burger, and it a does a great job of supporting this massive burger. While this is a classic, you can definitely see the steakhouse roots in the perfect grind/texture of the beef, and the high-end touches that make it one of the best I've had.  When finished with the Fridge Burger it was worthy of my ultimate praise...I wished there was some more to enjoy.",0.9943,0.7,0.3,0.0,0.625462962962963
2013-09-06,5.0,"My recent visit to Chicago was a good one as I dined in several restaurants thought Chicago. With the prize of the week being a soup to nuts experience at gibsons. Of all the places we visited Ditkas had the absolute best service and food...... Delicious, we ended up eating there 5 times! The NY strip was money with some mike ditka wine and a mike ditka cigar to end the night right. In most cases a vanity restaurant and all their hoopla with merchandise and other things usually are terrible. Well not the case here. Cigars and wine were great! Day 2 was bloody Mary's and burgers with pot roast nachos. Back to the bloody Mary's..... Epic....made with mikes special mix. Words can't describe what this actually is all about. Just get one..It comes with all the fixings and even a side car of mikes own beer! All great! Day 3 was Pan seared salmon with a jalapeño corn cake. Again awesome. Day four was a ton of mikes wine and an assortment of apps. Service was great every time and the bartenders were friendly and very knowledgable. If your lucky mike will be there as well. The restaurant is packed with memorabilia and some really awesome history of Chicago sports history. I love this place and will be back for sure. Well done! You can't go wrong!",0.9934,0.726,0.224,0.05,0.6018746579091406
2013-09-03,3.0,"While in Chicago, we were treated to dinner at Ditka's. What was even more interesting, is that Mike Ditka sat at the table next to us and we had an interesting conversation with him and his wife! We ordered the special of the day, which was tomahawk steaks. They were delicious! Cooked to perfection. The sides we ordered were the fresh asparagus and the lobster mac and cheese. I can not say enough about the mac and cheese. To every noodle, there had to be at least two pieces of lobster, thick pieces. We also tried the parmesan crusted cod, which was great as well. THe lemon caper butter had the right amount of tanginess.  Great place to try, might frequent it, if I lived in the area.",0.9822,0.8,0.2,0.0,0.5201530612244898
2013-09-01,5.0,Amazing food. If you love meatloaf or pork chops...the place to come. And love that Ditka shows up quiet frequently.,0.9217,0.582,0.418,0.0,0.5466666666666666
2013-08-23,3.0,"While my mom was in town visiting we decided to go to Ditka's. First thing you should know is that almost everyone there is a tourist or like myself, is there with a tourist. Some of the memorabilia is pretty cool, unfortunately we were seated in a back corner room with not as much.  Our server did a great job, friendly and helpful and about everything you want in a waiter. Food was good but nothing special. For appetizers we got a Shrimp Cocktail and some French Onion Soup. Both were pretty good, and the Shrimp were nice and big (although for $17 I would sure hope so). We both ordered the Prime Filet Mignon. The sear on both steaks was very good but my steak came out rare even tho it was ordered medium. When they brought it back it was questionably medium rare (but barely and nowhere near medium) but I was pretty hungry so I just went with it.  The grilled onions were actually very good and my mom's Bearnaise sauce was serviceable. Asparagus was very bland and the potatoes were good, but again nothing special.  We got the banana creme pie for dessert which was pretty good.  If you're in town and looking for a place to go with some history then this place is for you. If you live in Chicago and are looking for a good steak place I'd recommend going somewhere else. In a city with as many steakhouses as Chicago, Ditka's just doesn't measure up.",0.9952,0.75,0.224,0.026,0.6189417989417991
2013-08-21,4.0,I write this review as a citizen of the great city of Chicago.  I say that because most of the time you will be hard pressed to find anyone else who is not  a tourist here. The people wearing cowboy hats at the bar gave it away :) Its basically a culinary shrine to the Chicago bears when they were awesome back in 1984-1989. ..You know when Billy Idol got radio airplay and men with mullets were quasi fashionable :)   I know I paid over $45 for the colorado lamb chops. Unlike other places it had alot of meat on it because if I pay that type of money I would like some meat on my lamb chops...I'm just sayin' I dont think their breakfast on Sunday hits the spot. The service is usually good. Sometimes they have a lounge singer who is suppose to be among the top 5 lounge singers in the country who is belting out some tunes over there. I think his last name. Who knows. Ask them when the lounge singer is singing upstairs and that is a good time to go..it's an ambiance thing.,0.9702,0.86,0.126,0.015,0.5333333333333332
2013-08-20,4.0,"In town on business, staying at the Westin on Michigan and looking for a local place for dinner.  Ditkas was great.  Split between a team house and sports bar.  I had a Greek salad and filet sliders, which were tremendous.  PLENTY of food. I'll come back next time I'm in town.",0.6249,0.918,0.082,0.0,0.2916666666666667
2013-08-15,5.0,"I saw some celebrities, had great food, and the portion sizes are for a king. I give Ditka's a 5 because I am a Bears fan. I mean come on--where can you go in town and just see Ditka having dinner? Worth every penny. If you are not a Bears fan, I would say it is more like a 3.5 star restaurant.",0.908,0.775,0.225,0.0,0.509375
2013-08-12,1.0,"Overpriced for what you get. Go to a nicer steak house for this price range. The spinach salad was soaked in dressing and warm.  The halibut (dry) was covered in shredded crab on a bed of rice that tasted like instant rice....  The ambiance was dark, I think to make it difficult to really see the food. The steak was  flavorful but hard to chew..... The corn side dish came covered in some white sauce,,,,  Don't expect fresh vegetable dishes, it seems they are prepared ahead of time and just placed in a serving dish.   I think I was most disappointed with the price, it felt like the quality did not match the price...  Wine was great!",0.7438,0.789,0.13,0.081,0.5423611111111112
