date,star,text,compound,neutral,positive,negative,subjectivity
2017-08-26,2.0,"Had the great idea of going on a date at Ditka's in Chicago to celebrate my recent acceptance of a very prestigious job offer, and let me tell you that I wish I would have taken my patronage elsewhere if I would have known the outcome of this dining ""experience"". I could have cooked the meal better and saved myself the almost $200. The Brussels sprouts were literally burnt to a crisp and the portions were minuscule compared to the exorbitant price. I will, however, add that the service was great and the drinks were wonderful. All in all, the night still turned out wonderful but I do not think I will return to Ditka's anytime soon.",0.9418,0.832,0.168,0.0,0.6208333333333333
2017-08-26,4.0,"Ditka's Restaurant is great! My colleague and I were recently in Chicago for a business trip and one of the dinners took place at Ditka's in one of their private rooms. The restaurant has amazing ambiance - it is decorated from head to toe with sports memorabilia and of course everything Ditka! Apparently, Ditka eats there at least once a week when he is in town. Sadly, he was not there the night we were there. As part of the menu for the dinner, we tried: starters (coconut shrimp, calamari), filet mignon, salmon, creme brulee, and key lime pie! Everything was delicious. The service was good. Will definitely be back the next time I'm in Chicago!",0.9483,0.834,0.144,0.022,0.5520833333333334
2017-08-25,5.0,Went with a group of 10 and we all had fabulous food.  It was a bit of a wait for our reservation but they more than made up for it and gave us free nachos and calamari for the long wait.  Both were excellent. Everyone thoroughly enjoyed their meals and then we shared a piece of banana cream and a piece of coconut cream pie and loved them.  Would highly recommend this place for a nice dinner.  Outdoor patio was nice as well.,0.9911,0.633,0.367,0.0,0.7739999999999999
2017-08-25,2.0,"Having dined here in previous years decided to return on a recent business trip to Chicago. Unfortunately Ditka's has been left behind in the quality dining stakes and is a shade of its former glory. Table selection was fine, menus given but no wine list.  Wine selection had to be explained and when it came the red wine was cold. Starters were vastly overpriced, steaks ordered were wrongly cooked and not served with proper accomplishment. Steaks taken back and new ones delivered, which were just ok, far better quality steaks to be had in Chicago and for the price paid, try Gibson's. Ordered a macchiato and got a latte. When the final bill came not even a side order given as gratis for the mistakes made. A simple small gesture that would have warranted one more star maximum. Mike Ditka was a winner in the NFL, a distinguished career with many awards, unfortunately he isn't winning anything in the restaurant game and should hang up his shoulder pads sooner rather than later.",0.742,0.811,0.111,0.077,0.47913419913419913
2017-08-22,5.0,"The best steakhouse in the loop, hands down.  Try the crab bisque and reward yourself with Da Pork Chop.  You won't regret it!",0.8891,0.655,0.345,0.0,0.29444444444444445
2017-08-10,5.0,"Perfect cocktails, delicious oyster appetizers and the steaks were to die for. Lee was a dream of a waiter. Must try!",0.6996,0.525,0.339,0.136,1.0
2017-08-02,5.0,"I love Ditka and the '85 Bears so this was a must visit when we came to Chicago. I expected to be disappointed because I usually am with things I am looking forward to, but this meal was awesome.  We started with some nachos. I'm a Connecticut yankee and love my pot roast, but didn't believe the menu when it said pot roast nachos. There was, in fact, pot roast on a filling but perfectly apportioned plate. The nachos stayed crisp despite a perfect amount of toppings, and the roast made them the best nachos I have ever had.  My wife had sliders for an entree, and really enjoyed them. I had their lowest grade wet-aged paddle steak, which was recommended by the server because I like my meat well done. This was accompanied by mushrooms and some whipped potatoes.  My meal was so good that I would have French-kissed Ditka if he walked in the door, porn-stash and all, and I'm really committed to women (read wife here).  I am finicky about beer, and I also really enjoyed Ditka's own ale. Even though our server was covering the entire bar side of the establishment, every time I thought of needing something someone appeared. I'm lucky this place isn't closer to where I live because I would eat until my innards burst like the gluttony victim in the movie Seven.",0.9944,0.734,0.221,0.046,0.5855263157894738
2017-07-31,3.0,"Just okay. Had higher expectations. We had great service, but food was host okay. Lobster was over cooked, not much flavor. The meatloaf was recommended by two employees, but was fair. Probably won't return.",0.8591,0.716,0.284,0.0,0.5583333333333333
2017-07-29,5.0,"Had an amazing dinner here for my birthday. Ordered the ""Tomahawk"" 30oz steak medium and it was cooked perfectly. The burgundy mushrooms were awesome also, along with our twice baked potato. Can't say enough good things about Ditka's. We loved it.. next time we go to Chicago it will be a guaranteed stop!",0.9285,0.688,0.244,0.069,0.6857142857142857
2017-07-27,4.0,"I've been here several times. It surprises me with how consistent it is. I would say this is best for brunch. Or maybe dinner with out of town guests who want a mainstream Chicago experience. The food is always good. Service is always good. I wouldn't rank this as a top steak place, so get that misconception out of the way. They do have a kobe beef burger and it is probably the best burger I've ever had. Unfortunately, it is rarely on the menu.",0.9413,0.769,0.205,0.026,0.4833333333333334
2017-07-14,5.0,"Seemed like the thing to do for steak and being huge football fans. It is a more casual steak place, with great steak. Service was outstanding. Glad we made a reservation.",0.9516,0.561,0.439,0.0,0.8152777777777778
2017-07-03,5.0,My family and I visited Chicago and went to Ditka's. The food was fantastic and I would definitely recommend. Great atmosphere and the service was superb.,0.9517,0.528,0.472,0.0,0.7875
2017-07-02,5.0,"Ditka's is everything a steak house should be. We had early reservations (6) and arrived a few minutes early and were promptly seated in a small room off the main bar. The wine list was good and two of us split a bottle of Ditka's merlot (very good and reasonably priced) and the third had a margarita, which was good and strong. Two of us had wet aged filet mignons while the third had the Ditka's meatloaf. The steaks were phenomenally tender and seasoned perfectly. My hubby's meatloaf dinner was massive- and delicious but he only ate half. We finished up with creme brûlée which was also served perfectly- creamy, light with just the amount of crust. The service was impeccable- our waiter was friendly and knowledgeable with a good sense of humor. The cost of our meals were within the range I expected; a little less costly than Ruth's Chris and Michael Jordan's, primarily because of portion sizes. Well done!",0.9845,0.807,0.193,0.0,0.5159999999999999
2017-06-29,4.0,"Omg. I often judge according to Martinis...A+ all the way! The serving was huge too! Good thing I wasn't driving. Granted I had a quick & uncomplicated order, I still think the service was excellent...efficient, friendly and just right! The filet sliders were unexpectedly ""melt in your mouth""! Vibe of the place is typical of a higher end pub.",0.8329,0.809,0.161,0.029,0.6294642857142857
2017-06-27,4.0,"Always a GREAT place! Service is always good,... mostly. I like to sit at the bar. Tonight,... i was (unfortunately) able to hear the bar staff critique their co-workers. PLEASE,..... keep your internal concerns out of ear shot of your paying customers",0.8236,0.829,0.171,0.0,0.495
2017-06-19,3.0,Wife and I ate at ditkas last night I had da porkchop she had the 12 ounce prime rib. My chop was tenders n delicious. Her prime rib was on the tough side and she would not recommend it   The mushrooms it came with were very good. The sweet potatoes that came with the chop were also very good.   We shared the banana cream pie. I had high hopes for it but was just average. Our waiter was attentive and our water glass was kept filled. I would go back for da chop but not the prime rib   The place was about half full on Sunday evening. We had reservations but were not necessary,0.836,0.858,0.118,0.024,0.6119047619047621
2017-06-12,4.0,"Casual dress allowed, so we ended up here which was kind of cozy even though it is filled with sports memorabilia and pictures all over the walls. Maybe it was the company or where we sat, away from the bar.  Prime rib was rare enough for me with well salted outer layer.  Asparagus was bland.  It was just steamed and nothing else.  Sautéed with garlic would have been a nice touch.  Martini comes with blue cheese stuffed olives which is always a treat.  They also allow half glass of wine when one glass was not enough and you feel two would be too much.  I need to check out other steak houses nearby for comparison on next trip.",0.8519,0.907,0.093,0.0,0.5708333333333333
2017-06-12,5.0,Best Steakhouse in Chicago and anywhere else for that matter. As a frequent traveler I get to try places in other states and this place clearly knocks it out of the park! Food was so mouth watering and flavorful!,0.8217,0.798,0.202,0.0,0.33958333333333335
2017-06-11,5.0,"I can describe my experience in four words, OUT OF THIS WORLD! Everything truly exceeded my expectations, the service, food, ambiance, server,etc. I would highly recommend the restaurant.",0.7171,0.8,0.2,0.0,0.5399999999999999
2017-06-08,5.0,"A few of my good friends and I decided to take an impromptu day trip to Chicago about a week ago, and one of them insisted we eat at Ditka's. I was a bit skeptical; you don't typically associate a restaurant with a sports-related name with high quality food, but boy is that stereotype not true here. I was incredibly impressed with Ditka's, and I really want to come back. From the moment you step in, you can tell you're in a premium experience. I would recommend dressing at least a little classy. I was fine in a polo and khaki shorts, but I wouldn't suggest rolling in with sweatpants and a t-shirt. The interior is beautiful, with stunning wood themes. We were escorted to our table by the extremely helpful and kind staff.  Our waiter was great, and he joked around with us and made sure we had a great experience. We weren't here for a full steak meal, but I would LOVE to come back and try the steaks. I'd also love to try ""da pork chop"", another apparent favorite here. It sounded/looked amazing. We ordered a few dishes to share. We ordered the wings, the meatloaf, au grautin potatoes, and the pork nachos. Oh man, let's talk about that meatloaf. The meatloaf is deceptively huge in person. For $20, I was expecting a good sized portion, but this thing is massive. We couldn't eat the entire thing. It's arranged in such a cool manner; the bottom layer is a jalapeno cornbread, topped with the meatloaf, and then mashed potatoes. On top lies a bed of onion straws. It was delicious! Cornbread is my weakness, and when I read that it was included, I knew I would love this dish. The meatloaf was tender and seasoned well. The other dishes were great as well, but I mostly stuck to the meatloaf; it was that good. I also had the Pomegranate Rum Punch. This was certainly one of the more interesting drinks I've had. It looked stunning. It isn't something I'd be likely to order again, but that's simply because I discovered I wasn't a huge fan of the pomegranate and alcohol flavors mixed together; not the restaurant's fault. I'd love to try some of their other drinks. Overall, this is somewhere I am so happy I tried. I will definitely return next time I'm in Chicago.",0.9992,0.652,0.306,0.041,0.592543934240363
2017-05-30,3.0,"My husband and I had prime rib and crab cake filets. The meat dishes was amazing but their self proclaimed ""famous"" nachos had hardly anything on them. We got Brussels sprouts for a side, way undercooked. Best advice: eat elsewhere.",0.8481,0.814,0.186,0.0,0.6854166666666666
2017-05-24,5.0,"Came here with my boyfriend to have a nice, tasty dinner. Both of us have been to Ditka's before, so we knew that coming in to eat here would be a great experience.  At first we were seated up upstairs right behind the host stand. This was not a problem for us at all, but we thought that the downstairs looked more relaxing. I asked the hostess if it was possible to move to a table downstairs, and she was very generous and let us. The hosts downstair were just as kind and professional and seated us right away. The table we were sat at was perfect.  To begin, our server, Sam, was amazing. He was funny and knowledgable, and his calm and relaxed behavior made the experience much more enjoyable. We wanted to take our time with our meal and enjoy everything, and he picked up on that immediately and accommodated to it wonderfully.  We started the meal out with the small portion of  Coach's Pork Nachos, which is something we have had before and knew it was a must to order. As always, the pork on the nachos tasted amazing and was so tender.  We then ordered a salad and soup. My boyfriend got the Crab Bisque soup, which he thought was tasty. I ordered Mikes Salad, which is so delicious I always wish I had more of it daily.  Then, we ordered our main dishes. I ordered the Manchego Chicken, and my boyfriend ordered the BBQ Ribs. We also split the loaded baked potato. The Manchego Chicken was delicious. The creamy sauce with the gnocchi, arugula, mushrooms bits, and bacon mixed so well together. The Chicken was crispy and tasted great. The loaded baked potato we ordered on the side is one of the best potatoes I have eaten, and also probably the biggest. My boyfriends BBQ Ribs were so tender looking they came right off the bone. His French fries were fresh and crispy. He also ordered a classic mojito, which he loved. He likes that it doesn't taste weak and that it tastes refreshing. The glass it comes in makes it look all the better. We both enjoyed our meals greatly.  For dessert, we ordered the carrot cake. It's huge!! It came with a small scoop of vanilla ice cream and a mint leaf on top, and a bit of caramel sauce on the side to dip cake pieces in. The cake itself is moist and the cream cheese icing is everything anyone would dream of. We ended up taking home leftovers of the cake and our dinners, which made a pretty great meal the next day.  The service overall was exemplary. Water was always filled, even when slightly low. I never once got to finish my water, which I thought was amazing for them to keep up on, along with all of the other tables. Plates were taken out of the way nearly right away when empty. Crumbs were removed from the table before the main dishes. When you get up to go to the bathroom or anywhere else, your napkin is refolded and placed on the table.  Everything about our experience was amazing, and we will surely be back!",0.9994,0.755,0.238,0.007,0.6044745484400655
2017-05-22,3.0,"This place is ok. The service was very good, but there were some parts of my meal I didn't enjoy. I started with the buffalo wings. They tasted frozen and the sauce didn't have a ton of flavor. I also got the mike's salad which had a ""balsamic vinaigrette"". I put that in quotations because it didn't taste like balsamic. It tasted more of a italian dressing. Some of the mixed greens I didn't like, but the other ingredients in it tasted good. For my main, I got the double cut pork chop with redskin mashed potatoes. The pork chop was very flavorful and tender. The apples that came with it added a great sweetness that went well with the pork. But the best thing were the mashed potatoes. Great texture and well seasoned. I ended with the cherry cobbler which was very good and not too sweet. Ditka's is alright, but be careful with the appetizers and salad. If I were to come back I would try something more popular like the fried calamari.",0.9856,0.69,0.226,0.084,0.47706349206349213
2017-05-22,5.0,"I was in the mood for steak but had to work late and couldn't get away.  I took a chance and ordered from Ditka's (GrubHub).  I was shocked at how well they not only cooked the food, but preserved the integrity and cook of the steak and fries.  The fries remained crispy!  I was amazed.  This is the first time my fries on a delivery order were crispy.  The steak was the perfect medium-rare temperature I requested.  I asked for it to be slightly under mid-rare to accommodate for the additional cooking that happens during rest.  I couldn't be more pleased.  Ditka's took me from skeptic to believer.  I had resigned myself to be happy with whatever showed up...but they blew me away.  I had restaurant quality in my office :)  Thank you!",0.9704,0.724,0.203,0.074,0.74
2017-05-21,5.0,"Our dinner was outstanding last night! We went there for a romantic evening and enjoyed every minute of it! They were super crowded with several large groups there and it was loud and boisterous but everyone was so friendly and our waiter Sam was the best! Colossal shrimp cocktail, steak & crab cakes, and prime rib were delicious! Can't wait for next visit to Chicago & Ditka's Steakhouse!",0.9811,0.685,0.315,0.0,0.5105311355311355
2017-05-19,5.0,We celebrated my daughter's graduation here with a private party room - event planned by Heather Joyce. The food and the service were 5 star and worth every penny. Thank you Ditka's and Heather for creating a memory we will never forget.,0.913,0.686,0.314,0.0,0.4083333333333334
2017-05-18,2.0,Ordered a medium rare steak and when it came out well done got some real pushback from the server. A nice 16 ounce NY Strip murdered... big disappointment. No help to fix. Sad....,0.2732,0.665,0.194,0.141,0.6166666666666667
2017-05-07,4.0,"This is a little fancy place. You think that it will be a sports bar but it's a little more fancier.  If you eat downstairs, then you get the typical fancy dinner. However, go upstairs and you get the sports bar feel with TV with the fancy food. Today, I chose the sports bar feel.  I was told to go upstairs to check it. They sat me at a high top which was your typical high top. It was against the railing for the stairs which also had a ledge to hold your jacket and for your date to hold her purse. It was close to other tables but never felt cramped.  I ordered the Oyster shooters. It tasted fresh with a strong dose of Tabasco. The Tuna Poke ""Nachos"" was also delicious and refreshing. The Sriracha Aioli and Wasabi cream had a nice balance. My date who is anti spicy foods even said it didn't make her mouth burn. The Crab cake was amazing. I make a well known Crab cake considering I was a fine dining chef for many years but I think we both agreed that this place had me beat. It was probably much more un-healthier but still very very delicious.  Now to the only bad part of the food. The Lobster Mac n Cheese. They used Rotini pasta (if I recall correctly) and those ridges would be nice if it had a nice thick sauce. Sadly, the sauce was very thin. It was lacking in flavor and body as well. The lobster tasted dry and old and rubbery.  The wait staff was very attentive and friendly. Everyone had a nice big smile which is rare these days. How often do you visit a place where wait staff actually enjoyed their job? Rarely... I know but it happened here.  Overall, I did enjoy this place and I must return back to eat their steaks. I kept seeing them walk by for the private party and it looked/smelt amazing. But sometimes you just want to eat appetizers and that is what occurred here.",0.9968,0.767,0.204,0.029,0.6310714285714285
2017-04-29,5.0,"You would normally associate a sport's name restaurant with two attributes. High prices and mediocre food. Not here. Not only is the food great, but the restaurant runs like a well oiled machines. The waiters are professional meaning they are not going to school or looking for acting jobs, their profession is waiting on customers and it shows. A mastery of the menu, suggestions that are rock solid.  Do you like table cloths and fine cotton napkins? Bring it.  Do you like a beautiful dining room or a lively bar? Bring it. Do you like expert busboys/men/women? They are THE key to your service experience and these folks are outstanding.  I can't go down the entire menu although I could. Brunch on the weekend is not to be missed. Eggs Benedict-fuhget about it. $12 Bacon, eggs, pancakes, potatoes and coffee. $11 For lunch, have the best burger in the city, the ""Fridge."" Best meat in the city. Could eat it blood rare without a worry, but MR or M does the trick. If you don't love this burger, I'll buy it for you. Fries are great, so are the sweet potato fries, but I like mine with a side of fruit. It's all part of the price. $13 Save room for some banana cream pie. One slice serves three. Served ice cold, bananas that are firm, and real, yes real, whip cream.  The consistency of this place is what I find to be most impressive. You can count on a great experience time after time.  I'm not a big five-star rater. This place is a gem.",0.998,0.711,0.27,0.018,0.5785823754789273
2017-04-29,4.0,"We had a great time at Ditkas! While some may think this is just touristy, it definitely has awesome food! All one of us loved our main dishes and sides. Chilean sea bass was awesome...steaks and filets were great! Mashed sweet potatoes and Au gratin sides were great. Harvest salad was also fantastic. Fun atmosphere! Could spend a long time reading and looking at memorabilia! Recommend!",0.9898,0.583,0.417,0.0,0.6277777777777779
2017-04-28,5.0,"I came across this restaurant while visiting my boyfriend who's in the Navy. They made our reunion a very special experience for us as the host acknowledged our occasion upon arrival. The food was fantastic - cooked to perfection. The wait staff (Rachel) were helpful, kind, and made great suggestions to enhance our meal. I highly recommend this restaurant. 5 Stars!!",0.9749,0.672,0.328,0.0,0.7665714285714286
2017-04-25,4.0,The food & service were great! Only issue was the beer selection. I would like to see a better selection.,0.8687,0.588,0.412,0.0,0.75
2017-04-23,5.0,"Great food great service! I had two of the best Bloody Mary's I have been served. I think the prices were great, I have paid more lower quality food and service. Overall a great experience at this restaurant!",0.9571,0.495,0.403,0.103,0.5875
2017-04-20,5.0,"I can't say enough good things about our experience here! We had a reservation, but it ran over. Immediately upon being seated the manager was there offering us a complimentary appetizer, which truly wasn't necessary. We ordered the nachos, which were delicious. I had a filet, my husband the Del Monaco, both are amazing! Our waiter went above and beyond to make sure we had everything we needed and even just to chat with us a few times. This was, hands down, one of the best restaurant experience we've ever had.",0.9828,0.729,0.255,0.016,0.5616161616161616
2017-04-19,2.0,"So we decided to go to Ditka's for nachos (the best on reviews) after finding out that they didn't make the nachos of our liking, we didn't order it with our intention to have them before our meals.  So we order two dinner and mac and cheese/lobster, well the mac and cheese wasn't that great lets say I had better with much more better flavor.  Also, the meals no big deal but pricey.  I probably won't go again.  The place was a nice place to have a drink by the bar.",0.834,0.82,0.141,0.039,0.5214285714285715
2017-04-19,4.0,"You must order the steak here. Top notch! Our waiter was very helpful and attentive. Fun atmosphere. The menu has lots of nice starters, and desserts, too! We thought the bar tender was on spot with our drink order. This was a very happening place even on the Wednesday night we went there. Next time we go to Chicago we are coming back here again for dinner!",0.8972,0.839,0.161,0.0,0.4
